title,date,keywords,abstract,multilingual_abstract
심층강화학습 기반의 경기순환 주기별 효율적 자산 배분 모델  연구,2023,"['Portfolio Theory', 'Deep Reinforcement Learning', 'Business Cycle', 'Asset Allocation']",,"Purpose: This study presents a research approach that utilizes deep reinforcement learning to construct optimalportfolios based on the business cycle for stocks and other assets. The objective is to develop effectiveinvestment strategies that adapt to the varying returns of assets in accordance with the business cycle.Methods: In this study, a diverse set of time series data, including stocks, is collected and utilized to traina deep reinforcement learning model. The proposed approach optimizes asset allocation based on the businesscycle, particularly by gathering data for different states such as prosperity, recession, depression, and recoveryand constructing portfolios optimized for each phase.Results: Experimental results confirm the effectiveness of the proposed deep reinforcement learning-basedapproach in constructing optimal portfolios tailored to the business cycle. The utility of optimizing portfolioinvestment strategies for each phase of the business cycle is demonstrated.Conclusion: This paper contributes to the construction of optimal portfolios based on the business cycle usinga deep reinforcement learning approach, providing investors with effective investment strategies that simultaneouslyseek stability and profitability. As a result, investors can adopt stable and profitable investment strategiesthat adapt to business cycle volatility."
강화학습 기반의 위성통신 빔호핑 최적화 기법,2023,"['satellite communications', 'beam-hopping', 'reinforcement learning', 'regret minimization']",,"In this paper, we suggest a reinforcement learning algorithm in satellite-aided communication system. Satellite-aided communication are drawing attention because it can increase stability and robustness of wireless communication. To improve the efficiency of satellite-aided communication, beamhopping method is introduced. In beamhopping, satellite beams are divided and operated in time-based system. The actual efficiency of beamhopping can be depend on the hopping pattern. To determine beamhopping pattern, we introduced multiplay Thompson sampling which is a family of reinforcement learning. We mathematically modeled the features of satellite communication and then applied reinforcement learning. By means of simulations, the performances of proposed learning were analyzed in terms of capacity and regret."
강화학습을 이용한 생성형 한글 공감 대화 챗봇 연구,2023,"['우울증', '강화학습', '자연어처리', '언어모델', '공감 대화', 'Depression', 'Reinforcement Learning', 'NLP', 'Language model', 'Empathetic Dialogue']","본 연구는 목적 지향 대화, 생성형 언어 모델, 강화학습을 기반으로 한국어 공감 대화에 특화된 챗봇의 개발을 목적으로 한다. 본 연구는 웰니스 공감 대화 데이터셋과 ChatGPT API를 통해 자체 생성한 데이터셋을 활용하여 언어 모델의 파인튜닝을 진행하였다. 이후 답변 생성과 human feedback을 이용한 Reward 라벨링을 통해 강화학습에 사용할 데이터셋을 생성하였다. 강화학습을 통해 언어 모델의 파라미터 튜닝을 진행하여 챗봇의 성능을 개선하였다. 실험 결과, 강화학습을 통한 언어 모델 파라미터 튜닝은 공감 대화에서 효과적으로 활용될 수 있음을 보여주며, 감정적인 지원이 필요한 사용자에게 공감적인 대화를 제공하는 능력을 갖춘 챗봇의 성능을 향상시킴이 확인되었다.","This study aims to develop a chatbot specialized for Korean empathy conversation based on task-oriented dialogue, generative language model, and reinforcement learning. This study fine-tuned the language model using the wellness dataset and the self-generated dataset through the ChatGPT API. After that, we created a dataset for reinforcement learning using human feedback. The performance of the chatbot was improved by tuning parameter through reinforcement learning. Experiments have shown that tuning language models parameter through reinforcement learning can be effectively used in empathy conversations. It has also been shown that the improvement of the performance of chatbots provides empathetic dialogue to users who need emotional support."
유니티를 이용한 스마트 면진제어 시스템의 강화학습 환경개발,2023,"['Smart Base Isolation System', 'Unity Game Engine', 'Structural Control Algorithm', 'Reinforcement Learning', 'Seismic Response Control']",근래에 강화학습을 이용해서 구조제어시스템의 제어알고리즘을 개발하고자하는 다양한 연구가 수행되고 있다. 강화학습은 주어진 외부 환경과 상호작용을 하는 에이전트가 현재의 상태에서 어떤 행동을 취하는 것이 최적인지 학습한다. 본 연구에서는 최근 여러 공학 분야에 활용되기 시작한 유니티 게임엔진을 활용해서 구조제어시스템의 강화학습 환경을 구성하고 구조제어분야에서 활용 가능성을 검토해보았다. 이를 위해서 본 연구에서는 스마트 면진제어 시스템을 유니티 물리엔진을 이용해서 구성하고 이를 제어하는 알고리즘을 에이전트로 개발하였다. 에이전트의 행동으로는 스마트 면진제어시스템을 제어할 명령전압으로 하였고 면진된 구조물의 응답이 저감되면 높은 보상을 받을 수 있도록 설계하였다. 유니티 환경에서 구성된 진동대에 인공지진하중을 가하여 시뮬레이션을 수행하였다. 개발된 시스템을 검토한 결과 유니티를 이용해서 개발한 환경을 사용하여 스마트 면진제어시스템의 제어알고리즘을 강화학습을 이용해서 개발할 수 있음을 확인할 수 있었다.,"Recently, various research has been conducted to develop a control algorithm for a structural control system using reinforcement learning. Reinforcement learning trains an agent to take an optimal action in its current state by interacting with a given environment. The Unity game engine has recently been used in various engineering fields. In this study, it was used to construct a reinforcement learning environment for a structural control system, and the possibility of its application to structural control was evaluated. To this end, a smart base isolation control system was constructed using the Unity physical engine, and a control algorithm for an agent was developed. The agent provides a command voltage to control a smart base isolation control system. The reward was designed to be increased when the response of the isolated structure was reduced. An artificial earthquake was applied to a shaking table modeled in the Unity environment for simulation. The results show that a control algorithm for a smart base isolation control system can be developed using reinforcement learning based on the Unity environment."
DRL-based intersection traffic efficiency enhancement utilizing 5G-NR-V2I data,2023,['Deep reinforcement learning5G-NR-V2X5G-NR-V2ITraffic light controlTraffic efficiency'],,"Recent research on reinforcement learning (RL) based traffic management shows promising results, yet it is a significant issue due to increasing volume of traffic and lack of real time traffic information. Improvements of RL algorithms and vehicle-to-everything (V2X) communications technologies are creating new prospects to achieve better traffic efficiency. This paper proposes a new method, namely Vehicle-to-Infrastructure based Traffic Signal Control (V2I-TSC), to capture realistic traffic state using vehicle-to-infrastructure (V2I) communications under 5G-NR-V2X paradigm. It uses single agent RL framework to optimize a traffic signal control which is trained and evaluated through Simulation of Urban MObility (SUMO) simulator. The experimental results show that our proposed method enhances traffic efficiency at the intersection compared to the general traffic control method."
목표 기반 시각적 이동 작업을 위한 시각적 맥락정보 임베딩과 교착상태 처리,2023,"['Visual navigation', 'Deep reinforcement learning', 'Visual context', 'Reward shaping', 'Deadlock recovery']",,"In this paper, we propose a novel deep neural network-based agent model, (VCENet), for performing target-driven visual navigation tasks. Most recent agent models for visual navigation try to recognize the real-time task context by using only objects and their relationships detected from RGB input images. However, such object-oriented visual context does not contain detailed information about the background scene, which is important for ground navigation. Moreover, it may result in a misrecognized context due tobecause of errors inof the object and relation detectors. To overcome these problems, the proposed VCENet model represents the real-time task context by using as the appearance and geometric features of the background scene extracted from RGB-D input images well as the object relation features derived through from graph embedding. Many existing models, which learn an action policiesy based upon on reinforcement, learning, do not provide any reward functions to avoid deadlocks ahead during of navigation or any effective deadlock recovery policyy learning mechanisms to escape the deadlocks. To address these problems, the proposed VCENet model provides not only reward functions for deadlock avoidance and recovery, but also a deadlock recovery policy based on imitation learning. Conducting a variety ofvarious experiments in photo-realistic virtual indoor environments provided by the 3D simulator AI2THOR, we made sure ofdemonstrated the superiority of the proposed VCENet model."
동적 저궤도 위성 네트워크에서 실시간 라우팅을 위한 FPGA 기반 컨볼루션층 추론 병렬화 기술,2023,"['LEO satellite network routing', 'deep reinforcement learning', 'FPGA', 'parallelization', '.']",,"This paper addresses the real-time routing problem in Low Earth Orbit (LEO) satellite networks. Existing routing algorithms have been found to struggle to adapt effectively to dynamic satellite network environments. As such, this study proposes a reinforcement learning-based routing approach and implements it using a dueling deep Q-network model. However, the inference process on satellites faces challenges in meeting real-time requirements due to limited computational capabilities. To resolve this, we propose an approach that accelerates inference speed by parallelizing the convolutional layer's inference process. Experimental results show that our proposed method has reduced the computation time of the convolutional layer by 90.2% and the total algorithm execution time by 29.0% compared to the existing methods."
DDQN을 활용한 강화학습 기반의 다기능 레이더 임무 스케줄링 방법,2023,"['Multi-Function Radar', 'Radar Resource Management', 'Reinforcement Learning', 'Double Deep Q Network', 'Task Scheduling']","다기능 레이더(MFR, Multi-Function Radar)의 발전으로 한정된 자원을 가진 환경에서 효율적으로 레이더의 성능을 향상시키기 위한 레이더 자원관리 방법은 지속적으로 연구되는 분야이다. 레이더 임무 스케줄링은 자원관리 방법 중 핵심적인 요소로서 이를 해결하기 위한 다양한 알고리즘이 연구되고 있다. 하지만 기존 알고리즘은 성능 최적화의 어려움 혹은 다양한 환경 반영의 어려움 등 한계점을 가지고 있다. 본 연구에서는 다양한 파라미터를 가진 레이더 임무환경을 정의하고, 레이더 임무 스케줄링 문제를 해결하기 위해 심층 강화학습인 DDQN(Double Deep Q-Network)을 활용한 스케줄링 모델을 구현하였다. 스케줄링 임무의 수를 다르게 하여 전체 타임라인 대비 저부하 상황에서부터 과부하 상황까지 다양한 시나리오에 대한 시뮬레이션을 진행하였다. 시뮬레이션 결과 본 연구에서 제안한 DDQN 기반 스케줄링 기법은 모든 시나리오에서 휴리스틱기반의 스케줄링 기법보다 더 낮은 임무 드랍 수와 비용를 보여주며 스케줄링 최적화 측면에서 우수한 성능을 보여주었다. 또한 학습과정에서 보상값이 빠르게 수렴되어 기존 DQN(Deep Q-Network) 모델보다 레이더 임무 스케줄링 문제에서 안정적인 학습이 가능함을 보여주었다. 본 연구를 통해 다양한 레이더 환경에서 우수한 스케줄링 성능을 가지는 심층 강화학습 기반 스케줄링 기법의 적용 가능성을 확인하였다.","With the advances in multi-function radar, radar resource management to enhance radar performance efficiently in an environment with limited resources is an active area. Radar task scheduling is a key factor in radar resource management, and various algorithms have been studied to solve it. On the other hand, existing algorithms have limitations, such as difficulty in optimizing the performance or reflecting various environments. In this study, a radar task environment with various parameters is defined. A scheduler model utilizing a deep reinforcement learning-based agent called Double Deep Q-Network (DDQN) is proposed to solve the scheduling problem. Numerical simulations are constructed to evaluate the proposed scenarios ranging from underloaded to overloaded situations by varying the number of scheduling tasks. The simulations showed that the DDQN-based scheduling method proposed in this study provides a lower dropped ratio and cost compared to heuristic-based scheduling methods in all scenarios, demonstrating superior performance in terms of scheduling optimization. Furthermore, the convergence rate of the DDQN model during training is faster than the Deep Q-Network (DQN) model, suggesting that stable learning is possible in radar task scheduling problems. In this study, it is expected that deep reinforcement learning-based scheduling methods with superior performance can be applied in various radar operating environments."
다중 로봇 제조 물류 작업을 위한 안전성과 효율성 학습,2023,"['Smart Factory', 'Multi-Robot Logistics', 'Logic Rule Learning', 'Relational Reinforcement Learning', 'Domain Knowledge']",,"With the recent increase of multiple robots cooperating in smart manufacturing logistics environments, it has become very important how to predict the safety and efficiency of the individual tasks and dynamically assign them to the best one of available robots. In this paper, we propose a novel task policy learner based on deep relational reinforcement learning for predicting the safety and efficiency of tasks in a multi-robot manufacturing logistics environment. To reduce learning complexity, the proposed system divides the entire safety/efficiency prediction process into two distinct steps: the policy parameter estimation and the rule-based policy inference. It also makes full use of domain-specific knowledge for policy rule learning. Through experiments conducted with virtual dynamic manufacturing logistics environments using NVIDIA’s Isaac simulator, we show the effectiveness and superiority of the proposed system."
철근콘크리트 손상 특성 추출을 위한 최적 컨볼루션 신경망 백본 연구,2023,"['철근콘크리트 손상 이미지', '무인항공기', '특성 추출', '컨볼루션 신경망', '모바일', 'Reinforced concrete damage image', 'Unmanned aerial vehicle', 'Feature extraction', 'Convolution neural network', 'MobileNets']","철근콘크리트 손상 감지를 위한 무인항공기와 딥러닝 연계에 대한 연구가 활발히 진행 중이다. 컨볼루션 신경망은 객체 분류, 검출, 분할 모델의 백본으로 모델 성능에 높은 영향을 준다. 사전학습 컨볼루션 신경망인 모바일넷은 적은 연산량으로 충분한 정확도가 확보 될 수 있어 무인항공기 기반 실시간 손상 감지 백본으로 효율적이다. 바닐라 컨볼루션 신경망과 모바일넷을 분석 한 결과 모바일넷이 바닐라 컨볼루션 신경망의 15.9~22.9% 수준의 낮은 연산량으로도 6.0~9.0% 높은 검증 정확도를 가지는 것으로 평가 되었다. 모바일넷V2, 모바일넷V3Large, 모바일넷 V3Small은 거의 동일한 최대 검증 정확도를 가지는 것으로 나타났으며 모바일넷의 철근콘트리트 손상 이미지 특성 추출 최적 조건은 옵티마이 저 RMSprop, 드롭아웃 미적용, 평균풀링인 것으로 분석되었다. 본 연구에서 도출된 모바일넷V2 기반 7가지 손상 감지 최대 검증 정확도 75.49%는 이미지 축적과 지속적 학습으로 향상 될 수 있다.","'Research on the integration of unmanned aerial vehicles and deep learning for reinforced concrete damage detection is actively underway. Convolutional neural networks have a high impact on the performance of image classification, detection, and segmentation as backbones. The MobileNet, a pre-trained convolutional neural network, is efficient as a backbone for an unmanned aerial vehicle-based damage detection model because it can achieve sufficient accuracy with low computational complexity. Analyzing vanilla convolutional neural networks and MobileNet under various conditions, MobileNet was evaluated to have a verification accuracy 6.0~9.0% higher than vanilla convolutional neural networks with 15.9~22.9% lower computational complexity. MobileNetV2, MobileNetV3Large and MobileNetV3Small showed almost identical maximum verification accuracy, and the optimal conditions for MobileNet's reinforced concrete damage image feature extraction were analyzed to be the optimizer RMSprop, no dropout, and average pooling. The maximum validation accuracy of 75.49% for 7 types of damage detection based on MobilenetV2 derived in this study can be improved by image accumulation and continuous learning."
Preservice Teachers' Beliefs about Integrating Artificial Intelligence in Mathematics Education: A Scale Development Study,2023,"['artificial intelligence', 'teacher beliefs', 'preservice teachers', 'scale development']",,"Recently, AI has become a crucial tool in mathematics education due to advances in machine learning and deep learning. Considering the importance of AI, examining teachers’ beliefs about AI in mathematics education (AIME) is crucial, as these beliefs affect their instruction and student learning experiences. The present study developed a scale to measure preservice teachers’ (PST) beliefs about AIME through factor analysis and rigorous reliability and validity analyses. The study analyzed 202 PST’s data and developed a scale comprising three factors and 11 items. The first factor gauges PSTs' beliefs regarding their roles in using AI for mathematics education (4 items), the second factor assesses PSTs' beliefs about using AI for mathematics teaching (3 items), and the third factor explores PSTs' beliefs about AI for mathematics learning (4 items). Moreover, the outcomes of confirmatory factor analysis affirm that the three-factor model outperforms other models (a one-factor or a two-factor model). These findings are in line with previous scales examining mathematics teacher beliefs, reinforcing the notion that such beliefs are multifaceted and developed through diverse experiences. Descriptive analysis reveals that overall PSTs exhibit positive beliefs about AIME. However, they show relatively lower levels of beliefs about their roles in using AI for mathematics education. Practical and theoretical implications are discussed."
우울증 진단 및 치료를 위한 챗봇 연구 동향 분석,2023,"['우울증 진단', '우울증 치료', '챗봇', '멀티턴', '강화학습', 'Depression Detection', 'Depression Treatment', 'Chatbot', 'Multi-turn', 'Reinforcement Learning']","대한민국은 우울증과 같은 정신적인 질환의 발병률이 OECD 국가 중 최고 수준이다. 신체적인 질환과 같이 정신적인 질환 역시 초기에 발병 유무를 파악하고, 증세가 더 심해지지 않도록 치료하는 것이 중요하다. 하지만 이와 반대로 아직 대한민국 내에서 정신적인 질환에 대한 인식은 다소 부정적인 편이다. 따라서, 시설에 방문하지 않더라도, 언제 어디에서든지 전자기기로 정신질환의 초기 증상을 진단하고 이를 치료할 수 있도록 하는 시스템을 구축하는 것이 중요하다. 따라서 본 연구에서는 정신질환 중 특히 우울증과 관련하여 현재 우울증 진단 기준 및 우울증 관련 챗봇에 대한 동향 분석을 진행하였다. 추가로 초기 우울증을 앓거나 우울증 진단 기준에서 기준선 근처에 위치하는 한국인을 위해, 우울증 진단 및 치료를 위한 챗봇 구조를 멀티턴 대화 데이터셋과 강화학습을 기반으로 하여 제안한다.","South Korea has the highest incidence of mental diseases such as depression among OECD countries. It is important to identify the presence of mental diseases in the early stages, and to treat them so that the symptoms do not get worse, such as physical diseases. However, on the contrary the perception of mental illness in Korea is still somewhat negative. Therefore, it is important to establish a system that allows people to diagnose and treat initial symptoms of mental illness with electronic devices anytime, anywhere, even if they do not visit any facility. Therefore, in this study, the current criteria for diagnosis of depression and trends in chatbots related to depression were analyzed in relation to mental illness, especially depression. Additionally, a chatbot structure for diagnosis and treatment of depression for Koreans suffering from early depression of locating near the baseline in the diagnostic criteria for depression is proposed based on multi-turn conversation dataset and reinforcement learning."
신화를 활용한 한국문화 교육 방안 -<삼성신화를 중심으로>-,2023,"['한국 언어문화 교육', '한국어 교재', '삼성신화', '다층적 피드백 강화 모형', '활동 중심 학습', 'Korean Language Culture Education', 'Korean Textbook', 'Samseong-shinhwa', 'Multi-layered Feedback Reinforcement Model', 'Activity-Based Learning']",,"This study aims to enhance the value of Korean cultural education for general purposed Korean learners through the Jeju <Samseong-shinhwa>. We analyzed the aspects of classical literature in Korean textbooks and selected the <Samseong-shinhwa> through various mythological works. which is not included in the textbooks, and then reconstructed the contents and proposed a plan for Korean cultural education. Learners can learn a variety of vocabulary related to marriage and have a broad understanding of Korean marriage culture. We divided the activity-based learning area of 'content understanding, goal-oriented, and applied learning', and gave learners group activity time and allowed them to compare marriage cultures between Korean and their own country, thereby proposed that Korean cultural education is effectively carried out. In this process, learners can actively participate in the class through group-type jigsaw activities, and through the 'multi-layered feedback reinforcement model', they can receive feedback on multiple layers, thereby accurately understanding the educational content, and correcting errors to strengthen knowledge."
