title,date,keywords,abstract,multilingual_abstract
다중 에이전트 강화학습을 이용한 RC보 최적설계 기술개발,2023,"['Multi-Agent reinforcement learning', 'Deep Q-Network', 'Optimal structural design', 'Reinforced concrete beam']",,"Reinforcement learning (RL) is widely applied to various engineering fields. Especially, RL has shown successful performance for control problems, such as vehicles, robotics, and active structural control system. However, little research on application of RL to optimal structural design has conducted to date. In this study, the possibility of application of RL to structural design of reinforced concrete (RC) beam was investigated. The example of RC beam structural design problem introduced in previous study was used for comparative study. Deep q-network (DQN) is a famous RL algorithm presenting good performance in the discrete action space and thus it was used in this study. The action of DQN agent is required to represent design variables of RC beam. However, the number of design variables of RC beam is too many to represent by the action of conventional DQN. To solve this problem, multi-agent DQN was used in this study. For more effective reinforcement learning process, DDQN (Double Q-Learning) that is an advanced version of a conventional DQN was employed. The multi-agent of DDQN was trained for optimal structural design of RC beam to satisfy American Concrete Institute (318) without any hand-labeled dataset. Five agents of DDQN provides actions for beam with, beam depth, main rebar size, number of main rebar, and shear stirrup size, respectively. Five agents of DDQN were trained for 10,000 episodes and the performance of the multi-agent of DDQN was evaluated with 100 test design cases. This study shows that the multi-agent DDQN algorithm can provide successfully structural design results of RC beam."
버퍼 활용 무작위 빈 패킹 문제를 위한 강화학습-휴리스틱 결합 모델,2023,"['버퍼 활용 빈 패킹', '강화학습', '휴리스틱', '가치 측정', '불확실성 제어', 'Buffer-utilized bin packing', 'Reinforcement learning', 'Heuristics', 'Value estimation', 'Uncertainty handling']",,"In this paper, we propose a reinforcement learning algorithm combined with heuristics to solve the bin packing problem (BPP) where the objects are randomly given and once placed objects cannot be moved, but the small load buffer can be utilized. This setting resembles the loading problem which has not been resolved despite of logistics automation. Since heuristics can be rapidly optimized by human intuition, and reinforcement learning is highly responsive to the environment, the combined method is highly available in the real-world industries. When the model learned through reinforcement learning determines the optimal object among the new object and objects in the buffer, then defined heuristics find optimal position and orientation for placement of the selected object. Through experiments, we verified the effectiveness by comparing the loading efficiency between the heuristic-only system and the combined system presented in this study."
강화학습 기반 HVAC 제어 및 시뮬레이션 기법,2023,"['Reinforcement learning', 'Machine learning', 'HVAC', 'Air conditioner', 'DQN']",,"HVAC(Heating, Ventilation, and Air Conditioning: 공기조화기기) 시스템은 전력 소모가 크기에, 최소의 전력으로 지정된 실내온도를 유지하도록 운전하는 것이 중요한 문제이다. 최근 HVAC 전력 최소화 문제에 대한 기계학습 기법들의 응용 시도가 증가하고 있으나 기계학습 기반 전력 HVAC 운전 기법의 개발을 위해 사용할 수 있는 시뮬레이션 환경은 매우 찾기가 어려운 실정이다. 본 논문에서는 MATLAB/Simulink 기반의 시뮬레이션 환경을 소개 및 공개하고 이를 바탕으로 개발된 강화학습 기반의 에어컨 자동 운전 알고리즘의 성능을 평가한다. 시뮬레이션 및 학습 관련 코드는 (https://github.com/intplatlab/hvac_sim.git)에서 다운로드 받을 수 있다."
멀티 에이전트 강화학습에서의 게이트 기반 메시지 교환,2023,"['multi-agent reinforcement learning', 'communication', 'representation learning']",,"An environment is a complex space in which numerous agents and objects interact. In this environment, rational agents act to maximize utility, and their actions are learned through reinforcement learning algorithms using deep neural networks. Since most environments are non-stationary, a single agent cannot solely achieve maximum utility through its observations and inferences using a network. However, when multiple agents can communicate with each other, a single agent can access richer information about the state of the environment simply by receiving messages from other agents. Nonetheless, the inferred information from other agents is generated by a neural network, which can be vulnerable or incorporate the personal perspective of the agents processing the information. For example, even when presented with a single observation, two agents can encode significantly different messages due to variations in their parameter modules. Therefore, it is crucial to consider the subjectivity of messages in multi-agent reinforcement learning (MARL). Building on the assumption that the encoded information is inherently subjective and reflects the agent that encodes it, we address the challenge of objective and subjective information in MARL. One limitation is that the information processed by a neural network is often challenging to interpret. In the initial phases of addressing this subjectivity concern, we focus on a relatively minor challenge: determining whether subjective information surpasses objective information in utility. Consequently, we compare the usefulness of messages exchanged between agents in two forms: raw observation and the output of a neural network."
3D-Pinball 게임 기반 강화학습 알고리즘 및 모델 성능 분석,2023,"['강화학습', '인공지능', '딥러닝', '게임', '전처리', 'Reinforcement Learning', 'Artificial Intelligence', 'Deep Learning', '3D-Pinball', 'Preprocessing']",,"Game research applying reinforcement learning has demonstrated that AI can outperform humans. In this study, we extend this approach to '3D-Pinball', a game similar to 'Video Pinball' but with greater complexity. Three reinforcement learning algorithms - DQN, Double DQN, and Dueling Double DQN - are applied to both CNN-based models using visual data and MLP-based models extracting appropriate features from high-dimensional data. These are then evaluated in '3D-Pinball'. Restrictions on gameplay time and lives were implemented for efficient experimentation. Results showed that the Dueling Double DQN algorithm applied to the MLP-based model yielded the highest performance increase and game scores, underscoring the superior performance of simpler models in restricted environments. Consequently, it appears that model development considering constraints is required for superior performance in learning and game environments."
향상된 유닛 생산과 게임 플레이 경험을 위한 스타크래프트 II 강화학습 AI,2023,"['Game artificial intelligence', 'Reinforcement learning', 'StarCraft II', 'Flexible strategy']",,"The built-in AI in StarCraft II follows a predefined pattern of behavior patterns. This makes it easy for users to understand the AI's strategy without spending a lot of time, posing a challenge in maintaining user interest. To solve this problem, reinforcement learning AI has been developed for StarCraft II. But since theses studies focus on the win rate to train the agent, it provides monotonous strategies and misses the fun of the game. In this paper, we propose a player-like AI to improve the fun of the game by producing various units and adaptive strategies. To achieve this, we use reinforcement learning to train the agent the official counter list of StarCraft II and reward it based on the information of the opponent's scouting to make the agent change its strategy flexibly. The training is based on the ""Zerg"" race on the Simple64 map, and the opponent is the ""Protoss"" race. Based on the trained data, we evaluated the diversity of unit production, strategic unit production, etc. In addition, we had users play with the AI of existing work and the proposed AI, respectively. We then evaluated the fun and difficulty of the AI and its similarity to the player using a questionnaire. As a result, users rated the proposed AI higher than the fixed-strategy AI fin terms of fun, difficulty, and similarity."
딥러닝과 강화학습의 연구 동향 분석,2023,"['KeyBERT', 'topic extraction', 'trend analysis', 'deep learning', 'natural language processing', 'KeyBERT', '토픽 추출', '동향 분석', '딥러닝', '자연어 처리']",,"In this paper, we apply KeyBERT(Keyword extraction with Bidirectional Encoder Representations of Transformers) algorithm-driven topic extraction and topic frequency analysis to deep learning and reinforcement learning research to discover the rapidly changing trends in them. First, we crawled abstracts of research papers on deep learning and reinforcement learning, and temporally divided them into two groups.After pre-processing the crawled data, we extracted topics using KeyBERT algorithm, and then analyzed the extracted topics in terms of topic occurrence frequency. This analysis reveals that there are distinct trends in research work of all analyzed algorithms and applications, and we can clearly tell which topics are gaining more interest. The analysis also proves the effectiveness of the utilized topic extraction and topic frequency analysis in research trend analysis, and this trend analysis scheme is expected to be used for research trend analysis in other research fields. In addition, the analysis can provide insight into how deep learning will evolve in the near future, and provide guidance for select research topics and methodologies by informing researchers of research topics and methodologies which are recently attracting attention."
멀티 에이전트 강화학습을 활용한 유무인 협업 임무 수행 연구,2023,"['MUM-T', 'MA-POCA', 'Unity ML-Agents', '유무인 복합 운용 체계', 'MA-POCA', 'Unity ML-Agents']",무인기가 수행 가능한 임무의 범위가 확대되어 유무인 복합운용 MUM-T (Manned Unmanned Teaming)라는 개념이 대두되었다. 유무인 복합운용은 유인기가 다수 무인기의 운용 및 통제를 담당하기 때문에 조종사의 임무 부하도 감소를 위한 다수 무인기 자동 경로 생성 기법 연구가 필수적이다. 본 논문은 다수 무인기 자동 경로 생성 기법으로 멀티 에이전트 강화 학습 기법 적용을 제안한다. 멀티 에이전트 강화학습 기법은 기존의 싱글에이전트 강화학습 기법과 비교하여 유무인 복합운용 환경과 같이 공동의 목표를 가지는 다수의 에이전트가 존재하는 환경에 적용하기 유리하다. 따라서 본 논문은 Unity ML-Agents에서 제공하는 MA-POCA 알고리즘을 활용하여 유무인 복합운용 임무를 수행연구를 진행하였으며 시뮬레이션을 통해 임무 성공확률을 분석하였다.,"The scope of missions that drones can perform has expanded, and the concept of MUM-T(Manned Unmanned Teaning) has emerged. Since the manned aircraft is responsible for the operation and control of many drones, it I essential to study the automatic path generation technique for multiple drones to reduce the pilot’s mission load. This paper proposes the application of multi-agent reinforcement learning techniques as multiple drone automatic path generation techniques. Compared to single agent reinforcement learning, multi-agent reinforcement learning is advantageous to apply to environments where multiple agents with common goals, such as MUM-T environments. So in this paper, we conducted a study on the performance of a complex operation mission with a MA-POCA algorithm provided by Unity ML-Agent, and analyzed the probability of mission success through simulation."
심층강화학습 기반 자율주행차량의 차로변경 방법론,2023,"['Autonomous driving', 'Path planning', 'Lane-Change', 'Deep Q-Learning', '자율주행', '경로계획', '차로변경', 'Deep Q-Learning']","현재 국내에서는 자율주행차량의 상용화를 목표로 다양한 노력을 기울이고 있으며 자율주행차량이 운영 가이드라인에 따라 안전하고 신속하게 주행할 수 있는 연구들이 대두되고 있다. 본 연구는 자율주행차량의 경로탐색을 미시적인 관점으로 바라보며 Deep Q-Learning을 통해 자율주행차량의 차로변경을 학습시켜 효율성을 입증하고자 한다. 이를 위해 SUMO를 사용하였으며, 시나리오는 출발지에서 랜덤 차로로 출발하여 목적지의 3차로까지 차로변경을 통해우회전하는 것으로 설정하였다. 연구 결과 시뮬레이션 기반의 차로변경과 Deep Q-Learning을적용한 시뮬레이션 기반의 차로변경으로 구분하여 분석하였다. 평균 통행 속도는 Deep Q-Learning을 적용한 시뮬레이션의 경우가 적용하지 않은 경우에 비해 약 40% 향상되었으며평균 대기 시간은 약 2초, 평균 대기 행렬 길이는 약 2.3대 감소하였다.","Several efforts in Korea are currently underway with the goal of commercializing autonomous vehicles. Hence, various studies are emerging on autonomous vehicles that drive safely and quickly according to operating guidelines. The current study examines the path search of an autonomous vehicle from a microscopic viewpoint and tries to prove the efficiency required by learning the lane change of an autonomous vehicle through Deep Q-Learning. A SUMO was used to achieve this purpose. The scenario was set to start with a random lane at the starting point and make a right turn through a lane change to the third lane at the destination. As a result of the study, the analysis was divided into simulation-based lane change and simulation-based lane change applied with Deep Q-Learning. The average traffic speed was improved by about 40% in the case of simulation with Deep Q-Learning applied, compared to the case without application, and the average waiting time was reduced by about 2 seconds and the average queue length by about 2.3 vehicles."
강화학습 기반 차량 냉방 제어 알고리즘 개발,2023,"['Reinforcement learning', 'Energy efficiency', 'Air-conditioner', 'Optimal  control', 'Electric vehicle', '강화학습', '에너지 효율', '에어컨', '최적제어', '전기자동차']",,"To increase an electric vehicle’s mileage, the energy efficiency of vehicles grows in importance every day. To this end, this study proposes an automotive air conditioner control system based on DQN(Deep Q-Learning), a reinforcement learning algorithm. This control system aims to reduce energy consumption with equivalent temperature error by controlling the compressor RPM and blower output. Also, the control system must improve its performance if there is a change in vehicle velocity profile. For this purpose, the state signals are designed to include thermal information and driving velocity, and the reward function is designed to reduce temperature error and power consumption and to suppress the undesirable behavior of the compressor. Training results show an improvement in energy efficiency when simulating with trained driving velocity profiles and other driving velocity profiles compared to the target A/C system."
강화 학습 모델의 안전성 평가 방법: 자율 주행 사례 연구,2023,"['reinforcement learning', 'safety', 'hazard analysis', 'behavior driven development', '.']",,"Reinforcement Learning(RL) finds application in diverse fields such as healthcare and autonomous driving. However, due to its inherent complexity in agent decision-making and the inability to measure outcomes with the same precision as in supervised learning, there is a pressing need for research into assessing the safety of RL systems. Therefore, this paper introduces a method for evaluating the safety of RL models by combining behavior-driven development techniques with risk analysis. When applied to a driving simulation environment, the proposed approach reveals variations in the frequency of safety constraint violations among RL models, even when their average rewards are similar. The outcomes of safety assessment are anticipated to contribute to the improvement of model safety through thorough analysis and iterative enhancements across various aspects."
인간-AGV 충돌 위험을 고려한 강화학습 기반의 출하대기장 내 AGV 운영 최적화,2023,"['Reinforcement learning', 'Automated Guided Vehicle', 'Dispatch area', 'Human-AGV Collision']",,"Automated guided vehicles (AGV) are a crucial component to achieve automation in logistics. AGVs can autonomously transport heavy pallets with the pre-designed rules, hence reducing the need for human resources in the logistics area. However, since AGVs cannot completely replace human workers doing maintenance tasks, inspections, etc., AGVs sometimes share operating areas with human workers. As such an example, we optimize the operation of an AGV in the dispatch area which has a human operator for final inspections. While most previous studies focus on efficient operation of AGVs, this study considers the possibility of human-AGV collisions as well as efficient operation. We also propose a PPO-R algorithm to prevent conservative behaviors of AGV when introducing a collision penalty. Numerical experiments show that PPO-R can maintain throughput while reducing the number of potential collisions."
충전소에서의 대기시간을 고려한 전기차량의 경로 최적화 문제에서 강화학습 기법의 적용 방안 연구,2023,"['Electric Vehicle', 'VRP', 'Charging Station', 'Markov Decision Process', 'Reinforcement Learning']",,"There are several technical obstacles to Electric Vehicles (EVs) adoption such as limited battery capacity, long charging time and low accessibility to EV charging stations. We extend the conventional EVRP (Electric Vehicle Routing Problem) by including charging station visits in the routing decisions. Unlike the literature, the proposed model particularly decides which charging station to visit based on the information of charging station complexity, which is specified by arrival and service rates at each charging stations. We formulated the routing optimization problem as an MDP (Markov Decision Problem) model and used a deep reinforcement learning approach (i.e., DQN; Deep Q-Network) to optimize the route including charging station visits. Numerical analysis shows that the proposed model outperforms two other benchmarks such as nearest station choice and random choice in terms of the total travel time. Moreover, we show that the charging station complexity and the resulting waiting time have significant impact on the performance."
분포 강화학습을 위한 위험도 스케줄링 기반의 낙천적 탐색 방법,2023,"['distributional reinforcement learning', 'multi-agent system', 'exploration', 'risk-scheduling', '분포 강화학습', '다중 에이전트 시스템', '탐색', '위험도 스케줄링']","분포 강화학습은 행동 공간을 탐색하는데 사용될 수 있는 분산과 위험도(risk)의 특징을 통해 연속 및 이산 제어에서 괄목할 성능을 보이고 있다. 하지만, 위험도의 성질을 활용해서 탐색하는 방법은 분산을 활용한 탐색 방법에 대한 연구에 비해 발전되지 못했다. 이와 같은 한계를 극복하기 위해 이 논문에서는 분포 강화학습의 특징인 위험도를 활용하여 위험도 스케줄링(risk-scheduling) 방법을 제안한다. 위험도 스케줄링 방법은 학습하는 에이전트가 다양한 위험도를 경험하게 하고, 낙천적인 (optimistic) 행동을 선택하도록 도움으로써 성능을 개선시킬 수 있다. 다중 에이전트 시스템에서의 분포 강화학습 알고리즘인 DMIX, DDN, DIQL에 위험도 스케줄링을 적용했을 때 성능이 크게 향상되는 것을 확인하였다.",
강화학습을 이용한 초정밀 가공기용 챔버의 온도 제어,2023,"['Temperature control', 'Reinforcement learning', 'Artificial intelligence', 'Ultra-precision machines', 'Chamber', 'DQN algorithm', '온도 제어', '강화학습', '인공 지능', '초정밀 가공기', '챔버', 'DQN 알고리즘']",,"Deep reinforcement learning (RL) has attracted research interest in the manufacturing area in recent years, but real implemented applications are rarely found. This is because agents have to explore the given environments many times until they learn how to maximize the rewards for actions, which they provide to the environments. While training, random actions or exploration from agents may be disastrous in many real-world applications, and thus, people usually use computer generated simulation environments to train agents. In this paper, we present a RL experiment applied to temperature control of a chamber for ultra-precision machines. The RL agent was built in Python and PyTorch framework using a Deep Q-Network (DQN) algorithm and its action commands were sent to National Instruments (NI) hardware, which ran C codes with a sampling rate of 1 Hz. For communication between the agent and the NI data acquisition unit, a data pipeline was constructed from the subprocess module and Popen class. The agent was forced to learn temperature control while reducing the energy consumption through a reward function, which considers both temperature bounds and energy savings. Effectiveness of the RL approach to a multi-objective temperature control problem was demonstrated in this research."
자율적인 UAM 시스템의 효율적인 무인 정보수집 및 감시를 위한 멀티 에이전트 기반 심층 강화학습,2023,"['Deep Reinforcement Learning', 'Multi-Agent', 'UAM', 'CCTV', 'CommNet', '심층 강화학습', '멀티 에이전트', 'UAM', 'CCTV']","멀티 에이전트 심층 강화학습은 여러 에이전트 간의 통신을 통해 에이전트들이 협력적으로 공동의 목표를 달성하는 기계학습이다. 이러한 심층 강화학습 기술을 통해서, 도심 환경에서 교통정보 수집 및 보안을 위해 필수적인CCTV의 감시 역할을 여러 개의 도심 항공 모빌리티 (UAM, Urban Air Mobility)가 대체할 수 있다. 기존의CCTV는 고정된 위치에서 한정적인 시각 정보를 제공할 수 있지만, UAM을 통한 자율적인 CCTV 시스템을 구축하면 실시간으로 추적할 대상의 위치에 따라 유연하고 신뢰성 있는 시각 정보를 제공할 수 있다. 따라서, 본 논문은 에이전트 간 통신 임무를 수행하는 CommNet 알고리즘을 통해 여러 UAM들이 효율적으로 정보수집 및 감시가 가능한 시스템을 구축하는 기법을 제안한다.",
심층 강화학습 기반의 대학 전공과목 추천 시스템,2023,"['Deep Reinforcement Learning', 'Deep Q-Network', 'Dueling Deep Q-Network', 'Markov Decision Process', 'Recommendation System']",,"Existing simple statistics-based recommendation systems rely solely on students' course enrollment history data, making it difficult to identify classes that match students' preferences. To address this issue, this study proposes a personalized major subject recommendation system based on deep reinforcement learning (DRL). This system gauges the similarity between students based on structured data, such as the student's department, grade level, and course history. Based on this information, it recommends the most suitable major subjects by comprehensively considering information about each available major subject and evaluations of the student's courses. We confirmed that this DRL-based recommendation system provides useful insights for university students while selecting their major subjects, and our simulation results indicate that it outperforms conventional statistics-based recommendation systems by approximately 20%. In light of these results, we propose a new system that offers personalized subject recommendations by incorporating students' course evaluations. This system is expected to assist students significantly in finding major subjects that align with their preferences and academic goals"
심층 강화학습 기반 적응적 SAR 이미지 필터링 알고리즘 설계,2023,"['Low Earth Orbit (LEO)', 'Synthetic Aperture Radar (SAR)', 'Speckle Image Filtering', 'Deep Reinforcement Learning (DRL)', 'Buffer State']",,"Low Earth orbit (LEO) satellite synthetic aperture radar (SAR) is an efficient technology for Earth observation, and a lot of research is in progress.However, due to the time-limited property of LEO satellites, research on time-efficient SAR image processing is essential. In this paper, we propose an adaptive speckle noise filtering algorithm based on deep reinforcement learning for efficient processing of LEO SAR images. The proposed algorithm adaptively selects the filter size according to the buffer state to derive the maximum image resolution in a limited time. As a result of the simulation, the proposed algorithm selects the filter size more efficiently according to the buffer state than the method of conventional algorithm."
