title,date,keywords,abstract,multilingual_abstract
ChatGPT을 활용한 디지털회로 설계 능력에 대한 비교 분석,2023,"['ChatGPT(Generative Pre-trained Transformer)', 'RLHF(Reinforcement Learning from Human           Feedback)', 'Verilog HDL(Hardware Description Languge)', 'Synthesis', 'FSM(Finite State Machine)', '챗GPT', '인간 피드백형 강화 학습', '베릴로그 HDL', '합성', '유한상태머신']",,"Recently, a variety of AI-based platform services are available, and one of them is ChatGPT that processes a large quantity of data in the natural language and generates an answer after self-learning. ChatGPT can perform various tasks including software programming in the IT sector. Particularly, it may help generate a simple program and correct errors using C Language, which is a major programming language. Accordingly, it is expected that ChatGPT is capable of effectively using Verilog HDL, which is a hardware language created in C Language. Verilog HDL synthesis, however, is to generate imperative sentences in a logical circuit form and thus it needs to be verified whether the products are executed properly. In this paper, we aim to select small-scale logical circuits for ease of experimentation and to verify the results of circuits generated by ChatGPT and human-designed circuits. As to experimental environments, Xilinx ISE 14.7 was used for module modeling, and the xc3s1000 FPGA chip was used for module embodiment. Comparative analysis was performed on the use area and processing time of FPGA to compare the performance of ChatGPT products and Verilog HDL products."
다중 스펙트럼 채널 접근을 위한 강화학습 알고리즘 연구,2023,"['강화학습', '다중 스펙트럼 채널 접근', 'Reinforcement Learning', '802.11ax', 'Multi-Spectrum Channel Access', 'DDPG']",,
안정적인 베팅게임 운영을 위한 우선순위 기반의 MCTS 기법 연구,2023,"['MLPT', 'MCTS', '강화학습', '섰다', 'AI', 'MLPT', 'MCTS', 'Reinforcement Learning', 'Seotda', 'AI']","게임 AI에 사용되는 알고리즘 중 MCTS를 적용하는 방법이 널리 사용된다. 그중 Tree Policy로 UCT 알고리즘을 활용하는 방법이 존재하지만, 변동성이 많은 불완전 정보 게임에서는 좋은 성능을 보장할 수 없는 단점이 있다. 본 논문에서는 불완전 정보 게임에서의 성능 보장을 위해 각 노드의 우선순위를 활용한 MLPT(Multi Level Priority List) 알고리즘을 Tree Policy로 사용하는 방식을 제안하였다. MLPT는 자식 노드 중 최상위 레벨의 선택 가능한 첫 노드를 선택하여 실행한다. 선택한 노드의 승패에 우선순위가 조정된다. 따라서  MLPT는 베팅 시작 금액이 보유 금액의 2%였을 시 단일 게임에 대한 평균 보상비율은 101.237%, 표준편차는 0.0815, 승률은 51.739%가 나왔다. 파산까지 진행 시 승률은 97.8%, 이긴 경우 판수는 47.7판, 졌을 경우 판수는 60.2판으로 측정되었다. 다른 Tree Policy에 비해 가장 안정적인 수익을 냈으며, 그로 인해 안정적으로 베팅하여 판수가 많은 것을 알 수 있다. 따라서 제안하는 MLPT는 안정적인 베팅을 하여 기존의 방식보다 성능을 개선함을 보여준다.","The MCTS algorithm is frequently used in game AI. The commonly used tree policy is the UCT algorithm. In this paper, we propose the use of MLPT (Multi-Level Priority List) algorithm as a tree policy to ensure performance and optimize it for different game fields. MLPT selects the first available node from the top-level children of the node and adjusts its priority based on the outcome. As a result, when starting bet was 2% of the current amount, the average reward ratio was 101.237%, standard deviation was 0.0815, and winning rate was 51.739%. In games played until bankruptcy, the winning rate was 97.8% with 47.7 wins and 60.2 losses. MLPT provided the most stable profits compared to other tree policies and showed that it was a stable bet with a higher number of wins. The proposed MLPT algorithm outperforms existing methods by providing stable bets."
다양한 채널 혼잡도에 적응하는 셀룰러 V2X의 DQN 기반 분산혼잡제어,2023,"['cellular vehicle-to-everything mode 4', 'decentralized congestion control', 'reinforcement learning', 'deep Q-network', '.']",,"In a 3GPP LTE cellular vehicle-to-everything(C-V2X) mode 4, each vehicle user equipment(VUE) independently selects available radio resources using the sensing-based semi-persistent scheduling(SB-SPS) algorithm. As the density of VUEs increases, packet collisions increase, which leads to performance deterioration. This paper has proposed an enhanced DQN(Deep Q-Network)-based distributed congestion control(DCC) to adaptively control the transmission time interval according to densities of VUE(Vehicle User Equipment)s by training a DQN agent for various densities of VUE. Simulation results show that the enhanced DQN based DCC outperforms in environments of various VUE densities."
초등학교 5학년 학생들의 소수 개념 이해,2023,"['Elementary math education', 'Decimals', 'Decimal fraction', 'Decimal digit value', '초등 수학 교육', '소수', '십진분수', '자릿값']",,"This study examined fifth-grade elementary school student knowledge of the decimal concepts learned from national textbooks. A test that asked students to compare decimal sizes was conducted on two fifth-grade elementary school classes in A-si, Gyeonggi-do. Most students compared the decimals well; however, some students thought that the longer decimals were larger. There was also a higher incorrect answer rate when there were zeros in the decimal places, with many finding it difficult to explain the reason for this. In the decimal conceptualization tests, the students often used fractions to describe the decimals, and of the three representative decimal models, they found the base ten model to be the most comfortable. In the question that tested their understanding of decimal concepts, the incorrect answer rate was high for problems that connected fractions to decimals, asked about digit values, and when there were zeros in the decimal places. It was concluded that educational reinforcement was needed so that student could better understand decimal digit values, decimal numbers with zero as a digit, and the differences between fractions and decimals."
농업에서의 ICT 와 인공지능을 활용한 연구 개발 현황 조사,2023,"['ICT', 'AI', 'Big Data', 'Computer Vision', 'CNN', 'RNN', 'Reinforcement Learning', 'Smart Farm']",,"Agriculture plays an industrial and economic role, as well as an environmental and ecological conservation role, group harmony and the inheritance of traditional culture. However, no matter how advanced the industry is, the basic food necessary for human life can only be produced through the photosynthesis of plants with natural resources such as the sun, water, and air. The Food and Agriculture Organization of the United Nations (FAO) predicts that the world's population will increase by another 2 billion people by 2050, and it faces a myriad of complex and diverse factors to consider, including climate change, food security concerns, and global ecosystems and political factors. In particular, in order to solve problems such as increasing productivity and production of agricultural products, improving quality, and saving energy, it is difficult to solve them with traditional farming methods. Recently, with the wind of the 4th industrial revolution, ICT convergence technology and artificial intelligence have been rapidly developing in many fields, but it is also true that the application of new technologies is somewhat delayed due to the unique characteristics of agriculture. However, in recent years, as ICT and artificial intelligence utilization technologies have been developed and applied by many researchers, a revolution is also taking place in agriculture. This paper summarizes the current state of research so far in four categories of agriculture, namely crop cultivation environment management, soil management, pest management, and irrigation management, and smart farm research data that has recently been actively developed around the world."
텍스트 기반 생성형 인공지능의 이해와 과학교육에서의 활용에 대한 논의,2023,"['generative artificial intelligence', 'conversational artificial intelligence', 'natural language processing', 'adaptive learning', 'connectivism', '생성형 인공지능', '대화형 인공지능', '자연어 처리', '적응 학습', '연결주의']","본 연구는 최근 주목받고 있는 텍스트 기반 생성형 인공지능에대해 관심과 활용이 증가함에 따라 과학교육적 측면에서의 활용을위해 생성형 인공지능의 주요 개념과 원리를 설명하고, 이를 효과적으로 활용할 수 있는 방안과 그 한계를 지적하며 이를 토대로 과학교육의 실행과 연구의 측면에서 시사점을 제공하는 것을 목적으로 한다.최근 들어 증가하고 있는 생성형 인공지능은 대체로 인코더와 디코더로 이뤄진 트랜스포머 모델을 기반으로 하고 있으며, 인간의 피드백을 활용한 강화학습과 보상 모델에 대한 최적화, 문맥에 대한 이해등을 통해 놀라운 발전을 이루고 있다. 특히, 다양한 사용자의 질문이나 의도를 이해하는 능력과 이를 바탕으로 한 글쓰기, 요약, 제시어추출, 평가와 피드백 등 다양한 기능을 수행할 수 있다. 또한 교수자가제시하는 예를 토대로 주어진 응답을 평가하거나 질문과 적절한 답변을 생성하는 등 학습자에 대한 진단과 실질적 교육내용의 구성 등많은 유용성을 가지고 있다. 그러나 생성형 인공지능이 가지고 있는한계로 인해 정확한 사실이나 지식에 대한 잘못된 전달, 과도한 확신으로 인한 편향, 사용자의 태도나 감정 등에 미칠 영향의 불확실성등에 대한 문제 등에 대해 해가 없는지 검토가 필요하다. 특히, 생성형인공지능이 제공하는 응답은 많은 사람들의 응답 데이터를 기반으로한 확률적 접근이므로 매우 거리가 멀거나 새로운 관점을 제시하는통찰적 사고나 혁신적 사고를 제한할 우려도 있다. 이에 따라 본 연구는 과학교수학습을 위해 인공지능의 긍정적 활용을 위한 여러 실천적제언을 제시하였다.","This study aims to explain the key concepts and principles of text-based generative artificial intelligence (AI) that has been receiving increasing interest and utilization, focusing on its application in science education. It also highlights the potential and limitations of utilizing generative AI in science education, providing insights for its implementation and research aspects. Recent advancements in generative AI, predominantly based on transformer models consisting of encoders and decoders, have shown remarkable progress through optimization of reinforcement learning and reward models using human feedback, as well as understanding context. Particularly, it can perform various functions such as writing, summarizing, keyword extraction, evaluation, and feedback based on the ability to understand various user questions and intents. It also offers practical utility in diagnosing learners and structuring educational content based on provided examples by educators. However, it is necessary to examine the concerns regarding the limitations of generative AI, including the potential for conveying inaccurate facts or knowledge, bias resulting from overconfidence, and uncertainties regarding its impact on user attitudes or emotions.Moreover, the responses provided by generative AI are probabilistic based on response data from many individuals, which raises concerns about limiting insightful and innovative thinking that may offer different perspectives or ideas. In light of these considerations, this study provides practical suggestions for the positive utilization of AI in science education."
다자유도 갠트리형 용접로봇 시스템의 최적모션 생성을 위한 벡터 방정식 알고리즘 기초 연구,2023,"['multi-D.O.F', 'gantry-type welding robot system', 'optimization', 'path planning', 'reinforcement learning', 'vector equations']",,
Asynchronous Advantage Actor Critic 기반 그룹 임의접속 제어기술,2023,"['Internet of Things', 'Group Random Access', 'Access Class Barring', 'Reinforcement Learning', 'Early Preamble Collision Detection', '사물인터넷', '그룹 임의접속', '제어 정보', '강화 학습', '빠른 프리앰블 충돌 검출 방식']","본 논문은 대규모 그룹 IoT 기기들이 임의접속을 동시에 시도했을 때 발생하는 접속 과부하 문제를 해결하기위해 Asynchronous Advantage Actor Critic (A3C) 기반의 임의접속 제어 기법을 제안한다. 기존 연구에서는 강화학습 기법인 DQN을 이용하여 접속 제어기술을 구현하던 것과는 달리, 본 연구에서는 강화학습 기법 중 A3C를사용하는 접속제어 기술을 제안한다. 제안하는 A3C 기반의 그룹 임의접속 제어기술은 그룹의 모든 단말이 임의접속에 성공하는데 걸리는 시간 측면에서 최적 학습을 통해 일반적인 프리앰블 충돌 검출 방식과 빠른 프리앰블 충돌 검출 방식에 따른 이론적인 제어 성능에 도달함을 보여준다.",
"Application of artificial intelligence chatbots, including ChatGPT, in education, scholarly work, programming, and content generation and its prospects: a narrative review",2023,"['Artificial intelligence', 'Literacy', 'Reproducibility of results', 'Search engine', 'Writing']",,"This study aims to explore ChatGPT’s (GPT-3.5 version) functionalities, including reinforcement learning, diverse applications, and limitations. ChatGPT is an artificial intelligence (AI) chatbot powered by OpenAI’s Generative Pre-trained Transformer (GPT) model. The chatbot’s applications span education, programming, content generation, and more, demonstrating its versatility. ChatGPT can improve education by creating assignments and offering personalized feedback, as shown by its notable performance in medical exams and the United States Medical Licensing Exam. However, concerns include plagiarism, reliability, and educational disparities. It aids in various research tasks, from design to writing, and has shown proficiency in summarizing and suggesting titles. Its use in scientific writing and language translation is promising, but professional oversight is needed for accuracy and originality. It assists in programming tasks like writing code, debugging, and guiding installation and updates. It offers diverse applications, from cheering up individuals to generating creative content like essays, news articles, and business plans. Unlike search engines, ChatGPT provides interactive, generative responses and understands context, making it more akin to human conversation, in contrast to conventional search engines’ keyword-based, non-interactive nature. ChatGPT has limitations, such as potential bias, dependence on outdated data, and revenue generation challenges. Nonetheless, ChatGPT is considered to be a transformative AI tool poised to redefine the future of generative technology. In conclusion, advancements in AI, such as ChatGPT, are altering how knowledge is acquired and applied, marking a shift from search engines to creativity engines. This transformation highlights the increasing importance of AI literacy and the ability to effectively utilize AI in various domains of life."
항만 물류 환경에서 강화학습 기반 컨테이너 다단 적재 모델링 방법,2023,"['port logistics', 'container yard', 'container loading', 'optimizing container handling', 'reinforcement learning']",,
강화학습을 이용한 감성지향 에이전트 - 아트 게임 <MOMaI>(2022)를 중심으로 -,2023,"['아트 게임', '강화학습', '지능형 에이전트', '감성 표현', '뉴미디어 아트', 'Art game', 'Reinforcement learning', 'Intelligent agent', 'Expression of emotion', 'New media art']",,
"가족친화 조직지원 및 가족친화 상사지원이 직무소진에 미치는  영향: 번영감의 매개효과, 직업소명의식의 조절효과",2023,"['Family Friendly Organizational Support', 'Family Friendly Supervisor Support', 'Thriving at Work(Vitality', 'Learning)', 'Job Calling', 'Job Burnout', '가족친화 조직지원', '가족친화 상사지원', '직무소진', '번영감', '직업소명의식']","본 연구는 일-삶의 균형 차원에서 가족친화 조직지원과 가족친화 상사지원이 직무소진에 미치는 영향을규명하려는 목적에서 수행되었다. 또한 번영감과 직업소명의식을 반영하여 어떠한 과정을 통해 가족친화 조직지원, 상사지원이 직무소진에 영향력이 나타나는지 그리고 어떠한 맥락 하에서 영향력이 강화 또는 완충되는지를살펴보았다. 번영감을 매개변수로, 직업소명의식을 조절변수로 설정하였다. 설문의 대상은 병원이며 간호사와의료기사에게 설문을 실시하여 연구가설을 검증하였다. 동일방법편의 문제를 해결하기 위해 설문은 시차를 두고2회 진행하였으며 1차 설문에서는 가족친화 조직지원과 상사지원, 직업소명의식을 측정하였으며, 2차에서는번영감과 직무소진을 측정하였다. 설문의 최종분석은 1차와 2차 동일한 응답자로 확인된 설문을 활용하였으며불성실응답 5부를 제외한 249부를 활용하였다. 분석결과를 살펴보면 첫째, 가족친화 상사지원은 번영감을 높이고있었다. 가족친화 조직지원의 영향력은 나타나지 않았다. 둘째, 번영감은 직무소진을 낮추고 있었다. 셋째, 번영감은가족친화 상사지원과 직무소진과의 관계를 매개하고 있었다. 반면에 가족친화 조직지원과 직무소진과의 관계는매개하지 못하는 것으로 나타났다. 넷째, 직업소명의식은 번영감과 직무소진과의 관계를 조절하고 있었다.직업소명의식이 높은 경우 번영감이 직무소진을 낮추는 영향력은 더욱 확대되고 있었다. 마지막으로 조절된매개효과도 살펴보았는데 직업소명의식이 높은 경우 가족친화 상사지원과 직무소진과의 관계에 번영감의매개효과는 더욱 강하게 나타나고 있었다. 본 연구의 결과를 통해 병원의 주요 인력인 간호사, 의료기사의 일-삶의균형을 위하여 가족친화를 위한 상사의 역할이 중요하다는 점을 확인하였다. 이론적 측면에서 자원보존이론을 통해직무소진을 낮추는데 가족친화를 위한 상사의 지원 뿐만 아니라 번영감이 중요하다는 것을 알 수 있었다. 또한실무적 측면에서 간호사 또는 의료기사들의 직무소진을 줄이는 것이 중요하다는 점에서 가족친화를 위한 조직의노력도 의미가 있지만 상사의 노력이 더욱 필요하다는 것을 규명하였다는 점에서 의의를 가지고 있다.","Balancing work and life demands has become an established area of research and practice have been carried out on work-life-balance(hereafter WLB) to understand the impact this concept has on individuals (employees) and their capacity to manage work and aspect of their lives. WLB defined ‘the extent to which an individual is equally engaged in-and equally satisfied with-his or her work role and family role. Based on WLB, we drawing the organization and supervisor’s effort to enhancing WLB reflected perceived family-friendly organizational support and family-friendly supervisor support concepts. This study examined the effects of family-friendly organizational support and family-friendly supervisor support on job burnout in hospitals who are nurses and medical technicians. By examining the processes through which family-friendly organizational support and supervisor support influence on job burnout, as well as the process and contexts in which the reinforced or buffered. We used thriving at work(vitality, learning) as a mediator and job calling as a moderator. After literature review, we set the direct, mediate, moderate and moderated mediation of research hypotheses. The survey was conducted in hospitals, and nurses and medical technicians who provide medical services to test the research hypotheses. To solve the problem of the common method bias, the survey was conducted twice with a time difference, and the first survey measured family-friendly organizational support, supervisor support, and job calling, and the second survey measured thriving at work and job burn out. The final analysis of the survey used the same respondents from the first and second surveys, excluding five non-responses, and used 249 questionnaires. The results of the analysis showed that, first, family-friendly supervisor support increased thriving at work. There was no effect of family-friendly organizational support. Second, thriving at work decreased job burnout. Third, thriving at work mediated the relationship between family-friendly supervisor support and job burnout. However, it did not mediate the relationship between family-friendly organizational support and job burnout. Fourth, job calling moderated the relationship between thriving at work and job burnout. The effect of thriving at work on job burnout was magnified if high on job calling. Finally, we examined moderated mediation effect, and found that the mediating effect of thriving at work on the relationship between family-friendly supervisor support and burnout was stronger for those with high on job calling. The results of this study confirm the importance of family-friendly supervisor support for the work-life balance of female nurses and medical technicians, who make up the majority of the hospital workforce. In the theoretical aspect, the resource conservation theory suggests that not only the support of family-friendly supervisors but also thriving at work are important in reducing job burnout. In the practical aspect, it is significant that the efforts of family-friendly supervisors are necessary to reduce job burnout among nurses and medical technicians."
과정 중심 평가 결과로써 영어과 교과세특 기재 내실화를 위한 연수 모형 개발 및 적용,2023,"['과정 중심 평가', '교사 연수', '교과세특', 'Process-oriented evaluation', 'teacher training', 'subject-specific abilities and specialties']",,"The purpose of this study was to explore the necessary elements for the description of process-oriented evaluation and to derive implications by developing and applying a training model. A total of 6 expert group interviews were conducted with 7 teachers and education researchers at each level of elementary school, middle school, and high school. The training model developed in this process was applied to a total of 51 teachers, and implications were derived based on their learning experiences. It is suggested that the training course be designed in a hands-on way so that participants can discuss with other participants and write down their own records, and that each group has 5 to 6 participants. In addition, a facilitator is required for each division, and a composition in which group members circulate in each training course was proposed to discuss with various people and develop ideas. The composition of each training course is a total of 8 sessions, and the 1st and 2nd sessions included lecture-type class that helps basic understanding of course-oriented evaluation. In addition, it was suggested that participants practice and discuss the six examples during each session. Lastly, it was suggested that the training course be flexibly performed according to the learner's capacity in the form of presenting specific data or writing examples although the basic training course was provided."
