title,date,keywords,abstract,multilingual_abstract
Reinforcement learning-based virtual network embedding: A comprehensive survey,2023,['Virtual network embeddingDeep reinforcement learningGraph neural networkArtificial intelligence'],,"Virtual network embedding plays a vital role in network virtualization, as it determines the deployment and connection of virtual networks to the physical network in the 5G and beyond. An efficient virtual network embedding algorithm is essential to ensure that virtual networks are embedded in a way that meets the performance, security, and resource requirements of the virtual networks and their users. The integration of reinforcement learning with virtual network embedding can lead to more intelligent and efficient network management, which can enhance the performance of large-scale networked systems. Reinforcement learning has the potential to improve and overcome some limitations of traditional algorithms, such as the need for prior knowledge of network conditions and the difficulty in dealing with non-linear and dynamic network environments. Therefore, we conducted this survey to provide a comprehensive overview and examine potential future directions for the optimal reinforcement learning-based virtual network embedding solutions. However, applying reinforcement learning directly to virtual network embedding is a challenging task that requires further research and study. Additionally, it encourages researchers to examine the potential of reinforcement learning in virtual network embedding, identify the challenges for its application, and cover various factors related to the reinforcement learning application in virtual network embedding, including motivations, performance metrics, and challenges."
Deep Reinforcement Learning based Tourism Experience Path Finding,2023,"['Reinforcement Learning', 'Path Finding', 'Tour Planning', 'Smart Tourism', 'Digital twin']",,"In this paper, we introduce a reinforcement learning-based algorithm for personalized tourist path recommendations. The algorithm employs a reinforcement learning agent to explore tourist regions and identify optimal paths that are expected to enhance tourism experiences. The concept of tourism experience is defined through points of interest (POI) located along tourist paths within the tourist area. These metrics are quantified through aggregated evaluation scores derived from reviews submitted by past visitors. In the experimental setup, the foundational learning model used to find tour paths is the Deep Q-Network (DQN). Despite the limited availability of historical tourist behavior data, the agent adeptly learns travel paths by incorporating preference scores of tourist POIs and spatial information of the travel area."
Reinforcement learning-based control with application to the once-through steam generator system,2023,"['LSTM', 'PPO algorithm', 'Pretraining', 'Once-through steam generator']",,"A reinforcement learning framework is proposed for the control problem of outlet steam pressure of the once-through steam generator(OTSG) in this paper. The double-layer controller using Proximal Policy Optimization(PPO) algorithm is applied in the control structure of the OTSG. The PPO algorithm can train the neural networks continuously according to the process of interaction with the environment and then the trained controller can realize better control for the OTSG. Meanwhile, reinforcement learning has the characteristic of difficult application in real-world objects, this paper proposes an innovative pretraining method to solve this problem. The difficulty in the application of reinforcement learning lies in training.The optimal strategy of each step is summed up through trial and error, and the training cost is very high.In this paper, the LSTM model is adopted as the training environment for pretraining, which saves training time and improves efficiency. The experimental results show that this method can realize the self-adjustment of control parameters under various working conditions, and the control effect has the advantages of small overshoot, fast stabilization speed, and strong adaptive ability."
Learning Multiple-Gait Quadrupedal Locomotion via Hierarchical Reinforcement Learning,2023,"['Quadruped robot', 'Reinforcement learning', 'Gait patterns', 'Machine learning in locomotion']",,"Over long periods of evolution, legged animals have developed the capability to use a variety of gaits to move efficiently and flexibly at different speeds. To enable quadruped robots to acquire this ability, this study proposes a two-stage training hierarchical framework that can have quadruped robots generate energy-efficient multiple-gait locomotion, consisting of a gait selection policy module and a react controller module. The parameters of both modules are optimized using reinforcement learning. The experimental results in the simulation demonstrate that the proposed method can generate energy-efficient multiple-gait quadrupedal locomotion compared to previous methods. To validate the robustness and effectiveness of the method, we constructed a closed-chain quadruped robot and deployed the controller trained by the method to the robot. The experimental results in the real world suggest that the controller can enable the robot to move stably and efficiently in different gaits. The main contribution of this paper is that the authors propose a novel hierarchical framework, which makes quadruped robots use an optimal gait at a specific speed and smoothly switch to another one after getting a different speed command. These behaviors are automatically produced through simulation training, eliminating the need for the tedious work of designing gaits and modulating controllers. Experimental results showcase that the proposed method has significant advantages compared to previous methods."
Deep reinforcement learning-based model-free path planning and collision avoidance for UAVs: A soft actor–critic with hindsight experience replay approach,2023,['Deep reinforcement learningSoft actor–criticHindsight experience replayUAV path planningCollision avoidance and control'],,"In this paper, we propose a soft actor–critic (SAC) algorithm with hindsight experience replay (HER), called SACHER, which is a class of deep reinforcement learning (DRL) algorithm. SAC is an off-policy model-free DRL algorithm that outperforms earlier DRL algorithms in terms of exploration and robustness. However, in SAC, maximizing the entropy-augmented objective degrades the optimality of learning outcomes. We propose SACHER to improve the learning performance of SAC. We apply SACHER to the path planning and collision avoidance control of unmanned aerial vehicles (UAVs). We demonstrate the effectiveness of SACHER in terms of the success rate, learning speed, and collision avoidance performance of UAV operation."
Reward-based participant selection for improving federated reinforcement learning,2023,['Federated learningReinforcement learningFederated reinforcement learningParticipant selection'],,"Federated reinforcement learning (FRL) has recently received a lot of attention in various fields. In FRL systems, the concept of performing more proper actions with better experiences exists, and we focused on this unique characteristic. Motivated by such inherent property of FRL, in this paper, we propose the reward-based participant selection scheme for improving FRL. The FRL system with the proposed scheme performs learning effectively by putting a priority on utilizing better experiences of agents performing outstanding actions. We conducted various experiments, and the results show that it is possible to accelerate learning and require fewer agents when using the proposed scheme, which means that the proposed scheme improves the performance and efficiency of learning."
Supervised pre-training for improved stability in deep reinforcement learning,2023,"['Deep reinforcement learning', 'Pre-training', 'Supervised learning', 'Maximum entropy', 'Stability']",,"Deep reinforcement learning (DRL) technology has been actively studied with the recent advances in deep learning. As a result, the researchers are continuously improving performance and expanding the applications. However, recent literature reports that the performance of DRL is sensitive to the various design choices, e.g., the neural network initialization. Accordingly, it makes DRL hard to obtain a stable performance, which degrades reproducibility. Therefore, we propose a supervised pre-training method for both policy and value networks to improve stability. We pre-train the policy network to maximize the initial entropy and pre-train the value network to bias the distribution to a specific value. The experiments are conducted on tasks with discrete action space where it is hard to control the initial entropy. Through the experiments, the effectiveness of the proposed method in terms of stability and performance is validated."
Safe Reinforcement Learning-based Driving Policy Design for Autonomous Vehicles on Highways,2023,"['Autonomous vehicles', 'collision avoidance', 'decision-making', 'finite state machine', 'safe reinforcement learning.']",,"Safe decision-making strategy of autonomous vehicles (AVs) plays a critical role in avoiding accidents. This study develops a safe reinforcement learning (safe-RL)-based driving policy for AVs on highways. The hierarchical framework is considered for the proposed safe-RL, where an upper layer executes a safe explorationexploitation by modifying the exploring process of the ε-greedy algorithm, and a lower layer utilizes a finite state machine (FSM) approach to establish the safe conditions for state transitions. The proposed safe-RL-based driving policy improves the vehicle’s safe driving ability using a Q-table that stores the values corresponding to each action state. Moreover, owing to the trade-off between the ε-greedy values and safe distance threshold, the simulation results demonstrate the superior performance of the proposed approach compared to other alternative RL approaches, such as the ε-greedy Q-learning (GQL) and decaying ε-greedy Q-learning (DGQL), in an uncertain traffic environment. This study’s contributions are twofold: it improves the autonomous vehicle’s exploration-exploitation and safe driving ability while utilizing the advantages of FSM when surrounding cars are inside safe-driving zones, and it analyzes the impact of safe-RL parameters in exploring the environment safely."
Application of reinforcement learning based on curriculum learning for the pipe auto-routing of ships,2023,"['pipe auto-routing', 'path finding algorithm', 'reinforcement learning', 'curriculum learning']",,"The pipe routing of ships has been manually performed by experts, and the design quality depends on the competence of the experts. Therefore, studies on pipe-routing automation and optimization are required. In addition, the pipe-routing task in a ship that requires frequent pipe-routing modifications requires a long time to be optimized. In this study, we developed a methodology that enables a rapid response in situations where frequent pipe-routing modifications are required by applying curriculum learning that can be stably learned by gradually solving easy-to-complex problems. In addition, this study aimed to minimize the length of the pipe and number of bends as an objective function. Finally, the proposed methodology was verified by comparing it with existing studies that used the A*, jump point search, and reinforcement-learning algorithms to determine the search speed, number of bends, and length of the path."
Decision-making for Connected and Automated Vehicles in Chanllenging Traffic Conditions Using Imitation and Deep Reinforcement Learning,2023,"['Connected and automated vehicles (CAVs)', 'Traffic safety', 'Decision-making', 'Imitation learning', 'Deep reinforcement learning']",,"Decision-making is the “brain” of connected and automated vehicles (CAVs) and is vitally critical to the safety of CAVs. The most of driving data used to train the decision-making algorithms is collected in general traffic conditions. Existing decision-making methods are difficult to guarantee safety in challenging traffic conditions, namely severe congestion and accident ahead. In this context, a semi-supervised decision-making algorithm is proposed to improve the safety of CAVs in challenging traffic conditions. To be specific, we proposed the expert-generative adversarial imitation learning (E-GAIL) that integrates imitation learning and deep reinforcement learning. The proposed E-GAIL is deployed in roadside unit (RSU). In the first stage, the decision-making knowledge of the expert is imitated using the real-world data collected in general traffic conditions. In the second stage, the generator of E-GAIL is further reinforced and achieves self-learn decision-making in the simulator with challenging traffic conditions. The E-GAIL is tested in general and challenging traffic conditions. By comparing the evaluation metrics of time to collision (TTC), deceleration to avoid a crash (DRAC), space gap (SGAP) and time gap (TGAP), the E-GAIL greatly outperforms the state-of-the-art decision-making algorithms. Experimental results show that the E-GAIL not only make-decision for CAVs in general traffic conditions but also successfully enhances the safety of CAVs in challenging traffic conditions."
Navigation of Mobile Robots Based on Deep Reinforcement Learning: Reward Function Optimization and Knowledge Transfer,2023,"['Deep reinforcement learning (DRL)', 'knowledge transfer', 'mobile robot', 'navigation', 'reward function.']",,"This paper presents an end-to-end online learning navigation method based on deep reinforcement learning (DRL) for mobile robots, whose objective is that mobile robots can avoid obstacles to reach the target point in an unknown environment. Specifically, double deep Q-networks (Double DQN), dueling deep Q-networks (Dueling DQN) and prioritized experience replay (PER) are combined to form prioritized experience replay-double dueling deep Q-networks (PER-D3QN) algorithm to realize high-efficiency navigation of mobile robots. Moreover, considering the problem of sparse reward in the traditional reward function, an artificial potential field is introduced into the reward function to guide robots to fulfill the navigation task through the change of potential energy. Furthermore, in order to accelerate the training of mobile robots in complex environment, a knowledge transfer training method is proposed, which migrates the knowledge from simple to complex environment, and quickly learns on the basis of the priori knowledge. Finally, the performance is validated based on a three-dimensional simulator, which shows that the mobile robot can obtain higher rewards and achieve higher success rates and less time for navigation, indicating that the proposed approaches are feasible and efficient."
Robust Near-optimal Control for Constrained Nonlinear System via Integral Reinforcement Learning,2023,"['Constrained nonlinear system', 'integral reinforcement learning', 'optimal control', 'robust control.']",,"This paper proposes a robust near-optimal control algorithm for uncertain nonlinear systems with state constraints and input saturation. By incorporating a barrier function and a non-quadratic term, the robust stabilization problem with constraints and uncertainties is converted into an unconstrained optimal control problem of the nominal system, which requires the solution of the Hamilton-Jacobi-Bellman (HJB) equation. The proposed integral reinforcement learning (IRL)-based method can obtain the approximate solution of the HJB equation without requiring any knowledge of system drift dynamics. An online gain-adjustable update law of the actor-critic architecture is developed to relax the persistence of excitation (PE) condition and ensure the closed-loop system stability throughout learning. The uniform ultimate boundedness of the closed-loop system is verified using Lyapunov’s direct method. Simulation results demonstrate the effectiveness and feasibility of the proposed method."
Comparison of value-based Reinforcement Learning Algorithms in Cart-Pole Environment,2023,"['Reinforcement learning', 'deep reinforcement learning', 'FNN', 'CNN', 'SARSA', 'Q-learning.']",,"Reinforcement learning can be applied to a wide variety of problems. However, the fundamental limitation of reinforcement learning is that it is difficult to derive an answer within a given time because the problems in the real world are too complex. Then, with the development of neural network technology, research on deep reinforcement learning that combines deep learning with reinforcement learning is receiving lots of attention.In this paper, two types of neural networks are combined with reinforcement learning and their characteristics were compared and analyzed with existing value-based reinforcement learning algorithms. Two types of neural networks are FNN and CNN, and existing reinforcement learning algorithms are SARSA and Qlearning"
Robot Subgoal-guided Navigation in Dynamic Crowded Environments with Hierarchical Deep Reinforcement Learning,2023,"['Collision avoidance', 'graph attention networks', 'hierarchical deep reinforcement learning', 'robot navigation.']",,"Although deep reinforcement learning has recently achieved some successes in robot navigation, there are still unsolved problems. Particularly, a robot guided by a distant ultimate goal is easy to get stuck in danger or encounter collisions in dynamic crowded environments due to the lack of long-term perspectives. In this paper, a novel subgoal-guided approach based on two-level hierarchical deep reinforcement learning with spatial-temporal graph attention networks (ST-GANets), called SG-HDRL, is proposed for a robot navigating in a dynamic crowded environment with autonomous obstacles, e.g., crowd. Specifically, the high-level policy, that models the spatialtemporal relation between the robot and the obstacles using the obstacles’ trajectories by the designed high-level ST-GANet, generates intermediate subgoals from a longer-term perspective over higher temporal scales. The subgoals give a favorable and collision-free direction to avoid encountering danger or collisions while approaching the ultimate goal. The low-level policy, that similarly implements the designed low-level ST-GANet to implicitly predict the obstacles’ motions, takes the subgoals as short-term guidance through an intrinsic reward incentive to generate primitive actions for the robot. Simulation results demonstrate that SG-HDRL using ST-GANets has better performances compared with state-of-the-art baselines. Furthermore, the proposed SG-HDRL is deployed to an experimental platform based on omnidirectional cars, and experiment results validate the effectiveness and practicability of the proposed SG-HDRL."
An autonomous radiation source detection policy based on deep reinforcement learning with generalized ability in unknown environments,2023,"['Radiation source detection', 'Deep reinforcement learning', 'Hierarchical learning']",,"Autonomous radiation source detection has long been studied for radiation emergencies. Compared to conventional data-driven or path planning methods, deep reinforcement learning shows a strong capacity in source detection while still lacking the generalized ability to the geometry in unknown environments.In this work, the detection task is decomposed into two subtasks: exploration and localization.A hierarchical control policy (HC) is proposed to perform the subtasks at different stages. The low-level controller learns how to execute the individual subtasks by deep reinforcement learning, and the highlevel controller determines which subtasks should be executed at the current stage. In experimental tests under different geometrical conditions, HC achieves the best performance among the autonomous decision policies. The robustness and generalized ability of the hierarchy have been demonstrated"
Sustainable Smart City Building-energy Management Based on Reinforcement Learning and Sales of ESS Power,2023,"['AI', 'Big Data', 'Building-energy Management', 'Energy Storage System', 'Reinforcement Learning', 'Renewable Energy', 'Smart City']",,"In South Korea, there have been many studies on efficient building-energy management using renewable energy facilities in single zero-energy houses or buildings. However, such management was limited due to spatial and economic problems. To realize a smart zero-energy city, studying efficient energy integration for the entire city, not just for a single house or building, is necessary. Therefore, this study was conducted in the eco-friendly energy town of Chungbuk Innovation City. Chungbuk successfully realized energy independence by converging new and renewable energy facilities for the first time in South Korea. This study analyzes energy data collected from public buildings in that town every minute for a year. We propose a smart city building-energy management model based on the results that combine various renewable energy sources with grid power. Supervised learning can determine when it is best to sell surplus electricity, or unsupervised learning can be used if there is a particular pattern or rule for energy use. However, it is more appropriate to use reinforcement learning to maximize rewards in an environment with numerous variables that change every moment. Therefore, we propose a power distribution algorithm based on reinforcement learning that considers the sales of Energy Storage System power from surplus renewable energy. Finally, we confirm through economic analysis that a 10% saving is possible from this efficiency."
Distributed Multi-agent Target Search and Tracking With Gaussian Process and Reinforcement Learning,2023,"['Distributed system', 'Gaussian process', 'multi-agent reinforcement learning', 'target search and tracking.']",,"Deploying multiple robots for target search and tracking has many practical applications, yet the challenge of planning over unknown or partially known targets remains difficult to address. With recent advances in deep learning, intelligent control techniques such as reinforcement learning have enabled agents to learn autonomously from environment interactions with little to no prior knowledge. Such methods can address the explorationexploitation tradeoff of planning over unknown targets in a data-driven manner, streamlining the decision-making pipeline with end-to-end training. In this paper, we propose a multi-agent reinforcement learning technique (MARL) with target map building based on distributed Gaussian process (GP). We leverage the distributed GP to encode belief over the target locations in a scalable manner and incorporate it into centralized training with decentralized execution MARL framework to efficiently plan over unknown targets. We evaluate the performance and transferability of the trained policy in simulation and demonstrate the method on a swarm of micro unmanned aerial vehicles with hardware experiments."
Impact of network settings on reinforcement learning based caching policy in cooperative edge networks,2023,['Edge cachingDeep reinforcement learningCooperative cachingNetwork setting'],,"Reinforcement learning (RL) has been used in combination with cooperative caching to deal with growing traffic in mobile networks, but the performance of RL based caching policies depends heavily on network settings. This paper investigates the impact of access delays within network infrastructures and popularity and similarity properties of the contents requested on network performance. A deep Q-network based caching framework is established in both basic and extended cooperative edge networks. Our simulation results reveal explicit relationships between the performance and influential parameters, which can provide a guidance and benchmark for the design of effective caching polices with RL and cooperation technologies."
The Robotic Arm Velocity Planning Based on Reinforcement Learning,2023,"['Reinforcement learning', 'Velocity planning', 'Robotic arm', 'Industrial robot manipulator']",,"In order to improve the performance of the robotic arm effectively, this study established a robotic arm velocity planning model developed by artificial intelligence in the simulation system. The model not only considered the dynamic factors of the robotic arm but was also able to set different customized conditions such as machining accuracy and rotation angle. The study could be divided into three parts. First, the simulation environment was constructed with the ABB IRB140 six axes multipurpose industrial robot. To be consistent with real-world situations, a Vortex physics engine was applied to the simulation supplying varying locomotion parameters. In this research, friction, kinematics, and inertia were considered. Second, artificial intelligence was imported into the robotic arm through the establishment of connecting V-rep and Python. The proposed model was developed in the Python environment by deep deterministic policy gradients. Eventually, a design of the appropriate reward function governing the ultimate results was presented. Compared with traditional velocity planning, the proposed method can decline moving error by 0.05 degrees under the considerations involving dynamic factors in a robotic arm. Besides, the proposed velocity planning strategy could be obtained after taking the training time of one hour which can meet the demand for the time cost of the industry."
