title,date,keywords,abstract,multilingual_abstract
고등학생의 2015 개정 교육과정 기반 6대 핵심역량 잠재계층 분류 및 영향 요인,2023,"['핵심역량', '잠재프로파일', '2015 개정 교육과정', '성별', '학습활동 시간', '부모⋅자녀관계', '교사관계', '교우관계', 'Core competency', 'latent profile', '2015 revised curriculum', 'gender', 'learning activity hours', 'parent-child relationship', 'teacher relationship', 'peer relationship']","목적  본 연구는 고등학생의 자기관리 역량, 지식정보 처리 역량, 창의적 사고 역량, 심미적 역량, 공동체 역량, 의사소통 역량에 따라 잠재계층을 분류하여 잠재계층에 영향을 주는 요인들을 분석하고자 하였다.방법  연구 자료는 부산광역시교육청 교육정책연구원 주관으로 설문을 통해 수집한 부산교육 종단연구(Busan Education Longitudinal Study: BELS)의 설문 중 제4차 년도와 5차 년도에 해당하는 2019 ~ 2020년의 고등학교 1학년과 2학년에 해당하는 표집 자료를 사용하였고 1차 년도 설문에는 남학생 1,603명, 여학생 1415명으로 총 3,046명이 설문에 참여하였다. 잠재계층 분류를 위해 잠재프로파일 분석을, 계층별 영향 요인 분석을 위해 다항 로지스틱 회귀분석을 실시하였다.결과  첫째, 잠재 계층 사례 수를 종합적으로 고려해볼 때 5개의 계층 분류 모형이 가장 적합한 모형으로 판단하였다. 둘째, 성별은 계층 분류에 대부분 유의미한 영향을 주지 못하였으나 ‘전반적 고역량집단’, ‘공동체 역량 불균형집단’보다 ‘중하위 역량집단’에 포함될 가능성이 높았다. 셋째, 학습활동 시간이 높을수록 ‘전반적 저역량집단’보다 ‘중상위 역량집단’, ‘전반적 고역량집단’, ‘공동체 역량 불균형집단’에 포함될 가능성이 높았으며, 부모⋅자녀관계가 좋을수록 ‘공동체 역량 불균형집단’보다 ‘중하위 역량집단’에 포함될 가능성이 높았고, 교사 관계가 좋을수록 ‘전반적 저역량집단’보다 ‘전반적 고역량집단’에 포함될 가능성이 높았으며, 교우 관계가 좋을수록 ‘중상위 역량집단’ 보다는 ‘전반적 고역량집단’에 포함될 가능성이 높음을 확인하였다.결론  핵심역량 발달을 수준에 따라 잠재계층 분류에 영향을 주는 변수(학습활동 시간, 부모, 교사, 교우관계)의 적절한 한 개입이 필요하다. 자녀를 지지하고 보호하는 기능을 상실한 결손 가정을 돕기 위해 사회와 기관이 적극적 지원환경을 구축하고 학생이 학습활동 시간을 확보할 수 있도록 돕기 위해 학교에서 다양한 활동(학생자치, 방과후 활동 등) 지원해야 한다. 지나칠 정도로 교우관계에 집착하려는 경향을 보이는 학생들에게 역량 발달에 부정적인 영향을 미칠 수 있다는 점을 감안하여 건강한 교우관계에 대한 올바른 교육이 필요함을 시사한다.","Objectives  This study tried to analyze the factors affecting the potential class by classifying the potential class according to high school students' self-management ability, knowledge information processing ability, creative thinking ability, aesthetic ability, community ability, and communication ability.Methods  Research data were high school samples from 2020 to 2021, corresponding to the 4th and 5th years, among the surveys of the Busan Education Longitudinal Study (BELS) collected through questionnaires supervised by the Education Policy Research Institute of the Busan Metropolitan Office of Education. A total of 3,046 people (1,603 male students and 1,415 female students) participated in the survey. Latent profile analysis was performed to classify the latent class, and multinomial logistic regression analysis was performed to analyze the influencing factors for each class.Results  First, when comprehensively considering the number of latent class cases, the 5 class classification model was judged to be the most appropriate model. Second, gender did not have a significant effect on class classification in most cases, but it was more likely to be included in the ‘middle and lower competency group’ than the ‘overall high competency group’ and ‘community competency imbalanced group’. Third, the higher the learning activity time, the higher the possibility of being included in the ‘higher middle competency group’, ‘overall high competency group’, and ‘unbalanced community competency group’ than the ‘overall low competency group’. The possibility of being included in the ‘lower-middle competency group’ was higher than the ‘community imbalanced competency group’. The better the teacher relationship, the higher the possibility of being included in the ‘overall high competency group’ than the ‘overall low competency group’. It was confirmed that they were more likely to be included in the ‘overall high competency group’ rather than the upper middle competency group.Conclusions  intervention of variables (learning activity time, parents, teachers, peer relationships) that affect the classification of latent classes according to the level of core competency development is required. In order to help broken families who have lost the ability to support and protect their children, society and institutions must establish an active support environment and support various activities (student autonomy, after-school activities, etc.) at school to help students secure time for learning activities. do. Considering that students who tend to be excessively obsessed with peer relationships can have a negative impact on their competency development, it suggests that proper education on healthy peer relationships is necessary."
SNS 콘텐츠 오염자의 효율적인 탐지를 위한 특징 조합 탐색,2023,"['SNS', 'Content Polluter', 'Feature Combination', 'Random Forest', 'Deep Neural Network', 'SNS', '콘텐츠 오염자', '특징 조합', '랜덤포레스트', '심층신경망']","트위터, 페이스북과 같은 SNS 사용자가 증가함에 따라서, 상품 광고, 비방 및 성인 콘텐츠 등을 게재하여 SNS를 오염시키는 콘텐츠 오염자 혹은 스패머 문제가 점차 커지고 있기 때문에 콘텐츠 오염자 탐지 방법에 대한 연구가 필요한 실정이다. 과거 랜덤포레스트, 나이브베이즈와 같은 기계학습의 지도학습 기술을 이용한 탐지 방법은 98% 이상의 비교적 높은 분류 정확도를 나타내는 반면, 학습을 수행하기위해서 원본 데이터로부터 특징을 식별하고 특징 값을 추출하여 훈련데이터를 생성하는 과정이 필요하다. 식별한 특징이 분류 그룹의 성격을 잘 나타내고 특징의 수가 많을수록 분류 정확도를 높이는 특성이 있다. 그러나, 식별한 특징의 개수가 많다는 것은 특징 값 추출에 소요되는 시간을 고려했을 때, 학습 모델 생성의 효율성을 저하시키는 부분이다. 일정 수준의 정확도 성능은 보장되고 효율성 제고가 가능한 최소 집합의 특징 조합을 탐색하기 위해서 본 논문은 특징 중요도, 카이제곱 분포 및 PCA 분석 등을 이용하여 최소 규모 특징 조합 탐색 방법을 기술하고, 이를 랜덤포레스트 및 심층신경망 알고리즘을 이용한 실험으로 비교 평가한다.","As SNS users such as Twitter and Facebook increase, the problem of content polluters or spammers polluting SNS by posting product advertisements, slander and adult content is gradually increasing. Therefore, there is a continuous need for research on methods for detecting content polluters. Detection methods using supervised learning techniques of machine learning such as Random Forest and Naive Bayes in the past show relatively high classification accuracy of 98% or more. However, in order to create a learning model, a process of generating training data by identifying features from original data and extracting feature values is required. The identified features represent the characteristics of the classification group well, and the greater the number of features, the higher the classification accuracy. However, the large number of identified features reduces the efficiency of generating a learning model when considering the time required to extract feature values. In order to search for the minimum set of feature combinations that guarantees a certain level of accuracy performance and can improve efficiency, this paper describes a method for searching for minimum scale feature combinations using feature importance, chi-square distribution, and PCA analysis. And, this is compared and evaluated through experiments using Random Forest and deep neural network algorithms."
초등학교 인공지능 교육을 위한 게이미피케이션 설계,2023,"['게이미피케이션', '메타버스', '인공지능', '블록코딩', 'Gamification', 'Metaverse', 'AI', 'Block coding']","2022 개정 교육과정을 통하여 초등학생들을 대상으로 한 인공지능 교육에 관심이 고조되고 있다. 그러나 초등학생들에게 인공지능은 추상적이고 복잡한 개념일 수 있어 적절한 교육 방법에 대한 연구가 필요하다. 이에 본 연구에서는 게이미피케이션 개념을 도입하여 효율적인 초등 인공지능 교육방안을 제시하고자 한다. 본 연구에서는 지도학습을 통해 입력값과 출력값의 패턴을 학습하고 새로운 입력값을 예측하는 과정을 메타버스를 활용하여 이해할 수 있도록 설계하였다. 교육 프로그램은 메타버스 공간 활동과 인공지능 학습 및 응용 프로그래밍으로 구성하였으며, 로블록스, 머신러닝포키즈, 스크래치 3.0을 활용하여 교육환경을 개발하였다. 초등학생을 대상으로 8차시 교육 후 사전/사후 인공지능 이미지 검사를 통해 효과성을 검증하였다.","Through the 2022 revised curriculum, interest in artificial intelligence education for elementary school students is growing. However, artificial intelligence can be an abstract and complex concept for elementary school students, so research on appropriate teaching methods is needed. Therefore, this study introduces the concept of gamification and proposes an efficient elementary artificial intelligence education plan. In this study, it is designed to understand the process of learning patterns of input and output values ​​through supervised learning and predicting new input values ​​using the metaverse. The educational program consisted of metaverse space activities, artificial intelligence learning and application programming, and the educational environment was developed using Roblox, Machine Learning for Kids, and Scratch 3.0. After the 8th class of elementary school students, the effectiveness was verified through pre/post artificial intelligence image inspection."
MARS와 PAM을 활용한 순항 단계 고도 이탈 이상치 탐지,2023,"['이상치 탐지', 'ADS-B', 'MARS', 'DTW', 'PAM', 'Anomaly Detection']","최근 항적 데이터를 통해 항공 사고의 전조 징후를 분석하고 이를 탐지하는 방법이 연구되고 있다. 하지만 연구 대부분은 이·착륙 단계에 국한되어 있고, 순항 단계로 특정하는 규칙이 존재하지 않기 때문에 순항 단계 탐색 연구는 드문 실정이다. 이 단계에서는 속도보다는 고도, 경로에 따른 이탈이 발생하게 되는데, 본 논문에서는 순항 단계의 고도 이탈을 클러스터링 방법으로 탐지하려고 한다. 2019년 1월부터 12월까지 수신된 ADS-B(automatic dependent surveillancebroadcast) 항적 자료에서 국내선 중 가장 많이 운행하는 제주 공항에서 김포 공항으로 운항하는 항공편의 10%를 sampling 하여 약 4,400편의 항공편을 대상으로 연구를 진행했다. MARS(multivariate adaptive regression splines) 모형과 단순 선형 회귀모형을 통해 항적 간의 기울기를 계산하여 순항 단계라고 정의할 수 있는 구간인 순항 기울기를 정의하였다. 그리고 Distance Measure인 EDR(edit distance on real sequence)과 DTW(dynamic time wraping)를 활용해 항공편 간의 비유사도를 계산하였다. 2가지 클러스터 방법인 PAM, Hierarchical clustering 사용하였고, 평균 실루엣 너비가 가장 큰 PAM(partitioning around medoids)을 통해 항공편을 군집화했다. PAM을 통해 분류된 클러스터의 중심과 클러스터 내의 항공편 사이의 비유사도 값을 통해 이상치를 판별하였고, 약 12% 항공편이 이상치 항공편이 탐지되었다. 전조 징후 중 하나인 고도 이탈을 보다 일찍 탐지하여 항공 사고를 막을 수 있을 것으로 기대된다. 후속 연구에서는 항공 분야의 전문가의 도움으로 수집된 정상 데이터를 기반으로 이상치를 탐지하는 준-지도 학습(semi-supervised learning) 방법을 통해 이상치 탐지를 진행할 수 있다.","Recently, methods for analyzing and detecting precursor signs of aviation accidents through navigation data have been studied. However, most of the studies are limited to the takeoff and landing stages, and there are no rules specifying the cruise stage, so the cruise stage search studies are rare. At this stage, break away according to altitude and path rather than speed occur, and in this paper, we try to detect break away in altitude of cruise stage by clustering method. In the ADS-B flight data received from January to December 2019, 10% of flights from Jeju Airport to Gimpo Airport, the most frequently operated domestic flights, were sampled and studied about 4,400 flights. Through the Multivariate Adaptive Regression Splines (MARS) model and the simple linear regression model, the slope between the trajectories was calculated to define the cruise slope, an interval that can be defined as the cruise stage. In addition, the non-similarity between flights was calculated using the distance measurements, EDR and DTW. Two cluster methods were used: PAM, Hierarchical clustering, and flights were clustered through PAM with the largest average silhouette width. An outlier was determined through a non-similar value between the center of the cluster classified through PAM and the flights within the cluster, and about 12% of flights were detected. It is expected to be able to prevent aviation accidents by detecting altitude break away, one of the premonitory signs, earlier. In subsequent studies, outlier detection can be carried out using a Semi-supervised learning method to detect outliers based on normal data collected with the help of experts in the aviation field."
자가학습과 지식증류 방법을 활용한 LiDAR 3차원 물체 탐지에서의 준지도 도메인 적응,2023,"['Deep Learning', 'LiDAR', 'Computer Vision', '3D Object Detection']",,"With the release of numerous open driving datasets, the demand for domain adaptation in perception tasks has increased, particularly when transferring knowledge from rich datasets to novel domains. However, it is difficult to solve the change 1) in the sensor domain caused by heterogeneous LiDAR sensors and 2) in the environmental domain caused by different environmental factors. We overcome domain differences in the semi-supervised setting with 3-stage model parameter training. First, we pre-train the model with the source dataset with object scaling based on statistics of the object size. Then we fine-tine the partially frozen model weights with copy-and-paste augmentation. The 3D points in the box labels are copied from one scene and pasted to the other scenes. Finally, we use the knowledge distillation method to update the student network with a moving average from the teacher network along with a self-training method with pseudo labels. Test-Time Augmentation with varying z values is employed to predict the final results. Our method achieved 3rd place in ECCV 2022 workshop on the 3D Perception for Autonomous Driving challenge."
다문화 청소년의 비행 예측 요인 탐색: 랜덤포레스트를 활용하여,2023,"['Multicultural Adolescents', 'Delinquency', 'Machine Learning', 'Random Forest', 'Delinquency Theory', '다문화 청소년', '비행', '머신러닝', '랜덤포레스트', '비행이론']","이 연구에서는 다문화 청소년들의 비행 행동에 영향을 미치는 다양한 요인들을 식별하고 그들의 상대적 영향력을 비교하기 위하여 랜덤포레스트를 이용하여 분석하였다. 한국청소년정책연구원이 2011년부터 2020년까지 수행한 다문화 청소년 패널조사 데이터 중 2016년의 중학교 3학년 데이터를 사용하였다. 연구 결과, 사회유대이론, 사회학습이론, 그리고 일반긴장이론이 청소년의 비행 행동을 유의미하게 예측해주는 것으로 확인되었다. 구체적으로, 사회학습이론의 정의가 가장 큰 영향력을 지닌 것으로 확인되었으며, 이어서 성별과 일반긴장이론의 사회적 위축, 친구긴장 그리고 사회유대이론의 학교애착과 부모감독이 비행 행동에 영향을 미치는 것으로 나타났다. 이 연구의 결과를 토대로 일반청소년과 다문화 청소년의 비행에 영향력을 미치는 요인들의 차이점에 대해 논의하였다.","This study analyzed the factors influencing delinquent behavior among multicultural adolescents using Random Forest. The study utilized data from the third-grade middle school cohort in 2016, part of the multicultural adolescent panel survey conducted by the Korea Youth Policy Institute from 2011 to 2020. The research results showed that Social Bond Theory, Social Learning Theory, and General Strain Theory significantly predicted multicultural adolescents’ delinquency. The definition of the social learning theory was found to have the most substantial influence. This was followed by factors such as gender, social inhibition from the general strain theory, tension with friends, and school attachment and parental supervision from the social bond theory, all of which appeared to impact delinquent behavior. The findings emphasize the importance of developing targeted interventions, specifically addressing different factors and providing valuable insights for tackling delinquency in a multicultural context"
메타 의사 라벨을 이용한 오토인코더 기반 이상 탐지 성능 향상 기법,2023,"['Anomaly Detection', 'Autoencoder', 'Meta Pseudo Label', 'Semi-Supervised Learning', '이상 탐지', '오토인코더', '메타 의사 라벨', '준지도 학습']","이상 탐지(anomaly detection)는 대다수 데이터의 패턴에서 크게 벗어나는 데이터를 탐지하는 것이다. 오토인코더는 이상 탐지에 사용되는 대표적인 모델로서, 정상 데이터의 특징을 먼저 학습한 후 이 특징에 크게 벗어나는 데이터를 이상 데이터로 판별한다. 오토인코더가 정상 데이터의 특징을 학습하기 위해서는 정상이라고 라벨링(labeling)된 다량의 데이터가 필요하다. 하지만 라벨링된 다량의 데이터를 확보하는 것은 일반적으로 쉽지 않은 일이다. 이를 위해 본 논문은 메타 의사 라벨(meta pseudo label) 기법을 이용하여, 라벨링되지 않은 데이터까지 오토인코더의 학습에 활용하는 기법을 제안한다. 제안 기법은 라벨링되지 않은 데이터에서 정상으로 예측되는 데이터를 선별하여 이를 추가로 오토인코더의 학습에 사용한다. 그로 인해 제안 기법은 라벨링된 데이터가 많지 않은 환경에서도 라벨링되지 않은 데이터를 활용하여 이상 탐지의 성능을 향상시킬 수 있다. 두 개의 실제 데이터셋을 사용한 실험 결과, 제안 기법은 기존 이상 탐지 기법에 비해 이상 데이터를 더욱 정확히 탐지함을 확인하였다.","Anomaly detection is to detect data that deviate significantly from the pattern of the majority of data. The autoencoder is a representative model used for anomaly detection. An autoencoder first learns the features of normal data, and then determines data that greatly deviate from the the learned features as anomalous data. In order to learn the features of normal data, an autoencoder needs a large amount of data labeled as normal. However, it is usually not easy to obtain a large amount of labeled data. To address this problem, this paper proposes a method that utilizes even unlabeled data to train an autoencoder, which is based on the meta pseudo labeling. The proposed method selects data that is predicted as normal from unlabeled data and additionally uses them to train an autoencoder. Consequently, the proposed method can improve the performance of anomaly detection by using unlabeled data even in an environment where there are not much labeled data. Through experiments using two real datasets, we confirmed that the proposed method detects anomalies more accurately than the existing anomaly detection techniques."
Ensemble UNet 3+ for Medical Image Segmentation,2023,"['Ensemble UNet 3+', 'Medical image segmentation', 'Deep learning', 'UNet 3+', 'Deep supervision']",,
생성형 AI의 개발 및 이용에 관한 규제의 필요성 - 대규모 언어모델에 기반한 대화형 인공지능 서비스(LLMs AI)를 중심으로 -,2023,"['generative AI', 'LLMs AI', 'chatGPT', 'learning data', 'AI regulation', 'fair use', '생성형AI', '대규모 언어모델 AI', '챗GPT', '학습데이터', 'AI규제', '공정이용']","4차 산업혁명 시대에 접어든 이래 AI는 광속적인 발전을 하며 이제는 인공지능이 사회 전반에 영향력을 미치고 있다. 지난 2022년 출시된 챗GPT-3의 단기간 확산으로 생성형 AI의 개발경쟁이 치열해지면서 인공지능이 인간만의 영역으로 간주되었던 창작의 영역에서까지 인간을 능가하는 기술을 보여주고 있다. 그러나 진보한 기술만큼이나 복잡하고 다양한 사회적 문제를 수반하고 있기에 본 연구에서는 생성형 AI, 그리고 특히 텍스트를 중심으로 대화나 검색엔진에 특화된 대규모 언어모델에 기반한 AI의 현주소를 분석하여 문제를 지적하고 해결방안을 모색하였다.LLMs AI는 대량의 데이터에 의존하다 보니 데이터편향, 허위정보, 정보오용, 데이터 환각 등 학습데이터 문제와 학습·생성·이용과정에서 개인정보 및 저작권 침해, 범죄에의 이용 등 불법적 문제, 그리고 광범위한 활용 영역에 따라 디지털 디바이드, 고용시장의 변화 등의 파생적인 문제들도 발생하고 있다. 이를 위하여 앞으로의 기술 개발에 있어 인간의 기본권을 중심으로 한 기술윤리 준수와 책임감 있는 자체 감독을 강제하고 범정부적 차원에서 AI윤리에 대한 홍보·교육·감독을 강화하여야 한다. 나아가 생성자인 AI와 개발자, 그리고 이용자 모두가 책임감 있는 개발·생성·이용 활동을 하도록 개인정보, 저작권, 콘텐츠 관련 법령과 AI기본법을 검토하여 책임을 부여하는 강력한 직접규제조항이나, 저작인접권·보험의무화 등 간접책임을 명문화한 입법규제를 제안한다.","Since entering the era of the 4th industrial revolution, AI has made light-speed development, and now artificial intelligence has an influence on society as a whole. As competition for the development of generative AI intensifies due to the short-term spread of Chat GPT-3, which was released in 2022, artificial intelligence is showing technology that surpasses humans even in the realm of creation that was considered to be human-only. However, since it is as complex and involves various social problems as advanced technologies, this study analyzed the current status of generative AI, especially AI based on large language models specialized in conversation or search engines, focusing on text, to point out the problem and seek solutions.LLMs AI relies on large amounts of data, resulting in learning data problems such as data bias, false information, misuse of information, and data hallucinations, illegal problems such as personal information and copyright infringement, crime use, and changes in the digital divide and job market. To this end, it is necessary to enforce compliance with technical ethics centered on basic human rights and responsible self-supervision in future technology development, and strengthen public relations, education, and supervision of AI ethics at the pan-government level. Furthermore, it proposes strong direct regulatory provisions that give responsibility by reviewing personal information, copyright, content-related laws, and basic AI laws so that AI, developers, and users, all of them, can develop, create, and use responsibly. And also it proposes legislative regulations that stipulate indirect responsibilities such as neighboring rights of copyright and insurance obligations."
