title,date,keywords,abstract,multilingual_abstract
준지도 학습을 활용한 사용자 기반 소형 어선 충돌 경보 분류 모델에 대한 연구,2023,"['해상디지털', '데이터 파이프라인', '데이터 전처리', '준지도학습', '머신러닝', '딥러닝', 'maritime digital', 'data pipeline', 'data preprocessing', 'semi-supervised learning', 'machine learning', 'deep learning']","본 연구는 해양수산부의 ‘지능형 해상교통정보시스템’ 서비스 중 ‘사고취약선박 모니터링 서비스’의 선박 충돌 경보를 개선하기 위한 것으로, 현재의 선박 충돌 경보는 대형 선박 위주의 데이터와 그 운항자에 기반한 설문조사 레이블을 가지고 지도 학습(SL)한 모델을 사용하고 있다. 이로 인해, 소형선박 데이터 및 운항자의 의견이 현재 충돌 지도학습 모델에 반영되지 않아, 소형선박 운항자가 느끼는 체감보다 먼 거리에서 경보가 제공되기 때문에 그 효과가 미비하다. 또한, 지도학습(SL) 방법은 레이블링 된 다수의 데이터가 필요하지만, 레이블링 과정에서 많은 자원과 시간이 필요하다. 본 논문은 이러한 한계를 극복하기 위해 준지도학습(SSL)의 알고리즘인 Label Propagation과 TabNet을 사용하여 레이블이 결정되지 않은 데이터를 활용하여 소형선박을 위한 충돌 경보의 분류 모델을 연구하였다. 충돌 경보의 분류 모델을 활용하여 소형선박 운항자를 대상으로 실해역 시험을 수행한 결과 운항자의 만족도가 증가하는 결과를 확인하였다.","This study aimed to provide a solution for improving ship collision alert of the 'accident vulnerable ship monitoring service' among the 'intelligent marine traffic information system' services of the Ministry of Oceans and Fisheries. The current ship collision alert uses a supervised learning (SL) model with survey labels based on large ship-oriented data and its operators. Consequently, the small ship data and the operator's opinion are not reflected in the current collision-supervised learning model, and the effect is insufficient because the alarm is provided from a longer distance than the small ship operator feels. In addition, the supervised learning (SL) method requires a large number of labeled data, and the labeling process requires a lot of resources and time. To overcome these limitations, in this paper, the classification model of collision alerts for small ships using unlabeled data with the semi-supervised learning (SSL) algorithms (Label Propagation and TabNet) was studied. Results of real-time experiments on small ship operators using the classification model of collision alerts showed that the satisfaction of operators increased."
임계값 학습 모듈을 적용한 준지도 SAR 이미지 분류,2023,"['준지도 학습', '의사 라벨링', 'SAR 이미지 분류 학습', '임계값 학습 모듈Abstract', 'Semi-supervised Learning', 'Pseudo Labeling', 'SAR Classification', 'Threshold Train Module']",준지도 학습(Semi-supervised learning)은 소량의 라벨이 있는 데이터와 다량의 라벨이 없는 데이터를 사용하여모델을 훈련하는 효과적인 방법이다. 그러나 많은 논문에서 준지도 학습시 하나의 고정된 임계값을 사용하여각 클래스별 서로 다른 이미지들의 특징별 차이를 고려하지 않고 임의 라벨을 만든다. 본 논문에서는 합성개구레이더(SAR) 이미지 분류 준지도 학습시 모든 클래스가 하나의 고정된 임계값을 사용하는 대신 각 클래스에 대해 서로 다른 임계값을 적용한다. 모델에 임계값 학습 모듈을 추가하여 임계값을 학습하여 클래스별로 학습되는 차이를 고려하여 클래스별로 서로 다른 임계값을 얻는다. 서로 다른 임계값을 사용한 준지도 학습 기반의 SAR 이미지 분류 방법을 적용유무를 비교하여 클래스별 임계값을 사용하는 이점에 대해 고찰하였다.,"Semi-supervised learning (SSL) is an effective approach to training models using a small amount of labeled data and a larger amount of unlabeled data. However, many papers in the field use a fixed threshold when applying pseudo-labels without considering the feature-wise differences among images of different classes. In this paper, we propose a SSL method for synthetic aperture radar (SAR) image classification that applies different thresholds for each class instead of using a single fixed threshold for all classes. We propose a threshold learning module into the model, considering the differences in feature distributions among classes, to dynamically learn thresholds for each class. We compare the application of a SSL SAR image classification method using different thresholds and examined the advantages of employing class-specific thresholds."
공공 자전거 수요 예측을 위한 사이킷런의 지도 기계 학습 모델 성능 비교,2023,"['Machine Learning', 'Data Analysis', 'Demand Prediction', 'Public Bicycles', 'Python', 'Scikit-Learn', '기계 학습', '데이터 분석', '수요 예측', '공공자전거', '파이썬', '사이킷런']",,"This study compares and evaluates the performance of machine learning models provided by scikit-learn for predicting public bicycle demand. Reliable data provided by the government, namely ""Seoul public bicycle usage information"" provided by the Seoul Metropolitan Government and ""weather information"" provided by the Korea Meteorological Administration, were used for the experiment. Supervised learning models in scikit-learn, namely random forest, gradient boosting, decision tree, and linear regression, were used, and performance was evaluated using RMSE, R2, RMSLE, and accuracy. The random forest model showed the best performance with an RMSE of 347.37, R2 of 0.74, RMSLE of 0.51, and accuracy of 67.61%. The gradient boosting and decision tree were the next best-performing models, whereas the linear regression had the worst performance, as expected. Thus, from the various models for demand prediction analysis, the optimal model can be selected to reduce demand prediction errors."
지도학습 기반 수출물량 및 수출금액 예측 모델 개발,2023,"['Prediction Model', 'Machine Learning', 'Export Amount', 'Export Volume']",,"Due to COVID-19, changes in consumption trends are taking place in the distribution sector, such as an increase in non-face-to-face consumption and a rapid growth in the online shopping market. However, it is difficult for small and medium-sized export sellers to obtain forecast information on the export market by country, compared to large distributors who can easily build a global sales network.This study is about the prediction of export amount and export volume by country and item for market information analysisof small and medium export sellers. A prediction model was developed using Lasso, XGBoost, and MLP models based on supervised learning and deep learning, and export trends for clothing, cosmetics, and household electronic devices were predicted for Korea's major export countries, the United States, China, and Vietnam. As a result of the prediction, the performance of MAE and RMSE for the Lasso model was excellent, and based on the development results, a market analysis system for small and medium sellers was developed."
Keras 지도학습을 이용한 고교야구선수의 타율과 OPS 상관 관계 예측 모델,2023,"['Artificial intelligence', 'Machine learning', 'Keras predicton model', 'Tensorflow', 'Baseball player']",,"Recently, as an opportunity to take a new leap forward in the great change of the 4th industrial revolution, we are doing our best to develop artificial intelligence, which plays the role of the brain of the Internet of Things (IoT) and big data. AI is already being used in various fields such as healthcare, finance, manufacturing and transportation and is expected to infiltrating more deeply into our life and science in the future. Machine learning, which is the basis of AI, uses statistical and logical algorithms of mathematics to learn, analyze and predict using massive amounts of various data. Batting ability(of baseball) is one of the most important one for a baseball player. In particular, among the statistical data of batting average, slugging percentage, and OPS(On-base Plus Slugging) are the most important criteria for a baseball-fielder. The run-scoring ability is to run the base after hitting the ball, that is determined by the baseball player's speed, agility and baseball wits. In addition, defensive ability is the one to catch and throw the ball in the case of a in-fielder or out-fielder. Defensive ability is determined by a baseball player's dexterity, accuracy and judgment. In addition, teamwork minds are important because baseball is a team sport. Theses are determined by a baseball player's coordination, communication and leadership. In this paper, we study the Keras supervised learning prediction model method for predicting high school hitters' professional baseball nominations using Tensorflow. To this end, batters' batting average and OPS are used as learning data, and prediction model are implemented and performance is evaluated. Based on this one, it is possible to predict which hitters will be drafted in professional baseball player."
약한 지도학습을 이용한 오토인코더 기반 오디오 데이터 이상 탐지 알고리즘의 성능 향상,2023,"['Anomaly detection', 'Artificial neural network', 'Autoencoder', 'Weakly supervised learning', '이상 탐지', '인공신경망', '오토인코더', '약한 지도학습']","최근 산업시설의 고장 및 진단을 위해 딥 러닝을 이용한 이상 탐지 기술이 큰 관심을 얻고 있다. 일반적으로 고장 진단 및 예측 분야는 다른 분야와는 달리 이상 데이터가 정상 데이터 수에 비해 현저히 적다는 특징이 있다.따라서, 대부분의 데이터가 정상이라고 가정하고 데이터의 레이블 없이 학습하는 비지도 학습을 적용하는 것이 일반적이다. 하지만, 대부분의 정상 데이터로만 학습된 모델에서 높은 정확도의 정상과 이상 데이터 분류성능을 기대하기는 어렵다. 본 논문에서는 비지도 학습의 대표적인 모델인 오토인코더의 성능을 개선하는 방법으로 소량의 이상 데이터를 학습에 사용하는 약한 지도학습 기반 오토인코더를 제안한다. 제안하는 기법이 소량의 이상 데이터만으로도 낮은 복잡도를 유지하면서 기존의 여러 이상탐지 모델 대비 성능 향상에 효과적임을 실험을 통해 보인다.",
소셜 빅데이터 분석에서 지도 학습을 이용한 노이즈 리뷰 필터링,2023,"['Social big data', 'Noise review filtering', 'Supervised learning', 'LSTM', 'BERT', '소셜 빅데이터', '노이즈 리뷰 필터링', '지도 학습', 'LSTM', 'BERT']","검색 API를 통해 수집된 소셜 리뷰에는 주어진 검색어와 상관없는 리뷰가 다수 포함되어 있을수 있으며, 이들 리뷰는 왜곡된 분석 결과를 초래할 수 있어 노이즈 리뷰로 지칭된다. 본 논문에서는 노이즈 리뷰를 효과적으로 필터링하기 위한 지도 학습 알고리즘들을 소개하고, 실험을 통해 이들의 성능을 비교한다. 실험에는 울산광역시의 관광지를 대상으로 수집된 2만여 개의 리뷰가 이용되었으며, 학습 알고리즘으로는 텍스트 처리에 높은 정확도를 제공하는 것으로 알려진 LSTM과BERT를 이용하였다. 실험 결과, BERT의 정확도가 LSTM에 비해 우수했으며, 두 알고리즘의 f1-스코어는 각각 90.1%와 95.2%로 조사되었다. 반면, 실행시간 측면에서는 LSTM이 BERT에 비해 5배정도 빠른 성능을 제공하였다. 따라서 노이즈 리뷰 필터링 문제에 있어 정확도가 중요한 경우BERT가, 성능이 중요하거나 컴퓨팅 자원이 부족한 경우는 LSTM이 보다 적절하게 이용될 수 있다.","Social reviews collected through the search API may include a large number of reviews unrelated to a given search term, and these reviews are referred to as noise reviews because they may lead to distorted analysis results. In this paper, we discuss supervised learning algorithms to conduct filtering of the noise reviews efficiently, and compare their performance through experiments. About 20,000 reviews collected for tourist attractions in the Ulsan metropolitan city were used for the experiments, and LSTM and BERT, which are known to provide high accuracy in text processing, were adopted for training and testing the reviews. As a result, BERT provided better accuracy than LSTM, where f1-scores of the two algorithms were 90.1% and 95.2%, respectively. On the other hand, in terms of execution time, LSTM was about 5 times faster than BERT. The result shows that, in the noise review filtering, BERT can be used more properly when accuracy is important, whereas LSTM can be used more properly when performance is important or computation resources are insufficient."
그래프 임베딩 및 준지도 기반의 이더리움 피싱 스캠 탐지,2023,,최근 블록체인 기술이 부상하면서 이를 이용한 암호화폐 플랫폼이 늘어나며 화폐 거래가 활발이 이뤄지고 있다. 그러나 암호화폐의 특성을 악용한 범죄 또한 늘어나 문제가 되고 있다. 특히 피싱 스캠은 이더리움 사이버 범죄의 과반수 이상을 차지하며 주요 보안 위협원으로 여겨지고 있다. 따라서 효과적인 피싱 스캠 탐지 방법이 시급하다. 그러나 전체 이더리움 참여 계정 주소에서 라벨링된 피싱 주소의 부족으로 인한 데이터 불균형 문제로 지도학습에 충분한 데이터 제공이 어려운 상황이다. 이를 해결하기 위하여 본 논문에서는 이더리움 트랜잭션 네트워크를 고려한 효과적인 그래프 임베딩 기법인 trans2vec과 준지도 학습 모델 tri-training을 함께 사용하여 라벨링된 데이터 뿐만 아니라 라벨링되지 않은 데이터도 최대한 활용하는 피싱 스캠 탐지 방법을 제안한다.,
학습 장학의 개념 탐색,2023,"['장학', '학습 장학', '교수 중심 장학', '교사 전문성', 'supervision', 'learning Supervision', 'teaching-centered supervision', 'teacher expertise']","이 연구의 목적은 기존의 장학이 교수 중심 장학이라고 보고 그와 대비되는 학습 장학의 의미와 필요성, 절차 등에 대해 제안함으로써 학습자의 주도성이 강조되는 시대에 적합한 장학의 새로운 패러다임에 대한 논의에 이바지하고자 하는 데 있다. 우선, 장학이 교수-학습 활동에 대한 지도․조언이라는 점에 착안하여 교수 중심 장학과 학습 장학을 구분하고 학습 장학과 학습 컨설팅을 비교하여 학습 장학의 특성을 드러내고자 하였다. 이어서 학습 장학의 필요성을 장학의 본질 회복, 여건 변화에 따른 교육 패러다임의 변화, 교사의 과도한 책임 완화 측면에서 제시하였다. 학습 장학의 유형과 원리, 절차도 예시하였다. 마지막으로 학습 장학의 정착을 위한 제언을 제시하였다.","The purpose of this study is to contribute to the discussion of new paradigm of supervision suitable for the era in which the initiative of learners is emphasized by suggesting the meaning, necessity, and procedures of learning supervision in contrast with existing supervision as teaching-centered supervision. First, focusing on the fact that supervision is guidance and advice for teaching-learning activities, this study tries to reveal the characteristics of learning supervision by distinguishing learning-centered supervision from teaching-centered supervision and comparing learning supervision with learning consulting. Subsequently, the necessity of learning supervision is presented in terms of restoring the nature of supervision, change in the educational paradigm according to changing conditions, and relieving the excessive responsibility of teachers. The types and principles of learning supervision are exemplified and the example of the process of learning supervision presented. Finally, suggestions for the settlement of learning supervision are presented."
철저한 대조 학습 방법을 통한 생성적 적대 신경망의 불균형 데이터 생성품질 향상,2023,"['data imbalance', 'generative adversarial nets', 'contrastive learning', 'data augmentation', 'metric learning', '데이터 불균형', '생성적 적대 신경망', '대조 학습', '데이터 증강', '거리 학습']","딥러닝(Deep learning) 알고리즘의 성능이 향상되면서 실세계의 다양한 문제를 해결하기 위한 방법으로 사용되고 있다. 실세계를 반영하는 데이터의 경우 사건의 발생 빈도나 수집 난이도에 따라 데이터의 불균형(Imbalance)이 나타날 수 있다. 데이터를 구성하는 클래스의 수가 일정하기 않은 데이터를 불균형 데이터라고 하며, 특히 데이터가 상대적으로 적은 소수 클래스는 딥러닝 알고리즘을 통해 학습하기 어렵다. 최근에는 데이터 증강을 위한 방법으로 생성적 적대 신경망(Generative Adversarial Nets, GANs)이 응용되고 있으며, 소수 클래스 학습을 위해 자기 지도 학습(Self-supervised learning)기반의 사전 학습(Pre-training)이 제안되었다. 하지만 생성 모델(Generative Model)을 학습하는 과정에서 불균형 데이터의 클래스 정보를 활용하기 때문에 소수 클래스의 학습이 제대로 이루어지지 않아 생성 데이터의 품질이 떨어지는 문제가 나타난다. 이러한 문제를 해결하기 위하여 본 논문에서는 유사도 기반의 철저한 대조 학습(Exhaustive Contrastive Learning) 방법을 제안하였다. 제안 방법은 프레쳇 인셉션 거리(Frechet Inception Distance, FID)와 인셉션 점수(Inception Score, IS)를 통해 정량적으로 평가하였다. 본 논문에서 제안하는 방법은 기존 방법보다 프레쳇 인셉션 거리는 16.32, 인셉션 점수는 0.38의 성능 개선을 확인하였다.","As the performance of deep learning algorithms has improved, they are being used as a way to solve various problems in the real world. In the case of data that reflect the real world, imbalance data may occur depending on the frequency of occurrence of events or the difficulty of collection. Data with an inconsistent number of classes that make up the data are called imbalance data, and in particular, it is difficult to learn the minority classes with relatively little data through Deep Learning algorithms. Recently, Generative Adversarial Nets (GANs) have been applied as a method for data augmentation, and self-supervised learning-based pre-learning has been proposed for minority class learning. However, because class information of imbalance data is utilized in the process of learning the Generative Model, the quality of generated data is poor due to poor learning of minority classes. To solve this problem, this paper proposes a similarity-based exhaustive contrast learning method. The proposed method is quantitatively evaluated through the Frechet Inception Distance (FID) and Inception Score (IS). The method proposed in this paper confirmed the performance improvement of the Frechet Inception Distance of 16.32 and the Inception Score of 0.38, as compared to the existing method."
라플라스 영역 파동장을 이용한 딥러닝 탄성파 역산,2023,"['딥러닝', '탄성파 역산', '라플라스 영역 파동장', 'deep-learning', 'seismic inversion', 'Laplace-domain wavefield']","지도 학습 기반 딥러닝 탄성파 역산은 소규모 영역을 대상으로 하는 합성 자료 예제에서 성공적인 역산 성능을 보여주었다. 지도 학습 기 반 딥러닝 탄성파 역산은 시간 영역 파동장을 입력, 지하 속도 모델을 출력으로 사용하는데, 시간 영역 파동장은 다양한 파동 정보를 포 함하고 있어 자료의 크기가 상당히 크다. 따라서 대량의 데이터로 훈련하는 지도 학습 기반 딥러닝 탄성파 역산을 현장 규모의 자료에 적 용하는 연구는 아직까지 수행되지 못하고 있다. 본 연구에서는 지도 학습 기반 딥러닝 탄성파 역산 기법을 현장 규모의 자료에 적용하기 위해 시간 영역 파동장 대신 라플라스 영역 파동장을 입력으로 사용하여 지하 속도 모델을 예측하였다. 시간 영역 파동장 대신 라플라스 영역 파동장을 사용하면 결과의 해상도는 다소 떨어지지만 입력 자료의 크기가 크게 감소하여 신경망 훈련이 빨라지게 된다. 또한, 큰 격 자 간격을 사용할 수 있어 현장 자료 크기의 속도 모델을 효율적으로 예측할 수 있으며 이를 통해 얻은 결과는 후속 역산의 초기 모델로 사용될 수 있다. 신경망 훈련을 위해 현장 자료 크기를 가지는 대량의 합성 속도 모델과 라플라스 영역 파동장을 생성한 후 인공 합성 자 료만으로 신경망을 훈련시켰다. 또한, 해양 탄성파 탐사를 시뮬레이션하기 위해 견인 스트리머 취득 조건을 채택하였다. 테스트 자료와 벤 치마크 모델을 이용한 수치 예제에서 훈련된 신경망을 테스트한 결과, 적절한 배경 속도 모델들을 얻을 수 있었다.","The supervised learning-based deep-learning seismic inversion techniques have demonstrated successful performance in synthetic data examples targeting small-scale areas. The supervised learning-based deep-learning seismic inversion uses time-domain wavefields as input and subsurface velocity models as output. Because the time-domain wavefields contain various types of wave information, the data size is considerably large. Therefore, research applying supervised learning-based deep-learning seismic inversion trained with a significant amount of field-scale data has not yet been conducted. In this study, we predict subsurface velocity models using Laplace-domain wavefields as input instead of time-domain wavefields to apply a supervised learning-based deep-learning seismic inversion technique to field-scale data. Using Laplace-domain wavefields instead of time-domain wavefields significantly reduces the size of the input data, thereby accelerating the neural network training, although the resolution of the results is reduced. Additionally, a large grid interval can be used to efficiently predict the velocity model of the field data size, and the results obtained can be used as the initial model for subsequent inversions. The neural network is trained using only synthetic data by generating a massive synthetic velocity model and Laplace-domain wavefields of the same size as the field-scale data. In addition, we adopt a towed-streamer acquisition geometry to simulate a marine seismic survey. Testing the trained network on numerical examples using the test data and a benchmark model yielded appropriate background velocity models."
