title,date,keywords,abstract,multilingual_abstract
고장진단 및 예측 알고리즘을 내장한 전동기 제어용 DSP의 실용적 운용에 관한 연구,2024,"['Motor fault diagnosis', 'Motor controller', 'Deep learning', 'Mechanical fault', 'Auto-encoder', 'DSP']",,"In the fault diagnosis in electric motors, additional device is commonly required. This study proposes a solution to diagnose mechanical faults in electric motors by integrating a deep learning-based algorithm into the motor controller without additional hardware. Operating within Microcontroller Unit (MCU) memory constraints, the algorithm ensures comparable classification performance to existing methods using current signals. The chosen approach employs an auto-encoder in the MCU, adjusting neuron counts based on current signal sampling frequency and optimizing the model structure for a balance between memory usage and diagnostic success rate. The proposed model's architecture prevents interference with the control routine, showcasing stable control performance and effective fault diagnosis within the integrated system."
유한요소해석과 순환신경망을 활용한 하중 예측,2024,"['Recurrent Neural Network', 'Finite Element Analysis', 'Crawler Crane', 'Load Detection']",,"Artificial Neural Networks that enabled Artificial Intelligence are being used in many fields.  However,  the  application  to  mechanical  structures  has  several  problems  and research is incomplete. One of the problems is that it is difficult to secure a large amount  of  data  necessary  for  learning  Artificial  Neural  Networks.  In  particular,  it  is important  to  detect  and  recognize  external  forces  and  forces  for  safety  working  and accident  prevention  of  mechanical  structures.  This  study  examined  the  possibility  by applying the Current Neural Network of Artificial Neural Networks to detect and recognize the load on the machine. Tens of thousands of data are required for general learning  of  Recurrent  Neural  Networks,  and  to  secure  large  amounts  of  data,  this paper  derives  load  data  from  ANSYS  structural  analysis  results  and  applies  a  stacked auto-encoder  technique  to  secure  the  amount  of  data  that  can  be  learned.  The usefulness of Stacked Auto-Encoder data was examined by comparing Stacked Auto-Encoder  data  and  ANSYS  data.  In  addition,  in  order  to  improve  the  accuracy  of detection  and  recognition  of  load  data  with  a  Recurrent  Neural  Network,  the  optimal conditions are proposed by investigating the effects of related functions."
Decoupling Geometry from Surface Finish by  Parameterizing Texture Directly in G-code for Fused  Deposition Modeling (FDM) Printing,2024,"['3D-Printing', 'Computational Design', 'Digital Fabrication']",,"Background      Prior methods for applying auto-generated textures on a 3D model involve the construction of geometric feature layers on the top of the model surface. These geometries form a textural pattern that is effectively fused and inseparable from the underlying object. However, this interconnection makes it challenging to facilitate follow-up adjustments of the 3D model during the design process without necessitating the remodeling of parts, leading to a cumbersome process for designers and engineers.Methods           In this paper, we present Texture-Slicer , an innovative approach that addresses this issue by applying the texture patterns not during modeling, but instead during the slicing process conducted before 3D printing. This means that the 3D model remains unchanged and that a tunable texture pattern is achieved by injecting modifications of the G-code just before the printing process. Furthermore, Texture-Slicer  allows users to control the level of roughness with the texture parameters (wavelength, amplitude, and vertical spacing), supporting the creation of numerous custom textures for the same underlying geometry.Results              Technical evaluation of paradigms was conducted with 30 test samples. Then, a total of 59 texture samples were successfully printed, and an investigation of roughness perception was conducted through a preliminary user study involving 6 participants who evaluated 50 printed samples. The findings indicate that increased wavelength and amplitude created more roughly perceived textures. With vertical spacing, wavelength did not affect the perceived roughness of the texture, while amplitude did affect.Moreover, we presented practical applications that exemplify how Texture-Slicer  can be used by designers to generate diverse textures for identical objects to achieve different aesthetic or functional purposes.Conclusions     Texture-Slicer  allows designers to achieve rapid iterations and seamless texture modifications on objects without the necessity of remodeling the underlying 3D model. while enabling the encoding of various properties, such as tactile or mechanical attributes into products, all without altering the target 3D model’s surface."
다변량 시계열 환경의 산업 정보 시스템에서 해석 가능한 비지도 기계학습을 통한 이상 탐지 개선 방법,2024,"['monitoring', 'Time series', 'Anomaly Detection', 'unsupervised learning', 'Autoencoder', 'model interpretability', '.']",,"Time series anomaly detection is a technology that finds outliers in observed data over time, and is a significant research field associated with many applications or platforms. In this paper, we propose a method called Encoded-IF, a new and improved version of the isolation forest (IF) machine learning algorithm using Auto-Encoder to detect time series anomalies. Encoded-IF is a non-parametric and unsupervised method for detecting anomalies in time series data. It efficiently detects anomalies in each dimension of high-dimensional data and quickly learns nonlinear correlations between dimensions. Experiments were conducted on four publicly available time series data sets to evaluate the performance of the proposed method. The results improvement in performance of up to 4%."
Classification of Cognitive Impairment Using Quadratic Discriminant Analysis Based Spiral Dynamic Optimization Algorithm,2024,['Mild cognitive impairment  · Quadratic discriminant analysis  · Spiral dynamic optimization algorithm'],,"This research uses machine learning techniques for the classifi cation of cognitive impairment using Quadratic Discriminant Analysis (QDA) based Spiral Dynamic Optimization Algorithm (SDOA). The proposed method employs a machine learning classifi er coupled with a series of pre-processing techniques encompassing image contrast enhancement and feature extraction and selection. Linear contrast stretch is utilized for image contrast enhancement, while stacked auto-encoder (SAE) is employed for feature extraction. The feature selection process is optimized using the Adam optimizer within the QDA framework. The classifi cation process is executed through the QDA classifi er, and the obtained results are compared with those derived from CNN and QDA classifi cation methods. The primary objective of this study is to assess the eff ectiveness of the proposed machine learning method in distinguishing between Early Mild Cognitive Impairment (EMCI) and Mild Cognitive Impairment (MCI). Addressing the defi ciencies in existing research related to the early detection of MCI, the study focuses on enhancing robustness and accuracy. The fi ndings reveal that the accuracy rate of the QDA-SDOA classifi cation approach is 96%, which is a higher accuracy rate than MLSVM-RBFK, SVM-RF-MLR, NNITFS, E3DDCCN of 0.8%, 1.1.%, 1.4% and 0.9%, respectively. The classifi cation accuracy rate for meningioma MRIs highlights the superior accuracy of MCI classifi cation using QDA-SDOA in comparison to existing classifi ers."
단일 클래스 분류를 이용한 딥러닝 기반 시야 방해 탐지,2024,"['One-class Classification', 'Denoising', 'Anomaly Detection', '단일 클래스 분류', '노이즈 제거', '이상치 탐지']","영상감시는 다양한 환경에서 보안 및 감시 목적으로 광범위하게 사용되고 있을 뿐만 아니라 범죄 예방, 사건 및 사고의 기록, 자산보호, 안전관리 등 다양한 역할을 수행하고 있다. 영상감시에서 시각적 방해 영상을 식별하는 기술은 영상감시의 효율성과 신뢰성을 유지하기 위한 중요한 요소이다. 본 연구는 노이즈가 많은 야외 환경에서 영상감시에서의 시야를 방해하는 이상 영상에 대한 이상치 예측의 정확도를 향상시키고 이를 위한 비지도 학습 방식의 단일 클래스 분류 모델을 이용한 시각적 방해 영상 식별 기법을 제안한다. 제안 방법은 노이즈가 많은 실외 환경에 대응하기 위해 Denoising기법의 Denoising Auto-Encoder와 DeepSVDD를 결합한 모델을 기반으로 가우시안 노이즈 강도 변화에 따른 이상치 예측 성능을 확인하고 기존의 이상치 탐지 모델과의 성능을 비교한다. 제안 방법은 기존 모델과 비교하여 시각적 방해 영상을 식별하는데 있어서 노이즈에 더 강건한 성능을 갖고 있다.","Video surveillance is extensively used for security and surveillance purposes across various environments and also plays significant roles in crime prevention, recording incidents and accidents, asset protection, and safety management. The technology for identifying visual disturbance images in video surveillance is crucial for maintaining its efficiency and reliability. This study proposes a visual disturbance image identification technique using a one-class classification model of an unsupervised learning method to enhance the accuracy of outlier prediction for abnormal images that interfere with visibility in noisy outdoor environments. The proposed method is based on a model combining Denoising AutoEncoder and DeepSVDD, which are denoising techniques, to address environments with high noise levels. It evaluates the performance of anomaly prediction based on changes in the intensity of Gaussian noise and compares it with existing anomaly detection models. The proposed method shows more robust performance in identifying visual disturbance images against noise compared to the existing models."
Novel approaches in geomechanical parameter estimation using machine learning methods and conventional well logs,2024,"['Model evaluation', 'petrophysical data log', 'geomechanical parameters', 'CLM algorithm']",,"Today, geomechanics plays a crucial role in the oil industry, particularly in enhancing production and ensuring well stability. To achieve optimal results, accurate estimation of geomechanical parameters is essential. One of the low-cost and accurate methods for estimating geomechanical parameters is the use of intelligent methods. In this research, geomechanical parameters are estimated using conven- tional data logs using intelligent methods. The aim of this study is to introduce a new machine learning algorithm to estimate geomechanical parameters using conventional data logs in one of the hydro- carbon field wells in southwest Iran. In this article, the shear wave velocity and uniaxial compressive strength (UCS) were estimated using machine learning algorithms. Subsequently, other geomechanical parameters  were  calculated  based  on  these  estimated  parameters  derived  from  machine  learning algorithms. For shear wave velocity (Vs) prediction using MLP and CLM (CNN+LSTM+MLP) algorithms, First, effective features were selected using the Auto-encoder deep learning algorithm. The selected features  for  Vs  input  into  the  algorithms  were  Vp,  RHOB,  CALIPER,  and  NPHI,  and  then  the  Vs  is estimated with MLP and CLM algorithm."
Photovoltaic DC arc fault detection method based on deep residual shrinkage network,2024,"['Photovoltaic system', 'Arc detection', 'Deep residual shrinkage network', 'Photovoltaic system fault detection']",,"Distributed photovoltaic systems have encountered unprecedented opportunities for development given their environmentally friendly nature and flexible power generation characteristics. However, numerous connecting lines and taps within the distributed photovoltaic system can be subject to insulation issues, which will consequently cause direct current (DC) arc faults and severe electrical fire hazards. Moreover, the power semiconductor devices in the photovoltaic inverter can introduce common-mode noises to the DC current, resulting in unwanted tripping of the DC arc fault detector. The study proposes an arc fault detection method utilizing a deep residual shrinkage network (DRSN) to address this issue, thereby precisely detecting DC arc faults. A test platform for series arc faults in photovoltaic systems is built. The arc current data are collected for characteristic analysis in time and frequency domains to determine which bandwidth is preferred for the algorithm. The model’s depth is increased by introducing residual connections, enhancing its feature extraction, and improving noise reduction capabilities. The residual shrinkage network has been enhanced to prevent a computation increase from increased network depth. Introducing a convolutional auto-encoder for data dimension reduction has decreased neural network parameters, thereby improving training speed. A prototype for detecting photovoltaic DC arc faults was constructed using Raspberry Pi 4B, validating the practical application value of the proposed method. Experimental results demonstrate that the prototype for detecting photovoltaic DC arc faults successfully fulfi lls the real-time detection standard of the conduction test."
생성형 인공지능 기술의 최신 동향과 적용 사례 분석,2024,"['Generative AI', 'Generative Adversarial Network', 'Variational Auto-encoder', 'Large Language Model', 'Auto Encoder']",,"Over the past decade, artificial intelligence (AI) technology has been widely applied across various fields due to rapid advancements in machine learning and neural network technologies. These developments have opened an era of intelligent process automation in industries such as healthcare, manufacturing, finance, and automotive. Recently, the paradigm has shifted towards research on accessible AI technologies aimed at creating ecosystem environments and providing personalized services. Additionally, there has been growing interest in generative AI technologies, which create new data based on learned data. Generative AI refers to technologies that generate new content―such as text, audio, and images―in response to user requests, rather than merely learning from existing data. Due to these advantages, various research and development efforts are underway to apply generative AI technology. This paper analyzes the trends and application cases of generative AI technology by examining its main components and functions, presenting the current state of generative AI through cases studies, and discussing future challenges for improvement."
인공지능을 활용한 챔버형 반도체 제조 설비의 Fan Motor 이상감지 진단에 관한 연구,2024,"['CBM', 'Feature Engineering', 'LSTM', 'BiLSTM 오토인코더', 'Anomaly Score', 'CBM', 'Feature Engineering', 'LSTM', 'BiLSTM Auto-encoder', 'Anomaly Score']","반도체 장치산업은 막대한 투자비가 수반 되므로 생산 설비가 고유의 성능을 유지하기 위한 설비 예방보전 활동이 중요하다. 설비보전의 중요성으로 기업에서는 다양한 예방보전 활동이 진행되고 있으며, 아직은 수명에 의한 TBM(Time Base Maintenance) 형태의 예방보전에 의존하고 있다. 최근 기술 발전으로 AI 기법을 활용한 고장을 진단하고 사전 조치를 진행하는 CBM(Condition Based Maintenance) 예지보전 형태로 발전하고 있다. 본 논문에서는 반도체 챔버형 설비에서 Fan Motor 고장을 진단하기 위한 연구로 현장의 데이터와 가장 유사한 공공 데이터셋을 통해 진동신호를 AI 기법을 이용하여 고장진단 방법을 연구하였다. 첫 번째 선행연구에서 인공지능 딥러닝 기법으로 3가지 모델인 DNN, RNN, CNN로 고장을 예측하였고, 진동 신호 4개를 Feature Engineering을 통해 19개로 확대하여 동일하게 3가지 모델로 고장 예측을 비교 분석하여 모델 알고리즘의 성능을 개선하였다. 아울러 대부분의 AI 연구는 배치 단위의 시계열 데이터를 통한 고장진단 방법론을 연구하고 있다. 반도체 생산 현장은 24시간 가동되는 장비이므로 스트리밍 상태의 실시간 기반의 데이터를 활용하여 정상데이터를 학습하고 이상 데이터가 감지되면, 고장으로 분류가 가능한 오토인코더 기법을 활용하여 성능을 검증하고 고장진단 방법을 연구하였다. 본 연구에서 시사하는 바는 통상적인 인공지능 기법으로 알고리즘 성능을 개선하는 연구에서 한 단계 진전되어 Feature Engineering을 통한 성능개선을 진행하였다. 산업 현장에서 실제 적용이 가능한 오토인코더 알고리즘을 접목하여 고장 예측을 시각화하고, 정상상태를 학습하여 Anomaly Score을 예측하고, 이상 데이터가 발생 시 차이를 분석하여 고장 예측이 가능한 것을 검증하였다. 또한, 정상데이터의 학습데이터로 이상 데이터 예측이 가능하므로 정상학습 데이터의 Anomaly Score 최댓값으로 이상치를 등급화할 수 있다. 설비의 보전상태를 정상가동, 모니터링 상태, 보전상태 등으로 분류가 가능한 예지보전 시스템을 구현하는데 활용될 수 있다.","Since semiconductor device industry requires enormous investment costs, preventive maintenance activities are important to ensure that production equipment maintains its unique performance. Due to the importance of equipment maintenance, various preventive maintenance activities are being carried out by manufactures, and they still rely on preventive maintenance in the form of TBM (Time Base Maintenance) based on lifespan. With technological advancements, it is developing into a form of predictive maintenance that uses AI techniques to diagnose failures and take proactive measures. In this paper, a study was conducted to diagnose fan motor failure in semiconductor chamber-type equipment, and a failure diagnosis method was studied using vibration signals using AI techniques through similar data sets. First, in previous research, failure was predicted using three models (DNN, RNN, CNN) using artificial intelligence deep learning techniques, and the four vibration signals were expanded to 19 through feature engineering to compare failure predictions using the same three models. Through analysis, the performance of the model algorithm was improved. In addition, most AI research studies failure diagnosis methodologies through batch-level time series data. Since semiconductor production sites are equipment that operates 24 hours a day, normal data is learned using streaming real-time data, and when abnormal data is detected, the autoencoder technique is used to classify it as a failure, to verify performance and diagnose failures. was studied. The implication of this study is that it is a step forward from research on improving algorithm performance using typical artificial intelligence techniques, and has progressed to improve performance through feature engineering. We visualized failure prediction by incorporating an autoencoder algorithm that can be actually applied in industrial sites, predicted anomaly scores by learning normal states, and analyzed the differences when abnormal data occurs to verify that failure prediction is possible. In addition, since abnormal data can be predicted using normal learning data, outliers can be graded by grade based on the maximum Anomaly Score of normal learning data. It can be used to implement a predictive maintenance system that can classify the maintenance status of facilities into normal operation, monitoring status, and maintenance status."
Exploring lifestyle patterns from GPS trajectory data: embedding spatio-temporal context information via geohash and POI,2024,['Smartphone GPS trajectory · Lifestyle pattern mining · POI · Geohash · Auto-encoder · t-SNE · HDBSCAN'],,"This study explored the growing potential for knowledge discovery from GPS-based trajectory data across various domains, including urban planning and transportation systems. We analyzed the temporal and spatial data from GPS-derived stay points to examine life patterns. Stay points indicate specific geographic locations and provide data on the occurrence and duration of stays. We extracted these stay points from the GPS trajectory data and organized them into temporal sequences.Each sequence was transformed into a vector, incorporating Points of Interest, geohash codes, occurrence times, and duration times. Using representation learning, we reduced the dimensionality of these vectors and applied clustering techniques to identify distinct life pattern. Our analysis revealed five distinct patterns: locally active, student, school-centric, worker, and homebody. This research makes significant contributions to fields such as urban planning by integrating spatial characteristics with temporal and semantic information in life pattern analysis. The application of representation learning has enabled the discovery of meaningful life patterns from GPS-based trajectories."
기계 장비의 장단기 운용을 고려한 Long Short-Term Memory 기법에 의한 하중 인식,2024,"['Finite Element Analysis(유한요소해석)', 'Long Short-Term Memory(장단기 기억 메모리)', 'Stacked Auto Encoder(스택형 자동인코더)', 'Crawler Crane(크롤러 크레인). Load Detection(하중인식)']",,"Artificial Neural Network has been developed to enable the intelligence of mechanical equipment and devices. However, research on the intelligence of mechanical structures is rare. This study examined the possibility of learning structural loads, which is an important factor in the design and analysis of machines, using long short-term memory (LSTM), which is a Recurrent Neural Network. Because the machine structure operates for a long time, the investigation of the possibility of load learning using Long Short-Term Memory with a memory function for the short and long terms can have important implications for recognizing and predicting accidents and damage during the operation period. Depending on the size of the load, the data entered sequentially tended to be related to predictive accuracy, from relatively old low loads that required long-term memory to large loads that required new and short-term memory. Because the amount of data obtained by structural analysis is insufficient for learning Artificial Neural Networks, its usefulness was confirmed by investigating the possibility of utilizing the data that amplified the data calculated as a result of the structural analysis using the stacked autoencoder."
시계열 데이터에 대한 특징 추출 기반 이상 탐지,2024,"['신호 데이터', '시계열 데이터', '특징 추출', '이상 탐지', '오토 인코더', 'Signal Data', 'Time-series Data', 'Feature Extraction', 'Anomaly Detection', 'Auto Encoder']",,
합성곱 신경망에 의한 과도 하중 감지에 대한 연구,2024,"['Convolutional Neural Network(합성곱 신경망)', 'Crawler Crane(크롤러 크레인)', 'Finite Element Analysis(유한요소해석)', 'Stacked Auto Encoder(스택형 자동인코더)', 'Load Detection(하중인식)']",,"Accurate load detection is important for the safe operation of mechanical structures. This study attempts toincorporate convolutional neural network technology to improve the accuracy of load detection. To increase thedetection accuracy of the excessive external load applied to the mechanical structure, it is necessary to check theamount of learning data along with the application of the Convolutional Neural Network technique of the artificialneural network. In this study, the amount of analysis data of the mechanical structure was insufficient forConvolutional Neural Network learning; therefore, the application of the stacked auto code technique was examinedas a method of securing the amount of data required for Convolutional Neural Network learning. In addition,appropriate conditions were suggested by researching the procedure of the Convolutional Neural Network for loaddetection and conditions appropriate for each function and variable. The accuracy was verified by detecting thehoisting load of the crawler crane from the load of the roller, which was the lower structure. The results of thisstudy can be applied to the analysis and design of various mechanical structures, and the possibility of using aConvolutional Neural Network to ensure machine safety and prevent accidents was verified."
