title,date,keywords,abstract,multilingual_abstract
배 병해충 이미지 분류를 위한 딥러닝 최적 모델 선택에 관한 연구,2024,"['배 병해충', '딥러닝 모델', '이미지 분류', '검역', '데이터 증강', 'Pear Pests and Diseases', 'Deep Learning Models', 'Image Classification', 'Quarantine', 'Data Augmentation']",,"With the increase in agricultural exports, pest and disease quarantine measures have been strengthened globally. Upon detection of pests or diseases in agricultural products, the entire shipment must be recalled or discarded. Therefore, detecting pests during the post-harvest sorting process is critical. This study aims to identify the optimal deep-learning model for classifying healthy and pest-infested pears during sorting. To achieve this, a dataset was created by collecting images of pest-infested pears under conditions similar to publicly available healthy pear images. The study compares CNN-based models (ResNet, MobileNet, EfficientNet, ConvNext) and a transformer-based model (ViT) using the dataset. Standard learning parameters and data augmentation techniques were also evaluated. Accuracy and Grad-CAM were used to analyze model performance. The results indicate that ResNet101 achieved the best performance based on accuracy and Grad-CAM."
DNN을 위한 비트 단위 파라미터 조작 프레임워크 및 파라미터와 정확도 간의 상호 연관성 분석,2024,"['딥 뉴럴 네트워크', '파라미터', '비트 연산', '정확도', '강인성', 'Deep Neural Network', 'parameters', 'bit-wise operations', 'accuracy', 'robustness']","최근 DNN이 다양한 산업에 확산되면서 IoT 기기 및 엣지 컴퓨팅에 적합한 경량 모델에 관한 연구가 급증하고 있 다. 본 논문에서는 기존에 없던 딥러닝 모델의 파라미터를 1 비트 단위로 조작할 수 있는 자동화 프레임워크를 개발 하며 파라미터 비트와 모델 정확도 사이의 관계를 실험 및 연구한다. 본 연구는 제안된 프레임워크를 사용하여 ImageNet 데이터셋으로 사전 학습된 DNN 모델 중 CNN 모델들의 파라미터를 하위 n-bit를 0, 1 또는 랜덤한 값으로 치환하는 3가지 방법을 통해 각각 정보 손실 발생시키면서 파라미터와 정확도 간의 강인성을 비트 단위로 실험하였다. 주요 모델로는 InceptionV3, InceptionResnetV2, ResNet50, Xception, DenseNet121, Mobile NetV1, MobileNetV2 을 사용하였다. 실험 결과, 성능이 낮은 모델일수록 하위 비트의 정보 손실에 민감하여 성 능이 좋은 모델보다 정확도를 유지하는 비트 수가 적다는 것을 실험적으로 확인했고, 파라미터와 정확도 간의 강인 성이 높다는 것을 확인하였다. 이러한 실험을 바탕으로 모델별 유효 파라미터 비트를 설정하여 파라미터를 줄이며 정확도를 유지할 수 있다.","Recently, with the proliferation of DNNs in various industries, there has been a surge in research on lightweight models suitable for IoT devices and edge computing. In this paper, we propose an automated framework that enables manipulation of deep learning model parameters at a 1-bit level, a capability not previously available. We investigate the relationship between parameter bits and model accuracy. Using the developed framework, we systematically experimented with the parameters of CNN models pre-trained on the ImageNet dataset by setting the lower n-bit to 0, 1, or a random value while each method inducing distinct information loss. The primary models evaluated include InceptionV3, InceptionResnetV2, ResNet50, Xception, DenseNet121, MobileNetV1, and MobileNetV2. Experimental results show that models with lower performance are more sensitive to information loss in the lower bits, requiring fewer bits to maintain accuracy compared to high-performing models. This concludes a high robustness between parameters and accuracy."
생체정보 보호를 위한 CNN 기반의 홍채 지문 영역 분할,2024,"['Segmentation', 'Detection', 'Artificial Intelligence Learning', 'Biometric Information', 'CNN', '영역 분할', '감지', '인공지능 학습', '생체 정보', '합성곱 신경망 모델']","스마트 기기의 발달과 고해상도 이미징 기술의 대중화로 인해, 지문이 노출되거나, 화상 회의, 화상 통화 등 고화질 얼굴 사진에서 홍채 정보가 노출되고 있다. 스마트기기의 대중화는 일상적인 디지털 활동에서 무분별한 사진 공유로 인해, 개인의 생체정보인 지문이나 홍채가 노출되어 위조 및 악용될 가능성이 높아지고 있다. 이러한 문제를 해결하기 위해서 본 논문에서는 원본 이미지로부터 생체정보를 보호하고 보안을 강화할 목적으로 CNN의 영역 분할기법을 활용하여 이미지 내 지문과 홍채를 식별 보호하는 방안을 제안한다. 제안된 모델은 입력 이미지에서 지문 및홍채를 식별한 후 해당 영역에 블러 처리를 적용하며, 이를 원본 이미지와 결합하여 보안성을 강화한다. U-Net 및ResNet-34를 백본으로 사용한 모델 구조를 통해 학습 시간 및 성능을 비교한다.","With the development of smart devices and the popularization of high-resolution imaging technology, fingerprints arebeing exposed, and iris information is being exposed in high-definition facial photos such as video conferences and videocalls. The popularization of smart devices has increased the possibility of personal biometric information such asfingerprints and irises being exposed and forged and misused due to indiscriminate photo sharing in everyday digitalactivities. To solve this problem, this paper proposes a method to identify and protect fingerprints and irises in imagesby utilizing CNN's region segmentation technique for the purpose of protecting biometric information from the originalimage and enhancing security. The proposed model identifies fingerprints and irises in the input image, applies blurringto the corresponding regions, and combines them with the original image to enhance security. The learning time andperformance are compared through model structures using U-Net and ResNet-34 as backbones."
볼륨-플로우 그래프 기반 폐질환 분류를 위한앙상블 딥러닝 모델,2024,"['합성곱 신경망', '앙상블 딥러닝 모델', '폐질환', '볼륨-플로우 그래프', 'Convolutional Neural Network', 'Ensemble Deep Learning Model', 'Pulmonary Disease', 'Flow Volume Loops']","만성 폐쇄성 폐질환은 만성적인 기도 폐쇄를 특징으로 하는 호흡기 질환이다. 만성 폐쇄성폐질환은 초기에 자각 증상이 거의 없어, 대부분 중증 상태로 악화된다. 또한, 인종, 성별, 키,몸무게 등 다양한 요인을 포함한 폐 질환 분류 회귀식은 복잡하고, 정확한 판별을 위해서는지속적인 갱신을 필요로 한다. 따라서 폐질환의 초기 진단이 용이하도록 간편한 휴대형 페기능 검사기를 통해 산출 가능한 볼륨-플로우 그래프 이미지 기반 분류 모델이 요구된다.본 논문에서는 폐질환 조기 진단을 위해 볼륨-플로우 그래프 이미지의 전처리 및 합성곱 신경망 기반 앙상블 딥러닝 모델을 구현하였고, 이를 검증했다. 합성곱 신경망 기반 앙상블 딥러닝 모델은 VGG16, VGG19, ResNet50, 그리고 MobileNet 구조 기반 4개의 모델로 구성되며, 전부 전이학습 및 미세조정하여 사용하였다. 세부적으로는 부족한 수의 학습 데이터를볼륨-플로우 그래프 이미지의 특성을 고려하여 적합한 데이터 증강기법을 적용하였고, 4개의 모델들은 가중치 기반의 간접투표 방식을 사용했다. 최종 앙상블 모델은 단순히 폐질환유무를 판별하는 것이 아닌 정상, 제한성 폐질환, 폐쇄성 폐질환, 그리고 혼합성 폐질환과 같이 총 4개의 클래스로 분류하는 모델임에도 불구하고, 테스트 데이터를 통한 성능은 정확도90.91%, 가중치 평균 정밀도 91.11%, 가중치 평균 재현율 90.91%로 높은 수치를 보였다.","Chronic Obstructive Pulmonary Disease (COPD) is a respiratory disease characterized bychronic airway obstruction. COPD often progresses to a severe stage, since thereare few noticeable symptoms in the early stages. Also regression equations involingvarious factors such as race, gender, height, and weight to determine whether ornot there is pulmonary disease is complex and needs to be updated periodically.Therefore, there is a demand for a system that can easily analze the presence orabsence of the pulmonary disease, even for non-experts. In this paper, aCNN-based flow volume loops classification model using ensemble learning andappropriate data pre-processing algorithms was proposed and validated to diagnosepulmonary disease in the early stages. The ensemble model was organized by fourCNN models based on VGG16, VGG19, Resnet50, and MobileNet and used transferlearning and fine-tuning for each pre-trained model. Specifically, to overcome asmall amount of data, several data augmentation techniques that took into accountthe characteristics of flow volume loops were used, and soft voting was employedfor the ensemble model. The proposed ensemble model not only could diagnose thepresence or absence of pulmonary disease but could also classify into a total of fourcategories: normal, restrictive, obstructive, and combined pulmonary diseases. As aresult of the experiment, the performance of the proposed ensemble model showedan accuracy of 90.91%, precision of 91.11%, and recall of 90.91%."
흉부 X-선 영상을 이용한 Vision transformer 기반 폐렴 진단 모델의 성능 평가,2024,"['딥러닝', '폐렴 진단', '흉부 X-선 영상', 'Vision transformer', 'Deep learning', 'Pneumonia detection', 'Chest X-ray image']",,"The various structures of artificial neural networks, such as convolutional neural networks (CNNs) and recurrent neural networks (RNNs), have been extensively studied and served as the backbone of numerous models. Among these, a transformer architecture has demonstrated its potential for natural language processing and become a subject of in-depth research. Currently, the techniques can be adapted for image processing through the modifications of its internal structure, leading to the development of Vision transformer (ViT) models. The ViTs have shown high accuracy and performance with large data-sets. This study aims to develop a ViT-based model for detecting pneumonia using chest X-ray images and quantitatively evaluate its performance. The various architectures of the ViT-based model were constructed by varying the number of encoder blocks, and different patch sizes were applied for network training. Also, the performance of the ViT-based model was compared to the CNN-based models, such as VGGNet, GoogLeNet, and ResNet. The results showed that the traninig efficiency and accuracy of the ViT-based model depended on the number of encoder blocks and the patch size, and the F1 scores of the ViT-based model ranged from 0.875 to 0.919. The training effeciency of the ViT-based model with a large patch size was superior to the CNN-based models, and the pneumonia detection accuracy of the ViT-based model was higher than that of the VGGNet. In conclusion, the ViT-based model can be potentially used for pneumonia detection using chest X-ray images, and the clinical availability of the ViT-based model would be improved by this study."
BCED-Net: Breast Cancer Ensemble Diagnosis Network using transfer learning and the XGBoost classifier with mammography images,2024,"['Breast cancer classification', 'Feature extraction and concatenation', 'Performance evaluation', 'XGBoost classifier']",,"Objectives Breast cancer poses a significant global health challenge, characterized by complex origins and the potential for life-threatening metastasis. The critical need for early and accurate detection is underscored by the 685,000 lives claimed by the disease worldwide in 2020. Deep learning has made strides in advancing the prompt diagnosis of breast cancer. However, obstacles persist, such as dealing with high-dimensional data and the risk of overfitting, necessitating fresh approaches to improve accuracy and real-world applicability.Methods In response to these challenges, we propose BCED-Net, which stands for Breast Cancer Ensemble Diagnosis Network. This innovative framework leverages transfer learning and the extreme gradient boosting (XGBoost) classifier on the Breast Cancer RSNA dataset. Our methodology involved feature extraction using pre-trained models—namely, Resnet50, EfficientnetB3, VGG19, Densenet121, and ConvNeXtTiny—followed by the concatenation of the extracted features. Our most promising configuration combined features extracted from deep convolutional neural networks—namely Resnet50, EfficientnetB3, and ConvNeXtTiny—that were classified using the XGBoost classifier.Results The ensemble approach demonstrated strong overall performance with an accuracy of 0.89. The precision, recall, and F1-score values, which were all at 0.86, highlight a balanced trade-off between correctly identified positive instances and the ability to capture all actual positive samples.Conclusion BCED-Net represents a significant leap forward in addressing persistent issues such as the high dimensionality of features and the risk of overfitting."
Vision Transformer를 활용한 운전자 이상행동 분류 딥러닝 시스템,2024,"['도로 교통', '운전자 이상행동', '딥러닝', 'Vision Transformer', 'Road traffic', 'Driver abnormal behavior', 'Deep learning', 'Vision Transformer']","도로 교통 사고와 교통 위반 행동은 현대 사회에서 급증하는 문제로, 이에 대한 효과적인 대응이 필요하다. 이러한 사고와 위반 행동은 세계적으로 증가하는 추세를 보이며, 그로 인한 사회 및 경제적 영향은 상당히 심각하다. 주로 운전자의 부주의로 발생하는 도로 교통 사고를 예방하기 위해, 딥러닝과 머신러닝을 활용한 시스템이 구축되고 있다. 이전의 연구 들은 주로 운전자의 이미지를 기반으로 한 모델을 사용하여 운전자의 이상행동을 감지하는 데 초점을 맞추었다. 그러나 이러한 기존 연구들은 대부분 컨볼루션 기반의 모델을 사용하여 운전자의 이상행동을 감지하고 분류하는 데 중점을 두고 있다. 컨볼루션 기반 모델은 초기 학습 단계에서 이미지에서 특정 패턴 및 특징을 학습하고, 이를 고정된 크기의 필터로 추출하는 특징이 있다. 이는 다양한 운전 상황에 대한 적응성이 제한된다는 한계가 있다. 따라서 본 논문은 컨볼루션 기반 모델의 한계를 극복하고자, Vision Transformer 모델을 활용한 운전자 이상행동 분류 모델을 구축하였다. 해당 모델의 우수성을 확인하기 위해 기존 연구에서 사용된 ResNet-101, VGG19, Xception, ConvNeXt 등의 모델과 분류 성능 평가 지표를 기반으로 비교 분석을 실시하였다. 비교 분석 결과, Vision Transformer 모델이 기존의 컨볼루션 기반 모델들보다 탁월한 성능을 보여주었다. 이러한 결과는 Vision Transformer의 학습 방식이 다양한 특징 및 패턴을 효과적으로 학습하고 이를 활용할 수 있음을 시사한다. 본 연구는 도로 교통 안전성 향상을 위한 혁신적인 모델의 가능성을 제시하며, 더 나아가 안전 운전 문화의 정착과 사회적 이익을 증진시킬 수 있다.","The surge in road traffic accidents and traffic violations is a pressing issue in modern society, demanding effective responses. These incidents display a global upward trend, with significant societal and economic repercussions. To mitigate road accidents, primarily caused by driver negligence, systems leveraging deep learning and machine learning are being developed. Previous research has predominantly focused on models based on driver images for detecting abnormal driving behavior, with a predominant emphasis on convolutional models. Convolutional models learn specific patterns and features from images during the initial stages of training, extracting them using fixed-size filters, thereby limiting adaptability to diverse driving scenarios. This paper addresses the limitations of convolutional models by introducing a driver abnormal behavior classification model using the Vision Transformer. To validate the superiority of this model, a comparative analysis was conducted with well-established models such as ResNet-101, VGG19, Xception, and ConvNeXt, employing classification performance metrics from previous studies. The results of the comparative analysis demonstrate that the Vision Transformer model outperforms traditional convolutional models. This outcome indicates the effectiveness of Vision Transformer’s learning approach in efficiently capturing and utilizing various features and patterns. This research not only presents the potential for an innovative model to enhance road traffic safety but also pledges to contribute to the establishment of a safety-oriented driving culture and the enhancement of societal benefits."
A study of Strawberry Maturity Classification Using Improved Faster R-CNN,2024,"['Convolutional Neural Network (CNN)', 'Faster R-CNN', 'Image Classification', 'RoI Align', 'Strawberry Maturity']",,"In strawberry cultivation, maturity classification plays an important role in ensuring the efficiency and quality of harvesting. In this study, we propose an Improved Faster R-CNN model to address these challenges, using MobileNetV3-Large as the backbone network to achieve a lightweight model, and introducing RoI Align to improve the spatial accuracy of the feature map. Experiments are conducted using the KGCV_Strawberry dataset, with precision, recall, F1 score, and mean average precision (mAP) measured for performance evaluation. The experimental results show that the proposed model achieves an average precision of 71.35%, recall of 71.07%, and F1 score of 71.21% across all classes. In particular, the proposed model achieves 63% performance on mAP0.5 and 58% performance on mAP0.5:0.95, which is comparable to existing ResNet-based models while achieving faster inference speed. The proposed model achieves a processing speed of 27.6543 ms, which is about 2 ms faster than existing ResNet-based models. This indicates that the goal of creating a lightweight model with improved image processing capability was achieved with minimal performance degradation. This research is expected to contribute to the development of automated strawberry cultivation systems in greenhouse environments and has the potential to be applied to various agricultural environments in the future."
시간-주파수 도메인 변환 및 W2GAN-GP 모델 기반의 향상된 오디오 데이터 증강,2024,"['Audio augmentation', 'WGAN-GP', 'Time-frequency transformation', 'Speech classification', 'Imbalanced data']","최근 딥러닝 기술은 다양한 분야의 분류 시스템에 활용됨에 따라 점차 딥러닝 모델의 성능을 극대화하기 위한 연구가 활발하게 진행되고 있다. 딥러닝 모델의 성능은 학습 데이터의 양과 품질에 따라 많은 영향을 받으며, 딥러닝 모델은 깊고 복잡하게 설계될수록 더 많은 학습 데이터가 요구된다. 또한 학습 데이터가 부족하거나 클래스 간의 데이터 불균형이 존재할 경우, 과 적합 현상이 발생하며 성능이 저하되는 문제가 발생한다. 음성 및 오디오를 활용하는 분야에서 분류 성능을 높이기 위해서 학습 데이터 확장 및 클래스 간 불균형 문제는 중요한 이슈이며, 이를 해결하기 위한 연구는 반드시 필요하다. 본 논문에서는 2차원 이미지 증강을 위해 고안된 WGAN 모델을 개선하여 1차원 오디오 신호를 효과적으로 증강하는 W2GAN-GP 증강 모델을 제안한다. 원 신호 데이터를 입력 받아 시간-주파수 변환 기법을 이용하여 1차 증강을 수행하고, 제안된 W2GAN-GP 모델을 이용하여 2차 증강을 통한 듀얼 오디오 신호 증강 기법을 제안한다. 또한 제안한 증강기법으로 생성된 오디오 데이터의 유효성을 검증하기 위해서 ResNet50 및 DenseNet 분류 모델을 이용하여 분류 정확도를 측정하였다. 분류 모델을 통한 검증 결과, 증강을 수행하지 않은 경우보다 약 27~30% 의 정확도가 높아진 것을 확인할 수 있었다.","Recently, as deep learning technology is being utilized in classification systems in various fields, research is being actively conducted to maximize the performance of deep learning models. The performance of deep learning models is greatly affected by the amount and quality of training data, and the deeper and more complex the design of a deep learning model, the more training data is required. Additionally, if training data is insufficient or there is data imbalance between classes, over-fitting occurs and performance deteriorates. In order to improve classification performance in fields that utilize voice and audio, learning data expansion and imbalance between classes are important issues, and research to resolve these issues is essential. In this paper, we propose a W2GAN-GP augmentation model that effectively augments one-dimensional audio signals by improving the WGAN model designed for two-dimensional image augmentation. We propose a dual audio signal augmentation technique by performing the first augmentation on the original signal data using the time-frequency transform technique, and then performing the second augmentation using the proposed W2GAN-GP model. To verify the validity of the audio data generated by the proposed augmentation technique, classification accuracy was measured using ResNet50 and DenseNet classification models. As a result of verification through the classification model, it was confirmed that the accuracy increased by about 27 to 30% compared to the case where augmentation was not performed."
패션 카테고리 오버샘플링 자동화 시스템,2024,"['CNN', 'Deep learning', 'Oversampling', 'ResNet50', 'YOLOv8', 'Fashion category', '컨볼루션 신경망', '딥러닝', '오버샘플링', '레즈넷50', '욜로 버전 8', '패션 카테고리']",,
An Improved Classification Model Based on Feature Fusion for Orchid Species,2024,['Orchid species · Classifcation model · Feature fusion · ResNet34'],,"Orchid is a kind of terrestrial herb and it has elegant fower posture, quiet fower fragrance, rich colors and noble moral, therefore it has high ornamental value and is deeply loved by people. There are many kinds of orchids, and some of them are similar in shape, texture and color, which make people difcult to quickly and correctly distinguish them. As the existing classifcation model of orchid species have the problems of low accuracy rate and long classifcation time because of the inter species similarities and intra species diferences in orchid species, thus infuencing its wide application. In order to solve the problem above, in this paper, an improved classifcation model based on feature fusion is proposed for orchid species. The achievement of the paper lies in the fact that we successfully developed a classifcation model based on feature fusion to realize the high-efcient classifcation for orchid species. Specifcally, in our scheme, frstly we obtained 12 orchid image sets with number of 12,227 images by network and feld photography; Secondly we analyzed and studied the semantic relationship of diferent scale features from acquired orchid images above; Thirdly we designed an improved classifcation model based on feature fusion on the basis of the semantic relationship above; At last, we used the classifcation model above to realize the high-efcient classifcation for 12 orchid species. The experimental results showed that our proposed classifcation model based on feature fusion in this paper can realize 92.98% classifcation accuracy rate compared with classifcation models without using feature fusion technology, which can greatly improve the classifcation efciency for orchid species."
머신러닝기반 오이 생육 최적 예측 모델에 관한 연구,2024,"['작물 질병 진단', '딥러닝 모델 비교', '레스넷50', '스마트 농업', '욜로v8', 'Crop Disease Diagnosis', 'Deep Learning Model Comparison', 'ResNet50', 'Smart Agriculture', 'YOLOv8']",,
