title,date,keywords,abstract,multilingual_abstract
재난약자 및 취약시설에 대한 APC실증에 관한 연구,2024,"['재난취약시설', '요구조자', '자동계수기', '인공지능', '영상인식', 'Disaster-vulnerable Facilities', 'Victims', 'Auto People Counter', 'AI', 'Image Recognition']",,"Purpose: The purpose of this study is to improve the recognition rate of APC (Auto People Counting), which accurately identifies the remaining claimants and provides them to response agencies such as fire departments when a disaster occurs in a disaster-vulnerable facility such as a nursing hospital. Currently, when a disaster occurs, response agencies arrive at the disaster site and ask building officials directly to determine the status of those in need within the building. This may be inaccurate information about the rescuer, which may expand the scope of work of the response agency and pose a risk to the safety of the rescuer. APC automatically counts the number of people entering and leaving the building and provides real-time information on the number of people remaining, making it possible to accurately determine the status of those in need in the event of a disaster. The purpose of this study is to select the optimal artificial intelligence algorithm so that APC can more accurately count the number of people entering.Method: In this study, baseline modeling was performed using a CNN model to improve the algorithm that recognizes images of entering personnel through cameras targeting APCs installed and operated in actual disaster-vulnerable facilities. The study was conducted by analyzing the performance of various algorithms to select the top seven candidates and using a transfer learning model to select the optimal algorithm with the best performance.Research Results: As a result of the experiment, the precision and recall of the Densenet201 and Resnet152v2 models, which had the best time and performance, were confirmed to show 100% accuracy for all labels. Among these, the Densenet201 model showed higher performance.Conclusion: Among various artificial intelligence algorithms, the optimal algorithm that can be applied to APC was selected. This will improve the recognition rate of APC and enable quick and safe rescue operations by accurately identifying the information of rescuers in the event of a disaster. This is expected to contribute to ensuring the safety of rescuers performing rescue operations as well as the safe rescue of rescuers. In the future, additional research on algorithm analysis and learning is required to accurately identify the number of people entering disaster-vulnerable facilities in various disaster situations such as haze."
Crop Leaf Disease Identification Using Deep Transfer Learning,2024,"['Agricultural Artificial Intelligence', 'Crop Leaf Disease Identification', 'Plant Protection', 'Transfer Learning']",,"Traditional manual identification of crop leaf diseases is challenging. Owing to the limitations in manpower and resources, it is challenging to explore crop diseases on a large scale. The emergence of artificial intelligence technologies, particularly the extensive application of deep learning technologies, is expected to overcome these challenges and greatly improve the accuracy and efficiency of crop disease identification. Crop leaf disease identification models have been designed and trained using large-scale training data, enabling them to predict different categories of diseases from unlabeled crop leaves. However, these models, which possess strong feature representation capabilities, require substantial training data, and there is often a shortage of such datasets in practical farming scenarios. To address this issue and improve the feature learning abilities of models, this study proposes a deep transfer learning adaptation strategy. The novel proposed method aims to transfer the weights and parameters from pre-trained models in similar large-scale training datasets, such as ImageNet. ImageNet pre-trained weights are adopted and fine-tuned with the features of crop leaf diseases to improve prediction ability. In this study, we collected 16,060 crop leaf disease images, spanning 12 categories, for training. The experimental results demonstrate that an impressive accuracy of 98% is achieved using the proposed method on the transferred ResNet-50 model, thereby confirming the effectiveness of our transfer learning approach."
아음속 수송체 알루미늄 프레임의 비선형 유도초음파 주파수 응답 – 합성곱 신경망 분석 기반 미세 감육 진단 가능성 연구,2024,"['구조 진단', '유도초음파', '심층학습', '합성곱 신경망', '객체검출', 'Structural Health Monitoring', 'Guided Wave', 'Deep Learning', 'Convolution Neural Network', 'Object Detection']",,
Deep Learning-based Arabic Sign Recognition System for Automated Communication with Hearing Impaired Individuals,2024,"['Arabic Sign Language', 'Deep Neural Networks', 'ResNet', 'CNN', 'Automatic Recognition', 'Hearing Impaired']",,"Arabic Sign Language (ArSL) is used by individuals who are hard of hearing or deaf in Arab countries, as well as others around the world who use it for religious purposes. for the need for automated systems to facilitate the learning and communication of ArSL is therefore significant. Such systems would allow people to learn Arabic Sign Language and use it to communicate among themselves and with the surrounding community. This paper presents the development of an automatic recognition system capable of accurately identifying Arabic signs through hand gestures. In this paper, two Residual Network (ResNet) Configurations, Version 1 (V1) and Version 2 (V2), are proposed and detailed. The proposed ResNet V1 achieved an average accuracy of 98.83%, while ResNet V2 achieved an average accuracy of 98.84%. The results described in this paper far exceed those reported in the extant literature. The high accuracy of the proposed system shows the potential for integrating the system with education tools and assistive technologies for people with special needs."
Deep Learning Driven Human Posture Location  in Physical Education Teaching,2024,"['Human Posture', 'Physical Education Teaching', 'Deep Learning', 'ResNet.']",,"The study of human posture is widely applied in physical education teaching, human motion recognition, and other aspects. With the rise of online teaching, the lack of convenient physical education teaching methods has been able to improve. However, due to the complex structure of human body, the study of human posture is a hard problem of consciousness problem in the area of computer vision. This article mainly studies human posture research algorithms based on deep learning. It uses 101-layer network of ResNet to detect the key points of human body in the image and obtains the categories and coordinates of these key points. In this article, a 101-layer network of ResNet model is constructed to fully learn the visual features of key points in human posture. Secondly, the key point location loss function is improved, and the human posture research is realized by using huber loss function instead of mean square error (MSE) loss function. Finally, experimental analysis shows that compared to traditional integral pose regression (IPR) and location adaptive integral pose regression (LAIPR), the use of ResNet based human posture estimation method for human posture recognition improves precision. It has practical significance for physical education teaching applications."
Deep Learning-Based Plant Health State Classification Using Image  Data,2024,"['Deep Learning', 'Convolutional Neural Networks', 'Channel-wise Attention', 'Depthwise Separable Convolution', 'Attention-Enhanced ResNet', 'Plant Health State Classification', '딥러닝', '합성곱 신경망', '채널 어텐션', '깊이 분리 합성곱', 'Attention-Enhanced ResNet', '작물 건강 상태 분류']",,"Tomatoes are rich in nutrients like lycopene, β-carotene, and vitamin C. However, they often suffer from biological and environmental stressors, resulting in significant yield losses. Traditional manual plant health assessments are error-prone and inefficient for large-scale production. To address this need, we collected a comprehensive dataset covering the entire life span of tomato plants, annotated across 5 health states from 1 to 5. Our study introduces an Attention-Enhanced DS-ResNet architecture with Channel-wise attention and Grouped convolution, refined with new training techniques. Our model achieved an overall accuracy of 80.2% using 5-fold cross-validation, showcasing its robustness in precisely classifying the health states of tomato plants"
상품 카테고리 자동분류를 위한 BERT-분류기 아키텍처 연구,2024,"['문장 분류', '문장 유사도', 'Sentence BERT', 'CNN', 'ResNet', 'Transformer', 'Classification', 'Sentence classification', 'Sentence similarity', 'Sentence BERT', 'CNN', 'ResNet', 'Transformer', 'Classification']","본 연구는 생활 속 존재하는 다양한 상품들의 명칭을 BERT를 통해 임베딩 벡터화한 다음 이를 기반으로 상품 카테고리 예측을 수행하는 아키텍처에 대한 연구이다. 아키텍처의 성능은 상품 명칭으로부터 임베딩 추출을 수행하는 BERT 모델과, 추출된 임베딩으로 카테고리 예측을 수행하는 분류기에 의해 결정된다. 따라서 본 연구는 우선 상품 명칭 분류에 적합한 BERT 모델을 선정하고, 선정된 BERT 모델에 다양한 분류기를 적용하여 가장 높은 성능을 달성하는 BERT-분류기 조합을 찾고자 하였다. 최초 적합한 BERT 모델 선정에는 단순한 CNN 분류기를 사용하였으며 이를 baseline으로 다른 분류기와 성능을 비교하였다. 아키텍처의 성능은 카테고리 정답에 대한 precision, recall, f1 score, accuracy로 정량화하여 평가하였다. 실험 결과 BERT 측면에서는, Sentence BERT 모델이 비교 대상인 일반 BERT 모델보다 적합함을 확인하였다. 그리고 분류기 측면에서는, Sentence BERT와 CNN으로 구성된 baseline 대비하여 Residual Block이 추가 적용된 분류기가 더 높은 성능을 보였다. 본 연구에 사용된 Sentence BERT 모델의 경우 한국어 데이터가 학습되지 않은 단순 모델로, 향후 추가적 연구를 통해 다양한 한국어 데이터를 학습시켜 Domain Adaptation을 수행할 경우 추가적 성능 향상이 기대된다.","This research focuses on an architecture that vectorizes the names of various products found in daily life using BERT, followed by predicting product categories based on these embeddings. The architecture's performance is determined by the BERT model, which extracts embeddings from product names, and the classifier that predicts categories from these embeddings. Consequently, this research initially aimed to identify a BERT model suitable for classifying product names and then find the most efficient combination of BERT model and classifier by applying various classifiers to the chosen BERT model. A simple CNN classifier was employed for the initial selection of a suitable BERT model, serving as a baseline for performance comparison with other classifiers. The architecture's effectiveness was quantified using precision, recall, f1 score, and accuracy for category predictions. Experimental results showed that the Sentence BERT model was more suitable for this task than a conventional BERT model. Additionally, classifiers enhanced with Residual Blocks demonstrated superior performance compared to the baseline combination of Sentence BERT and CNN. The Sentence BERT model used in this study, not trained on Korean data, suggests that further improvements could be achieved through Domain Adaptation by training with diverse Korean datasets."
모션블러 이미지에 대한 CNN 모델의 균열 검출 성능,2024,"['CNN (convolutional neural network)', 'Motion blur', 'Dataset', 'Crack detection', 'F1 score', 'CNN (convolutional neural network)', '모션블러', '데이터셋', '균열 검출', 'F1 score']",,"In this study, we analyzed the effect of motion blur on images used for detecting cracksin concrete tunnel linings on the performance of CNN models. Motion-blurred imageswith intensities ranging from 10 to 50 were generated on the Kaggle and KICT datasets.A semantic segmentation model with ResNet 18, ResNet 34, VGG 11, and Alex-Net as backbones for feature extraction was employed, all pre-trained on the U-Netarchitecture. The performance of these models in crack detection was then assessed.It was observed that detection accuracy decreased across all models as the intensity ofmotion blur increased for each dataset. Within the same model, the F1-score on theKICT dataset showed over 20% higher performance than on the Kaggle dataset. Thisstudy demonstrates that CNN-based crack detection performance is affected by thequality of the image data and that the crack detection accuracy of CNN models canvary depending on the quality of the dataset used in training."
SERN 기반 운전자의 다중 행동 특징을 이용한 졸음 검출 시스템,2024,"['졸음 인식', '운전자 행동 특징', 'SERN', '다중 특징', '딥러닝', 'drowsiness detection', 'driver behavior features', 'SERN', 'Multiple features', 'deap learning']","최근 교통사고의 주요한 원인 중 하나인 운전자 졸음으로 인한 교통사고를 예방하기 위해 졸음 인식 연구가 활발히 진행되는 중이다. 기존 졸음 인식 시스템은 운전자의 신체적 특징을 이용하여 졸음 상태를 인식하지만 신체 부위 폐 색에 의한 가려짐으로 제한되는 한계가 있다. 본 논문에서는 운전자의 다중 행동 특징을 이용한 SERN(Squeeze and Excitation Resnet Network) 기반 졸음 인식 시스템을 제안한다. 제안한 시스템은 다중 행동적 특징 기반 특징 추출 과정, 데이터의 계층적 레이블링 세분화 과정, SERN 모델에 의한 졸음 인식 과정으로 구성된다. 공개 DB인 NTHU-DDD를 사용한 실험 결과, 제안하는 SERN 모델 기반 운전자 졸음 검출 성능이 기존 네트워크 모델 보다 정확도 1.03% 우수함을 확인했다.","Recently, driver drowsiness has been one of the major causes of traffic accidents, and study on drowsiness detection has been actively conducted to prevent drowsiness-related accidents. Existing drowsiness detection systems recognize the drowsy state of the driver using the driver's physical features, but they have limitations due to occlusion caused by obstructed body parts. In this paper, we propose a drowsiness detection system based on the squeeze and excitation resnet network (SERN) using the driver's multi-behavioral features. The proposed system consists of a multibehavioral feature extraction process, a hierarchical data labeling refinement process, and a drowsiness detection process using the SERN model. As a result of an experiment using public DB’s NTHU-DDD, it was confirmed that the proposed SERN model based driver drowsiness detection performance was 1.03% better than the existing network model."
합성곱 신경망 기반 화재 인식 모델 최적화 연구: Layer Importance Evaluation 기반 접근법,2024,"['레이어 중요도 평가', '전이 학습 모델', '합성곱 신경망 최적화', '실시간 화재 감지', '기여도', 'Layer Importance Evaluation', 'Transfer Learning Model', 'CNN Optimization', 'Real-Time Fire Detection', 'Contribution']","본 연구는 Layer Importance Evaluation을 통해 도출된 화재 감지에 최적화된 딥러닝 아키텍처를 제안한다. 기존의 합성곱 신경망(Convolutional Neural Network, CNN) 기반 화재 감지 시스템의 불필요한 복잡성과 연산을 초래하는 문제점을 해결하기 위해, Layer Importance Evaluation 기법을 통해 가중치 및 활성화 값에 근거한 모델의 내부 레이어의 동작을 분석하고, 화재 감지에 기여도가 높은 레이어를 식별한 뒤, 식별한 레이어만으로 모델을 재구성하여, 기존 모델과의 성능 지표를 비교 분석하였다. Xception, VGG19, ResNet, EfficientNetB5 등 네 가지 전이 학습 모델을 사용하여 화재 데이터를 학습시킨 후, Layer Importance Evaluation기법을 적용하여 각 레이어의 가중치와 활성화 값을 분석한 뒤 기여도가 가장 높은 상위 랭크 레이어들을 선별하여 새로운 모델을 구축하였다. 연구 결과, 구현된 아키텍처는 기존 모델 대비 약 80% 가량 경량화 된 파라미터로도 동등한 성능을 유지하며, 약 3~5배가량 신속한 학습 속도를 가지면서도 기존의 복잡한 전이학습 모델에 비해 정확도, 손실, 혼동행렬 지표에서 동등한 성능을 출력함으로써, 화재 감시 장비의 효율성을 높이는 데 기여할 수 있음을 확인하였다.","This study proposes a deep learning architecture optimized for fire detection derived through Layer Importance Evaluation. In order to solve the problem of unnecessary complexity and operation of the existing Convolutional Neural Network (CNN)-based fire detection system, the operation of the inner layer of the model based on the weight and activation values was analyzed through the Layer Importance Evaluation technique, the layer with a high contribution to fire detection was identified, and the model was reconstructed only with the identified layer, and the performance indicators were compared and analyzed with the existing model. After learning the fire data using four transfer learning models: Xception, VGG19, ResNet, and EfficientNetB5, the Layer Importance Evaluation technique was applied to analyze the weight and activation value of each layer, and then a new model was constructed by selecting the top rank layers with the highest contribution. As a result of the study, it was confirmed that the implemented architecture maintains the same performance with parameters that are about 80% lighter than the existing model, and can contribute to increasing the efficiency of fire monitoring equipment by outputting the same performance in accuracy, loss, and confusion matrix indicators compared to conventional complex transfer learning models while having a learning speed of about 3 to 5 times faster."
합성곱 신경망 기반 화재 인식 모델 최적화 연구: Layer Importance Evaluation 기반 접근법,2024,,"본 연구는 Layer Importance Evaluation을 통해 도출된 화재 감지에 최적화된 딥러닝 아키텍처를 제안한다. 기존의 합성곱 신경망(Convolutional Neural Network, CNN) 기반 화재 감지 시스템의 불필요한 복잡성과 연산을 초래하는 문제점을 해결하기 위해, Layer Importance Evaluation 기법을 통해 가중치 및 활성화 값에 근거한 모델의 내부 레이어의 동작을 분석하고, 화재 감지에 기여도가 높은 레이어를 식별한 뒤, 식별한 레이어만으로 모델을 재구성하여, 기존 모델과의 성능 지표를 비교 분석하였다. Xception, VGG19, ResNet, EfficientNetB5 등 네 가지 전이 학습 모델을 사용하여 화재 데이터를 학습시킨 후, Layer Importance Evaluation기법을 적용하여 각 레이어의 가중치와 활성화 값을 분석한 뒤 기여도가 가장 높은 상위 랭크 레이어들을 선별하여 새로운 모델을 구축하였다. 연구 결과, 구현된 아키텍처는 기존 모델 대비 약 80% 가량 경량화 된 파라미터로도 동등한 성능을 유지하며, 약 3~5배가량 신속한 학습 속도를 가지면서도 기존의 복잡한 전이학습 모델에 비해 정확도, 손실, 혼동행렬 지표에서 동등한 성능을 출력함으로써, 화재 감시 장비의 효율성을 높이는 데 기여할 수 있음을 확인하였다.","This study proposes a deep learning architecture optimized for fire detection derived through Layer Importance Evaluation. In order to solve the problem of unnecessary complexity and operation of the existing Convolutional Neural Network (CNN)-based fire detection system, the operation of the inner layer of the model based on the weight and activation values was analyzed through the Layer Importance Evaluation technique, the layer with a high contribution to fire detection was identified, and the model was reconstructed only with the identified layer, and the performance indicators were compared and analyzed with the existing model. After learning the fire data using four transfer learning models: Xception, VGG19, ResNet, and EfficientNetB5, the Layer Importance Evaluation technique was applied to analyze the weight and activation value of each layer, and then a new model was constructed by selecting the top rank layers with the highest contribution. As a result of the study, it was confirmed that the implemented architecture maintains the same performance with parameters that are about 80% lighter than the existing model, and can contribute to increasing the efficiency of fire monitoring equipment by outputting the same performance in accuracy, loss, and confusion matrix indicators compared to conventional complex transfer learning models while having a learning speed of about 3 to 5 times faster."
전이학습을 이용한 신발 이미지 스타일 분류모델 연구,2024,"['전이학습', '신발 스타일 분류', '신발 아웃솔', '신발 갑피', 'Transfer Learning', 'Shoes Style Classification', 'Shoes Outsole', 'Shoes Upper', 'ConvNeXt']","전자상거래의 성장과 4차산업혁명 기술 발전에 따라 패션 산업에서 인공지능을 접목한 서비스가 활발히 도입되고 있으나 신발 산업은 아직 관련 연구가 깊게 되어 있지 않아 활용 사례 및 데이터셋이 부족하다. 본 논문에서는 웹크롤링으로 운동화, 스니커즈 이미지를 수집하고 디자인 및 제조 관점을 반영하여 신발 스타일과 아웃솔, 갑피에 대해서 라벨링하였다. 구축한 약 2만건의 데이터셋을 대상으로 ResNet, ConvNeXt, ViT, Swin Transfomer를 전이학습하고 각 모델의 결과를 비교하였다. 그 결과 ConvNeXt 모델에서 가장 우수한 결과를 얻었고 과적합을 방지하기 위해 추가로 파인튜닝하여 테스트 데이터셋 대상으로 정확도 87%의 결과를 얻었다. 본 연구를 바탕으로 신발 산업에서 디자인 및 제조 기술에 딥러닝 모델을 활용하여 생산성을 향상시킬 수 있을 것이라 기대한다.","With the growth of e-commerce and the development of the 4th Industrial Revolution technologies, services using AI are being actively introduced in the fashion industry. However, the shoes industry has not yet been studied in-depth on AI and there is a lack of datasets and use cases. In this paper, we collected images of sneakers and running shoes by web crawling and labeled shoe styles, outsoles, and uppers from design and manufacturing perspectives. We trained ResNet, ConvNeXt, ViT and Swin Transformer on our dataset and compared the results of each model. As a result, the ConvNeXt model obtained the best results and was further fine-tuned to prevent overfitting, resulting in 87% accuracy on the test dataset. Based on this study, We expect that deep learning will be used in design and manufacturing process to improve productivity in the shoe industry."
