title,date,keywords,abstract,multilingual_abstract
뉴럴 메모리의 리콜 기능에 관한 탐구,2022,[],"최근 들어 딥러닝은 컴퓨팅 기술의 발달과 이론 분야의 발전을 통해 다양한 분야에 적용되며 뛰어난 성능을 보여주고 있다. 본 논문에서는 고도화된 딥러닝 기술을 기반으로 뉴럴 메모리(neural memory) 분야에 대한 내용을 다룬다. 뉴럴 메모리는 고전적인 컴퓨터의 메모리 형태를 취하고 있으며, 구글 딥마인드에서 발표한 미분가능 뉴럴 컴퓨터 기술인 DNC를 발표한 이후 급속히 성장하고 있는 분야 중 하나이다. DNC 이후 다양한 연구를 통해 응용 목적에 특화된 형태의 현대적 신경망 기반의 메모리 분야는 계속적으로 발전되고 있으며, 본 연구에서는 DNC의 주요 특징을 계승하는 동적 카네르바 머신(dynamic Kanerva machine, DKM)의 현대화된 연상 메모리 기능에 주목한다. 보다 구체적으로, 최근 메타-학습(meta-learning) 분야에 메모리를 활용하여 의미있는 결과를 보여준 변분 의미론적 메모리(variational semantic memory) 방법론을 활용하는 방법을 제안한다. 이를 통해 장기메모리에 대한 저장이 가능할 뿐만 아니라, 잡음이 포함된 데이터와 새롭게 목격하는 데이터에 대해서도 접근할 수 있고, 스토리지의 메모리 효율 면에서도 가볍고 효과적으로 다룰 수 있다는 장점을 가질 것으로 생각한다.",
깊은신경망을 이용한 회전객체 분류 연구,2015,"['PCA', 'MLP', 'DBN', 'Pre-training', '딥러닝', 'Deep learning']","본 논문은 딥러닝 알고리즘을 적용한 깊은신경망을 이용하여 회전 객체의 분류 효율성을 높이기 위한 연구이다. 회전객체의 분류 실험을 위하여 데이터는 COIL-20을 사용하며 객체의 2/3영역을 학습시키고 1/3영역을 유추하여 분류한다. 연구에 이용된 3가지 분류기는 주성분 분석법을 이용해 데이터의 차원을 축소하면서 특징값을 추출하고 유클리디안 거리를 이용하여 분류하는 PCA분류기와 오류역전파 알고리즘을 이용하여 오류 에너지를 줄여가는 방식의 MLP분류기, 마지막으로 pre-training을 통하여 학습데이터의 관찰될 확률을 높여주고 fine-tuning으로 오류에너지를 줄여가는 방식의 딥러닝을 적용한 DBN분류기이다. 깊은신경망의 구조별 오류율을 확인하기 위하여 은닉층의 개수와 은닉뉴런의 개수를 변경해가며 실험하고 실제로 가장 낮은 오류율을 나타내는 구조를 기술한다. 가장 낮은 오류율을 보였던 분류기는 DBN을 이용한 분류기이다. 은닉층을 2개 갖는 깊은신경망의 구조로 매개 변수들을 인식에 도움이 되는 곳으로 이동 시켜 높은 인식률을 보여줬다.","This paper is a study to improve the classification efficiency of rotating objects by using deep neural networks to which a deep learning algorithm was applied. For the classification experiment of rotating objects, COIL-20 is used as data and total 3 types of classifiers are compared and analyzed. 3 types of classifiers used in the study include PCA classifier to derive a feature value while reducing the dimension of data by using Principal Component Analysis and classify by using euclidean distance, MLP classifier of the way of reducing the error energy by using error back-propagation algorithm and finally, deep learning applied DBN classifier of the way of increasing the probability of observing learning data through pre-training and reducing the error energy through fine-tuning. In order to identify the structure-specific error rate of the deep neural networks, the experiment is carried out while changing the number of hidden layers and number of hidden neurons. The classifier using DBN showed the lowest error rate. Its structure of deep neural networks with 2 hidden layers showed a high recognition rate by moving parameters to a location helpful for recognition."
MobileNet 기반의 사람 음성 활동 감지 모델,2021,"['Voice activity detection', 'MFCC', 'MobileNet', 'Deep learning']","사람 음성 활동 감지는 스마트 홈이나 자동차 등 다양한 응용 분야에서 활용될 수 있으며, 딥러닝 기술을 이용한 연구들도 수행되고 있다. 본 논문에서는MobileNet 딥러닝 모델을 이용하여 사운드 세그먼트에 사람음성 활동이 있는지 검출하는 모델을 제안한다. 사운드 세그먼트의 MFCC 특징 추출을 위하여 MFCC 특징을 추출하였고, CNN 기반의 모델들보다 연산 복잡도가 최소화되고 의미있는 특징 데이터를 학습할 수 있는 MobileNet을 도입하여 최적화를 수행하였다. 이를 통하여 95.52% 정확도로 사람 음성 활동 여부를 검출하였다.","Voice activity detection of human can be used in various applications such as smart homes and automobiles, and researches using deep learning technology are being conducted. In this paper, we propose a voice activity detection model of human in sound segments using MobileNet. The MFCC features were extracted as features of the sound segments. Also, MobileNet, which has lower computational complexity than CNN-based models and can learn meaningful features, is applied and optimized. As a result, voice activity detection was performed with 95.52% accuracy."
Image Dehazing using Conditional Context-aware Generative Adversarial Network,2021,"['generative adversarial network', 'convolutional neural network', 'image dehazing']","기후 변화 인해 흐리고 흐린 날씨가 자주 일어나기 때문에 시야가 좁아진다. 최근 이미지 디헤이징을 위한 딥러닝 접근법의 개발에서, 이 작업은 컴퓨터 비전에서 좋지않은 성능으로 도전적인 문제로 여전히 간주된다. 본 논문에서 제안된 비지도 딥 러닝 모델인 이미지 디헤이징의 성능을 향상시킨다. 제안된 모델은 이미지 디헤이징 작업을 강화하기 위해 조건부 상황 인식 생성적 적대 네트워크를 통한 비지도 학습 방법을 채택했다. 이 모델은 희미해진 데이터와 원래의 희미하지 않은 훈련 데이터 사이의 상황 차이를 기반으로 희미함을 제거하는 방법을 학습한다. 또한 제안된 모델은 이미지의 사실적인 텍스처 정보를 생성하고 복잡한 흐릿한 이미지에 대한 시각적 대비를 향상시키기 위해 성공적인 정확도를 달성했다.","Due to climate change, cloudy and hazy weather frequently occurs; therefore, this weather condition reduces visibility. In the recent development of deep learning approaches for image dehazing, the task remains considered an ill-posed and challenging problem in computer vision. Enhance the performance of image dehazing, an unsupervised deep learning model proposed in this paper. The proposed model adopted the unsupervised learning strategy with Conditional Context-aware Generative Adversarial Network to enhance the image dehazing task. The model learns to remove the haze based on the context difference between the dehazed and original haze-free training data. In addition, the proposed model achieved successive accuracy to generate realistic texture information of the image and enhance visual contrast for the complex hazy image."
망막질환진단을 위한 CNN모델들의 성능비교,2022,"['딥러닝', '망막 OCT', 'Deep Learning', 'VGG-16', 'VGG-19', 'ResNet', 'DenseNet', 'Retinal OCT']",,
어텐션 네트워크를 활용한 카메라-라이다 융합 기반 포인트 클라우드 의미론적 분할에 관한 연구,2021,"['Deep Learning(딥러닝)', 'Sensor Fusion(센서융합)', 'Attention Network(어텐션 네트워크) Semantic Segmentation(의미론적 분할)']",,
복원 모델 기반 이상 탐지를 위한 효율적인 데이터 전처리 방법,2021,"['Anomaly detection', 'Deep learning', 'Data preprocessing', 'Reconstruction model.']",최근 몇 년간 딥 오토 인코더 또는 UNet과 같은 딥러닝 모델이 이상 상황 탐지를 위한 재구성 기반 모델로 사용되었다. 이러한 재구성 기반 모델은 재구성 손실을 기반으로 비정상 지수를 측정한다. 그러나 재구성 기반 모델의 탐지 성능은 입력 데이터의 형식에 따라 크게 좌우되므로 데이터 전처리 과정은 재구성 기반 이상 탐지 모델의 탐지 성능을 향상하는 데 매우 중요한 요소이다. 따라서 본 연구에서는 이상 탐지를 위한 새로운 데이터 처리 방법을 제안한다. 우리가 제안한 데이터 전처리 과정에서는 우선 현재 프레임과 이전 프레임 간의 차이를 계산하여 새로운 이미지를 생성한다. 그런 다음 새로 구축된 이미지를 UNet 모델에 대한 입력 이미지로 사용한다. 그런 다음 원래 이미지와 UNet 모델을 통해 재구성된 이미지 간의 차이를 계산하여 이상 영역 위치를 탐지한다. 실험에서 우리가 제안한 데이터 전처리 방법과 기존의 다른 데이터 전처리 기법의 탐지 성능을 비교하였다. 실험 결과 우리가 제안한 데이터 처리 방법을 사용한 UNet 기반 이상 탐지 모델이 다른 데이터 전처리 방법을 사용한 모델보다 이상 영역을 더 잘 탐지할 수 있음을 보여준다.,
HILS 장비를 이용한 차선 검출 시스템의 성능 검증에 관한 연구,2021,"['Lane Detection(차선검출)', 'Deep Learning(딥러닝)', 'HILS(하드웨어 루프 시뮬레이션)', 'PILS(프로세서 루프 시뮬레이션)', 'NCAP(신차평가프로그램)']",,
회전 정보 일치를 통한 전이학습 기반 초저속 베어링 고장 진단,2021,"['고장진단(Fault diagnosis)', '전이학습(Transfer learning)', '딥러닝(Deep learning)', '초저속 베어링(Very low speed bearings)']",,"Fault diagnosis of bearings is a crucial task, because their defects could cause severe damages to total systems. Many research efforts have been made to apply transfer learning to fault diagnosis of bearings under various speeds; however, transfer learning under very low speeds has not been studied yet. The main difficulty in transfer learning under very low speed arises in that there is a large difference in the number of revolutions between the source and target bearings per one sample. This paper thus proposes transfer learning that considers revolution information of very low speed bearings. Two different types of bearing datasets were used to verify the effectiveness of the proposed method. It can be confirmed from experimental results that the proposed method outperforms existing methods."
군집 별 표준곡선 매개변수를 이용한 치밀오일 생산성 예측 순환신경망 모델,2021,"['Tight oil', 'LSTM', 'GRU', 'Clustering analysis', 'Type curve']","치밀오일 미래 생산성 예측은 잔류오일 회수량 및 저류층 거동 분석을 위해 중요한 작업이다. 일반적으로 석유공학적 관점에서 감퇴곡선법을 이용하여 생산성 예측이 이루어지는데, 최근에는 데이터기반의 머신러닝 기법을 이용한 연구도 수행되고 있다. 본 연구에서는 딥러닝 기반 순환신경망과 LSTM, GRU 알고리즘을 이용하여 미래 생산량 예측을 위한 효과적인 모델을 제안하고자 한다. 입력변수로는 치밀오일 생산 시 산출되는 오일, 가스, 물과 이와 더불어 다양한 군집분석을 통해 산출된 표준곡선이 주요 매개변수이고, 출력변수는 월별 오일 생산량이다. 기존의 경험적 모델인 감퇴곡선법과 순환신경망 모델들을 비교하였으며, 모델의 예측성능을 향상시키기 위해 하이퍼파라미터 튜닝을 통해 최적 모델을 도출하였다.","Predicting future productivity of tight oil is an important task for analyzing residual oil recovery and reservoir behavior. In general, productivity prediction is made using the decline curve analysis(DCA). In this study, we intend to propose an effective model for predicting future production using deep learning-based recurrent neural networks(RNN). LSTM, and GRU algorithms. As input variables, the main parameters are oil, gas, water, which are calculated during the production of tight oil, and the type curve calculated through various cluster analyzes. the output variable is the monthly oil production. Existing empirical models, the DCA and RNN models, were compared, and an optimal model was derived through hyperparameter tuning to improve the predictive performance of the model."
하수처리 활성오니공정 최적화를 위한 XAI(eXplainable AI) 기법 비교 분석,2021,[],"본 연구에서는 하수처리 활성오니공정의 유출수 수질에 영향을 미치는 유입수의 수질과 제어량을 구하기 위해 여러가지 XAI(eXplainable AI) 기법을 적용 비교하여 최적의 방안을 도출하고자 한다. 기존의 공정을 분석하여 그 원인을 파악방법은 주로 예측 중심의 접근 방법으로 원인에 기반한 제어보다는 단순 예측 결과에 기반하는 것으로, 이 경우 데이터 의존도가 높아 한계가 있다. 본 연구에서는 기존의 딥러닝을 활용한공정 예측에 설명가능한 AI를 적용함으로써 단순히 예측 결과에만 의존하는 것이 아니라 특정 성능(KPI: Key Performance Index)을 달성하지 못한 공정에 대한 원인 분석을 진행하여 공정을 최적으로 제어할 수 있는 기법을 제시하고자 한다.",
항공 우주 해상 : Convolutional Neural Networks기반 항공영상 영역분할 및 분류,2015,"['Convolutional neural networks', 'ConvNet', 'Deep learning', 'Image segmentation', 'Scene labeling']","항공영상은 디지털 광학 영상 기술의 성장과 무인기(UAV)의 발달로 인하여 영상의 도입 및 공급이 크게 증가하였고, 이러한 항공영상 데이터를 기반으로 지상의 속성 추출, 분류, 변화탐지, 영상 융합, 지도 제작 형태로 활용되고 있다. 특히, 영상분석 및 활용에 있어 딥 러닝 알고리즘은 패턴인식 분야의 한계를 극복하는 새로운 패러다임을 보여주고 있다. 본 논문은 딥 러닝 알고리즘인ConvNet기반으로 항공영상의 영역분할 및 분류 결과를 통한 더욱더 넓은 범위와 다양한 분야에 적용할 수 있는 가능성을 제시한다. 학습데이터는 도로, 건물, 평지, 숲 총 3000개 4-클래스로 구축하였고 클래스 별로 일정한 패턴을 가지고 있어 특징 벡터맵을 통한 결과가 서로 다르게 나옴을 확인할 수 있다. 본 연구의 알고리즘은 크게 두 가지로 구성 되어 있는데 특징추출은 ConvNet기반으로 2개의 층을 쌓았고, 분류 및 학습과정으로 다층 퍼셉트론과 로지스틱회귀 알고리즘을 활용하여 특징들을 분류 및 학습시켰다.","Aerial scene is greatly increased by the introduction and supply of the image due to the growth of digital optical imaging technology and development of the UAV. It has been used as the extraction of ground properties, classification, change detection, image fusion and mapping based on the aerial image. In particular, in the image analysis and utilization of deep learning algorithm it has shown a new paradigm to overcome the limitation of the field of pattern recognition. This paper presents the possibility to apply a more wide range and various fields through the segmentation and classification of aerial scene based on the Deep learning(ConvNet). We build 4-classes image database consists of Road, Building, Yard, Forest total 3000. Each of the classes has a certain pattern, the results with feature vector map come out differently. Our system consists of feature extraction, classification and training. Feature extraction is built up of two layers based on ConvNet. And then, it is classified by using the Multilayer perceptron and Logistic regression, the algorithm as a classification process."
