title,date,keywords,abstract,multilingual_abstract
딥러닝 세그먼테이션과 폴리곤화를 활용한 도면 벡터화,2021,[],건축도면 이미지를 활용한 3차원 실내공간정보 구축에서 문제가 되는 사항 중에 하나는 도면에 나타난 기하적 형상을 보존하는 것이다. 딥러닝의 발전에 따라 도면이미지를 딥러닝으로 분류한 수 벡터화 과정을 통해 실내공간정보를 구축하려는 시도가 많이 있지만 딥러닝의 확률론적인 특징으로 인해 형상의 왜곡이 발생하고 있다. 본 연구에서는 스캔된 도면을 폴리곤화 하여 형상을 보존한 수 딥러닝 세그먼트를 폴리곤 분류기로 사용하여 원본 형상을 보존한 도면 벡터 결과물을 획득하였다.,
가속도계 설치 개수 및 위치에 따른 딥러닝 기반 교량 손상 추정 영향 분석,2021,"['교량 손상 추정', '딥러닝', '최적 센서 위치', '시설물 방재', 'Bridge Damage Detection', 'Deep Learning', 'Optimal Sensor Locations', 'Disaster Prevention for Infrastructure']","최근 노후화 시설물의 급증과 함께 노후시설물로 인한 재난이 자주 발생하고 있다. 노후시설물로 인한 재난의 방재대책으로 모니터링 시스템을 기반한 시설물 유지관리가 활용될 수 있다. 본 연구진은 선행연구를 통해 모니터링 시스템에서 활용할 수 있는 딥러닝 기반의 교량 손상 추정 기술 기반 유지관리 기술을 제안하였다. 하지만, 선행 연구를 통해 제안된 기술은 기술의 사용에 있어 고가의 가속도계가 다수 필요하므로 높은 비용이 든다는 문제가 존재하였다. 이를 해결하기 위해, 본 연구에서는 손상 추정에 있어 가속도계의 위치 및 개수를 줄여 교량 손상 추정의 활용성을 높이기 위한 연구를 수행하였다. 그 결과, 기존 교량 손상 추정의 효과적인 위한 최적의 가속도계 설치 위치를 제시할 수 있었다.","In recent times, there has been an increase in the occurrence of disasters caused by a rapid increase in the aging of infrastructure. A structural health monitoring system can be utilized to detect severe damages in infrastructure and prevent accidents. In a previous study, the authors developed a method for damage detection in bridges using monitoring systems. However, the operational cost of the proposed method was high due to the requirement of multiple expensive accelerometers. The aim of this study is to reduce the number of accelerometers used in the aforementioned method by determining the optimal installation locations of the accelerometers. As a result of this study, optimal accelerometer installation locations for bridge damage detection, have been proposed."
MIMO 시스템을 위한 딥러닝 기반의 검파기,2021,"['artificial neural network', 'deep learning', 'convolutional neural network (CNN)', 'multiuser MIMO', 'detector']","본 논문에서는 상향링크 다중 사용자 MIMO 시스템을 위한 딥러닝 기반의 검파기를 제안한다. 딥러닝 기법을 적용하여 검파기를 설계하면, 데이터 추정 성능이 우수한 데이터도 있지만, 그렇지 않은 데이터도 존재한다. 따라서 제안하는 기법에서는 먼저 딥러닝 검파기의 데이터 추정 성능이 우수한 데이터들을 찾고, 그 데이터를 수신 신호로부터 제거한 후에, 반복적으로 딥러닝 검파기를 적용하는 방식을 제안한다.","In this paper, we propose a deep learning based detector for uplink multiuser multiple-input multiple-output (MIMO) systems. If deep learning techniques are applied for the design of a detector, the data estimation performance will be very good for some data but not good for the other. Therefore, in the proposed scheme, we first find a data with a good estimation performance and then, eliminate the data from the received signal. After that, we propose to apply a deep learning based detector iteratively."
딥러닝을 사용한 교각 크랙 탐지 및 폭 측정 시스템,2021,"['딥러닝(Deep learning)', '기계학습(Machine learning)', '크랙 감지(Crack Detection)']",,
딥러닝 기반 자가적응형 알고리즘을 활용한 상수관망 수리모형 검보정,2021,"['상수관망', '보정', '딥러닝', '최적화 알고리즘']",,
딥러닝 모델과 초해상화를 이용한 도로포장 균열 탐지,2021,"['균열 탐지', '딥러닝', '초해상화', '콘크리트 도로']",,
딥러닝을 이용한 고압 수소에 의하여 손상된 Acrylonitrile Butadiene Rubber (NBR) 단면 균열 탐지,2021,"['딥러닝(Deep learning)', '균열 탐지(Crack Detection)', '인공신경망(Artificial neural network)', '객체인식(Object detection)', '반 자동화 라벨링(Semi-automated labeling)']",,"Demand for understanding material behaviors in hydrogen rich environment rises due to the extended use of hydrogen gas. Organic material such as rubber used in O-rings for hydrogen containers displays pore-like cracks when it is exposed extensively to high pressure hydrogen. To find the optimal organic material in a certain hydrogen rich environment, a method for localizing and analyzing pore-like cracks must be devised. This paper deals with a new method to detect high pressure hydrogen induced cracksusing deep learning algorithms. In this study, acrylonitrile Butadiene Rubber (NBR) was exposed to hydrogen of 96.6MPa for 24 hours. Images were taken of the appearing pore like cracks magnified by 100. For bounding box labeling a semi-automated labeling was used using maximally. stable extremal region (MSER) features on graphical contours. The crack detection model was trained adopting the structure of faster R-CNN using ResNet50 as its backbone network. The resulting artificial intelligence model showed robust and accurate detecting ability."
딥러닝 기반 실시간 픽셀 단위 주행 가능 영역 검출 및 격자 지도 생성 알고리즘,2021,"['자율주행(Self-driving)', '딥러닝(Deep learning)', '주행환경(Driving environment)', '인지(Perception)', '격자지도(Grid map)']",,"Self-driving, a core technology that leads the Fourth Industrial Revolution era, aims to create a route and driving safely to the target location based on information obtained through various sensors. In real-world driving environments, all processing processes are guaranteed real-time and require high accuracy for different environments. In this paper, we implement a deep learning model that detects drivable areas for real-time autonomous driving and generates noise-removed grid map. The pixel-level segmentation model for detecting drivable area is using BiSeNet v2 with guaranteed real-time and excellent performance. A vehicle simulator was constructed to reflect the vehicle characteristics and various environments of the BRT. Data for deep learning models is used driving videos from vehicle simulator and the Cityscapes dataset. The grid map generation algorithm proposed in this paper eliminates noise for the drivable area, increasing the IoU of the driveable area by up to 3%."
건물 용도에 따른 딥러닝 다층구조의 정확도 분석,2022,"['딥러닝(Deep Learning)', '다층구조(Multi-Layer Perceptron)', '파이썬(Python)', '최적화(Optimizer)']",,
딥러닝 기반 등검은말벌 모니터링 시스템 개발,2021,"['Digital Agriculture', 'Machine Learning', 'Monitoring System', 'Vespa Velutina', 'Yolo V3']","4차 산업혁명 관련 기술들이 발전함에 따라, 농업 분야에도 이를 활용한 연구가 증가하고 있다. 특히, 이미지 활용 객체 인식 또는 분류에 인공지능 기술을 적용하여 농업 현장의 문제를 해결하고자 하고 있다. 최근 양봉산업에서 꿀벌 개체 수의 감소는 매우 중요한 문제 중 하나이다. 이에 대한 원인 중 가장 큰 비중을 차지하고 있는 말벌의 출현정보를 작업자에게 전달하기 위한 모니터링 시스템을 개발하고자 한다. 대부분의 양봉장의 경우 전력공급에 제한이 있어, 저전력 기반의 태양광 충전시스템이 적용된 이미지 취득 시스템을 개발하였다. 아울러 개체 인식을 위해서 딥러닝(Yolo) 기술을 적용하여 꿀벌과 등검은말벌을 구분하여 인식할 수 있도록 하였다. 등검은말벌 인식을 위한 이미지 데이터 1,928개 중 1,350장(약 70%)는 기계학습에 사용하였으며, 나머지 578장(약 30%)로 검증을 하였다. 연구 결과 기계학습 프로세서는 약 98.2%의 정확도로 인식할 수 있었다. 추가로 현장에서 촬영된 추가 동영상 데이터를 활용하여 등검은말벌의 출현을 인지할 수 있었다. 등검은말벌 출현 알림 자동화 시스템을 통하여 말벌로부터 꿀벌의 개체수 감소를 억제할 것으로 판단되며, 향후 등검은말벌집 탐색을 위한 연구로 확대할 예정이다.","As the 4th industrial revolution technologies develop, research conducted using these technologies is also increasing in several fields, including agriculture. In particular, these technologies solve problems in the agricultural sector by applying artificial intelligence technology to image-based object recognition or classification. The recent decline in the number of bees is one of the most important issues in the beekeeping industry. We intend to develop a monitoring system to inform the appearance of wasps, which is the most significant cause for the decline in the number of bees. Most apiaries have limited power supply, so we developed an image acquisition system with a low power-based solar charging system. In addition, we applied deep learning (Yolo) technology for individual recognition distinguishing the bees and Vespa velutina. We used 1,350 images (about 70%) of 1,928 image data to train the black wasp recognizing machine learning and verified the remaining 578 images (about 30%). At the end of the study, the machine learning processor was able to recognize black wasps with an accuracy of about 98.2%. In addition, we were able to recognize the appearance of the Vespa velutina by using additional video data recorded on site. It is judged that the decrease in the number of bees from wasps can be suppressed through the automated system of notifying the appearance of Vespa velutina. In the future, it is planned to expand the study to explore the nearby Vespa velutina nest."
감정노동자를 위한 딥러닝 기반의 스트레스 감지시스템의 설계,2021,"['Deep Learning', 'Emotional Labor', 'Stress', 'Facial Expression Recognition', 'CNN']","서비스 산업의 성장과 함께 감정노동자의 스트레스가 사회적 문제로 인식되어 2018년 감정노동자 보호법이 시행되었다. 그러나 실질적인 감정노동자 보호 시스템의 부족으로 스트레스 관리를 위한 디지털 시스템이 필요한 시점이다. 본 논문에서는 대표적인 감정노동자인 고객 상담사를 위한 딥러닝 기반 스트레스 감지 시스템을 제안한다. 시스템은 실시간 얼굴검출 모듈, 한국인 감정 이미지 중심의 이미지 빅데이터를 딥러닝한 감정분류 FER 모듈, 마지막으로 스트레스 수치만을 시각화하는 모니터링 모듈로 구성된다. 이 시스템을 통하여 감정노동자의 스트레스 모니터링과 정신질환 예방을 목표로 설계하였다.","According to the growth of the service industry, stresses from emotional labor workers have been emerging as a social problem, thereby so-called the Emotional Labor Protection Act was implemented in 2018. However, insufficient substantial protection systems for emotional workers emphasizes the necessity of a digital stress management system. Thus, in this paper, we suggest a stress detection system for customer service representatives based on deep learning facial expression recognition. This system consists of a real-time face detection module, an emotion classification FER module that deep-learned big data including Korean emotion images, and a monitoring module that only visualizes stress levels. We designed the system to aim to monitor stress and prevent mental illness in emotional workers."
지능형 교통 체계를 위한 딥러닝 기반 객체 검출 활용 방법론,2021,"['Intelligent Transport System', 'Convolutional Neural Network', 'Event detection', 'Velocity Estimation', 'Object Awareness']",,"Most machine vision solutions for intelligent transport systems begin with the extraction of hand-crafted visual features from traffic scenes. In this study, the category-specific information for detecting specific visual patterns was investigated by replacing machine vision solutions with a standard convolutional neural network (CNN)-based object detector, and three practical applications of the system were developed. First, our system learned important categories, such as pedestrian and vehicles, for traffic monitoring and management. In addition, while collecting related databases, we efficiently performed data augmentation and improved the recognition accuracy of the system for several user-defined events. Further, the displacement of the detected positions between consecutive frames was converted into the real-world distance to compute the physical velocity of a vehicle. Second, we developed a vision-based system for a real-time lane-level traffic congestion measurement. After tracking the detected vehicles, the estimated velocities of vehicles for each lane were averaged. Subsequently, traffic congestion was determined based on the number of detected vehicles and averaged velocity. Third, we presented a context-aware method for background maintenance. To handle dynamic background objects, we utilized a 2D object detector to identify the category-specific background patterns. The key observation was that the detected regions do not belong to a true background. Hence, we developed a new confidence map to update the static background model and exclude pre-learnt background objects for conventional background subtraction methods. In the study, more than eight user-defined events were suggested by the combination of traditional machine vision techniques and deep learning-based object detectors with a substantial number of training images. In addition, our key ideas were validated using various datasets, such as five different scenes for lane-level traffic congestion and two CCTV image sequences for object-aware background subtraction and unseen object detection in the challenging traffic congestion. Lastly, the suggested applications of this system for intelligent transport systems were successfully demonstrated."
해상풍력단지의 풍황 및 해황 장기예측을 위한 딥러닝 생성모델 적용성 검토,2022,"['해상풍력단지(Offshore wind farm)', '파랑(Wave)', '바람(Wind)', '장기예측(Long-term Prediction)', '딥러닝(Deep learning)', '생성모델(Generative Model)', '시계열(Time-series)']",,
딥러닝 시멘틱 세그멘테이션과 YOLO를 이용한 주행가능 경로 검출 연구,2021,[],,
딥러닝을 이용한 효율적인 인체 검출 기법 실험 및 동향 연구,2021,[],,
딥러닝 기반 DC/AC 인버터 입력 커패시터 추정 기법에 대한 연구,2021,[],,
딥러닝 기술과 뎁스카메라를 이용한 사람 추종로봇의 추종 알고리즘 개발,2022,"['deep learning', 'Automated guided vehicle', 'following robot', 'mobile robot', 'position measurement']",,"For robots that follow humans, the ability to estimate the location information of the robot and the person is essential. This paper proposes a method for estimating location information between a robot and a human, and evaluates the performance of the proposed method using a self-made mobile robot. In this paper, humans are recognized through the Tiny-YOLOv3 model and distance and angle information between the robot and the person is estimated using a depth camera. The distance is obtained using the depth image of the recognized person, and the angle is obtained using the recognized person-centered X pixel. In an experiment measuring distance and angle at five points, the average error of the distance was 0.077m and the average error of the angle was 0.675°. Through real-time human-following experiments, it was confirmed that the proposed method can be used to control human-following robots."
점군 데이터에서 딥러닝 기반 Natural head position 재현 방법,2022,[],,
이미지 전송을 위한 딥러닝 기반의 소스 채널 코딩 및 전력 최적화,2021,[],"본 논문은 링크 간 간섭이 존재할 때, 프로그레시브 패킷들의 조인트 소스 채널 코딩 및 전력 제어에 관한 연구이다. 각각의 패킷마다 서로 다른 데이터 전송률을 할당하는 경우의 연산 복잡도는 패킷의 개수가 증가함에 따라 지수적으로 증가한다. 송신전력을 최적화하는 문제 또한, 기존에 연구된 기법들은 수많은 반복을 통해 차선의 전력을 찾아내는 iterative 알고리즘이다. 따라서, 본 논문은 조인트 소스 채널 코딩과 전력 제어가 결합된 문제의 복잡도를 해결할 방안으로 deep neural network 구조를 제안하였다. 제안한 신경망은 기존의 알고리즘과 유사한 peak-signal-to-noise ratio(PSNR) 성능을 달성한다.",
주파수응답 유사성을 이용한 증기터빈 블레이드의 균열 위치 및 크기 예측을 위한 딥러닝 모델에 관한 연구,2021,[],,
기관지 구조 변수와 폐 기능 특성을 결합한 시멘트 노출 분류 예측을 위한 딥러닝 모형,2021,[],,
딥 러닝과 마르코프 랜덤필드를 이용한 동영상 내 그림자 검출,2015,"['Moving Shadow Detection', 'Convolutional Neural Network', 'Markov Random Field', 'Surveillance System', 'Object Detection']",,
5G mmWave 통신을 위한 딥 러닝 기반 전송 제어 프로토콜,2022,[],,
생성 모델을 이용한 전력 수요량 예측,2022,"['Deep learning', 'Electricity consumption', 'Multi-step prediction', 'Generative model']",,"Recently, advanced metering infrastructure (AMI) has been deployed for power demand distribution and energy saving, and correspondingly traditional watt-hour meters installed in apartments and industrial sites are also being replaced with AMIs. Accordingly, power demand prediction using AMIs will become increasingly important to save electrical energy consumption. In this paper, we develop various deep learning-based electricity consumption prediction models using simple neural networks, convolutional neural networks, recurrent neural networks, and encoder-decoder-based generative models. To build prediction models, we use average power demand data collected from various home smart meters. Experimental results show that the generative model outperforms other deep learning-based models in terms of mean squared error, and we roughly explain why the generative model is better than other models by examining the activation layer output distributions."
Error Correction in Korean Morpheme Recovery using Deep Learning,2015,"['딥 러닝', '단어 표현', '형태소 분석', '원형 복원', 'Deep Learning', 'Word embedding', 'Morphological Analysis', 'Morpheme Recovery']",,
인공지능기반 모빌리티 탑승자 집중도 및 감정 추론 기술,2021,"['Non-face-to-face', 'Voice recognition', 'Image recognition', 'Emotion recognition', 'Intension Analysis']","Objective: 본 논문은 비대면 디바이스(자율주행 휠체어)에 탑재하여 사용자의 숨겨진 의도를 현장에서 실시간으로 추론 예측하는 인공지능 플랫폼의 주요기술인 영상기반 탑승자 집중도 및 감정 추론 기술에 관한 내용이다. Background: 비대면 디바이스 시스템에서 사용자 감정, 집중도 등의 인식 기술은 비교적 최근에 개발되고 있는 기술 분야로써 사용자의 부정적 감정을 인식하고 이를 해소할 수 있는 상호작용을 제공하는 데 그 목적이 있으며, 특히 합성곱신경망 (CNN: Convolutional Neural Network)을 이용한 딥러닝 모델들은 그 적용범위를 넓히고 있다. Method: 본 연구에서는 언택트 환경에서 비대면 디바이스를 사용함에 있어 사용자의 사용의도를 추론·예측하기 위해 비접촉식 영상 센서의 이미지 데이터 전처리 기술 및 딥러닝 기반 얼굴 인식을 통한 사용자 다중데이터(감정/집중도) 추론 기술을 제시한다. 본 논문에서 제시하는 기술은 첫번째로 영상기반 사용자 표정/감정 추론을 위한 학습 데이터 셋 가공 기술, 기존 딥러닝 모델 분석, 개선된 딥러닝 모델이다, 두번째로 영상기반 사용자 집중도 추론을 위해 사용자 집중도 정의 및 분류 방법, 기존 딥러닝 모델 분석, 그리고 개선된 사용자 얼굴 행동/상태 인식 모델을 제시한다. Results: 영상기반 사용자 표정/감정 및 집중도 추론을 위해 정면/다각도 학습데이터를 사용하였으며, 얼굴 위치의 편협성을 보완하기 위해 검출 된 얼굴 영역을 포함한 임의의 영역을 Crop 및 Resizing하는 등 이미지 전처리를 수행하였다. 영상기반 사용자 표정/감정 및 집중도 추론 결과로 precision, recall, f1-score 를 제시하였다. Conclusion: 본 논문에서는 사용자의 사용의도를 추론·예측하기 위한 비접촉식 영상 센서기반 얼굴 인식 딥러닝 기술과 기능 및 성능을 기술하였으며, 추후 개발될 기술에 대한 내용도 제시하였다. Application: 본 연구의 결과로 제시되는 요소기술은 비대면 디바이스를 사용하는 서비스 산업 전반에서 활용이 가능하며, 사용자의 숨겨진 의도를 파악하여 사용자 경험 최적화화 하는 분야에 적용될 수 있다.",
이상행동 및 행동 인식 모델 학습 및 테스트를 위한 시스템 UI 설계에 대한 연구,2021,"['이상행동 인식', '행동 인식', '딥러닝', '모델 학습', '사용자 인터페이스']",인공지능을 활용한 사업이 활발히 진행되면서 범죄 예방 및 안전분야와 관련하여 이상행동 및 행동 인식에 대한 연구와 관심이 높아지고 있다. 하지만 딥러닝 등 인공지능 모델을 생성하는 것은 전문 지식이 없는 경우 많은 어려움이 따른다. 본 논문에서는 사용자가 편리하게 딥러닝 모델을 생성할 수 있도록 데이터셋을 제공하고 이상행동 및 행동 인식 기술을 API화하여 인터페이스에서 호출하는 방식을 사용하는 사용자 친화적인 모델 학습 및 테스트를 위한 시스템 UI를 제안하였다. 본 논문에서 제안한 시스템은 딥러닝에 대한 사전 지식이 없는 사용자가 편리하게 딥러닝 모델을 생성할 수 있을 것으로 기대된다.,
히스토그램 분석 기반 파손 영상 선별 알고리즘,2021,"['딥러닝', '데이터셋', 'GAN', '히스토그램 분석', '파손 영상 선별']","최근 딥러닝 환경의 확산으로 인하여 데이터셋 생성의 중요성이 높아지고 있어, 효율적인 데이터셋 생성을 위하여 GAN을 활용하여 데이터를 증강시키고 있다. 그러나 GAN을 활용하여 생성되는 데이터에는 학습 초기 발생하는 문제점 및 생성되는 영상 내에 픽셀 깨짐 현상이 발생하는 등 여러 문제점이 발견되고 있다.  본 논문에서는 기존 GAN에서 발생하는 여러 문제점을 해결하기 위하여 파손 영상 데이터 선별 알고리즘을 구현하고자 한다. 파손 영상 선별 알고리즘은 영상 내의 히스토그램 분포를 분석하고 해당 결과값이 지정한 임곗값에 만족하는지에 따라 생성된 영상의 저장 여부를 결정하도록 구현하였다.","Recently, the spread of deep learning environments has increased the importance of dataset generation. Therefore, data is being augmented using GAN for efficient data set generation. However, several problems have been found in data generated using GAN, such as problems that occur in the early stages of learning and pixel breakage occurring in the generated image.  In this paper, we intend to implement an image data selection algorithm to solve various problems arising from the existing GAN. The broken image screening algorithm was implemented to analyze the histogram distribution in the image and determine whether to store the generated image according to whether the result value satisfies the specified threshold value."
