title,date,keywords,abstract,multilingual_abstract
"Synthesis and Evaluation of Tricarbonyl <sup>99m</sup> Tc-Labeled 2-(4-Chloro)phenyl-imidazo[1,2- <i>a</i> ]pyridine Analogs as Novel SPECT Imaging Radiotracer for TSPO-Rich Cancer",2016,"['translocator protein', 'TSPO', 'Tricarbonyltechnetium-99m', '99mTc(CO)3', 'TSPO-rich tumors', 'SPECT']",국문 초록 정보 없음,"<P>The 18-kDa translocator protein (TSPO) levels are associated with brain, breast, and prostate cancer progression and have emerged as viable targets for cancer therapy and imaging. In order to develop highly selective and active ligands with a high affinity for TSPO, imidazopyridine-based TSPO ligand (CB256, <B>3</B>) was prepared as the precursor. <SUP>99m</SUP>Tc- and Re-CB256 (<B>1</B> and <B>2</B>, respectively) were synthesized in high radiochemical yield (74.5% ± 6.4%, decay-corrected, <I>n</I> = 5) and chemical yield (65.6%) by the incorporation of the [<SUP>99m</SUP>Tc(CO)<SUB>3</SUB>(H<SUB>2</SUB>O)<SUB>3</SUB>]<SUP>+</SUP> and (NEt<SUB>4</SUB>)<SUB>2</SUB>[Re(CO)<SUB>3</SUB>Br<SUB>3</SUB>] followed by HPLC separation. Radio-ligand <B>1</B> was shown to be stable (>99%) when incubated in human serum for 4 h at 37 °C with a relatively low lipophilicity (log<I>D</I> = 2.15 ± 0.02). The rhenium-185 and -187 complex <B>2</B> exhibited a moderate affinity (<I>K</I><SUB>i</SUB> = 159.3 ± 8.7 nM) for TSPO, whereas its cytotoxicity evaluated on TSPO-rich tumor cell lines was lower than that observed for the precursor. In vitro uptake studies of <B>1</B> in C6 and U87-MG cells for 60 min was found to be 9.84% ± 0.17% and 7.87% ± 0.23% ID, respectively. Our results indicated that <SUP>99m</SUP>Tc-CB256 can be considered as a potential new TSPO-rich cancer SPECT imaging agent and provides the foundation for further in vivo evaluation.</P>"
P2P cloud network services for IoT based disaster situations information,2016,[],국문 초록 정보 없음,"<P>In order to cope with disaster situations properly, it is very important to identify the disaster scale and provide the accurate information of the site to the appropriate authorities including disaster site and Central Disaster Management Center, on-site command post, etc. and share the information provided. In particular, sharing information on disaster situations should control the disaster quickly to prevent the disaster situation from lasting and expanding. However, in the event of a large-scale disaster, delay is caused in the existing commercial network and therefore, the disaster situation cannot be communicated quickly and accurately. In order to determine the situation exactly in the event of a disaster, safety and connectivity of the network and flow of data are very important. Even if the stability of the network and connection of nodes are resolved in the network of each agency business operator, it is necessary to share the platform between networks for IoT/M2M communication for the smooth flow of data. Recently, the disaster safety net of combining existing disaster standard technology with Ubiquitous Technology and Smart IT such as Tetra of Europe, iDEN of the U.S., etc. has been built for disaster safety communications. In addition, systems useful for demand-centered, site-centered immediate disaster response by using Mobile, SNS, cloud computing, etc. are being built and designed to play an important role in the disaster information system especially through IoT, P2P cloud network, big data, etc. Therefore, in this paper, we proposed the P2P cloud network service for IoT based disaster situations information according to the paradigm of the changing times. The proposed service is to combine IoT/M2M network with P2P cloud service for rapid and smooth response in the event of a disaster and provide the results as social services such as SNS. To this end, the wide area wireless disaster information network system has been built in the local and each local network is connected to each other to provide disaster situations by using the server of the disaster area. At this time, each server was to be interconnected via P2P network and to be connected automatically by software-based network in P2P Cloud System. Also, the cognitive cycle was applied for selecting optimal wireless link and router of P2P Cloud-based Disaster Information Network and the danger situations of the disaster area were to be provided to the user by configuring disaster information component for providing services and building central disaster information platform managing it.</P>"
중동의 지정학적 리스크가 에너지 시장에 미친 영향,2016,"['Geopolitical Risk', 'Event Study Analysis', 'Crude Oil Price', 'Energy Supply', '지정학적 리스크', '사건분석 모형', '국제유가', '공급 불안']","본 연구는 중동의 지정학적 리스크(Geopolitical Risk)가 국제유가 등 에너지 시장에 미친 영향을 분석했다. 지정학적 리스크는 정정 불안 등 예상치 못한 비경제적인 요인으로 인해 글로벌 경제와 기업 경영에 주는 위험을 의미한다. 자스민 혁명으로 시작되어 리비아, 이집트 등으로 전이된 MENA사태, 2012년 이란의 핵개발 제재에 따른 호르무즈 해협의 군사적 긴장, 2014년 IS의 이라크 북부 장악으로 인한 이라크 사태 등 3가지 중동의 지정학적 리스크의 영향을 분석했다. 지정학적 불안이 발생하면 에너지 생산 감소와 물류 차질이 발생해 공급 불안이 생긴다. 사건분석(Event Study) 모형 분석 결과, 지정학적 리스크는 국제유가를 상승시키는 요인으로 작용하나 그 영향의 정도는 언론 등에서 예상하는 것과는 달리 제한적이었다. 2011년 MENA 사태 때는 국제유가의 2개월 누적 순 가격 변동은 5.2%, 2012년 이란 사태 때는 4.3%, 2014년 이라크 사태 때는 1.4%에 그쳤다. 지정학적 리스크의 영향력이 약해진 것은 미국, 러시아 등 공급이 다변화되었기 때문이다. 따라서 IS 등에 의해 중동에 불안이 발생하더라도 저유가가 상당 기간 지속될 가능성이 크다.","This paper analyzed the effects of geopolitical risks in the Middle East on energy markets including the crude oil price. Geopolitical risk means the danger imposed upon the global economy and corporate management due to unexpected uneconomic factors such as political instabilities. Three geopolitical risks dealt with in the paper are turmoils in Libya and Egypt caused by Arab Spring, military tension in Hormuz caused by fortified sanctions on Iran, instability in Iraq caused by IS’s occupation on Northern part of Iraq. If geopolitical instability occurred energy supply would be disrupted because of energy production reduction and logistics setbacks. According to estimation results using Event Study analysis, the geopolitical risks acted as the factor increasing the oil price but the extent of the effect was much less than the expectation of the media or other practical articles. Net change of oil price for 2 months just after the commotions of MENA in 2011 was 5.17%, and those after the conjunctions of Iran in 2012 and Iraq in 2014 were 4.31% and 1.39%, respectively. This result is mainly because the energy supply sources such as U.S. and Russia have been diversified. Therefore low oil price would continue with considerable time even if geopolitical instabilities by IS, etc in the Middle East are kept on."
The Stock Price Relevance of Accounting Information for the Companies Designated as “Issues for the Administration” according to the Causes of Designation :Application of Propensity Score Matching,2016,"['value relevance of accounting information', 'issue for administration', 'Ohlson Model', 'propensity score matching']",국문 초록 정보 없음,"The purpose of this research is to examine the stock price relevance of accounting information for the companies designated as “Issues for Administration” in the KOSPI market of South Korea. First, the value relevance of accounting information was compared between the designated companies and non－designated companies from five years prior to designation. Second, the value relevance of accounting information was compared according to the causes of designation－financial causes and non－financial causes. Third, as additional analyses, the value relevance of accounting information was compared for the sample in which designated companies were 1 to 1 matched with non－designated by propensity score matching method.The value relevance of accounting information was analyzed by the basic Ohlson model and the extended Ohlson model, which includes debts ratio and size as additional variables to the basic Ohlson model.The 174 designated non－financial firms are sampled out of the firms listed on the KOSPI between 2003 and 2015. The stock price relevance of designated companies which were disclosed as “Issue for Administration” in the Korea Investors’ Network for Disclosure System (http://kind.krx.co.kr) was compared with that of the non－designated companies(n＝7, 081).For the non－designated companies, the accounting information(EPS, Book Value, Size, and Debt ratio) has significant effect on the stock price during all the years, and the debt ratio affects the stock price in the reversed U－shape. However, for the designated companies, the basic model was insignificant in t－4 year, and only BPS and size had effects on the stock price. The value relevance of accounting information between the designated companies and the non－designated companies was different.The value relevance of accounting information was slightly different as the causes of designation－financial causes and non－financial causes. The EPS and debt ratio has no effect on the stock price in both groups while the size has significant effect in both groups. And the net book value showed difference between the financial and the non－financial cause group.When the designated companies were matched with non－designated companies by propensity score, the results were a little different from non－matched sample. In the non－designated group, only BPS and Size were significant while EPS and Debt ratio had no effect on the stock price. The value relevance of accounting information was different between the designated companies and non－designated companies.Considering these results, the value relevance of accounting information is different in the designated companies and the non－designated companies, and the value relevance of accounting information also varies according to the causes of designation. It is needed for control group to have more elaborate sampling methods in order to avoid the sampling bias in further studies."
한국테크랜드 분식회계 및 부실감사 사례,2016,"['분식회계', '부실감사', '감사위험', '상장폐지', 'accounting fraud', 'audit failure', 'audit risk', 'delisting']",국문 초록 정보 없음,"Korea Techland Ltd. (KTL henceforth) was established in 1997 as a software developer. At initial stage, KTL successfully developed networksecurity software and grow rapidly as internet was widely used and homepage became popular in the late 1990’s. As a successful venture enterprise, the firm was listed in KOSDAQ market in 2001. After the listing, the firm expand its business areas to anti-terrorism equipments, related education and consulting, nutritional supplement delivery system, and clothing shopping mall. In addition, KTL started operations in Japan and China. Although KTL pursued aggressive expansion strategy, KTL’s new attempts turned out unsuccessful. The firm’s operating performance was getting deteriorated and the firm actually suffered continuing losses from its operation and new investment. The firm changed its name when the management switched its main business to another. After all, the post-audit review performed by Korean Financial Supervisory Service revealed that KTL committed accounting fraud to inflate firm performance. The management also committed misappropriation and malpractice. As a result, the firm was delisted eventually. KTL was revealed to have overstated short-term loan, sales to the related parties, account receivables and inventory. The firm asserted that the sales of security equipment occurred via the related party located in Japan and considerable inventories were also kept in Japan. However, all the assertions of the management were found to be false. The sales through related parties were fictitious and the inventory did not exist in Japan. Moreover, the firm did not recognize impairment losses from long-term investment asset and intangible asset. Overall, KTL understated net loss amount by 44.4% in 2008, 8.7% in 2009, and 79.4% in 2010. After reflecting all the adjustments, net asset of KTL decreases from 45,550 million won in 2008 to 15,254 million won in 2010. Throughout the 3 years, adjusted sales were all below 3,000 million won which is the amount of criteria for judging delisting. In spite of such a serious problem inherent in financial statement reporting, two audit firms that audited KTL for 2008 and 2009 failed to find out the accounting fraud and did not perform quality audit. Although the two audit firms recognized that KTL experienced consecutive operating losses and was under the pressure of delisting, they did not conduct appropriate audit process. First, they ignored the importance of audit risk assessment which reflects the risk of business, accounting system, and internal control of the client firm. If they have assessed audit risk as high and thus reflect the risk in the audit process, they would expand audit scope and increase substantive tests. Second, they did not evaluate collectibility of loan and did not assess its collateral, which enables KTL to overstate its short-term loan. Third, the auditors did not focus on abnormally large transactions with related parties and thus miss fictitious sales. In addition, they did not confirm the existence of inventory in Japan. Although the inventory was in the foreign country, the auditors should have request cooperation of accounting firms in Japan to confirm the existence of inventory if the amount of inventory was significant. Lastly, the audit firms did not review financial statement of investee to assess the long-term equity investment and intangible asset(sales right). At that time, the operating performance of investee located in U.S. was deteriorated and the operation of main production facilities was already stopped in 2010. But, the auditors did not notice the facts and just accept the amount of equity investment suggested by KTL. Through this case, students can understand the deteriorating process of a venture firm and accounting frauds occurred in the process. More specifically, students are able to learn the ways that the management of KTL used to commit accounting fraud and why audit firms fail to find the fraud. Also, students can find out features of external audit of small and medium-sized firms. Even though the management of small and medium-sized firms are more likely to commit misappropriation and malpractice, and thus exposed to higher audit risk, auditors tend to input relatively smaller audit efforts due to the small audit fees of such clients. From this case, we need to perceive the importance of thorough audit risk assessment for small and medium-sized firms, sufficient audit efforts based on the assessed audit risk, and the realization of audit fees to support the enough audit efforts."
미국 침해부당이득법에서의 수익전부반환책임(Disgorgement)과 초과수익의 반환 - 반환범위의 획정기준으로서 인과관계 등의 문제,2016,"['수익전부반환책임', '침해부당이득', '미국 부당이득법 제3차 리스테이트먼트', '초과이득반환', '운용이익반환', '위법행위', '인과관계', 'Disgorgement', 'Restitution for Wrongs', 'Restatement (Third) of Restitution and Unjust Enrichment', 'Wrongs', 'Causation', 'Attribution', 'Accounting for Profits', 'Restoration of Proceeds and Consequential Gains.']","우리 부당이득법은 공평의 이념을 기초로 하여 그에 반하는 재산귀속상태를 교정하는 것에 본질을 두고 있으며, 통설과 판례는 민법 제741조를 우리 부당이득제도의 통일적 지도원리규정으로 파악하여 이로부터 모든 유형의 부당이득의 성립요건을 도출한다. 부당이득의 성립요건 중 하나인 손실은 수익자의 반환범위를 결정함에 있어서도 특정의 역할을 담당하고 있는 바, 즉 우리 통설과 판례는 수익자가 반환해야 할 이득의 범위는 손실자의 손해를 한도로 정해진다고 한다. 이에 대해 타인 권리를 침해함으로써 발생한 이익이 손실자의 손실을 초과한 경우에 그 초과수익을 반환범위에 포함시키지 아니하는 것은 부당하다는 반론이 제기되고 있다. 그런데 미국 침해부당이득법상 인정되는 수익전부반환책임에서는 손실자의 손해에 구애됨이 없이 초과수익까지도 전부 반환범위에 포함시키고 있다. 이는 미국 침해부당이득법이 위법행위에의 유인을 차단하고 억지하려는 정책적 고려에 따른 결과라고 할 수 있다. 이렇듯 미국 침해부당이득법이 주력하고 있는 위법행위에의 억지기능은 우리 부당이득법의 제도적 취지와 다소 이질적인 면이 있다. 그러나 미국 침해부당이득법을 포함한 전체 부당이득법의 궁극적 지향점은 공평과 정의의 실현이므로 결과적으로 우리 부당이득법의 목적과 크게 다르지 않다. 이렇게 본다면, 양국의 침해부당이득법은 구체적 접근방식에 차이가 있을 뿐 궁극적으로 지향하는 가치가 다르다고 볼 것은 아니다. 게다가 어느 법제에서든 부당한 이익귀속상태를 제거하기 위해 합리적 반환범위를 획정하는 작업 그 자체는 정당한 것이며, 이는 우리 부당이득법의 목적에 억지기능이 포함될 수 있는지 여부와 관계없이도 충분히 고민해 볼 가치가 있다. 그렇다면 비록 완전히 일치하지 않은 목적과 배경을 가진 미국 침해부당이득법이라고 하더라도 합리적 반환범위를 찾아내는 작업에 있어서는 우리 부당이득법과 상호호환관계에 있다고 보아도 무방할 것이다. 특히 미국 침해부당이득법 상의 attribution법리와 그 하위기준으로서 인과관계 등의 심사기준들은 우리 침해부당이득법에서도 참고할 만한 내용들이라고 생각한다.","The Korean Law of Unjust Enrichment is designed to correct allocations of legitimate interests or properties, corresponding to fairness and justice. The Korean commentators and courts have long viewed the Korean Civil Code §741 as a fundamental principle governing all types of unjust enrichment and provided the four-factor test based on the provision, which is for determining whether or not the defendant has unjust enrichment. According to their theories, the loss as one of those four factors plays a role to restrict the defendant's liability to restitution because the value of benefits being defined unjust enrichment is not more than the plaintiff's loss. Consequently, the defendant who is enriched by the misconduct may keep the wrongful gain in excess of the plaintiff's loss. In the same matter, however, the U.S. Law of Restitution and Unjust Enrichment approves the disgorgement remedy, which allows the plaintiff to recover the net increase in the assets of the defendant(wrongdoer), to the extent that this increase is attributable to the underlying wrong. The disgorgement disallows any implication that the defendant's wrongful gain must correspond to a loss on the part of the plaintiff. This is based on the policy consideration that stripping the wrongdoer of a wrongful gain is a very effective deterrent for wrongdoers. It is debatable whether the deterrence may be embodied in and harmonized with the Korean law of unjust enrichment. However, defining a resonable scope or liability of restitution is just in any country, and it does not run counter to the purpose of the Korean law of unjust enrichment. Thus, it is not impossible to draw some implication for improving the Korean legal rules of unjust enrichment through the comparison with the U.S. law of restitution and unjust enrichment. Especially, it deserves consideration of the attribution rule and its substandard, for example, causation and remoteness, apportionment, etc in the U.S. law of restitution for wrong."
