title,date,keywords,abstract,multilingual_abstract
장학재단의 장학사업 제고를 위한 법제도 및 세제 개선방안,2016,"['장학재단', '장학활동', '출연재산', '기본재산', '보통재산', 'scholarship foundation', 'activities for public interest', 'property contributions', 'fundamental property', 'general property']","우리나라의 장학단체(특히 재단)는 전체 공익단체(종교법인 제외)의 28.7%로 가장 많은 비중을 차지하고 있다. 이들 단체에게는 다른 비영리법인의 경우와 동일하게 여러 세제상의 혜택이 주어지고 있다. 이 논문에서는 장학재단에 대한 세제혜택만큼 장학사업이 제대로 이행되고 있는가를 평가하기 위해 602개 장학법인의 결산서류를 분석하는 한편, 이를 미국 및 일본의 경우와 비교하였다.그 결과 장학금 지급이라는 직접적 지출비중이 주요국에 비해 매우 낮다는 점과 재산을 상당히 비효율적으로 운용하는 것으로 평가되었다. 그 이유는 현행의 장학재단 관련 법제도와 세제가 ‘기본재산’ 유지에만 초점이 맞추어져 있어서 장학재단의 재산적 활동범위를 ‘보통재산’에 한정하는 한편 ‘기본재산’의 처분을 주무관청의 허가로 봉쇄하는 등 재단소유 재산의 대부분을 직접적인 장학금 지급의 재원으로 사용하지 못하도록 하는 것에서 찾을 수 있다.이러한 문제점을 극복하고 장학사업 지출비중을 높이기 위해서는 다음과 같은 개선방안이 요구된다.첫째, 종전 ‘기본재산’의 처분을 자유롭게 허용하여야 한다. 장학재단은 장학사업의 특성상 특별한 시설을 필요로 하지 않아 출연재산의 처분을 엄격하게 규제하여야 할 이유가 없다. ‘기본재산’의 자유로운 처분을 위해서는 출연재산과 ‘기본재산’의 개념을 달리하여야 한다. 이를 위해 출연재산의 최소기준을 법제화하거나 ‘기본재산’을 ‘보통재산’으로 용도변경하기 위한 요건을 크게 완화할 필요가 있다.둘째, ‘기본재산’으로부터 얻어지는 과실소득 즉, ‘보통재산’이 충분히 확보될 수 있도록 해야 한다. 장학활동의 직접적인 재원은 ‘보통재산’이기 때문이다. ‘보통재산’의 경우에도 ‘기본재산’과 같이 설립허가시 출연하한요건을 신설하고, 일정 출연하한요건을 어긴 경우 세제상 불이익을 주는 방법, ‘기본재산’ 과 비교하여 ‘보통재산’의 출연비율이 높을수록 세제상 혜택을 부여하는 방법을 고려하여야 한다.셋째, 장학활동에 대한 지출이 높아지도록 순투자자산 대비 장학활동 지출이 적은 경우에는 미국연방세법상 유보소득 가산세제도와 같은 제재를 가하는 방법, 장학재단의 총비용 중 장학금의 지급금액이 일정비율 이하인 경우 가산세를 부과하거나 손금불산입하는 등의 불이익을 주는 제재방안도 필요하다.선행연구들이 공익법인 전체에 대하여 주로 설립절차의 완화, 공익성 검증을 위한 기관의 설치, 주식출연 한도의 완화 등을 중심적 과제로 다룬 것에 비해 이 논문은 장학재단의 재산처분에 자율성을 보장함으로써 그 공익성을 제고하는 방안을 제시함에 차별성이 있다.","Scholarship organization occupies the largest share with 28.7% of the overall public interest organizations except religious corporation in South Korea. These organizations have had many tax benefits have been given compared to other non－profit corporation. In this paper, we analyze the statements of subsidiaries 602 scholarships to assess whether there is a scholarship program being implemented properly as tax incentives for scholarship. As a result, direct expenditure such as scholarship expenditure is very lower than U.S and Japan do. It is evaluated by management quite inefficient.The problem is our political regulations focus on ‘fundamental property’. Related laws allow scholarship foundations to use ‘general property’ for their business, but the disposal of the ‘fundamental property’ shall be approved. these limitations restrict to activate the scholarship business.In order to overcome these problems mentioned and increase the scholarship program expenditure, it may be presented to the following improvements.First, it should be allowed to freely dispose of the former ‘fundamental property’. Scholarship Foundation as public organization does not require special tangible facilities, regarding of the nature of the scholarship, there is no particular reason to be strictly regulated the disposal of assets appearances. It is necessary that distinguish between ‘fundamental property’ and ‘general property’ for activating scholarship foundations. Legislated minimum standards of the properties are required or there is a need to alleviate the requirement for changes to the applications fundamental property and general property.In addition to improvement of ‘fundamental property’, ‘general property’ which is generated by ‘fundamental property’ should be more encouraged. Because the direct source of scholarship is from ‘general property’, like ‘fundamental property’, it also requires lower bound for ‘general property’. If lower bound requirement is hard to match establishment, there are two examples of alternatives. First, we can impose penalty if organizations do not to meet lower bound requirements. Second, as ratio of normal property is higher, the more tax benefits are granted.Third, in order to increase the expenditure related to scholarships, penalty is required unless organization spent scholarship lower than net investment. such as additional taxes on reserved earnings. Another way is the inclusion in gross revenue if total expenses are lower than scholarships.Previous studies have mainly discussed installation of the Institute for Public Interest verification, equity relief appearances limits such as the establishment of procedures. Our study suggests ensuring the autonomy of property disposal of the scholarship foundation as a way to improve scholarship foundation."
Effect of 60Co g-ray irradiation on electrical properties of Ti/Au/ GaAs1xNx Schottky diodes,2016,['g-ray irradiation Schottky diode Ideality factor IeV CeV-f G/u-V-f measurements'],국문 초록 정보 없음,"Current-voltage (I-V), capacitance-voltage-frequency (C-V-f) and conductance-voltage-frequency (G/u-V-f) measurements at room temperature are used to study 50 kGy 60Co g-ray electrical properties irradiation dependence of Ti/Au/GaAs1xNx Schottky diodes with 0.2%; 0.4%; 0.8% and 1.2% nitrogen dilution. This g-ray irradiation induces a permanent damage that has increased ideality factor and series resistance for all samples. It was accompanied by a decrease in Schottky barrier height with nitrogen content up to 0.4%N and remained constant thereafter. Radiation was also found to degrade the reverse leakage current.At high frequency (1 MHz), capacitance and conductance decreased after radiation due to a decrease in net doping concentration. Interface state density and series resistance were determined from C-V-f and G/u-V-f characteristics using Hill-Coleman methods. Interface states density exponentially decreased with increasing frequency confirming the behavior of interface traps response to ac signal.Series resistance increases after irradiation is attributed to carrier's removal effect andmobility degradation. It has two peaks in the accumulation and inversion region for some diodes (0.4%N, 0.8%N). g-ray irradiation produced traps levels and recombination centers that reduce relaxation time. An increase in %N content can impede irradiation damagewith even some compensationwhen the percent of diluted nitrogen is high (1.2%N)."
이미지기반 딥러닝 모델을 활용한 공극률 계측과 콘크리트 탄산화 깊이 예측모델,2022,"['탄산화', '공극률', '영상 분할', '딥러닝', '인공신경망', 'Carbonation', 'Porosity', 'Image Segmentation', 'U-net', 'Deep Learning', 'ANN']",국문 초록 정보 없음,다국어 초록 정보 없음
"A new record of sea star genus Pteraster (Asteroidea: Velatida: Pterasteridae) from the East Sea, Korea",2016,"['East Sea', 'Korea', 'morphology', 'Pteraster militaris', 'sea star', 'taxonomy']",국문 초록 정보 없음,"An asteroid specimen was collected from Jumunjin, Gangwon-do in the East Sea, Korea at a depth of 50 m using fishing nets on 26 May 2013. It was identified as Pteraster militaris (O.F. $M{\ddot{u}ller$, 1776) belonging to the family Pterasteridae of the order Velatida based on morphological characteristics. This species is usually distributed in the cold boreal zone around northern Pacific and Atlantic, and is distinctly distinguished from P. tesselatus which was reported in Korean fauna: body form, length ratio of arm to disc and surface of dorsal membrane."
전통사찰음식 대중화를 위한 사찰음식에 대한 인식과 음식 선호도연구,2016,"['전통사찰음식', '사찰음식 인식', '사찰음식 선호도', '전통 사찰음식 대중화 방향', 'Traditional Temple Food', 'Temple Food Recognized', 'Temple Food Preferences', 'Traditional Temple Food Popularized Direction.']","본 연구의 목표는 한국 전통사찰음식에 대한 관광객을 대상으로 사찰음식의 인식과 선호 도 조사하여 결과에 따라 사찰음식 대중화 전략방안을 제시하는데 목적이 있다. 대중화를 위한 방향과 가능성을 알아보기 위해서 사찰음식의 인식도와 선호도를 비슷한 특징을 갖는 관측 값들끼리 집단으로 세분화하여 특성을 제시하고 이를 인구 통계적 특성과 이용행태로 분류하였다. 표본은 사찰음식의 경험을 가지고 사찰을 방문하는 관광객으로 선정하여 설문 조사를 실시하고 유효표본 216부의 설문지를 직접 설문응답자를 통하여 조사를 하였으며, 세부적으로 사찰음식의 인식도와 선호도변수의 타당도와 신뢰도를 살펴보고, 표본 응답자를 동질 특성별로 분류 분석하여 사찰음식의 인지와 선호의 특성분류 그룹별 차이 검정을 실시하여 집단별 차이를 알아보기 위해서 계층군집분석, K-평균군집 분석, 판별분석을 통해 검증을 실시하기 위해서 SPSS 22 프로그램을 사용하였다. 연구결과 ‘높은 인식’군은 연령에서 40-49세가 가장 많은 사찰음식의 분포를 나타내었고 ‘낮은 인식’군으로는 직업에서 학생이 가장 많은 분포를 나타내었으며 선호도에서는 동반자 에서 가족이 ‘높은 선호’군으로 가장 많은 분포를 나타냈고 ‘낮은 선호’군은 직업에서 가정주 부가 가장 많은 분포를 나타내었다. 결과적으로 사찰음식 대중화를 위해서는 40-49세의 인 식도를 중심으로 가족이 사찰음식을 선호하는 것이 전통사찰음식의 대중화를 위한 방향임을 나타내었다. 연구결과는 전통사찰음식 대중화에 대한 전략의 방향을 제시를 함으로서 한민족 고유의 문화적, 종교적 성격을 갖는 귀중한 사찰음식 관광자원의 대중화 전략방안으로 활용이 가능 할 것으로 사료된다.","The aim of this study aims to establish a strategy popularized temple food along the food temple recognized and ranked as a tourist destination for Korea traditional temple food. To determine the direction and possibilities for popularization examine the validity and reliability of perception and preference variables of the temple food, the analysis classifies the sample of respondents for each homogenous characteristics by conducting a property classified by group differences in test of perception and preferences o f temple food to evaluate the population difference.The population was u sing the SPSS 22 program was to direct respondents through a survey a total o f 216 questionnaires targeting tourists visiting the temples, through a hierarchical cluster analysis, K- means clustering analysis, discriminant analysis conducted for verification.Analysis "" high awareness "" group showed the distribution of age at 40-49 years old, most food temple ' low awareness ' group in this "" highly preferred "" partner families in preferences showed the students the most in professional distribution It showed the largest distribution group in the ' low preference ' group showed the highest number of house wives in the distribution of jobs. This study is a valuable food with a granular recognized as a Korean-specific cultural and religious characteristics of the were presented the characteristics to refine the perception and preference of the temple food to between o b served values groups with similar features traditional temples, based on a study of food It is considered highly valuable tourist resource utilization. In addition, temple can be used as a dietary food therapy, food tourism, alternative medicine as the convergence of business and interdisciplinary net work configuration, especially in the traditional temples is expected to be used as a Temple Stay core brands."
1970~80년대 농촌근대화와 로컬시간의 재구성,2016,"['로컬시간', '국가시간', '자본시간', '창평일기', '성과주의', 'Local time', 'National time', 'Capital time', 'Changpyung Diary', 'Performance principle']","본 연구는 1970~80년대 근대화를 경험하는 농촌의 로컬시간을 분석한 것이다. 로컬시간을 ‘로컬의 고유한 리듬 혹은 시간’으로 정의하였다. 이 시간은 로컬 구성원들의 일상생활 과정에서 만들어지는 것으로, 로컬의 내재적 속성 즉 에너지를 구성한다. 로컬시간은 다양하게 존재하며, 로컬외부에서 작동하는 국가시간이나 자본시간과 충돌, 포섭, 재구성 등의 양상을 보인다.  본 연구는 로컬시간 탐색을 위해 전라북도 임실군 창인리에서 살았던 최내우가 쓴 『창평일기』를 분석하였다. 이 일기는 1970~80년대 농촌근대화 과정을 상세하게 기록하고 있다. 이 마을사람들은 농업에 종사하였기 때문에 자연에 의존적인 시간을 가지고 있었다. 그런데 이 시기 국가의 국민 포섭의 한 방법은 시간 지배였다. 농민들의 생활리듬인 로컬시간은 성과주의로 대표되는 국가시간과 충돌하였다. 마을사람들은 국가시간에 포섭되기도 하지만, 국가시간을 비켜갈 수 있는 자신들의 시간을 구성하기도 하였다. 이 시기 국가시간은 마을사람들의 생활리듬을 빠르게 만들었고, 한편으로는 경제적으로 곤란하게 만들었다.  로컬시간의 연구는 글로벌시대의 빠른 시간에 무조건 흡수되지 않는 개체의 고유한 시간의 필요성을 제기한다. 이것이 로컬사람들의 삶을 안전하게 만들어 줄 수 있는 안전망이 될 수 있기 때문이다.","This study analyzed local time of agricultural communities experienced modernization in the 1970s to 1980s. Local time was defined as ‘a unique local rhythm or time.’ This time is made in the process of local members’ daily life, which constitutes the implicit local property, that is, energy. Local time exists in various ways and shows aspects such as crashes, subsumption and reconstitution with national time or capital time operating outside the local area.  This study analyzed Changpyung Diary written by Nae-u Choi who lived in Chang-in-ri, Imsil-gun, Jeollabuk-do Province in order to explore local time. This diary records the process of the modernization of agricultural communities in the 1970s and 1980s in detail. Since the village people worked in agriculture, they had a time dependent to nature. However, the state would dominate them by taking over the peasants’ time. There are increasing cases of the collision of local time, the rhythm of the peasants’ life to national time, characterized by the performance principle. Village people were persuaded by national time, while they constituted their own time by which they could move around national time. The national time during this period made the rhythms of village people’s life faster on the one hand and made it economically more difficult on the other hand.  Studies of local time raise the necessity of a time peculiar to the individual, not absorbed into the fast time in the global era, unconditionally. It is because this can be a safety net that can make local people’s life safe."
미국 민간위탁법제상 국가사무의 기능적 유형화와 공인선박검사기관(RO)의 지위 일고찰,2016,"['민간위탁', '본래적 정부기능', '상사적 기능', '선박검사', '공인선박검사기관', 'Delegation', 'Inherently Governmental Function', 'Commercial Function', 'Ship inspection', 'Recognized Organization']","매우 빠르게 확장되어 가고 있는 지식산업사회, 안전사회 및 복지사회 등의 양태는 정부에게 그에 상응하는 공적 기능의 정교화를 요구하게 되었다. 그에따라 정부가 수행하는 국가사무는 단순반복적인 것에서부터 고도의 과학기술적인 사안에 이르기까지 비약적으로 다양화되었고 복잡하게 되었다. 정부는 국가사무를 한정된 예산 내에서 효율적으로 이행하기 위해 점차 민간에게 사무를 맡겨 처리하게 함으로써 행정의 간소화와 시민의 참여확대를 도모하게 되었다. 정부가 민간에게 국가사무를 맡기는 방식은 대한민국은 정부조직법상 민간위탁이 상정되어 있으나 개별법상으로는 대행 등이 많이 활용되고 있다. 해상의 분야에 있어서는 주로 국제항행선박에 대해서 국제협약, 국내법령, 선급규칙 등에 따라 감항성에 관한 규칙적합성 검사를 수행하는 선급법인과 같은 민간 선박검사단체가 정부로부터 일정한 위탁유사의 관계를 맺고 국가사무에 참여하고 있다. 이 글에서는 민간위탁제도가 가장 오랫동안 정립되어 왔고 국가사무를 기능적으로 유형화하여 운용하고 있는 미국의 위탁제도를 살펴보고 그 제도내 공인선박검사기관에 대한 규제가 어떻게 형성되어 있는지 살펴보고자 한다.","Today’s society requires a government to perform a diversity of complex contemporary challenges such as knowledge-based high-end industrial needs, SHEQ-related systematic requirements and welfare-securing social safety nets, which extensively range from a very simple recurring task to a state of the art technology based measure including technical inspection of vessels in accordance with statutory and international requirements. Within the limited government budgets, however, those challenges have constantly led governments to more and more rely upon private sectors in terms of their expertises and experiences as well as participatory democracy so that a streamlined and effective government functionality may be realized and structurally stabilized to the satisfaction of voting citizens and taxpayers. Thus, since the late 1970s, every country's legal environment scrambled to embrace the system of delegation of government tasks to a private sector with each developing its own version of law and administration, and so did the Republic of Korea legislating delegative norms under the Government Organization Act and its implementing regulations, which, however, due to their restrictive approach, are said to insufficiently reflect the reality of critical functions with regard to the mandatory vessel inspections and the Recognized Organization(RO)'s legal relation with a government. In the meanwhile, the delegation of governmental authority to a private sector in the United States is often evaluated to have gone through a lot of practical and normative experiments and accumulative administrative experiences, making it all worthwhile to benchmark their approach. Therefore, in this paper, peeping into the delegation system of the United States would benefit us to understand how to define or clarify the nature of vessel inspection activities and the legal position of the ROs under the laws of delegation in light of their conventional and transhistorical contributory values to safety at sea"
