title,date,keywords,abstract,multilingual_abstract
k-NN Join Based on LSH in Big Data Environment,2018,"['Big data', 'High dimension', 'k-NN join', 'LSH', 'Spark']",,"k-Nearest neighbor join (k-NN Join) is a computationally intensive algorithm that is designed to find k-nearest neighbors from a dataset S for every object in another dataset R. Most related studies on k-NN Join are based on single-computer operations. As the data dimensions and data volume increase, running the k-NN Join algorithm on a single computer cannot generate results quickly. To solve this scalability problem, we introduce the locality-sensitive hashing (LSH) k-NN Join algorithm implemented in Spark, an approach for high-dimensional big data. LSH is used to map similar data onto the same bucket, which can reduce the data search scope. In order to achieve parallel implementation of the algorithm on multiple computers, the Spark framework is used to accelerate the computation of distances between objects in a cluster. Results show that our proposed approach is fast and accurate for high-dimensional and big data."
Analysis of Market Trajectory Data using k-NN,2018,"['Data Analytics', 'Statistical Analytics', 'K-Nearest Neighbors Algorithm', 'Point of Sales Data', 'Trajectory Data']",,"Recently, as the sensor and big data analysis technology have been developed, there have been a lot of researches that analyze the purchase-related data such as the trajectory information and the stay time. Such purchase-related data is usefully used for the purchase pattern prediction and the purchase time prediction. Because it is difficult to find periodic patterns in large-scale human data, it is necessary to look at actual data sets, find various feature patterns, and then apply a machine learning algorithm appropriate to the pattern and purpose. Although existing papers have been used to analyze data using various machine learning methods, there is a lack of statistical analysis such as finding feature patterns before applying the machine learning algorithm. Therefore, we analyze the purchasing data of Songjeong Maeil Market, which is a data gathering place, and finds some characteristic patterns through statistical data analysis. Based on the results of 1, we derive meaningful conclusions by applying the machine learning algorithm and present future research directions. Through the data analysis, it was confirmed that the number of visits was different according to the regional characteristics around Songjeong Maeil Market, and the distribution of time spent by consumers could be grasped."
Constraints on jet quenching in p–Pb collisions at <sub> s NN </sub> = 5.02 TeV measured by the event-activity dependence of semi-inclusive hadron-jet distributions,2018,,,"<P><B>Abstract</B></P>  <P>The ALICE Collaboration reports the measurement of semi-inclusive distributions of charged-particle jets recoiling from a high-transverse momentum trigger hadron in p–Pb collisions at    <SUB>  s   NN  </SUB>   = 5.02  TeV. Jets are reconstructed from charged-particle tracks using the anti- <SUB>  k   T  </SUB>  algorithm with resolution parameter  R = 0.2  and 0.4. A data-driven statistical approach is used to correct the uncorrelated background jet yield. Recoil jet distributions are reported for jet transverse momentum  15 <   p   T , jet   ch   < 50  GeV / c  and are compared in various intervals of p–Pb event activity, based on charged-particle multiplicity and zero-degree neutral energy in the forward (Pb-going) direction. The semi-inclusive observable is self-normalized and such comparisons do not require the interpretation of p–Pb event activity in terms of collision geometry, in contrast to inclusive jet observables. These measurements provide new constraints on the magnitude of jet quenching in small systems at the LHC. In p–Pb collisions with high event activity, the average medium-induced out-of-cone energy transport for jets with  R = 0.4  and  15 <   p   T , jet   ch   < 50  GeV / c  is measured to be less than 0.4  GeV / c  at 90% confidence, which is over an order of magnitude smaller than a similar measurement for central Pb–Pb collisions at    <SUB>  s   NN  </SUB>   = 2.76  TeV . Comparison is made to theoretical calculations of jet quenching in small systems, and to inclusive jet measurements in p–Pb collisions selected by event activity at the LHC and in d–Au collisions at RHIC.</P>"
Nuclear modification factor of D<sup>0</sup> mesons in PbPb collisions at <sub> s NN </sub> = 5.02 TeV,2018,"['Physics', 'Suppression', 'Quark gluon plasma', 'Shadowing', 'D-meson', 'Open heavy-flavour']",,"<P><B>Abstract</B></P>  <P>The transverse momentum ( <SUB>  p   T  </SUB> ) spectrum of prompt  <SUP>  D   0  </SUP>  mesons and their antiparticles has been measured via the hadronic decay channels  <SUP>  D   0  </SUP> → <SUP>  K   −  </SUP> <SUP>  π   +  </SUP>  and  <SUP>    D  ‾    0  </SUP> → <SUP>  K   +  </SUP> <SUP>  π   −  </SUP>  in  p p  and PbPb collisions at a centre-of-mass energy of 5.02 TeV per nucleon pair with the CMS detector at the LHC. The measurement is performed in the  <SUP>  D   0  </SUP>  meson  <SUB>  p   T  </SUB>  range of 2–100  GeV/ c  and in the rapidity range of  | y | < 1 . The  p p  (PbPb) dataset used for this analysis corresponds to an integrated luminosity of 27.4 pb<SUP>−1</SUP> (530 μb<SUP>−1</SUP> ). The measured  <SUP>  D   0  </SUP>  meson  <SUB>  p   T  </SUB>  spectrum in pp collisions is well described by perturbative QCD calculations. The nuclear modification factor, comparing  <SUP>  D   0  </SUP>  meson yields in PbPb and  p p  collisions, was extracted for both minimum-bias and the 10% most central PbPb interactions. For central events, the  <SUP>  D   0  </SUP>  meson yield in the PbPb collisions is suppressed by a factor of 5–6 compared to the  p p  reference in the  <SUB>  p   T  </SUB>  range of 6–10  GeV/ c . For  <SUP>  D   0  </SUP>  mesons in the high- <SUB>  p   T  </SUB>  range of 60–100  GeV/ c , a significantly smaller suppression is observed. The results are also compared to theoretical calculations.</P>"
BCI에서 기계 학습을 위한 간질 뇌파 특징 선택을 통한 차원 감소 방법 분석,2018,"['뇌-컴퓨터 인터페이스. 뇌파', '기계학습', '뇌전증', 'BCI', 'EEG', 'Machine Learning', 'Epilepsy']","지금까지 뇌파(Electroencephalography - EEG)는 뇌전증 진단 및 치료를 위한 가장 중요하고 편리한 방법이었다. 그러나 뇌전증 뇌파 신호의 파형 특성은 매우 약하고 비 정지 상태이며 배경 노이즈가 강하기 때문에 식별하기가 어렵다. 이 논문에서는 간질 뇌파의 특징 선택을 통한 차원 감소를 통한 분류 방법의 효과를 분석한다. 우리는 차원 감소를 위해 주 요소 분석, 커널 요소 분석, 선형 판별 분석 방법을 사용하였다. 차원 감소 방법의 성능 분석을 위해 Support Vector Machine （SVM）, Logistic Regression (LR), K-Nearestneighbor (K-NN), Decision Tree (DR), Random Forest (RF) 분류 방법들을 사용해 평가하였다. 실험 결과에 따르면, PCA는 SVM, LR 및 K-NN에서 75% 정확도를 나타냈다. KPCA는 SVM과 K-KNN에서 85%의 성능을 보였으며 LDA는 K-NN를 이용했을 때 100 %의 정확도 보여주었다. 따라서 LDA를 이용한 차원 감소가 뇌전증 EEG 신호에 대한 최고의 분류 결과 보여주었다.","Until now, Electroencephalography (EEG) has been the most important and convenient method for the diagnosis and treatment of epilepsy. However, it is difficult to identify the wave characteristics of an epileptic EEG signals as it is very weak, non-stationary and has strong background noise. In this paper, we analyse the effect of dimensionality reduction methods on Epileptic EEG feature selection and classification. Three dimensionality reduction methods: Pincipal Component Analysis（PCA）, Kernel Principal Component Analysis (KPCA) and Linear Discriminant Analysis （LDA）were investigated. The performance of each method was evaluated using Support Vector Machine （SVM）, Logistic Regression (LR), K-Nearestneighbor (K-NN), Decision Tree (DR) and Random Forest (RF). From the experimental result, PCA recorded 75% highest accuracy in SVM, LR and K-NN. KPCA recorded 85% best performance in SVM and K-KNN while LDA achieved 100% accuracy in K-NN. Thus, LDA dimensionality reduction is found to provide the best classification result for epileptic EEG signal."
Noise-tolerance Investigation into Dual-kNN Pattern Classification,2018,"['k-NN', 'Dual-kNN', 'Logistic regression', 'Neural network', 'Robustness']",,"The performance of an algorithm is usually measured in three dimensions (simplicity, processing time, and prediction power). In addition, we should take into account the noise resistance level in those measures. For this reason, this paper focuses on investigating the noisetolerance level of dual k-nearest neighbors (dual-kNN) primarily based on five noisy medical diagnosis problems. Literally, dual-kNN is a reborn version of the k-nearest neighbors (k-NN) algorithm with a new observation idea in the classification process with a collaborative effort between the first and second nearest neighbors of an observed instance. It was recently proven that dual-kNN has high prediction accuracy for a variety of real-world data sets, especially so in unbiased data sets. Thus, in this report, not only the prediction accuracy of dual-kNN is compared with normal k-NN, logistic regression, and the neural network, but we additionally investigate the noise tolerance in the aforementioned approaches. The practical data sets applied in this paper are medical data files from the University of California, Irvine, Machine Learning Repository. In this report, the new approach to dual-kNN commences with better prediction accuracy, and higher noise resistance is presented, in comparison with normal k-NN, logistic regression, and neural networks."
Investigation into Tolerance of Mislabeling when Classifying Patterns with Dual-kNN,2018,"['Dual-kNN', 'Density-based kNN', 'k-NN', 'Mislabeled noise']",,"As we know, machine learning algorithms are powerful tools for a variety of application domains, giving widely divergent dimensions, such as reliability, precision, robustness, high-speed solutions, etc. Likewise, the other critical dimension that a well-designed learning algorithm should occupy is strength against unpredictable and phenomenal noise. For this critical dimension, we introduce a new approach, dual k-nearest neighbors (dual-kNN), to investigate the tolerance level for mislabeling based on different injected-noise levels. Literally, dual-kNN is a reborn algorithm of k-nearest neighbors (k-NN) aiming to reduce the influence of a steady decrease in prediction accuracy over increasing k values. What is more, dual-kNN is proven to have higher classification accuracy in many application domains. For the primary goal of this paper, we mainly emphasize investigating dual-kNN’s resistance level to mislabeled classes. Provably, our empirical experimentations describe how dual-kNN has a higher resistance level to mislabeling than normal k-NN, density-based kNN, and logistic regression, for noise levels of up to 50%. The practical datasets applied within this paper are medical data files from the University of California, Irvine (UCI) Machine Learning Repository."
Short-term Prediction of Localized Heavy Rain from Radar Imaging and Machine Learning,2018,"['Dual-kNN', 'kNN', 'Machine learning', 'Robustness', 'Weather forecasting']",,"Heavy rainfall has frequently caused serious flooding and landslides, increasing traffic delays in most parts of the world. Consequently, the people in areas battered by heavy rainfall face many hardships. Thus, the negative effects of torrential rainfall always remind researchers to keep seeking the ways to prevent such damage. Therefore, we designed a system for short-term prediction of localized heavy downpours by using radar images coupled with a machine learning method. Here, we introduce a new approach, named dual k-nearest neighbor (dual-kNN), for shortterm rainfall prediction by upgrading the ordinary classification routines of classical k-nearest neighbors (k-NN). dual-kNN is able to maintain highly robust classification of various K values with an advanced simple dual consideration, where observation of a targeted object can be found not only in the specified region but also in other related regions. We conducted experimentations using 2011, 2013, and 2014 data sets collected from the WITH small-dish aviation radar installed on the rooftop of Information Engineering, University of the Ryukyus. Then, we compared the prediction accuracy of our new approach with classical k-NN. It was experimentally confirmed with test cases and simulations that the performance of dual-kNN is more effective than classical k-NN."
Improved Neighborhood Search for Collaborative Filtering,2018,"['Personalized experts', 'Recommender system', 'Collaborative filtering', 'Support vector machine']",,"k-Nearest Neighbor (k-NN) and other user-based collaborative filtering (CF) algorithms have gained popularity because of the simplicity of their algorithms and performance. As the performance of such algorithms largely depends on neighborhood selection, it is important to select the most suitable neighborhood for each active user. Previous user-based CF simply relies on similar users or common experts in this regard; however, because users have different tastes as well as different expectations for expert advice, similar users or common experts may not always be the best neighborhood for CF. In search of a more suitable neighborhood, so-called personalized experts develop personalized expert features. Through experimentation, we show that personalized experts are different from similar users, common experts, or similar common experts. The personalized, expert-based CF algorithm outperforms k-NN and other user-based CF algorithms."
Improved Neighborhood Search for Collaborative Filtering,2018,"['Personalized experts', 'Recommender system', 'Collaborative filtering', 'Support vector machine']",,"k-Nearest Neighbor (k-NN) and other user-based collaborative filtering (CF) algorithms have gained popularity because of the simplicity of their algorithms and performance. As the performance of such algorithms largely depends on neighborhood selection, it is important to select the most suitable neighborhood for each active user. Previous user-based CF simply relies on similar users or common experts in this regard; however, because users have different tastes as well as different expectations for expert advice, similar users or common experts may not always be the best neighborhood for CF. In search of a more suitable neighborhood, so-called personalized experts develop personalized expert features. Through experimentation, we show that personalized experts are different from similar users, common experts, or similar common experts. The personalized, expert-based CF algorithm outperforms k-NN and other user-based CF algorithms."
기상 데이터를 활용한 가스사고위험 예보에 관한 연구,2018,"['Weahter Database', 'Accident Database', 'K-Nn', 'Decision Tree', 'Intelligent Analysis Model']",,"While accident data are used to show alertness to accidents or to review similar cases, the analysis of nature of accident data its association with surrounding environment is very insufficient. Therefore, it is very necessary to demonstrate the possibility of an accident for a particular region by developing analysis techniques with the related accident data. The purpose of this study is to develop an analysis model and implement a system that produces regional accident probability based on historical weather information data and accident and reporting data. In other words, the system is designed and developed to create models by k-NN and decision tree algorithms with optional user-environment variables based on the probability between weather and accidents about many particular region of Korea. In the future, the models developed in this study are intended to be used to analyze and calculate the risk of a more narrow area."
Recognition of damage pattern and evolution in CFRP cable with a novel bonding anchorage by acoustic emission,2018,"['CFRP cable anchorage', 'acoustic emission', 'clustering-based pattern recognition', 'ultimate bearing capacity']",,"Carbon fiber reinforced polymer (CFRP) cable has good mechanical properties and corrosion resistance. However, the anchorage of CFRP cable is a big issue due to the anisotropic property of CFRP material. In this article, a high-efficient bonding anchorage with novel configuration is developed for CFRP cables. The acoustic emission (AE) technique is employed to evaluate the performance of anchorage in the fatigue test and post-fatigue ultimate bearing capacity test. The obtained AE signals are analyzed by using a combination of unsupervised K-means clustering and supervised K-nearest neighbor classification (K-NN) for quantifying the performance of the anchorage and damage evolutions. An AE feature vector (including both frequency and energy characteristics of AE signal) for clustering analysis is proposed and the under-sampling approaches are employed to regress the influence of the imbalanced classes distribution in AE dataset for improving clustering quality. The results indicate that four classes exist in AE dataset, which correspond to the shear deformation of potting compound, matrix cracking, fiber-matrix debonding and fiber fracture in CFRP bars. The AE intensity released by the deformation of potting compound is very slight during the whole loading process and no obvious premature damage observed in CFRP bars aroused by anchorage effect at relative low stress level, indicating the anchorage configuration in this study is reliable."
UNB 2012 침입탐지 데이터셋 기반의 네트워크 비정상 행위 탐지,2018,"['기계학습', '침입탐지', 'UNB 2012 데이터셋', '분류', '인공지능', 'machine learning', 'intrusion detection', 'UNB 2012 Dataset', 'classification', 'artificial intelligence']","UNB 2012 침입탐지 평가 데이터셋을 캐나다 뉴 브런스윅 대학교의 CIC (Canadian Institute for Cybersecurity)로부터 제공받았다. UNB 2012 침입탐지 데이터셋은 실제 네트워크 공격 상황을 시뮬레이션하여 생성되었다. 침입탐지와 관련하여 많은 연구가 이루어지고 있지만 대부분의 연구 결과는 실제 환경에 적용하기 어려운 측면이 있는데 CIC는 이런 점을 고려하여 UNB 2012 침입탐지 평가 데이터셋을 만들었다. 본 연구에서는 정상 클래스와 4개의 공격 클래스를 사용한다. UNB 2012 데이터셋은 일자별로 나뉜 서브 데이터셋을 갖는데 서브 데이터셋 간의 특징이 조금씩 다르다. 각 서브 데이터셋의 공통된 특징들을 선택 및 가공하여 16개의 특징을 추출한다. 대표적인 데이터 마이닝 도구 중 하나인 WEKA (Waikato Environment for Knowledge Analysis)를 사용하여 데이터셋 분할, 언더샘플링, 모델링 등의 과정을 거쳐 비교 실험을 한다. 실험 결과에서 k-NN 알고리즘이 가장 우수한 성능을 나타내었다.","UNB 2012 intrusion detection evaluation dataset was provided from CIC (Canadian Institude for Cybersecurity) of new brunswick university in Canada. The dataset is created by simulation considering real network intrusion. Many researches related to intrusion detection are conducted, but it is difficult to apply most of the results of the researches to real intrusion detection system. The CIC made the UNB 2012 intrusion detection evaluation dataset considering the difficulty. In this paper, we use a normal class and four attack classes. The dataset has several sub dataset separated by date. Each sub dataset has their own characteristics. We select or modify 16 features among common features of all sub dataset. We conduct comparative experiments after data partitioning, undersampling, and modeling using WEKA(Waikato Environment for Knowledge Analysis), a typical data mining tool. In the experimental results, the k-NN algorithm showed the best performance."
Performance of machine learning methods in diagnosing Parkinson’s disease based on dysphonia measures,2018,"['Parkinson’s disease', 'Dysphonia measurements', 'Machine learning', 'Classification']",,"Parkinson’s disease (PD) is a widespreaddegenerative syndrome that affects the nervous system. Itsearly appearing symptoms include tremor, rigidity, andvocal impairment (dysphonia). Consequently, speechindicators are important in the identification of PD basedon dysphonic signs. In this regard, computer-aided-diagnosissystems based on machine learning can be useful inassisting clinicians in identifying PD patients. In this work,we evaluate the performance of machine learning basedtechniques for PD diagnosis based on dysphonia symptoms.Several machine learning techniques were consideredand trained with a set of twenty-two voice disordermeasurements to classify healthy and PD patients. Thesemachine learning methods included linear discriminantanalysis (LDA), k nearest-neighbors (k-NN), naı¨ve Bayes(NB), regression trees (RT), radial basis function neuralnetworks (RBFNN), support vector machine (SVM), andMahalanobis distance classifier. We evaluated the performanceof these methods by means of a tenfold cross validationprotocol. Experimental results show that the SVMclassifier achieved higher average performance than allother classifiers in terms of overall accuracy, G-mean, andarea under the curve of the receiver operating characteristicplot. The SVM classifier achieved higher performancemeasures than the majority of the other classifiers also interms of sensitivity, specificity, and F-measure statistics.The LDA, k-NN and RT achieved the highest averageprecision. The RBFNN method yielded the highestF-measure.; however, it performed poorly in terms of otherperformance metrics. Finally, t tests were performed toevaluate statistical significance of the results, confirmingthat the SVM outperformed most of the other classifiers onthe majority of performance measures. SVM is a promisingmethod for identifying PD patients based on classificationof dysphonia measurements."
미세먼지 수치 예측 모델 구현을 위한 데이터마이닝 알고리즘 개발,2018,"['ANN', 'K-NN']",,"Recently, as the fine dust level has risen rapidly, there is a great interest. Exposure to fine dust is associated with the development of respiratory and cardiovascular diseases and has been reported to increase death rate. In addition, there exist damage to fine dusts continues at industrial sites. However, exposure to fine dust is inevitable in modern life. Therefore, predicting and minimizing exposure to fine dust is the most efficient way to reduce health and industrial damages. Existing fine dust prediction model is estimated as good, normal, poor, and very bad, depending on the concentration range of the fine dust rather than the concentration value. In this paper, we study and implement to predict the PM10 level by applying the Artificial neural network algorithm and the K-Nearest Neighbor algorithm, which are machine learning algorithms, using the actual weather and air quality data."
Elliptic Flow of Charm and Strange Hadrons in High-Multiplicity p+Pb Collisions at sNN=8.16 TeV,2018,,,"<P>The elliptic azimuthal anisotropy coefficient (upsilon(2)) is measured for charm (D-0) and strange (K-S(0), Lambda, Xi(-), and Omega(-)) hadrons, using a data sample of p + Pb collisions collected by the CMS experiment, at a nucleonnucleon center-of- mass energy of root(NN)-N-s = 8.16 TeV. A significant positive upsilon(2) signal from long- range azimuthal correlations is observed for all particle species in high- multiplicity p + Pb collisions. The measurement represents the first observation of possible long-range collectivity for open heavy flavor hadrons in small systems. The results suggest that charm quarks have a smaller upsilon(2) than the lighter quarks, probably reflecting a weaker collective behavior. This effect is not seen in the larger PbPb collision system at root(NN)-N-s = 5.02 TeV, also presented.</P>"
A New Fine-grain SMS Corpus and Its Corresponding Classifier Using Probabilistic Topic Model,2018,"['Spam SMS corpus', 'Topic Model', 'LDA', 'SMTM']",,"Nowadays, SMS spam has been overflowing in many countries. In fact, the standards of filtering SMS spam are different from country to country. However, the current technologies and researches about SMS spam filtering all focus on dividing SMS message into two classes: legitimate and illegitimate. It does not conform to the actual situation and need. Furthermore, they are facing several difficulties, such as: (1) High quality and large-scale SMS spam corpus is very scarce, fine categorized SMS spam corpus is even none at all. This seriously handicaps the researchers’ studies. (2) The limited length of SMS messages lead to lack of enough features. These factors seriously degrade the performance of the traditional classifiers (such as SVM, K-NN, and Bayes). In this paper, we present a new fine categorized SMS spam corpus which is unique and the largest one as far as we know. In addition, we propose a classifier, which is based on the probability topic model. The classifier can alleviate feature sparse problem in the task of SMS spam filtering. Moreover, we compare the approach with three typical classifiers on the new SMS spam corpus. The experimental results show that the proposed approach is more effective for the task of SMS spam filtering."
