title,date,keywords,abstract,multilingual_abstract
지능형 IoT 미러 시스템을 활용한 인터랙티브 콘텐츠 서비스 구현,2018,"['Electroencephalography', 'Facial expression', 'Interactive content', 'Internet-of-Things', 'Machine learning.']",,"In this paper, we develop interactive content services for preventing depression of users through an intelligent Internet of Things (IoT) mirror system. For interactive content services, an IoT mirror device measures attention and meditation data from an EEG headset device and also measures facial expression data such as sad, angery, disgust, neutral,  happy, and surprise classified by a multi-layer perceptron algorithm through an webcam. Then, it sends the measured data to an oneM2M-compliant IoT server. Based on the collected data in the IoT server, a machine learning model is built to classify three levels of depression (RED, YELLOW, and GREEN) given by a proposed merge labeling method. It was verified that the k-nearest neighbor (k-NN) model could achieve about 93% of accuracy by experimental results. In addition, according to the classified level, a social network service agent sent a corresponding alert message to the family, friends and social workers. Thus, we were able to provide an interactive content service between users and caregivers."
비행 수행도와 심박변이도 특징을 활용한 조종사 인지부하 수준 감지,2018,"['Cognitive workload', 'Flight performance', 'Heart rate variability', 'Ensemble classifier']",,"Objective: The purpose of this study is to analyze characteristics of flight performance and heart rate variability features and develop cognitive workload classification model in order to detect cognitive workload levels of pilots.  Background: Pilots can experience high cognitive workload conditions by performing various tasks simultaneously during air operation mission. Accurate detection of the cognitive workload state is required to improve the survivability of pilots and ensure flight safety.  Method: Five student pilots in 20s performed dual task consisting of simulated flight task with baseline task and three levels of N-back task (0-back, 1-back, 2-back). Three flight performance features (standard deviation of altitude, heading, airspeed) and two heart rate variability features (standard deviation of NN (SDNN), Low Frequency to High Frequency ratio (LF/HF)) were measured from the flight simulation experiment with photoplethysmogram (PPG) sensor. Cognitive workload classification model was developed by pre-processing input features and output classes, applying five classifiers (Decision tree (DT), Support vector machine (SVM), K-nearest neighbor (KNN), Bayesian, Ensemble), and validating the model performance.  Results: High cognitive workload level (2-back) was 327%, 161%, and 1.2% higher than baseline in terms of standard deviation of altitude, standard deviation of airspeed, and LF/HF respectively. DT, SVM, KNN, Bayesian, and Ensemble classifier performance was 94.4%, 91.1%, 96.6%, 93.3%, and 96.6% with two output classes, 62%, 51.4%, 64.6%, 57.1%, and 64.6% with three output classes, 36.3%, 36%, 48%, 36.3%, and 49% with four output classes respectively.  Conclusion: The best classifier performance for detecting cognitive workload levels of pilots was acquired from an ensemble classifier with two output classes (baseline, 2-back) with an accuracy of 96.6%.  Application: The cognitive workload classification model using the ensemble classifier in this study can contribute to the development of a system capable of providing warning signal in real time under pilot""s cognitive overload situation."
A Comparative Study on Similarity Measure Techniques for Cross-Project Defect Prediction,2018,,,"Software defect prediction is helpful for allocating valuable project resources effectively for software quality assurance activities thanks to focusing on the identified fault-prone modules. If historical data collected within a company is sufficient, a Within-Project Defect Prediction (WPDP) can be utilized for accurate fault-prone module prediction. In case a company does not maintain historical data, it may be helpful to build a classifier towards predicting comprehensible fault prediction based on Cross-Project Defect Prediction (CPDP). Since CPDP employs different project data collected from other organization to build a classifier, the main obstacle to build an accurate classifier is that distributions between source and target projects are not similar. To address the problem, because it is crucial to identify effective similarity measure techniques to obtain high performance for CPDP, In this paper, we aim to identify them. We compare various similarity measure techniques. The effectiveness of similarity weights calculated by those similarity measure techniques are evaluated. The results are verified using the statistical significance test and the effect size test. The results show k-Nearest Neighbor (k-NN), LOcal Correlation Integral (LOCI), and Range methods are the top three performers. The experimental results show that predictive performances using the three methods are comparable to those of WPDP."
기계학습 알고리즘을 사용한 스포츠 경기장 방문객 마케팅 적용 방안,2018,"['데이터 분석', 'K-평균 군집화', 'K-근접 이웃', '기계학습 알고리즘', '스포츠마케팅', 'Big Data Analytics', 'K-Means Clustering', 'K-NN', 'Machine Learning Algorithm', 'Sport Marketing']",,
Neural Network based Real-time UAV Detection and Analysis by Sound,2018,"['artificial intelligence', 'artificial neural network', 'machine learning', 'ensemble learning', 'audio categorization', 'drone classification', 'K-NN', 'UAV categorization', 'UAV analysis']",,"In this paper, we present a real-time artificial intelligence system for drone detection on multiple locations. With ensemble machine learning on multiple regional clients and a central neural network server, the users can easily monitor the drone's appearance based on its motor sound data. The clients perform FFT on the sampled real-time data and detect drones using Plotted Image Machine Learning (PIL) with sending the detected audio sample to the server. The PIL uses image data from the visualized FFT graph to detect robust points, and compares the average image similarity with a reference FFT template associated with a target of interest. The server visualizes each client's detection status including machine learning result, and trains Artificial Neural Network (ANN) with extensive regional samples from clients. Afterwards, the server tests its ANN model whenever the client reports drone detection. The accuracy rate of client's PIL test is 83% and server's ANN test accuracy rate is 86%. The major deliverables of this work are a software package framework one may use to train its ANN model with various sound samples from different places to make a generalized drone detection model."
First measurement of jet mass in Pb–Pb and p–Pb collisions at the LHC,2018,,,"<P><B>Abstract</B></P>  <P>This letter presents the first measurement of jet mass in Pb–Pb and p–Pb collisions at    <SUB>  s   NN  </SUB>   = 2.76  TeV and    <SUB>  s   NN  </SUB>   = 5.02  TeV, respectively. Both the jet energy and the jet mass are expected to be sensitive to jet quenching in the hot Quantum Chromodynamics (QCD) matter created in nuclear collisions at collider energies. Jets are reconstructed from charged particles using the anti- <SUB>  k   T  </SUB>  jet algorithm and resolution parameter  R = 0.4 . The jets are measured in the pseudorapidity range  | <SUB>  η   jet  </SUB> | < 0.5  and in three intervals of transverse momentum between 60 GeV/<I>c</I> and 120 GeV/<I>c</I>. The measurement of the jet mass in central Pb–Pb collisions is compared to the jet mass as measured in p–Pb reference collisions, to vacuum event generators, and to models including jet quenching. It is observed that the jet mass in central Pb–Pb collisions is consistent within uncertainties with p–Pb reference measurements. Furthermore, the measured jet mass in Pb–Pb collisions is not reproduced by the quenching models considered in this letter and is found to be consistent with PYTHIA expectations within systematic uncertainties.</P>"
Collision energy dependence of moments of net-kaon multiplicity distributions at RHIC,2018,,,"<P><B>Abstract</B></P>  <P>Fluctuations of conserved quantities such as baryon number, charge, and strangeness are sensitive to the correlation length of the hot and dense matter created in relativistic heavy-ion collisions and can be used to search for the QCD critical point. We report the first measurements of the moments of net-kaon multiplicity distributions in Au+Au collisions at    <SUB>  s   NN  </SUB>   = 7.7 , 11.5, 14.5, 19.6, 27, 39, 62.4, and 200 GeV. The collision centrality and energy dependence of the mean (<I>M</I>), variance ( <SUP>  σ   2  </SUP> ), skewness (<I>S</I>), and kurtosis (<I>κ</I>) for net-kaon multiplicity distributions as well as the ratio  <SUP>  σ   2  </SUP> / M  and the products <I>Sσ</I> and  κ <SUP>  σ   2  </SUP>  are presented. Comparisons are made with Poisson and negative binomial baseline calculations as well as with UrQMD, a transport model (UrQMD) that does not include effects from the QCD critical point. Within current uncertainties, the net-kaon cumulant ratios appear to be monotonic as a function of collision energy.</P>"
