title,date,keywords,abstract,multilingual_abstract
Spatial prediction of gully erosion using ALOS PALSAR data and ensemble bivariate and data mining models,2019,"['remote sensing', 'ALOS PALSAR', 'gully erosion', 'random forest', 'GIS']",,"Remote sensing is recognized as a powerful and efficient tool that provides a comprehensive view of large areas that are difficult to access, and also reduces costs and shortens the timing of projects. The purpose of this study is to introduce effective parameters using remote sensing data and subsequently predict gully erosion using statistical models of Density Area (DA) and Information Value (IV), and data mining based Random Forest (RF) model and their ensemble. The aforementioned models were employed at the Tororud-Najarabad watershed in the northeastern part of Semnan province, Iran. For this purpose, at first using various resources, the map of the distribution of the gullies was prepared with the help of field visits and Google Earth images. In order to analyse the earth's surface and extraction of topographic parameters, a digital elevation model derived from PALSAR (Phased Array type L-band Synthetic Aperture Radar) radar data with a resolution of 12.5 meters was used. Using literature review, expert opinion and multi-collinearity test, 15 environmental parameters were selected with a resolution of 12.5 meters for the modelling. Results of RF model indicate that parameters of NDVI (normalized difference vegetation index), elevation and land use respectively had the highest effect on the gully erosion. Several techniques such as area under curve (AUC), seed cell area index (SCAI), and Kappa coefficient were used for validation. Results of validation indicated that the combination of bivariate (IV and DA models) with the RF data-mining model has increased their performance. The prediction accuracy of AUC and Kappa values in DA, IV and RF are (0.745, 0.782, and 0.792) and (0.804, 0.852, and 0.860) and these values in ensemble models of DA-RF and IV-RF are (0.845, and 0.911) and (0.872, and 0.951) respectively. Results of SCAI show that ensemble models had a good performance, so that, with increasing of sensitivity, the values of SCAI have decreased. Based on results, determination of gullies and assessing the process of gullying through remote sensing technology in combination with field observations and accurate statistical and computer methods can be a suitable methodology for predicting areas with gully erosion potential."
공공데이터를 활용한 아파트 매매 가격 결정 모형의 예측 능력 비교 : 서울 강남구 지역을 중심으로,2019,"['Public Data', 'Multiple Linear Regression', 'Random Forest', 'Support Vector Machine', '공공데이터', '다중선형회귀', '랜덤포레스트', '서포트벡터머신']","본 연구는 국토교통부의 아파트 실거래가 데이터 등 부동산 관련 공공데이터로 다양한 기계학습 알고리즘을 활용하여 서울특별시 강남구 지역의 아파트 매매 가격 결정 모형 간 예측 능력을 비교하였다. 다중선형회귀모형은 이해하기 쉽다는 장점이 있으나 오차의 정규성과 독립성 등의 가정을 충족하기 어렵다는 단점이 있으며 특히 예측 능력 면에서 기계학습 알고리즘에 비해 성능이 낮다. 본 연구에서는 아파트 매매 가격의 추정 성능을 비교하기 위하여 랜덤 포레스트 및 서포트 벡터 머신 알고리즘을 사용하였고, 그 결과 다중회귀분석 모형에 비해 예측 능력이 크게 향상된 결과를 보였다.","This study compares the forecasting ability of apartment sale pricing models in Gangnam-gu, Seoul, using various machine learning algorithms for real estate public data such as apartment transaction prices from the Ministry of Land, Infrastructure and Transport. The multiple linear regression model has advantages that it is easy to understand, but it has a disadvantage that it can’t easily meet assumptions such as normality and independence of residuals. Especially, it has lower performance than machine learning algorithms in prediction ability. In this study, random forest and support vector machine algorithms were used to compare the estimation performance of apartment sale prices. As a result, the predictive power was significantly improved compared to the multiple regression model."
한국의 계층의식 결정 요인: 탐색적 데이터분석,2019,"['subjective class identification', 'exploratory data analysis', 'random forest', 'ordered logit model', '계층의식', '탐색적 데이터분석', '랜덤 포레스트', '순서형 로짓 분석']","본 연구는 한국 사회의 주관적 계층의식에 어떤 요인들이 중요한 영향을 미치는지 탐색적 접근 방식으로 분석한다. 이에 관한 많은 선행 연구들과 달리 우리는 특정 이론이나 선험적 판단에 근거하지 않고 이용가능한 모든 변수들을 사용하여 탐색적 데이터분석 방법론을 사용하여 계층의식에 영향을 미치는 주요 변수들을 찾아낸 다음, 회귀분석을 통해 구체적 관련성을 규명한다. 통계청의 2017년 사회분석 데이터를 사용하며, 총 70개 전후의 변수에서 출발하여 머신러닝의 랜덤 포레스트 기법을 사용하여 주요 설명변수들을 추출한 다음, 회귀분석을 통해 계수의 부호와 통계적 유의성을 검토한다. 분석 결과, 계층의식은 소득이나 소비 등 어느 특정 부문의 특정 요소에 의해서만 결정되는 것이 아니라 사회 제반 분야 다양한 변수들의 영향을 받는 것으로 나타났다.","In this exploratory study, we analyze factors that affect individuals’ subjective class identification in Korea. While the majority of previous studies are based on a specific theory or a priori judgment, our approach is different: we begin with utilizing all available variables. First, we have employed the exploratory data analysis (EDA) to find out all possible variables that affect individuals’ subjective class identification. And then, a specific relationship is identified through the regression analysis. Using the 2017 Social Survey data provided by Statistics Korea, we extract the main explanatory variables from a total of about 70 variables using a random forest method of machine learning. The regression analysis is then used to examine the sign and statistical significance of the coefficients. The results suggest that individuals’ subjective class identification is influenced not only by certain factors, such as income or consumption but also by other various aspects existing in the social context."
노면 적응형 대퇴 의족개발을 위한 발목 관절 부하가변형 하퇴 의족 적용에 대한 연구,2019,"['above-knee prosthesis', 'control ankle joint', 'decision tree', 'random forest', 'walking imbalance']",,"This study is the method which is adapted to control ankle joint movement for resolving the problem of gait imbalancein intervals where gait environments are changed and slope walking, as applying terrain-adaptive technique to intelligentabove-knee prosthesis. In this development of above-knee prosthesis, to classify the gait modes is essential. Fordistinguishing the stance phases and the swing phase depending on roads, a machine learning which combines decisiontree and random forest from knee angle data and inertial sensor data, is proposed and adapted. By using this method, theankle movement state of the prosthesis is controlled. This study verifies whether the problem is resolved throughbutterfly diagram."
머신러닝을 활용한 대청수계 취수원 냄새물질 예측,2019,"['Artificial neural network', 'Machine Learning', 'Odor compounds forecasting', 'Random Forest']",,"The contamination of source water by odor compounds are one of the problems related to the water quality management, especially in Daecheong Reservoir, South Korea issued an algal alert system anually. This study investigated the efficiencies of 4 machine learning models, including Multi-parameter Regression Analysis(MRA), Decision Tree(DT), Artificial Neural Network (ANN) and Random Forest (RF), for odor compounds forecasting(Geosmin, 2-MIB) in the Daecheong Water Intake Station, where supply water treatment plants to source water. The models based on input variables considered correlation between target output and water quality parameter and hydrologic‧meteorological factors. The established models showed good results between observed and simulated values. For Geosmin models, ANN produced better forcasting results than others. RF showed the best results for 2-MIB models. These results and models are applied in work-site operations through the Daecheng Intergreted Water Quality Forecasting System since September, 2018."
RSVRs based on Feature Extraction: A Novel Method for Prediction of Construction Projects’ Costs,2019,"['construction project’s cost prediction', 'support vector regression', 'random forest', 'kernel principal component analysis', 'feature fusion']",,"The construction industry is an important basis for the development of China's economy. The accurate prediction of the cost of the project determines the profitability of the project and the decision-making of the construction. Therefore, this paper combines Random Forest with Support Vector Regression, and puts forward a method of construction cost prediction based on this method which we call it Random Support Vector Regressions (RSVRs). In this paper, 22 kinds of features which are related to cost are extracted, then we use Kernel Principal Component Analysis to fuse features which are less relevant to the cost. Then 11-dimensional features are put into RSVRs for modeling. From the theoretical point of view, RSVRs gives a novel work flow that is fusing features with low correlation firstly and then performing regression. In order to avoid the defects of the regression method, the two methods are fused, so that each method can maximize its advantages and make up for the disadvantages of the other method. From a practical point of view, RSVRs can be used to predict the project cost, which not only improves the accuracy, but also immediately obtains thepredicted result. As long as the appropriate training data is selected, the method can predict the cost of any area and any building."
머신러닝 기법을 활용한 사교육 참여 예측 모형 탐색,2019,"['사교육', '머신러닝', '랜던 포레스트', '나이브 베이즈 분류', '서포트 벡터 머신', '인공신경망 모형 Demand for private tutoring', 'Random Forests', 'Naive Bayes Classifier', 'Support Vector Machine', 'and Artificial Neural Network']","그 동안 사교육 수요의 원인 분석과 해결 방안 모색을 위한 다양한 연구들이 수행되었지만, 학생들의 사교육 참여 및 사교육비 지출에 대한 논의는 여전히 하나의 결론에 도달하지 못하고 있다. 선행연구들 중에는 그러한 이유를 그 동안 사교육 수요를 설명하기 위해 사용된 분석 모형이나 변수들이 상당히 제한적이었으며, 그로 인해 중요한 변수를 간과하거나 보다 직접적인 변수들을 통합․분리해 내는데 실패했기 때문이라고 설명하고 있다. 이에 본 연구에서는 빅데이터 분석과 함께 최근 주목을 받고 있는 네 가지 머신러닝 기법 즉, ‘랜덤 포레스트’, ‘나이브 베이즈 분류’, ‘서포트 벡터 머신’, ‘인공신경망 모형’을 적용하여 고등학생들의 사교육 참여에 영향을 미치는 변수들을 탐색적으로 살펴보았다. 그리고 이들 각 기법들의 예측성과를 비교․분석함으로써 머신러닝 기법이 갖는 성능과 한계를 조망해 보고, 향후 사교육 영향 요인 연구를 비롯한 다양한 교육 분야의 연구로 확대 가능한지 여부를 함께 검토해 보았다. 분석을 위해 본 연구에서는 한국교육고용 패널 Ⅱ의 1차 년도 자료를 사용하였다. 분석 결과 첫째, 머신러닝 기법에 따라 고등학생들의 사교육 참여를 예측하는 변수는 상이하였으며, 네가지 기법의 분석 결과에 공통적으로 포함된 예측 변수는 하나도 존재하지 않았다. ‘방과후 자율학습 참여여부’ 변수가 그나마 세 가지 기법에 공통적으로 포함되었으나, 상대적인 중요도에는 상당한 차이가 있었다. 둘째, 시험 자료를 기반으로 각 머신러닝 기법의 사교육 참여 예측률을 산출한 결과, 랜덤 포레스트 기법과 나이브 베이즈 분류 기법이 서포트 벡터 머신 기법이나 인공신경망 기법보다 고등학생의 사교육 참여를 더욱 정확하게 예측하는 것으로 나타났다. 따라서 표본 및 변수 선정 과정에서의 편의를 줄이고 분석 결과의 일반화 가능성을 높이기 위한 방편으로 머신러닝 기법을 적극 활용할 수 있으나, 분석의 목적이나 자료의 구조에 적합한 머신러닝 기법을 선택하기 위한 적절한 검증 작업이 선행되어야 할 것으로 보인다.","There’s a plenty of literature on the demand of private tutoring across east-asian countries, particularly in the republic of Korea. To predict the demand for private tutoring more accurately, various methodologies have been proposed and applied. However, the methodologies have some deficits. First of all, they are unable to give a solution for which variables in the dataset should be considered as explanatory variables to effectively predict the demand for private tutoring. Also, they are easily exposed to over-fitting and risk being affected by outliers and noise. To overcome those limitations, this study proposes the application of multiple machine learning mechanisms including Random Forests(RF), Naive Bayes Classifier, Support Vector Machine, and Artificial Neural Network on the 1ST year dataset of the Korea Education and Employment Panel II. And to evaluate and compare our those results of multiple machine learning mechanisms, each model’s performance was calculated by Correct Classified Rate, Sensitivity, and Specificity based on test dataset.　Empirical results showed that RF outperforms other machine learning algorithms from the perspective of prediction accuracy."
랜덤 포레스트를 활용한 대학 수시 전형 선택 관련 예측 요인 탐색,2019,"['수시 전형', '머신 러닝', '랜덤 포레스트', '한국교육고용패널', 'Korean Type Early Decision Programs', 'machine Learning', 'random forest', 'KEEP']","본 연구는 대학 수시 전형 입학생들의 특성을 탐색적으로 확인하기 위하여 ‘입학한 대학에의 수시 입학 여부’ 및 ‘2015년 중앙일보 대학평가 기준 상위 30위권 대학으로의 수시 입학 여부’를 반응변수로 하여 이를 예측하는 설명변수를 탐색적으로 확인하였다. 이를 위해 본 연구는 한국교육고용패널 I 중학교 3학년 코호트의 4-12 차년도 자료를 활용하여, 해당 코호트가 대학에 진학하기 시작한 2008년부터 2015년 사이의 대학 신입생 수시입학 여부 변수를 최근 주목받고 있는 랜덤 포레스트 기법을 적용함으로써 대학생들의 수시 입학 및 소위 상위권 대학으로의 수시 입학을 예측하는 주요 변수들을 탐색하였다. 분석 결과, 예측성과 측면에서 랜덤 포레스트로부터 도출된 예측 모형이 적합한 모형임을 확인하였다. 다음으로 수시 입학 및 소위 상위권 대학 수시 입학에영향을 주는 설명변수들의 중요도를 확인한 결과 ‘서울 4년제 대학 진학자수’, ‘수능 등급’, ‘고등학교 유형’, ‘학교 규모’, ‘혼자 학습하는 시간’ 등의 설명변수들의 예측력이 상대적으로 높게 나타났다. 본 연구는 수시 입학에상대적으로 더 큰 예측력을 지니는 중요 설명변수를 탐색적으로 밝혀냄으로써, 향후 수시 전형의 개선 및 보완을 위한 정책적 판단에 의미있는 시사점을 제공할 것으로 기대된다.","The purpose of this paper was to predict variables related to the characteristics of freshmen who entered university through Korean-type Early Decision Programs (KEDP). This study utilized a random forest model, one of the most popular machine learning approaches. Results showed that in-Seoul, Korea, 4-year university applicants’ “SAT Score” and “school size” were the substantial variables in predicting university entrance through KEDP. In terms of the so-called prestigious university entrance through KEDP, each school’s characteristics such as school type, school size, and individual characteristics such as SAT score, were relatively more predictive variables. The findings of this study, based on a new approach using a machine learning method, provide useful policy implications for improving current university admission processes, including KEDP."
해설가(家)와 해설사(士)의 의미로 보는 환경교육자(者)의 전문성에 관한 고찰,2019,"['가(家)', '사(士)', '해설가', '전문성', '환경교육', '환경교육자', 'professionalism', 'interpreter', 'environmental education', 'environmental educator']","전문적인 직업을 나타내는 접미사는 여러 가지가 있는데, 거기에는 지식의 전문성을 나타내거나 기술의 전문성 그리고 지명도나 성향 그리고 존대의 의미 등 다양한 의미와 뉘앙스의 차이를 포함한다. ‘가(家)'와 ‘사(士)'의 경우도 그중의 하나이지만, 분명한 차이와 의미를 식별하지 못한 채 사용되는 경우가 있다. ‘숲해설가’와 ‘숲해설사’라는 용어를 혼재되어 사용되는 경우가 그렇다. 이에 본 연구는 가와 사의 의미구조를 통해 '해설가'와 '해설사'의 차이를 식별했으며, 아울러 직업 전문성의 의미를 살펴보았다. 이를 통해 환경교육지도자는 자격수준으로서의 사(士)의 전문성은 물론 체화된 경험과 지식 그리고 문제해결 능력을 갖는 암묵지적 가(家)의 전문성도 요구되고 있음을 고찰했다.","Environmental education as non-formal education in Korea is carried out by educators classified by various job titles. Before the introduction of governmental certification systems, e.g. 'Non-formal Environmental Education Educator,' 'Forest Education Specialist' and 'Guide on Natural Environment,' environmental educators worked under the title of environmental education instructor, forest interpreter, ecological education instructor, eco guide, and so on. In this paper, I focus on suffixes used in the various job titles of environmental educators in connection with professional identity, with focus on 'Forest Education Specialist'. Suffixes used in job titles generally divided into '-er/or' and '-ist', which imply different meaning respectively, depending on degrees of ability required to perform certain job duties, relation with certain principles or doctrines, social customs, etc. As I Look into examples of practical usage, '-er/or' or '-ist' tend to be chosen at random by customs or individual preference. I consider ambiguity like this would affect in building up professional identity of environmental educators in general. Through the study, I analyze the structure of meaning that two most confusedly used suffixes '-er' and '-ist' involved, and seek to establish the significance of 'professionalism' and 'specialist' based on the findings. Therefore, I have come to a conclusion that suffix '-ist' denote person who perform a specific action or specialized skill, and closely engaging tacit knowledge is more suitable to define environmental educator's occupation and professional identity."
T1-MRI 뇌영상으로부터 히포캠퍼스 특징 기반 알츠하이머 병 자동 분류기법,2019,"['알츠하이머 병', '경도인지장애', '경도인지장애(안정)', '경도인지장애(전환)', 'ISOMAP', '소프트 맥스', '랜덤포레스트', 'Alzheimer’s disease', 'mild cognitive impairment', 'MCIs', 'MCIc', 'ISOMAP', 'Softmax', 'Random forest']","알츠하이머 병 (Alzheimer's disease, AD) 에서 해마는 신경 세포 및 신경 섬유 얽힘 스레드 침착으로 인해 영향 을 받는 첫 번째 구조물 중 하나이며 결국 신경 세포의 손실을 초래합니다. 또한 최근에 많은 자기 공명 영상 연구에 서 AD 환자는 건강한 피검자에 비해 해마의 체적이 작다는 의견을 제시했다. 해마 자기 공명 영상 체적은 AD를 위한 잠재적인 바이오 마커이지만 작은 구조로 인해 수동 분할 및 낮은 시각화의 한계가 에 의해 어려움이 있다. 이 러한 문제를 해결하기 위해 대부분의 이미지 분석가는 뇌 구조의 자동 세분화를 위해 Freesurfer와 FSL에 익숙했 습니다. 본 연구에서는 다른 그룹의 AD 환자의 조기 진단을 위해 Freesurfer (v.6.0) 자동화 도구 상자를 사용하여 해마 영역을 추출하는 방법을 이용한다. 38 명의 환자가 AD에 속하며, 46 명의 환자가 MCI에 속한다 (안정-MCI, 18 개월 후에 AD로 전환되지 않음) 및 36 명의 환자가 MCIc에 속한다 (전환-MCI, 18 개월 이내에 AD로 전환), 나머지 38 명의 노인은 정상 대상 (NC)에 속하며 이러한 모든 환자들의 정보는 알츠하이머병 Neuroimaging Initiative database (ADNI)에서 다운로드 되었습니다. AD, MCIs, MCIc 및 노인 대조군 (NC) 환자를 구별하 기 위해 우리는 구입한 해마 체적을 사용했습니다. 여기서 차원적 감소를 위해 우리는 다양한 학습 기반의 ISOMAP 기법을 사용했다. 이 기법은 많은 기능들 중 중요한 특징만을 선택하고 나중에 랜덤 포레스트와 softmax 분류기를 사용하여 이진 분류 문제들을 분류했다.","In Alzheimer’s disease (AD), the hippocampus is among the first structures, which is affected, due to the neuropil and neurofibrillary tangle thread deposition, which eventually results in a neuronal loss. Moreover, recently a large number of magnetic resonance imagining studies have stated that AD patients has get smaller hippocampus volume as compared to healthy subjects. Hippocampal magnetic resonance imaging volumetric is a potential biomarker for an AD but is hindered by the limitation of manual segmentation and low visualization because of its small structure. To solve that problems, most image analyst used to Freesurfer and FSL for automatic segmentation of brain structures. In this paper, we apply to extract hippocampus region using Freesurfer (v.6.0) automated toolbox for early diagnosis of AD subjects with different groups. a total 158 baseline subjects were used for the experiment, from which 38 patients belong to AD, 46 patients belong to MCIs (stable-MCI, not converted to AD after 18th month of periods) and 36 patients belong to MCIc (converted-MCI, converted to AD within 18th month of periods), and remaining 38 patients belong to elderly normal subjects (NC), and all these subjects were downloaded from Alzheimer’s disease Neuroimaging Initiative database (ADNI). We used the gained hippocampal volumes to discriminate between AD, MCIs, MCIc, and elderly controls (NC) patients. Here, for dimensionality reduction purpose we have used manifold learning based ‘isometric feature mapping’ ISOMAP technique, which only selects the important feature from a bunch of features and later random forest and softmax classifier were used to classify the binary classification problems."
