title,date,keywords,abstract,multilingual_abstract
공간통계모형을 이용한 정량적 강우 추정 성능 비교,2019,"['공간랜덤포레스트', '일반화가법모형', '크리깅', 'Generalized addictive model', 'kriging', 'spatial random forest']","강우는 집중호우와 같은 기상재해 피해를 경감시키기 위한 수문학 연구의 기초 자료로써 사용된다. 정량적 강우 추정을 개선하기 위해 지상 강우 자료와 레이더 자료를 합성하는 연구가 이루어지고 있다. 레이더는 넓은 지역에서 강우 현상을 모니터링하며 미관측지점에서 강우량을 추정할 수 있다. 본 연구는 정량적 강우 추정을 위해 공간통계모형인 역거리가중법, 일반화가법모형, 크리깅, 공간랜덤포레스트를 고려하였다. 예측성능을 평가하기 위해 10-겹 교차검증이 50번 수행하여 RMSE, MAE, rBIAS, CC를 계산하였다. 그 결과, 비가 적게 내리고 국지성 강우일 때는 역거리가중법이 예측성능이 우수하였으나, 반대의 상황에서는 정규크리깅이 우수하였다. 공간랜덤포레스트는 강우량에 관계없이 로버스트한 예측성능을 보였다. 시간해상도가 높을 때는 공간랜덤포레스트가 예측성능이 우수하였으며, 낮을 때는 정규크리깅이 예측성능이 우수하였다.","Precipitation is necessary data for hydrological studies to reduce the damage caused by meteorological disasters such as heavy rainfall. There are being conducted studies of combining gauge data and radar data to improve quantitative precipitation estimate. The advantage of radar is monitoring the rainfall phenomenon over a large area and can estimate the rainfall at the non-measurement sites. This study considered geostatistical models for quantitative precipitation estimate. The models used are inverse distance weight, generalized additive model, kriging, and spatial random forest. To evaluate the prediction performance, 10-folds cross-validation was repeated 50 times and root mean square error, mean absolute error, relative bias is calculated. As a result, inverse distance weight performs best when rainfall was low and spatial range was local. In the opposite situation, ordinary kriging performs best. A spatial random forest was regarded as robust predictors regardless of rainfall intensity. Spatial random forest performs well when time resolution is high. However ordinary kriging performs best for low time resolution."
고빈도 자료를 이용한 머신러닝모형의 예측력 비교 ․ 분석: KOSPI200 선물시장을 중심으로,2019,"['High Frequency Data', 'Machine Learning', 'Microstructure', 'Bar', 'Private Information', '고빈도자료', '머신러닝', '미시구조론', '바(bar)', '사적정보']","본 연구에서는 KOSPI200 선물의 틱(tick) 데이터를 활용하여 머신러닝 모형의 예측력을 분석한다.첫째, 미시구조론(microstructure)의 함의를 이용해 바(bar)를 구성했을 경우와 둘째, support vector machine, random forest와 같은 머신러닝(machine learning) 모형을 이용했을 경우 선물가격의상승과 하락 방향에 대한 예측력이 향상되는지를 분석했다. 분석 결과 시장에 새로운 정보가유입되는 시점을 기준으로 봉을 구성했을 때, 그리고 머신러닝 모형을 이용했을 때 예측력이더욱 향상되는 것으로 나타났다. 머신러닝 모형의 예측력은 모형의 훈련에 사용되는 데이터의양이 많아짐에 따라 더욱 향상되는 것으로 나타났다. 특히 거래량의 표본추출 기간을 정보의유입여부에 따라 조정함으로써 예측력이 향상되었다는 결과는 통상적인 시간에 따라 가격의상승 하락을 기록하고 분석하는 것은 유의미한 정보의 손실이 있음을 알 수 있다.","This paper investigates the effectiveness of machine learning algorithms and microstructure theory in predicting high frequency price movement. While accurately predicting future prices of financial assets has always been a major concern for the financial sector, recent developments in analytics tools and accessibility to new data have stimulated academics to pursue research.There are two main ways in which machine learning algorithms are incorporated into financial research. The first is to increase the predictive power of models by adopting machine learning techniques that have not been used in previous studies (Yoon, 2019; Laborda and Laborda, 2017).Secondly, machine learning algorithms are also used to identify new predictive variables (Kim and Joh, 2019; Gentzkow et al., 2017).On the other hand, there is very little discussion regarding the criteria to construct structured dataset from raw financial data. While microstructure theory argues that active informed traders leave characteristic footprints in market data, incorrectly structured data may fail to extract this information effectively. In this aspect, de Prado(2018a) suggested VIB(volume imbalance bar) based on implications of microstructure theory, which sample bars when informed traders are active.Therefore, this study examines whether or not VIBs contain predictive information regarding future price movement. Using tick data of KOSPI 200 futures, we constructed VIBs and three standard bar types widely used by practitioners and academics: time bar, tick bar and volume bar. Then, we produced out of sample predictions of one-bar ahead price movement and compared prediction performances of different bar types. In order to test the effectiveness of machine learning algorithms, we used logistic regression as the benchmark and compared the prediction accuracy with SVM(support vector machine) and random forest, two machine learning algorithms widely applied in financial research.The results of the analysis can be summarized as follows. First, the prediction accuracies of time bar, tick bar and volume bar were no better than a random walk. On the other hand, the prediction accuracy of data constructed with VIB was 65% at least, implying that it contains predictive information regarding future price movement. Chinko et al.(2019) argues that predictive information of returns are sparse and short-lived. Therefore it is better to predict price movements when an information event takes place, and before that information is reflected in the price than predicting them at a random time. This result shows that while VIB incorporates predictive information by effectively identifying the presence of informed traders, standard bar types fail to capture this information.Second, as the size of training data increases, prediction accuracies of SVM and random forest outperform the prediction accuracy of logistic regression. While there is no significant difference when the training data is small, the gap widens with more training data and eventually resulting in a 5% difference in the biggest training data size. This result implies that machine learning algorithms may enhance prediction accuracy given large data.This study shows that even though the same raw data is used, prediction accuracy of machine learning algorithms may differ depending on the criteria of how the structured dataset is constructed. Synchronizing bar constructions with information flows may capture predictive information. On the other hand, sampling bars based on chronological time may lead to a significant loss of information. Therefore, while the majority of financial machine learning research focus on model implementation and producing new predictor variables, this research shows that proper construction of structured data is also an important feature."
남부지방 단감원에서 미국선녀벌레의 분산 및 공간분포 분석,2019,,,"Since Metcalfa pruinosa was first reported in Koera, it has continually caused damage to sweet persimmon orchard in southern part of Korea. Metcafa pruinosa exist not only in farmland but also in forest areas, and are difficult to control due to the influx of individuals from near forest. M. pruinosa has been occurred in orchard and its surroundings because of various host range. Thus, it has been difficult to decide spatial range and control time for efficient management. In this study, occurrence and dispersal pattern of M. pruinosa in persimmon orchard were surveyed using clear sticky traps, and spatial patterns were analyzed with SADIE(Spatial Analysis by Distance IndicEs), based on location information at sticky traps. Spatial association between survey time was also analyzed to identify when the spatial pattern changed. In sweet persimmon orchard, M. pruinosa mainly dispersed in mid to late May, when the first instar hatches, and in August, emerging season of adult. The first instar nymphs hatched in mid-May were randomly distributed in orchard, but distribution was changed to aggregative pattern after dispersed surroundings of orchard. Adults showed random distribution pattern after immigration to orchard again. These tendency was also observed in density change at orchard and its surroundings, and matched to actual density of M. pruinosa in sweet persimmon trees."
효율적인 특허정보 조사를 위한 분류 모형,2019,"['Patent Information Research', 'Noise Patent Classification', 'Word2Vec', 'Random Fores']",,"A patent contains detailed information of the developed technology and is published to the public. Thus, patents can be used to overcome the limitations of traditional technology trend research and prediction techniques. Recently, due to the advantages of patented analytical methodology, IP R&D is carried out worldwide. The patent is big data and has a huge amount, various domains, and structured and unstructured data characteristics. For this reason, there are many difficulties in collecting and researching patent information. Patent research generally writes the Search formula to collect patent documents from DB. The collected patent documents contain some noise patents that are irrelevant to the purpose of analysis, so they are removed. However, eliminating noise patents is a manual task of reading and classifying technology, which is time consuming and expensive. In this study, we propose a model that automatically classifies The Noise patent for efficient patent information research. The proposed method performs Patent Embedding using Word2Vec and generates Noise seed label. In addition, noise patent classification is performed using the Random forest. The experimental data is published and registered with the USPTO among the patents related to Ocean Surveillance & Tracking Network technology. As a result of experimenting with the proposed model, it showed 73% accuracy with the label actually given by experts."
효과적인 결측치 보완을 통한 다층 퍼셉트론 기반의전력수요 예측 기법,2019,"['스마트 그리드', '전력수요 예측', '결측치 보완', '심층 학습', 'Smart Grid', 'Electric Load Forecasting', 'Missing Data Handling', 'Deep Learning']",,"Accurate electric load forecasting is very important in the efficient operation of the smart grid. Recently, due to the development of IT technology, many works for constructing accurate forecasting models have been developed based on big data processing using artificial intelligence techniques. These forecasting models usually utilize external factors such as temperature, humidity and historical electric load as independent variables. However, due to diverse internal and external factors, historical electrical load contains many missing data, which makes it very difficult to construct an accurate forecasting model. To solve this problem, in this paper, we propose a random forest-based missing data recovery scheme and construct an electric load forecasting model based on multilayer perceptron using the estimated values of missing data and external factors. We demonstrate the performance of our proposed scheme via various experiments."
Pauses and Speech Rates in Assessing Fluency of English Speech,2019,"['pause', 'speech rate', 'English proficiency', 'speaking evaluation', 'L2 fluency']",,"An experiment was conducted to clarify how silent pauses and speech rate influence the human raters’ fluency evaluation of English speech. Three groups (30 English native listeners, 30 Korean high level listeners, and 30 Korean low level listeners) totaling 90 listeners rated the controlled test materials which were manipulated to have various levels of pause and speech rate. In order to exclude all other unrelated factors such as segmental effects, more precisely manipulated stimuli compared to previous research were created. Results, in general, were obtained through a statistical analysis known as the Mixed Effects Model and a technique called Random Forests. These results verified that pause related features such as pause frequency and pause position play a more important role than speech rate or raters’ English proficiency. This study is expected to help determine the weight of features affecting evaluation results and identify human raters’ performance patterns in speech evaluation."
A Wrist Worn Acceleration Based Human Motion Analysis and Classifi cation for Ambient Smart Home System,2019,['Body sensors · Human motion detection · Regression trees · Smart home'],,"In recent years, health-care industry has received a major boost due to sensors i.e., accelerometers, magnetometers etc., which allow its user to get instant updates about their current health status in indoor/outdoor environments. The real driving force behind the usage of accelerometer has been the fi tness industry but it also holds a prominent place in ambient smart home to monitor resident’s life-style. In this paper, we proposed a novel triaxial accelerometer-based human motion detection and recognition system using multiple features and random forest. Triaxial signals have been statistically processed to produce worthy features like variance, positive and negative peaks, and signal magnitude features. The proposed model was evaluated over HMP recognition data sets and achieved satisfactory recognition accuracy of 85.17%. The proposed system is directly applicable to any elderly/children health monitoring system, 3D animated games/movies and examining the indoor behaviors of people at home, malls and offi ces."
Pauses and Speech Rates in Assessing Fluency of English Speech,2019,"['pause', 'speech rate', 'English proficiency', 'speaking evaluation', 'L2 fluency']",,"An experiment was conducted to clarify how silent pauses and speech rate influence the human raters’ fluency evaluation of English speech. Three groups (30 English native listeners, 30 Korean high level listeners, and 30 Korean low level listeners) totaling 90 listeners rated the controlled test materials which were manipulated to have various levels of pause and speech rate. In order to exclude all other unrelated factors such as segmental effects, more precisely manipulated stimuli compared to previous research were created. Results, in general, were obtained through a statistical analysis known as the Mixed Effects Model and a technique called Random Forests. These results verified that pause related features such as pause frequency and pause position play a more important role than speech rate or raters’ English proficiency. This study is expected to help determine the weight of features affecting evaluation results and identify human raters’ performance patterns in speech evaluation."
학습을 이용한 손 자세의 강인한 추정,2019,,,"Recently, due to the popularization of 3D depth cameras, new researches and opportunities have been made in research conducted on RGB images, but estimation of human hand pose is still classified as one of the difficult topics. In this paper, we propose a robust estimation method of human hand pose from various input 3D depth images using a learning algorithm. The proposed approach first generates a skeleton-based hand model and then aligns the generated hand model with three-dimensional point cloud data. Then, using a random forest-based learning algorithm, the hand pose is strongly estimated from the aligned hand model. Experimental results in this paper show that the proposed hierarchical approach makes robust and fast estimation of human hand posture from input depth images captured in various indoor and outdoor environments."
Data-Driven Machine-Learning Quantifies Differences in the Voiding Initiation Network in Neurogenic Voiding Dysfunction in Women With Multiple Sclerosis,2019,"['Neurogenic lower urinary tract dysfunction', 'Multiple sclerosis', 'Functional magnetic resonance imaging', 'Machine learning']",,"Purpose: To quantify the relative importance of brain regions responsible for reduced functional connectivity (FC) in their Voiding Initiation Network in female multiple sclerosis (MS) patients with neurogenic lower urinary tract dysfunction (NLUTD) and voiding dysfunction (VD). A data-driven machine-learning approach is utilized for quantification.Methods: Twenty-seven ambulatory female patients with MS and NLUTD (group 1: voiders, n=15 and group 2: VD, n=12) participated in a functional magnetic resonance imaging (fMRI) voiding study. Brain activity was recorded by fMRI with simultaneous urodynamic testing. The Voiding Initiation Network was identified from averaged fMRI activation maps. Four machine-learning algorithms were employed to optimize the area under curve (AUC) of the receiver-operating characteristic curve. The optimal model was used to identify the relative importance of relevant brain regions.Results: The Voiding Initiation Network exhibited stronger FC for voiders in frontal regions and stronger disassociation in cerebellar regions. Highest AUC values were obtained with ‘random forests’ (0.86) and ‘partial least squares’ algorithms (0.89).While brain regions with highest relative importance (>75%) included superior, middle, inferior frontal and cingulate regions, relative importance was larger than 60% for 186 of the 227 brain regions of the Voiding Initiation Network, indicating a global effect.Conclusions: Voiders and VD patients showed distinctly different FC in their Voiding Initiation Network. Machine-learning is able to identify brain centers contributing to these observed differences. Knowledge of these centers and their connectivity may allow phenotyping patients to centrally focused treatments such as cortical modulation."
심박변이도를 이용한 적응적 뉴로 퍼지 감정예측 모형에 관한 연구,2019,"['Emotion prediction', 'ECG', 'Heart rate variability', 'Adaptive Neuro Fuzzy Inference System', 'Membership function', 'Adaptive Neuro-Fuzzy System for Emotion Prediction', '감정 예측', '심전도', '심박변이도', '적응적 뉴로-퍼지 추론시스템', '소속함수', '감정예측 적응적 뉴로-퍼지 시스템']","감정을 정확히 예측하는 것은 환자중심의 의료디바이스 개발 및 감성관련 산업에서 매우 중요한 이슈이다. 감정 예측에 관한 많은 연구 중 감정 예측에 심박 변동성과 뉴로-퍼지 접근법을 적용한 연구는 없다. 본 연구는 HRV를 이용한 ANFEP(Adaptive Neuro Fuzzy system for Emotion Prediction)을 제안한다. ANFEP의 핵심 기능은 인공 신경망과 퍼지 시스템을 통합해 예측 모델을 학습하는 ANFIS(Adaptive Neuro-Fuzzy Inference System)에 기반한다. 제안 모형의 검증을 위해 50명의 실험자를 대상으로 청각자극으로 감정을 유발하고, 심박변이도를 구하여 ANFEP 모형에 입력하였다. STDRR과 RMSSD를 입력으로 하고 입력변수 당 2개의 소속함수로 하는 ANFEP모형이 가장 좋은 결과를 나타났다. 제안한 감정예측 모형을 선형회귀 분석, 서포트 벡터 회귀, 인공신경망, 랜덤 포레스트와 비교한 결과 본 제안모형이 가장 우수한 성능을 보였다. 연구 결과는 보다 적은 입력으로 신뢰성 높은 감정인식이 가능함을 입증했고, 이를 활용해 보다 정확하고 신뢰성 높은 감정인식 시스템 개발에 대한 연구가 필요하다.","An accurate prediction of emotion is a very important issue for the sake of patient-centered medical device development and emotion-related psychology fields. Although there have been many studies on emotion prediction, no studies have applied the heart rate variability and neuro-fuzzy approach to emotion prediction. We propose ANFEP(Adaptive Neuro Fuzzy System for Emotion Prediction) HRV. The ANFEP bases its core functions on an ANFIS(Adaptive Neuro-Fuzzy Inference System) which integrates neural networks with fuzzy systems as a vehicle for training predictive models. To prove the proposed model, 50 participants were invited to join the experiment and Heart rate variability was obtained and used to input the ANFEP model. The ANFEP model with STDRR and RMSSD as inputs and two membership functions per input variable showed the best results. The result out of applying the ANFEP to the HRV metrics proved to be significantly robust when compared with benchmarking methods like linear regression, support vector regression, neural network, and random forest. The results show that reliable prediction of emotion is possible with less input and it is necessary to develop a more accurate and reliable emotion recognition system."
기상 및 토양정보가 고랭지배추 단수예측에 미치는 영향,2019,"['Chinese cabbage', 'Random forest', 'Regression model', 'Ubiquitous sensor network']",,"Highland farming is agriculture that takes place 400 m above sea level and typically involves both low temperatures and long sunshine hours. Most highland Chinese cabbages are harvested in the Gangwon province. The Ubiquitous Sensor Network (USN) has been deployed to observe Chinese cabbages growth because of the lack of installed weather stations in the highlands. Five representative Chinese cabbage cultivation spots were selected for USN and meteorological data collection between 2015 and 2017. The purpose of this study is to develop a weight prediction model for Chinese cabbages using the meteorological and growth data that were collected one week prior. Both a regression and random forest model were considered for this study, with the regression assumptions being satisfied. The Root Mean Square Error (RMSE) was used to evaluate the predictive performance of the models. The variables influencing the weight of cabbage were the number of cabbage leaves, wind speed, precipitation and soil electrical conductivity in the regression model. In the random forest model, cabbage width, the number of cabbage leaves, soil temperature, precipitation, temperature, soil moisture at a depth of 30 cm, cabbage leaf width, soil electrical conductivity, humidity, and cabbage leaf length were screened. The RMSE of the random forest model was 265.478, a value that was relatively lower than that of the regression model (404.493); this is because the random forest model could explain nonlinearity."
데이터마이닝 기반 육군 수리부속 수요예측,2019,"['data mining', 'repair parts', 'random forest', 'multiple regression', '다중선형회귀', '데이터마이닝', '육군 수리부속', '회귀나무', 'random forest']","우리 군에서 사용하고 있는 수리부속은 약72만 종으로, 연간 예산은 전체 국방예산의 3% (약1.3조원)을 차지하고 있다. 이와 같은 예산이 집행됨에도 불구하고 현재 우리 육군의 수리부속 예측정확도는 품목기준 70%, 수량기준 60%를 보이고 있으며, 이는 목표 장비가동률 저하에 악영향을 미친다. 따라서 본 연구에서는 수리부속 수요예측 정확도 제고를 위해 현재 육군에서 운용중인 장비정비정보체계 시스템의 에이타킴스 (ATCMS), K-9자주포, ARTHUR-K 총 3개 장비에 대한 2012 ~ 2016년까지의 ASL (authorized storage list) 598개 수리부속 품목의 연도별 소모개수, 표준단가의 데이터 수집을 통해 데이터마이닝 예측모형 (회귀나무, random forest, 인공신경망, 다중선형회귀)을 활용하여 2017년 수요 (Y)를 예측하였으며, 예측력척도는 RMSE (평균제곱근오차)와 MAE (평균절대오차)를 사용하였다. 연구결과 데이터마이닝 예측모형이 현재 육군에서 활용중인 시계열 예측 모형에 비해 예측정확도가 높았으며, 이어서 K-means 군집분석을 통해서 예측정확도를 더욱 높일 수 있는 군집을 찾을 수 있었다.","Recent the development of science and technology, weapon systems have been upgraded and the cost of introducing, operating and maintaining the weapon systems has greatly increased. However, defense spending is limited, and the operational burden of army equipment is continuously increasing in order to cope with North Korea’s constant threats. Therefore, the ARMY needs precise demand forecasts for the spare parts in order to maintain proper operational availability under budget constraints. This is a study to develop a model for predicting of the 3-equipment including k-9. In order to do this, we collected the data that affected the demand for the spare parts using DELIIS (defense logistics integrated information system). The objective variable is the quantity of spare parts in 2017 and RMSE (root mean squared error), MAE (mean absolute error) are used as the predictive power measure. To construct an optimal demand forecasting model, regression tree, random forest, neural network and linear regression model were used an data mining techniques. The model construction results showed that RMSE, MAE value was the best in the random forest model and the predicted quantity was also highest in the scatter plot."
