title,date,keywords,abstract,multilingual_abstract
Selection of geographical factors using the random forest analysis method for developing the site index equation of <i>Pinus densiflora</i> stands in Republic of Korea,2019,,,
Random Forest 기법을 이용한 산사태 취약성 평가 시 훈련 데이터 선택이 결과 정확도에 미치는 영향,2019,"['산사태 취약성', '머신러닝', 'Random Forest', '훈련 데이터', '샘플링 전략', 'landslide susceptibility', 'machine learning', 'Random Forest', 'training data', 'sampling strategy']","머신러닝 기법을 활용한 분석에서 훈련 데이터의 샘플링 전략은 예측 정확도 뿐 만 아니라 일반화 능력에도 많은영향을 미친다. 특히, 산사태 취약성 분석의 경우, 산사태 발생부에 대한 정보에 비해 산사태 미발생부에 대한 정보가과도하게 많은 데이터 불균형 현상이 발생하며, 이에 따라 분석 모델의 훈련 데이터 설계 시 데이터 샘플링 과정이필수적이다. 그러나 기존의 연구들은 대부분 산사태 미발생부 선택 시 발생부 데이터와 1:1의 비율을 갖도록 무작위로 선택하는 방법을 적용하였을 뿐, 특정한 선택 기준에 따라 분석을 수행하지 않았다. 따라서 본 연구에서는 훈련 데이터의 샘플링 전략이 모델의 예측 성능에 미치는 결과를 확인하기 위하여 산사태 발생부와 미발생부의 샘플링 전략기준에 따라 서로 다른 6개의 시나리오를 만들어 Random Forest 모델의 훈련에 사용하였다. 또한 Random Forest의결과 중 하나인 변수 중요도를 각 산사태 유발인자들에 가중치로 곱하여 줌으로써 산사태 취약지수 값을 산정하였으며, 취약지수 값을 이용해 산사태 취약성도를 제작하고 각 결과 지도의 정확도를 비교 분석하였다. 분석 결과, 훈련데이터의 샘플링 방법에 상관없이 두 지역의 산사태 취약성 분석 결과는 모두 70~80%의 정확도를 보였다. 이를 통해 Random Forest 기법의 산사태 취약성 분석기법으로서의 적용 가능성을 확인하였으며, Random Forest 모델이 제공하는 입력변수의 중요도를 산사태 유발인자 가중치로 활용할 수 있음을 확인하였다. 또한 훈련 시나리오 간의 정확도를 비교한 결과, 특정한 기준에 의해 훈련 데이터를 설계하는 것이 기존의 랜덤 선택 방법보다 높은 예측 정확도를기대할 수 있음을 확인하였다.",
머신러닝 기반 CFS(Correlation-based Feature Selection)기법과 Random Forest모델을 활용한 BMI(Benthic Macroinvertebrate Index) 예측에 관한 연구,2019,"['Aquatic ecology', 'BMI', 'CFS(Correlation-based Feature Selection)', 'Machine Running', 'Random Forest']",,"Recently, people have been attracting attention to the good quality of water resources as well as water welfare. to improve the quality of life. This study is a papers on the prediction of benthic macroinvertebrate index (BMI), which is a aquatic ecological health, using the machine learning based CFS (Correlation-based Feature Selection) method and the random forest model to compare the measured and predicted values ​​of the BMI. The data collected from the Han River’s branch for 10 years are extracted and utilized in 1312 data. Through the utilized data, Pearson correlation analysis showed a lack of correlation between single factor and BMI. The CFS method for multiple regression analysis was introduced. This study calculated 10 factors(water temperature, DO, electrical conductivity, turbidity, BOD, NH3-N, T-N, PO4-P, T-P, Average flow rate) that are considered to be related to the BMI. The random forest model was used based on the ten factors. In order to prove the validity of the model, R2, %Difference, NSE (Nash-Sutcliffe Efficiency) and RMSE (Root Mean Square Error) were used. Each factor ​​was 0.9438, -0.997, and 0,992, and accuracy rate was 71.6% level. As a result, These results can suggest the future direction of water resource management and Pre-review function for water ecological prediction."
Correlation-based Feature Selection 기법과 Random Forest 알고리즘을 이용한 한강유역 지류의 TDI 예측 연구,2019,"['Aquatic ecology health', 'Correlation-based Feature Selection', 'Random forest', 'TDI Prediction']",,"The purpose of this study is to predict Trophic Diatom Index (TDI) in tributaries of the Han River watershed using the random forest algorithm. The one year (2017) and supplied aquatic ecology health data were used. The data includes water quality(BOD, T-N, NH3-N, T-P, PO4-P, water temperature, DO, pH, conductivity, turbidity), hydraulic factors(water width, average water depth, average velocity of water), and TDI score. Seven factors including water temperature, BOD, T-N, NH3-N, T-P, PO4-P, and average water depth are selected by the Correlation Feature Selection. A TDI prediction model was generated by random forest using the seven factors. To evaluate this model, 2017 data set was used first. As a result of the evaluation, R2, % Difference, NSE(Nash-Sutcliffe Efficiency), RMSE(Root Mean Square Error) and accuracy rate show that this model is compatible with predicting TDI. To be more concrete, R2 is 0.93, % Difference is –0.37, NSE is 0.89, RMSE is 8.22 and accuracy rate is 70.4%. Also, additional evaluation using data set more than 17 times the measured point was performed. The results were similar when the 2017 data set were used. The Wilcoxon Signed Ranks Test shows there was no statistically significant difference between actual and predicted data for the 2017 data set. These results can specify the elements which probably affect aquatic ecology health. Also, these will provide direction relative to water quality management for a watershed that must be continuously preserved."
Identifying SDC-Causing Instructions Based on Random Forests Algorithm,2019,"['Fault tolerance', 'Error detection', 'Reliability', 'SDC-Causing instructions', 'Random forests']",,"Silent Data Corruptions (SDCs) is a serious reliability issue in many domains of computer system. The identification and protection of the program instructions that cause SDCs is one of the research hotspots in computer reliability field at present. A lot of solutions have already been proposed to solve this problem. However, many of them are hard to be applied widely due to time-consuming and expensive costs. This paper proposes an intelligent approach named SDCPredictor to identify the instructions that cause SDCs. SDCPredictor identifies SDC-causing Instructions depending on analyzing the static and dynamic features of instructions rather than fault injections. The experimental results demonstrate that SDCPredictor is highly accurate in predicting the SDCs proneness. It can achieve higher fault coverage than previous similar techniques in a moderate time cost."
Rice yield prediction in South Korea by using random forest,2019,"['Random forest', 'Rice yield', 'Yield prediction', 'Empirical']",,"In this study, the random forest approach was used to predict the national mean rice yield of South Korea by using mean climatic factors at a national scale. A random forest model that used monthly climate variable and year as an important predictor in predicting crop yield. Annual yield change would be affected by technical improvement for crop management as well as climate. Year as prediction factor represent technical improvement. Thus, it is likely that the variables of importance identified for the random forest model could result in a large error in prediction of rice yield in practice. It was also found that elimination of the trend of yield data resulted in reasonable accuracy in prediction of yield using the random forest model. For example, yield prediction using the training set (data obtained from 1991 to 2005) had a relatively high degree of agreement statistics. Although the degree of agreement statistics for yield prediction for the test set (2006-2015) was not as good as those for the training set, the value of relative root mean square error (RRMSE) was less than 5%. In the variable importance plot, significant difference was noted in the importance of climate factors between the training and test sets. This difference could be attributed to the shifting of the transplanting date, which might have affected the growing season. This suggested that acceptable yield prediction could be achieved using random forest, when the data set included consistent planting or transplanting dates in the predicted area."
UWB Rectangular Microstrip Patch Antenna Design in Matching Liquid and Evaluating the Classification Accuracy in Data Mining Using Random Forest Algorithm for Breast Cancer Detection with Microwave,2019,['Breast cancer detection Classification Data mining Random forest algorithm Rectangular microstrip patch antenna'],,"The most common type of cancer for a female is breast cancer in the world. Regular checks and effective-timely treatment are noteworthy parameters for patients’ survival struggle . Against existing imaging methods, microwave imaging method has been considered more powerful and effective method by many researchers. In this paper, comprehensive design equations and parameters of rectangular microstrip patch antenna (RMPA) are given for microwave breast cancer detection. The layered breast model with a spherical tumor that was placed into the fibro-glandular layer was created by using CST Microwave Studio Software, and it was embedded in canola oil to decrease the distorted signals between the transmitting and receiving antennas. The RMPA has a wideband performance from 3 to 18 GHz. The simulation results show that differences in the electric field and reflection coefficients might more efficiently give a possibility to assign the tumor in the breast model. In addition, in this study, the data obtained from these experiments are classified by using the random forest algorithm from the data mining methods. According to the classification result, the random forest algorithm can diagnose breast cancer by classifying the tumor as 94% accuracy."
Analysis of Dam Behavior by Statistical Models: Application of The Random Forest Approach,2019,"['arch dam', 'thermal analysis', 'displacements', 'solar radiation', 'random forest']",,"Dams are singular infrastructures whose safety assessment requires mathematical models for predicting its behavior and detecting anomalies. Here, we develop an approach based on random forest regression for dam displacement prediction. Random forest regression is a non-parametric statistical technique that can deal with non-linearities and does not need assumptions regarding relationship between predictors. Inputs to the model are the water level in the reservoir, time, and concrete temperature, and the outputs –predicted variables– are movements at the desired points. Since concrete temperature is only available at those points where thermometers are placed, we compute the thermal field at any point of the dam through a one-dimensional deterministic model. Our thermal model accounts for solar radiation, shading, night and evaporative cooling, convection with the air, and long wave radiation exchange. We assess the performance of our model by comparing its estimates with recorded data at a case study, an arch dam located in Algeria, and with outputs computed by two widely used statistical models and an artificial neural network model. Our model provides satisfactory predictions and improves the results of the other models. Our approach is a powerful tool for analyzing dam displacements and incorporates a rigorous evaluation of thermal loads. It emerges as a good alternative for practitioners and stakeholders."
A Comparative Study Based on Random Forest and Support Vector Machine for Strawberry Production Forecasting,2019,"['Strawberry Production', 'Random Forest', 'Support Vector Machine']",,"The purpose of this research is to develop a prediction method for strawberry growth. The main focus is to assess and compare the performance of the three beds using random forest and support vector machine method, in which the correlation of strawberry growth is identified by using water quantity, site selection, soil preparation and parameters. In addition, the suggested study uses three types of beds that are compared to find out the best bed production of strawberry fruits. The dataset includes collected from greenhouse strawberry product in South Korea and the four predicted variables consist of Strawberry production Maebang, Sulhyang Production, Water Type A, Maebang, Sulhyang Production, Water Type B and Maebang, Sulhyang Production, Water Type C. Through three Rooms Strawberry production test, this research suggests that the factors would closely influence the strawberry growth in fruit concentration directly with the variation of harvesting by every day."
Comparison of landslide susceptibility maps using random forest and multivariate adaptive regression spline models in combination with catchment map units,2019,"['landslide susceptibility', 'multivariate adaptive regression spline (MARSpline) model', 'random forest (RF) model', 'catchment map units (CMUs)']",,"Landslide susceptibility mapping (LSM) is a critical tool for mitigating the damages caused by geologic disasters. The selection of map units and mathematical models greatly affects the efficiency of LSM. To obtain the most appropriate combination of map units and mathematical models, four scales of catchment map units (CMUs) were analyzed and random forest (RF) and multivariate adaptive regression spline (MARSpline) models were applied in Gero City, Japan. The percentage of correctly identified landslides and the areas under the relative operating characteristic (ROC) curve were used to evaluate the model performances. The results indicate that the RF model had higher prediction accuracy than the MARSpline model, especially when the size of the CMU was 0.09 km2. A relatively high percentage of landslides fell into the high and very high landslide susceptibility classes (73%) and the lowest percentage of landslides fell into the very low landslide susceptibility classes (0.82%). The prediction-area (P-A) plots indicated that the prediction rates were higher for the RF model than the MARSpline model. The results of this study also suggest that the model accuracy can be increased if the appropriate CMU size is used. Therefore, the potential benefits of using the RF model in combination with the appropriate CMU size should be further explored using additional landslide-conditioning factors and other models."
Development of QSAR Model for Subchronic Inhalation Toxicity Using Random Forest Regression Method,2019,"['Subchronic inhalation toxicity', 'QSAR', 'Recursive feature selection', 'Random forest']",,"Subchronic inhalation toxicity assessment is mainly used to evaluate both workers and occupational risk. Since the assessment requires repeated experiment of chemical exposure to model animals, this type of studies is laborious and expensive. Computational methods for estimating toxicity play an increasingly important role in assessing toxicity of chemicals. They not only predict toxicity of chemicals but can also analyze molecular features of a chemical causing toxic effect. Here we present a computational model to predict the subchronic inhalation toxicity. We retrieved repeated dose inhalation toxicity information and chemicals from OECD eChemPortal website and compile 143 chemical compounds with NOAEC (No Observed Adverse Effect Concentration) values. The random forest regression approach has been applied to learn inhalation toxicity data using a number of molecular descriptors, such as physicochemical properties and fingerprints. Recursive feature selection with nested cross-validation was applied to efficiently select essential molecular features. In results, we successfully obtained a model performing with r 2ext = 0.70 and RMSEext = 0.74 for external set."
Comparison of Frequencies in Order to Estimate of Tree Species Diversity in Caspian Forests of Iran,2019,"['biodiversity', 'Caspian forest', 'tree species indices', 'type of data']",,"Species diversity is one of the most important indices that used to evaluate the sustainability of forest communities. In the present study, three variables including number of individuals (frequency of species), basal area and volume of tree species were compared to estimate tree species diversity in broadleaves forests of Iran. Based on systematic random design, 30 plots (circle plot, $1000m^2$) was selected. Type of species, number of species, DBH and height of trees were measured. Simpson (1-D), Hill ($N_2$), Shannon-Wiener (H'), Mc Arthur ($N_1$), Smith-Wilson ($E_{var}$) and Margalef ($R_1$) indices used to estimate tree species diversity. Species diversity was calculated in each plot. ANOVA test showed that there was a significant difference between of three variables used for estimation of species diversity. Number of trees variable has more precision than basal area and volume variables to estimate of species diversity. But Duncan test revealed that there were significant difference between of basal area and volume variables with number of trees. Therefore, basal area and volume variables were selected as more suitable variables in order to estimate of biodiversity indices in northern forests of Iran."
Comparison of Frequencies in Order to Estimate of Tree Species Diversity in Caspian Forests of Iran,2019,"['biodiversity', 'Caspian forest', 'tree species indices', 'type of data']",,"Species diversity is one of the most important indices that used to evaluate the sustainability of forest communities. In the present study, three variables including number of individuals (frequency of species), basal area and volume of tree species were compared to estimate tree species diversity in broadleaves forests of Iran. Based on systematic random design, 30 plots (circle plot, 1000 m2) was selected. Type of species, number of species, DBH and height of trees were measured. Simpson (1-D), Hill (N2), Shannon-Wiener (H’), Mc Arthur (N1), Smith-Wilson (Evar) and Margalef (R1) indices used to estimate tree species diversity. Species diversity was calculated in each plot. ANOVA test showed that there was a significant difference between of three variables used for estimation of species diversity. Number of trees variable has more precision than basal area and volume variables to estimate of species diversity. But Duncan test revealed that there were significant difference between of basal area and volume variables with number of trees. Therefore, basal area and volume variables were selected as more suitable variables in order to estimate of biodiversity indices in northern forests of Iran."
Genetic Diversity Evaluation of Thamnocalamus spathiflorus (Trin.) Munro Accessions through Morphological and Randomly Amplified Polymorphic DNA (RAPD) Markers,2019,"['polymorphism', 'randomly amplified polymorphic DNA (RAPD)', 'polymorphic information content (PIC) value', 'Thamnocalamus spathiflorus', 'cluster analysis']",,"Biodiversity refers to the total number and variation among species of flora and fauna of an area. Due to tremendous biotic especially anthropogenic pressure these natural resources are being vanishing. In present study genetic diversity among accessions of Thamnocalamus spathiflorus was evaluated. A total of 51 vegetative characters and 42 primers (10-mer) were screened. Out of 42 screened primers, 28 polymorphic primers were selected for further analysis. A total of 263 bands were recorded as polymorphic whereas 48 bands were monomorphic. The resolving power (Rp) of 28 Randomly Amplified Polymorphic DNA (RAPD) primers ranged from 4.6 (OPE08) to 17.6 (OPA11). The polymorphic information content (PIC) value ranged from 0.21 (OPAH09) to 0.44 (OPG02). The result revealed high degree of genetic relatedness (56 to 80%). Cluster analysis revealed two major clusters both for morphology as well as RAPD. Unlike morphological characterization, the accession (D5) from Bahli, Rampur, Shimla (H.P.) was clustered separately from the others in RAPD cluster analysis. Accessions with closed locality grouped together through RAPD marker system however analogy was recorded for morphological traits. The study conducted reflects the utility of RAPD technique for species identification and phylogenetic studies in bamboo for conducting bamboo breeding program."
Genetic Diversity Evaluation of Thamnocalamus spathiflorus (Trin.) Munro Accessions through Morphological and Randomly Amplified Polymorphic DNA (RAPD) Markers,2019,"['polymorphism', 'randomly amplified polymorphic DNA (RAPD)', 'polymorphic information content (PIC) value', 'Thamnocalamus spathiflorus', 'cluster analysis']",,"Biodiversity refers to the total number and variation among species of flora and fauna of an area. Due to tremendous biotic especially anthropogenic pressure these natural resources are being vanishing. In present study genetic diversity among accessions of Thamnocalamus spathiflorus was evaluated. A total of 51 vegetative characters and 42 primers (10-mer) were screened. Out of 42 screened primers, 28 polymorphic primers were selected for further analysis. A total of 263 bands were recorded as polymorphic whereas 48 bands were monomorphic. The resolving power (Rp) of 28 Randomly Amplified Polymorphic DNA (RAPD) primers ranged from 4.6 (OPE08) to 17.6 (OPA11). The polymorphic information content (PIC) value ranged from 0.21 (OPAH09) to 0.44 (OPG02). The result revealed high degree of genetic relatedness (56 to 80%). Cluster analysis revealed two major clusters both for morphology as well as RAPD. Unlike morphological characterization, the accession (D5) from Bahli, Rampur, Shimla (H.P.) was clustered separately from the others in RAPD cluster analysis. Accessions with closed locality grouped together through RAPD marker system however analogy was recorded for morphological traits. The study conducted reflects the utility of RAPD technique for species identification and phylogenetic studies in bamboo for conducting bamboo breeding program."
An Analysis of Forest Health Using Machine Learning Algorithms,2019,"['숲', '건강', 'UAV', 'WEKA', 'RGBVI', 'GLI', 'NGRDI', 'ExGR', '기계학습', '알고리즘', 'Random Forest', 'forest', 'health', 'machine learning', 'algorithm', 'Random Forest']","본 연구의 주된 목적은 기계학습알고리즘을 이용하여 숲의 건강상태를 예측하고 분류하는 것이었다. 연구목적을 달성하기 위해 본 연구는 청주시 정중리의 한 숲을 연구지역으로 선정하고 이 지역에 대한 UAV영상을 촬영하였다. 본 연구는 UAV영상을 RGB 밴드로 분리시킨 다음 이를 기반으로 RGBVI값을 도출하였다. RGBVI는 일반적으로 농작물이나 식생의 건강상태를 나타내주는 지표로 이용되고 있다. 숲의 건강상태를 예측하기 위해 본 연구는 WEKA의 회귀분석 알고리즘을 이용하였다. 분석의 결과 GLI, NGRDI, ExGR은 숲의 건강에 정의 영향을 미치지만, ExG와 ExR은 숲의 건강에 부의 영향을 미치고 있음이 확인되었다. 또한 본 연구는 4개의 기계학습알고리즘을 이용하여 숲의 건강상태를 분류해보고 각 알고리즘의 성능을 비교하였다. 분석의 결과 Random Forest가 모든 범주에서 가장 효과적인 알고리즘임이 확인되었다. 본연구의 결과는 정책결정자들이 숲의 건강문제를 예측하고 이에 대한 대책을 세우는데 있어서 참고자료로 활용될 수 있을 것이다. 그러나 이러한 유용성에도 불구하고 본 연구는 몇 가지 한계점들을 지니고 있다. 이러한 한계들은 앞으로 시계열분석을 이용하면 어느 정도 극복될 수 있을 것이다.","The primary purpose of this study was to predict and classify the health status of forests using machine learning algorithms. To accomplish the research goals, I selected a forest of Jeongjung-ri, Cheongju city as a study area and captured the UAV images of this area. In this research, I split UAV images into RGB bands and then extracted RGBVI values based on them. RGBVI is generally used as an indicator of the health status of crops and vegetation. This study used the regression analysis algorithm of WEKA to predict the health status of forests. The results of the analysis showed that GLI, NGRDI, and ExGR had a positive impact on forest health, but ExG and ExR had a negative effect on forest health. This research also classified the health status of forests using four machine learning algorithms and compared the performance of each algorithm. The result of the analysis shows that Random Forest is the most effective algorithm in all categories. The results of this research can be used as a reference for policymakers to predict the health problems of forests and to prepare measures for them. Despite this usefulness, however, this study has some limitations. These limitations can be overcome to some extent by using time-series analysis."
