title,date,keywords,abstract,multilingual_abstract
1920-30년대 상하이의 협의서사 흥성 배경: 근대시기 동북아해역 인문네트워크와 상하이의 대중문화 (1),2019,"['근대시기', '동북아해역', '인문네트워크', '상하이', '협의서사', '상무정신', '협객', '엘리트문화', '하위문화', 'Modern Times', 'Northeast Asian Waters', 'Humanities and Cultural Network', 'Shanghai', 'Wuxia Literature', 'Militaristic Spirit', 'Wuxia Hero', 'Elite Culture', 'Low-class Culture']","상하이는 국제도시로 세계의 다양한 지식과 정보가 모이는 곳이었기 때문에 중국 그 어느 도시보다 지식인들이 집결하는 도시로 성장하였다. 상하이의 진보적 지식인은 국제정세 속에서 중국이 처한 상황을 깨닫게 되었고, 서구 열강의 침략에 맞서기 위해 자연스럽게 상무정신을 고취하였다. 많은 지식인은 중국 역사와 민간의 전통 속에서 협객을 발굴하였으며 그들의 상무정신을 찬양하였다. 한편, 상하이는 노동 이주민의 도시였다. 세계대전 후 서구의 자본이 상하이에 몰리게 되면서 국제도시 상하이는 중국 최대의 상공업도시로 성장하게 된다. 이에 상하이에는 다양한 국가, 인종, 지역민이 모여들었다. 이주민들은 그들의 생존과 이익을 위해 업종별, 출신 지역별로 다양한 조직을 결성하였고, 이들 조직은 조직의 결속을 위해 민간의 협의정신을 적극 수용하였다. 결론적으로 근대시기 상하이에는 위로는 상류층 지식인의 엘리트문화에서 아래로는 하층 노동자들의 하위문화에 이르기까지 모두가 협의정신을 찬양하는 문화가 형성되었다. 이는 근대시기 상하이가 지식과 지식인, 자본과 노동자를 끌어들이는 동북아해역의 인문네트워크 중심도시로 성장한 것과 밀접한 관련이 있는 것이었다. 그리고 이것이 1920-30년대 상하이에 협의서사가 흥성하게 된 주요배경이 되었다.","Reflecting both the modern desire as well as traditional values of East Asian cultures, wuxia literatures, or chivalry literatures, have long been loved by many in Northeast Asian region while being branched out into various genres until today. In order to understand and explore how these popular chivalry novels have emerged, spread out, and changed overtime, one must take a macroscopic view of looking into the “Northeast Asian society in modern times”. And in doing so, Shanghai must be at the center of attention as it was the hub of “humanities and cultural network of Northeast Asian waters” during the modern era. Shanghai, during modern times, was an international city, where diverse information from all over the world would flow into. Social and intellectual elites gathered in Shanghai more than any other cities in China. Those intellects, who wanted to learn from new cultures of the Western society rushed into Shanghai, which led to republication of some famous publications from other cities including Illustrated Treaties on the Maritime Kingdoms (海國圖志) and Evolution and Ethics (天演論) in Shanghai. Against such backdrop, many progressive intellects in Shanghai began to realize the situation China was faced with. They naturally immersed into the so called “martialism” or “militaristic spirit”. Many discovered knight-errants or wuxia heros in old Chinese history and civil traditions and admired their spirit. Amidst the invasion by the Western powers, the Chinese intellects of the modern times have chosen to abandon its long tradition of “educating people by literary”, and praised the wuxia heros. Shanghai was also a city of labor immigrants. With the Western capital rushing into Shanghai after the World War, this international city developed into the biggest commercial and industrial city of China, drawing various people of different nationalities, races, and regional background into the city. These immigrants formed many different organizations based on their industrial fields, origins and etc. to survive and uphold their interest. And these organizations proactively and widely accepted wuxia (chivalry) spirit in order to reinforce their solidarity. Amidst the anarchic chaos of Shanghai and fierce competition to survive in such environment, many of these organizations degenerated into criminal organizations. In such process of deterioration, the wuxia spirit was emphasize even more. Wuxia culture become so prevalent in Chinese society that even the leaders of criminal organizations were highly respected as wuxia heros within the lower-class society. In conclusion, the wuxia spirit was highly praised from all spectrums of the society from low-class labor culture to high-class elite cultures in modern Shanghai. This is highly relevant to the development of Shanghai as a hub of Northeast Asian humanities and culture network, drawing knowledge and intellects as well as capital and labors from all over the world. Such cultural and social background laid the foundation for prosperity of wuxia literatures in shanghai during 1920s-1930s."
황혼이혼 예방을 위한 결혼만족도 향상 차문화 프로그램,2019,"['Twilight Divorce', 'elderly couple', 'marriage satisfaction', 'tea culture', 'program', '황혼이혼', '노인부부', '결혼만족도', '차문화', '프로그램']","본 연구는 고령화와 이혼률 증가로 나타나는 노인 부부들의 황혼이혼을 예방하기 위한 결혼만족도 향상을 위한 차문화 프로그램을 개발하고 적용하고자 한다. 개발된 프로그램은 P시의 S노인복지관의 노인 부부들 10쌍을 대상으로 하였다. 황혼이혼을 예방하기 위한 결혼만족도 향상을 위한 차문화 프로그램은 1주일에 1회씩 총 8회이며, 회기 당 90분으로 도입 15분, 개입 전개 활동 60분, 소감나누기와 정리 15분으로 구성하여 진행하였다. 노인 부부들의 결혼만족도 향상을 위한 차문화 프로그램 참여가 노인부부들의 결혼만족도 향상에 미치는 효과를 검증하기 위하여, 프로그램 참여 전과 후의 결혼만족도 측정도구 점수 차이에 대한 대응표본 t-test를 실시하였다. 황혼이혼을 예방하기 위한 결혼만족도 향상을 위한 차문화 프로그램의 효과를 분석한 결과, 프로그램 참여 전 노인들의 결혼만족도 점수 평균은 157.60(SD 24.65)이었고, 프로그램 참여 후 결혼만족도 점수 평균은 158.45(SD 23.78)로 나타나 프로그램 참여 전과 참여 후의 결혼만족도 점수 수준은 유의한 차이가 나는 것으로 확인되었다(t=-2.998**, P=.007). 또한 프로그램 참여한 노인부부들은 부부가 함께 차문화를 알고, 몸에 좋은 차를 마시며, 마음에 있었던 것을 표현할 수 있는 프로그램으로 활동하니 건강도 증진되고, 부부관계도 친해지고 가까워졌다고 하였다. 그리고 황혼이혼을 예방하기 위한 결혼만족도 향상을 위한 차문화 프로그램 활동은 우리 민족의 전통생활문화인 차문화를 바탕으로 한 프로그램이라 쉽게 따라 할 수 있었고, 프로그램에서 활동한 것을 일상생활 속에서 부부가 함께 실천할 수가 있어서 부부 공동의 소중한 체험이었다고 하였다. 이상으로 본 연구는 노인부부들의 황혼이혼을 예방하기 위한 차문화 프로그램은 결혼만족도 향상를 향상시키는데 효과가 있음을 보여주었다.","This study aimed to develop and apply a tea culture program to improve marriage satisfaction with the purpose of preventing divorce in elderly couples. The program was developed to target 10 elderly couples in the S-Aged Welfare Center in P.C. The tea culture program was conducted once a week, consisting of 15 minutes of introduction, 60 minutes of intervention activities, and 15 minutes of impression sharing and wrap up. To verify the effects of the tea culture program, a t-test was conducted to test the difference between the scores of marriage satisfaction measurement tools before and after the program. Analysis of the effectiveness of the tea culture program to improve the level of marriage satisfaction showed that the average score of elderly people's marriage satisfaction before the program was 157.60 (SD 24.65), and the average of marriage satisfaction score after program participation was 158.45 (SD 23.78), showing significant differences in the level of marriage satisfaction before and after program participation (t=-2.998**, P=.007). Moreover, elderly couples who participated in the program expressed that they were able to learn about the tea culture together, drink healthy tea, and express what was on their minds, thus promoting health and improving the relationship. In addition, the activity of the tea culture therapy program aimed at improving the marital satisfaction level to prevent divorce was a valuable experience for couples because it was a program based on the tea culture, reinforcing the traditional Korean lifestyle and culture and giving couples the opportunity to bond together. This study further showed that the tea culture program to prevent elderly couples from getting divorced at twilight may be effective in improving their marriage satisfaction."
Language and culture as distinctive features of pedagogy in the classroom,2019,"['Pedagogy', 'Language', 'culture', 'teaching and leanring', 'Korean society', 'Primary school', '교육학', '언어', '문화', '교수 및 학습', '한국사회', '초등학교']","본 논문은 한국 사회의 언어와 문화적 특징들이 학교 교실 현장에서 교사의 수업방식, 학생들의 학습행태 등에 어떻게 영향을 미치고 서로 연관성을 갖는지를 분석하는데 중점을 둔다. 본 논문은 혼합 방법론 : 포커스 그룹 인터뷰 및 강의실 관찰 방법론을 활용하여 초등학교 교실 수업을 분석한 결과, 교실에서의 수업 행태 등이 체면, 눈치 등으로 대표되는 한국의 문화적 특징들과 한글에 나타나는 존칭어 구조와 특징들의 영향을 받는다는 사실을 입증하는 한편, 교실에서의 현장교육이 한 사회의 문화적 특징들을 반영할 뿐만 아니라 그러한 특징들을 더욱 강화한다는 사실을 설명해 주고 있다. 본 연구는 결론적으로 교실에서의 교육 행태와 과정 등을 보다 잘 이해하고 개선하기 위해서는 항상 그 나라의 문화적 맥락 속에서 현상을 바라봐야 한다는 점을 강조하고 있다.","This study used mixed method methodology: focus group interviews and classroom observations to examine aspects of teaching practices and learning behaviors in relation to the characteristics of Korean society. More specifically, this study aimed to explore the effect of language and cultural characteristics, and its relation to students and teachers behavior in the classroom. The study found teaching beliefs and practices were affected by the cultural features identified as chemyeon , hyodo and nunchi , as well as the honorific structure and characteristics of hangul (the Korean language). The present study, went further and showed that primary school pedagogy does not just reflect this social selection but also maintained and reinforced it. The study concludes that the process of teaching and educational practices should always be examined within their national cultural context in which the classroom is located, in order to understand and improve classroom practices."
2015 개정 영어과 교육과정 성취기준에 반영된 교과역량 특성 분석,2019,"['English competency', 'English curriculum', 'English curriculum achievement standards', 'Semantic network analysis', '영어과 교과역량', '영어과 교육과정', '영어과 성취기준', '언어 네트워크 분석']","2015 개정 교육과정에서는 미래지향적 관점에서 핵심역량과 교과역량을 도입하였다. 교과역량은 핵심역량 도달의 전제이고, 학생들의 교과역량 함양은 개별 교과 수업을 통해서 가능하다. 이에 본 연구는 수업을 안내하는 교육과정 성취기준에 교과역량이 반영되어 있어야 한다고 보고, 영어과 성취기준에 반영된 영어과 교과역량의 특성을 언어 네트워크 분석 방법을 사용하여 분석하였다. 초·중·고 영어과 교육과정 문서의 성취기준을 분석의 대상으로, 교과역량을 분석의 틀로 설정하고 빈도와 중심성 값을 산출하였다. 연구의 결과, 영어과 교육과정 성취기준 진술은 빈도와 중심성 값에서 영어 의사소통 역량으로 크게 편중되어 있었으며, 이를 통해 다음과 같은 시사점을 도출하였다. 첫째, 영어과의 교과역량을 교육과정 성취기준에 균형적으로 반영할 필요가 있다. 둘째, 교과역량을 성취기준에 체계적으로 반영하기 위해서는 교과역량을 하위범주로 구체화하고, 각론 내용체계의 ‘기능’을 개발하는 연구가 요구된다. 셋째, 영어과의 정체성과 특수성을 드러내고 총론의 핵심역량과 연계되는 교과역량 개발이 필요하다. 교과역량을 기르는 교수·학습이 실현되고 궁극적으로 국가 교육과정에서 의도하는 핵심역량의 구현이 가능해지기 위해서는 성취기준 진술문에 대한 교과역량의 반영이 중요함을 강조하였다.","In the revised 2015 curriculum, core competencies and subject competencies were introduced in future-oriented perspectives. The general competence is well developed only when subject competence is acquired and subject capacity can be realized through individual lessons. The goal of this study is to analyze the English  competency of the achievement standards of the 2015 revision. For this purpose, the Semantic Network Analysis method was used to structurally analyze the text and understand semantic relations. Results of the study show that achievement standards in all school levels were heavily biased to the English communication competency. From this, the following suggestions were identified for additional revisions: First, it is necessary to have well balanced reflection of subject competency on curriculum achievement standards. Second, in order to systematically reflect subject competencies in the achievement standards, it is necessary to departmentalize the subject competencies into subcategories and develop the functionality of the curriculum contents system. Third, subject competence development needs to be aligned with core competence as well as adhere to the expectations and specificity of the English department. By reinforcing the linkage between competency and achievement standards, it is expected that the teaching and learning methods required to raise subject competency will be implemented, and ultimately, the core competence expected in the national curriculum will also be achieved.."
인공지능과 젠더차별,2019,"['인공지능', '젠더', '차별', '편향', '윤리', 'Artificial Intelligence', 'Gender', 'Discrimination', 'Bias', 'Ethics']","인공지능 알고리즘은 사회 전반에서 급속도로 활용범위가 넓어지고 있으나, 이로 인하여 차별이나 편향이 강화될 우려가 있고, 이러한 문제는 젠더차별에서 두드러진다. 인공지능 알고리즘은 디자인 단계에서 개발자의 편향을 그대로 반영할 수도 있고, 소수자 데이터 대표성의 결여로 차별을 야기할 수도 있으며, 과거의 데이터로부터 기존의 편향을 학습하여 확대, 재생산할 수도 있다. 인공지능 맥락에서 젠더차별은 인공지능 스피커의 디자인에서 여성 목소리를 디폴트로 설정하거나, 안면인식 알고리즘이 여성을 남성에 비하여 정확하게 인식하지 못한다거나, 여성이 인공지능 입사지원 선별 시에 남성보다 불리하게 취급되거나, 여성의 신용한도가 남성보다 적거나, ‘여성스러운’ 광고에만 노출되는 등의 여러 형태로 나타난다.  이러한 인공지능에 의한 편향과 차별을 시정하기 위해서는 먼저 과학기술 교육, 연구, 사업영역에서 젠더평등이 실현되어야 한다. 다음으로는 인공지능 알고리즘의 공정성, 설명가능성, 투명성을 높이기 위한 연구와 정책적 노력이 필요하다. 끝으로 기존에 존재하였던 젠더차별을 파악하고 시정하는 수단으로 인공지능을 활용하는 방안도 모색하여야 할 것이다.","Algorithms of artificial intelligence are already broadly used, but many people worry that AI might reinforce bias or discrimination, and such problems are the most prominent in gender discrimination. AI algorithms can reflect programmers’ bias at the design stage, cause discrimination to minorities due to lack of minority-representative data, or learn and reproduce existing biases from past data. In the AI context, gender discrimination appears in many forms; for example, programmers tend to set a female voice as the default of an AI speaker, the AI-powered facial recognition systems do not accurately identify female faces compared to male faces, the recruit AI gives lower scores to female job applicants than to male ones, the credit card AI allows lower credit limit to females than males, and AI shows less STEM ads to females than males.  In order to correct such gender bias and discrimination by AI, firstly, gender equality must be realized in the STEM and ICT education, research and business areas. Secondly, research and policy efforts are needed to promote fairness, explainability and transparency of AI. Lastly, we should explore ways to use AI as a means to identify and correct the existing gender discrimination."
학교 수학에서 디지털 리터러시 교육 양상 분석,2019,"['디지털 리터러시', '공학적 도구', '정보 처리 역량', '2015 개정 수학과 교육과정', 'Digital Literacy', 'technological tools', 'information processing competency', 'the 2015 Revised Mathematics Curriculum']","디지털 시대가 도래함에 따라 디지털 리터러시는 학교 교육에서 필수적으로 다루어져야 할 부분이 되어 가고 있다. 수학과 교육과정에서는 6차 교육과정에서 계산기와 컴퓨터 등과 같은 공학적 도구를 활용한 교육을 명시하면서 수학 교과에 디지털 리터러시 교육에 대한 역할을 부여하고 있으며, 최근 2015 개정 교육과정에서는 좀 더 적극적으로 디지털 리터러시 교육을 수용하는 경향을 보이고 있다. 본 연구에서는 수학과 교육과정의 디지털 리터러시 수용 양상을 살펴보고, 설문 조사 및 수업 사례 분석을 통해 수학 수업에서 디지털 리터러시 교육 실태를 분석하였다. 연구 결과 2015 개정 교육과정에서는 디지털 리터러시 교육을 수용하는 양상을 보이고 있으나, 교사들은 디지털 리터러시 관련 수업에 대한 인식이 긍정적이지 않은 편이었고, 수업이 교사 주도로 이루어지는 경우가 많았다. 또한 성취기준 수준에 제시된 ‘공학적 도구의 이용’에 대한 해석에 혼란이 있었고, 수학 교과에서 디지털 리터러시 교육을 위한 학교 여건이 부족하였으며, 디지털 리터러시 수업에서 학생들의 협력적 실행 정도가 낮은 것으로 나타났다.","The purpose of this study is to examine the current status of digital literacy education of the mathematics in accordance with the 2015 revised national curriculum and to draw up substantial improvements to foster digital literacy education in mathematics. This study intends to carry out a multi-layered inspection on how contents related to digital literacy has been adopted in the mathematics curriculum, how the math teacher perceive digital literacy education, and how they put this into practice in real classes. The study investigated how digital literacy has been adopted according to the changes of the mathematics curriculum and aggregate and considerate aspects how mathematics adopted digital literacy by characteristics in mathematics  through analysis of standards in the 2015 revised national mathematics curriculum. In addition, this study analysis the current status of digital literacy education in mathematics education through surveying teaching cases, and exploring the improvements for digital literacy education in Mathematics educationThrough this study drew three suggestions so as to enhance digital literacy education of the mathematics: reinforcement of learning contents for strengthen digital literacy education of mathematics; activation of cooperative learning for digital literacy education of mathematics; and establishing a system to improve math teachers’ professionality."
한국과 중국의 전통무예에 관한 인식조사 연구,2019,"['Traditional Martial Arts', 'Recognition', 'the Revitalization of Traditional Martial Arts']",,"The purpose of this study is to propose a development plan to develop effective martial arts policies for the conditions of Korea and China and to provide basic data for the promotion of traditional martial arts. Therefore, I compared and analyzed the policies related to martial arts in Korea and China, and examined how the public in both countries perceive traditional martial arts. Based on the analyzed results, it is as follows. Based on the recognition of traditional martial arts policies and laws, the following conclusions were drawn. First, in the perception and attitude of the traditional martial arts felt by the people of Korea and China, the masses of the two countries should be aware of the macro recognition of traditional martial arts, the necessity of learning the culture, the necessity of succession and reversal of traditional martial arts, I think that there is a need for the cultural value and tradition of the traditional martial arts of the nation in regard to the development of legitimacy and the intention of participating in training. However, they were not aware of the traditional martial arts. Second, the perception of the constraints of traditional martial arts development in the two countries was recognized in the order of lack of publicity, indifference of the people, restriction of supply due to complicated classification, lack of training opportunities and non practicality. Third, for the activation of traditional martial arts, it is necessary to reinforce publicity about the culture and to attract related game events, and to provide a combination of life sports and school education. Korea and China should make more effort for modernization and popularization with the value and meaning of traditional martial arts."
