title,date,keywords,abstract,multilingual_abstract
텍스트 마이닝 기법을 활용한 인공지능 기술개발 동향 분석 연구: 깃허브 상의 오픈 소스 소프트웨어 프로젝트를 대상으로,2019,"['Artificial Intelligence', 'Technology Trends', 'Open Source Software', 'Github', 'Text Mining', '인공지능', '기술 동향', '오픈 소스 소프트웨어', '깃허브', '텍스트 마이닝']","제4차 산업혁명을 이끄는 주요 원동력 중 하나인 인공지능 기술은 이미지와 음성 인식 등 여러 분야에서 사람과 유사하거나 더 뛰어난 능력을 보이며, 사회 전반에 미치게 될 다양한 영향력으로 인하여 높은 주목을 받고있다. 특히, 인공지능 기술은 의료, 금융, 제조, 서비스, 교육 등 광범위한 분야에서 활용이 가능하기 때문에, 현재의 기술 동향을 파악하고 발전 방향을 분석하기 위한 노력들 또한 활발히 이루어지고 있다. 한편, 이러한 인공지능 기술의 급속한 발전 배경에는 학습, 추론, 인식 등의 복잡한 인공지능 알고리즘을 개발할 수 있는 주요플랫폼들이 오픈 소스로 공개되면서, 이를 활용한 기술과 서비스들의 개발이 비약적으로 증가하고 있는 것이주요 요인 중 하나로 확인된다. 또한, 주요 글로벌 기업들이 개발한 자연어 인식, 음성 인식, 이미지 인식 기능등의 인공지능 소프트웨어들이 오픈 소스 소프트웨어(OSS: Open Sources Software)로 무료로 공개되면서 기술확산에 크게 기여하고 있다. 이에 따라, 본 연구에서는 온라인상에서 다수의 협업을 통하여 개발이 이루어지고있는 인공지능과 관련된 주요 오픈 소스 소프트웨어 프로젝트들을 분석하여, 인공지능 기술 개발 현황에 대한보다 실질적인 동향을 파악하고자 한다. 이를 위하여 깃허브(Github) 상에서 2000년부터 2018년 7월까지 생성된인공지능과 관련된 주요 프로젝트들의 목록을 검색 및 수집하였으며, 수집 된 프로젝트들의 특징과 기술 분야를 의미하는 토픽 정보들을 대상으로 텍스트 마이닝 기법을 적용하여 주요 기술들의 개발 동향을 연도별로 상세하게 확인하였다. 분석 결과, 인공지능과 관련된 오픈 소스 소프트웨어들은 2016년을 기준으로 급격하게 증가하는 추세이며, 토픽들의 관계 분석을 통하여 주요 기술 동향이 ‘알고리즘’, ‘프로그래밍 언어’, ‘응용분야’, ‘개발 도구’의 범주로 구분하는 것이 가능함을 확인하였다. 이러한 분석 결과를 바탕으로, 향후 다양한 분야에서의 활용을 위해 개발되고 있는 인공지능 관련 기술들을 보다 상세하게 구분하여 확인하는 것이 가능할 것이며, 효과적인 발전 방향 모색과 변화 추이 분석에 활용이 가능할 것이다.","Artificial intelligence (AI) is one of the main driving forces leading the Fourth Industrial Revolution. The technologies associated with AI have already shown superior abilities that are equal to or better than people in many fields including image and speech recognition. Particularly, many efforts have been actively given to identify the current technology trends and analyze development directions of it, because AI technologies can be utilized in a wide range of fields including medical, financial, manufacturing, service, and education fields. Major platforms that can develop complex AI algorithms for learning, reasoning, and recognition have been open to the public as open source projects. As a result, technologies and services that utilize them have increased rapidly. It has been confirmed as one of the major reasons for the fast development of AI technologies. Additionally, the spread of the technology is greatly in debt to open source software, developed by major global companies, supporting natural language recognition, speech recognition, and image recognition. Therefore, this study aimed to identify the practical trend of AI technology development by analyzing OSS projects associated with AI, which have been developed by the online collaboration of many parties. This study searched and collected a list of major projects related to AI, which were generated from 2000 to July 2018 on Github. This study confirmed the development trends of major technologies in detail by applying text mining technique targeting topic information, which indicates the characteristics of the collected projects and technical fields.The results of the analysis showed that the number of software development projects by year was less than 100 projects per year until 2013. However, it increased to 229 projects in 2014 and 597 projects in 2015. Particularly, the number of open source projects related to AI increased rapidly in 2016 (2,559 OSS projects). It was confirmed that the number of projects initiated in 2017 was 14,213, which is almost four-folds of the number of total projects generated from 2009 to 2016 (3,555 projects). The number of projects initiated from Jan to Jul 2018 was 8,737.The development trend of AI-related technologies was evaluated by dividing the study period into three phases. The appearance frequency of topics indicate the technology trends of AI-related OSS projects. The results showed that the natural language processing technology has continued to be at the top in all years. It implied that OSS had been developed continuously. Until 2015, Python, C ++, and Java, programming languages, were listed as the top ten frequently appeared topics. However, after 2016, programming languages other than Python disappeared from the top ten topics. Instead of them, platforms supporting the development of AI algorithms, such as TensorFlow and Keras, are showing high appearance frequency. Additionally, reinforcement learning algorithms and convolutional neural networks, which have been used in various fields, were frequently appeared topics.The results of topic network analysis showed that the most important topics of degree centrality were similar to those of appearance frequency. The main difference was that visualization and medical imaging topics were found at the top of the list, although they were not in the top of the list from 2009 to 2012. The results indicated that OSS was developed in the medical field in order to utilize the AI technology. Moreover, although the computer vision was in the top 10 of the appearance frequency list from 2013 to 2015, they were not in the top 10 of the degree centrality. The topics at the top of the degree centrality list were similar to those at the top of the appearance frequency list. It was found that the ranks of the composite neural network and reinforcement learning were changed slightly.The trend of technology development was examined using the appearance frequency of topics ..."
NASNet을 이용한 이미지 시맨틱 분할 성능 개선,2019,"['Image semantic segmentation', 'Neural network hyper-parameter', 'Brain tumor', 'DeepU-Net', 'NASNet']","최근 빅데이터 과학은 사회현상 모델링을 통한 예측은 물론 강화학습과 결합하여 산업분야 자동제어까지 응용범위가 확대되고 있다. 이러한 추세 가운데 이미지 영상 데이터 활용연구는 화학, 제조, 농업, 바이오산업 등 다양한 산업분야에서 활발히 진행되고 있다. 본 논문은 신경망 기술을 활용하여 영상 데이터의 시맨틱 분할 성능을 개선하고자, U-Net의 계산효율성을 개선한 DeepU-Net 신경망에 AutoML 강화학습 알고리즘을 구현한 NASNet을 결합하였다.BRATS2015 MRI 데이터을 활용해 성능 검증을 수행하였다. 학습을 수행한 결과 DeepU-Net은 U-Net 신경망 구조보다 계산속도 향상 뿐 아니라 예측 정확도도 동등 이상의 성능이 있음을 확인하였다. 또한 이미지 시맨틱 분할 성능을개선하기 위해서는 일반적으로 적용하는 드롭아웃 층을 빼고, DeepU-Net에 강화학습을 통해 구한 커널과 필터 수를신경망의 하이퍼 파라미터로 선정했을 때 DeepU-Net보다 학습정확도는 0.5%, 검증정확도는 0.3% 시맨틱 분할 성능을 개선할 수 있었다. 향후 본 논문에서 시도한 자동화된 신경망을 활용해 MRI 뇌 영상진단은 물론, 열화상 카메라를통한 이상진단, 비파괴 검사 진단, 화학물질 누출감시, CCTV를 통한 산불감시 등 다양한 분야에 응용될 수 있을 것으로 판단된다.","In recent years, big data analysis has been expanded to include automatic control through reinforcement learning as well as prediction through modeling. Research on the utilization of image data is actively carried out in various industrial fields such as chemical, manufacturing, agriculture, and bio-industry. In this paper, we applied NASNet, which is an AutoML reinforced learning algorithm, to DeepU-Net neural network that modified U-Net to improve image semantic segmentation performance. We used BRATS2015 MRI data for performance verification. Simulation results show that DeepU-Net has more performance than the U-Net neural network. In order to improve the image segmentation performance, remove dropouts that are typically applied to neural networks, when the number of kernels and filters obtained through reinforcement learning in DeepU-Net was selected as a hyperparameter of neural network. The results show that the training accuracy is 0.5% and the verification accuracy is 0.3% better than DeepU-Net. The results of this study can be applied to various fields such as MRI brain imaging diagnosis, thermal imaging camera abnormality diagnosis, Nondestructive inspection diagnosis, chemical leakage monitoring, and monitoring forest fire through CCTV."
대학 교양국어 교재 개편 방안 연구 - 목원대학교 1학기 교양국어 교재를 중심으로 -,2019,"['목원대학교', '교양 국어', '토론', '말하기', '글쓰기', '의사소통능력', '창의적 문제해결 능력', '생각하고 표현하는 말하기.', 'Mokwon University', 'liberal arts Korean language', 'discussion', 'speaking', 'writing', 'communication skills', 'creative problem solving skills', 'Speaking to thinking and expression.']","이 연구의 목적은 목원대학교 교양국어 1학기 교재에 대한 방향성과 내용을 수립하여, 대학생들이 2020년 1학기부터 수업에서 직접 활용할 수 있는 교재의 콘텐츠를 개발, 탐색하는 데 있다. 목원대학교 교양국어 교재편찬위원회는 그동안 교양국어 <토론과 글쓰기>Ⅰ,Ⅱ 개편 방향을 모색한 결과 읽기, 듣기, 말하기, 글쓰기의 국어과 4대 영역에 대한 통합교육을 반영하는 동시에 ‘혁신’교과목으로서 4대 핵심역량(이타적 인성역량, 주체적 자립역량, 창의적 문제해결 역량, 융화적 소통역량)에 맞추어 새롭게 교재를 편찬하고자 하였다.목원대학교는 학습자와 교수자의 설문 조사를 통해 다음과 같은 방안을 마련하였다. 첫 번째, 새 교재는 신입생들의 기초 학습 능력을 향상하기 위해 교과의 목표와 운영을 학기별로 특화(1학기는 말하기 집중 교육/2학기는 글쓰기 집중 교육)하는데 주안점을 둔다. 두 번째, 1학기 교재의 경우 학생들이 효과적으로 학습을 수행할 수 있도록 말하기에 대한 기초지식을 먼저 습득한 후 다양한 생각과 의견을 수렴하고 자신의 생각을 자유롭게 소그룹 내에서 말하기로 표현할 수 있도록 교재를 단계적으로 구성한다. 세 번째, 본 교재는 15주 강의에 적합하도록 이론 및 실습, 발표, 토론, 중간 및 기말고사로 구성한다. 중간고사 이전에는 미니토론, 발표 등의 소그룹 활동을 배치하여 자신의 생각을 자유롭게 말로 표현하는 개인별 체험학습을 강화하도록 중점을 둔다. 중간고사 이후에는 본격적인 토론을 통해 공적 말하기 집중교육을 실시함으로써 학습의 효율성을 높일 수 있도록 구성한다. 네 번째, 새 교재는 교양 마이크로 디그리 과정에 신설된 의사소통능력과 국어능력을 함양하는 교과목들과 연계하여 설계된다는 점이 특징이다.무엇보다 2020년 1학기에 사용될 새 교재(생각하고 표현하는 말하기)는 학생들이 수업을 듣고 난 후 비판능력과 창의적 문제해결능력을 함양할 수 있도록 향후 멀티미디어 부교재, 표준강의안, 평가 도구 등을 함께 개발하여 체계적인 기초교육이 실시될 수 있도록 방향을 모색할 것이다.","This article aims to search for directionality regarding the reorganization of the textbook that is to be used beginning in the first semester of the year 2020 in the liberal arts Korean language course of <Discussion and Writing> I of Mokwon University. After the Textbook Compilation Committee for the liberal arts Korean language course of Mokwon University searched for directionality for the textbooks of the liberal arts Korean language courses <Discussion and Writing> I and II, it attempted to newly compile textbooks that reflect the integrated education of reading, listening, speaking, and writing, which are the 4 major domains of Korean language, and that satisfy 4 major core competencies as an ‘innovative’ course (altruistic personality capacity, self󰠏reliant capacity, creative problem solving capacity, conciliatory communication capacity). Goals were set to compile new textbooks with those for the first semester focusing on the cultivation of speaking abilities (expressing thoughts freely), and those for the second semester focusing on the cultivation of writing abilities (organizing thought logically).Mokwon University prepared the following measures through surveys conducted on learners and teachers. First, new textbooks lay emphasis on specializing subject goals and management by semester (speaking focused education in semester 1/writing focused education in semester 2) to improve the basic learning skills of new students. Second, with textbooks for the first semester, basic knowledge on speaking is taught so that students can effectively learn and textbooks are composed in phases so that diverse thoughts and opinions can be collected and individual thoughts can be freely expressed through speaking within small groups. Third, these textbooks are composed to fit 15 week lectures with theory and practice, presentation, discussion, mid󰠏terms, and finals. Before mid󰠏terms, small group activities such as mini discussions and presentations are arranged, placing focus on the reinforcement of individual empirical learning in which thoughts can be expressed freely. After mid󰠏terms, focused speaking education is conducted through standard discussion and it is composed to increase learning efficiency. Fourth, new textbooks are characteristic in that they are designed to connect to subjects that cultivate communication skills and Korean language skills established in liberal arts micro degree courses. Fifth, contents of the Mokwon Stokes Discussion Competition held in the second semester of every year will be included in a supplement. Contents such as discussion competition topics, discussion process methods, discussion manuals, and score cards are included in sessions 1 to 6 and after students take classes, they can continually use these textbooks as speaking guides.More than anything else, methods for systematic basic education to be implemented will be searched for through the development of various multimedia auxiliary textbooks, standard lecture plans, and assessment tools along with textbooks(Speaking to thinking and expression) that will be used in the first semester of 2020 so that students will be able to cultivate their critical skills and creative problem solving skills after taking classes."
자기주도적 독서력 향상을 위한 수업모형 개발,2019,,"연구목적: 학습자의 독서에 대한 동기 부여 및 자기주도적 독서능력을 향상시키기 위한 수업모형을 개발하고자 하는 목적으로 연구가 진행되었다. 연구방법: 문헌 연구를 통해 자기주도적 학습의 개념 모형과 독서지도 모형 및 전략을 비교 분석하여 자기주도적 독서 수업모형을 개발하기 위한 설계원리를 도출한 후, 그에 맞는 모형을 개발하였다. 실제 수업에 개발된 수업모형을 적용하여 문제점과 개선점을 찾아 수업 모형을 수정 보완한 후 자기주도적 독서 수업모형을 완성하였다. 연구결과: 개발된 수업모형은 크게 학습설계, 학습실행, 학습평가의 세 단계로 나뉜다. 학습설계 단계의 1차시에는 책으로 다가가기-책에 대해 알아보기- 독서과제 정하기 활동이 이루어지고, 2차시에는 독서목표 정하기-소집단구성하기-독서계약정하기-독서활동계획하기 활동이 이루어진다. 학습실행 단계는 주로 과제학습으로 이루어지며 계획 점검하며 책읽기-읽기전략 사용하며 책읽기-다양한 독후활동하기가 이루어진다. 학습평가 단계에서는 자기평가-동료평가-자기강화 활동이 이루어진다. 논의 및 결론: 자기주도적 독서 수업모형의 적용 결과, 학습자의 자기주도적 독서에 대한 관심이 높아졌으며 자기주도적 학습력과 독서 동기가 향상되었다.","Purpose: The purpose of this study was to develop a model of instruction geared toward boosting the reading motivation and self-directed reading ability of learners. Method: Based on the design principles, it creates the main activities and thought processes of each step of self-directed reading. After applying the model to the actual class, the model is verified through the formative evaluation and revised and complemented to complete the self–directed reading ability class model. Results: There were largely three stages in the instructional model: learning design, acting and evaluating. The first phase of the learning design is composed of students approach the book - learn about the book - set reading tasks, and second session is composed of set reading goals - set up small groups - set reading agreements - plan reading activities. The acting stage is composed of planning checks, the use of reading strategies and post reading activities. Evaluation stage is composed of self-evaluation, peer evaluation and self-reinforcement. Conclusion: The instructional model of self-directed learning was found to draw attention from the learners to self-directed learning and effective at bolstering self-directed learning capability and reading motivation."
N-DQN: 계층화된 병렬 강화학습 모델의 구현 및 연구,2019,"['강화학습', 'Reinforcement Learning', 'DQN']",,
심층 결정론적 정책 경사법을 이용한 선박 충돌 회피 경로 결정,2019,"['Collision avoidance(충돌 회피)', 'Reinforcement learning(강화학습)', 'Deep Deterministic Policy Gradient(DDPG', '심층결정론적정책경사법)', 'Markov Decision Process(MDP', '마르코프결정과정)', 'Autonomous ship(자율운항선박)']",,
NCS 직업기초능력 신장을 위한 프로젝트기반 융합 교육 프로그램 개발 및 적용,2019,"['NCS vocational basic abilities', 'STEAM education', 'Project-based Learning', 'Education', 'NCS 직업기초능력', '프로젝트기반 학습', 'STEAM 교육', '형성적 연구 방법']","본 연구는 NCS 직업기초능력의 개념과 특징, 기존의 교수 학습 방법에 대한 고찰을 통해 NCS 직업기초능력 신장을위한 효과적인 교수 학습 방안을 제안하고자 수행되었다. 기존의 NCS 직업기초능력 교육은 직무 상황에서 실질적인지식의 활용과 행동 변화를 추구하기 때문에 체험 활동이 중심이 되는 프로젝트기반 학습을 활용한다. 하지만 NCS 직업기초능력은 문제해결능력, 의사소통능력, 대인관계능력과 같이 다양한 요소가 융합된 상황에서 사회· 환경과의긴밀한 상호작용 속에서 구성될 수 있는 영역이 주요 요소로 부각되고 있다. 이에 STEAM 교육은 다양한 영역과의융합을 통해 직무현장과 학습 환경을 밀접하게 연계할 수 있어 기존의 프로젝트기반 학습 보다 사회적 수요를 반영하기용이하기 때문에 실무 역량을 강화하기 유용하다. 또한 교사의 개입을 최소화하여 최대한 자유로운 환경 속에서학습자의 창의적인 지식, 기술, 사고 등을 촉진할 수 있어 삶의 적용 능력을 비롯한 문제해결능력, 의사소통능력, 대인관계능력과 같은 영역 신장에 직접적인 영향력을 발휘한다. 이에 본 연구는 형성적 연구방법에 따라 먼저 선행연구를통해 프로젝트기반 융합 교육 프로그램 개발을 위한 설계 원칙, 구성 요소를 도출하고, 프로젝트기반 교육과 STEAM 교육의 연계 교육 단계를 정립하였다. 이후 전문가 타당화 검사를 실시하여 적합성을 인정받은 프로그램을 충남시특성화 고등학교 1학년 학생 26명에게 2018년 3월부터 5월까지 8차시 동안 적용하였으며, 설문조사를 통해 자료를수집한 후 사전 ·사후 t 검정을 통해 NCS 직업기초능력이 향상되는 결과를 확인하였다. 최종적으로 면담과 성찰일지를통한 학습자 반응과 프로그램 적용 결과를 분석하고, 담당 교사의 의견을 종합하여 NCS 직업기초능력 신장을 위한교육 방법으로서 보다 발전시키기 위한 시사점을 도출하였다.","As more and more effort to reinforce learners’ vocational ability is put over entire school education system, demand for teaching and learning methods of basic NCS vocational ability is increasing. Basic NCS vocational ability applies project-based education methods of learner-oriented experience activities based on Constructivist Epistemology, seeking knowledge application to vocational situations and behavioral changes. However, what this study pays attention to is the point that basic NCS vocational ability can be configured in combination of complex factors against societal backgrounds such as problem-solving ability, communication skills, human relation skills, etc. in addition to knowledge, technology, character, attitude, etc. which are considered cognitive and definitive. Therefore, associating study situation with real life more closely, active participation in study is induced. Reinforcing active interaction with different social environmental factors, more advanced knowledge, technology, abilities need to be developed and promoted. So, in this study, more practical study subjects and situations are suggested by integrating diverse factors and active interaction among different areas internally and externally. Finally, this study complemented STEAM educational factors additionally which makes advanced knowledge, technology, and ability extending through self-reflection. In this study, as a way to improve basic NCS vocational ability, project-based integrated education program is developed by complementing STEAM educational factors to previous project-based education in order to improve NCS-based vocational ability. Finally, a few implications were drawn out from the results of program application to suggest better educational methods to improve basic NCS vocational ability."
CCTV-Based Multi-Factor Authentication System,2019,"['Argon2', 'Convolutional Neural Network', 'Deep Reinforcement Learning', 'Physically Unclonable Functions']",,"Many security systems rely solely on solutions based on Artificial Intelligence, which are weak in nature. These security solutions can be easily manipulated by malicious users who can gain unlawful access. Some security systems suggest using fingerprint-based solutions, but they can be easily deceived by copying fingerprints with clay. Image-based security is undoubtedly easy to manipulate, but it is also a solution that does not require any special training on the part of the user. In this paper, we propose a multi-factor security framework that operates in a three-step process to authenticate the user. The motivation of the research lies in utilizing commonly available and inexpensive devices such as onsite CCTV cameras and smartphone camera and providing fully secure user authentication. We have used technologies such as Argon2 for hashing image features and physically unclonable identification for secure device-server communication. We also discuss the methodological workflow of the proposed multi-factor authentication framework. In addition, we present the service scenario of the proposed model. Finally, we analyze qualitatively the proposed model and compare it with state-of-the-art methods to evaluate the usability of the model in real-world applications."
딥러닝 기반의 농산물 가격 예측 시스템에 대한 연구,2019,"['agricultural price prediction system', 'deep learning', 'reinforcement learning', 'KAMIS']",,
