title,date,keywords,abstract,multilingual_abstract
문서 분류의 개선을 위한 단어-문자 혼합 신경망 모델,2017,"['문서 분류', '딥 러닝', '컨볼루션 신경망', '순환 신경망', 'document classification', 'deep learning', 'convolutional neural network', 'recurrent neural network']","문서의 텍스트를 바탕으로 각 문서가 속한 분류를 찾아내는 문서 분류는 자연어 처리의 기본 분야 중 하나로 주제 분류, 감정 분류 등 다양한 분야에 이용될 수 있다. 문서를 분류하기 위한 신경망 모델은 크게 단어를 기본 단위로 다루는 단어 수준 모델과 문자를 기본 단위로 다루는 문자 수준 모델로 나누어진다. 본 논문에서는 문서를 분류하는 신경망 모델의 성능을 향상시키기 위하여 문자 수준과 단어 수준의 모델을 혼합한 신경망 모델을 제안한다. 제안하는 모델은 각 단어에 대하여 문자 수준의 신경망 모델로 인코딩한 정보와 단어들의 정보를 저장하고 있는 단어 임베딩 행렬의 정보를 결합하여 각 단어에 대한 특징 벡터를 만든다. 추출된 단어들에 대한 특징 벡터를 바탕으로, 주의(attention) 메커니즘을 이용한 순환 신경망을 단어 수준과 문장 수준에 각각 적용하는 계층적 신경망 구조를 통해 문서를 분류한다. 제안한 모델에 대하여 실생활 데이터를 바탕으로 한 실험으로 효용성을 검증한다.","Document classification, a task of classifying the category of each document based on text, is one of the fundamental areas for natural language processing. Document classification may be used in various fields such as topic classification and sentiment classification. Neural network models for document classification can be divided into two categories: word-level models and character-level models that treat words and characters as basic units respectively. In this study, we propose a neural network model that combines character-level and word-level models to improve performance of document classification. The proposed model extracts the feature vector of each word by combining information obtained from a word embedding matrix and information encoded by a character-level neural network. Based on feature vectors of words, the model classifies documents with a hierarchical structure wherein recurrent neural networks with attention mechanisms are used for both the word and the sentence levels. Experiments on real life datasets demonstrate effectiveness of our proposed model."
복합형 신경망을 이용한 시계열 예측 기법,2017,[],"본 연구에서는 시계열예측 신경망기법에서 특징 선별기법을 적용하여 학습의 효율을 높이고 성능을 개선하는 방법론을 고찰한다. 순환구조 신경망을 사용하여 시계열 예측기를 구현하였으며, 효과적인 특징을 선별하기 위하여 FMM 신경망을 사용하여 특징의 연관도 요소를 산출하는 방법을 제시하였다. 모바일 결제시스템에서 실제 측정된 데이터를 사용하여 사용빈도 예측실험을 수행하였으며 그 결과를 통하여 제안된 기법의 유용성을 고찰하였다.",다국어 초록 정보 없음
이미지 캡션 생성을 위한 심층 신경망 모델의 설계,2017,"['이미지 캡션 생성', '심층 신경망 모델', '모델 전이', '멀티 모달 순환 신경망', 'Image Caption Generation', 'Deep Neural Network Model', 'Model Transfer', 'Multi-Modal Recurrent Neural Network']",국문 초록 정보 없음,"In this paper, we propose an effective neural network model for image caption generation and model transfer. This model is a kind of multi-modal recurrent neural network models. It consists of five distinct layers: a convolution neural network layer for extracting visual information from images, an embedding layer for converting each word into a low dimensional feature, a recurrent neural network layer for learning caption sentence structure, and a multi-modal layer for combining visual and language information. In this model, the recurrent neural network layer is constructed by LSTM units, which are well known to be effective for learning and transferring sequence patterns. Moreover, this model has a unique structure in which the output of the convolution neural network layer is linked not only to the input of the initial state of the recurrent neural network layer but also to the input of the multimodal layer, in order to make use of visual information extracted from the image at each recurrent step for generating the corresponding textual caption. Through various comparative experiments using open data sets such as Flickr8k, Flickr30k, and MSCOCO, we demonstrated the proposed multimodal recurrent neural network model has high performance in terms of caption accuracy and model transfer effect."
심층학습을 이용한 기계번역 기술과 정확도 연구,2017,"['Deep Neural Network', 'Machine Translation', 'Google Translator', 'Recurrent Neural Network', 'Autoencoder']",국문 초록 정보 없음,"In this study, we discuss the basic technology of machine learning of the deep neural network for natural language processing(NLP). We explain the distributed vector representation of words. Distributed vector representation is proved to be able to carry semantic meanings and are useful in various NLP tasks. The recurrent neural network(RNN) is employed to get the vector representation of sentences. We discuss the RNN encoder-decoder model and some modifications of the RNN structure to improve the accuracy of the machine translations. To test and verify the accuracy of Google translator, we performed the translation among Korean, English, and Japanese, and examined the meaning change between the original and the translated sentence. In neural network translation, we showed some inaccuracies of the translation such as wrong relation between subject and object, or some omission or repetition of the original meaning. In order to increase the performance and accuracy of machine translation, it is necessary to acquire more data for training."
Recurrent Neural Networks를 활용한 Baltic Dry Index (BDI) 예측,2017,"['장단기 메모리', '순환형 신경망', '건화물운임지수', '인공신경망', '시계열 분석', 'Long Short-Term Memory', 'Recurrent Neural Networks', 'BDI (Baltic Dry Index)', 'Artificial Neural Networks', 'Time-Series Analysis']",장기 해운불황에 따라 불확실성이 증폭되고 있는 상황에서 경기추세의 이해뿐만 아니라 예측 또한 중요해지고 있는 실정이다. 본 논문에서는 최근 특정 복잡한 문제에 대해서 각광받고 있는 인공신경망을 적용하여 BDI 예측을 연구하였다. 사용된 인공신경망은 순환신경망으로 RNN과 LSTM 그리고 비교의 목적으로 MLP를 통해 2009.04.01.부터 2017.07.31.의 기간을 대상으로 연구를 진행하였다. 또한 전통적 시계열 예측방법론인 ARIMA 분석을 실시해 인공신경망들의 예측성능과 비교하였다. 결과로 순환신경망인 RNN의 성능이 가장 뛰어났으며 LSTM의 특정 시계열(BDI)에의 적용가능성을 확인할 수 있었다.,"Not only growth of importance to understanding economic trends, but also the prediction to overcome the uncertainty is coming up for long-term maritime recession. This paper discussed about the prediction of BDI with artificial neural networks (ANN). ANN is one of emerging applications that can be the finest solution to the knotty problems that may not easy to achieve by humankind. Proposed a prediction by implementing neural networks that have recurrent architecture which are a Recurrent Neural Network (RNN) and Long Short-Term Memory (LSTM). And for the reason of comparison, trained Multi Layer Perceptron (MLP) from 2009.04.01 to 2017.07.31. Also made a comparison with conventional statistics, prediction tools; ARIMA. As a result, recurrent net, especially RNN outperformed and also could discover the applicability of LSTM to specific time-series (BDI)."
딥러닝 모델을 이용한 영상 기반 항만시설물 손상 탐지 프레임워크,2022,"['딥러닝', '영상', '항만시설물', '손상', 'Deep Learning', 'Vision', 'Port Structure', 'Damage']","우리나라에는 60개의 항만에 총 1,086개의 항만시설이 존재하며, 그중 30년이 지난 노후시설은 총 284개(27.7%)나 된다. 현재 항만시설물은 육안 점검을 통해 유지관리가 수행되고 있으나, 항만시설물의 규모와 접근성의 어려움으로 인해 많은 노동력과 작업시간, 그리고 점검자의 위험 노출의 문제점을 안고 있다. 본 연구에서는 영상으로 항만시설물을 촬영하고, 촬영된 영상을 학습된 딥러닝 모델을 이용하여 검출하는 항만시설물 손상 탐지 프레임워크를 제안하였다. 실제 항만에서 촬영한 영상을 이용하여 제안한 프레임워크의 성능을 검증한 결과, 높은 정확도로 손상을 자동 탐지할 수 있음을 보였다.",다국어 초록 정보 없음
AWS 사물 인터넷 환경에서 딥러닝을 이용한 시계열 센서 데이터의 실시간 예측 서비스 아키텍처,2017,"['아마존 웹서비스', '사물인터넷', '딥러닝', 'LSTM', '순환형 신경망', 'AWS', 'IoT', 'Deep Learning', 'LSTM', 'RNN']",국문 초록 정보 없음,"With the advent of Internet of Things (IoT), the use of various devices connected to Internet has generated a large amount of data, and the importance of big data analysis has rapidly been increasing. In particular, it is necessary to analyze various IoT data generated in real-time and to provide various services through new meaningful future prediction analysis. Therefore, this paper presents the direction of Amazon Web Service (AWS) for real-time prediction service in IoT environment. Also, in this paper, we propose an architecture in AWS IoT environment for analyzing sensor data such as power, temperature, humidity, wind speed, and so on, received from IoT devices using recurrent neural networks (RNN) suitable for time series data among various algorithms, and providing users with necessary services using prediction data. The proposed architecture extracts new information from the time series IoT data and can create new business value by applying real-time IoT service to sports, cultural contents, and so on as well as real-time prediction model."
Title Generation Model for which Sequence-to-Sequence RNNs with Attention and Copying Mechanisms are used,2017,"['sequence-to-sequence 모델', '주의집중 작용', '복사 작용', '제목 생성', '순환신경망', 'sequence-to-sequence model', 'attention mechanism', 'copying mechanism', 'title generation', 'recurrent neural network']",국문 초록 정보 없음,다국어 초록 정보 없음
[A 5.4] GRU를 이용한 다중 시계열 분석: 정유공장사례에 대한 적용,2017,[],본 연구는 데이터 중심(data-driven) 다중 시계열 이상 진단 기법에 대해서 탐구하였다. GRU 순환신경망과 MLP를 이용해 물리적 시스템의 제어 조건과 목적 조건의 동적 관계를 학습하였다. 학습된 신경망을 이용해 주어진 제어 조건과 환경 조건에서 물리적 시스템의 목적 조건을 예측하였다. 본 연구에서 사용한 기법을 검증하기 위해 정유공장의 회전 설비 데이터를 사용하였고 정유 공장의 회전 설비 동적 특성을 효과적으로 모사하였다.,다국어 초록 정보 없음
GRU를 이용한 다중 시계열 분석,2017,[],본 연구는 데이터 중심(data-driven) 다중 시계열 이상 진단 기법에 대해서 탐구하였다. GRU 순환신경망과 MLP를 이용해 물리적 시스템의 제어 조건과 목적 조건의 동적 관계를 학습하였다. 학습된 신경망을 이용해 주어진 제어 조건과 환경 조건에서 물리적 시스템의 목적 조건을 예측하였다. 본 연구에서 사용한 기법을 검증하기 위해 정유공장의 회전 설비 데이터를 사용하였고 정유 공장의 회전 설비 동적 특성을 효과적으로 모사하였다.,다국어 초록 정보 없음
GRU를 이용한 다중 시계열 분석,2017,[],본 연구는 데이터 중심(data-driven) 다중 시계열 이상 진단 기법에 대해서 탐구하였다. GRU 순환신경망과 MLP를 이용해 물리적 시스템의 제어 조건과 목적 조건의 동적 관계를 학습하였다. 학습된 신경망을 이용해 주어진 제어 조건과 환경 조건에서 물리적 시스템의 목적 조건을 예측하였다. 본 연구에서 사용한 기법을 검증하기 위해 정유공장의 회전 설비 데이터를 사용하였고 정유 공장의 회전 설비 동적 특성을 효과적으로 모사하였다.,다국어 초록 정보 없음
LSTM모델 기반 전기차용 2단 감속기 유압 예측,2022,"['Hydraulic Pressure(유압)', 'Deep Learning(딥러닝)', 'Machine Learning(머신러닝)', 'Long Short Term Memory(장단기 순환신경망)', 'Vehicle Control(차량 제어)']",국문 초록 정보 없음,다국어 초록 정보 없음
자율주행을 위한 딥러닝기반 주변 차량의 위치예측 기법,2017,"['Machine Learning (기계 학습)', 'Trajectory Prediction (경로예측)', 'Autonomous Driving (자율주행)', 'Deep Learning (심층 학습)', 'Recurrent Neural Network (순환신경망)']",국문 초록 정보 없음,다국어 초록 정보 없음
환경 빅데이터 분석 및 서비스 개발,2017,"['빅데이터', '기계학습', '예측', '데이터 마이닝', '심층신경망', 'Big Data', 'Machine Learning', 'Estimation', 'Data Mining', 'Deep Learning']","본 연구는 단기예측 및 패턴 파악에 비교우위가 있는 빅데이터 연구 방법론의 환경정책연구에 대한 적용 가능성을 모색하였다. 본 연구는 환경연구 전 부문에 빅데이터 연구 방법론을 적용하는 ‘환경 빅데이터 연구’, 환경 관련 자료를 수집, 축적하는 ‘환경 빅데이터 플랫폼 구축 연구’, 연구성과를 이용하여 환경 서비스를 개발하는 ‘원내외 빅데이터 서비스 개발’의 3개 영역에 걸쳐서 3년간 3단계의 연구를 진행한다. 2017년에는 본 연구를 구성하는 3단계 연구 중 ‘환경 빅데이터 연구’에 중점을 두는 제1단계 연구를 시작하였다. 2017년에는 상대적으로 전처리 부담이 적은 수치 및 전산화된 텍스트 분석에 집중하여, 빅데이터 연구 방법론의 환경정책연구 가능성을 진단하였다. 그 결과 환경오염 추정 알고리듬 3개, 텍스트 자료 이용 환경연구 동향 파악 알고리듬 3개, 온라인 환경 관련 자료의 집적을 자동화하는 자료 수집 알고리듬 3개를 구축하였다.본 연구에서 개발한 환경오염 추정 3개 알고리듬은 ① 서울지역 측정소 단위 시간별 미세먼지 오염도를 예측하는 KNN 공간순환신경망 알고리듬, ② 기초지자체의 월별 장감염 발생 건수를 추정하는 심층신경망 알고리듬 ③ 기초지자체 월별 미세먼지 오염도 발생요인을 파악하는 의사결정나무 기반 알고리듬이다.서울지역 측정소 단위 시간별 미세먼지 농도 예측 KNN 공간순환신경망 알고리듬은 서울지역 39개 측정소의 2016년 1년간 미세먼지(PM10) 오염도 자료를 이용하여 구축하였으며, 미세먼지 농도를 2시간 전에 예측할 수 있도록 하였다. 설명변수로는 4개 대기오염물질오염도(SO<sub>2</sub>, CO, O<sub>3</sub>, NO<sub>2</sub>) 및 기상 정보(기온, 강수량, 풍속, 풍향)를 사용하였다. 분석결과 본 연구에서 개발한 KNN공간순환신경망 알고리듬은 통상적으로 시계열 예측에 사용하는 ARIMA 모델보다 예측치와 실측치 간 평균제곱근오차를 10.5% 축소하는 정확한 추정치를 제공할 수 있음을 확인하였다.기초지자체의 월별 장감염 발생 건수를 추정하는 심층신경망 알고리듬은 건강보험 코호트 DB를 이용하여 구축한 2009~2013년 월별 장감염 발생빈도를 기상자료, 대기오염 자료, 인구 통계적 자료, 위-경도 좌표를 이용하여 추정하는 심층신경망 알고리듬이다. 이 알고리듬은 노드가 500개인 3개의 은닉층을 지니며, 활성화 함수로는 ReLU 함수를 사용하였고, Epoch 30회에 걸쳐서 학습을 진행하여 도출한 모수 값을 이용하여 구축하였다. 이렇게 구축한 심층신경망 모델은 같은 변수를 사용한 선형회귀분석 모델보다 평균제곱근오차가 25% 낮은 정확한 추정치를 도출할 수 있었다.기초지자체 월별 미세먼지 농도 추정 의사결정나무 기반 알고리듬은 2001년 1월~2016년 9월 시군구 월평균 미세먼지(PM10) 농도 자료의 추정을 목적으로 구축하였다. 독립변수로는 대기오염물질 오염도, 대기오염물질 배출량, 기상변수, 황사일수, 중국 베이징, 상하이, 톈진의 대기오염 자료를 이용하였다. 자료의 가용성에 따라서 추정 시기와 독립변수의 집합을 달리하는 6개의 실험을 실시하였으며, 매 실험에 의사결정나무, 랜덤포레스트, 배깅, 부스팅 4개의 방법론을 적용하였다. 분석 결과 랜덤포레스트 및 부스팅 알고리듬은 선형회귀분석의 평균제곱오차를 각각 45.5%, 37.2% 개선하는 효과가 있었다. 그리고 독립변수에 황사일수, 베이징/상하이의 미세먼지 오염도, 베이징/톈진의 대기질 지수가 포함될 경우 추정치의 평균제곱오차가 크게 줄어든다는 사실을 확인하였다. 이는 국내 미세먼지오염도가 중국의 대기오염에 크게 영향을 받는다는 기존의 주장을 뒷받침하는 결과이다.본 연구에 개발한 텍스트 자료 분석 알고리듬은 모두 3개로 환경정보 문헌을 분석하여 문헌 토픽을 추출하는 LDA 분석 알고리듬, 문헌의 키워드 간 연관규칙을 발견하는 연관성 분석 및 키워드 네트워크 분석 알고리듬, 키워드 간 문장 내 관계를 분석하는 Word2Vec 알고리듬이다. 본 연구에서는 이상의 3개 알고리듬을 1993~2016년 KEI 연구보고서 및 2001~2016년 네이버 환경뉴스에 적용하여 두 종류의 문헌의 특성을 비교하였다.LDA 분석 결과는 다음과 같다. 2008~2012년간 KEI 연구 중 기후변화의 비중이 네이버 뉴스에서 기후변화 비중보다 상대적으로 높았으며, 폐기물, 에너지-자원, 수질오염 연구의 비중은 네이버 뉴스의 비중보다 낮았다. 그리고 2013년 이후에도 에너지-자원 및 폐기물 연구의 비중이 네이버 뉴스의 비중보다 낮은 수준으로 유지되고 있었다. 그리고 2013년 이후 네이버 뉴스에서 그 비중이 급증하고 있는 ‘유전자 변형-소음’, ‘보건-데이터’ 관련 연구가 KEI 연구동향에서는 독립된 토픽으로 나타나지 않아서, 이에 대한 연구가 필요한 것으로 파악되었다.연관성 분석 및 키워드 네트워크 분석 결과는 다음과 같다. 키워드 네트워크의 시기적 추이를 보면 KEI는 2003~2007년간 기후변화 연구를 선도하였으며, 기후변화 및 녹색성장에 대한 민간의 관심이 높았던 2008~2012년에는 해당 연구를 중심으로 연구를 수행하였다. 단, 2013년 이후에는 네이버 뉴스에서 기후변화 연관 키워드가 세부주제를 중심으로 분기하고 있는 것과 달리, KEI 연구보고서에서는 기후변화 키워드의 중심성이 강화되고 있어 최근 조류를 반영하는 연구가 필요한 것으로 파악되었다.Word2Vec 분석 결과는 다음과 같다. Word2Vec 분석에서는 기후변화의 세부현상인 온난화, 홍수, 가뭄 3개 단어와 문장 내 연관관계가 높은 단어들을 파악하여 매체 간 비교를 수행하였다. KEI 보고서는 온난화의 단기적인 영향, 온난화가 인간에 미치는 영향, 홍수의 국내 영향, 가뭄이 인간에 미치는 영향과 관계된 단어가 3개 단어와 연관성이 높은 것으로 파악되었고, 네이버 뉴스에서는 온난화의 초장기적인 영향, 온난화가 생물 및 식량에 미치는 영향, 해외 홍수의 피해, 가뭄이 농업에 미치는 영향과 관계된 단어의 연관성이 높은 것으로 파악되었다. 이러한 차이는 연구보고서가 국민의 삶에 질과 연관하여 기후변화를 연구하고 있는 데 비해, 네이버 뉴스는 기후변화로 인한 세계적인 피해를 중심으로 기사가 작성되고 있는 현상을 반영한다고 할 수 있다.이상에서 소개한 3개의 알고리듬을 2개의 텍스트 문헌에 적용한 텍스트 분석 결과로부터 환경 연구 수요 및 현재 연구 부족 분야를 파악하였다. 토픽 구성 변화를 보면, ‘에너지-자원’, ‘폐기물’, ‘유전자 변형/소음’, ‘보건/데이터’에 대한 민간의 관심이 제고되고 있는데 연구동향은 이를 담아내지 못하고 있었다. 그리고 키워드 분석의 결과를 보면 민간의 관심은 태풍, 한파, 대설 등 세분화된 기후변화 주제로 이동하고 있지만 연구동향은 기후변화 일반을 중심으로 전개되고 있었다. 따라서 환경연구의 외연을 기후변화 외부 영역으로 확장하고, 기후변화와 관계된 연구는 연구주제를 세분화하는 연구가 필요하다고 할 수 있다.환경 빅데이터 연구 인프라 구축의 일환으로 공공데이터포털(대기오염 및 기상정보), 한국환경공단 AirKorea, 기상자료개방포털 3개 웹페이지의 자료 수집 알고리듬을 개발하였다. 공공데이터포털 자료 수집 알고리듬은 공공데이터포털에서 제공하는 API 서비스를 이용하여 자료를 수집하는 알고리듬이다. 한국환경공단 AirKorea 자료 수집 알고리듬은 웹사이트에 직접 접속하여 자료를 수집하는 알고리듬이다. 이상 2개의 알고리듬은 데이터를 수집하고 추출하는 전 과정을 Python 코드로 작성하여 자동화하였다. 반면 기상자료개방포털 자료 수집 알고리듬은 셀레니움(Selenium) 프로그램을 이용하여 웹브라우저의 로그인 과정을 대행하고, 로그인 이후부터 압축파일(Zip)로 제공되는 자료를 다운로드하는 과정을 자동화한 알고리듬이다. 이 3개 알고리듬을 구축하여 자료가 직접 게시되는 경우, API를 통해 제공되는 경우, 압축파일 형태로만 제공되는 경우에 각각 대응 가능한 자료 추출 도구를 구비하였다.2017년 본 연구는 빅데이터 연구 방법론을 수치 자료에 적용하면 기존의 방법론보다 소규모 지역 단위에서 예측오차를 단축할 수 있고, 텍스트 자료에 적용하면 민간의 연구에 대한 수요(환경뉴스) 및 연구 공급 현황(연구보고서)을 비교·분석할 수 있음을 확인하였다. 본 연구가 제공하는 정교한 환경정보 예측치는 그 자체로서 민간 환경정보 서비스의 인프라로 기능할 수 있고, 단기 소규모 지역 단위 정책재원 운용의 기준으로 활용할 수 있다. 또한 의사결정나무를 이용하여 독립변수의 중요도를 파악하는 기법을 적용하면, 재정지출이 환경오염에 미치는 영향의 중요도를 평가하여 소규모 지역 단위 재정운용 성과평가 수단으로도 활용할 수 있다. 본 연구의 성과는 빅데이터 연구 방법론이 민간 환경정보사업의 인프라 구축, 정책운용의 효율성 제고, 정책평가 수단의 확충이라는 3가지 측면에서 잠재적으로 정책적 활용 가능성이 있음을 보여 주었다.본 연구의 성과는 본 연구에서 구축한 깃허브(https://github.com/keibigdata)에 공개하였으며, 향후 본 연구에서 개발하는 환경 빅데이터 분석플랫폼의 기초자료로 활용할 계획이다.","The key advantages of Machine Learning analysis using large data are 1) accurate forecast and 2) unknown-pattern finding In this report, we try to make use of these advantages in Environmental Research and Service. This research is composed of three components. First, we apply Machine learning algorithm to environmental research. (2017~19) Second, we accumulate data and algorithms developed in environmental research and combine them with environmental data web crawling algorithm to build environmental machine learning platform(2020~22). Third, we develop public environmental service using these research results and platform(2023~25).In 2017, we developed three machine learning algorithms applied to environment data - LSTM algorithm estimating hourly find dust pollution, Random Forest/Boosting ensemble algorithm estimating monthly find dust pollution, DNN algorithm estimating intestinal infection case numbers using climate data. Also we applied LDA/Association Rule Learning/word2vec algorithm to online news data and KEI report data, and found that KEI should pay more attention to generic mutation, noise, environmental health, environmental data and specific climate issues like typhoon, severe cold, heavy snow to catch up with public interests represented in online news data."
