title,date,keywords,abstract,multilingual_abstract
전자상거래 추천시스템을 위한 순환신경망 알고리즘들의 성능평가,2017,"['전자상거래', '추천시스템', '머신러닝', '순환신경망', '최적화 알고리즘', '텐서플로우', 'e-commerce', 'recommendation system', 'machine learning', 'recurrent neural network', 'optimization algorithm', 'TensorFlow']","전자상거래 발전에 따라 온라인 쇼핑을 이용하는 사람들이 증가하였고 제품 또한 다양해지고 있다. 이러한 추세로 구매자가 만족할 수 있는 정확한 추천시스템의 중요성이 증대되었으며 정확도를 높이기 위한 새로운 방법의 연구가 계속되고 있다. 순환신경망은 시퀀스 학습에 적합한 딥 러닝 방법 중 하나이며 본 연구에서는 추천시스템의 정확도를 높이는 방법으로 구매자의 제품 접근순서를 순환신경망에 적용하여 알고리즘 성능평가를 하였다. 알고리즘 성능평가에는 대표적인 순환신경망 알고리즘과 최적화 알고리즘으로 진행하였다. 순환신경망 알고리즘으로는 RNN, LSTM, GRU 그리고 최적화 알고리즘으로는 Adagrad, RMSProp, Adam optimizer를 사용하였다. 실험 도구로는 구글의 오픈소스 라이브러리인 텐서플로우를 사용하였고 데이터는 RecSys Challenge 2015에서 제공하는 e-commerce session 데이터를 활용하였다. 실험 결과 실험 데이터에 적합한 최적의 하이퍼파라미터를 발굴하고 적용하여 RecSys Challenge 2015 참가자들의 결과와 비교하였다. 상품 접근 순서만을 학습시킨 결과이기 때문에 등수가 높지는 않았지만 기존 추천시스템에 접목한다면 정확도 향상에 기여할 수 있을 것으로 보인다.","Due to the advance of e-commerce systems, the number of people using online shopping and products has significantly increased. Therefore, the need for an accurate recommendation system is becoming increasingly more important. Recurrent neural network is a deep-learning algorithm that utilizes sequential information in training. In this paper, an evaluation is performed on the application of recurrent neural networks to recommendation systems. We evaluated three recurrent algorithms (RNN, LSTM and GRU) and three optimal algorithms(Adagrad, RMSProp and Adam) which are commonly used. In the experiments, we used the TensorFlow open source library produced by Google and e-commerce session data from RecSys Challenge 2015. The results using the optimal hyper-parameters found in this study are compared with those of RecSys Challenge 2015 participants."
순환신경망을 이용한 한글 필기체 인식,2017,"['순환신경망', '한글필기체 인식', '딥러닝 응용', '한글 구성 원리를 고려한 인식', '온라인 필기체 인식', 'recurrent neural networks', 'Hangul handwriting recognition', 'deep learning application', 'online handwriting recognition']","온라인 방식의 한글 필기체 인식 문제를 분석하고 순환신경망 기반의 해법을 모색한다. 한글 낱글자 인식 문제를 순서데이터 레이블링의 관점에서 서열 분류, 구간 분류, 시간별 분류의 세 단계로 구분하여 각각에 대한 해법을 살펴보며, 한글의 구성 원리를 고려한 해결 방안을 정리한다. 한글 2350글자에 대한 온라인 필기체 데이터에 GRU(gated recurrent unit)의 다층 구조를 가지는 서열 분류모델을 적용한 결과, 낱글자 인식 정확도는 86.2%, 초･중･종성 구성에 따른 6가지 유형 분류 정확도는 98.2%로 측정되었다. 유형 분류 모델로 획의 진행에 따른 유형 변화 역시 높은 정확도로 인식하는 결과를 통해, 순환신경망을 이용하여 순서 데이터에서 한글의 구조와 같은 고차원적 지식을 학습할 수 있음을 확인하였다.","We analyze the online Hangul handwriting recognition problem (HHR) and present solutions based on recurrent neural networks. The solutions are organized according to the three kinds of sequence labeling problem - sequence classifications, segment classification, and temporal classification, with additional consideration of the structural constitution of Hangul characters. We present a stacked gated recurrent unit (GRU) based model as the natural HHR solution in the sequence classification level. The proposed model shows 86.2% accuracy for recognizing 2350 Hangul characters and 98.2% accuracy for recognizing the six types of Hangul characters. We show that the type recognizing model successfully follows the type change as strokes are sequentially written. These results show the potential for RNN models to learn high-level structural information from sequential data."
구조물 손상 예측 향상을 위한 순환신경망 방법론의 적용,2017,"['순환신경망', '머신러닝', '구조물 열화 및 노후화', 'LSTM', '의사결정']",국문 초록 정보 없음,다국어 초록 정보 없음
순환인공신경망(RNN)을 이용한 대도시 도심부 교통혼잡 예측,2017,"['순환 인공 신경망', '기계학습', '실시간 소통상황 예측', '반복정체', 'Recurrent Neural Network', 'machine learning', 'realtime traffic congestion estimation', 'recurrent congestion']",국문 초록 정보 없음,다국어 초록 정보 없음
반복 구매제품의 재구매시기 예측을 위한 다층퍼셉트론(MLP) 모형과 순환신경망(RNN) 모형의 성능비교,2017,"['Purchase Timing', 'Recommender', 'Neural Network', 'Recurrent Neural Network', 'Franchise Business', 'Repurchase Product']",국문 초록 정보 없음,"Existing studies for recommender have focused on recommending an appropriate item based on the customer preference. However, it has not yet been studied actively to recommend purchase timing for the repurchase product despite of its importance. This study aims to propose MLP and RNN models based on the only simple purchase history data to predict the timing of customer repurchase and compare performances in the perspective of prediction accuracy and quality. As an experiment result, RNN model showed outstanding performance compared to MLP model. The proposed model can be used to develop CRM system which can offer SMS or app based promotion to the customer at the right time. This model also can be used to increase sales for repurchase product business by balancing the level of order as well as inducing repurchase of customer."
순환신경망과 WAVENET의 음성 인식 성능 비교,2017,[],국문 초록 정보 없음,다국어 초록 정보 없음
순환신경망 기반 점유 격자 맵 상 확률적 경로 예측,2017,"['Machine Learning (기계 학습)', 'Trajectory Prediction (경로예측)', 'Autonomous Driving (자율주행)', 'Deep Learning (심층 학습)', 'Occupancy Grid (점유 격자)']",국문 초록 정보 없음,다국어 초록 정보 없음
순환신경망을 활용한 야구승부예측,2017,[],"최근 딥러닝(Deep-learning) 을 활용한 기상 예측, 심리 예측, 교통상황 예측 등 다양한 분야에 걸쳐 여러 모델의 인공신경망이 활용되고 있다. 본 논문에서는 여러 분야 중 스포츠라는 분야에 접근했으며, 딥러닝 모델을 통해 승부를 예측하는 실험을 진행하였다. 야구의 승부는 선수의 능력치, 기상의 변화, 홈/어웨이 여부, 교체 여부 등 가늠할 수 없이 수많은 데이터들에 의존하고 있다. 그러나 본 논문에서는 이러한 수많은 데이터 중 경기 외적인 데이터를 제외한 데이터를 활용하여 그 다음 경기의 승부를 예측할 수 있을 지를 연구한다. 날짜 별 경기들이 훈련데이터가 되고 목표는 이전 경기들의 영향으로 예측된 다음 경기의 승/패를 예측한다. 즉 순차적인 데이터의 활용에 적합한 모델, Recurrent Neural-Network 을 이용하였다. 이를 위하여 KBreport 에서 데이터를 수집하였고, 수집된 데이터를 훈련 데이터 세트로 만들어 Recurrent Neural Network 를 통해 훈련시켜 다음 경기의 승패를 예측하였다.",다국어 초록 정보 없음
순환신경망모델 기반 차량 이동 패턴 예측 알고리즘 연구,2017,[],국문 초록 정보 없음,다국어 초록 정보 없음
장단기 메모리 순환신경망 기반의 비침입적 음성 명료도 추정 방법,2017,"['Deep neural network (DNN)', 'Recurrent neural network (RNN)', 'Long short-term memory (LSTM)', 'Non-Intrusive', 'Speech intelligibility estimation', 'STOI', 'P.563']",국문 초록 정보 없음,다국어 초록 정보 없음
기상 레이더 데이터를 이용하여 강우량 예측을 위한 합성곱 순환신경망 학습 모델 개발,2017,[],국문 초록 정보 없음,다국어 초록 정보 없음
음소기반의 순환 신경망 음성 검출기를 이용한 음성 향상,2017,"['RNN', 'GMM', 'Phoneme', 'VAD', 'MMSE']",국문 초록 정보 없음,다국어 초록 정보 없음
비분할 비디오로부터 행동 탐지를 위한 순환 신경망 학습,2017,[],"본 논문에서는 비분할 비디오로부터 이 비디오에 담긴 사람의 행동을 효과적으로 탐지해내기 위한 심층 신경망 모델을 제안한다. 일반적으로 비디오에서 사람의 행동을 탐지해내는 작업은 크게 비디오에서 행동 탐지에 효과적인 특징들을 추출해내는 과정과 이 특징들을 토대로 비디오에 담긴 행동을 탐지해내는 과정을 포함한다. 본 논문에서는 특징 추출 과정과 행동 탐지 과정에 이용할 심층 신경망모델을 제시한다. 특히 비디오로부터 각 행동별 시간적, 공간적 패턴을 잘 표현할 수 있는 특징들을 추출해내기 위해서는 C3D 및 I-ResNet 합성곱 신경망 모델을 이용하고, 시계열 특징 벡터들로부터 행동을 자동 판별해내기 위해서는 양방향 BI-LSTM 순환 신경망 모델을 이용한다. 대용량의 공개 벤치마크 데이터 집합인 ActivityNet 비디오 데이터를 이용한 실험을 통해, 본 논문에서 제안하는 심층 신경망 모델의 성능과 효과를 확인할 수 있었다.",다국어 초록 정보 없음
순환 신경망 기술을 이용한 코스피 200 지수에 대한 예측 모델 개발 및 성능 분석 연구,2017,"['순환신경망', '코스피 200', '로보 어드바이저', 'Recurrent Neural Networks', 'kospi 200', 'RoboAdvisor']","Wealthfront, Betterment 등의 성공에 힘입어 전세계적으로 알고리즘을 통한 자동적인 자산분배 시스템인 로보어드바이저에 대한 관심이 증가하고 있다. 로보 어드바이저는 자산을 관리하는데 있어 사람의 개입을 최소화 하기 때문에 서비스를 이용하는데 드는 비용을 줄일 수 있으며 사람의 심리적 요인을 배제할 수 있다는 장점을 지닌다. 본 논문에서는 기존의 기술적 분석 기법을 대체하기 위하여 딥러닝 기술을 이용한 코스피 200 선물지수 예측 모델을 개발하고 그 성능을 분석하였다. 모델의 성능 분석 결과 제안하는 모델은 보합세에 놓인 종목의 방향성과 주가를 예측하는 문제에 활용 될 수 있음을 확인하였고, 향후 본 연구에서 제안하는 모델을 기존의 기술적 분석과 결합하여 로보어드바이저 서비스에 적용할 수 있음을 확인하였다.연구",다국어 초록 정보 없음
순환 신경망과 합성곱 신경망을 이용한 개체명 인식,2017,[],국문 초록 정보 없음,다국어 초록 정보 없음
다채널 오디오 특징값 및 게이트형 순환 신경망을 사용한 다성 사운드 이벤트 검출,2017,[],국문 초록 정보 없음,"In this paper, we propose an effective method of applying multichannel-audio feature values to GRNNs (Gated Recurrent Neural Networks) in polyphonic sound event detection. Real life sounds are often overlapped with each other, so that it is difficult to distinguish them by using a mono-channel audio features. In the proposed method, we tried to improve the performance of polyphonic sound event detection by using multi-channel audio features. In addition, we also tried to improve the performance of polyphonic sound event detection by applying a gated recurrent neural network which is simpler than LSTM (Long Short Term Memory), which shows the highest performance among the current recurrent neural networks. The experimental results show that the proposed method achieves better sound event detection performance than other existing methods."
환경 센서 및 V2X 통신을 이용한 순환 신경망 기반 차선 변경 예측,2017,"['Lane change(차선 변경)', 'Prediction(예측)', 'Recurrent Neural Network(순환 신경망)', 'Environmental sensors(환경 센서)', 'V2X communication(V2X 통신)']",국문 초록 정보 없음,다국어 초록 정보 없음
순환 신경망 기반 언어 모델을 활용한 초등 영어 글쓰기 자동 평가,2017,[],국문 초록 정보 없음,"We often use spellcheckers in order to correct the syntactic errors in our documents. However, these computer programs are not enough for elementary school students, because their sentences are not smooth even after correcting the syntactic errors in many cases. In this paper, we introduce an automated method for evaluating the smoothness of two synonymous sentences. This method uses a recurrent neural network to solve the problem of long-term dependencies and exploits subwords to cope with the rare word problem. We trained the recurrent neural network language model based on a monolingual corpus of about two million English sentences. In our experiments, the trained model successfully selected the more smooth sentences for all of nine types of test set. We expect that our approach will help in elementary school writing after being implemented as an application for smart devices."
합성곱 순환 신경망 모델을 활용한 주제별 트윗 분류 기법,2017,[],국문 초록 정보 없음,다국어 초록 정보 없음
히스톤 변이 마크를 이용한 인핸서 영역 분류 순환 신경망 모델,2017,[],국문 초록 정보 없음,다국어 초록 정보 없음
악성코드 API 호출 패턴 추출에 대한 순환 신경망 적용 연구,2017,[],국문 초록 정보 없음,다국어 초록 정보 없음
기술 용어에 대한 한국어 정의 문장 자동 생성을 위한 순환 신경망 모델 활용 연구,2017,"['Sentence Generation', 'Text Generation', 'Natural Language Generation(NLG)', 'Automatic Report Generation', 'Deep Learning', '문장 생성', '텍스트 생성', '자연어 생성', '보고서 자동 생성', '딥 러닝']","본 논문에서는 지속적으로 커져가는 산업․시장에 대해 관련 연구자들이 이를 효율적으로 분석할 수 있는 반자동 지원 체제 개발을 위한 기술 용어와 기술 개념에 대한 정의문 및 설명문을 자동으로 생성하는 한국어 문장 생성 모델을 제시한다. 한국어 정의 문장 생성을 위하여 딥러닝 기술 중 데이터의 전/후 관계를 포함한 시퀀스 레이블링이 가능한 LSTM을 활용한다. LSTM을 근간으로 한 두 가지 모델은 기술명을 입력할 시 그에 대한 정의문 및 설명문을 생성한다. 다양하게 수집된 대규모 학습 말뭉치를 이용해 실험한 결과, 본 논문에서 구현한 2가지 모델 중 CNN 음절 임베딩을 활용한 어절 단위 LSTM 모델이 용어에 대한 정의문 및 설명문을 생성하는데 더 나은 결과를 도출시킨다는 사실을 확인하였다. 본 논문의 연구 결과를 바탕으로 동일한 주제를 다루는 문장 집합을 생성할 수 있는 확장 모델을 개발할 수 있으며 더 나아가서는 기술에 대한 문헌을 자동으로 작성하는 인공지능 모델을 구현할 수 있으리라 사료된다.","In order to develop a semiautomatic support system that allows researchers concerned to efficiently analyze the technical trends for the ever-growing industry and market. This paper introduces a couple of Korean sentence generation models that can automatically generate definitional statements as well as descriptions of technical terms and concepts. The proposed models are based on a deep learning model called LSTM (Long Sort-Term Memory) capable of effectively labeling textual sequences by taking into account the contextual relations of each item in the sequences. Our models take technical terms as inputs and can generate a broad range of heterogeneous textual descriptions that explain the concept of the terms. In the experiments using large-scale training collections, we confirmed that more accurate and reasonable sentences can be generated by CHAR-CNN-LSTM model that is a word-based LSTM exploiting character embeddings based on convolutional neural networks (CNN). The results of this study can be a force for developing an extension model that can generate a set of sentences covering the same subjects, and furthermore, we can implement an artificial intelligence model that automatically creates technical literature."
순환적 합성곱 신경망을 이용한 CCTV 영상 기반 날씨정보 생산 방법,2017,[],국문 초록 정보 없음,다국어 초록 정보 없음
배연탈황석고 모르타르의 강도특성에 관한 인공신경망 모델 비교평가,2017,"['인공신경망 모델', '배연탈황석고 강도']","우리나라의 경우 1990년대부터 환경오염문제의 사회화가 배경이 되어 환경에 대한 관심이 높아짐에 따라 1998년부터 배기가스의 탈황공정이 가동되어 화학석고가 발생하기 시작하였는데 이것이 화력발전소에서 부산물로 나오는 배연탈황석고이다. 국내의 석탄화력 발전소에 설치된 탈황설비는 흡착재로 석회석 분말을 사용하고 부산물로 석고를 생성하는 습식공정으로서, 배연탈황석고는 이수석고(CaSO4⋅2H2O)로 생성되는데, 인산석고와 비교할 때 pH가 중성이며 높은 순도의 균일한 품질을 가지고 있어 발생 전량이 시멘트 및 석고보드 원료로서 재활용되고 있다. 한편 최근 그 수요가 증가하는 고강도콘크리트 혼화재, 슬래그 시멘트에 사용하기 위하여 년간 30만톤 이상 수입되고 있는 천연무수석고는 우리나라에 광물로 부존하지 않는다. 선진국과 마찬가지로 배연탈황 석고가 전량 수입되고 있는 천연석고를 대체할 수 있다는 장점에 대하여 충분히 인식함에도 불구하고, 아직까지 전반적인 기술 기반의 취약성 및 인력 부족으로 석고보드 제조 등 초보적인 수준에 머물러 있으나 최근 콘크리트 혼화재료 제조기업은 중국의 값싼 제품으로 인해 가격 경쟁력을 상실하고 있어 미래 경쟁력 있는 분야로의 전환을 위해 배연탈황 석고를 이용한 고부가성 건설재료 제조 기술에 관심을 가지기 시작하고 있다. 이에 본 연구에서는 지속가능 친환경-고성능 건설용 복합재료의 생산 및 이의 활용 기술을 적극적으로 개발하고자 인공신경망 모델을 활용한 배연탈황석고 모르타르의 배합조건과 물리적 결과값의 데이터를 다양한 알고리즘에 적용하여 이의 분석과 예측의 정확성을 판별하여 기초데이터로 제공하고자 한다.",다국어 초록 정보 없음
배연탈황석고 모르타르의 강도특성에 관한 인공신경망 모델 비교평가,2017,"['인공신경망 모델', '배연탈황석고 강도']","우리나라의 경우 1990년대부터 환경오염문제의 사회화가 배경이 되어 환경에 대한 관심이 높아짐에 따라 1998년부터 배기가스의 탈황공정이 가동되어 화학석고가 발생하기 시작하였는데 이것이 화력발전소에서 부산물로 나오는 배연탈황석고이다. 국내의 석탄화력 발전소에 설치된 탈황설비는 흡착재로 석회석 분말을 사용하고 부산물로 석고를 생성하는 습식공정으로서, 배연탈황석고는 이수석고(CaSO<sub>4</sub>·2H<sub>2</sub>O)로 생성되는데, 인산석고와 비교할 때 pH가 중성이며 높은 순도의 균일한 품질을 가지고 있어 발생 전량이 시멘트 및 석고보드 원료로서 재활용되고 있다. 한편 최근 그 수요가 증가하는 고강도콘크리트 혼화재, 슬래그 시멘트에 사용하기 위하여 년간 30만톤 이상 수입되고 있는 천연무수석고는 우리나라에 광물로 부존하지 않는다. 선진국과 마찬가지로 배연탈황 석고가 전량 수입되고 있는 천연석고를 대체할 수 있다는 장점에 대하여 충분히 인식함에도 불구하고, 아직까지 전반적인 기술 기반의 취약성 및 인력 부족으로 석고보드 제조 등 초보적인 수준에 머물러 있으나 최근 콘크리트 혼화재료 제조기업은 중국의 값싼 제품으로 인해 가격 경쟁력을 상실하고 있어 미래 경쟁력 있는 분야로의 전환을 위해 배연탈황 석고를 이용한 고부가성 건설재료 제조 기술에 관심을 가지기 시작하고 있다.이에 본 연구에서는 지속가능 친환경-고성능 건설용 복합재료의 생산 및 이의 활용 기술을 적극적으로 개발하고자 인공신경망 모델을 활용한 배연탈황석고 모르타르의 배합조건과 물리적 결과값의 데이터를 다양한 알고리즘에 적용하여 이의 분석과 예측의 정확성을 판별하여 기초데이터로 제공하고자 한다.",다국어 초록 정보 없음
뜰개 이동 예측을 위한 신경망 및 통계 기반 기계학습 기법의 성능 비교,2017,"['유류 유출', '뜰개', '기계학습', '순환신경망', '예측', 'Oil Spill', 'Drifter', 'Machine learning', 'Recurrent neural network', 'LSTM', 'Prediction']","뜰개는 해양에서 해수의 특성 및 흐름을 관측하기 위한 장비로서, 해수의 흐름 관측을 이용해 유출유 확산 예측을 위해 사용될 수 있다. 본 논문에서는 관측기관에서 사용하는 뜰개가 특정 시간 간격으로 관측한 바람 및 해수의 특성과 이동경로를 기계학습 기법들을 이용하여 학습시키고 예측하는 모델을 제안한다. 서포트벡터 회귀, 방사기저함수 네트워크, 가우시안 프로세스, 다층 퍼셉트론, 순환신경망을 이용하여 뜰개의 이동경로 예측 방법을 제시한다. 기존 MOHID 수치모델과 비교하여 각 기법별로 4 개의 사례중 3 개에서 성능이 개선되었으며, 가장 좋은 개선율을 보인 기법은 LSTM으로 평균 47.59% 개선되었다. 추후 연구에서는 배깅과 부스팅을 이용하여 가중치를 부여하여 정확도를 개선할 예정이다.","Drifter is an equipment for observing the characteristics of seawater in the ocean, and it can be used to predict effluent oil diffusion and to observe ocean currents. In this paper, we design models or the prediction of drifter trajectory using machine learning. We propose methods for estimating the trajectory of drifter using support vector regression, radial basis function network, Gaussian process, multilayer perceptron, and recurrent neural network. When the propose mothods were compared with the existing MOHID numerical model, performance was improve on three of the four cases. In particular, LSTM, the best performed method, showed the imporvement by 47.59% Future work will improve the accuracy by weighting using bagging and boosting."
