title,date,keywords,abstract,multilingual_abstract
RNN(Recurrent Neural Network)을 이용한 기업부도예측모형에서 회계정보의 동적 변화 연구,2017,"['순환 신경망', '부도 예측', '시계열 모형', 'Recurrent Neural Network', 'Bankruptcy Prediction', 'Time-Series model']",국문 초록 정보 없음,"Corporate bankruptcy can cause great losses not only to stakeholders but also to many related sectors in society. Through the economic crises, bankruptcy have increased and bankruptcy prediction models have become more and more important. Therefore, corporate bankruptcy has been regarded as one of the major topics of research in business management. Also, many studies in the industry are in progress and important.  Previous studies attempted to utilize various methodologies to improve the bankruptcy prediction accuracy and to resolve the overfitting problem, such as Multivariate Discriminant Analysis (MDA), Generalized Linear Model (GLM). These methods are based on statistics. Recently, researchers have used machine learning methodologies such as Support Vector Machine (SVM), Artificial Neural Network (ANN). Furthermore, fuzzy theory and genetic algorithms were used. Because of this change, many of bankruptcy models are developed. Also, performance has been improved.  In general, the company’s financial and accounting information will change over time. Likewise, the market situation also changes, so there are many difficulties in predicting bankruptcy only with information at a certain point in time. However, even though traditional research has problems that don’t take into account the time effect, dynamic model has not been studied much. When we ignore the time effect, we get the biased results. So the static model may not be suitable for predicting bankruptcy. Thus, using the dynamic model, there is a possibility that bankruptcy prediction model is improved.  In this paper, we propose RNN (Recurrent Neural Network) which is one of the deep learning methodologies. The RNN learns time series data and the performance is known to be good. Prior to experiment, we selected non-financial firms listed on the KOSPI, KOSDAQ and KONEX markets from 2010 to 2016 for the estimation of the bankruptcy prediction model and the comparison of forecasting performance. In order to prevent a mistake of predicting bankruptcy by using the financial information already reflected in the deterioration of the financial condition of the company, the financial information was collected with a lag of two years, and the default period was defined from January to December of the year. Then we defined the bankruptcy. The bankruptcy we defined is the abolition of the listing due to sluggish earnings. We confirmed abolition of the list at KIND that is corporate stock information website. Then we selected variables at previous papers. The first set of variables are Z-score variables. These variables have become traditional variables in predicting bankruptcy. The second set of variables are dynamic variable set. Finally we selected 240 normal companies and 226 bankrupt companies at the first variable set. Likewise, we selected 229 normal companies and 226 bankrupt companies at the second variable set.  We created a model that reflects dynamic changes in time-series financial data and by comparing the suggested model with the analysis of existing bankruptcy predictive models, we found that the suggested model could help to improve the accuracy of bankruptcy predictions. We used financial data in KIS Value (Financial database) and selected Multivariate Discriminant Analysis (MDA), Generalized Linear Model called logistic regression (GLM), Support Vector Machine (SVM), Artificial Neural Network (ANN) model as benchmark.   The result of the experiment proved that RNN’s performance was better than comparative model. The accuracy of RNN was high in both sets of variables and the Area Under the Curve (AUC) value was also high. Also when we saw the hit-ratio table, the ratio of RNNs that predicted a poor company to be bankrupt was higher than that of other comparative models. However the limitation of this paper is that an overfitting problem occurs during RNN learning. But we expect to be able to solve the overfitting problem by selecting more lear"
한국어 음소 단위 LSTM 언어모델을 이용한 문장 생성,2017,"['언어 모델', '순환 신경망 모형', 'LSTM 모형', '문장 생성 모형', 'Language model', 'Recurrent neural network', 'Long short-term memory model', 'Sentence generation model']",국문 초록 정보 없음,"Language models were originally developed for speech recognition and language processing. Using a set of example sentences, a language model predicts the next word or character based on sequential input data. N-gram models have been widely used but this model cannot model the correlation between the input units efficiently since it is a probabilistic model which are based on the frequency of each unit in the training set. Recently, as the deep learning algorithm has been developed, a recurrent neural network (RNN) model and a long short-term memory (LSTM) model have been widely used for the neural language model (Ahn, 2016; Kim et al., 2016; Lee et al., 2016). These models can reflect dependency between the objects that are entered sequentially into the model (Gers and Schmidhuber, 2001; Mikolov et al., 2010; Sundermeyer et al., 2012). In order to learning the neural language model, texts need to be decomposed into words or morphemes. Since, however, a training set of sentences includes a huge number of words or morphemes in general, the size of dictionary is very large and so it increases model complexity. In addition, word-level or morpheme-level models are able to generate vocabularies only which are contained in the training set. Furthermore, with highly morphological languages such as Turkish, Hungarian, Russian, Finnish or Korean, morpheme analyzers have more chance to cause errors in decomposition process (Lankinen et al., 2016).  Therefore, this paper proposes a phoneme-level language model for Korean language based on LSTM models. A phoneme such as a vowel or a consonant is the smallest unit that comprises Korean texts. We construct the language model using three or four LSTM layers. Each model was trained using Stochastic Gradient Algorithm and more advanced optimization algorithms such as Adagrad, RMSprop, Adadelta, Adam, Adamax, and Nadam. Simulation study was done with Old Testament texts using a deep learning package Keras based the Theano. After pre-processing the texts, the dataset included 74 of unique characters including vowels, consonants, and punctuation marks. Then we constructed an input vector with 20 consecutive characters and an output with a following 21st character. Finally, total 1,023,411 sets of input-output vectors were included in the dataset and we divided them into training, validation, testsets with proportion 70:15:15. All the simulation were conducted on a system equipped with an Intel Xeon CPU (16 cores) and a NVIDIA GeForce GTX 1080 GPU.  We compared the loss function evaluated for the validation set, the perplexity evaluated for the test set, and the time to be taken for training each model. As a result, all the optimization algorithms but the stochastic gradient algorithm showed similar validation loss and perplexity, which are clearly superior to those of the stochastic gradient algorithm. The stochastic gradient algorithm took the longest time to be trained for both 3- and 4-LSTM models. On average, the 4-LSTM layer model took 69% longer training time than the 3-LSTM layer model. However, the validation loss and perplexity were not improved significantly or became even worse for specific conditions. On the other hand, when comparing the automatically generated sentences, the 4-LSTM layer model tended to generate the sentences which are closer to the natural language than the 3-LSTM model. Although there were slight differences in the completeness of the generated sentences between the models, the sentence generation performance was quite satisfactory in any simulation conditions: they generated only legitimate Korean letters and the use of postposition and the conjugation of verbs were almost perfect in the sense of grammar. The results of this study are expected to be widely used for the processing of Korean language in the field of language processing and speech recognition, which are the basis of artificial intelligence systems."
교류협력국 교원 초청 교육정보화 연수의 성과 분석,2017,"['초등 글쓰기 자동 평가', '순환 신경망', '언어 모델', 'e-Learning Globalization Project', 'Training of ICT in Education for Teachers from Partner Country']","각 시·도교육청은 “이러닝 세계화 사업”의 일환으로 교류협력국의 교원을 초청하여 교육정보화 연수를 진행하 고 있다. 이 초청 연수의 목적은 이러닝 국가경쟁력 유지와 영향력 강화에 따른 국가 브랜드 제고, 우리의 선진 교육정보화 사례를 공유하여 국가 간 지식정보 격차 해소, 교육정보화 분야 교류협력을 통한 동반자적 관계 구 축, 교류협력국 선도 교원들이 자국의 교육정보화를 발전 및 확산할 수 있는 역량 강화 등이다. 2005년에 시작된 교류협력국의 교원 초청 교육정보화 연수가 10주년이 되는 시점을 맞이하여, 그간 진행된 연수 프로그램의 성과 를 반추하고 지속적인 발전 방안을 모색할 필요가 있다. 이를 위해 상황, 투입, 과정, 산출에 따른 현황을 분석하 기 위해 질적 연구를 수행하였다. 각 시·도교육청의 초청 연수 담당 장학사, 주무관, 그리고 해외 교원 등을 대 상으로 심층면담을 실시하였고, 그 면담 결과를 주제별로 구분하여 분석하였다.","Each City & Provincial office of education has provided educational informatization training, which invites its partner country’s teachers as part of ‘e-Learning Globalization Project.’ The purposes of this training program are, a) improving nation brand power by maintaining e-learning national competitiveness and strengthening influence, b) solving digital divide by sharing Korean best practices, c) establishing partnership through exchanges and  cooperation, d) capacity building which support partner country’s leading teachers can play key roles to spread educational informatization in their own country. It is necessary to reflect outcomes of training program until now and to find sustainable development plan, at 10th anniversary of Education ICT training program now. In order to fulfil purposes, qualitative research was conducted to analyze current status based on context, input, process, and product phases, and to find sustainable development alternative. In-depth interview(IDI) was conducted among  supervisor, officials, and teachers from partner countries. Also, the result of IDI was analyzed by themes."
Document Summarization Considering Entailment Relation between Sentences,2017,"['문서 요약', '수반 관계 추론', '자연어 처리', '텍스트 랭크', '순환 신경망', 'document summarization', 'entailment relation inference', 'natural language processing', 'TextRank', 'recurrent neural network']",국문 초록 정보 없음,다국어 초록 정보 없음
가상 산소 센서를 통한 EGR 제어 전략,2017,"['Diesel Engine(디젤엔진)', 'Numerical Analysis(수치해석)', 'Virtual Sensor(가상센서)', 'EGR(배기재순환)', 'Neural Network(인공신경망)']",국문 초록 정보 없음,다국어 초록 정보 없음
