title,date,keywords,abstract,multilingual_abstract
딥러닝 시계열 알고리즘 적용한 기업부도예측모형 유용성 검증,2018,"['Optimal Feature Selection', 'Lasso Regression', 'Deep Learning Time Series Algorithm', 'Corporate Bankruptcy', 'RNN', 'LSTM', '최적 변수 선별', 'Lasso 회귀분석', '딥러닝 시계열 알고리즘', '기업부도', 'RNN', 'LSTM']","본 연구는 경제적으로 국내에 큰 영향을 주었던 글로벌 금융위기를 기반으로 총 10년의 연간 기업데이터를이용한다. 먼저 시대 변화 흐름에 일관성있는 부도 모형을 구축하는 것을 목표로 금융위기 이전(2000~2006년) 의 데이터를 학습한다. 이후 매개 변수 튜닝을 통해 금융위기 기간이 포함(2007~2008년)된 유효성 검증 데이터가 학습데이터의 결과와 비슷한 양상을 보이고, 우수한 예측력을 가지도록 조정한다. 이후 학습 및 유효성 검증데이터를 통합(2000~2008년)하여 유효성 검증 때와 같은 매개변수를 적용하여 모형을 재구축하고, 결과적으로최종 학습된 모형을 기반으로 시험 데이터(2009년) 결과를 바탕으로 딥러닝 시계열 알고리즘 기반의 기업부도예측 모형이 유용함을 검증한다.부도에 대한 정의는 Lee(2015) 연구와 동일하게 기업의 상장폐지 사유들 중 실적이 부진했던 경우를 부도로선정한다. 독립변수의 경우, 기존 선행연구에서 이용되었던 재무비율 변수를 비롯한 기타 재무정보를 포함한다.이후 최적의 변수군을 선별하는 방식으로 다변량 판별분석, 로짓 모형, 그리고 Lasso 회귀분석 모형을 이용한다. 기업부도예측 모형 방법론으로는 Altman(1968)이 제시했던 다중판별분석 모형, Ohlson(1980)이 제시한 로짓모형, 그리고 비시계열 기계학습 기반 부도예측모형과 딥러닝 시계열 알고리즘을 이용한다.기업 데이터의 경우, ‘비선형적인 변수들’, 변수들의 ‘다중 공선성 문제’, 그리고 ‘데이터 수 부족’이란 한계점이 존재한다. 이에 로짓 모형은 ‘비선형성’을, Lasso 회귀분석 모형은 ‘다중 공선성 문제’를 해결하고, 가변적인데이터 생성 방식을 이용하는 딥러닝 시계열 알고리즘을 접목함으로서 데이터 수가 부족한 점을 보완하여 연구를 진행한다.현 정부를 비롯한 해외 정부에서는 4차 산업혁명을 통해 국가 및 사회의 시스템, 일상생활 전반을 아우르기위해 힘쓰고 있다. 즉, 현재는 다양한 산업에 이르러 빅데이터를 이용한 딥러닝 연구가 활발히 진행되고 있지만, 금융 산업을 위한 연구분야는 아직도 미비하다. 따라서 이 연구는 기업 부도에 관하여 딥러닝 시계열 알고리즘 분석을 진행한 초기 논문으로서, 금융 데이터와 딥러닝 시계열 알고리즘을 접목한 연구를 시작하는 비 전공자에게 비교분석 자료로 쓰이기를 바란다.","In addition to stakeholders including managers, employees, creditors, and investors of bankrupt companies, corporate defaults have a ripple effect on the local and national economy. Before the Asian financial crisis, the Korean government only analyzed SMEs and tried to improve the forecasting power of a default prediction model, rather than developing various corporate default models. As a result, even large corporations called 'chaebol enterprises' become bankrupt. Even after that, the analysis of past corporate defaults has been focused on specific variables, and when the government restructured immediately after the global financial crisis, they only focused on certain main variables such as 'debt ratio'.A multifaceted study of corporate default prediction models is essential to ensure diverse interests, to avoid situations like the 'Lehman Brothers Case' of the global financial crisis, to avoid total collapse in a single moment.The key variables used in corporate defaults vary over time. This is confirmed by Beaver (1967, 1968) and Altman’s (1968) analysis that Deakins'(1972) study shows that the major factors affecting corporate failure have changed. In Grice's (2001) study, the importance of predictive variables was also found through Zmijewski’s (1984) and Ohlson’s (1980) models. However, the studies that have been carried out in the past use static models. Most of them do not consider the changes that occur in the course of time. Therefore, in order to construct consistent prediction models, it is necessary to compensate the time-dependent bias by means of a time series analysis algorithm reflecting dynamic change.Based on the global financial crisis, which has had a significant impact on Korea, this study is conducted using 10 years of annual corporate data from 2000 to 2009. Data are divided into training data, validation data, and test data respectively, and are divided into 7, 2, and 1 years respectively. In order to construct a consistent bankruptcy model in the flow of time change, we first train a time series deep learning algorithm model using the data before the financial crisis (2000~2006). The parameter tuning of the existing model and the deep learning time series algorithm is conducted with validation data including the financial crisis period (2007~2008). As a result, we construct a model that shows similar pattern to the results of the learning data and shows excellent prediction power. After that, each bankruptcy prediction model is restructured by integrating the learning data and validation data again (2000 ~ 2008), applying the optimal parameters as in the previous validation. Finally, each corporate default prediction model is evaluated and compared using test data (2009) based on the trained models over nine years. Then, the usefulness of the corporate default prediction model based on the deep learning time series algorithm is proved. In addition, by adding the Lasso regression analysis to the existing methods (multiple discriminant analysis, logit model) which select the variables, it is proved that the deep learning time series algorithm model based on the three bundles of variables is useful for robust corporate default prediction.The definition of bankruptcy used is the same as that of Lee (2015). Independent variables include financial information such as financial ratios used in previous studies. Multivariate discriminant analysis, logit model, and Lasso regression model are used to select the optimal variable group. The influence of the Multivariate discriminant analysis model proposed by Altman (1968), the Logit model proposed by Ohlson (1980), the non-time series machine learning algorithms, and the deep learning time series algorithms are compared.In the case of corporate data, there are limitations of 'nonlinear variables', 'multi-collinearity' of variables, and 'lack of data'. While the logit model is nonlinear, the Lasso regression model solves the multi-collinear..."
Comparison of physics-based and data-driven models for streamflow simulation of the Mekong river,2018,"['Deep learning algorithm', 'LSTM', 'Mekong river', 'Physics-based model', 'SWAT', '딥러닝 알고리즘', 'LSTM', '물리적 기반 모형', '메콩강']","최근 기후변화 및 유역개발로 인하여 메콩강 유역의 수문환경이 급격히 변화하고 있으며, 메콩강을 공유하는 국가의 수재해 예방 및 지속가능한 수자원개발을 위해서는 메콩강 주요지점에서의 유량 정보의 분석 및 예측이 요구된다. 본 연구에서는 물리적 기반의 수문모형인 SWAT과 데이터기반 딥러닝 알고리즘인 LSTM을 이용하여 메콩강 하류 Kratie 지점의 유출모의를 수행하고, 유출모의 정확도 및 두 가지 방법론의 장 ․ 단점을 비교 ․ 분석한다. SWAT 모형의 구축을 위해 범용 입력자료(지형: HydroSHED, 토지이용: GLCF-MODIS, 토양: FAO-Soil map, 강우: APHRODITE 등)을 이용하였으며 warming-up 및 매개변수 보정 후 2003~2007년 일유량 모의를 수행하였다. LSTM을 이용한 유출모의의 경우, 딥러닝 오픈소스 라이브러리인 TensorFlow를 활용하여 Kratie 지점기준 메콩강 상류 10개 수위관측소의 두 기간(2000~2002, 2008~2014) 일수위 정보만을 이용하여 심층신경망을 학습하고, SWAT 모형과 마찬가지로 2003~2007년을 대상으로 Kratie 지점에 대한 일수위 모의 후 수위-유량관계곡선식을 이용하여 유출량으로 환산하였다. 두 모형의 모의성능 비교 ․ 검토를 위하여 모의기간에 대해 NSE (Nash-Sutcliffe Efficiency)을 산정한 결과, SWAT은 0.9, LSTM은 보다 높은 0.99의 정확도를 나타내는 것으로 분석되었다. 메콩강과 같은 대유역의 특정 지점에 대한 수문시계열 자료의 모의를 위해서는 다양한 입력자료를 요구하는 물리적 수문모형 대신 선행시계열자료의 변동성을 기억 ․ 학습하여 이를 예측에 반영하는 LSTM 기법 등 데이터기반의 심층신경망 모형의 적용이 가능할 것으로 판단된다.","In recent, the hydrological regime of the Mekong river is changing drastically due to climate change and haphazard watershed development including dam construction. Information of hydrologic feature like streamflow of the Mekong river are required for water disaster prevention and sustainable water resources development in the river sharing countries. In this study, runoff simulations at the Kratie station of the lower Mekong river are performed using SWAT (Soil and Water Assessment Tool), a physics-based hydrologic model, and LSTM (Long Short-Term Memory), a data-driven deep learning algorithm. The SWAT model was set up based on globally-available database (topography: HydroSHED, landuse: GLCF-MODIS, soil: FAO-Soil map, rainfall: APHRODITE, etc) and then simulated daily discharge from 2003 to 2007. The LSTM was built using deep learning open-source library TensorFlow and the deep-layer neural networks of the LSTM were trained based merely on daily water level data of 10 upper stations of the Kratie during two periods: 2000~2002 and 2008~2014. Then, LSTM simulated daily discharge for 2003~2007 as in SWAT model. The simulation results show that Nash-Sutcliffe Efficiency (NSE) of each model were calculated at 0.9(SWAT) and 0.99(LSTM), respectively. In order to simply simulate hydrological time series of ungauged large watersheds, data-driven model like the LSTM method is more applicable than the physics-based hydrological model having complexity due to various database pressure because it is able to memorize the preceding time series sequences and reflect them to prediction."
지식베이스 확장을 위한멀티소스 비정형 문서에서의 정보 추출 시스템의 개발,2018,"['정보추출', '질의응답 시스템', '기계독해', 'Bi-directional LSTM-CRF', '지식베이스', 'Information Extraction', 'Question Answering System', 'Machine Reading Comprehension', 'Bi-directional LSTM-CRF', 'Knowledge Base']","지식베이스를 구축하는 작업은 도메인 전문가가 온톨로지 스키마를 이해한 뒤, 직접 지식을 정제하는 수작업이 요구되는 만큼 비용이 많이 드는 활동이다. 이에, 도메인 전문가 없이 다양한 웹 환경으로부터 질의에 대한 답변 정보를 추출하기 위한 자동화된 시스템의 연구개발의 필요성이 제기되고 있다. 기존의 정보 추출 관련연구들은 웹에 존재하는 다양한 형태의 문서 중 학습데이터와 상이한 형태의 문서에서는 정보를 효과적으로 추출하기 어렵다는 한계점이 존재한다. 또한, 기계 독해와 관련된 연구들은 문서에 정답이 있는 경우를 가정하고질의에 대한 답변정보를 추출하는 경우로서, 문서의 정답포함 여부를 보장할 수 없는 실제 웹의 비정형 문서로부터의 정보추출에서는 낮은 성능을 보인다는 한계점이 존재한다. 본 연구에서는 지식베이스 확장을 위하여 웹에 존재하는 멀티소스 비정형 문서로부터 질의에 대한 정보를 추출하기 위한 시스템의 개발 방법론을 제안하고자 한다. 본 연구에서 제안한 방법론은 “주어(Subject)-서술어(Predicate)”로 구분된 질의에 대하여 위키피디아, 네이버 백과사전, 네이버 뉴스 3개 웹 소스로부터 수집된 비정형 문서로부터 관련 정보를 추출하며, 제안된 방법론을 적용한 시스템의 성능평가를 위하여, Wu and Weld(2007)의 모델을 베이스라인 모델로 선정하여 성능을비교분석 하였다. 연구결과 제안된 모델이 베이스라인 모델에 비해, 위키피디아, 네이버 백과사전, 네이버 뉴스등 다양한 형태의 문서에서 정보를 효과적으로 추출하는 강건한 모델임을 입증하였다. 본 연구의 결과는 현업지식베이스 관리자에게 지식베이스 확장을 위한 웹에서 질의에 대한 답변정보를 추출하기 위한 시스템 개발의지침서로서 실무적인 시사점을 제공함과 동시에, 추후 다양한 형태의 질의응답 시스템 및 정보추출 연구로의확장에 기여할 수 있을 것으로 기대한다.","In this paper, we propose a methodology to extract answer information about queries from various types of unstructured documents collected from multi-sources existing on web in order to expand knowledge base. The proposed methodology is divided into the following steps. 1) Collect relevant documents from Wikipedia, Naver encyclopedia, and Naver news sources for “subject-predicate“ separated queries and classify the proper documents. 2) Determine whether the sentence is suitable for extracting information and derive the confidence. 3) Based on the predicate feature, extract the information in the proper sentence and derive the overall confidence of the information extraction result.In order to evaluate the performance of the information extraction system, we selected 400 queries from the artificial intelligence speaker of SK-Telecom. Compared with the baseline model, it is confirmed that it shows higher performance index than the existing model.The contribution of this study is that we develop a sequence tagging model based on bi-directional LSTM-CRF using the predicate feature of the query, with this we developed a robust model that can maintain high recall performance even in various types of unstructured documents collected from multiple sources. The problem of information extraction for knowledge base extension should take into account heterogeneous characteristics of source-specific document types. The proposed methodology proved to extract information effectively from various types of unstructured documents compared to the baseline model. There is a limitation in previous research that the performance is poor when extracting information about the document type that is different from the training data.In addition, this study can prevent unnecessary information extraction attempts from the documents that do not include the answer information through the process for predicting the suitability of information extraction of documents and sentences before the information extraction step. It is meaningful that we provided a method that precision performance can be maintained even in actual web environment. The information extraction problem for the knowledge base expansion has the characteristic that it can not guarantee whether the document includes the correct answer because it is aimed at the unstructured document existing in the real web. When the question answering is performed on a real web, previous machine reading comprehension studies has a limitation that it shows a low level of precision because it frequently attempts to extract an answer even in a document in which there is no correct answer. The policy that predicts the suitability of document and sentence information extraction is meaningful in that it contributes to maintaining the performance of information extraction even in real web environment.The limitations of this study and future research directions are as follows. First, it is a problem related to data preprocessing. In this study, the unit of knowledge extraction is classified through the morphological analysis based on the open source Konlpy python package, and the information extraction result can be improperly performed because morphological analysis is not performed properly. To enhance the performance of information extraction results, it is necessary to develop an advanced morpheme analyzer.Second, it is a problem of entity ambiguity. The information extraction system of this study can not distinguish the same name that has different intention. If several people with the same name appear in the news, the system may not extract information about the intended query. In future research, it is necessary to take measures to identify the person with the same name.Third, it is a problem of evaluation query data. In this study, we selected 400 of user queries collected from SK Telecom 's interactive artificial intelligent speaker to evaluate the performance of the information extraction ..."
An accident diagnosis algorithm using long short-term memory,2018,"['Accident Diagnosis', 'Long Short-term Memory', 'Recurrent Neural Network', 'Softmax']",,"Accident diagnosis is one of the complex tasks for nuclear power plant (NPP) operators. In abnormal oremergency situations, the diagnostic activity of the NPP states is burdensome though necessary.Numerous computer-based methods and operator support systems have been suggested to address thisproblem. Among them, the recurrent neural network (RNN) has performed well at analyzing time seriesdata. This study proposes an algorithm for accident diagnosis using long short-term memory (LSTM),which is a kind of RNN, which improves the limitation for time reflection. The algorithm consists ofpreprocessing, the LSTM network, and postprocessing. In the LSTM-based algorithm, preprocessed inputvariables are calculated to output the accident diagnosis results. The outputs are also postprocessedusing softmax to determine the ranking of accident diagnosis results with probabilities. This algorithmwas trained using a compact nuclear simulator for several accidents: a loss of coolant accident, a steamgenerator tube rupture, and a main steam line break. The trained algorithm was also tested to demonstratethe feasibility of diagnosing NPP accidents."
머신 러닝 방법과 시계열 분석 모형을 이용한 부동산 가격지수 예측,2018,"['머신 러닝', '부동산가격지수', '예측', '시계열분석', 'Machine Learning', 'Real Estate Price Index', 'Predicting', 'Time Series Analysis']","본 연구의 목적은 부동산 가격지수 예측을 위한 머신 러닝 방법의 활용가능성을 확인하는 것이다. 이를 위해 머신 러닝 방법인 서포트 벡터 머신, 랜덤 포레스트, 그래디언트 부스팅 회귀 트리, 심층신경망, LSTM과 시계열분석 방법인 자기회귀이동평균모형, 벡터자기회귀모형, 베이지언 벡터자기회귀모형을 이용하여 아파트 매매실거래가격지수를 예측하고 모형간 예측력을 비교하였다. 연구 결과, 첫째, 머신 러닝 방법의 예측력이 시계열분석 모형보다 우수한 것으로 나타났다. 둘째, 시장이 안정적인 상황에서는 머신 러닝 방법과 시계열분석 방법 모두 시장 추세를 적절히 예측하는 것으로 나타났다. 셋째, 구조적인 변화 또는 외부 충격으로 시장이 급변하는 경우 머신 러닝 방법은 시장 추세를 대체로 유사하게 예측하는 것으로 나타났으나, 시계열분석 방법은 시장 추세를 전혀 예측할 수 없는 것으로 나타났다. 향후 머신 러닝 방법을 활용함으로써 부동산 시장에 대한 예측의 정확성이 향상 될 것으로 기대된다.","This study aims to explore the feasibility of using machine learning methods to forecast the real estate price index. To do so, machine learning methods, such as support vector machine, random forest, gradient boosting regression tree, deep neural networks, and long short term memory networks (LSTM), and the time series analysis methods such as the autoregressive integrated moving average model (ARIMA), the vector autoregression model (VAR), and the Bayesian vector autoregressive model (Bayesian VAR), were used to predict the real estate price index for apartments. The following were the main findings of the comparison of their predictive abilities. First, the predictive power of machine learning methods is superior to that of the time series analysis methods. Second, in a stable market situation, both machine learning and time series analysis methods can predict market trends moderately well. Third, when the market undergoes a dramatic change due to structural changes or external shocks, the machine learning method can accurately predict market trends for the most part, whereas the time series analysis method fails to do so. Thus, the accuracy of real estate market forecasts can be expected to improve with the use of machinelearning methods."
ViStoryNet: 비디오 스토리 재현을 위한 연속 이벤트 임베딩 및 BiLSTM 기반 신경망,2018,"['비디오 스토리 학습', '비디오 스토리 재현', '연속 이벤트 임베딩', '유아용 비디오 데이터집합', 'video story learning', 'video story regeneration', 'successive event order embedding', 'kids video dataset']","본 고에서는 비디오로부터 coherent story를 학습하여 비디오 스토리를 재현할 수 있는 스토리 학습/재현 프레임워크를 제안한다. 이를 위해 연속 이벤트 순서를 감독학습 정보로 사용함으로써 각 에피소드들이 은닉 공간 상에서 궤적 형태를 가지도록 유도하여, 순서정보와 의미정보를 함께 다룰 수 있는 복합된 표현 공간을 구축하고자 한다. 이를 위해 유아용 비디오 시리즈를 학습데이터로 활용하였다. 이는 이야기 구성의 특성, 내러티브 순서, 복잡도 면에서 여러 장점이 있다. 여기에 연속 이벤트 임베딩을 반영한 인코더-디코더 구조를 구축하고, 은닉 공간 상의 시퀀스의 모델링에 양방향 LSTM을 학습시키되 여러 스텝의 서열 데이터 생성을 고려하였다. ‘뽀롱뽀롱 뽀로로’ 시리즈 비디오로부터 추출된 약 200 개의 에피소드를 이용하여 실험결과를 보였다. 실험을 통해 에피소드들이 은닉공간에서 궤적 형태를 갖는 것과 일부 큐가 주어졌을 때 스토리를 재현하는 문제에 적용할 수 있음을 보였다.","A video is a vivid medium similar to human’s visual-linguistic experiences, since it can inculcate a sequence of situations, actions or dialogues that can be told as a story. In this study, we propose story learning/regeneration frameworks from videos with successive event order supervision for contextual coherence. The supervision induces each episode to have a form of trajectory in the latent space, which constructs a composite representation of ordering and semantics. In this study, we incorporated the use of kids videos as a training data. Some of the advantages associated with the kids videos include omnibus style, simple/explicit storyline in short, chronological narrative order, and relatively limited number of characters and spatial environments. We build the encoder-decoder structure with successive event order embedding, and train bi-directional LSTMs as sequence models considering multi-step sequence prediction. Using a series of approximately 200 episodes of kids videos named ‘Pororo the Little Penguin’, we give empirical results for story regeneration tasks and SEOE. In addition, each episode shows a trajectory-like shape on the latent space of the model, which gives the geometric information for the sequence models."
