title,date,keywords,abstract,multilingual_abstract
IoT 스트리밍 센서 데이터에 기반한 실시간 PM10 농도 예측 LSTM 모델,2018,"['Long Short Term Memory', 'PM10', 'Prediction model', 'Recurrent Neural Network', 'Sequence data']","최근 사물인터넷(IoT)의 등장으로 인터넷에 연결된 다양한 기기들에 의해 대규모의 데이터가 생성됨에 따라 빅데이터 분석의 중요성이 증가하고 있다. 특히 실시간으로 생성되는 대규모의 IoT 스트리밍 센서 데이터를 분석하여 새로운 의미있는미래 예측을 통해 다양한 서비스를 제공하는 것이 필요하게되었다. 본 논문은 AWS를 활용하여 IoT 센서로부터 생성되는 스트리밍 데이터에 기반하여 실시간 실내 PM10 농도 예측 LSTM 모델을 제안한다. 또한 제안 모델에 따른 실시간 실내 PM10 농도 예측 서비스를 구축한다. 논문에 사용된 데이터는 PM10 IoT 센서로부터 24시간 동안 수집된 스트리밍 데이터이다. 이를 LSTM의 입력 데이터로 사용하기 위해 PM10 시계열 데이터로부터 30개의 연속된 값으로 이루어진 시퀀스 데이터로 변환한다. LSTM 모델은 바로 인접한 공간으로 이동해 가는 슬라이딩 윈도우 프로세스를 통하여 학습한다. 또한 모델의 성능 개선을 위해 24시간마다 수집한 스트리밍 데이터에 대해 점진적 학습 방법을 적용한다. 제안한 LSTM 모델의 성능을 평가하기 위해 선형회귀 모델 및 순환형 신경망(RNN) 모델과 비교한다. 실험 결과는 제안한 LSTM 예측 모델이 선형 회귀보다 700%, RNN 모델보다는 140% 성능 개선이 있음을 보여주었다.","Recently, the importance of big data analysis is increasing as a large amount of data is generated by various devices connected to the Internet with the advent of Internet of Things (IoT). Especially, it is necessary to analyze various large-scale IoT streaming sensor data generated in real time and provide various services through new meaningful prediction. This paper proposes a real-time indoor PM10 concentration prediction LSTM model based on streaming data generated from IoT sensor using AWS. We also construct a real-time indoor PM10 concentration prediction service based on the proposed model. Data used in the paper is streaming data collected from the PM10 IoT sensor for 24 hours. This time series data is converted into sequence data consisting of 30 consecutive values from time series data for use as input data of LSTM. The LSTM model is learned through a sliding window process of moving to the immediately adjacent dataset. In order to improve the performance of the model, incremental learning method is applied to the streaming data collected every 24 hours. The linear regression and recurrent neural networks (RNN) models are compared to evaluate the performance of LSTM model. Experimental results show that the proposed LSTM prediction model has 700% improvement over linear regression and 140% improvement over RNN model for its performance level."
온톨로지 지식 기반 특성치를 활용한 Bidirectional LSTM-CRF 모델의 시퀀스 태깅 성능 향상에 관한 연구,2018,"['시퀀스 태깅', 'CRF(Conditional Random Field)', 'LSTM(Long Short Term Memory)', '질의응답 시스템', '온톨로지', 'Sequence Tagging', 'QA System', 'Ontology']",,"This paper proposes a methodology applying sequence tagging methodology to improve the performance of NER(Named Entity Recognition) used in QA system. In order to retrieve the correct answers stored in the database, it is necessary to switch the user’s query into a language of the database such as SQL(Structured Query Language). Then, the computer can recognize the language of the user. This is the process of identifying the class or data name contained in the database. The method of retrieving the words contained in the query in the existing database and recognizing the object based on the index does not identify the homophone and the word phrases because it does not consider the context of the user’s query. If there are multiple search results, all of them are returned as a result, so there can be many interpretations on the query and the time complexity for the calculation becomes large. In addition, in the existing QA system, chunking has a higher probability of selecting the longest phrase among the sentence component phrases retrieved after obtaining a subset of all cases that can come from the user query. This chunking process has a problem that the algorithm is complicated, but it is not always correct according to the query. To overcome these, this study aims to solve this problem by reflecting the contextual meaning of the query using neural network-based methodology and to identify the problem of the neural network based methodology. Context-sensitive tagging combined with CRF and Bidirectional LSTM can be used to supplement the LSTM-based model, which can limit long-term memory problems, but can be biased toward recent input because of the data nature of word embedding. Therefore, we have solved the disadvantages of the neural network model by introducing the latest technology Bidirectional LSTM-CRF model in Sequence Tagging field. We used reasoning that reflects context by using ontology-based characteristic values for untrained words. In case that untrained words come in, we store the object name recognition tag information obtained from the ontology knowledge base in the Lucene index DB as the ontology knowledge based feature. and In this paper, we propose a neural network model based on ontology knowledge based feature.  Experiments were conducted on the ontology knowledge base of music domain and the performance was evaluated. In order to accurately evaluate the performance of the L-Bidirectional LSTM-CRF proposed in this study, we experimented with converting the words included in the learned query into untrained words in order to test whether the words were included in the database but correctly identified the untrained words. Through experimentation, it was confirmed that tag recognition based on the context of the homophone and chunking is possible. In addition, we could apply the features that match the data type by using the CRF property which can use user defined function as a variable. As a result, it was possible to recognize objects considering the context and can recognize the untrained words without re-training the L-Bidirectional LSTM-CRF model, and it is confirmed that the performance of the object recognition as a whole is improved. Therefore, the proposed L-Bidirectional LSTM-CRF methodology can be applied to the ontology knowledge base of various fields to solve the object name recognition problem. However, the proposed L-Bidirectional LSTM-CRF method performed better than the conventional LSTM-CRF method, but lacked the ability to process homophones compared to the conventional Bidirectional LSTM-CRF. This is due to the fact that the hypothesis of this study inserts a feature that can infer a pattern of unknown words based on the entity name pattern of trained queries. This is because the weight increases linearly with the inclusion in the training data. In future research, it is necessary to experiment with various methods of applying weights so that homophones can be found well while ma"
LSTM-based Anomaly Detection on Big Data for Smart Factory Monitoring,2018,"['Long Short-Term Memory (LSTM)', '이상탐지', 'SCADA', 'Anomaly Detection']",,"This article presents machine learning based approach on Big data to analyzing time series data for anomaly detection in such industrial complex system. Long Short-Term Memory (LSTM) network have been demonstrated to be improved version of RNN and have become a useful aid for many tasks. This LSTM based model learn the higher level temporal features as well as temporal pattern, then such predictor is used to prediction stage to estimate future data. The prediction error is the difference between predicted output made by predictor and actual in-coming values. An error-distribution estimation model is built using a Gaussian distribution to calculate the anomaly in the score of the observation. In this manner, we move from the concept of a single anomaly to the idea of the collective anomaly. This work can assist the monitoring and management of Smart Factory in minimizing failure and improving manufacturing quality."
양방향 LSTM을 활용한 전력수요 데이터 예측 기법 연구,2018,"['전력 수요 예측', '딥 러닝', '순환 신경망', '양방향 장단기 기억 네트워크', 'Electronic Demand Prediction', 'Deep Learning', 'Recurrent Neural Network', 'Bidirectional Long Short Term Memory Networks']",,"Power demand prediction is used to detect anomalies such as machine malfunction and power off when the measured power amount deviates from the predicted power amount by a certain range in the industrial sector. Power data is difficult to predict because it is time series data with strong seasonality and trend.In this paper, a power prediction model based on bi-directional LSTM algorithm, which is a deep learning based algorithm and the most popular algorithm in recent years, has been established along with LSTM. The model was learned, evaluated, and verified using four years of power data."
Research on Joint Models for Korean Word Spacing and POS (Part-Of-Speech) Tagging based on Bidirectional LSTM-CRF,2018,"['한국어 품사 태깅', '한국어 자동 띄어쓰기', '자연어처리', '심층학습', 'korean POS(part-of-speech) tagging', 'korean automatic spacing', 'NLP(natural language processing)', 'deep-learning']",,
Prediction of water level in a tidal river using a deep-learning based LSTM model,2018,"['Tidal river', 'Deep learning', 'lead time', 'Jamsu bridge', 'LSTM model', '감조하천', '딥러닝', '선행시간', '잠수교', 'LSTM 모형']","본 연구는 물리적 수리·수문모형의 적용이 제한적인 감조하천에서의 수위예측을 목적으로 하고 있으며, 이를 위해 한강 잠수교를 대상으로 딥러닝 오픈소스 소프트웨어 라이브러리인 TensorFlow를 활용하여 LSTM 모형을 구성하고 2011년부터 2017년까지의 10분 단위의 잠수교 수위, 팔당 댐 방류량과 한강하구 강화대교지점의 예측조위 자료를 이용하여 모형학습(2011~2016) 및 수위예측(2017)을 수행하였다. 모형 매개변수는 민감도 분석을 통해 은닉층의 개수는 6개, 학습속도는 0.01, 학습횟수는 3000번로 결정하였으며, 모형 학습 시 학습정보의 시간적 양을 결정하는 중요한 매개변수인 시퀀스길이는 1시간, 3시간, 6시간으로 변화시키며 모의하였다. 최종적으로 선행시간에 따른 모의 예측능력을 평가하기 위해 LSTM 모형의 예측 선행시간을 6개(1 ~ 24시간)로 구분하여 실측수위와 예측수위와의 비교·분석을 수행한 결과, LSTM 모형의 최적의 성능을 내 는 결과는 시퀀스길이를 1시간으로 하였을 때로 분석되었으며, 특히 선행시간 1시간에 대한 예측정확도는 RMSE는 0.065 m, NSE는 0.99로 실 측수위에 매우 근접한 예측 결과를 나타내었다. 또한 시퀀스길이에 상관없이 선행시간이 길어질수록 모형의 예측 정확도는 2017년 전기간에 걸쳐 평균적으로 RMSE 0.08 m에서 0.28 m로 오차가 증가하였으며, NSE는 0.99에서 0.74로 감소하였다.","Discharge or water level predictions at tidally affected river reaches are currently still a great challenge in hydrological practices. This research aims to predict water level of the tide dominated site, Jamsu bridge in the Han River downstream. Physics-based hydrodynamic approaches are sometimes not applicable for water level prediction in such a tidal river due to uncertainty sources like rainfall forecasting data. In this study, TensorFlow deep learning framework was used to build a deep neural network based LSTM model and its applications. The LSTM model was trained based on 3 data sets having 10-min temporal resolution: Paldang dam release, Jamsu bridge water level, predicted tidal level for 6 years (2011~2016) and then predict the water level time series given the six lead times: 1, 3, 6, 9, 12, 24 hours. The optimal hyper-parameters of LSTM model were set up as follows: 6 hidden layers number, 0.01 learning rate, 3000 iterations. In addition, we changed the key parameter of LSTM model, sequence length, ranging from 1 to 6 hours to test its affect to prediction results. The LSTM model with the 1 hr sequence length led to the best performing prediction results for the all cases. In particular, it resulted in very accurate prediction: RMSE (0.065 cm) and NSE (0.99) for the 1 hr lead time prediction case. However, as the lead time became longer, the RMSE increased from 0.08 m (1 hr lead time) to 0.28 m (24 hrs lead time) and the NSE decreased from 0.99 (1 hr lead time) to 0.74 (24 hrs lead time), respectively."
CNN-LSTM Coupled Model for Prediction of Waterworks Operation Data,2018,"['Big Data', 'CNN', 'Correlation Analysis', 'Deep-Learning', 'LSTM']",,"In this paper, we propose an improved model to provide users with a better long-term prediction ofwaterworks operation data. The existing prediction models have been studied in various types of models suchas multiple linear regression model while considering time, days and seasonal characteristics. But the existingmodel shows the rate of prediction for demand fluctuation and long-term prediction is insufficient.Particularly in the deep running model, the long-short-term memory (LSTM) model has been applied topredict data of water purification plant because its time series prediction is highly reliable. However, it isnecessary to reflect the correlation among various related factors, and a supplementary model is needed toimprove the long-term predictability. In this paper, convolutional neural network (CNN) model is introducedto select various input variables that have a necessary correlation and to improve long term prediction rate,thus increasing the prediction rate through the LSTM predictive value and the combined structure. Inaddition, a multiple linear regression model is applied to compile the predicted data of CNN and LSTM,which then confirms the data as the final predicted outcome."
CNN-LSTM Coupled Model for Prediction of Waterworks Operation Data,2018,"['Big Data', 'CNN', 'Correlation Analysis', 'Deep-Learning', 'LSTM']",,"In this paper, we propose an improved model to provide users with a better long-term prediction of waterworks operation data. The existing prediction models have been studied in various types of models such as multiple linear regression model while considering time, days and seasonal characteristics. But the existing model shows the rate of prediction for demand fluctuation and long-term prediction is insufficient. Particularly in the deep running model, the long-short-term memory (LSTM) model has been applied to predict data of water purification plant because its time series prediction is highly reliable. However, it is necessary to reflect the correlation among various related factors, and a supplementary model is needed to improve the long-term predictability. In this paper, convolutional neural network (CNN) model is introduced to select various input variables that have a necessary correlation and to improve long term prediction rate, thus increasing the prediction rate through the LSTM predictive value and the combined structure. In addition, a multiple linear regression model is applied to compile the predicted data of CNN and LSTM, which then confirms the data as the final predicted outcome."
Sentence Comprehension with an LSTM Language Model,2018,"['장단기 기억 신경망', '언어 모델', '써프라이절', '엔트로피 감소', 'Entropy reduction', 'Long Short-Term Memory network', 'Language model', 'Surprisal']",,"We are to build a Long Short-Term Memory (LSTM) network-based language model which can estimate the amount of information that words in sentences convey. We are then to investigate whether reading-times on words in a sentence are predicted by information-theoretic measures such as surprisal and entropy reduction. Specifically, the proposed LSTM deep-learning model is first to be trained on the large dataset of learner English sentences and is then to be applied to estimate the two different information-theoretic measures on each word of the test data of English sentences. The reading times on the words in the test data are to be collected from the Korean English L2 learners reading the test sentences. A comparison between the information-theoretic measures and reading-times by using a linear mixed effect model reveals a reliable relationship between surprisal/entropy reduction and reading time. We conclude that both surprisal and entropy reduction are positively related to the processing effort (i.e. reading time), confirming the surprisal/entropy-reduction hypothesis."
A study on oil-film detection technique using IR-UWB radar-based Bi-LSTM,2018,"['IR-UWB Radar', 'Oil film', 'Bi-LSTM', 'SVD', 'Spectral entropy', 'Power spectrogram']",,
LSTM 네트워크를 활용한 농산물 가격 예측 모델,2018,"['자연재해', '농산물', '가격', '예측', '딥러닝', 'LSTM', 'RMSE', '날씨', 'Natural Disaster', 'Agricultural Product', 'Price', 'Prediction', 'Deep Learning', 'Weather']","태풍, 홍수는 우리에게 빈번하게 닥치는 자연 재해이며, 이와 같은 자연 재해로부터 오는 피해는 사전에 예측되어 대응책이 마련될 필요가 있다. 자연 재해로부터 야기되는 피해에는 건물의 붕괴, 인명 피해, 논/밭의 유실 등 주로 직접적인 피해가 많지만, 소비자 물가 상승과 같은 간접적인 영향에도 관심을 가져야한다. 태풍, 홍수의 피해로부터 영향을 받는 대표적인 소비재 상품은 농산물이다. 갑작스럽고 강력한 태풍은 많은 비를 동반하면서 농작물에 피해를 주고, 농산물의 가격을 상승시킨다. 본 연구에서는 딥러닝 알고리즘을 활용하여 태풍과 같은 자연 재해가 농산물 가격에 미치는 영향을 예측한다. 우리는 데이터 확보가 가능한 쌀, 양파, 대파, 애호박, 시금치 등을 가격 예측 대상으로 했고, 농산물 가격에 영향을 미치는 변수 데이터들로 학습 모델을 만들고, 그 학습 모델이 농산물 가격을 예측하는 연구를 진행하였다. 연구 결과, 모델에 의한 예측 가격과 실제 가격의 차이를 나타내는 RMSE가 0.069 수준이며, 농산물 가격을 비교적 잘 설명하는 것으로 해석된다. 정확한 농산물 가격 예측은 정부의 농산물 공급 규모 조절 등 자연 재해 대응을 위한 정부의 노력에 활용될 수 있을 것이다.","Typhoons and floods are natural disasters that occur frequently, and the damage resulting from these disasters must be in advance predicted to establish appropriate responses. Direct damages such as building collapse, human casualties, and loss of farms and fields have more attention from people than indirect damages such as increase of consumer prices. But indirect damages also need to be considered for living. The agricultural products are typical consumer items affected by typhoons and floods. Sudden, powerful typhoons are mostly accompanied by heavy rains and damage agricultural products; this increases the retail price of such products. This study analyzes the influence of natural disasters on the price of agricultural products by using a deep learning algorithm. We decided rice, onion, green onion, spinach, and zucchini as target agricultural products, and used data on variables that influence the price of agricultural products to create a model that predicts the price of agricultural products. The result shows that the model’s accuracy was about 0.069 measured by RMSE, which means that it could explain the changes in agricultural product prices. The accurate prediction on the price of agricultural products can be utilized by the government to respond natural disasters by controling amount of supplying agricultural products."
Malware Detection Model with Skip-Connected LSTM RNN,2018,"['악성코드 탐지', '딥러닝', 'Skip-Connected LSTM RNN', 'malware detection', 'deep-learning']",,
LSTM 기반의 차선 정보와 조향 각을 활용한 LKAS 요각속도 예측 모델,2018,"['Lane keeping assistance system(차선 유지 시스템)', 'Yaw rate prediction(요각속도 예측)', 'Long short-term memory(장 단기 순환신경망)', 'Steering control(조향 제어)']",,
Detection and Correction Method of Erroneous Data Using Quantile Pattern and LSTM,2018,"['Data cleansing', 'Data quality', 'IoT', 'Water supply information']",,
Detection and Correction Method of Erroneous Data Using Quantile Pattern and LSTM,2018,"['Data cleansing', 'Data quality', 'IoT', 'Water supply information']",,"The data of K-Water waterworks is collected from various sensors and used as basic data for the operation and analysis of various devices. In this way, the importance of the sensor data is very high, but it contains misleading data due to the characteristics of the sensor in the external environment. However, the cleansing method for the missing data is concentrated on the prediction of the missing data, so the research on the detection and prediction method of the missing data is poor. This is a study to detect wrong data by converting collected data into quintiles and patterning them. It is confirmed that the accuracy of detecting false data intentionally generated from real data is higher than that of the conventional method in all cases. Future research we will prove the proposed system's efficiency and accuracy in various environments."
