title,date,keywords,abstract,multilingual_abstract
Self-Attention 기반의 변분 오토인코더를 활용한 신약 디자인,2022,"['De Novo Drug Design', 'SMILES', 'Deep Learning', 'Self-attention', 'Variational Autoencoder', '신약 디자인', '심층학습', '셀프 어텐션', '변분 오토인코더']",,"De novo drug design is the process of developing new drugs that can interact with biological targets such as protein receptors. Traditional process of de novo drug design consists of drug candidate discovery and drug development, but it requires a long time of more than 10 years to develop a new drug. Deep learning-based methods are being studied to shorten this period and efficiently find chemical compounds for new drug candidates. Many existing deep learning-based drug design models utilize recurrent neural networks to generate a chemical entity represented by SMILES strings, but due to the disadvantages of the recurrent networks, such as slow training speed and poor understanding of complex molecular formula rules, there is room for improvement. To overcome these shortcomings, we propose a deep learning model for SMILES string generation using variational autoencoders with self-attention mechanism. Our proposed model decreased the training time by 1/26 compared to the latest drug design model, as well as generated valid SMILES more effectively."
오토인코더 기반 수치형 학습데이터의 자동 증강 기법,2022,"['Autoencoder', 'CTGAN', 'Data Augmentation', 'Deep learning', 'Table Data', 'Training Data', 'VAE']",,"This study aims to solve the problem of class imbalance in numerical data by using a deep learning-based Variational AutoEncoder and to improve the performance of the learning model by augmenting the learning data. We propose 'D-VAE' to artificially increase the number of records for a given table data. The main features of the proposed technique go through discretization and feature selection in the preprocessing process to optimize the data. In the discretization process, K-means are applied and grouped, and then converted into one-hot vectors by one-hot encoding technique. Subsequently, for memory efficiency, sample data are generated with Variational AutoEncoder using only features that help predict with RFECV among feature selection techniques. To verify the performance of the proposed model, we demonstrate its validity by conducting experiments by data augmentation ratio."
영상 식별 및 항법 정확도 향상을 위한 적대적 오토인코더 기반 전처리 알고리즘,2022,"['.', 'AAE', 'preprocessing', 'image identification', 'navigation accuracy', 'loss function', 'EMD']",,.
그래프 합성곱 오토인코더 기반 고령자 이상 행동 인식,2022,"['Abnormal action detection', 'Human pose estimation', 'Human action recognition', 'Graph convolutional network', 'Autoencoder']",,"The increase in the elderly population living alone is considered the most serious problem. The elderly people living alone are difficult to cope with emergencies situations properly, leading to lonely deaths. Although various monitoring systems for emergency situations at home have been developed, some limitations still exist in identifying abnormal behaviors of the elderly people because of frequent equipment malfunctions. To address this situation, we use ETRI-Activity3D recorded in locations that mimic actual living spaces focused on the daily activities of the elderly people. In this study, we propose a methodology to detect abnormal actions of elderly people using a graph convolutional autoencoder. By capturing the spatial temporal feature of each action through graph convolution operation, the proposed method outperforms other existing methods in detecting abnormal actions. We hope that our work can help elderly people in real emergency situations."
신장암의 임상 예측을 위한 딥 오토인코더 기반 분류,2022,"['Kidney cancer', 'Deep learning', 'Generative models', 'Autoencoder']",,"Predicting clinical information using gene expression is challenging given the complexity and high dimensionality of gene data. This study propose a deep learning framework for cancer diagnosis through feature extraction and classifier based on various pre-trained autoencoder technologies for kidney cancer. It can be fine-tuned for any tasks and predict clinical information by neural network classifiers. Our model achieved micro and macro F1-scores of 96.2% and 95.8% for gender, 95.8% and 76.3% for race, and 99.8% and 99.6% for sample type predictions, respectively, which is much higher than the values of traditional dimensionality reduction and machine learning techniques. In the results, the conditional variational mutation autoencoder (CVAE) improved the macro F1 score, a difficult race prediction task, by 7.6%. Our results are useful for the prognosis as well as prevention and early diagnosis of kidney cancer."
PSC 박스 거더교 내부의 덕트 공동 탐지를 위한 LSTM Auto-Encoder의 활용,2022,"['PSC 박스 거더교', 'Impact-Echo 신호', 'LSTM 오토 인코더', '잠재 벡터', '이상 탐지', 'PSC box girder bridge', 'impact-echo signal', 'LSTM auto-encoder', 'latent vector', 'anomaly detection']","PSC 박스 거더교는 내부 구조물 중 덕트 내부에 강연선을 삽입 후 콘크리트를 타설하지만, 작은 내부 직경으로 인해 약간의 실수로도 공동이 발생할 수 있다. 그래서 비파괴 검사인 Impact-Echo (IE) 신호에 대해 전문가의 해석이 요구되지만, 덕트 내부의 공동을 정확히 식별하기는 어렵다. 또한, IE 신호는 측정하는 환경에 따라 신호의 패턴이 달라진다. 따라서 본 연구에서는 PSC 박스 거더교 내부 덕트의 공동 여부를 탐지하기 위해 IE 신호와 비지도 학습인 오토 인코더(Auto-Encoder)를 도입한다. 오토인코더의 구조는 시계열 데이터에 장점을 보이는 장단기 메모리(Long Short-Term Memory)를 활용한다. 우리는 정상 IE 신호를 LSTM 오토 인코더로 학습한 후 평가 데이터에 대한 인코더의 출력(잠재 벡터)을 비교하여 평가한다. 실험 결과, 공동 신호와 정상 신호의 잠재 벡터는 최대 0.0634의 유사도 차이를 보였다. 이를 통해 실제 PSC 박스 거더교 내부 덕트의 공동을 탐지하는 데에 도움을 될 것이다.","In the PSC box girder bridge, concrete is poured after inserting a tendon inside the duct, but void may occur due to the small internal diameter. Therefore, many experts interpreted the Impact-Echo (IE) signal, which is a non-destructive test, but it is difficult to accurately identify the void inside the duct. In addition, the IE signal has a different pattern depending on the measurement environment. In this study, the IE signal and Auto-Encoder are introduced to detect the void inside the duct of the PSC box girder bridge. The structure of the auto-encoder utilizes Long Short-Term Memory, which is advantageous for time series. We trained the normal IE signal by the LSTM auto-encoder and compared the encoder""s output (latent vector) for evaluation. As a result, the latent vectors of the void signal and the normal signal have a similarity difference up to 0.0634. This will help to detect voids in the duct inside the actual PSC box girder bridge."
Detecting Design Infringement Using Multi-Modal Visual Data and Auto Encoder based on Convolutional Neural Network,2022,"['합성곱 신경망', '오토인코더', '다중 양식의 시각 데이터', '유사도 측정', 'convolutional neural network', 'auto encoder', 'multi-modal visual data', 'similarity measurement']",,
기계 학습을 활용한 보안 이상징후 식별 알고리즘 개발,2022,"['보안 위협', '이상 탐지', 'LSTM-오토인코더', 'Deep-오토인코더', 'CERT 데이터세트', 'Security Threat', 'Anomaly Detection', 'LSTM-autoencoder', 'Deep-autoencoder', 'CERT Dataset']","인터넷, 모바일 등 네트워크 기술이 발전함에 따라 내외부 침입 및 위협으로부터 조직의 자원을 보호하기 위한 보안의 중요성이 커지고 있다. 따라서 최근에는 다양한 보안 로그 이벤트에 대하여 보안 위협 여부를 사전에 파악하고, 예방하는 이상징후 식별 알고리즘의 개발이 강조되고 있다. 과거 규칙 기반 또는 통계 학습에 기반하여 개발되어 온 보안 이상징후 식별 알고리즘은 점차 기계 학습과 딥러닝에 기반한 모델링으로 진화하고 있다. 본 연구에서는 다양한 기계학습 분석 방법론을 활용하여 악의적 내부자 위협을 사전에 식별하는 최적 알고리즘으로 LSTM-autoencoder를 변형한 Deep-autoencoder 모형을 제안한다. 본 연구는 비지도 학습에 기반한 이상탐지 알고리즘 개발을 통해 적응형 보안의 가능성을 향상시키고, 지도 학습에 기반한 정탐 레이블링을 통해 기존 알고리즘 대비 오탐율을 감소시켰다는 점에서 학문적 의의를 갖는다.","With the development of network technologies, the security to protect organizational resources from internal and external intrusions and threats becomes more important. Therefore in recent years, the anomaly detection algorithm that detects and prevents security threats with respect to various security log events has been actively studied. Security anomaly detection algorithms that have been developed based on rule-based or statistical learning in the past are gradually evolving into modeling based on machine learning and deep learning. In this study, we propose a deep-autoencoder model that transforms LSTM-autoencoder as an optimal algorithm to detect insider threats in advance using various machine learning analysis methodologies. This study has academic significance in that it improved the possibilityof adaptive security through the development of an anomaly detection algorithm based on unsupervised learning, and reduced the false positive rate compared to the existing algorithm through supervised true positive labeling."
준지도 학습 기반 원심펌프 캐비테이션 감지,2022,"['Anomaly Detection(이상 감지)', 'Short Time Fourier Transform(단시간 푸리에 변환)', 'Variational Autoencoder(변이형 오토인코더)', 'Mahalanobis Distance(마할라노비스 거리)']","캐비테이션은 원심펌프의 마모 및 열화를 가속하는 주요 고장 모드 중 하나이다. 캐비테이션은 펌프의 오작동을 초래할 수 있고, 이는 시스템 전체 가동을 멈추게 할 수 있다. 따라서 캐비테이션 현상을 미리 감지하고 회피하는 것은 중요하다. 본 논문은 원심펌프에서 캐비테이션을 감지하는 준지도 학습방법을 제안한다. 1차원 진동 신호를 단시간 푸리에 변환을 통해 2차원 이미지로 변환한다. 변이형 오토인코더와 마할라노비스 거리를 사용하여 캐비테이션 심각도를 결정한다. 본 논문에서 제안한 방법을 0.75 kW 원심펌프 테스트베드에서 수집한 데이터로 평가한다. 제안한 방법은 캐비테이션의 심각도를 감지하고 캐비테이션 현상을 피할 수 있도록 도움을 줄 것으로 기대된다.","Cavitation is a dominant failure mode that accelerates the wear and deterioration of pumps. Cavitation can lead to pump malfunction and, eventually, catastrophic failure of the whole system. Therefore, it is important to avoid cavitation in the pump. This paper proposes a semi-supervised learning method that detects cavitation in centrifugal pumps. One-dimensional (1D) vibration signals are converted into two-dimensional (2D) images by the short time Fourier transform. The severity of the cavitation is determined using the variational autoencoder and Mahalanobis distance. The effectiveness of the proposed method is evaluated using the data collected from a 0.75 kW hydraulic pump testbed. It is confirmed that the proposed method can detect cavitation with different severities and help avoid the cavitation phenomenon."
딥러닝 기법을 이용한 대동맥 동맥경화성 플라크 판별에 관한 연구,2022,"['Aorta(대동맥)', 'Plaque Classification(플라크 분류)', 'Plaque Area Prediction(플라크 영역 예측)', 'Autoencoder(오토인코더)', 'U-Net(유넷)']","고령층의 사망원인 중 높은 비율을 차지하고 있는 뇌졸중, 심장질환은 갑작스럽게 발생하여 사망에 이를 수 있으므로 조기 진단하여 지속적인 관리가 필요하다. 고위험성 질병을 진단하기 위해서는 의료 영상을 이용한 의료진 판독을 통해서 수행되어야 하지만 판독 시간이 많이 소요되거나 의료진에 따라 판독 의견이 달라지는 경우가 발생하고 있다. 본 연구에서는 뇌졸중의 주요 원인인 대동맥 동맥경화성 플라크 상태를 분류하고 영역을 예측할 수 있는 컨볼루션 오토인코더(convolution autoencoder)와 유넷(U-Net) 모델을 수립하여 판독 시간을 단축시키고 정확도를 높이고자 한다.","Stroke and heart disease, which account for a high percentage of the causes of death amongst the elderly population, can occur suddenly leading to death. Hence, early diagnoses and continuous management are required. High-risk diseases should be diagnosed through medical personnel using established medical techniques. However, it is time consuming to decide on a diagnosis or the opinion may differ depending on the medical professional. This study aims to shorten the diagnosis period and provide high accuracy diagnoses by establishing the semi-supervised convolution autoencoder and the U-Net models that can classify aortic atherosclerotic plaque conditions and predict the primary locations for stroke occurrence."
회귀 매니폴드 3-D PCA 기반 새로운 이미지 분석 방법,2022,"['Regression Manifold', '3-D PCA', 'Autoencoder', 'Image Enhancement']","본 논문에서는 회귀 매니폴드 3-D PCA 기반 새로운 이미지 분석 방법을 제안한다. 제안된 방법은 대용량 이미지 데이터 입력 시 효율적인 차원 축소를 위해 개선된 매니폴드 3-D PCA와 PCA의 비선형 확장이 가능한 오토인코더를기반으로 설계된 구조로 회귀분석 알고리즘으로 구성된 새로운 이미지 분석 방법이다. 오토인코더의 구성으로는 이미지픽셀 값을 3차원 회전을 통한 최전의 초평면을 도출하는 회귀 매니폴드 3-D PCA와 딥러닝 구조와 유사한 Bayesian Rule 구조를 적용한다. 성능 검증을 위해 실험을 수행한다. 미세먼지 이미지를 활용하여 이미지를 향상되며, 이를 분류모델을 통한 정확도 성능 평가를 수행한다. 그 결과 딥러닝 성능에 유효함을 확인할 수 있다.",
BGP 데이터의 기계학습 분석을 통한 적대세력 사이버 활동탐지,2022,"['Cyber warfare', 'Cyber Space', 'Anomaly Detection', 'Data mining', 'Cyber warfare', 'Anomaly Detection', 'Data mining']","전 세계적으로 사이버 공격은 계속 증가해 왔으며, 그 영향으로 국가 기관에막대한 피해가 발생하고 있다. 이에 따라, 美, 국방부는 사이버 공간을 전장으로규정하며, 민간과 군대가 연계하여 사이버 공격을 방어하기 위한 연구에천문학적인 투자를 하고 있다. 적대세력의 사이버 공격의 피해를 최소화하기위해서 그들의 사이버 활동을 탐지하여 이상징후로 분류할 시스템이 필요하다.본 논문에서는 적대세력의 사이버 공격을 탐지하고 대응하기 위해, 사이버활동을 패턴을 오토인코더에 학습시켜 탐지하는 시스템을 제안한다. 본연구에서는 적대세력의 사이버 활동 정보가 저장된 BGP(Border Gateway Protocol) 데이터를 오토인코더에 학습시켰다. 그 결과로 적대세력의 사이버활동탐지 정확도는 93.4%, F1-점수(score)는 91%의 성능을 보였다. 이를 통해사이버 공격에 대한 탐지 및 대응에 도움이 될 것이라 기대된다.",
주가 예측 모델에서의 분할 예측을 통한 성능향상 탐구,2022,"['Machine learning', 'AutoEncoder', 'DNN', 'Stock', 'HyperParameter', '기계 학습', '오토인코더', 'DNN', '주식', '하이퍼파라미터']",본 논문의 연구 취지는 예측하고자 하는 다음 날과 이전 날의 시가 사이 변동률을 예측값으로 두고 시가를 예측하는 기존 논문들과는 다르게 예측하고자 하는 다음날의 주가 순위를 일정한 간격으로 분할하여 생성된 각 구간마다의 시가 변동률을 예측값으로 하는 모델을 통하여 최종적인 다음날의 시가 변동률을 예측하는 새로운 시계열 데이터 예측 방식을 제안하고자 한다. 예측값의 세분화 정도와 입력 데이터의 종류에 따른 모델의 성능 변화를 분석했으며 연구 결과 예측값의 세분화 정도에 따른 모델의 예측값과 실제값의 차이가 예측값의 세분화 개수가 3일 때 큰 폭으로 감소한다는 사실도 도출해 낼 수 있었다.,
주변 센서 정보를 이용한 자동차 엔진 이상 탐지,2022,"['이상 탐지', '자동차 엔진', '전이 학습', '합성곱 신경망', '오토인코더', '심층 학습', 'Anomaly Detection', 'Vehicle Engine', 'Transfer Learning', 'Convolutional Neural Network', 'Autoencoder', 'Deep Learning']",,"This study proposes a new method of determining whether the state of a vehicle engine is normal or abnormal using measured data from various sensors around the engine and verifies its performance. To understand the obtained sensor data, a correlation between data from each sensor is developed, and an analysis is performed to classify data that can be used as a feature. The given sensor data are converted into gray images and color images to be used as training and test data. The performance in discriminating between normal and abnormal states of an automobile engine is evaluated using an autoencoder, convolutional neural networks, and transfer learning. It is confirmed that the proposed method can accurately classify the normal and abnormal states of the vehicle engine."
생성 모델과 검색 모델을 이용한 한국어 멀티턴 응답 생성 연구,2022,"['언어 모델', '멀티턴', '대화', '자연어 생성', '발화 생성', 'Language model', 'Multi-turn', 'Conversation', 'Natural language generation']","최근 딥러닝 기반의 자연어처리 연구는 사전 훈련된 언어 모델을 통해 대부분의 자연어처리 분야에서 우수한 성능을 보인다. 특히 오토인코더 (auto-encoder) 기반의 언어 모델은 다양한 한국어 이해 분야에서 뛰어난 성능과 쓰임을 증명하고 있다. 그러나 여전히 디코더 (decoder) 기반의 한국어 생성 모델은 간단한 문장 생성 과제에도 어려움을 겪고 있으며, 생성 모델이 가장 일반적으로 쓰이는 대화 분야에서의 세부 연구와 학습 가능한 데이터가 부족한 상황이다. 따라서 본 논문은 한국어 생성 모델을 위한 멀티턴 대화 데이터를 구축하고 전이 학습을 통해 생성 모델의 대화 능력을 개선하여 성능을 비교 분석한다. 또한, 검색 모델을 통해 외부 지식 정보에서 추천 응답 후보군을 추출하여 모델의 부족한 대화 생성 능력을 보완하는 방법을 제안한다.","Recent deep learning-based research shows excellent performance in most natural language processing (NLP) fields with pre-trained language models. In particular, the auto-encoder-based language model proves its excellent performance and usefulness in various fields of Korean language understanding. However, the decoder-based Korean generative model even suffers from generating simple sentences. Also, there is few detailed research and data for the field of conversation where generative models are most commonly utilized. Therefore, this paper constructs multi-turn dialogue data for a Korean generative model. In addition, we compare and analyze the performance by improving the dialogue ability of the generative model through transfer learning. In addition, we propose a method of supplementing the insufficient dialogue generation ability of the model by extracting recommended response candidates from external knowledge information through a retrival model."
X-FDS : 게임 결제 로그 기반 XAI적용 이상 거래탐지 모델 연구,2022,"['FDS', 'Machine Learning Algorithm', 'XAI']","게임에 대한 결제 수단과 방식이 다양해지는 가운데, 관련된 금융사고가 이용자와 게임사에 심각한 문제를 야기하고 있다. 최근 게임 결제 시스템에 대해 게임사는 이상거래탐지시스템(FDS)을 도입하여 금융 사고를 방지하고 있다. 하지만, FDS는 지속적으로 탐지 패턴을 변경해야 하므로 효과적이지 않고 판단 결과에 따른 근거를 제시할 수 없다. 본 논문에서는 실제 게임회사의 결제 로그 데이터 중 이상거래를 분석하여 관련된 피처를 생성하였다. 비지도학습 모델중 하나인 오토인코더를 사용하여 이상거래를 탐지하는 모델을 구축하였으며, 그 결과 85% 이상의 정확도를 얻을 수 있었다. 이를 XAI-SHAP을 적용한 X-FDS를 사용하여 이상 거래탐지에 대한 영향력이 가장 높은 피처는 나라, 거래 금액과 거래 매체, 이용자의 나이임을 알 수 있었다. 이를 바탕으로 제시한 모델의 판단 결과에 편향성을 주는 피처에 가중치를 세부 조정하여 최종적으로 정확도 94%의 개선된 탐지 모델을 도출하였다.",
머신러닝 기반 금속외관 결함 검출 비교 분석,2022,"['금속 외관', '결함 검출', '머신러닝', '합성곱신경망', 'Metal Surface', 'Defect Detection', 'Machine Learning', 'Convolutional Neural Network']","최근 스마트팩토리와 인공지능 기술의 수요 증가로 인해 다양한 분야에서 인공지능 기술을 적용하는 연구가 진행되고 있다. 결함 검사 분야에서도 인공지능 알고리즘을 도입하기 위한 노력을 기울이고 있다. 특히, 금속 외관의 결함을 검출하는 연구는 다른 소재(목재, 플라스틱, 섬유 등)의 결함을 검출하는 연구에 비해 많은 연구가 이루어지고 있다. 본 논문에서는 머신러닝 기법(서포터 벡터 머신(SVM: Support Vector Machine), 소프트맥스 회귀(Softmax Regression), 결정 트리(Decesion Tree))과 차원 축소 알고리즘(주성분 분석(PCA: Principal Component Analysis), 오토인코더(AutoEncoder))의 9가지 조합과 2가지 합성곱신경망(CNN: Convolution Neural Network) 기법(자체 알고리즘, ResNet)의 금속 외관의 결함 분류 성능 및 속도를 비교하고 분석하는 연구를 수행하고자 한다. 두 종류의 학습 데이터셋((i) 공용 데이터셋, (ii) 실측 데이터셋)에 대한 실험을 통해 각 데이터셋에 대한 성능 및 속도를 비교 분석하고, 가장 효율적인 알고리즘을 찾아낸다.",
전문어의 범용 공간 매핑을 위한 비선형 벡터 정렬 방법론,2022,"['워드 임베딩', '사전학습 언어모델', '벡터 정렬', '레이블 임베딩', 'Word Embedding', 'Pre-trained Language Model', 'Vector Alignment', 'Label Embedding']","최근 워드 임베딩이 딥러닝 기반 자연어 처리를 다루는 다양한 업무에서 우수한 성능을 나타내면서, 단어, 문장, 그리 고문서임베딩의고도화및활용에대한연구가활발하게이루어지고있다. 예를들어교차언어전이는서로다른언어 간의의미적교환을가능하게하는분야로, 임베딩모델의발전과동시에성장하고있다. 또한핵심기술인벡터정렬 (Vector Alignment)은 임베딩 기반 다양한 분석에 적용될 수 있다는 기대에 힘입어 학계의 관심이 더욱 높아지고 있다. 특 히벡터정렬은최근수요가높아지고있는분야간매핑, 즉대용량의범용문서로학습된사전학습언어모델의공간에 R&D, 의료, 법률등전문분야의어휘를매핑하거나이들전문분야간의어휘를매핑하기위한실마리를제공할수있을 것으로 기대된다. 하지만 학계에서 주로 연구되어 온 선형 기반 벡터 정렬은 기본적으로 통계적 선형성을 가정하기 때문 에, 본질적으로 상이한 형태의 벡터 공간을 기하학적으로 유사한 것으로 간주하는 가정으로 인해 정렬 과정에서 필연적인 왜곡을 야기한다는 한계를 갖는다. 본 연구에서는 이러한 한계를 극복하기 위해 데이터의 비선형성을 효과적으로 학습하 는 딥러닝 기반 벡터 정렬 방법론을 제안한다. 제안 방법론은 서로 다른 공간에서 벡터로 표현된 전문어 임베딩을 범용어 임베딩 공간에 정렬하는 스킵연결 오토인코더와 회귀 모델의 순차별 학습으로 구성되며, 학습된 두 모델의 추론을 통해 전문 어휘를 범용어 공간에 정렬할 수 있다. 제안 방법론의 성능을 검증하기 위해 2011년부터 2020년까지 수행된 국가 R&D 과제 중 ‘보건의료’ 분야의 문서 총 77,578건에 대한 실험을 수행한 결과, 제안 방법론이 기존의 선형 벡터 정렬에 비해 코사인 유사도 측면에서 우수한 성능을 나타냄을 확인하였다.",
