title,date,keywords,abstract,multilingual_abstract
순환 신경망과 합성곱 신경망을 이용한 뉴스 기사 편향도 분석,2020,[],,"While search portals' 'Portal News' account for the largest portion of aggregated news outlet, its neutrality as an outlet is questionable. This is because news aggregation may lead to prejudiced information consumption by recommending biased news articles. In this paper we introduce a new method of measuring political bias of news articles by using deep learning. It can provide its readers with insights on critical thinking. For this method, we build the dataset for deep learning by analyzing articles' bias from keywords, sourced from the National Assembly proceedings, and assigning bias to said keywords. Based on these data, news article bias is calculated by applying deep learning with a combination of Convolution Neural Network and Recurrent Neural Network. Using this method, 95.6% of sentences are correctly distinguished as either conservative or progressive-biased; on the entire article, the accuracy is 46.0%. This enables analyzing any articles' bias between conservative and progressive unlike previous methods that were limited on article subjects."
합성곱 순환 신경망 구조를 이용한 지진 이벤트 분류 기법,2020,"['Earthquake events classification', 'Convolutional Neural Network (CNN)', 'Recurrent Neural Network (RNN)', 'Convolutional Recurrent Neural Network (CRNN)', '지진 이벤트 분류', '합성곱 신경망', '순환 신경망', '합성 순환 신경망']","본 논문은 다양한 지진 이벤트 분류를 위해 지진 데이터의 정적인 특성과 동적인 특성을 동시에 반영할 수있는 합성곱 순환 신경망(Convolutional Recurrent Neural Net, CRNN) 구조를 제안한다. 중규모 지진뿐만 아니라미소 지진, 인공 지진을 포함한 지진 이벤트 분류 문제를 해결하려면 효과적인 특징 추출 및 분류 방법이 필요하다. 본논문에서는 먼저 주의 기반 합성곱 레이어를 통해 지진 데이터의 정적 특성을 추출 하게 된다. 추출된 특징은 다중 입력단일 출력 장단기메모리(Long Short-Term Memory, LSTM) 네트워크 구조에 순차적으로 입력되어 다양한 지진 이벤트 분류를 위한 동적 특성을 추출하게 되며 완전 연결 레이어와 소프트맥스 함수를 통해 지진 이벤트 분류를 수행한다. 국내외 지진을 이용한 모의 실험 결과 제안된 모델은 다양한 지진 이벤트 분류에 효과적인 모습을 보여 주었다.","This paper proposes a Convolutional Recurrent Neural Net (CRNN) structure that can simultaneously reflect both static and dynamic characteristics of seismic waveforms for various earthquake events classification. Addressing various earthquake events, including not only micro-earthquakes and artificial-earthquakes but also macro-earthquakes, requires both effective feature extraction and a classifier that can discriminate seismic waveform under noisy environment. First, we extract the static characteristics of seismic waveform through an attention-based convolution layer. Then, the extracted feature-map is sequentially injected as input to a multiinput single-output Long Short-Term Memory (LSTM) network structure to extract the dynamic characteristic for various seismic event classifications. Subsequently, we perform earthquake events classification through two fully connected layers and softmax function. Representative experimental results using domestic and foreign earthquake database show that the proposed model provides an effective structure for various earthquake events classification."
양방향 순환 신경망 언어 모델을 이용한 Fuzzy-AHP 기반 영화 추천 시스템,2020,"['양방향 순환 신경망', '언어 모델', '퍼지 계층적 분석 방법', '스크래핑', '추천 시스템', 'Bidirectional Recurrent Neural Network', 'Language Model', 'Fuzzy-AHP', 'Scraping', 'Recommendation System']",,
실시간 순환 신경망 기반의 멀티빔 소나 이미지를 이용한 수중 물체의 추적에 관한 연구,2020,"['Underwater Sonar Image', 'Object Tracking', 'Real-Time Recurrent Regression Networks', 'Heterogeneous Sonar Sensors']",,"This research is a case study of underwater object tracking based on real-time recurrent regression networks (Re3). Re3 has the concept of generic object tracking. Because of these characteristics, it is very effective to apply this model to unclear underwater sonar images. The model also an pursues object tracking method, thus it solves the problem of calculating load that may be limited when object detection models are used, unlike the tracking models. The model is also highly intuitive, so it has excellent continuity of tracking even if the object being tracked temporarily becomes partially occluded or faded. There are 4 types of the dataset using multi-beam sonar images: including (a) dummy object floated at the testbed; (b) dummy object settled at the bottom of the sea; (c) tire object settled at the bottom of the testbed; (d) multi-objects settled at the bottom of the testbed. For this study, the experiments were conducted to obtain underwater sonar images from the sea and underwater testbed, and the validity of using noisy underwater sonar images was tested to be able to track objects robustly."
인지 무선 통신을 위한 순환 신경망 기반 스펙트럼 센싱 기법,2020,[],,"This paper proposes a new Recurrent neural network (RNN) based spectrum sensing technique for cognitive radio communications. The proposed technique determines the existence of primary user's signal without any prior information of the primary users. The method performs high-speed sampling by considering the whole sensing bandwidth and then converts the signal into frequency spectrum via fast Fourier transform (FFT). This spectrum signal is cut in sensing channel bandwidth and entered into the RNN to determine the channel vacancy. The performance of the proposed technique is verified through computer simulations. According to the results, the proposed one is superior to more than 2 [dB] than the existing threshold-based technique and has similar performance to that of the existing Convolutional neural network (CNN) based method. In addition, experiments are carried out in indoor environments and the results show that the proposed technique performs more than 4 [dB] better than both the conventional threshold-based and the CNN based methods."
고객 평가 분석을 위한 멀티태스크 순환 신경망 모델,2020,"['Voice of Customer', 'Sentiment Analysis', 'Multitask Learning', 'Recurrent Neural Networks', 'Attention', 'N']",,"Hotel and resort industries analyze customers’ evaluation data collected from various channels to improve the quality of their own facilities and services. Recently, hotel and resort corporations have attempted to predict the customers’ emotions by using machine learning models. However, the scale of the emotion of the data varies from channel to channel. Moreover, each channel has different characteristics such as sentence length and the degree of imbalance by class. Existing models were constructed by each channel but this approach could be inefficient in terms of model operation and management. In this study, we propose a multitask recurrent neural network model that performs two tasks (channels) simultaneously. The proposed model addresses the problems caused by class imbalance and insufficient data by sharing the model's parameters. In addition, we used attention scores of the words to identify the causes of customers’emotions. The experiment using real data from the resort company demonstrated that the proposed model outperformed the singletask models built based on each channel."
UWB 시스템에서 실내 측위를 위한 순환 신경망 기반 거리 추정,2020,[],,"This paper proposes a new distance estimation technique for indoor localization in ultra wideband (UWB) systems. The proposed technique is based on recurrent neural network (RNN), one of the deep learning methods. The RNN is known to be useful to deal with time series data, and since UWB signals can be seen as a time series data, RNN is employed in this paper. Specifically, the transmitted UWB signal passes through IEEE802.15.4a indoor channel model, and from the received signal, the RNN regressor is trained to estimate the distance from the transmitter to the receiver. To verify the performance of the trained RNN regressor, new received UWB signals are used and the conventional threshold based technique is also compared. For the performance measure, root mean square error (RMSE) is assessed. According to the computer simulation results, the proposed distance estimator is always much better than the conventional technique in all signal-to-noise ratios and distances between the transmitter and the receiver."
확장 합성곱 신경망과 자기 지도 순환 적대적 생성 신경망을 이용한 안개 제거 네트워크,2020,"['안개 제거', '순환 적대적 생성 신경망', '자기 지도 학습', '회전 손실 함수', '지각적 손실 함수', '확장합성곱 신경망', 'dehazing', 'cyclegan', 'self-supervised learning', 'rotation loss', 'perceptual loss', 'smoothed dilated convolution']","C/C++의 타입 캐스팅은 취약점을 유발하며 프로그램의 안정성을 저하시킨다. 이를 보완하기 위해 C++에서는 실행 중 객체의 타입을 확인하여 캐스팅하는 dynamic_cast를 지원하지만, 안전성이 높아지는 대신 실행 속도가 느려진다는 단점이 있다. 이러한 이유로 절충안인 런타임 오버헤드가 적은 static_cast가 사용된다. 그러나 static_cast는 컴파일시에 알려진 타입으로만 캐스팅을 제한하는 방법으로서, 취약점이 여전히 존재한다. 본 논문에서는 프로그램 재작성과 타입 시스템을 활용하여 기존의 C++ static_cast를 보완하여 런타임 오버헤드가 적으면서도 개발 단계에서 좀 더 안전한 코딩을 할 수 있도록 유도하는 방법을 제안한다.","The purpose of this study is to investigate methods restoring hazy images to haze-free images. Most dehazing studies have used datasets that consist of pairs of images, one hazy and one haze-free of the same scene, for training purposes. However, in the real world, it is almost impossible to acquire this kind of data where the hazy image and the haze-free image are perfectly matched except for the haze. Therefore, this paper aims to develop a network that removes haze using hazy images and images without haze that are not paired. The proposed model uses the CycleGAN architecture with this unpaired data. In order to improve the haze removal performance, we propose a dehazing model consisting of a smoothed dilated convolution, a perceptual loss function and a rotational loss function under self-supervised learning. For objective performance evaluation of the proposed techniques, we conducted experiments on the D-HAZY dataset and with real hazy images. The performance of the proposed method was demonstrated through qualitative and quantitative analysis."
다층신경망을 이용한 장래 생활폐기물 발생량 예측 연구 : B시 사례연구,2020,"['Forecasting model', 'Multiple layer perceptron', 'The unit generation rate method', 'Waste generation']",없음,"In order to establish an efficient waste management plan, it is essential to forecast waste generation accurately, andsuch estimates become the basis for optimizing and developing the existing waste management infrastructure. The unitgeneration rate method used to estimate waste generation is widely used because it is convenient to apply. However,because it has various problems, methods for forecasting waste generation must be improved. Machine learning techniquesare being used to forecast prices and demand in various areas, such as economy and industrial engineering. This studyapplies those techniques for predicting waste generation and compares the results with those obtained using existingmethodologies. In this study, 80% (January 2013 to December 2016) of the data were used for training purposes, and20% (January 2017 to December 2017) were used for testing. The results of five hundred iterations show that the minimumvalue of 515.4 ton/day, the one-quartile value of 573.6 ton/day, and the median value of 590.4 ton/day in 2020, aresignificantly different from the results obtained using the unit generation rate method (547.7 ton/day). It was also shownthat future waste generation will continue to increase despite a decrease in population, and then it converges on 614.9ton/day in 2030. In other words, the model that was applied in this study is more suitable for short-term forecasts thanfor long-term forecasts. In addition, results of this study suggest that future increases in waste generation would be dueto changes in the population structure and the developing delivery service."
청각 장애인용 홈 모니터링 시스템을 위한 다채널 다중 스케일 신경망 기반의 사운드 이벤트 검출,2020,"['Sound event detection', 'Multichannel audio features', 'Multi-scale neural networks', 'Bidirectional gated recurrent neural networks', '사운드 이벤트 검출', '다채널 오디오 특징 값', '다중 스케일 신경망', '양방향 게이트 순환 신경망']","본 논문에서는 청각 장애인을 위한 소리 감지 홈 모니터링을 위해 다채널 다중 스케일 신경망을 사용한 사운드이벤트 검출 방식을 제안한다. 제안하는 시스템에서는 홈 내의 여러 무선 마이크 센서들로부터 높은 신호 품질을 갖는두 개의 채널을 선택하고, 그 신호들로부터 도착신호 지연시간, 피치 범위, 그리고 다중 스케일 합성 곱 신경망을 로그멜 스펙트로그램에 적용하여 추출한 특징들을 양방향 게이트 순환 신경망 기반의 분류기에 적용함으로써 사운드 이벤트 검출의 성능을 더욱 향상시킨다. 검출된 사운드 이벤트 결과는 선택된 채널의 센서 위치와 함께 텍스트로 변환되어청각 장애인에게 제공된다. 실험결과는 제안한 시스템의 사운드 이벤트 검출 방식이 기존 방식보다 우수하며 청각 장애인에게 효과적으로 사운드 정보를 전달할 수 있음을 보인다.","In this paper, we propose a sound event detection method using a multi-channel multi-scale neural networks for sound sensing home monitoring for the hearing impaired. In the proposed system, two channels with high signal quality are selected from several wireless microphone sensors in home. The three features (time difference of arrival, pitch range, and outputs obtained by applying multi-scale convolutional neural network to log mel spectrogram) extracted from the sensor signals are applied to a classifier based on a bidirectional gated recurrent neural network to further improve the performance of sound event detection. The detected sound event result is converted into text along with the sensor position of the selected channel and provided to the hearing impaired. The experimental results show that the sound event detection method of the proposed system is superior to the existing method and can effectively deliver sound information to the hearing impaired."
이미지의 질과 왜곡을 고려한 적대적 생성 신경망과 이를 이용한 비정상 검출,2020,"['Anomaly Detection', 'Unsupervised learning', 'Generative Adversarial Network', 'Variational Autoencoder']","최근 연구 결과에 따르면, 컨볼루션 신경 회로망은 이미지 분류, 객체 검출, 이미지 생성 등의 문제에서 최고의 성능을 보여주고 있다. 비전 카메라를 사용한 결함 검사는 다른 결함 검사보다 경제적이기 때문에 공장 자동화에 있어서 아주 중요하고, 딥러닝의 지도학습은 전통 기계학습 방식의 결함 검사 성능을 월등히 뛰어넘었다. 하지만, 딥러닝의 지도 학습은 엄청난 양의 데이터 주석 작업을 요구하기 때문에, 이를 실제 산업 현장에 적용하는 것은 효율적이지 않다. 따라 서 본 연구는 최근 이미지 생성 과업에서 큰 성공을 보여주고 있는 변분 오토인코더와 적대적 생성 신경망을 활용하여 비지도 방식의 비정상 검출을 위한 신경망 회로 구조를 제안하였고, 이를 MNIST, 용접 결함 데이터에 적용하여 비정상 검출 성능을 검증하였다.","Recently, studies have shown that convolution neural networks are achieving the best performance in image classification, object detection, and image generation. Vision based defect inspection which is more economical than other defect inspection, is a very important for a factory automation. Although supervised anomaly detection algorithm has far exceeded the performance of traditional machine learning based method, it is inefficient for real industrial field due to its tedious annotation work, In this paper, we propose ADGAN, a unsupervised anomaly detection architecture using the variational autoencoder and the generative adversarial network which give great results in image generation task, and demonstrate whether the proposed network architecture identifies anomalous images well on MNIST benchmark dataset as well as our own welding defect dataset"
LSTM 기반 모형의 주식시장 예측성 분석,2020,"['순환신경망', '시계열 데이터', '주식시장', '포트폴리오', 'RNN', 'time series', 'stock market', 'portfolio']","본 논문에서는 한국 주식시장에서 순환신경망(Recurrent Neural Network, RNN)을 이용한 머신러닝 기법이 수익률의 예측성을 내포하고 있는지 살펴본다. 단순한 순환신경망의 경우, 시계열의 단기적인 기억 효과만 모형화되었기에 비교적 장기 기억 효과가 있는 것으로 알려진 금융시장정보에 적용하기에는 한계가 있다. 따라서 순환신경망 중에서도 금융 시계열 자료에 적합한 것으로 알려진 장단기 기억네트워크(Long Short Term Memory, LSTM)를 활용하여 과거 수익률로 학습된 모형이 미래의 수익률에 대한 정보를 담아낼 수 있는지를 확인한다. 시가총액 기준 상위 100개의 주식에 대하여 학습모형을 구성하여 약 1년 수익률에 해당하는 일간 수익률을 입력한 모형의 1개월, 3개월, 6개월 수익률 예측성을 각각 실험한다. 다시 말해 100개 주식 전체를 하나의 시스템으로 학습하고 예측하도록 한다. 그 결과 1개월과 3개월 모형의 예측에 기반을 둔 매수-공매도 포트폴리오(Long-short Portfolio) 포트폴리오 전략은 통계적으로 유의한 수익성을 보이나, 6개월 모형은 그렇지 못함을 보고한다. 또한, 시장, 장부가치-시장가치 비율, 기업 규모 등 전통적인 위험 요인의 효과를 제거한 위험조정 수익률 또한 같은 결과를 보인다. 수익성 분석에 더하여 가격 결정 요인으로서의 가능성을 확인하기 위하여 각 포트폴리오 전략의 분위 분석 및 Fama-French 요인분석을 분석한 결과 세 요인에 대한 선형적 패턴이 없음을 보인다.","This article investigates whether machine learning techniques based on the Recurrent Neural Network (RNN) imply return predictability in the Korean stock market. The Long Short Term Memory (LSTM), known to be suitable for financial time series data, is utilized to see if a machine learning model trained upon past return data captures any information about future returns. For the top 100 stocks by market capitalization, LSTM models are constructed to test the predictability for the one-month, three-month and six-month returns, respectively, with the daily returns of past one year as input. As a result, the long-short portfolio strategies based on predictions of one- and three-month models show statistically significant profitability, while the six-month model does not. In addition to the profitability analysis, the quantile analysis of each portfolio strategy and the Fama-French factor analysis are performed to analyze the characteristics of the strategies."
수문모형과 기계학습을 연계한 실시간 하천홍수 예측,2020,"['자료기반 해석', '비선형 자기회귀 인공신경망', '실시간 홍수예측', '하천범람', 'Data-based analysis', 'NARX', 'Real-time flood prediction', 'River flood']","수자원분야에서 이용되는 강우에 따른 유역의 수문학적 시스템, 도시지역 및 하천에 대한 수리학적 시스템은 비선형성이 강하고 많은 변수들을포함하고 있다. 이러한 특성을 가진 시계열 자료에서 기계학습을 통한 예측은 예측시점 이전의 자료 특성을 반영하지 못하는 등 기본적인 신경망으로는 부족한 상황이 발생하기도 한다. 본 연구에서 적용할 강우-유출량과 같이 비선형성이 강하고 시간종속성이 높은 복잡한 시계열 자료를예측하기 위해 신경망의 학습능력을 극대화한 순환형 동적 신경망(Recurrent Dynamic Neural Network)의 한 종류인 동시에, 시간 지연 신경망(Time-Delay Neural Network)의 특성을 가진 비선형 자기회귀(NARX, Nonlinear Autoregressive Exogenous Model) 인공신경망을 사용하였다. 이를 태화강 지방하천 구간에 적용하여 NARX 인공신경망의 시간 지연 매개변수를 10분에서 120분까지 조정하며 모의한 결과에 대해 여러 통계지표를 이용해 정량적으로 평가하였다. 그 결과 지연시간이 증가할수록 효율계수(NSE)가 0.530에서 0.988으로 증가하고, 평균제곱근편차(RMSE)가 379.9 m3/s에서 16.1 m3/s로 감소하는 등 정교한 예측이 가능함을 확인하였다.","The hydrological characteristics of watersheds and hydraulic systems of urban and river floods are highly nonlinear and containuncertain variables. Therefore, the predicted time series of rainfall-runoff data in flood analysis is not suitable for existing neuralnetworks. To overcome the challenge of prediction, a NARX (Nonlinear Autoregressive Exogenous Model), which is a kind ofrecurrent dynamic neural network that maximizes the learning ability of a neural network, was applied to forecast a flood in real-time.At the same time, NARX has the characteristics of a time-delay neural network. In this study, a hydrological model was constructedfor the Taehwa river basin, and the NARX time-delay parameter was adjusted 10 to 120 minutes. As a result, we found that preciseprediction is possible as the time-delay parameter was increased by confirming that the NSE increased from 0.530 to 0.988 and theRMSE decreased from 379.9 m3/s to 16.1 m3/s. The machine learning technique with NARX will contribute to the accurate predictionof flow rate with an unexpected extreme flood condition."
증류공정 내부 온도 예측을 위한 머신 러닝 모델 개발,2020,"['Machine learning', 'Distillation column', 'LSTM', 'Prediction model', 'Adam optimizer']","본 연구에서는 증류공정의 제품 생산단 온도 예측을 위한 머신러닝 기반 모델을 개발하였다. 증류공정의 제어는 제품 생산단의 온도를 통해 이루어지고 있어 제어를 위해 정확한 온도 예측이 필요하다. 증류공정에서 온도는 다양한 변수들과 복잡한 비선형의 관계를 형성하고 있으며 시계열 데이터의 특성이 있어 이를 예측하기 위해 순환신경망 기반 알고리즘을 이용하였다. 모델 개발 과정에서 적절한 예측 알고리즘을 선정하기 위해 세 가지 순환신경망 기반 알고리즘과 배치 사이즈 조절하여 제품 생산단 온도를 예측하기 위한 가장 적저한 모델을 선정하였다. LSTM128 모델이 제품 생산단 온도를 예측하기 위한 가장 적절한 모델로 선정되었다. 선정된 모델을 활용하여 실제 공정 운전데이터에 적용한 결과 RMSE 0.0791, R<sup>2</sup> 0.924의 성능을 보였다.","In this study, we developed a machine learning-based model for predicting the production stage temperature of distillation process. It is necessary to predict an accurate temperature for control because the control of the distillation process is done through the production stage temperature. The temperature in distillation process has a nonlinear complex relationship with other variables and time series data, so we used the recurrent neural network algorithms to predict temperature. In the model development process, by adjusting three recurrent neural network based algorithms, and batch size, we selected the most appropriate model for predicting the production stage temperature. LSTM128 was selected as the most appropriate model for predicting the production stage temperature. The prediction performance of selected model for the actual temperature is RMSE of 0.0791 and R<sup>2</sup> of 0.924."
