title,date,keywords,abstract,multilingual_abstract
가속도 예측 기반 새로운 선박 이동 경로 예측 방법,2020,"['Vessel path prediction', 'Ship trajectory prediction', 'Long short-term memory network (LSTM)', 'recurrent neural network (RNN)', 'Acceleration prediction']","선박의 이동 경로를 예측하는 기존의 방법들은 일반적으로 위도와 경도를 직접 예측한다. 하지만, 위도와 경도를 직접 예측할 경우, 예측 모델이 출력 가능한 범위가 상당히 넓어서 예측 오차가 매우 크게 발생할 수 있다. 또한, 순환 신경망 모델 기반의 예측에서는 이전 예측 위치도 다음 위치를 예측하기 위해 사용되기 때문에 오차가 누적되는 현상도 쉽게 발생할 수 있다. 이에 따라, 제안하는 방법에서는 위도와 경도를 직접 예측하지 않고, 선박의 가속도를 예측하여, 향후 속도와 방향을 결정하고, 그 결과로 위도와 경도가 예측되는 방법을 제안한다. 실험 결과에서는 같은 순환 신경망 모델을 사용했을 때, 제안하는 방법이 기존의 직접적으로 위도와 경도를 예측하는 방법에 비해 더 적은 오차를 발생시킴을 보인다.","Vessel path prediction methods generally predict the latitude and longitude of a future location directly. However, in the case of direct prediction, errors could be large since the possible output range is too broad. In addition, error accumulation could occur since recurrent neural networks-based methods employ previous predicte data to forecast future data. In this paper, we propose a vessel path prediction method that does not directly predict the longitude and latitude. Instead, the proposed method predicts the acceleration of the vessel. Then the acceleration is employed to generate the velocity and direction, and the values decide the longitude and latitude of the future location. In the experiment, we show that the proposed method makes smaller errors than the direct prediction method, while both methods employ the same model."
변형된 Attention 메커니즘 기반의 LSTM을 통한 전력수요 예측 프레임웍,2020,"['전력수요 예측', '순환 신경망', 'Long Short Term Memory', 'Attention Mechanism', 'Modified Attention-based LSTM', 'Power demand prediction', 'Recurrent Neural Networks', 'Auto Regressive Integrated Moving Average']","본 연구는 효율적인 스마트 그리드 시스템을 운용하기 위한 필수 불가결한 요소인 전력수요의 보다 정확한 예측을 그 대상으로 한다. 기존의 시계열적 방법론 및 인공신경망을 이용한 방법론 들이 전력수요 예측에 쓰이는 동안, 전력수요가 가지는 비선형적 요소 및 소수의 데이터 등이 그 이슈로 여겨져 왔다. 이를 해소하기 위하여, 본 연구는 두 개의 LSTM을 하나의 Attention Mechanism으로 연결한 변형된 Attention Mechanism 기반의 LSTM (MA-LSTM)을 제안한다. MA-LSTM은 기존의 시계열화되어 있는 데이터를 첫 번째 LSTM에 넣고, 여기서 추출된 attention 요소들을 두 번째 LSTM에 넣어 학습한 후, 최종적으로 Attentaion 레이어에서 결합하는 형태를 취한다. 이를 통하여 소수의 데이터를 가지고 보다 정확하게 특성에 기초하여 학습 및 예측하는 특징을 가진다. 본 연구에서는 실제 전력수요 데이터의 예측을 통하여, 제안된 프레임웍을 ARIMA 및 LSTM과 비교하여 그 우수성을 실험적으로 보여준다.","This research focuses on an electricity demand forecasting framework, which is an essential component of an efficient smart grid system. While time-series analysis and neural network-based approaches have been applied, non-linearity and few number of data are considered main issues. In order to overcome these issues, the research proposes a Modified Attention-based Long Short Term Memory(MA-LSTM) which combines two LSTMs with one Attention layer. While the first LSTM handles the original data, the second LSTM module handles attention-based context features extracted from the data. Then, these are combined with an attention layer. For this manner, the more accurate features are trained with a small number of data in the proposed MA-LSTM. In order to show the effectiveness of MA-LSTM, the real electricity data forecasting is conducted and compared with ARIMA and LSTM methods."
Defect Classification of Cross-section of Additive Manufacturing Using Image-Labeling,2020,"['Deep Learning(딥러닝)', 'CNN(순환 신경망)', 'Data Augmentation(데이터 증폭)', 'Image Labeling(이미지 라벨링)', 'Additive Manufacturing(적층제조)']",,"Recently, the fourth industrial revolution has been presented as a new paradigm and additive manufacturing (AM) has become one of the most important topics. For this reason, process monitoring for each cross-sectional layer of additive metal manufacturing is important. Particularly, deep learning can train a machine to analyze, optimize, and repair defects. In this paper, image classification is proposed by learning images of defects in the metal cross sections using the convolution neural network (CNN) image labeling algorithm. Defects were classified into three categories: crack, porosity, and hole. To overcome a lack-of-data problem, the amount of learning data was augmented using a data augmentation algorithm. This augmentation algorithm can transform an image to 180 images, increasing the learning accuracy. The number of training and validation images was 25,920 (80 %) and 6,480 (20 %), respectively. An optimized case with a combination of fully connected layers, an optimizer, and a loss function, showed that the model accuracy was 99.7 % and had a success rate of 97.8 % for 180 test images. In conclusion, image labeling was successfully performed and it is expected to be applied to automated AM process inspection and repair systems in the future."
관심 문자열 인식 기술을 이용한 가스계량기 자동 검침 시스템,2020,"['가스계량기', '자동 검침', '선택적 문자 인식', '합성곱 신경망', '순환 신경망', '고속 병렬처리', 'Gasometer', 'automatic reading', 'selective optical character recognition', 'convolutional neural network', 'recurrent neural network', 'parallel processing']",,"In this paper, we suggest an application system architecture which provides accurate, fast and efficient automatic gasometer reading function. The system captures gasometer image using mobile device camera, transmits the image to a cloud server on top of private LTE network, and analyzes the image to extract character information of device ID and gas usage amount by selective optical character recognition based on deep learning technology. In general, there are many types of character in an image and optical character recognition technology extracts all character information in an image. But some applications need to ignore non-of-interest types of character and only have to focus on some specific types of characters. For an example of the application, automatic gasometer reading system only need to extract device ID and gas usage amount character information from gasometer images to send bill to users. Non-of-interest character strings, such as device type, manufacturer, manufacturing date, specification and etc., are not valuable information to the application. Thus, the application have to analyze point of interest region and specific types of characters to extract valuable information only. We adopted CNN (Convolutional Neural Network) based object detection and CRNN (Convolutional Recurrent Neural Network) technology for selective optical character recognition which only analyze point of interest region for selective character information extraction. We build up 3 neural networks for the application system. The first is a convolutional neural network which detects point of interest region of gas usage amount and device ID information character strings, the second is another convolutional neural network which transforms spatial information of point of interest region to spatial sequential feature vectors, and the third is bi-directional long short term memory network which converts spatial sequential information to character strings using time-series analysis mapping from feature vectors to character strings. In this research, point of interest character strings are device ID and gas usage amount. Device ID consists of 12 arabic character strings and gas usage amount consists of 4 ~ 5 arabic character strings. All system components are implemented in Amazon Web Service Cloud with Intel Zeon E5-2686 v4 CPU and NVidia TESLA V100 GPU. The system architecture adopts master-lave processing structure for efficient and fast parallel processing coping with about 700,000 requests per day. Mobile device captures gasometer image and transmits to master process in AWS cloud. Master process runs on Intel Zeon CPU and pushes reading request from mobile device to an input queue with FIFO (First In First Out) structure. Slave process consists of 3 types of deep neural networks which conduct character recognition process and runs on NVidia GPU module. Slave process is always polling the input queue to get recognition request. If there are some requests from master process in the input queue, slave process converts the image in the input queue to device ID character string, gas usage amount character string and position information of the strings, returns the information to output queue, and switch to idle mode to poll the input queue. Master process gets final information form the output queue and delivers the information to the mobile device. We used total 27,120 gasometer images for training, validation and testing of 3 types of deep neural network. 22,985 images were used for training and validation, 4,135 images were used for testing. We randomly splitted 22,985 images with 8:2 ratio for training and validation respectively for each training epoch. 4,135 test image were categorized into 5 types (Normal, noise, reflex, scale and slant). Normal data is clean image data, noise means image with noise signal, relfex means image with light reflection in gasometer region, scale means images with small object size due to long-distance capturin"
RNN 모델을 이용한 스마트 중간층 면진시스템의 제어성능 평가,2020,"['Smart Mid-Story Isolation System', 'Recurrent Neural Network Model', 'Fuzzy Logic Controller', 'Seismic Response Reduction', 'Soft-Computing']",본 논문에서는 RNN 순환 신경망 (Recurrent Neural Network) 모델을 사용하여 스마트 중간층 면진 시스템의 지진 응답 제어 성능을 수치 해석을 통하여 검토하였다. 이를 위해서 지진 하중을 받는 건물의 동적 지진 응답 예측을 위한 RNN 모델을 개발하였다. 보다 실제적인 연구를 위하여 중간층 면진 시스템이 설치된 실존하는 건물인 시오도메 스미토모 건물을 예제 구조물로 선택하였다. 스마트 중간층 면진 시스템은 기존의 납 댐퍼를 대신하여 MR (Magnetorheological) 댐퍼를 사용하여 구성하였다. 그 외 고무 베어링이나 강재 댐퍼는 그대로 사용 하였다. 수치 해석을 통하여 개발된 RNN 모델이 기존의 FEM (Finite Element Method) 모델과 비교해서 매우 정확한 응답을 예측하는 것을 확인할 수 있었다. RNN 모델을 사용하면 자유도가 많은 FEM 모델을 사용한 경우에 비하여 해석 시간을 대폭 줄일 수 있다. 개발된 RNN 모델을 사용한 수치 해석 결과 스마트 중간층 면진 시스템이 기존의 수동 중간층 면진 시스템에 비하여 구조물의 지진 응답을 대폭 저감시킬 수 있는 것을 확인할 수 있었다.,"The seismic response reduction capacity of a smart mid-story isolation system was investigated using the RNN model in this study. For this purpose, an RNN model was developed to make a dynamic response prediction of building structures subjected to seismic loads. An existing tall building with a mid-story isolation system was selected as an example structure for realistic research. A smart mid-story isolation system was comprised of an MR damper instead of existing lead dampers. The RNN model predicted the seismic responses accurately compared to those of the FEM model. The simulation time of the RNN model can be reduced significantly compared to the FEM model. After the numerical simulations, the smart mid-story isolation system could effectively reduce the seismic responses of the existing building compared to the conventional mid-story isolation system."
얼굴 속성 편집을 위한 마스크 정보를 활용한 개선된 STGAN,2020,"['얼굴 속성 편집', 'GAN', '딥러닝', '마스크', 'STGAN', 'Facial attribute editing', 'GAN', 'Deep learning', 'Mask', 'STGAN']","본 논문에서는 머리카락과 모자 영역의 마스크 정보를 활용하여 더 자연스러운 얼굴 속성 편집(facial attribute editing)을 수행하는 모델을 제안한다. 최신 얼굴 속성 편집 연구인 STGAN은 다중얼굴 속성을 자연스럽게 편집하는 성과를 보였다. 그러나 머리카락과 관련된 속성을 편집할 때부자연스러운 결과를 생성할 수 있다. 제안하는 방법의 핵심 아이디어는 기존 모델에서 부족했던얼굴 영역의 정보를 모델에 추가로 반영하는 것이다. 이를 위해 세 가지 아이디어를 적용한다. 첫째로 마스크를 통해 머리카락 면적 속성을 추가하여 머리카락 정보를 보완한다. 둘째로 순환 일관성 손실(cycle consistency loss)을 추가하여 영상의 불필요한 변화를 억제한다. 셋째로 모자 분할신경망을 추가하여 모자 영역 왜곡을 방지한다. 정성적 평가를 통해 제안하는 방법 적용 여부에따른 유효성을 평가 및 분석한다. 실험 결과에서 제안하는 방법이 머리카락 및 얼굴 영역을 더자연스럽게 생성하고, 모자 영역의 왜곡을 성공적으로 방지했다.","In this paper, we propose a model that performs more natural facial attribute editing by utilizing mask information in the hair and hat region. STGAN, one of state-of-the-art research of facial attribute editing, has shown results of naturally editing multiple facial attributes. However, editing hair-related attributes can produce unnatural results. The key idea of the proposed method is to additionally utilize information on the face regions that was lacking in the existing model. To do this, we apply three ideas. First, hair information is supplemented by adding hair ratio attributes through masks. Second, unnecessary changes in the image are suppressed by adding cycle consistency loss. Third, a hat segmentation network is added to prevent hat region distortion. Through qualitative evaluation, the effectiveness of the proposed method is evaluated and analyzed. The method proposed in the experimental results generated hair and face regions more naturally and successfully prevented the distortion of the hat region."
아파트매매가격지수 예측에 관한 비교 연구 : 서울과 6대 광역도시를 중심으로,2020,"['아파트매매가격지수', '표준 장단기 메모리', '양방향 장단기 메모리', '게이트 순환 유닛', '벡터오차회귀모형', 'VECM(Vector Error Correction)', 'LSTM(Long Short-Term Meomory)', 'Bidirectional LSTM', 'GRU(Gated Recurrent Unit)', 'Apartment Sales Price Index']","부동산에 편중되어 있는 가계의 자산구조로 인해 부동산 가격 변동은 국가경제에 큰 영향을 미치게 된다. 주택가격에 대한 정확한 예측은 주택가격의 불확실성을 감소시킬 뿐만 아니라 관련 정책의사결정에 도움을 줄 수 있다. 본 연구의 목적은 2006년 1월부터 2019년 11월까지의 서울 및 6대 광역시 아파트 매매 실거래 가격지수를 대상으로 계량 시계열 모형과 인공신경망 모형을 활용하여 주택가격을 예측하고, 높은 예측력을 지닌 예측모형을 구축하는 데에 있다. 분석결과를 통해 정책적 시사점을 도출하고자 한다. 본 연구에서는 기존의 계량시계열 모형 및 표준 LSTM 모형이외 양방향(Bidirectional) LSTM 및 GRU모형을 추가하여 제시된 모형의 예측력을 비교분석하여 높은 예측력을 지닌 인공신경망 모형을 제시하였다. 실증분석결과 지역에 따라 높은 예측력을 보이는 인공신경망 모형이 다르다는 것을 확인하였다. 지역별로 예측력 높은 인공신경망 모형 구축 후 변수의 추가·삭제와 같은 자유로운 조작을 통해 지역에 적합한 거시경제변수가 주택가격지수에 미치는 효과를 파악하여 원하는 정책효과를 거두는 것이 가능할 것이다.","Due to the household s asset structure concentrated on real estate, changes in real estate prices have a great influence on the national economy. Accurate forecasting of house prices not only reduces uncertainty in house prices, but can also help in making relevant policy decisions. The purpose of this study is to estimate housing prices using a time-series model and artificial neural network model for the actual transaction price index for apartment sales in Seoul and six metropolitan cities from January 2006 to November 2019, and forecast with high predictive power. It is in building a model. In this study, by adding bidirectional LSTM and GRU models in addition to the existing weighing time series model and Vanilla LSTM model, we compared the predictive power of the proposed model and presented an artificial neural network model with high predictive power. As a result of empirical analysis, it was confirmed that the artificial neural network model with high predictive power differs depending on the region. After constructing a highly predictive artificial neural network model for each region, it is possible to grasp the effects of macroeconomic variables suitable for the region on the housing price index through free manipulation such as adding and deleting variables to achieve desired policy effects."
