title,date,keywords,abstract,multilingual_abstract
기계학습 기반 도박중독 위험도 예측 모델,2025,"['기계학습', '지도학습', '도박중독', '로지스틱 회귀', '상담심리', 'Machine Learning', 'Supervised Learning', 'Gambling Addiction', 'Logistic Regression', 'Counseling Psychology']","본 논문은 도박 문제 감소를 위해 중독 수준에 따라 도박중독자를 변별하는 기계학습 기반의 예측 모델을 제안한다. 최근 인터넷과 스마트폰의보급으로 인해 도박 접근성이 높아지면서 도박 문제를 겪는 중독자가 점차 증가하고 있다. 도박중독은 개인의 문제가 아닌 사회 전반에 영향을미치는 중대한 문제로, 이를 조기에 발견하고 개입하는 것이 중요하다. 도박 문제를 예방하고 치료 개입을 강화하기 위해서는 도박중독자를 신속하고정확하게 식별할 수 있는 모델이 필요하다. 본 연구에서는 한국판 도박 문제 선별척도(K-Canadian Problem Gambling Index, K-CPGI) 데이터를기반으로 학습된 기계학습 모델을 활용하여, 개인의 도박 행동 수준에 따라 중독 위험도를 예측하는 방법을 제안한다. 본 연구에서는 다양한 기계학습모델을 비교 분석한 결과, 로지스틱 회귀가 상대적으로 높은 성능을 보였으며, 해석 가능성과 신뢰성을 고려하여 최종 모델로 선정하였다. 그러나본 연구에서 사용된 데이터가 제한적이므로, 추가적인 데이터 확보와 일반화 성능 검증이 필요함을 논의한다. 이를 통해 본 연구는 도박중독자를보다 신속하고 정확하게 예측하여, 치료 연계를 강화하고 도박중독 예방 및 개입 전략 수립에 기여할 수 있을 것으로 기대된다.","This paper proposes a machine learning-based prediction model to distinguish gambling addicts according to their level of addictionto mitigate gambling-related problems. With the widespread use of the Internet and smartphones, gambling accessibility has increased,leading to a growing number of individuals experiencing gambling addiction. Gambling addiction is not just a personal issue but a significantsocietal problem that requires early detection and intervention. To prevent gambling problems and strengthen treatment interventions,a model capable of quickly and accurately identifying gambling addicts is necessary. In this study, we propose a method to predict addictionrisk levels based on an individual’s gambling behavior using a machine learning model trained on data from the Korean version of theCanadian Problem Gambling Index (K-CPGI). We compared and analyzed various machine learning models and found that logisticregression demonstrated relatively high performance. Considering its interpretability and reliability, it was selected as the final model. However, due to the limitations of the dataset used in this study, we discuss the need for additional data collection and validation ofgeneralization performance. Through this research, we expect to enhance the early and accurate identification of gambling addicts, therebystrengthening treatment linkage and contributing to the development of gambling addiction prevention and intervention strategies."
지도 학습 TS-CAN 기반 rPPG 신호 취득 및 VR 기기 착용 전후의 스트레스 분석,2025,"['Deep Learning', 'Supervised', 'Two-Stream Convolutional Attention Network', 'Remote Photoplethysmography', 'Virtual Reality', 'Heart Rate Variabilityㅍ', 'Deep Learning', 'Supervised', 'Two-Stream Convolutional Attention Network', 'Remote Photoplethysmography', 'Virtual Reality', 'Heart Rate Variability']",,"The use of VR devices is gradually increasing due to the emergence of various applications such as therapy, research, and entertainment in virtual environments. However, one of the most common side effects of increasing usage is mental health, such as dizziness due to eye fatigue caused by high immersion. Therefore, this paper analyzes the health status through HRV(Heart Rate Variability) analysis by obtaining bio-signals using a non-contact method before and after using VR(Virtual Reality) devices. To acquire the signals, we used the TS-CAN(Two-Stream Convolutional Attention Network) method, which is a supervised learning among deep learning models, and used the UBFC-rPPG dataset and our own dataset, which is a face image taken from a webcam with a resolution of 640x480 at 30 fps. The rPPG (Remote Photoplethysmography) data obtained before and after using the VR (Virtual Reality) device were analyzed using HRV (Heart Rate Variability) analysis. The results showed that VR device usage led to a significant increase in BPM (Heart Rate) and LF Power, as well as a decrease in RMSSD, NN50, and SDNN, indicating a shift in autonomic nervous system balance towards sympathetic dominance, consistent with stress response. These findings suggest that VR usage has a notable impact on physiological stress markers, with implications for health monitoring in VR environments. This study emphasizes the utility of rPPG in assessing physiological responses to stress induced by VR usage. The key findings demonstrate that HRV metrics, such as BPM and LF Power, significantly increased, while RMSSD and SDNN decreased, providing objective insights into the stress effects of VR environments. These results underline the potential of non-contact biosignal analysis for health monitoring in Virtual Reality applications."
자동화 제조 시스템에서 공정 이미지 기반 고장 감지 모델의 학습 패러다임 및 출력 형식 전환에 따른 성능 비교 분석,2025,"['Fault Detection', 'Learning Paradigm', 'Output Representation', 'Automated Manufacturing System', 'Process Image']",,"Fault detection in electromechanical systems plays a significant role in product quality and manufacturing efficiency during the transition to smart manufacturing. Because collecting a sufficient number of datasets under faulty conditions of the system is challenging in practical industrial sites, unsupervised fault detection methods are mainly used. Although fault datasets accumulate during machine operation, it is not straightforward to utilize the information it contains for fault detection after the deep learning model has been trained in an unsupervised manner. However, the information in fault datasets is expected to significantly contribute to fault detection. In this regard, this study aims to validate the effectiveness of the transition from unsupervised to supervised learning as fault datasets gradually accumulate through continuous machine operation. We also focus on experimentally analyzing how changes in the learning paradigm of the deep learning model and the output representation affect fault detection performance. The results demonstrate that, with a small number of fault datasets, a supervised model with continuous outputs as a regression problem showed better fault detection performance than the original model with one-hot encoded outputs (as a classification problem)."
머신러닝과 텍스트마이닝을 활용한  SNS 상의 비자살적 자해 위험군 식별,2025,"['non-suicidal self-injury(NSSI)', 'social networking service(SNS)', 'risk group', 'detection', 'machine learning', 'text-mining']",,"This study was intended to rapidly and accurately detect non-suicidal self-injury(NSSI) risk groups on social networking services (SNS) using machine learning and text mining methods. Data were collected from the text-based SNS platform, X, using the keyword “self-injury” over a one-year period. Following preprocessing and cross-validation by three researchers, 18,758 posts were labeled (1: NSSI risk posts, 0: non-risk posts). Users were placed in the NSSI risk group if they had at least one NSSI risk post. A transformer-embedding method for natural language processing was then used, followed by supervised machine learning algorithms to validate the detection of NSSI risk and non-risk groups.After the collected SNS posts were labeled, 6,613 posts (35.25%) were identified as NSSI risk posts, while 12,147 posts (64.76%) were identified as non-risk posts. Users who posted risk-related content even once were placed in the at-risk group. Consequently, among the 10,524 participants included in the study, 1,733 users (16.47%) were identified as belonging to the NSSI risk group, and 8,791 users (83.53%) as belonging to the non-risk group. Furthermore, the development of a supervised machine learning model to detect NSSI risk groups on SNS demonstrated excellent performance, achieving an accuracy of approximately 85%. This result highlights the high precision of the model in distinguishing between NSSI risk and non-risk groups on SNS.These results indicate the NSSI risk groups on SNS can be efficiently and accurately identified using machine learning, thereby providing a cost-effective and timely approach for early detection. This study advances previous research by expanding the analytical focus from individual posts to user-level accounts. This approach provides a more comprehensive understanding of self-harm risk groups, which may be challenging to identify at the post-level, and enhances the feasibility of connecting insights to practical interventions."
초음파 영상에서의 반복적 유사 라벨링을 이용한 준지도 학습 기반 유방암 세그멘테이션,2025,"['딥 러닝', '유사 라벨', '재귀적 라벨링', '이중 분기 방법', '유방암', 'deep learning', 'pseudo-label', 'recursive labeling', 'two-branch method', 'breast cancer.']","여성에서 유방암을 진단하는 데 있어 유방 종양의 정확하고 신속한 분할은 매우 중요하다. 초음파 이미지는 비침습적이고 효율적인 유방 검진 방법을 제공하나, 유방 초음파 이미지에서 종양의 모양대로 segmentation하는 것은종양크기와 형태의 다양성, 스펙클 노이즈와 인공보형물등으로 인한 불명확한 경게 때문에 쉽지 않은 문제다. 또한, label이있는 유방 종양 데이터셋이 많지 않기 때문에 심층신경망(deep neural net)을 잘 훈련시키기 어렵다. 본 연구에서는한정된 labeled data로 심층 신경망모델을 훈련하기 위해 준지도 학습(semi-supervised learning)을 활용한다. 데이터 부족 문제를 해결하기 위해 라벨이 없는 데이터(unlabeled data)에 대해 유사 라벨(pseudo-label)을 생성하고, 유사 라벨이 달린 이미지와 원래 라벨이 달린 이미지를 모두 사용하여 모델을 재훈련한다. 제안한 방법은 BUSI 데이터셋에서 학습 데이터의 절반만 label이 제공된 경우 약 82%의 Dice 계수를 달성하며, 1/4만 label이 제공된 경우 약 77%, 1/8만 label이 제공된 경우 약 75%의 성능을 보인다. 본 연구는 방사선 전문의의 labeling 작업 부담을 줄이는 데 기여할 것으로 기대된다.","Accurate and rapid segmentation of breast tumors is essential for diagnosing breast cancer, particularly in young females. While ultrasound imaging provides a non-invasive and efficient approach for breast screening, segmenting breast ultrasound (BUS) images is challenging due to the wide variation in tumor size and shape, as well as ambiguous boundaries caused by speckle noise and artifacts.Additionally, limited access to annotated breast tumor datasets complicates training deep neural networks effectively. This research focuses on semi-supervised learning to train deep models with limited annotated breast tumor images. To address data scarcity, we generated pseudo-labels for unlabeled images and re-trained the model using both pseudo-labeled and originally labeled images. To mitigate potential inaccuracies in pseudo-labels that could disrupt the training process, we applied a multi-view approach to enhance pseudo-label robustness Our method achieved an 82% Dice coefficient with half of the training data annotated, approximately 77% with 1/4 annotated, and around 75% with only 1/8 labeled images on the BUSI dataset. We anticipate that this method will help reduce the label burden for radiologists."
제한된 레이블 데이터 환경에서 적응형 가중치 전략을  적용한 준지도학습 기반 반월상 연골 분할,2025,"['반월상 연골 분할', 'MR 영상', '준지도학습', '평균-교사 모델', '가중치 전략', 'Meniscus Segmentation', 'MR Image', 'Semi-Supervised Learning', 'Mean Teacher Model', 'Weight Strategy']","반월상 연골 이식편 이식 수술은 손상된 반월상 연골을 치료하는 주요 방법으로, 이식편의 적절한 크기와 형태를 결정하기 위해 정확한 반월상 연골 분할이 필수적이다. 그러나 반월상 연골은 주변 구조물과 밝기값이 유사하고, 형태와 두께가 다양하게 나타나기 때문에 분할이 어렵다. 본 논문에서는 무릎 MR 영상에서 모델의 일반화 성능을 향상시키고, 반월상 연골의 다양한 형태와 두께를 효과적으로 고려하여 분할 성능을 개선하는 것을목표로 한다. 이를 위해 적은 레이블 데이터로도 효과적인 학습이 가능한 준지도학습 모델을 제안한다. 실험결과, 제안된 방법은 재현율 93.28%, F1-score 90.02%, 균형 정확도 96.42%를 보이며 가장 높은 성능을 달성하였고, 과소분할 문제를 개선하여 83개의 레이블 데이터를 사용한 지도학습 모델보다 0.8%p 높은 재현율을 나타내었다.","Meniscus allograft transplantation is a primary method for treating damaged meniscus, and accurate segmentation is essential to determine the appropriate size and shape of the graft. However, meniscus segmentation is challenging due to the similar intensity between the meniscus and surrounding structures, as well as the variability in its shape and thickness. In this pape r, we aim to enhance the generalization performance of models on knee MR images and improve segmentation accuracy by effectively accounting for the diverse shapes and thicknesses of the meniscus. To this end, we propose a semi-supervised le arning model capable of effective training even with limited labeled data. Experimental results demonstrate that the proposed method achieved the highest performance with a recall of 93.28%, an F1-score of 90.02%, and a balanced accuracy of 96.4 2%, and by addressing the under-segmentation issue. it achieved a recall that is 0.8%p higher than that of the supervised le arning model trained with 83 labeled data"
듀얼 티처 기반의 3D 준지도 객체 검출 모델 설계,2025,"['Semi-Supervised Learning', '3D Object Detection', 'Autonomous Driving']",,"For safe urban driving in autonomous driving platforms, it is critical not only to develop high-performance object detection methods but also to build a training dataset that accurately reflects the diverse environments and object characteristics present in urban settings. To tackle these challenges, in previous study, we created a multi-class 3D LiDAR dataset that incorporated various urban environments and object types. In this paper, we have developed an efficient 3D semi-supervised object detector based on a dual-teacher framework. In this framework, similar classes are grouped into categories, with each category assigned a teacher. By leveraging these teachers, the student model gradually improves, resulting in an efficient object detector. The experiments on the WOD and KITTI validate the effectiveness of our proposed method, and the results demonstrate that our approach consistently outperforms existing state-of-the-art 3D semi-supervised object detection methods."
메타버스 플랫폼 기반 신체 표현 활동 교육의 창의적 학습 효과와 교육적 융합 가능성 탐구,2025,"['신체 표현 활동', '메타버스 플랫폼', '융합 교육', '창의적 학습', 'Body expression activities', 'Metaverse platform', 'Convergence education', 'Creative learning']","본 연구의 목적은 메타버스 플랫폼을 활용한 신체 표현 활동 교육이 학생들의 자발적 참여와 학업 성취에 미치는 영향을 탐구하고, 디지털 기술과 신체 표현 활동의 융합 가능성을 제시하는 데 있다. 이를 위해 2024년 9월부터 12월까지 연구자가 직접 지도하고 있는 B 대학교에서 진행되었으며, 연구 참여교수 1명, 디지털 전문 교수 1명, 학생 6명으로 구성되었다. 자료 수집은 참여관찰, 심층 면담, 각종 문서자료를 통해 수집하였고, 자료 분석은 귀납적 분석을 실시하였다. 연구 결과는 다음과 같다. 첫째, 메타버스 플랫폼 활용은 신체 표현 활동에서 학생들의 창의적 사고와 학습 몰입을 촉진하였다. 둘째, 디지털 기술과 신체 표현 활동의 융합은 창의적 문제해결 능력과 대인관계 기술을 강화하였다. 셋째, 메타버스 플랫폼 활용은 신체 표현 활동 교육에서 창의적 가능성을 열어주며 자기 주도적 학습 능력을 강화하였다. 연구 결과 및 논의를 바탕으로 메타버스 플랫폼을 활용한 신체 표현 활동 교육의 맞춤형 프로그램 개발, 교사 역량 강화를 위한 연수 프로그램, 교육 가이드라인과 지속적인 연구 및 인프라 구축의 필요성을 제안하였다.","The purpose of this study is to explore the impact of physical expression activity education using the metaverse platform on students’ voluntary participation and academic achievement, and to suggest the possibility of integrating digital technology and physical expression activities. To this end, the study was conducted at University B, which the researcher directly supervises, from September to December 2024, and consisted of one research professor, one digital expert professor, and six students. Data were collected through participant observation, in-depth interviews, and various document materials, and data were analyzed using inductive analysis. The results of the study are as follows. First, the use of the metaverse platform promoted students’ creative thinking and learning immersion in physical expression activities. Second, the fusion of digital technology and physical expression activities enhanced creative problem-solving skills and interpersonal skills. Third, the use of the metaverse platform opened up creative possibilities in physical expression activity education and enhanced self-directed learning skills. Based on the results and discussion of the study, the development of a customized program for physical expression activity education using the metaverse platform, a training program to enhance teacher capacity, educational guidelines, and the need for continuous research and infrastructure construction were proposed."
창업가의 언어적 스타일과 자금조달 성과 간의 관계: 머신러닝 알고리즘을 중심으로,2025,"['크라우드 펀딩', '자금조달', '창업가', '언어적 스타일', 'LIWC', 'Kiva', '머신러닝', 'Crowdfunding', 'Fundraising', 'Founders', 'Linguistic Style', 'LIWC', 'Kiva', 'Machine Learning']",,"Global crowdfunding platforms are growing in popularity as a source of funding for entrepreneurs. Much of the prior research on crowdfunding has focused on project success factors, and an under-researched topic is the linguistic style of founders. A small number of researchers have examined the linguistic characteristics of content within reward-based crowdfunding. According to speech act theory, not only what founders try to convey, but also how they convey it(i.e. their linguistic style) is likely to affect performance. In this study, we use machine learning algorithms to analyze the impact of different founders' linguistic styles on fundraising performance in the crowdfunding context. Specifically, we use latent class analysis(LCA), an unsupervised learning method, to categorize combinations of linguistic styles into classes and analyze whether there are differences in funding performance based on these classes. We also utilize the Random Forest algorithm, a supervised learning method, to predict funding performance and explore the importance and direction of influence of each linguistic style variable based on Shapley value. For the empirical analysis, we collected data from 16,279 campaigns on Kiva, a crowdfunding site. Linguistic style was measured using the linguistic inquiry and word count(LIWC) program. The LCA revealed that four linguistic style tiers were the best fit, and there were significant differences in fundraising performance across tiers. The random forest model predicted fundraising performance relatively accurately(AUC = .71), and the importance of the variables was in the following order: word count, external focus, analytical style, and positive style."
클래스 분할 전략이 화재 감지 딥러닝 모델의  감지 성능에 미치는 영향 분석,2025,"['Fire', 'Smoke', 'Multi-class Detection', 'Single Class Detection', 'Instance Segmentation']","데이터셋 구축은 이미지 기반 지도학습 딥러닝 모델 개발 중 많은 자원이 필요한 작업 중 하나이다. 특히 대상 객체의 비정형성이 크고, 객체 간 구분이 어려울수록 데이터셋 구축에 더 많은 노력이 필요하게 된다. 본 논문은 비정형성이 크고 주변 환경 조건에 따라 객체 간 구분이 어려운 화재 데이터를 대상으로 클래스 분류조건을 달리한 개체형 세그멘테이션 데이터셋을 구축하고, 이를 학습한 세 가지 유형의 딥러닝 모델의 화재 감지 성능을 비교한다: 1) 불과 연기를 분류하는 다중 클래스 감지 모델, 2) 불과 연기를 각각 학습한 단일 클래스 감지 모듈을 통합한 모델, 3) 불과 연기를 단일 클래스로 학습한 모델. 시험데이터에 대한 세 가지 모델의 성능 지표를 평가하였으며, 추론 이미지에 대한 정성적 비교 분석을 함께 수행하였다. 다중 클래스 감지모델의 성능 지표가 가장 높게 나타났으나, 단일 클래스 기반 모델과의 차이가 미소하였고, 개별 추론 이미지 간 비교에서도 두드러진 성능 차이를 확인하기 어려웠다. 비교 분석 결과를 토대로 화재 데이터셋 구축 시 효과적인 클래스 분할 전략을 제시하였다.","Building a dataset is one of the most resource-intensive tasks in dfeveloping image-based supervised deep learning models. The more unstructured the target objects are and the more difficult it is to distinguish between them, the more effort is required to construct the dataset. This study focused on constructing an instance segmentation dataset for fire data, where objects have high irregularity, and distinguishing between them is challenging under varying environmental conditions. The fire detection performance of three types of deep learning models trained on datasets with different class division conditions was compared: (1) a multiclass detection model that classifies fire and smoke, (2) a model integrating single-class detection modules trained separately on fire and smoke, and (3) a single-class model trained on fire and smoke together. The performance metrics of these three models were evaluated using test data, and qualitative comparative analysis of inference images was conducted. Although the multiclass detection model produced the highest performance metrics, the difference from single-class models was minimal, and it was challenging to identify a noticeable performance gap in individual inference images. In conclusion, this paper proposes an effective class division strategy for building fire datasets based on the results of comparative analysis."
