title,date,keywords,abstract,multilingual_abstract
학교 밖 청소년의 진로준비행동 및 학습동기 향상을 위한 인간중심 집단미술치료 사례 연구,2025,"['학교 밖 청소년', '진로준비행동', '학습동기', '인간중심 집단 미술치료', '사례연구', 'out-of-school youth', 'career preparation behavior', 'learning motivation', 'person-centered group art therapy', 'case study']","목적  본 연구는 학교 밖 청소년의 진로준비행동과 학습동기를 향상시키는 데 있어 인간중심 집단미술치료의 효과성을 탐구하는 것을 목적으로 한다.방법  이를 위해 문헌연구와 수퍼비전을 바탕으로 인간중심 집단미술치료 프로그램을 구성하였으며, 경기도 D시에 위치한 K센터를 이용하는 학교 밖 청소년 4명을 대상으로 주 1회, 회기당 90분씩 총 12회기의 인간중심 집단미술치료를 실시하였다. 각 회기별 관찰일지와 작품자료를 수집하고, 사과 따는 사람 그림검사를 활용하여 청소년들의 진로준비행동 및 학습동기 변화를 질적으로 분석하였다.결과  첫째, 인간중심 집단미술치료가 학교 밖 청소년의 진로준비행동과 학습동기에 효과적인 개입 방법이 될 수 있음을 확인할 수 있었다. 둘째, 사과 따는 사람 그림검사의 사전-사후 비교를 통해 미술치료를 통한 자기표현과 집단 내 상호작용이 학교 밖 청소년들의 사회적 기술 향상과 정서적지지 경험에 미친 긍정적 영향을 확인할 수 있었다.결론  본 연구는 인간중심 집단미술치료가 학교 밖 청소년의 진로준비행동과 학습동기 향상에 긍정적인 영향을 미친다는 것을 시사하며, 이는 향후 관련 프로그램 설계 및 실행에 유용한 지침을 제공할 수 있을 것으로 기대된다.","Objectives  The purpose of this study is to explore the effectiveness of person-centered group art therapy in improving career preparation behavior and learning motivation of out-of-school youth.Methods  For this purpose, a human-centered group art therapy program was created based on literature research and supervision, and a human-centered group art therapy program was provided for a total of 12 sessions of 90 minutes per session, once a week, for four out-of-school youth using the K Center located in D-city, Gyeonggi-do. Group art therapy was conducted. Observation logs and work data were collected for each session, and changes in adolescents' career preparation behavior and learning motivation were qualitatively analyzed using the apple picker picture test.Results  First, it was confirmed that person-centered group art therapy can be an effective intervention for enhancing career preparation behaviors and learning motivation in out-of-school youth. Second, through a pre- and post-comparison of the Apple Picking Person Drawing Test, the positive impact of self-expression through art therapy and group interaction on improving social skills and experiencing emotional support among out-of-school youth was confirmed.Conclusions  This study suggests that human-centered group art therapy has a positive effect on improving the career preparation behavior and learning motivation of out-of-school youth, and is expected to provide useful guidelines for the design and implementation of related programs in the future."
글로벌 공급망 위험 감지를 위한 네트워크 기반 뉴스 감성분석 및 스코어링 방법,2025,"['뉴스 기사 감성분석', '네트워크 기반 준지도 학습', '이상 징후 포착', '위험도 스코어링', 'news sentiment analysis', 'network-based semi-supervised learning', 'anomalous sign detection', 'risk scoring']","원부자재 공급망 구조 변화는 관련 국가들의 경제적 위기를 초래하는 중요한 문제로, 신속하게 감지 및 대응하는 것이 중요하다. 과거에는 주가 및 경제지표의 변동성, 수출입 통계, 신용등급, 기업간의 거래관계 등의 경제 지표 분석이 주를 이루었으나, 이러한 방법만으로 공급망 이슈를 조기 탐지하기에 어려움이 있다. 반면, 뉴스는 다방면의 정보를 신속하게 제공해 주며, 특정 이슈에 대한 이상 징후를 내포할 수 있기에 사전 감지에 유리하다는 장점이 있다. 따라서, 본 연구에서는 뉴스 데이터를 활용하여 이슈에 대한 이상 징후를 포착할 수 있는 방법을 제안한다. 이상 징후를 추론하기 위해 뉴스 기사로부터 구축된 단어 및 국가 네트워크가 활용되며, 네트워크 기반 준지도 학습을 적용하여 단어 감성 기반 위험도 스코어링이 이루어진다. 주요 글로벌 이슈를 선정하여 검증한 결과, 특정 이슈의 감성을 모두 알맞게 포착하였고 관련 국가들의 위험도를 효과적으로 정량화하여 신뢰할 만한 결과를 도출하였다.","The structural changes in the raw material supply chain present a significant challenge that can trigger economic crises in affected countries. This highlights the necessity of promptly detecting and responding to these changes. Historically, analysts primarily focused on economic indicators such as stock price volatility, economic indices, trade statistics, credit ratings, and inter -corporate transactions. However, relying solely on these methods often made it difficult to identify supply chain issues at an early stage. In contrast, news provides quick and multifaceted information, which can be advantageous for early detection as it may reveal early signs of specific problems. Therefore, this study proposes a method for identifying anomalous signs of issues using news data. We construct word and country networks based on news articles and apply network-based semi-supervised learning to assess risk levels based on word sentiment. By selecting and verifying major global issues, our method successfully captures the sentiments associated with specific issues and effectively measures the risk levels of the related countries."
생성형 AI의 활용에 따른 저작권 침해와 형사정책적 개선방안,2025,"['Generative AI', 'Copyright Infringement', 'Criminal Liability', 'Fair Use', 'TDM Exceptions', '생성형 AI', '저작권 침해', '형사책임', '공정한 이용', 'TDM 면책 규정']","생성형 AI의 등장은 우리들에게 혁신적인 변화를 가져왔다. 기존의 데이터를 학습하여 ‘새로운’ 결과물을 제공하며, 다양한 분야에서 편리하게 활용되는 도구가 되었다. 기존의 것을 학습하여 창작물을 만들어내는 것은 인간의 창작활동과 유사하나, 학습할 수 있는 자료나 데이터가 없는 이상 결과물을 만들어낼 수 없기에, 인간의 창작물을 필연적으로 이용할 수밖에 없는 구조를 띄고 있다.그에 따라 생성형 AI를 학습시키는 과정에서, 또 생성물을 만들어내기 위해 이용하는 과정에서 기존의 저작물들을 활용할 수밖에 없으므로 복제권, 전송권, 2차적 저작물작성권 등 저작권자의 저작권을 침해하게 된다.이와 관련하여 관련 산업의 활성화와 발전을 위해, 생성형 AI의 학습은 저작권이 제한되는 ‘공정한 이용’에 해당한다고 보거나, 애초에 저작권 침해에 해당하지 않도록 하는 ‘면책 규정’의 도입을 주장하기도 한다.그러나, 생성형 AI의 학습과 이용은 공정한 이용에 따른 저작권 제한 요건에 해당한다고 보기 어렵다. 또, 아직 저작권자 측과 아무런 합의가 이루어지지 않은 상태에서 섣부른 면책 규정 도입은 더 큰 혼란만 가져올 것이다.산업 발전을 이유로 저작권자의 일방적인 희생을 요구할 것이 아니라, 우선은 저작권 침해가 될 수 있는 영역을 명확히 하고, 생성형 AI가 학습한 저작물의 목록을 공개하거나 최소한 저작권자들이 수집 거부를 할 수 있는 권리를 갖춘 후에 면책 규정을 적용할 수 있도록 해야 할 것이다.또한 생성형 AI를 개발하고 운영할 때, 저작권 침해가 발생하지 않도록 꾸준히 관리․감독을 하도록 법적 의무를 부과할 필요가 있다. 그리고 이러한 의무를 다하지 못할 때, 과실로 인한 책임을 지도록 저작권 침해죄에 대한 과실범 처벌 규정이 보완되어야 할 것이다.","The emergence of generative AI has brought about revolutionary changes for us. It has become a tool that is conveniently used in various fields by learning from existing data and providing ‘new’ results. Learning from existing things and creating creative works is similar to human creative activities. However, since it is impossible to create results without learning materials or data, it has a structure that inevitably has to use human creative works.Accordingly, in the process of learning generative AI and in the process of using it to create results, existing works have no choice but to be used, thereby infringing on the copyright holder's copyright.In relation to this, in order to activate and develop related industries, it is argued that the learning of generative AI corresponds to ‘fair use’ subject to copyright restrictions, or that an ‘exception provision’ should be introduced to prevent it from being a copyright infringement in the first place.However, it is difficult to say that the learning and use of generative AI falls under the requirements for copyright restrictions based on fair use. In addition, hasty introduction of exception regulations while no agreement has yet been reached with the copyright holder will only lead to greater confusion.We should not demand unilateral sacrifices from copyright holders in the name of industrial development. First of all, it is necessary to clarify the areas where copyright infringement can occur and to make the list of works learned by generative AI public, or at least allow copyright holders to have the right to refuse collection before applying exception regulations.In addition, when developing and operating generative AI, it is necessary to impose a legal obligation to continuously manage and supervise to prevent copyright infringement. When these obligations are not fulfilled, the provisions for punishment of negligence for copyright infringement should be supplemented to ensure that liability for negligence is assumed."
전자기파 신호분석을 통한 무기체계 부품 이상행위 탐지 연구,2025,"['Hardware Trojan', 'Anomaly Detection', 'Electromagnetic Analysis', 'Side channel analysis', 'FPGA', 'ASIC', '하드웨어 트로이목마', '이상행위 탐지', '전자기파 분석', '부채널 분석', 'FPGA', 'ASIC']","본 논문은 무기체계 및 IoT 장비 부품에서 발생하는 이상행위를 탐지하기 위해 부채널 분석을 이용하여 장비 부품 해체와 같은 파괴적 방법이 아닌 조립된 상태 그대로 검사하는 비파괴적 방법의 적용 가능성을 보였다. 무기체계 부품에서 발생하는 이상행위는 하드웨어 트로이목마 (HT, Hardware Trojan)에 의해 발생하는 것을 의미하며 부채널 분석 방법 중에서도 전자기파 신호분석을 이용하였다. 초기 시험은 HT공유 포털에서 제공하는 암호 모듈인 AES(Advanced Encryption Standard)-128 GM(Golden Model)과 HT들로 시험했으며 대상 하드웨어 플랫폼은 먼저 FPGA(Field Programmable Gate Array)에서, 그 후에는 ASIC(Application Specific Integrated Circuit) 칩을 제작하여 시험하였다. IoT 장비로는 RC 자동차, 무기체계 장비 부품으로는 군통신체계에 사용된 FPGA와 동일한 신규 제품과 시뮬레이션 장비를 이용하여 시험함으로써 무기체계에서 부품 이상 여부를 탐지할 수 있는 기술의 적용 가능성을 보였다.","This paper demonstrates the possibility of a non-destructive method that inspects the assembled state of the equipment circuit rather than a destructive method such as disassembling the equipment circuits, using side-channel analysis to detect abnormal behaviors in weapon systems and IoT equipment circuits. The abnormal behaviors generated in weapon system circuits are caused by hardware Trojans (HTs), and electromagnetic signal analysis was used among the side-channel analysis methods. The initial experiments were conducted with the AES-128 GM, an encryption module provided by the HT sharing portal, and HTs. The target hardware platform was first implemented in the FPGA, and then tested on the manufactured ASIC chip. Initially, the tests were conducted using supervised learning machine learning as an abnormal behavior detection algorithm, and then unsupervised learning deep learning models were used. After proving the possibility with the FPGA and the manufactured ASIC chip, the tests were conducted on the RC car as IoT equipment, and the possibility of the circuit abnormal behavior detection technology was demonstrated by conducting experiments on the same product FPGA applied to the weapon system."
교통사고 감지를 위한 Inflated 3D ConvNet 및 Transformer 기반 향상된 시공간 특징 탐지 모델,2025,"['deep learning', 'anomaly detection', 'traffic accident detection', 'transformer', '.']","영상 기반 모니터링 시스템은 도로 교통 관리, 특히 교통사고 감지에서 중요한 역할을 하지만, 여전히 만족할 만한 성능을 보이지 못하고 있다. 본 연구에서는 보다 정확한 교통사고 감지와 오탐지 감소를 위해 I3D(Inflated 3D ConvNet)와 MHSA(Multi Head Self-Attention) 기반 Transformer 분류기를 결합한 지도학습 기반 이상 상황 탐지 모델을 제안한다. 제안된 기법은 입력 비디오를 세그먼트로 나누고, I3D를 통해 각 세그먼트의 시공간 특징을 추출한 뒤, MHSA로 세그먼트 간 관계를 학습하여 비정상 상황에 대한 특징을 강화하고, 최종적으로 MLP(Multi-Layer Perceptron)을 통해 정상과 비정상 세그먼트를 분류한다. 이를 통해 기존 방식의 정상과 비정상 이벤트의 혼재 문제를 해결하였으며, 기존 접근 방식 대비 최대 5.75% 향상된 AUC 성능을 확인함으로써 제안된 모델의 우수성을 입증하였다.","Video-based monitoring systems play a critical role in various fields, including road traffic management, particularly in the detection of traffic accidents. However, current systems still fall short of achieving satisfactory performance. This study proposes a novel supervised anomaly detection model that combines Inflated 3D ConvNet (I3D) and a Transformer classifier based on Multi Head Self-Attention(MHSA) to enhance traffic accident detection accuracy and reduce false positives. The proposed method segments the input video and extracts spatiotemporal features of each segment through I3D. Subsequently, MHSA is applied to learn inter-segment relationships, thereby emphasizing features associated with anomalous situations, and finally, a Multi-Layer Perceptron(MLP) classifies segments as normal or abnormal. This approach addresses the issue of intermingling normal and abnormal events inherent in traditional anomaly detection methods and demonstrates the model's effectiveness, achieving up to a 5.75% improvement in AUC performance over existing approaches."
TAG-Net: Triple Attention Guided Network for Inspecting Surface Defects on Steel Products,2025,"['Attention mechanisms', 'boundary segmentation', 'semantic segmentation', 'steel manufacturing industry', 'surface defect inspection.']",,"Recent advances in deep learning models for object detection and segmentation have received a lot of attention in various industry applications. However, applying deep learning methods on real world problems has In steel manufacturing industry, unexpected factors cause critical effects on the quality of steel products, and it is required to inspect defects in an early stage to reduce production costs. This paper proposes TAG-Net, a novel attention-based semantic segmentation network aimed at improving the performance for inspecting surface defects on steel products. TAG-Net estimates three attention maps each for background, defects, and boundaries of defects, and we introduce an auxiliary deep supervision to guide the boundaries of defective regions. Experiments were conducted on the NEU-Seg dataset, and experimental results demonstrate that our proposed method significantly outperforms previous methods with a significant margin."
CountGD와 SAM2 모델을 활용한 Zero-shot 정밀 농업 자동 라벨링 시스템,2025,"['automatic labeling', 'deep learning', 'zero shot detection', 'agricultural imagery', '.']",,"In this study, we present a computer vision–based automated labeling system for agricultural environments that seamlessly integrates the CountGD and SAM2 frameworks to achieve efficient and accurate data annotation. Traditional supervised object detection approaches require extensive manual labeling, resulting in substantial costs and delays, while state-of-the-art zero-shot models such as Ground DINO face challenges in differentiating objects in high-density or complex crop environments. To address these limitations, the proposed system leverages natural language prompts for dynamic object detection and labeling. Specifically, the object counting model CountGD is employed to accurately recognize individual objects in intricate scenes, and SAM2 is utilized for refined segmentation and bounding box correction. Moreover, an Effective Region Cropping technique is developed to mitigate issues related to object fragmentation and duplicate detection during image patch processing. Experimental results on high-resolution agricultural images reveal significant improvements in labeling accuracy and efficiency compared to existing zero-shot automated labeling models, thereby facilitating enhanced crop monitoring and management."
Tactile 센서 및 딥러닝 모델 기반 새로운 신체 압력중심점(CoP) 추정 시스템 개발,2025,"['Balance', 'Center of Pressure', 'Tactile Sensor', 'Supervised Learning', 'CNN-Bi-LSTM']",,"The Center of Pressure (CoP) is utilized as an essential indicator for assessing the body’s balance. CoP reflects the state of balance and is important in evaluating balance ability and predicting fall risk. Existing systems are too expensive, less accurate in dynamic conditions, or have limited measurement ability, which is for only the foot’s CoP without fully reflecting the overall body balance. Thus, this study proposes a novel system using Tactile sensors and a deep learning model for less cost and accurately estimating dynamic body CoP. The performance of the suggested CNN-Bi-LSTM model was compared with existing foot CoP estimation models, CNN-LSTM and Bi-LSTM. Model performance was validated using the Leave-One-Out Cross-Validation (LOOCV) method and evaluated with Root-Mean-Squared Error (RMSE) and R² coefficient. The experimental results showed that the CNN-Bi-LSTM model achieved the best performance, with an average RMSE of 7.09 mm in the ML direction and 4.69 mm in the AP direction, and an average R² of 0.99. In comparison, the CNN-LSTM and Bi-LSTM models recorded RMSE values of 11.59 mm and 25.52 mm in the ML direction, and 8.81 mm and 10.90 mm in the AP direction, respectively. Additionally, the RMSE difference value between ML (medio-lateral) and AP (Antero-posterior) was shown to be smaller compared to previous studies on estimating the foot CoP. This result highlights the effectiveness of the CNN-Bi-LSTM model in capturing both spatial and temporal features, surpassing traditional methods and previous models in dynamic conditions. Future research will focus on expanding the system and conducting clinical trials for gait CoP analysis."
온라인 강의 평점 및 수요자 예측을 위한 텍스트 기반 특성 분석: 다중 플랫폼 비교 접근,2025,"['텍스트 마이닝', '평점 예측', '자연어처리', '특징 분석', '준지도 학습', 'Text Mining', 'Rating Prediction', 'Natural Language Processing', 'Feature Analysis', 'Semi-Supervised Learning']",,
유사도 기반 선별적 데이터 활용을 통한 차량 내 비전 시스템의 실시간 적응형 파인튜닝 기법 연구,2025,"['딥 러닝', '자율 주행', '유사도', '지도 학습', '온디바이스 AI (명사와 명사 사이는 띄어쓰세요. 예) 지도 학습)', 'Deep Learning', 'Autonomous Vehicle', 'Similarity', 'Supervised Learning', 'On-Device AI', 'YOLOv8']","최근 차량 내부 비전 시스템은 다양한 주행 상황환경에서의 인식 정확도를 향상시키기높이기 위해 지속적인 데이터 수집과 모델 개선이 요구되고 있다필수적이다. 특히, 차량이 주행 중에 수집되는하는 새로운 데이터에상황에 적응하기 위해 실시간 또는 주기적인 모델 파인튜닝이 중요하다. 그러나 실시간 학습을 위해에 필요한 데이터의 양은 방대하며, 이를 모두 활용하는 것은 연산 자원 및과 저장 공간 측면에서 비효율적일 수 있다. 이에이를 해결하기 위해, 본 연구에서는 주행 중 수집된 데이터 중에서 유사도 알고리즘을 기반으로 선별된 정보만을 활용하여 연산 및 데이터 저장의 효율성을 높인효율적인 실시간 적응형 파인튜닝 기법을 제안한다. 제안하는된 기법은 리소스자원 소모를 줄이면서도 모델 성능을 효과적으로 개선할 수 있으며, 실제 차량 내 환경을 모사한 실험에서 그 효과성을 확인하였다.높은 효율성을 달성하였다.","In-vehicle vision systems increasingly require continuous data collection and model updates to maintain high recognition accuracy across diverse driving conditions. Especially during driving, real-time or periodic fFine-tTuning of models is essential for adapting to new scenarios. However, leveraging all collected data is impractical due to the massive volume and the limitations of computational and storage resources. To address this, we propose a real-time adaptive fFine-tTuning method that selectively utilizes only meaningful data based on similarity analysis from the continuously collected video. This approach effectively improves model performance while minimizing resource usage. Experiments conducted in a simulated in-vehicle environment demonstrate the efficiency and effectiveness of the proposed method."
해상교통 특화 LLM 기반의 멀티모달 종합추론 시스템,2025,"['Multi-Modal Large Language Model(MLLM)', 'Video Question Answering(VQA)', 'Maritime-specialized LLM', 'Supervised Fine-Tuning(SFT)', 'Deep Learning', '멀티 모달 대규모 언어 모델(MLLM)', '비디오 질의-응답(VQA)', '해양 특화 대규모 언어 모델', '지도 학습 미세 조정(SFT)', '딥러닝']",,"The maritime environment plays an economically important role in many industries, including international trade, transportation, resource exploitation, and marine tourism. This economic and industrial importance has led to a surge in interest in autonomous ships and autonomous navigation solutions. The maritime environment contains a lot of specialized information that is different from general data, but there are still limited models and systems that can effectively process such maritime-specific data. To overcome these limitations, this study proposes a multimodal comprehensive reasoning navigation support system for maritime traffic. The proposed system simultaneously processes nautical map videos and front camera navigation videos based on AIS (Automatic Identification System) data, and supports decision-making considering navigation laws and regulations. By complementarily utilizing information from various modalities to build a comprehensive reasoning system that reflects the specificity of the maritime environment, it can provide a safer and more efficient navigation support solution."
