title,date,keywords,abstract,multilingual_abstract
순환신경망 모형을 활용한 시계열 비교예측,2019,"['ARIMA model', 'neural network', 'RNN', 'LSTM.', 'ARIMA 모형', '신경망모형', '순환신경망', 'LSTM.']","최근 알파고 이후 딥러닝 연구에 대한 활발한 연구가 진행되고 있다. 딥러닝에는 이미지 분석에 적합한 CNN(convolution neural network), 순차적 자료에 적합한 RNN(recurrent neural network) 모델 등 많은 모델이 존재하는데 그 중 시계열데이터 분석에 적합한 딥러닝 모델을 전형적 시계열데이터인 항공사 데이터(1949년 1월부터 1960년 12월까지 매월 총 국제 항공사 승객 수)에 Box-Jenkins의 ARIMA 모형과 함께 적합시켜 비교 할 것이다. 본 연구에서는 R 프로그램을 이용하여 LSTM(long short-term memory) 순환신경망 모델을 구축하고, ARIMA 모형, Faraway(1998)가 제시한 단순 신경망(neural network) 모형 그리고 Jordan & Elman의 순환신경망 모형과의 적합도를 비교하였다. 모형 비교결과 Elman 모형의 오차제곱합이 0.0128, Jordan 모형의 오차제곱 합이 0.0138, LSTM 모형의 오차제곱합이 0.0165, 신경망 모형은 오차제곱합 0.0212로 ARIMA 모형의 0.0194 에 비해 조금 뒤떨어지는 것으로 나타났다. 결국 Elman 순환신경망 모형이 가장 우수하게 나타났으며 LSTM 모형도 기존 ARIMA 모형과 Faraway의 단순신경망모형 보다 우수한 적합도를 나타났다.","Typical algorithms for deep learning include DNN (deep neural network), CNN (convolution neural network), and RNN (recurrent neural network) algorithms. Among them, RNN is excellent at dealing with sequential data. Sequential data such as time series data can be handled without losing gradient by LSTM (long short-term memory) RNN. In this study, the LSTM, a modified algorithm of RNN, is applied to international airline passenger data (from January 1, 1994 to December 1960). We find the optimal model and compare it with the ARIMA model, the initial network model presented by Faraway (1998), and the model of Jordan & Elman, the simple RNN model. To compare the models, we train the data as learning data sets from January 1949 to December 1950, and designate the remaining one year of data as test sets. and compare the performance of the model with the sum of square errors of the test sets. The model comparison shows that the Elman RNN model was the best, and that the LSTM model was not inferior to the ARIMA model."
순환신경망 기법을 이용한 스파 플랫폼의 시계열데이터 필터링에 관한 연구,2019,"['데이터 필터링', '순환신경망', '시계열 데이터', '실시간', '필터링 기법', 'Data filtering', 'Recurrent neural network', 'Time series data', 'Real-time', 'Filtering methods']",스마트 선박 (Smart ship)의 개발과 해양 플랫폼의 예지보전 시스템 및 자산 관리 시스템 개발을 위해 방대한 양의계측 데이터를 실시간으로 분석할 수 있는 기술에 대한 관심이 높아지고 있다. 이러한 계측 데이터를 실시간으로 분석하기 위해서는 계측 데이터의 노이즈를 제거하고 필요한 정보를 추출하여 분석에 용이한 형태로 데이터를 가공하는 과정인 데이터 필터링이 반드시 선행되어야 한다. 기존의 조선 해양 산업에서는 일정기간 이상 데이터를 저장한 후 이에대한 분석을 실시하여 스펙트럼 기반의 필터링 기법을 많이 이용하였다. 이러한 방법은 실시간 데이터를 분석해야 하는현 상황에는 적합하지 않아 실시간 데이터를 필터링하기 위한 새로운 기법이 필요한 실정이다. 본 논문에서는 시계열데이터를 학습하기 위한 딥 러닝 모델인 순환신경망 알고리즘을 이용하여 실시간으로 전송되는 데이터를 필터링하고자하였다. 실시간으로 계측되는 스파 플랫폼의 계류 장력 값을 필터링하기 위해 순환신경망 알고리즘을 이용한 필터링 모델을 설계하고 그 결과값을 확인하여 실시간 필터링 가능 여부를 확인하였다. 최종적으로 실시간으로 전송되는 데이터를 필터링 하기 위해 순환신경망 알고리즘을 사용하는 것이 적합하다는 것을 확인하였다.,"There is growing interest in the numerous techniques focused on analyzing vast quantities of measurement data in real time for the development of smart ships along with the development of asset integrity management systems for offshore platforms. To analyze the measurement data in real time, data filtering is used to eliminate the noise in the data and then extract the necessary information to perform a comprehensive data analysis. In the traditional shipbuilding and offshore industry, spectrum-based filtering methods are used because the corresponding data is saved for a certain period and subsequently analyzed. These methods are not suited to the present situation in which real-time data is required to be analyzed. Therefore, a new method for data filtering is required. The objective of this study is to filter data in real time using a recurrent neural network algorithm, which is a deep learning model used for learning time series data. In order to filter the measured mooring tension value of the spa platform in real time, a filtering model comprising a recurrent neural network algorithm was designed, and the results of the data filtering process were verified to confirm the possibility of real- time filtering."
순환신경망을 이용한 태양광 발전량 예측 모델 설계,2019,"['스마트그리드', '순환신경망', '태양광 발전', '예측 모델', 'smart grid', 'recurrent neural network', 'photovoltaic power generation', 'prediction model']","스마트그리드는 태양광 발전을 포함한 신·재생에너지의 발전량을 예측하고 이를 기반으로 효율적인 전력 생산과 소비를 가능하게 한다. 기존 태양광 발전량 예측 연구들은 시계열에 뛰어난 순환신경망 기법들을 적용 및 비교한 연구가 거의 없다. 또한 학습에 사용되는 과거 데이터의 길이에 대한 고려가 없어 모델의 예측 성능이 떨어졌다. 본 연구에서는 임베디드 변수 선택 기법을 이용하여 태양광 발전에 영향을 미치는 요인을 찾아내고, 시계열 순환신경망 기법들(RNN, LSTM. GRU)에 다양한 과거 데이터 길이를 넣는 실험을 진행하였다. 이 과정에서 가장 뛰어난 성능을 보이는 예측 요인들을 찾고 예측 모델을 설계하였다. 설계한 태양광 발전량 예측 모델은 다른 변수 설정을 사용할 때와 비교하여 더욱 뛰어난 예측 성능을 보이는 것을 확인하였다. 또한 기존 연구들과의 비교를 통하여 본 연구에서 개발한 태양광 발전량 예측 결과가 더 뛰어난 성능을 보이는 것을 확인하였다.","The Smart Grid predicts the power generation amount of renewable energy and enables efficient power generation and consumption. Existing PV power generation prediction studies have rarely applied and compared recurrent neural network techniques that are superior to time series.Furthermore, in the reported studies, there is no consideration of the length of past data used for learning, leading to lowered prediction performance of the model. In this study, we used the embedded variable selection techniques to find the factors influencing PV power generation. Subsequently, experiments were carried out to insert various past data length into the recurrent neural networks (RNN, LSTM, GRU). We found the optimal prediction factors and designed a prediction model based on the outcomes of the experiments. The designed PV power generation prediction model shows better prediction performance compared to other factor settings. In addition, better performance based on the prediction rate is confirmed in the present study as compared with the existing researches."
순환신경망을 이용한 제주지역 겨울철 저층윈드시어 예측,2019,"['ensemble prediction', 'long short-term memory', 'low-level wind shear', 'recurrent neural network', '앙상블 예측', '장기 단기 메모리', '저층윈드시어', '순환신경망']",,"Ensemble verification and prediction of low-level wind shear (LLWS) are an important matter for airplane landing and management. In this study, we compared the prediction performance of LLWS forecasts of ensemble mean, multiple regression model and long short-term memory (LSTM), which belong to the family of recurrent neural network based on the grid points over the Jeju area. The prediction skills of methods were compared by mean absolute error. We found that the prediction skills of forecasts of LSTM were better than the bias-corrected forecasts in terms of deterministic prediction."
LSTM 순환 신경망을 이용한 초음파 도플러 신호의 음성 패러미터 추정,2019,['LSTM (Long Short Term Memory)'],,"In this paper, a method of estimating speech parameters for ultrasonic Doppler signals reflected from the articulatory muscles using LSTM (Long Short Term Memory) RNN (Recurrent Neural Networks) was introduced and compared with the method using MLP (Multi-Layer Perceptrons). LSTM RNN were used to estimate the Fourier transform coefficients of speech signals from the ultrasonic Doppler signals. The log energy value of the Mel frequency band and the Fourier transform coefficients, which were extracted respectively from the ultrasonic Doppler signal and the speech signal, were used as the input and reference for training LSTM RNN. The performance of LSTM RNN and MLP was evaluated and compared by experiments using test data, and the RMSE (Root Mean Squared Error) was used as a measure. The RMSE of each experiment was 0.5810 and 0.7380, respectively. The difference was about 0.1570, so that it confirmed that the performance of the method using the LSTM RNN was better."
음성 신호와 심층 잔류 순환 신경망을 이용한 파킨슨병 진단,2019,[],,"Parkinson's disease, one of the three major diseases in old age, has more than 70 % of patients with speech disorders, and recently, diagnostic methods of Parkinson's disease through speech signals have been devised. In this paper, we propose a method of diagnosis of Parkinson's disease based on deep residual gated recurrent neural network using speech features. In the proposed method, the speech features for diagnosing Parkinson's disease are selected and applied to the deep residual gated recurrent neural network to classify Parkinson's disease patients. The proposed deep residual gated recurrent neural network, an algorithm combining residual learning with deep gated recurrent neural network, has a higher recognition rate than the traditional method in Parkinson's disease diagnosis."
원자력발전소 기동 및 정지 운전을 위한 순환 신경망 기반 인공지능 프레임워크 개발,2019,"['automation system', 'nuclear power plant', 'artificial intelligence', 'deep learning']",,"In order to reduce operator workload from startup and shutdown operations for existing Nuclear Power Plants (NPPs), it is necessary to develop an automation system based on deep learning, the leading approach in current Artificial Intelligence (AI) technology. From existing research, it is challenging to develop an automation system using conventional machine learning for startup and shutdown operation since the automation system needs to be able to handle many instances of both monitoring and control variables in NPPs. Deep learning is able to simulate a variety of operating actions based on the experience of each operator. In this study, an AI framework for an automation system for startup operation in NPPs has been developed using a Recurrent Neural Network (RNN), which is a robust deep learning method for time series analysis. A feasibility study for an AI framework for the automation system is conducted using a Compact Nuclear Simulator (CNS) based on Westinghouse three-loop NPPs. The target scenario for the feasibility study is operation under bubble creation conditions in a pressurizer under startup."
가중치 손실 함수를 가지는 순환 컨볼루션 신경망 기반 주가 예측,2019,"['인공지능', '순환 컨볼루션 신경망', '주가 예측', '가중치 손실 함수', 'Artificial Intelligence', 'Recurrent Convolution Neural Network', 'Stock Price Prediction', 'Weighted Loss Function']",,"This paper proposes the stock price prediction based on the artificial intelligence, where the model with recurrent convolution neural network (RCNN) layers is adopted. In the motivation of this prediction, long short-term memory model (LSTM)-based neural network can make the output of the time series prediction. On the other hand, the convolution neural network provides the data filtering, averaging, and augmentation. By combining the advantages mentioned above, the proposed technique predicts the estimated stock price of next day. In addition, in order to emphasize the recent time series, a custom weighted loss function is adopted. Moreover, stock data related to the stock price index are adopted to consider the market trends. In the experiments, the proposed stock price prediction reduces the test error by 3.19%, which is over other techniques by about 19%."
시계열 자료의 예측을 위한 자료 기반 신경망 모델에 관한 연구: 한강대교 수위예측 적용,2019,"['Prediction of water surface elevation', 'Artificial Neural Networks', 'Recurrent Neural Networks', 'NARX model', 'Data Driven Model', 'Social Infrastructure', '수위예측', '인공신경망(ANN)', '순환신경망(RNN)', 'NARX 신경망 모형', '자료기반 모형', '사회기반시설']","최근 이상기후로 인한 집중호우에 따른 하천변 사회기반시설의 침수피해가 증가하고 있으며, 침수 가능성 여부에 대한 신속한 예·경보가 필요한 실정이다. 일반적인 홍수 예·경보는 하천수위를 이용하고 있으며, 수치모형을 이용하여 하천수위를 예측하는 연구가 대부분이었다. 그러나 수치모형을 이용한 하천수위 예측은 결과가 정확한 반면 수치모의 시간이 오래 소요된다는 한계점이 있어 최근에는 인공신경망 등을 적용한 자료기반의 수위예측 모형이 많이 이용되고 있다. 하지만 기존의 인공신경망을 활용한 수위예측 연구는 시간적 매개변수를 고려하지 못하였다는 한계점이 존재한다. 본 연구에서는 시간적 매개변수(Time delay= 2시간)를 고려한 NARX 신경망 모형을 사용하여 한강대교의 수위를 예측하였다. 또한 NARX 모형의 적합성을 판단하기 위하여 인공신경망(ANN) 모형과, 순환신경망(RNN)모형의 결과와 비교하였다. 2009년에서 2018년까지 10년간의 수문자료를 이용하여 70%를 학습시키고 검정과 평가에 15%를 사용하여 2018년의 한강대교 3시간 후 수위를 예측한 결과 평균제곱근오차(RMSE)의 경우 ANN, RNN, NARX model이 각 각 0.20 m, 0.11 m, 0.09 m, 평균절대오차(MAE)의 경우, 각각 0.12 m, 0.06 m, 0.05 m, 첨두수위 오차(Peak Error)는 각각 1.56 m, 0.55 m, 0.10 m로 나타났다. 연구 대상지역에 대한 시간적 매개변수를 고려한 예측 결과의 오차분석을 통하여 NARX 신경망 모형을 사용 하는 것이 수위예측 모형 구축이 가장 적합한 것으로 나타났다. 이는 NARX 신경망 모형이 과거의 입력자료를 고려함으로써 시계열 자료의 변동 추세도 학습 할 수 있으며, 또한 모형 내 활성함수를 쌍곡선탄젠트(Hyperbolic tangent) 및 Rectified Linear Unit(ReLU) 함 수를 사용하여 고수위 예측 시에도 정확한 예측 값을 도출할 수 있기 때문이다. 그러나 NARX 신경망 모형은 시퀀스 길이가 길어짐에 따라 기울기 소실문제(Vanishing gradient)가 발생하는 한계점이 있어 향후에는 이를 보완한 LSTM(Long Short Term Model)모형을 이용하여 수위예측의 정확도를 검토하고자 한다.","Recently, as the occurrence frequency of sudden floods due to climate change increased, the flood damage on riverside social infrastructures was extended so that there has been a threat of overflow. Therefore, a rapid prediction of potential flooding in riverside social infrastructure is necessary for administrators. However, most current flood forecasting models including hydraulic model have limitations which are the high accuracy of numerical results but longer simulation time. To alleviate such limitation, data driven models using artificial neural network have been widely used. However, there is a limitation that the existing models can not consider the time-series parameters. In this study the water surface elevation of the Hangang River bridge was predicted using the NARX model considering the time-series parameter. And the results of the ANN and RNN models are compared with the NARX model to determine the suitability of NARX model. Using the 10-year hydrological data from 2009 to 2018, 70% of the hydrological data were used for learning and 15% was used for testing and evaluation respectively. As a result of predicting the water surface elevation after 3 hours from the Hangang River bridge in 2018, the ANN, RNN and NARX models for RMSE were 0.20 m, 0.11 m, and 0.09 m, respectively, and 0.12 m, 0.06 m, and 0.05 m for MAE, and 1.56 m, 0.55 m and 0.10 m for peak errors respectively. By analyzing the error of the prediction results considering the time-series parameters, the NARX model is most suitable for predicting water surface elevation. This is because the NARX model can learn the trend of the time series data and also can derive the accurate prediction value even in the high water surface elevation prediction by using the hyperbolic tangent and Rectified Linear Unit function as an activation function. However, the NARX model has a limit to generate a vanishing gradient as the sequence length becomes longer. In the future, the accuracy of the water surface elevation prediction will be examined by using the LSTM model."
온도와 강수를 이용하여 일별 일사량을 추정하기 위한 심층 신경망 모델 개발,2019,"['Solar radiation', 'Deep neural network', 'Temperature', 'Precipitation']","일사량은 자연 생태계와 농업 생태계에서 에너지 수지와 물 순환을 추정하는데 중요한 변수이다. 일별 일사량을 추정하기 위해 심층 신경망(DNN) 모델이 개발되었다. 일조시간 등의 변수보다 기상 관측소에서의 가용성이 더 높은 온도와 강수량이 심층 신경망 모델의 입력 자료로 사용되었다. five-fold cross-validation 을 사용하여 심층 신경망을 훈련시키고 검증하였다. 국내 15 개의 기상 관측소에서 30 년 이상 장기간의 기상 자료가 수집되었다. Cross-validation을 통해 얻어진 심층 신경망 모델은 수원 지역 기상관측소의 일별 일사량 추정치에 대해 비교적 작은 RMSE(3.75 MJ m-2 d-1) 값을 가졌다. 심층 신경망 모델은 수원 지역 기상 관측소의 일사량의 변위의 약 68%를 설명했다. 1985 년과 1998 년의 일사량 관측값은 일조시간에 비해 상당히 낮은 값이 관측되었다. 이는 후속 연구에서 일사량 관측 데이터의 품질 평가가 필요할 것임을 시사했다. 해당 연도의 데이터를 분석에서 제외했을 때, 심층 신경망 모델의 추정값은 통계적 수치가 약간 높게 나타났다. 예를 들어, R2 와 RMSE 의 값은 각각 0.72 와 3.55 MJ m-2 d-1 이었다. 심층 신경망 모델은 기온과 강수량을 통해 일사량을 추정하는데 유용하며, 이는 미래 기후 시나리오 자료에 대해서 활용할 수 있을 것이다. 따라서, 공간에 대한 제약이 완화된 심층 신경망 모델은 작물 모델의 입력 자료로 일사량이 필요한 작물 생산성에 대한 기후 변화 영향 평가에 유용하게 활용될 수 있을 것이다.","Solar radiation is an important variable for estimation of energy balance and water cycle in natural and agricultural ecosystems. A deep neural network (DNN) model has been developed in order to estimate the daily global solar radiation. Temperature and precipitation, which would have wider availability from weather stations than other variables such as sunshine duration, were used as inputs to the DNN model. Five-fold cross-validation was applied to train and test the DNN models. Meteorological data at 15 weather stations were collected for a long term period, e.g., > 30 years in Korea. The DNN model obtained from the cross-validation had relatively small value of RMSE (3.75 MJ m-2 d-1) for estimates of the daily solar radiation at the weather station in Suwon. The DNN model explained about 68% of variation in observed solar radiation at the Suwon weather station. It was found that the measurements of solar radiation in 1985 and 1998 were considerably low for a small period of time compared with sunshine duration. This suggested that assessment of the quality for the observation data for solar radiation would be needed in further studies. When data for those years were excluded from the data analysis, the DNN model had slightly greater degree of agreement statistics. For example, the values of R2 and RMSE were 0.72 and 3.55 MJ m-2 d-1, respectively. Our results indicate that a DNN would be useful for the development a solar radiation estimation model using temperature and precipitation, which are usually available for downscaled scenario data for future climate conditions. Thus, such a DNN model would be useful for the impact assessment of climate change on crop production where solar radiation is used as a required input variable to a crop model."
음성 분류 인공신경망을 활용한 자폐아 치료용 로봇의 지능화 동작 연구,2019,"['Autism Spectrum Disorders', 'Autistic Children Training', 'MFCC', 'Convolutional Neural Network', 'Speech Data Classification']",현재 아이들의 자폐스펙트럼장애 유병률이 한층 더 높게 보고되고 있으며 다양한 형태의 장애 징후를 보이고 있다. 특히 이들은 사회적 의사소통 영역에서 의사소통장애로 인한 대화에 어려움을 겪고 있으며 이를 훈련을 통해 개선 시킬 필요가 대두된다. 이를 위해 본 연구에서는 사전 연구를 통해 설계된 로봇에 장착된 마이크를 통해 음성 정보를 취득하고 이러한 정보를 이용하여 지능적인 동작을 만드는 방식을 제안한다. 음성 정보를 로봇 동작으로 분류하기 위해 인공신경망을 이용하였으며 여러 신경망 기법중 합성곱 방식을 기본으로 한 순환신경망을 결합하여 정확도를 향상시키려고 하였다. 입력 음성 데이터의 전 처리는 MFCC를 이용하여 분석하였으며 여러 데이터 정규화 및 인공신경망 최적화 기법을 활용하여 로봇의 동작을 추정하였다. 아울러 설계된 인공신경망은 기존에 사용한 구조 및 사람이 개입하여 분석하는 방법과의 정확도 비교 실험을 진행하여 분석 결과가 높은 정확도를 나타냈다. 향후 보다 높은 정확도를 가질 수 있는 로봇 동작을 설계하여 실제의 자폐아 치료 및 교육환경에서 적용할 수 있기 위하여 다양한 형태의 데이터를 수집하고 효율적으로 전처리하는 방식에 대한 연구가 요구된다.,"Currently, the prevalence of autism spectrum disorders in children is reported to be higher and shows various types of disorders. In particular, they are having difficulty in communication due to communication impairment in the area of social communication and need to be improved through training. Thus, this study proposes a method of acquiring voice information through a microphone mounted on a robot designed through preliminary research and using this information to make intelligent motions. An ANN(Artificial Neural Network) was used to classify the speech data into robot motions, and we tried to improve the accuracy by combining the Recurrent Neural Network based on Convolutional Neural Network. The preprocessing of input speech data was analyzed using MFCC(Mel-Frequency Cepstral Coefficient), and the motion of the robot was estimated using various data normalization and neural network optimization techniques. In addition, the designed ANN showed a high accuracy by conducting an experiment comparing the accuracy with the existing architecture and the method of human intervention. In order to design robot motions with higher accuracy in the future and to apply them in the treatment and education environment of children with autism."
인공신경망을 적용한 악성 댓글 분류 모델들의 성능 비교,2019,"['인공신경망', '순환신경망', '악성 댓글', '분류모델 성능비교', 'Artificial Neural Network', 'Recurrent Neural Network', 'Malicious Comment', 'Comparison Performance']",,"Victims of malicious comments are increasing from the public figures including celebrities to personal social network users. Furthermore, users who only use comments can be the victim. This study used the malicious comment classification model applied with artificial neural network to compare the performance of 12 models applied 4 preprocessing methods including [noun], [noun+adjective], [noun+adjective+verb], and [all parts of speech] and 3 algorithms of RNN, LSTM, GRU. The study result would be the reference for successful introduction of AI algorithm-based text categorization service."
