title,date,keywords,abstract,multilingual_abstract
딥 러닝을 이용한 주택가격 예측에 관한 연구,2019,"['주택매매가격', '비선형', '예측', '딥 러닝', '순환신경망(RNN)', 'Housing Price', 'Nonlinear', 'Prediction', 'Deep Learning', 'Recurrent Neural Network']",,"The purpose of this study is to estimate housing prices using deep running. The simple RNN, LSTM, and GRU models, which are evaluated to be suitable for time series forecasting, are based on the time series data of apartment real price index, interest rate, household loan, building permit area and consumer price index. As a result of the empirical analysis, it is confirmed that the prediction power of the GRU model is superior to that of the learning data by evaluating the performance of forecasting power on apartment real price index based on the RMSE value. On the other hand, in the verification data, it is confirmed that the prediction power of the RNN model is excellent. Also, if the performance of the deep running model is evaluated with accuracy, the accuracy of the RNN model and the GRU model is the highest. As a result of this study, the government needs to build and develop a system that can predict and diagnose the housing market by using the deep learning technique that combines artificial neural network and big data to advance the housing market."
딥 러닝 기법을 이용한 레이더 신호 분류 모델 연구,2019,"['Deep Learning(딥 러닝)', 'Convolutional Neural Network(컨볼루션 신경망)', 'Recurrent Neural Network(순환신경망)', 'Radar Signal Classification(레이더 신호 분류)', 'Electronic Warfare(전자전)']",,"Classification of radar signals in the field of electronic warfare is a problem of discriminating threat types by analyzing enemy threat radar signals such as aircraft, radar, and missile received through electronic warfare equipment. Recent radar systems have adopted a variety of modulation schemes that are different from those used in conventional systems, and are often difficult to analyze using existing algorithms. Also, it is necessary to design a robust algorithm for the signal received in the real environment due to the environmental influence and the measurement error due to the characteristics of the hardware. In this paper, we propose a radar signal classification method which are not affected by radar signal modulation methods and noise generation by using deep learning techniques."
CNN과 Bidirectional LSTM을 활용한 부산시 민원 자동 분류 연구,2019,"['automatic text classification', 'civil complaint', 'CNN', 'bidirectional LSTM', 'bi－LSTM', '민원', '자동분류', '딥러닝', '순환신경망', '양방향 LSTM', 'CNN']","온라인과 정보통신기술의 발달로 정부정책에 대한 시민의 참여 욕구는 높아지고 있다. 이에 따라 시민들은 민원을 인터넷과 모바일을 활용하여 전자 민원 게시판을 통해 접수하는 건수가 증가하고 있다. 폭발적으로 늘어나는 민원의 양에 비해 아직 수작업으로 분류 하여 오류가 발생하거나 신속한 대응이 이루어지지 않아 민원인들의 불만이 늘어나고 있다. 본 연구에서는 딥러닝 기법을 통해 담당 부서 분류를 자동화하기 위해 2017년도의 부산시 민원 데이터를 수집하고, 담당 부서를 확인 할 수 있는 부서명, 전화번호, 담당자명을 기준으로 레이블을 부여하였다. 그리고 딥러닝 중 대표적인 분류방법인 CNN과 최근 여러 분야에서 두각을 내고 있는 Bidirectional LSTM을 기반으로 상위 12개 범주에 대하여 지도학습을 실시하였다. 지도학습 결과 각각 73%, 77%의 정확도를 보여 안정적인 성능을 보여주었다. 본 연구의 민원 분류에 대한 지도학습 사례는 향후 다른 주제 및 지방자치단체 민원에 대한 텍스트 데이터의 분류에 이용될 수 있어 실무적인 공헌도와 함께 후속연구를 유발할 수 있다는 학문적 기여도가 있다.",
개인신용정보 표본DB 기반의 대출 현황 분석 및 채무불이행 예측성능 비교,2019,"['statistic analysis', 'default predict', 'credit information', 'recurrent neural network', 'machine learning', '통계 분석', '채무불이행 예측', '신용정보', '순환신경망', '기계학습']","본 논문은 한국신용정보원의 신용정보 표본DB 시범서비스의 일환인 개인신용정보 표본DB를 이용하여 차주들의 성별, 연령, 기준월, 업권 등에 따른 대출 및 채무불이행 현황을 분석하고 통계자료를 제시한다. 또한, 국내외 은행은 대출 차입자의 채무불이행에 따른 손실을 최소화하는데 주목하고 있음에 따라 개인신용정보 표본DB를 사용하여 차주의 채무불이행을 예측 모델을 생성하고 성능을 평가한다. 특정 달의 채무불이행을 예측하기 위하여 직전 6개월의 차주의 정보 및 대출 정보를 가공하여 특징 데이터를 생성하고 Recurrent Neural Network와 기계학습 알고리즘을 사용하여 채무불이행 예측 모델을 생성하였다. 각 모델의 성능 측정 결과, Recurrent Neural Network가 채무불이행 차주에 대한 Recall이 0.96, AUC가 0.85로 가장 좋은 성능을 보였다.","In this paper, we analyze the status of loans and defaults and present statistical data according to the borrower's gender, age, month, etc. by using the personal credit information sample database offered as a trial service from Korea Credit Information Services. In addition, since domestic and foreign banks are paying attention to minimize the loss caused by default of the borrower, we used the personal credit information sample database to create a predicting model of borrower default and evaluated the model performance. To predict the default for a certain month, the borrower's demographic information and loan information for the previous six months were processed to generate characteristic data, and a default prediction model was created using Recurrent Neural Network and machine learning algorithm. Based on the performance of each model, Recurrent Neural Network was showed as the model to demonstrate the best performance with Recall of 0.96 and AUC of 0.85 for the default borrower."
어텐션 알고리듬 기반 양방향성 LSTM을 이용한 동영상의 압축 표준 예측,2019,"['Deep Learning', 'Attention algorithm', 'LSTM', 'NLP', 'Codec']","본 논문에서는 어텐션 알고리듬 (attention algorithm) 기반의 양방향성 LSTM (bidirectional long short-term memory; BLSTM) 을 동영상의 압축 표준을 예측하기 위해 사용한다. 자연어 처리 (natural language processing; NLP) 분야에서 순환적 신경망 (recurrent neural networks; RNN) 의 구조를 이용하여 문장의 다음 단어를 예측하거나 의미에 따라 문장을 분류하거나 번역하는 연구들은 계속되어왔고, 이는 챗봇, 음성인식 스피커, 번역 애플리케이션 등으로 상용화되었다. LSTM 은 RNN에서 gradient vanishing problem 을 해결하고자 고안됐고, NLP 분야에서 유용하게 사용되고 있다. 제안한 알고리듬은 BLSTM과 특정 단어에 집중하여 분류할 수 있는 어텐션 알고리듬을 자연어 문장이 아닌 동영상의 비트스트림에 적용해 동영상의 압축 표준을 예측하는 것이 가능하다.",
인공지능 기반 전력량예측 기법의 비교,2019,"['Demand Forecast', 'Deep Learning', 'MLP', 'RNN', 'LSTM']","최근 안정적인 전력수급과 급증하는 전력수요를 예측하는 수요예측 기술에 대한 관심과 실시간 전력측정을 가능하게 하는 스마트 미터기의 보급의 증대로 인해 수요예측 기법에 대한 연구가 활발히 진행되고 있다. 본 연구에서는실제 측정된 가정의 전력 사용량 데이터를 학습하여 예측결과를 출력하는 딥 러닝 예측모델 실험을 진행한다. 그리고본 연구에서는 데이터 전처리 기법으로써 이동평균법을 도입하였다. 실제로 측정된 데이터를 학습한 모델의 예측량과실제 전력 측정량을 비교한다. 이 예측량을 통해서 전력공급 예비율을 낮춰 사용되지 않고 낭비되는 예비전력을 줄일수 있는 가능성을 제시한다. 또한 본 논문에서는 같은 데이터, 같은 실험 파라미터를 토대로 세 종류의 기법: 다층퍼셉트론(Multi Layer Perceptron, MLP), 순환신경망(Recurrent Neural Network, RNN), Long Short Term Memory(LSTM)에 대해 실험을 진행하여 성능을 평가한다. 성능평가는 MSE(Mean Squared Error), MAE(Mean Absolute Error)의 기준으로 성능평가를 진행했다.","Recently, demand forecasting techniques have been actively studied due to interest in stable power supply with surging power demand, and increase in spread of smart meters that enable real-time power measurement. In this study, we proceeded the deep learning prediction model experiments which learns actual measured power usage data of home and outputs the forecasting result. And we proceeded pre-processing with moving average method. The predicted value made by the model is evaluated with the actual measured data. Through this forecasting, it is possible to lower the power supply reserve ratio and reduce the waste of the unused power. In this paper, we conducted experiments on three types of networks: Multi Layer Perceptron (MLP), Recurrent Neural Network (RNN), and Long Short Term Memory (LSTM) and we evaluate the results of each scheme. Evaluation is conducted with following method: MSE(Mean Squared Error) method and MAE(Mean Absolute Error)."
조건적 제한된 볼츠만머신을 이용한 중기 전력 수요 예측,2019,"['Smart grid', 'Learning Algorithm', 'Energy Demand Forecast', 'RBM', 'CRBM']",미래에 스마트 그리드 도입을 위해 전력수요예측은 중요한 연구 분야 중 하나이다. 하지만 전력데이터는 많은 외부적 요소들에 영향을 받기 때문에 예측하기 어렵다. 기존의 전력수요예측 방법들은 가공되지 않은 전력데이터를 그대로 이용하기 때문에 정확도 높은 예측을 하는데 한계가 있어왔다. 본 논문에서는 가공되지 않은 전력데이터를 이용하는 전력수요예측의 문제를 해결하기 위해 확률기반 학습알고리즘을 제안한다. 확률 모델은 전력데이터의 확률적 특성을 분석하기에 적합하다. 제안한 모델의 중기 전력수요예측 성능을 비교하기 위해 신경망 네트워크 중 하나인 순환신경망과 성능 비교를 해보았다. 매사추세츠 대학에서 제공한 전력데이터를 이용하여 성능 비교를 한 결과 본 논문에서 제안한 확률기반 학습알고리즘이 중기 수요예측에 더 좋은 성능을 나타냄을 확인하였다.,"Electric power demand forecasting is one of the important research areas for future smart grid introduction. However,It is difficult to predict because it is affected by many external factors. Traditional methods of forecasting power demandhave been limited in making accurate prediction because they use raw power data. In this paper, a probability-basedCRBM is proposed to solve the problem of electric power demand prediction using raw power data. The stochastic modelis suitable to capture the probabilistic characteristics of electric power data. In order to compare the mid-term powerdemand forecasting performance of the proposed model, we compared the performance with Recurrent NeuralNetwork(RNN). Performance comparison using electric power data provided by the University of Massachusetts showedthat the proposed algorithm results in better performance in mid-term energy demand forecasting."
Self-Attention을 활용한 Siamese CNN-Bidirectional LSTM 기반 문장 유사도 예측,2019,"['자연어 처리', '유사도 측정', '샴 네트워크', '합성곱 신경망', '순환 신경망', '어텐션', 'natural language processing', 'similarity measure', 'siamese network', 'convolution neural network', 'recurrent neural network', 'attention']",본 논문에서는 입력된 두 문장의 유사도를 측정하는 딥러닝 모델을 제안한다. 기존의 문장의유사도 측정 모델에는 단어 혹은 형태소 단위로 문장을 분해하여 임베딩 하는 방식을 활용한다. 하지만 이는 사전의 크기를 증가시켜 모델의 복잡도를 높이는 문제점이 있다. 본 논문에서는 문장을 음소 단위로 분해하여 모델 복잡도를 줄이고 해당 음소를 묶어주는 다양한 필터 사이즈의 1D Convolution Neural Network와 Long Short Term Memory(LSTM)을 결합한 Siamese CNN-Bidirectional LSTM 모델을 제안한다. 본 모델을 평가하기 위해 네이버 지식인 데이터를 활용하여 기존의 문서 유사 측정에서 좋은 성능을 보이는 모델 Manhattan LSTM(MaLSTM)과 비교하였다.,"A deep learning model for semantic similarity between sentences was presented. In general, most of the models for measuring similarity word use level or morpheme level embedding.However, the attempt to apply either word use or morpheme level embedding results in higher complexity of the model due to the large size of the dictionary. To solve this problem, a Siamese CNN-Bidirectional LSTM model that utilizes phonemes instead of words or morphemes and combines long short term memory (LSTM) with 1D convolution neural networks with various window lengths that bind phonemes is proposed. For evaluation, we compared our model with Manhattan LSTM (MaLSTM) which shows good performance in measuring similarity between similar questions in the Naver Q&A dataset (similar to Kaggle Quora Question Pair)."
인공지능 기반의 행동인식을 통한 개인 운동 트레이너 구현의 방향성 제시,2019,"['Healthcare', 'Fitness', 'Artificial Intelligence', 'Deep Running', 'CNN', 'RNN', '헬스케어', '피트니스', '인공지능', '딥러닝', '합성곱 신경망', '순환 신경망']","최근 딥러닝을 비롯한 인공지능 기술의 활용이 다양한 분야에서 활발해지고 있으며, 특히 딥러닝 기술 기반의 객체 인식 및 검출에 뛰어난 성능을 보이는 여러 알고리즘들이 발표되고 있다. 이에 본 논문에서는 사용자의 편의성이 효과적으로 반영된 모바일 헬스케어 애플리케이션 구현에 대한 적절한 방향성을 제시하고자 한다. 기존의 피트니스 애플리케이션들에 대한 이용 만족도 연구 및 모바일 헬스케어 애플리케이션에 대한 현황을 파악하여, 이로부터 피트니스 애플리케이션 시장에서의 생존과 우위를 확보하는 동시에, 최근 주목 받고 있는 인공지능 기술의 효과적인 적용에 의한 성능 개선을 통해 기존 이용자 유지 및 확대를 도모하고자 한다.","Recently, the use of artificial intelligence technology including deep learning has become active in various fields. In particular, several algorithms showing superior performance in object recognition and detection based on deep learning technology have been presented. In this paper, we propose the proper direction for the implementation of mobile healthcare application that user's convenience is effectively reflected. By effectively analyzing the current state of use satisfaction research for the existing fitness applications and the current status of mobile healthcare applications, we attempt to secure survival and superiority in the fitness application market, and, at the same time, to maintain and expand the existing user base."
BCI에서 EEG 기반 효율적인 감정 분류를 위한 LSTM 하이퍼파라미터 최적화,2019,"['BCI(Brain Computer Interface)', 'EEG(Electroencephalography)', 'Emotion', 'LSTM-RNN 뇌 컴퓨터 인터페이스', '뇌파', '감정', '장단기 기억 구조 순환 신경망']","감정은 인간의 상호 작용에서 중요한 역할을 하는 심리 생리학적 과정이다. 감성 컴퓨팅은 감정을 이해하고 조절할 수 있는 인간 인지 인공 지능의 개발하는데 중점을 둔다. 우울증, 자폐증, 주의력 결핍 과잉 행동 장애 및 게임 중독과 같은 정신 질환이 감정과 관련되어 있기 때문에 이러한 분야의 연구가 중요하다. 감정 인식에 대한 노력에도 불구하고, 비정상적인 EEG 신호로부터의 감정 검출은 여전히 높은 수준의 추상화를 요구하기에 정교한 학습 알고리즘이 필요하다. 이 논문에서는 EEG 기반으로 효율적인 감정 분류를 위해 LSTM을 위한 최적의 하이퍼파라미터를 파악하고자 다양한 실험을 수행하여 이를 분석한 결과를 제시하였다.","Emotion is a psycho-physiological process that plays an important role in human interactions. Affective computing is centered on the development of human-aware artificial intelligence that can understand and regulate emotions. This field of study is also critical as mental diseases such as depression, autism, attention deficit hyperactivity disorder, and game addiction are associated with emotion. Despite the efforts in emotions recognition and emotion detection from nonstationary, detecting emotions from abnormal EEG signals requires sophisticated learning algorithms because they require a high level of abstraction. In this paper, we investigated LSTM hyperparameters for an optimal emotion EEG classification. Results of several experiments are hereby presented. From the results, optimal LSTM hyperparameter configuration was achieved."
CTC를 적용한 CRNN 기반 한국어 음소인식 모델 연구,2019,"['Phoneme Recognition', 'CTC Algorithm', 'Convolutional Neural Network', 'Recurrent Neural Network', '음소 인식', 'CTC 알고리즘', '합성곱 신경망', '순환 신경망']",,"For Korean phoneme recognition, Hidden Markov-Gaussian Mixture model(HMM-GMM) or hybrid models which combine artificial neural network with HMM have been mainly used. However, current approach has limitations in that such models require force-aligned corpus training data that is manually annotated by experts. Recently, researchers used neural network based phoneme recognition model which combines recurrent neural network(RNN)-based structure with connectionist temporal classification(CTC) algorithm to overcome the problem of obtaining manually annotated training data. Yet, in terms of implementation, these RNN-based models have another difficulty in that the amount of data gets larger as the structure gets more sophisticated. This problem of large data size is particularly problematic in the Korean language, which lacks refined corpora. In this study, we introduce CTC algorithm that does not require force-alignment to create a Korean phoneme recognition model. Specifically, the phoneme recognition model is based on convolutional neural network(CNN) which requires relatively small amount of data and can be trained faster when compared to RNN based models. We present the results from two different experiments and a resulting best performing phoneme recognition model which distinguishes 49 Korean phonemes. The best performing phoneme recognition model combines CNN with 3hop Bidirectional LSTM with the final Phoneme Error Rate(PER) at 3.26. The PER is a considerable improvement compared to existing Korean phoneme recognition models that report PER ranging from 10 to 12."
