title,date,keywords,abstract,multilingual_abstract
Word2Vec과 2계층 양방향 장단기 기억 네트워크를 이용한 특허 문서의 자동 IPC 분류,2019,"['텍스트 마이닝', '문서 분류', '순환 신경망', 'text mining', 'document classification', 'recurrent neural network']","자연어 처리를 이용한 문서 분류 분야에서도 전통적인 방법에서 벗어나 단어 임베딩을 활용한 합성곱 신경망과 순환 신경망 등 심층 신경망을 이용한 다양한 연구가 진행되고 있다. 본 논문에서는 Word2Vec과 두 개의 계층으로 구성된 양방향 장단기 기억 네트워크를 이용한 특허 문서의 IPC(International Patents Classification) 자동 분류 모델을 제안한다. IPC는 세계지식재산권기구에서 제정한 국제적으로 통일된 특허 분류 기준이며, 각 국가의 공인된 기관에서 수작업으로 분류하고 있다. IPC 자동 분류를 위하여 입력 시퀀스에 Word2Vec을 이용한 단어 임베딩가중치를 사용한다. 그리고 가중치가 부여된 시퀀스를 두 개의 계층을 갖는 깊은 구조의 양방향 장단기 기억 네트워크 신경망에 입력하여 IPC를 분류한다. 실험 결과 특허 문서의 분류 정확도가 합성곱 신경망 보다는 약 7% 향상되었으며, 순환 신경망을 단일로 이용하는 것 보다는 약 5% 향상된 것을 확인할 수 있었다. 또한 전통적인 방법인 나이브 베이시안, 로지스틱 분류 및 서포트 벡터 머신보다는 5~12% 이상 우수한 성능을 나타내었다.","There are various studies using Deep Neural Network such as CNN(Convolutional Neural Network) and RNN(Recurrent Neural Network) that utilize word embedding in document classification using natural language processing out of traditional methods. In this paper, we propose the IPC(International Patents Classification) automatic classification model of patent documents using two layers BLSTM(Bidirectional Long Short Term memory) network. The IPC is an internationally uniform standard for patent classification established by the World Intellectual Property Organization and is categorized by hand in authorized agencies in each country. For the IPC automatic classification, we use word embedding weight with Word2Vec in the input sequences. And they are classified by entering a weighted sequences into a deep neural network with two layers BLSTM. The experimental results showed that the accuracy of classification is improved by about 7% than that of CNN, and about 5% than that of single layer LSTM that is a field of RNN. Also it showed more than 5~12% higher performance than traditional methods such as Naive Bayes, Logistic and Support Vector Machine classification."
스마트폰 다종 데이터를 활용한 딥러닝 기반의 사용자 동행 상태 인식,2019,"['사용자 행동 인식', '그룹 상호작용', '스마트폰 물리 센서', '컨볼루션 신경망', '장단기 기억 순환 신경망', 'human activity recognition', 'group interaction', 'smartphone multimodal sensors', 'convolutional neural network', 'long short-term memory recurrent network']","스마트폰이 널리 보급되고 현대인들의 생활 속에 깊이 자리 잡으면서, 스마트폰에서 수집된 다종 데이터를바탕으로 사용자 개인의 행동을 인식하고자 하는 연구가 활발히 진행되고 있다. 그러나 타인과의 상호작용 행동 인식에 대한 연구는 아직까지 상대적으로 미진하였다. 기존 상호작용 행동 인식 연구에서는 오디오, 블루투스, 와이파이 등의 데이터를 사용하였으나, 이들은 사용자 사생활 침해 가능성이 높으며 단시간 내에 충분한 양의 데이터를 수집하기 어렵다는 한계가 있다. 반면 가속도, 자기장, 자이로스코프 등의 물리 센서의 경우 사생활 침해 가능성이 낮으며 단시간 내에 충분한 양의 데이터를 수집할 수 있다. 본 연구에서는 이러한 점에 주목하여, 스마트폰 상의 다종 물리 센서 데이터만을 활용, 딥러닝 모델에 기반을 둔 사용자의 동행 상태 인식 방법론을 제안한다. 사용자의 동행 여부 및 대화 여부를 분류하는 동행 상태 분류 모델은 컨볼루션 신경망과 장단기기억 순환 신경망이 혼합된 구조를 지닌다. 먼저 스마트폰의 다종 물리 센서에서 수집한 데이터에 존재하는 타임 스태프의 차이를 상쇄하고, 정규화를 수행하여 시간에 따른 시퀀스 데이터 형태로 변환함으로써 동행 상태분류 모델의 입력 데이터를 생성한다. 이는 컨볼루션 신경망에 입력되며, 데이터의 시간적 국부 의존성이 반영된 요인 지도를 출력한다. 장단기 기억 순환 신경망은 요인 지도를 입력받아 시간에 따른 순차적 연관 관계를학습하며, 동행 상태 분류를 위한 요인을 추출하고 소프트맥스 분류기에서 이에 기반한 최종적인 분류를 수행한다. 자체 제작한 스마트폰 애플리케이션을 배포하여 실험 데이터를 수집하였으며, 이를 활용하여 제안한 방법론을 평가하였다. 최적의 파라미터를 설정하여 동행 상태 분류 모델을 학습하고 평가한 결과, 동행 여부와 대화 여부를 각각 98.74%, 98.83%의 높은 정확도로 분류하였다.","As smartphones are getting widely used, human activity recognition (HAR) tasks for recognizing personal activities of smartphone users with multimodal data have been actively studied recently. The research area is expanding from the recognition of the simple body movement of an individual user to the recognition of low-level behavior and high-level behavior. However, HAR tasks for recognizing interaction behavior with other people, such as whether the user is accompanying or communicating with someone else, have gotten less attention so far. And previous research for recognizing interaction behavior has usually depended on audio, Bluetooth, and Wi-Fi sensors, which are vulnerable to privacy issues and require much time to collect enough data. Whereas physical sensors including accelerometer, magnetic field and gyroscope sensors are less vulnerable to privacy issues and can collect a large amount of data within a short time. In this paper, a method for detecting accompanying status based on deep learning model by only using multimodal physical sensor data, such as an accelerometer, magnetic field and gyroscope, was proposed. The accompanying status was defined as a redefinition of a part of the user interaction behavior, including whether the user is accompanying with an acquaintance at a close distance and the user is actively communicating with the acquaintance. A framework based on convolutional neural networks (CNN) and long short-term memory (LSTM) recurrent networks for classifying accompanying and conversation was proposed.First, a data preprocessing method which consists of time synchronization of multimodal data fromdifferent physical sensors, data normalization and sequence data generation was introduced. We applied the nearest interpolation to synchronize the time of collected data from different sensors. Normalization was performed for each x, y, z axis value of the sensor data, and the sequence data was generated according to the sliding window method. Then, the sequence data became the input for CNN, where feature maps representing local dependencies of the original sequence are extracted. The CNN consisted of 3 convolutional layers and did not have a pooling layer to maintain the temporal information of the sequence data. Next, LSTM recurrent networks received the feature maps, learned long-term dependencies from them and extracted features. The LSTM recurrent networks consisted of two layers, each with 128 cells. Finally, the extracted features were used for classification by softmax classifier. The loss function of the model was cross entropy function and the weights of the model were randomly initialized on a normal distribution with an average of 0 and a standard deviation of 0.1. The model was trained using adaptive moment estimation (ADAM) optimization algorithm and the mini batch size was set to 128. We applied dropout to input values of the LSTM recurrent networks to prevent overfitting. The initial learning rate was set to 0.001, and it decreased exponentially by 0.99 at the end of each epoch training.An Android smartphone application was developed and released to collect data. We collected smartphone data for a total of 18 subjects. Using the data, the model classified accompanying and conversation by 98.74% and 98.83% accuracy each. Both the F1 score and accuracy of the model were higher than the F1 score and accuracy of the majority vote classifier, support vector machine, and deep recurrent neural network. In the future research, we will focus on more rigorous multimodal sensor data synchronization methods that minimize the time stamp differences. In addition, we will further study transfer learning method that enables transfer of trained models tailored to the training data to the evaluation data that follows a different distribution. It is expected that a model capable of exhibiting robust recognition performance against changes in data that is not considered in the model learning stage wil..."
LSTM(Long Short-Term Memory)을 이용한 가짜 리뷰 생성과 분석 및 평가,2019,"['의견 스팸', '크라우드터핑', '가짜 리뷰', '순환신경망', 'LSTM (long short-term memory)', 'Word2Vec', 'opinion spam', 'crowdturfing', 'fake review', 'RNN', 'LSTM', 'Word2Vec']","의견 스팸(opinion spam)은 특정 목적을 가진 집단이 생성한 의견을 통하여 타인 또는 타 집단에 영향을 미치는 행위를 일컫는다. 이는 소셜 네트워크 상에서 특정 대상의 평판에 영향을 미칠 수 있다는 점에서 온라인 서비스가 활발히 이루어지고 있는 현 시점에 큰 문제로 여겨질 수 있으며, 국내외 산업 및 학계에서도 관심을 보이고 있다. 본 연구에서는 의견 스팸 행위 탐지에 앞서 국내 의견 스팸 현황을 확인하고 순환신경망을 이용해 가짜 리뷰를 자동 생성해봄으로써 의견 스팸으로 인한 피해 가능성을 예측해본다. 특히, 순환신경망의 장기 의존성 문제가 개선된 LSTM(long short-term memory)을 기반으로 한글 언어 모델을 학습하고 Word2Vec을 이용하여 생성된 리뷰의 특정 용어를 대체함으로써 품질 개선을 시도한다. 특정 외국어 기반 학습 모델을 한국어에 적용하고 성능 및 적절성을 평가함으로써 향후 한국어 의견 스팸에 대한 대응 방향을 살펴본다.","Opinion Spam is the act of misleading the public to comply with the intent of a particular group. This is a serious problem at this point in time, when online services are widely deployed and the reputation of a specific target seller relative to the offline market can be easily affected. In this context, detecting and preventing opinion spam is an important research topic. This study investigates the current status of the domestic online market and poses possible damages caused by opinion spam through the automatic generation of Korean reviews using a recurrent neural network (RNN). In particular, we applied a learning model based on an LSTM (long short-term memory) unit for the Korean language in order to improve the long-term dependency problem of the typical RNN.Then, the Word2Vec is exploited to improve the relevance by replacing keywords with a set of candidates from the target market. We show the translation of the learning model based on a foreign language to Korean, then evaluate its appropriateness with regard to the development of countermeasures with which to effectively prevent automatically generated opinion spam in the near future."
도메인 정보가 강화된 워드 임베딩을 사용한 한국어 텍스트 생성,2019,"['언어 모델', '순환 신경망', 'LSTM', '창의적 텍스트', '워드 임베딩', 'Language Model', 'RNN', 'LSTM', 'Creative Writing', 'Word Embedding']","최근 순환신경망(Recurrent Neural Network, RNN)이 언어 모델링에서 두각을 나타냄에 따라 많은 연구들에서 해당 기법을사용하여 언어 모델링 연구를 수행하고 있다. RNN은 뉴스와 같은 정형화된 텍스트의 생성뿐만 아니라 소설, 수필과 같은창의적 텍스트 생성을 위한 시스템에도 쓰이고 있다. 영어권에서는 글쓰기를 위한 보조적 수단으로 사용된 연구가 있으나, 한국어에 관한 연구는 아직 부족하다. 한국어는 영어보다 어휘의 쓰임새나 형변환이 다양하기 때문에 난이도가 높다. 본논문에서는 도메인 정보가 강화된 워드 임베딩을 이용하여 한국어 텍스트 생성 모델을 구축하였다. 임베딩 층을 학습하기위해 두 가지 모델을 실험 하였는데 도메인 말뭉치만 가지고 임베딩 층을 학습하는 모델 1과 대용량의 일반 데이터를 먼저학습하고 도메인 말뭉치를 추가 학습하는 모델 2를 구축하여 실험을 수행하였다. 실험 결과, 두 모델 모두 한국어 창의적텍스트 생성의 가능성을 보여 주었는데 모델 2를 통해 생성된 데이터는 창의성 면에서, 즉 수사적 단어의 활용 면에서 모델1보다 나았고 통사적 면에서는 모델 1이 좀 더 깔끔한 문장을 생성하였다.","Recently, along with recurrent neural networks’ (RNN) notable performances, lots of language modeling systems are built upon RNN. The architecture is not only used to generate standard text like news articles, but also utilized in creative text generation, for instance, novels and essays. Among studies on English language, an auxiliary model suggesting the next sentence to users who are writing creative essays has been proposed. Meanwhile, Research on Korean language generation is not enough yet. This paper suggests a language generation system to generate creative texts in Korean based on previous researches done on English and word embedding enhanced by domain information. In the system, to learn the weights of embedding layer, two models are suggested. Model 1 learns the weights only through domain corpus, and Model 2 learns the weight using the large general corpus first followed by domain corpus. The texts generated by Model 2 was more creative, which means learned rhetorical words’ usage better than Model 1. In the aspects of syntax, Model 1 was better than Model 2."
딥 러닝 기반 휴먼 모션 디노이징,2019,"['human motion', 'motion capture', 'motion denoising', 'attention', 'bidirectional recurrent neural network']","본 논문에서는 어텐션 기법을 적용한 양방향 순환신경망을 이용하여 새로운 휴먼 모션 디노이징 방법을 제안한다. 본 방법을 이용하면, 단일 3D 깊이 센서 카메라에서 캡처된 노이즈가 포함된 사람의 움직임이 잘 교정된 자연스러운 움직임으로 자동 조정된다. 양방향 순환신경망에 어텐션 기법을 도입하면, 입력으로 들어온 움직임을 인코딩할 때 여러 자세 중에 더 중요한 자세가 있는 프레임에 더 높은 어텐션 가중치를 부여함으로써, 다른 딥 러닝 네트워크와 비교해 더 나은 최적화 결과와 더 높은 정확도를 보인다. 실험을 통해 본 논문에서 제시한 방법이 다양한 스타일의 움직임과 노이즈를 효과적으로 처리함을 확인하였으며, 제시한 방법은 모션 캡처 후처리 단계의 애플리케이션으로 충분히 사용 가능할 것으로 기대된다.","In this paper, we propose a novel method of denoising human motion using a bidirectional recurrent neural network (BRNN) with an attention mechanism. The corrupted motion captured from a single 3D depth sensor camera is automatically fixed in the well-established smooth motion manifold. Incorporating an attention mechanism into BRNN achieves better optimization results and higher accuracy than other deep learning frameworks because a higher weight value is selectively given to a more important input pose at a specific frame for encoding the input motion. Experimental results show that our approach effectively handles various types of motion and noise, and we believe that our method can sufficiently be used in motion capture applications as a post-processing step after capturing human motion."
청각장애인을 위한 사운드 이벤트 검출 기반 홈 모니터링 시스템,2019,[],"본 논문에서는 청각장애인을 위해 양방향 게이트 순환 신경망을 이용한 사운드 이벤트 검출 기반의 홈 모니터링 시스템을 제안한다. 제안된 시스템에서는 우선적으로 효과적인 사운드 이벤트 검출을 위해 패킷손실 은닉을 이용하여 무선 센서 네트워크로 인해 손실된 신호를 복원하고, 멀티채널 상호 상관관계 계수를 이용하여 신뢰할 수 있는 채널을 선택한다. 선택된 채널의 사운드는 이벤트 검출을 위해 두 개의 오디오 채널을 사용하는 양방향 게이트 순환신경망에 적용된다. 검출된 사운드 이벤트는 텍스트로 변환되며, 이와 함께 하모닉/퍼커시브 음원 분리 방식을 통해 햅틱 신호로 변환되어 청각장애인에게 제공된다. 실험결과는 제안한 사운드 검출기반의 성능이 기존 방식보다 더 우수하다는 것과 음원 분리 방식을 통해 사운드를 세밀한 햅틱 신호로 표현할 수 있음을 보인다.",
SVR과 LSTM 모형의 토양습도 예측력 비교분석,2019,"['prediction of soil humidity', 'SVR', 'RNN', 'LSTM.', '토양습도 예측', '서포트벡터 회귀분석', '순환신경망', '장단기 메모리.']","토양수분은 지구 환경과 인간 사회에 직접적인 영향을 미치는 중요한 수문학적 요소이다. 토양수분은 다양한 분야에서 활용되며, 농업의 경우 관수 시기 및 관수량 조절, 농작물 생산량 예측에 활용되는 등 토양수분에 대한 연구와 이해는 다양한 분야에서 필요로 한다. 본 논문에서는 “나주시 농업기상시스템”에서 제공하는 “나주시 남창리”의 기상 및 토양 데이터를 활용하여 기존의 토양습도 예측 방법인 서포트벡터 회귀분석(support vector regression : SVR)과 새로운 방법으로 순환신경망(recurrent neural network : RNN)의 일종인 장단기 메모리(long short term memory : LSTM)를 사용하여 토양습도 예측 분석을 실시하였다. 많은 농가에서 토양습도에 대한 측정이 이루어지지 않는 점을 고려하여 기상 데이터만을 설명변수로 활용하여 2013년 6월 12일부터 2018년 5월 16일까지의 데이터를 통해 2018년 5월 17일부터 2019년 6월 20일까지의 미래 토양습도를 예측하였다. 예측력 평가지표인 평균제곱근오차(root mean square error : RMSE)를 비교해본 결과 짧은 기간을 예측할수록 LSTM 모형이 높은 예측력을 보였으나, 예측기간이 길어질수록 비슷하거나 오히려 더 낮은 예측력을 보였다. 따라서 토양습도를 예측하는 방법으로 LSTM 모형을 활용하기 위해서는 장기 예측에서도 좋은 예측력을 갖도록 하는 개선 방안이 필요할 것으로 보인다.","Soil moisture is an important hydrological factor that directly affects the earth's environment and human society. Soil moisture is utilized in various fields, and in the case of agriculture, research and understanding of soil moisture is needed in a variety of fields such as irrigation scheduling and amount of irrigation control, utilization in predicting crop production. In this paper, weather and soil data provided by ""Naju Agricultural Meteorological System"" were utilized, and soil humidity prediction analysis was performed using the existing prediction method, support vector regression (SVR), and long short term memory (LSTM) which is a type of recurrent neural network (RNN), as a new prediction method. Considering the fact that many farms do not measure soil humidity, future soil humidity was predicted using only weather data as a descriptive variable. Comparing root mean square error (RMSE), the LSTM model showed higher predictive power over a shorter period of time, but the longer the forecast period, the more similar or rather lower. Therefore it will be necessary to improve the long-term predictability of the LSTM model as a way of predicting soil humidity."
고밀도 비디오 캡션 생성을 위한 의미 특징 학습,2019,"['고밀도 비디오 캡션 생성', '의미 특징 학습', '주의 집중', 'dense video captioning', 'semantic feature learning', 'attention']","본 논문에서는 고밀도 비디오 캡션 생성을 위한 새로운 심층 신경망 모델을 제안한다. 고밀도 비디오 캡션 생성은 하나의 입력 비디오로부터 다수의 이벤트 구간들을 찾아내고, 이들 각각에 관한 자연어 설명 문장을 생성하는 작업이다. 기존의 모델들에서는 합성곱 신경망을 통해 입력 비디오의 시각 특징 만을 추출하여 사용한 것과는 달리, 본 논문에서 제안하는 모델에서는 행위, 물체, 배경, 사람 등 중요한 이벤트 구성 요소들을 효과적으로 표현할 수 있는 고수준의 의미 특징들을 추가적으로 활용하였다. 또한 제안 모델에서는 순환 신경망인 LSTM을 이용하여 비디오 안에 포함된 이벤트 시간 영역들을 탐지하였다. 또, 제안 모델에서는 중요도에 따라 선택적으로 입력 특징들에 집중할 수 있도록, 캡션 생성 과정에 주의집중 메커니즘을 적용하였다. 고밀도 비디오 캡션 생성을 위한 대용량 벤치마크 데이터 집합인 ActivityNet Captions 데이터 집합을 이용한 다양한 실험을 통해, 본 논문에서 제안한 모델의 높은 성능과 우수성을 확인할 수 있었다.","In this paper, we propose a new deep neural network model for dense video captioning.Dense video captioning is an emerging task that aims at both localizing and describing all events in a video. Unlike many existing models, which use only visual features extracted from the given video through a sort of convolutional neural network(CNN), our proposed model makes additional use of high-level semantic features that describe important event components such as actions, people, objects, and backgrounds. The proposed model localizes temporal regions of events by using LSTM, a recurrent neural network(RNN). Furthermore, our model adopts an attention mechanism for caption generation to selectively focus on input features depending on their importance. By conducting experiments using a large-scale benchmark dataset for dense video captioning, AcitivityNet Captions, we demonstrate high performance and superiority of our model."
딥러닝 모형을 사용한 한국어 음성인식,2019,"['한국어 음성인식', '종단 간 딥러닝', '연결성 시계열 분류기', '주의 기제', '베이즈 딥러닝', 'Korean speech recognition', 'end to end deep learning', 'Connectionist temporal classification', 'Attention', 'Bayesian deep learning']","본 논문에서는 베이즈 신경망을 결합한 종단 간 딥러닝 모형을 한국어 음성인식에 적용하였다. 논문에서는 종단 간 학습 모형으로 연결성 시계열 분류기(connectionist temporal classification), 주의 기제, 그리고 주의 기제에 연결성 시계열 분류기를 결합한 모형을 사용하였으며. 각 모형은 순환신경망(recurrent neural network) 혹은 합성곱신경망(convolutional neural network)을 기반으로 하였다. 추가적으로 디코딩 과정에서 빔 탐색과 유한 상태 오토마타를 활용하여 자모음 순서를 조정한 최적의 문자열을 도출하였다. 또한 베이즈 신경망을 각 종단 간 모형에 적용하여 일반적인 점 추정치와 몬테카를로 추정치를 구하였으며 이를 기존 종단 간 모형의 결괏값과 비교하였다. 최종적으로 본 논문에 제안된 모형 중에 가장 성능이 우수한 모형을 선택하여 현재 상용되고 있는 Application Programming Interface (API)들과 성능을 비교하였다. 우리말샘 온라인 사전 훈련 데이터에 한하여 비교한 결과, 제안된 모형의 word error rate (WER)와 label error rate (LER)는 각각 26.4%와 4.58%로서 76%의 WER와 29.88%의 LER 값을 보인 Google API보다 월등히 개선된 성능을 보였다.","In this paper, we propose an end-to-end deep learning model combining Bayesian neural network with Korean speech recognition.In the past, Korean speech recognition was a complicated task due to the excessive parameters of many intermediate steps and needs for Korean expertise knowledge.Fortunately, Korean speech recognition becomes manageable with the aid of recent breakthroughs in ``End-to-end"" model.The end-to-end model decodes mel-frequency cepstral coefficients directly as text without any intermediate processes.Especially, Connectionist Temporal Classification loss and Attention based model are a kind of the end-to-end.In addition, we combine Bayesian neural network to implement the end-to-end model and obtain Monte Carlo estimates.Finally, we carry out our experiments on the ``WorimalSam"" online dictionary dataset. We obtain 4.58% Word Error Rate showing improved results compared to Google and Naver API."
