title,date,keywords,abstract,multilingual_abstract
The Influence of Temperature and Aging on the Characteristic Parameters of Dielectric Spectroscopy of Epoxy Resin Impregnated Paper Insulation,2019,"['thermal aging', 'dielectric properties', 'temperature', 'epoxy resin impregnated paper', 'characteristic parameters.']",국문 초록 정보 없음,"This study aimed to investigate the effects of temperature and aging on the characteristic parameters of dielectric spectra of epoxy resin impregnated paper insulation. A broadband dielectric spectra test platform was established and an equivalent physical model of the valve side dry-type bushing of the converter transformer was developed. Different degrees of thermal aging were performed at 130 °C for 0, 4, 8, 16, and 32 days. In addition, variation of the complex permittivity and dielectric loss factors of epoxy resin impregnated paper at different temperatures and different degrees of aging was revealed. The dielectric spectra test results were fitted using the Havriliak-Negami (HN) relaxation model. The characteristic parameters were extracted, and the influences of temperature and aging on the characteristic parameters of the HN model were analyzed. The results show that in the low frequency range, temperature and aging exert greater influences on the complex permittivity. In the high frequency range, temperature and aging have smaller effect. The relaxation time and temperature satisfy the relationship of the Arrhenius equation, and the relaxation strength increases exponentially with increasing temperature. The relaxation time τ, the relaxation intensity Δε, the shape parameter α, and the shape parameter β can characterize the aging degree of paper insulation. A linear relationship between relaxation and aging times, and an exponential relationship between relaxation intensity and aging time were revealed."
Precise Modeling and Adaptive Feed-Forward Decoupling of Unified Power Quality Conditioners,2019,"['Adaptive feed-forward decoupling', 'Interaction analysis', 'Power quality', 'Precise unified modeling', 'UPQC']",국문 초록 정보 없음,"The unified power quality conditioner (UPQC) is an effective custom power device that is used at the point of common coupling to protect loads from voltage and current-related PQ issues. Currently, most researchers have studied series unit and parallel unit models and an idealized transformer model. However, the interactions of the series and parallel converters in AC-link are difficult to analyze. This study utilizes an equivalent transformer model to accomplish an electric connection of series and parallel converters in the AC-link and to establishes a precise unified mathematical model of the UPQC. The strong coupling interactions of series and parallel units are analyzed, and they show a remarkable dependence on the excitation impedance of transformers. Afterward, a feed-forward decoupling method based on a unified model that contains the uncertainty components of the load impedance is applied. Thus, this study presents an adaptive method to estimate load impedance. Furthermore, simulation and experimental results verify the accuracy of the proposed modeling and decoupling algorithm."
Individual Channel Design-based Modeling and Analysis of Three Phase Grid-tied Inverter with Unbalanced Grid Impedance,2019,"['Inverter', 'individual channel analysis and design (ICAD)', 'multivariable frequency domain', 'modeling', 'stability', 'unbalanced grid impedance']",국문 초록 정보 없음,"Three-phase grid-tied inverters are usually designed to operate in symmetric grid impedance. In actual operations, due to the imbalanced loads, three-phase systems with significant single-phase loads, imbalanced power line impedance or the imbalanced short-circuit impedance of the three grid power transformer, the equivalent three-phase grid impedance is unbalanced. It is, consequently, important to develop an effective model and stability analysis method to address three-phase grid-tied inverter with unbalanced grid impedance. Traditionally, the stability of unbalanced system can be analyzed by harmonic linearization technique, however, the model derivation is complex and the controller parameters need second designing. This paper develops the system model in a multivariable frequency domain, by using the individual channel analysis and design (ICAD), simplifying the stability analysis of the unbalanced system. The detailed study on the three-phase LCL filter-based grid-tied inverter under the unbalanced grid impedance condition is presented. Simulation and experiment analysis are carried out on a 380 V/50 Hz/6 kW grid-tied inverter prototype."
Precise Modeling and Adaptive Feed-Forward Decoupling of Unified Power Quality Conditioners,2019,"['Adaptive feed-forward decoupling', 'Interaction analysis', 'Power quality', 'Precise unified modeling', 'UPQC']",국문 초록 정보 없음,"The unified power quality conditioner (UPQC) is an effective custom power device that is used at the point of common coupling to protect loads from voltage and current-related PQ issues. Currently, most researchers have studied series unit and parallel unit models and an idealized transformer model. However, the interactions of the series and parallel converters in AC-link are difficult to analyze. This study utilizes an equivalent transformer model to accomplish an electric connection of series and parallel converters in the AC-link and to establishes a precise unified mathematical model of the UPQC. The strong coupling interactions of series and parallel units are analyzed, and they show a remarkable dependence on the excitation impedance of transformers. Afterward, a feed-forward decoupling method based on a unified model that contains the uncertainty components of the load impedance is applied. Thus, this study presents an adaptive method to estimate load impedance. Furthermore, simulation and experimental results verify the accuracy of the proposed modeling and decoupling algorithm."
DAB Converter Based on Unified High-Frequency Bipolar Buck-Boost Theory for Low Current Stress,2019,"['BCM', 'Current stress', 'DAB', 'DCM', 'High-frequency bipolar buck-boost', 'Multi-parameters solving']",국문 초록 정보 없음,"This paper proposes a unified high-frequency bipolar buck-boost (UHFBB) control strategy for a dual-active-bridge (DAB), which is derived from the classical buck and boost DC/DC converter. It can achieve optimized current stress of the switches and soft switching in wider range. The UHFBB control strategy includes multi-control-variables, which can be achieved according to an algorithm derived from an accurate mathematical model. The design method for the parameters, such as the transformer turns ratio and the inductance, are shown. The current stress of the switches is analyzed for selecting an optimal inductor. The analysis is verified by the experimental results within a 500W prototype."
DAB Converter Based on Unified High-Frequency Bipolar Buck-Boost Theory for Low Current Stress,2019,"['BCM', 'Current stress', 'DAB', 'DCM', 'High-frequency bipolar buck-boost', 'Multi-parameters solving']",국문 초록 정보 없음,"This paper proposes a unified high-frequency bipolar buck-boost (UHFBB) control strategy for a dual-active-bridge (DAB), which is derived from the classical buck and boost DC/DC converter. It can achieve optimized current stress of the switches and soft switching in wider range. The UHFBB control strategy includes multi-control-variables, which can be achieved according to an algorithm derived from an accurate mathematical model. The design method for the parameters, such as the transformer turns ratio and the inductance, are shown. The current stress of the switches is analyzed for selecting an optimal inductor. The analysis is verified by the experimental results within a 500W prototype."
A Precise Stability Criterion for Power Hardware-in-the-loop Simulation System,2019,"['Delay time', 'power hardware-in-the-loop (PHIL)', 'power interface', 'stability criterion']",국문 초록 정보 없음,"Power hardware in the loop (PHIL) simulation is an attractive option for power system testing, as it combines the benefits of real-time digital simulation and physical experiments. In view of the fact that only systems with pure resistance have been considered in previous literatures, this paper presents a systematic and comprehensive approach to evaluating stability of different types of impedance. A rigorous stability criterion of a PHIL system based on the ideal transformer interface model which utilizes Nyquist stability criterion is introduced in this paper. Phase lag caused by delay time in the PHIL system is considered to be the essential cause of instability and in terms of Nyquist criterion, relative positions of the starting and ending points of the Nyquist curve completely determine stability conditions. Effectiveness of the proposed stability criterion is verified by experimental results conducted by RT-LAB."
Hybrid-Boost Modular Multilevel Converter-Based Medium-Voltage Multiphase Induction Motor Drive for Subsea Applications,2019,"['Five phase', 'Hybrid boost', 'Medium voltage', 'Motor drive', 'Subsea']",국문 초록 정보 없음,"This paper proposes a hybrid-boost Modular Multilevel Converter (MMC) for the Medium-Voltage (MV) Variable Speed Drives (VSDs) employed in subsea applications, such as oil and gas recovery. In the presented architecture, a hybrid-boost MMC with a reduced number of semiconductor devices driving a multiphase Induction Machine (IM) is investigated. The stepped output voltage generated by the MMC reduces or eliminates the filtering requirements. Moreover, the boosting capability of the proposed architecture eliminates the need for bulky low-frequency transformers at the converter output terminals. A detailed illustration of the hybrid-boost MMC operation, the expected limitations/constraints, and the voltage balancing technique are presented. A simulation model of the proposed MV hybrid-boost MMC-based five-phase IM drive has been built to investigate the system performance. Finally, a downscaled prototype has been constructed for experimental verification."
Hybrid-Boost Modular Multilevel Converter-Based Medium-Voltage Multiphase Induction Motor Drive for Subsea Applications,2019,"['Five phase', 'Hybrid boost', 'Medium voltage', 'Motor drive', 'Subsea']",국문 초록 정보 없음,"This paper proposes a hybrid-boost Modular Multilevel Converter (MMC) for the Medium-Voltage (MV) Variable Speed Drives (VSDs) employed in subsea applications, such as oil and gas recovery. In the presented architecture, a hybrid-boost MMC with a reduced number of semiconductor devices driving a multiphase Induction Machine (IM) is investigated. The stepped output voltage generated by the MMC reduces or eliminates the filtering requirements. Moreover, the boosting capability of the proposed architecture eliminates the need for bulky low-frequency transformers at the converter output terminals. A detailed illustration of the hybrid-boost MMC operation, the expected limitations/constraints, and the voltage balancing technique are presented. A simulation model of the proposed MV hybrid-boost MMC-based five-phase IM drive has been built to investigate the system performance. Finally, a downscaled prototype has been constructed for experimental verification."
High efficient plasma generation in an inductively coupled plasma using a passive resonant antenna,2019,[],국문 초록 정보 없음,"<P>We developed a high efficiency plasma source in an inductively coupled discharge using a passive resonant antenna, which has the advantage that it could be retro-fitted to existing reactors with minimal change to the reactor. At the resonance, the source has a larger total equivalent resistance that is 3–18 times larger than that at the non-resonance. As the resistance increases at the fixed RF power, the RF current decreases accordingly, which indicates that the power loss in the powered antenna including the impedance matching circuits is significantly reduced. The experimental result shows that the power transfer efficiency is improved by about 30%–70% and the plasma density at the resonance increases 2–8 times higher than that at the non-resonance. For analysis, three-winding transformer model is developed. The experimental results are consistent with the model.</P>"
Analysis of Key Parameters for Inductively Coupled Power Transfer Systems Realized by Detuning Factor in Synchronous Generators,2019,"['Detuning factor', 'Efficiency', 'ICPT', 'Resonant compensation', 'Rotary transformer', 'Transfer power']",국문 초록 정보 없음,"In this paper, a detuning factor (DeFac) method is proposed to design the key parameters for optimizing the transfer power and efficiency of an Inductively Coupled Power Transfer (ICPT) system with primary-secondary side compensation. Depending on the robustness of the system, the DeFac method can guarantee the stability of the transfer power and efficiency of an ICPT system within a certain range of resistive-capacitive or resistive-inductive loads. A MATLAB-Simulink model of a ICPT system was built to assess the system's main evaluation criteria, namely its maximum power ratio (PR) and efficiency, in terms of different approaches. In addition, a magnetic field simulation model was built using Ansoft to specify the leakage flux and current density. Simulation results show that both the maximum PR and efficiency of the ICPT system can reach almost 70% despite the severe detuning imposed by the DeFac method. The system also exhibited low levels of leakage flux and a high current density. Experimental results confirmed the validity and feasibility of an ICPT system using DeFac-designed parameters."
Analysis of Key Parameters for Inductively Coupled Power Transfer Systems Realized by Detuning Factor in Synchronous Generators,2019,"['Detuning factor', 'Efficiency', 'ICPT', 'Resonant compensation', 'Rotary transformer', 'Transfer power']",국문 초록 정보 없음,"In this paper, a detuning factor (DeFac) method is proposed to design the key parameters for optimizing the transfer power and efficiency of an Inductively Coupled Power Transfer (ICPT) system with primary-secondary side compensation. Depending on the robustness of the system, the DeFac method can guarantee the stability of the transfer power and efficiency of an ICPT system within a certain range of resistive-capacitive or resistive-inductive loads. A MATLAB-Simulink model of a ICPT system was built to assess the system’s main evaluation criteria, namely its maximum power ratio (PR) and efficiency, in terms of different approaches. In addition, a magnetic field simulation model was built using Ansoft to specify the leakage flux and current density. Simulation results show that both the maximum PR and efficiency of the ICPT system can reach almost 70% despite the severe detuning imposed by the DeFac method. The system also exhibited low levels of leakage flux and a high current density. Experimental results confirmed the validity and feasibility of an ICPT system using DeFac-designed parameters."
