title,date,keywords,abstract,multilingual_abstract
검색 모델 후처리를 위한 트랜스포머 기반 질의 유형 분류기,2019,[],국문 초록 정보 없음,다국어 초록 정보 없음
진단명 자동 레이블링을 위한 양방향 트랜스포머 사전학습 언어모델기반 최종진단명 분류,2019,"['Medical', 'Final Diagnosis', 'Classification', 'Pre-training', 'BERT']",최근 의료분야에서는 보다 나은 의료기술을 제공하기 위하여 인공지능을 적용한 많은 연구들이 진행되고 있다. 인공지능 학습에 있어 높은 정확성과 안정성을 확보하기 위해서는 충분한 수의 학습데이터가 필요하다는 것은 저명한 사실이다. 그러나 의료데이터 레이블링 작업은 노동 집약적이며 비용과 시간이 많이 들기 때문에 학습에 필요한 양질의 데이터를 확보하기가 쉽지 않다. 따라서 이러한 문제를 해결하기 위해 자동으로 레이블링을 하고자하는 필요성이 증대되었다. 본 논문에서는 인공지능 기반 의료영상 자동 판독 솔루션의 개발 및 검증을 위해 필요한 영상과 이에 해당하는 질환명을 레이블링 하고자 자연어처리 분야에서 높은 성능을 보여 많이 사용되고 있는 양방향 트랜스포머 사전학습 언어모델 기반인 BERT 모델을 사용하여 판독기록문에서 최종 진단명을 분류하는 문제를 해결하였다.,"Recently, many studies have been underway to provide better medical technology by applying artificial intelligence technology in the medical field. Building training data for learning artificial intelligence is a necessary process because it requires a sufficient number of medical data and corresponding labels. However, large numbers of medical data labeling is labor-intensive issue, which has increased the need for automatic labeling. In this paper, we will introduce the study of automatically labeling the final diagnosis in medical treatment record using the BERT model, which shows the best performance in natural language processing in recent years"
진단명 자동 레이블링을 위한 양방향 트랜스포머 사전학습 언어모델기반 최종진단명 분류,2019,[],국문 초록 정보 없음,다국어 초록 정보 없음
다중 인코더 Transformer 기반 번역문 자동 사후 교정 모델의 디코더 구조 연구,2019,[],국문 초록 정보 없음,다국어 초록 정보 없음
BERT Transformer와 GCN Deep Learning을 활용한 문맥 인식 기반 인용 추천 모델,2019,[],국문 초록 정보 없음,다국어 초록 정보 없음
BERT Transformer와 GCN Deep Learning을 활용한 문맥 인식 기반 인용 추천 모델,2019,[],국문 초록 정보 없음,다국어 초록 정보 없음
50kVA 개별 및 공유형 변압기 / 리액터 모델의 열 특성 분석,2019,[],국문 초록 정보 없음,다국어 초록 정보 없음
50kVA급 공유형 변압기/리액터와 개별 모델 특성해석,2019,[],국문 초록 정보 없음,다국어 초록 정보 없음
트랜스포머를 이용한 향상된 댓글 생성에 관한 연구,2019,"['Deep Learning(딥 러닝)', 'Natural Language Processing(자연어 처리)', 'Self-Attention(셀프-어텐션)', 'Transformer(트랜스포머)']","온라인 커뮤니티 안에서 다른 사용자들의 글에 반응할 수 있는 딥러닝 연구를 2017년부터 진행해 왔으나, 한국어의 조사와 같은 특성으로 인한 단어처리의 어려움과 RNN 모델의 특성으로 인한 GPU 사용률 저조 문제로 인해 적은 양의 데이터로 학습을 제한해야 했다. 하지만 최근 자연어 처리 분야의 급격한 발전으로 이전보다 뛰어난 모델들이 등장함에 따라 본 연구에서는 이러한 발전된 모델을 적용해 더 나은 학습 결과를 생성해 내는 것을 목표로 한다. 이를 위해 셀프-어텐션 개념이 적용된 트랜스포머모델을 도입했고 여기에 한국어 형태소 분석기 MeCab을 적용해 단어처리의 어려움을 완화했다.","We have been studying a deep-learning program that can communicate with other users in online communities since 2017. But there were problems with processing a Korean data set because of Korean characteristics. Also, low usage of GPUs of RNN models was a problem too. In this study, as Natural Language Processing models are improved, we aim to make better results using these improved models. To archive this, we use a Transformer model which includes Self-Attention mechanism. Also we use MeCab, korean morphological analyzer, to address a problem with processing korean words."
비 작업지향 챗봇 모델의 실험적 비교 연구,2019,"['챗봇', '시퀀스 투 시퀀스', '주의집중 기법', '트랜스포머', '강화학습', '군집화', 'Chatbot', 'Sequence-to-Sequence', 'Attention Mechanism', 'Transformer', 'Reinforcement Learning', 'Clustering']","최근 챗봇에 대한 연구가 활발히 진행되고 있다. 챗봇은 작업지향 챗봇과 비 작업지향 챗봇으로 나눌 수있다. 사람과 다양한 주제의 대화를 나눌 수 있는 비 작업지향 챗봇은 주로 시퀀스 투 시퀀스(Sequence-to-Sequence) 모델을 기반으로 한다. 본 논문에서는 다양한 시퀀스 투 시퀀스 기반 모델을 비 작업지향 챗봇에 적용해보고 그 성능을 실험적으로 비교한다. 영화 대사 데이터 집합을 사용하여 실험한 결과, 트랜스포머 모델이 정량 및 정성평가에서 가장 우수한 성능을 보였다. 또한, 학습 데이터에 군집화를 적용하면 BLEU 점수가 향상되는 반면 다양성 점수는 저하되는 것을 발견하였다.","Recently, there have been active research efforts on chatbots. Chatbots can be divided into task-oriented and non-task-oriented chatbots. Non-task-oriented chatbots, which can converse with humans on various topics, are mainly based on Sequence-to-Sequence models. In this paper, we apply various Sequence-to-Sequence models to non-task-oriented chatbots and conduct an empirical comparison study.Experimental results using a movie dialogue dataset show that the Transformer model is the best one in quantitative and qualitative evaluation. We also discovered that applying clustering to the train data increases the BLEU score, but decreases the diversity score."
자기 공진형 무선전력전송 시스템의 효율 향상을 위한 변압기 적용 시스템 모델 분석,2019,"['Wireless Power Transfer', 'Magnetic Resonance Modeling', 'Inductive link', 'Q-factor']",국문 초록 정보 없음,"As the mobile devices develop, the contact type wireless power transmission technologies face its limitation, and there are demands for convenient charging systems. Under the demands, non-contacting wireless power transmission system has been studied using magnetic resonance. Magnetic resonance type system uses four coils to transmit electrical power further. However, the 4-coil system has disadvantages in its size of transmission/receiving coils and difficulties in impedance matching. To improve the 4-coil system, 2-coil wireless power transmission system with transformers is proposed and analyzed. The existence of the transformers at the transmission part and the receiving part make the impedance matching between the system and the load comfortably and make the 2-coil system transmit power further. Circuit simulation is used to analyze the power transmission coefficient of the proposed 2-coil system with the 4-coil system. It can be seen through the simulation that the 2-coil wireless power transmission system with the transformers has analogous power transmission coefficient to that of the 4-coil wireless power transmission system. As a result, the wireless power transmission system can be made into a smaller size by using transformers in the 2-coil wireless power transmission system."
원시문과 기계번역문 간 효과적 관계모델링을 통한 Transformer 기반 번역문 자동 사후 교정,2019,[],국문 초록 정보 없음,다국어 초록 정보 없음
BERT Transformer와 Deep Learning을 활용한 전이학습 효과 검증 연구 :법률상담데이터 분류문제 적용,2019,"['Transfer Learning', 'Natural Language Processing', 'BERT', 'Deep Learning', 'Classification', 'Neural Network']",국문 초록 정보 없음,"As AI(artificial intelligence) is actively researched, it is being applied in various fields such as natural language processing, video and voice processing. However, voices pointing out the technical limitations of deep learning are spreading, and accordingly, researches for solving the technical limitations of deep learning are being actively conducted. In this paper, BERT, well known as the pre-training model of natural language processing, was applied to the classification problem of legal counseling data to verify the effect of transfer learning. Using BERT pre-trained data, the Transformer classification model was implemented and applied to the problem of legal counseling data classification, which showed higher accuracy than the traditional machine learning algorithm."
Transformer 기반 번역문 사후 교정,2019,"['기계 번역', '번역문 사후 교정', 'transformer', '다중 인코더 구조', 'machine translation', 'automatic post-editing', 'multi-encoder architecture']","번역문 사후 교정은 기계 번역 시스템의 결과물을 교정하여 더 나은 번역문을 만들어내는 연구로, 기계 번역 시스템에 독립적으로 번역 품질 향상을 위해 제안된 분야이다. 본 논문에서는 최근의 연구 흐름에 따라 번역문 사후 교정을 번역문과 원문을 별도의 소스로 간주하는 다중 소스 번역 문제(multi-source translation problem)로 간주하고, 이를 바탕으로 Transformer를 이용한 다중 인코더 구조의 사후 교정 모델을 제안한다. 이 모델은 각 입력과 교정문 사이의 의존성을 별도로 학습하고, 이들을 더하여 최종 입출력 의존성을 얻는다. WMT17 사후 교정 말뭉치를 이용한 실험에서는 다중 인코더 모델이 기존 모델에 비해 더 나은 교정 성능을 보였으며, 사후 교정을 거치지 않은 문장에 비해서도 나은 번역품질을 보였다.","Automatic Post-Editing (APE) is a study on the correction for the output of machine translation (MT) systems for the purpose of improving their translation quality. In this paper, APE is regarded as a multi-source translation problem in which one source is an MT output and the other is an input source sentence. So we propose a neural multi-encoder post-editing model based on the transformer. This model aims to find out the dependencies of multiple sources against their post-edited sentence separately. It then adds them to achieve the final input-output dependency. Our experiment on the WMT17 APE data shows that the multi-encoder model outperforms the basic transformer model, producing a better MT output."
Contribution of Magnetostriction and Electromagnetic Force to Transformer Core Vibration,2019,"['Power Transformer', 'Magnetostriction', 'Electromagnetic Force', 'Overlap Area', 'Transformer Vibration']",국문 초록 정보 없음,"Power transformer is widely used as the key equipment of power transmission system. At the same time, with the improvement of people""s awareness of environmental protection, the problem of core vibration in the operation of transformer has attracted more and more attention. The vibration of transformer core is mainly caused by magnetostriction(MS) and electromagnetic force(EF) and that the transformer corner is the concentrated reflection area is universally acknowledged. A three-dimensional model for a square ring core containing the overlap area of the corner is firstly developed and then the distribution of MS and EF and the vibration displacement caused by the two forces acting alone are calculated under normal working conditions. At the same time, the transformer may work in abnormal working conditions such as DC bias or harmonics, which will cause MS and EF to increase in varying degrees. The contribution of MS and EF to core vibration under different working conditions is analyzed and a conclusion is drawn that EF is much smaller than MS in normal working condition, but under abnormal working conditions, EF increases rapidly and should not be neglected."
A Novel Method for Thermal Analysis of MF Transformers with Hollow Windings,2019,"['MF transformers', 'thermal analysis', 'finite element method', 'hollow windings']",국문 초록 정보 없음,"One of the key problems in the research and development of high-power electronic transformer is the thermal analysis of high-frequency or medium frequency transformer under non-sinusoidal load. At present, there is a lack of a convenient and effective method. Taking the thermal problem of an medium frequency transformer with a hollow conductor structure as an example, this paper presents an analysis method suitable for researchers. Firstly, based on the finite element model, the loss of hollow winding is studied by numerical analysis. Then, based on the similarity principle, the equivalent reduction method for calculating the core loss of medium frequency transformer is presented. Finally, the measurement data of the magnetic properties of the transformer core and the measurement data of the transformer loss under the medium frequency excitation are given. The complete research work can provide a method for the thermal analysis of high frequency or medium frequency transformer."
A Novel Experimental Measurement Method of Transformer Parasitic Capacitances,2019,"['Charge balance method', 'Measurement method', 'Step response method', 'Transformer parasitic capacitance']",국문 초록 정보 없음,"As the increase of switching frequency and the extensive use of planar transformers, the capacitive effects of transformers can’t be neglected anymore. Firstly, several transformer parasitic capacitance models are introduced in this paper. Next, this paper proposes a novel experimental method, charge balance method, to measure transformer parasitic capacitances. This method is applicable to single lumped parasitic capacitance model. Finally, the step response method is performed to verify the charge balance method. Experimental results show that the charge balance method is of high accuracy."
The Reduction Method of a Stray Load Loss of Distribution Transformer on the Bushing Flange Plate with STS,2019,['Bushing · Stray load loss · Distribution transformer'],국문 초록 정보 없음,"This paper deals with the stray load loss on the bushing fl ange plate of low voltage side for high effi ciency of the distribution transformer. To reduce the magnetic fl ux concentration, three models are proposed as follows. First, the basic transformer model is designed which is consisted of the windings, the core, the case and the bushing. Second transformer model is designed to creating a slit at the area where the magnetic fl ux on the bushing fl ange plate is concentrated and then attaching the STS (Stainless steel). In the third model, the bushing fl ange plate around the bushing terminal is cut into a large square shape and STS is attached. As a result of the simulations, when the material of the case is only steel, the stray load loss is 10.56 W, while the case with STS slit is 1.49 W and the case with STS plate is 0.17 W. The stray load loss reduction rate was 85.9% and 98.4% compared with the steel plate model. It is also verifi ed by the load test using the distribution transformer based on simulation data."
Resonant Parameter Design of Asymmetrical CLLC-Type DC Transformer with Robust Voltage Gain,2019,"['DC Transformer', 'resonant converter', 'efficiency', 'voltage conversion gain', 'renewable energy system']",국문 초록 정보 없음,"In the renewable energy system, the asymmetrical CLLC-type resonant DC transformer (ACLLC-type DCT) has been widely applied due to its high power-density and low-cost control. Whereas, the main circuit parameters are varying with operation power and temperature in practice, especially at the high-frequency condition. Therefore, the circuit parameters must be properly designed to achieve the robust voltage conversion gain (VCG) when adopting the open-loop scheme. To solve the above problems, this paper presents a special parameters design approach for DCT. In the proposed approach, all unknown parameters are replaced with two equivalent variables with the help of the mathematical model simplifications. Subsequently, a two-stage procedure is introduced to complete the parameters design based on the robust VCG requirement. At last, the proposed method is validated in a DCT based prototype."
Multi-objective Optimization and Modeling of High Frequency Transformers for DC-DC Stage in Solid State Transformer,2019,"['high frequency transformer', 'optimization design', 'multi-objective genetic algorithm (MOGA)', 'DC-DC converter']",국문 초록 정보 없음,"High frequency transformer (HFT) is the key component in bi-directional high-power DC-DC converter stage, which will substitute the traditional bulky transformers for modern power system. This paper presents an optimization design methodology of HFT based on multiobjective genetic algorithm (MOGA) with emphasis on efficiency, power density and thermal behavior. Accurate analytical models on total loss, magnetic size and the maximum temperature rise are carefully discussed and formulated as respective cost functions during optimization. An equivalent thermal model is introduced and validated by finite element modeling (FEM) and computational fluid dynamics (CFD) simulation. Incorporating the proposed methodology, optimal design of a 6kW, 50kHz, 600V/600V, HFT design has been derived, which exhibits a 99.62% efficiency and 12.24 kW/L power density with maximum 54.59℃ temperature rise. To verify the effectiveness and accuracy of the analytical expressions employed in the optimization methodology, experiments were performed on the constructed prototype and the analytical models have been well benchmarked with the laboratory results."
Analysis of Effect of Winding Interleaving on Leakage Inductance and Winding Loss of High Frequency Transformers,2019,['High frequency transformer · Interleaving winding · Leakage inductance · Winding loss · Frequency dependency'],국문 초록 정보 없음,"This work concerns prediction of the eff ect of winding interleaving used in high frequency transformers on leakage inductance and AC resistance. Although the reduction of the leakage inductance and AC resistance by applying interleaving has been well known by most designers, it is diffi cult to foresee the electrical performance of the transformer in the design stage. Based on the one-dimensional model for windings of magnetic components, this study presents a frequency dependent analytical method for leakage inductance and winding loss, which is suitable for no interleaving and interleaving winding confi gurations.Several high frequency transformer models with distinct winding arrangements are built, and the validity of the proposed method is verifi ed by comparing the FEM simulation and measurement. Other analytical methods are also compared with this new method. Results show that this method is more reliable and accurate as compared to the other analytical methods.The interleaving provides signifi cant advantage in reducing the leakage inductance and winding loss."
Analysis and Design of Transformer Windings Schemes in Multiple-Output Flyback Auxiliary Power Supplies with High-Input Voltage,2019,"['Multiple-output auxiliary power supply', 'Stray capacitance', 'Transformer', 'Two-transistor flyback', 'Winding arrangement']",국문 초록 정보 없음,"In this paper, aiming at high-voltage applications, transformer windings schemes of multiple-output two-transistor flyback converters are investigated, which are mainly based on the stray capacitances effect. First, based on a transformer model including equivalent stray capacitors, the operational principle of the converter is presented, and the main influence of its stay capacitors is determined. Second, the windings structures of the transformer are analyzed and designed based on the stray capacitances effect. Third, the windings arrangements of the transformer are analyzed and designed through a coupling analysis of the secondary windings and a stray capacitance analysis between the primary and secondary windings. Finally, the analysis and design conclusions are verified by experimental results obtained from a 60W laboratory prototype of a multiple-output two-transistor flyback converter."
Adaptive Fuzzy Sliding Mode Control Based on Pi-sigma Fuzzy Neutral Network for Hydraulic Hybrid Control System Using New Hydraulic Transformer,2019,"['Hydraulic hybrid system', 'hydraulic transformer', 'pi-sigma fuzzy neutral network', 'sliding mode control']",국문 초록 정보 없음,"Control issue is the key for applying hydraulic hybrid system, especially for common pressure rail (CPR)system which has the huge potential to enhance efficiency. In the paper, the mathematical model of hydrauliccylinder speed control system using new hydraulic transformer is established. Then an adaptive fuzzy sliding modecontroller based on Pi-sigma fuzzy neutral network is designed to solve the problem of parameter uncertainty andnonlinearity without establishing the precise model. Furthermore, compared to PID and conventional adaptivefuzzy system, the controller proposed can achieve good control performance and strong robustness in the presenceof time-varying uncertainty."
Modeling and Stability Assessment of Single-Phase Droop Controlled Solid State Transformer,2019,"['droop control', 'time-domain model', 'solid-state transformer (SST)', 'stability assessment']",국문 초록 정보 없음,"This paper addresses the modeling aspects and small-signal stability considerations for a single-phase droop controlled Solid State Transformer (SST). A state-space based modeling approach is utilized to assess the stability of the SST. It is demonstrated that physical parameter (e.g. grid impedance) variations, the choice of control parameters (e.g. droop control parameters) and the steady state operating point play a crucial role in determining the stability of the SST system that needs to handle wide load variations. Simulation results from a 1kVA droop-controlled SST system are presented to validate the analytical models."
Modular DC Solid State Transformer with Fault-Tolerant Function,2019,"['modular', 'DC solid state transformer', 'multilevel', 'fault tolerance method']",국문 초록 정보 없음,"A modularized control method with faulttolerant function is proposed under the condition that a module of DC solid state transformer (DCSST) fails due to input short circuit. The decoupling control strategy is deduced by establishing the mathematic model of the DCSST. The maximum input voltage is selected as the reference voltage by adding diodes at the input side. The proposed system can automatically adjust the input voltage reference to keep the output voltage stability for the module in DCSST with short-circuit fault. Simulation and experiment results show that the proposed control method can decouple the output voltage and the input average voltage, maintain the output voltage stable and improve the reliability of the system when a short circuit occurs in a module of DCSST."
Analysis and Design of Transformer Windings Schemes in Multiple-Output Flyback Auxiliary Power Supplies with High-Input Voltage,2019,"['Multiple-output auxiliary power supply', 'Stray capacitance', 'Transformer', 'Two-transistor flyback', 'Winding arrangement']",국문 초록 정보 없음,"In this paper, aiming at high-voltage applications, transformer windings schemes of multiple-output two-transistor flyback converters are investigated, which are mainly based on the stray capacitances effect. First, based on a transformer model including equivalent stray capacitors, the operational principle of the converter is presented, and the main influence of its stay capacitors is determined. Second, the windings structures of the transformer are analyzed and designed based on the stray capacitances effect. Third, the windings arrangements of the transformer are analyzed and designed through a coupling analysis of the secondary windings and a stray capacitance analysis between the primary and secondary windings. Finally, the analysis and design conclusions are verified by experimental results obtained from a 60W laboratory prototype of a multiple-output two-transistor flyback converter."
