title,date,keywords,abstract,multilingual_abstract
Study on Electrical Aging Characteristics of Fiber Sheath Materials in Power Transformer Oil,2019,"['Fiber sheath', 'Electrical aging', 'Lifetime model']",국문 초록 정보 없음,"Optical fiber has great potential in the development of online monitoring for trans-formers. In this paper, the electrical aging test of fiber sheath material based on a gradual voltage-rising method was performed and the influence of thermal aging on electrical aging was determined. Compared to the oil-paper insulation performance of traditional transformers, it was found that ethylene tetrafluoroethylene(ETFE), polytetrafluoroethylene(PTFE) and Polyamide 12 (PA 12) were better than oil-paper. Statistical analysis of the ETFE material and oil-paper test data was conducted using double-parameter Weibull distribution. The inverse power and exponential functions were used to fit the experimental data and voltage tolerance coefficients of the ETFE material were obtained. Experimental results show the parameters of the ETFE model in the inverse power function and exponential function model are better than those of the oil paper insulation, and the sheathed fiber is ETFE that can be stably operated in the transformer."
Control Algorithm Design and Implementation of Solid State Transformer,2019,"['Cascade converter', 'dual active bridge', 'parallel converters', 'smart transformer', 'voltage balancing']",국문 초록 정보 없음,"In this paper, a design review and control algorithm of a solid state transformer (SST) model intended to replace the existing 60Hz power transformer for the railway application is presented. The proposed smart transformer is a high-frequency power electronic transformer. It is made of multiple cascade AC-DC converter modules, linked by a high voltage DC-link to the multiple parallel dual active bridges (DAB) DC-DC converters. This arrangement of modules is susceptible to the unbalanced voltage of the DC-link capacitors, and the voltages of modules as well. However, if the control system is well designed, the voltage balance can be maintained. The main advantage of the presented SST is that it is capable of controlling the instantaneous voltage and improving the power quality by compensating the harmonics. The proposed control algorithm includes the design analysis of the output DC voltage control, the voltage balancing capability across the DC-link capacitors and the cascaded modules. It guarantees the great performance during the verification process. The validity of the proposed algorithm is verified by PSIM simulation and scale-downed experimental results."
BERT 기반 Variational Inference와 RNN을 이용한 한국어 영화평 감성 분석,2019,"['sentimental analysis', 'movie review', 'BERT', 'Transformer', 'variational inference', 'RNN', '감성 분석', '영화평', 'BERT', 'Transformer', 'variational inference', 'RNN']","최근 자연어처리 분야에서 많은 성능 향상을 보이고 있는 BERT는 양방향성을 가진 트랜스포머(transformer)를 기반으로 한 모델이다. BERT는 OOV (Out Of Vocabulary) 문제를 해결하기 위하여 BPE (Byte Pair Encoding)를 적용하며, 이를 기반으로 언어 모델을 사전 학습하고 출력 층(layer)을 추가하여 자연어처리 태스크를 fine-tuning한다. 감성 분석은 주어진 문장에 대한 잠재적 의미를 분석하고 분류하는 문제이다. 본 논문에서는 감성 분석에 BERT로부터 생성되는 토큰 표현을 이용하기 위하여 대용량 한국어 코퍼스로 언어 모델을 학습한 BERT 모델을 사용한다. 또한 문맥 정보를 인코딩하는 RNN을 BERT 함께 사용하는 방법과, RNN으로 인코딩한 hidden state에 variational inference를 이용하여 감성 분석을 수행하는 방법을 제안한다.","BERT is a model based on a bidirectional transformer and has demonstrated immense improvement in performance in the field of natural language processing. BERT applies BPE (Byte Pair Encoding) to solve OOV (Out Of Vocabulary) problem, and pre-trains language model based on the BPE and fine-tunes natural language processing task by adding an output layer. Sentimental analysis is a task of analyzing and classifying the potential meaning of a given sentence. In the present work, we have employed the BERT model which trains the language model with large capacity Korean Corpus to use the token representation generated from BERT for sentimental analysis. In addition, we propose a method of using BERT along with RNN, which encodes context information and a method of performing sentimental analysis using variational inference in hidden state encoded by RNNv."
주상변압기 부싱취부판의 표류부하손 저감 연구,2019,"['Eddy Current', 'Transformer', 'Bushing', 'Stray Load Loss']","본 논문에서는 배전용 변압기의 고효율화를 위해 저압측 부싱 취부판의 표류부하손에 대한 연구를 진행하였다. 전류의 방향이 다른 두개의 부싱 단자에서 발생하는 자기장은 취부판 정중앙에서 자속이 집중되는 것을 예상할 수 있다. 이를 저감하기 위한 방법으로 두 가지의 모델을 제시하였다. 첫 번째 모델은 자속이 집중되는 부분을 얇고 길게 잘라내어 STS(Stainless Steel)를 부착하였다. 두 번째 모델은 부싱 단자 주변을 넓게 판 형태로 잘라내어 STS를 부착하였다. 또한 배전용 변압기 용량에 따라 해석을 진행하였으며, 용량별 효과를 확인하였다",다국어 초록 정보 없음
자크 엘륄의 인격주의 운동과 혁명적 기독교,2019,"['자크 엘륄', '인격주의 운동', '필요한 혁명', '혁명적 기독교', 'Jacques Ellul', 'Mouvement personnaliste', 'Revolution necessaire', 'Christianisme revolutionnaire']","기독교적인 토대 위에서 이루어진 엘륄의 인격주의 운동은 다음 같은 출발점으로부터 시작한다. 즉, 혁명 활동을 수행하기 위해서는 현존하는 모든 모델, 곧 민주 정당이나 각종 연맹이나 전체주의 정당의 모델에서 벗어나야 하고, 개인적인 동시에 집단적인 변혁을 이루어야 하며, 그 변혁에는 공동체적 방식만을 적용해야 한다는 것이다. 엘륄에게 혁명은 근본적으로 사회를 변혁시키는 것이다. 따라서 그가 ‘필요한 혁명’이라고 부르는 ‘진정한 혁명’은 사회 및 문명 전체와 관련되고, 기술화에 직접 연결되어 있으며, 기술 환경 속에서의 인간 존재 자체와 관련된다. 결국, ‘필요한 혁명’은 기술화된 국가와 기술 사회에 맞서 일어나는 것이다. 그렇지만 현대 사회에서는 혁명을 통한 급격한 단절은 가능하지 않고, 기술 사회에서는 진정한 혁명 의식을 발견할 수 없다. 그 때문에, 기술 사회에서 혁명이 더는 가능하지 않고 ‘필요한 혁명’에 대한 희망이 사라진 듯 하지만, 기술 사회에서 인간은 여전히 ‘반란’을 시도할 수 있고, 자신에게 강요되는 것을 본능적이고 자발적으로 거부할 수 있다. 그러므로 완전히 새로운 기술 사회에서 지나간 혁명 모델은 전혀 유용하지 않고, 유일하게 혁명이 이루어지는 장소는 개인의 의식이며, 자유로운 인간에 의해서만 혁명이 이루어질 따름이다. 그 상황에서 유일하게 가능한 혁명은 권력 차지가 아니라, 현대 기술의 긍정적 잠재력을 확보하면서 인간 해방이라는 방향으로 현대 기술들의 방향을 설정하는 것이다. 그러한 혁명을 통해 기술이 종속될 수 있는 동시에, 체계로서의 기술 체계가 파괴될 수 있고, 국가의 권력이 사라질 수 있으며, 평등이 실현될 수 있고, 소외가 그칠 수 있다. 그런데, 이 시대의 본질적인 특성은 ‘필요한 혁명’을 시도하려는 갈망에 대립하는 문명의 깊은 정체 상태가 있다는 것이고, ‘진정한 혁명’이 불가능하다는 것이다. 근본 문제가 국가 형태나 경제 형태를 바꾸는 것이라면, 끊임없이 문제제기를 해야 할 세상의 문명 구조를 변화시키는 것이기에, 이 세상에서의 혁명적 역할을 하도록 부름을 받은 그리스도인들은 자신들의 상황이 본질적으로 혁명적임을 인식해야 한다. 그리스도인들은 모든 사회적 순응과 완전히 결별한 상태에서 자신의 사고와 행동을 통해 예언적 사명을 부여받기 때문에 현실 속에서 종말론의 힘을 지닌다. 따라서 예수 그리스도의 영광스러운 재림에 대한 소망은 그리스도인들을 기술적 독재에 맞설 수 있게 하는 혁명적인 상황에 놓이게 한다. 결국, 사회를 변화시킬 수 있는 진정한 기독교는 ‘혁명적 기독교’이며, 자신들이 사는 사회를 변화시킬 능력이 있는 사람들이 있다면, 그들은 바로 그리스도인들이다.","Le mouvement personnaliste de Jacques Ellul fonde sur des valeurs chretiennes, a pour point de depart l’idee suivante : pour mettre en pratique les activites revolutionnaires, il faudra quitter tous les modèles existants tels que les partis democratiques, toutes sortes de federations ou encore les partis totalitaires. Il faudra alors executer cette reforme de façon individuelle et collective et n’y appliquer que la methode communautaire. Chez Ellul, la revolution consiste à reformer fondamentalement la societe. Ainsi cette revolution authentique qu’il appelle aussi ‘la revolution necessaire’ est relative à la societe et à toute la civilisation. Elle est directement liee à la technicisation et est en relation avec l’etre humain lui-meme. En somme, ‘la revolution necessaire’ consiste à se dresser contre l’État technicise et la societe technicienne. Pourtant, la rupture brusque engendree par cette revolution n’est pas possible dans notre societe moderne et la veritable conscience revolutionnaire ne peut etre trouvee dans la societe technicienne. De ce fait, il semble que la revolution ne soit plus possible et que l’espoir de ‘la revolution necessaire’ ait dispau dans la societe technicienne. Cependant l’homme peut essayer de declencher ‘la revolte’ et refuser de manière instinctive et consciente ce qui s’impose à lui-meme. C’est ainsi que les modèles revolutionnaires desuets ne sont en aucun cas efficaces dans notre societe technicienne tout à fait nouvelle, et que le seul lieu où la revolution pourrait s’effectuer, c’est dans la conscience individuelle. En effet, la revolution ne peut s’accomplir que par l’homme libre, la seule revoluion possible dans cette situation etant de ne pas s’emparer du pouvoir, mais d’orienter les techniques modernes vers la liberation de l’homme en preservant leurs cotes positifs. Grace à cette revolution, la technique pourra etre subordonnee, le système technicien en tant que système pourra etre detruit, le pouvoir de l’État pourra disparaitre, l’egalite pourra etre mise en place et la desalienation pourra cesser. Or, les caracterisques essentielles de notre temps, c’est qu’il existe un statisme profond de la civilisation en opposition avec l’ardent desir de tenter ‘la revolution necessaire’, ce qui rend impossible ‘la revolution authentique’. Si le problème fondamental n’est pas de changer de formes economiques, mais de transformer la structure de notre civilisation qui devrait etre mise en question, ce sont les Chretiens qui sont appeles à remplir ce role revolutionnaire. Ils doivent reconnaitre que leur situation est essentiellement revolutionnaire. En effet, dans notre realite, les Chretiens detiennent la force eschatologique, en raison de la mission prophetique qui leur est attribuee au moyen de leurs idees et actions, puisqu’ils sont parfaitement separes de tous les conformismes sociaux. C’est ainsi que l’esperance du retour glorieux de Jesus Christ fait que les Chretiens se retrouvent dans une situation revolutionnaire où ils peuvent faire face à la dictature technicienne. Au bout du compte, s’il y a un christianisme authentique susceptible de transformer la societe, c’est bien justement ‘le christianisme revolutionnaire’, et s’il y a des personnes capables de transformer la societe, ce sont indubitablement les Chretiens."
BERT 를 활용한 한국어 개체명 인식기,2019,[],"개체명이란, 문서에서 특정한 의미를 가지고 있는 단어나 어구를 뜻하는 말로 사람, 기관명, 지역명, 날짜, 시간 등이 있으며 이 개체명을 찾아서 해당하는 의미의 범주를 결정하는 것을 개체명 인식이라고 한다. 본 논문에서는 BERT(Bidirectional Encoder Representations from Transformers) 활용한 한국어 개체명 인식기를 제안한다. 제안하는 모델은 기 학습된 BERT 모델을 활용함으로써 성능을 극대화하여, 최종 F1-Score 는 90.62 를 달성하였고, Bi-LSTM-Attention-CRF 모델에 비해 매우 뛰어난 결과를 보였다.",다국어 초록 정보 없음
주상변압기 저압권선의 두께변화에 따른 손실 분석,2019,"['Eddy Current', 'Transformer', 'Skin Effect', 'Proximity Effect.']","본 논문에서는 100kVA 주상변압기의 대하여 저압권선의 형상변화에 따른 표피효과와 근접효과를 분석하였다. 변압기에 경우 교류전류에 의해 권선의 표피효과(skin effect)와 다수의 권선이 근접함으로써 근접효과(Proximity effect)가 발생하게 된다. 해석결과 권선의 두께가커질수록 표피효과와 근접효과가의 영향이 커지게 되며, 이에 따라 전체 권선손실 또한 증가하였다.",다국어 초록 정보 없음
Study on the Protection and Energy Transmission Modes of One Phase Short Circuit to Ground in Inverters,2019,"['double boost circuit', 'inverters', 'short circuit', 'simulation and experiment']",국문 초록 정보 없음,"This paper introduces the mathematical model of a double boost circuit for the condition that the short circuit to ground happens to one phase of inverters, taking into account the impact of leakage inductance of power transformers. The corresponding energy transmission modes are analyzed, mainly focusing on the reason that the rectifier diode reverses voltage and the DC bus voltage rises. Then a novel method for rectifier determination, considering the short circuit to ground in one phase of inverters, is proposed. The effectiveness of the proposed method is verified by both simulation and experiment."
Resonance Investigation and Active Damping Method for VSC-HVDC Transmission Systems under Unbalanced Faults,2019,"['Core saturation', 'High voltage direct current', 'Impedance frequency characteristics', 'Resonance', 'Unbalanced fault', 'Virtual harmonic resistor', 'Voltage-source converter']",국문 초록 정보 없음,"Grid unbalanced faults can cause core saturation of power transformer and produce lower-order harmonics. These issues increase the electrical stress of power electronic devices and can cause a tripping of an entire HVDC system. In this paper, based on the positive-sequence and negative-sequence impedance model of a VSC-HVDC system as seen from the point of common connection (PCC), the resonance problem is analyzed and the factors determining the resonant frequency are obtained. Furthermore, to suppress over-voltage and over-current during resonance, a novel method using a virtual harmonic resistor is proposed. The virtual harmonic resistor emulates the role of a resistor connected in series with the commutating inductor without influencing the active and reactive power control. Simulation results in PSCAD/EMTDC show that the proposed control strategy can suppress resonant over-voltage and over-current. In addition, it can be seen that the proposed strategy improves the safety of the VSC-HVDC system under unbalanced faults."
Resonance Investigation and Active Damping Method for VSC-HVDC Transmission Systems under Unbalanced Faults,2019,"['Core saturation', 'High voltage direct current', 'Impedance frequency characteristics', 'Resonance', 'Unbalanced fault', 'Virtual harmonic resistor', 'Voltage-source converter']",국문 초록 정보 없음,"Grid unbalanced faults can cause core saturation of power transformer and produce lower-order harmonics. These issues increase the electrical stress of power electronic devices and can cause a tripping of an entire HVDC system. In this paper, based on the positive-sequence and negative-sequence impedance model of a VSC-HVDC system as seen from the point of common connection (PCC), the resonance problem is analyzed and the factors determining the resonant frequency are obtained. Furthermore, to suppress over-voltage and over-current during resonance, a novel method using a virtual harmonic resistor is proposed. The virtual harmonic resistor emulates the role of a resistor connected in series with the commutating inductor without influencing the active and reactive power control. Simulation results in PSCAD/EMTDC show that the proposed control strategy can suppress resonant over-voltage and over-current. In addition, it can be seen that the proposed strategy improves the safety of the VSC-HVDC system under unbalanced faults."
배치-적응형 공간 변형 네트워크를 이용한 도메인에 무관한 얼굴 특징점 추출,2019,[],국문 초록 정보 없음,"This paper focuses on developing a few-shot facial landmark detector that can operate on the general domain of face. Conventional methods typically used the huge amount of labeled data to perform human facial landmark detection or transferred the knowledge on the human domain to other domains. However, faces share similar geometric structure across various domains ranging from human, animals, cartoons, or even emojis. We propose domain-agnostic few-shot facial landmark detector (DAFF) that possesses both generalizability and dataefficiency. On top of model-agnostic meta-learning (MAML) framework, DAFF is composed of two components: (1) batch-adaptive spatial transformer network with triangle matching loss and (2) facial landmark regressor. Batch-adaptive spatial transformer network first transforms the input image to have a common structure for each facial domain, and facial landmark regressor localizes the position of both eyes and nose. For evaluation, we repurpose LHI-Animal-Faces dataset by adding facial landmark labels on each image. Experimental results show that DAFF outperforms previous methods significantly."
[전기기기] 전력용 변압기 권선의 탭 조건에 따른 단락 전자력 계산에 관한 연구,2019,"['Power trasformer', 'Short-circuit electromagnetic']",국문 초록 정보 없음,"This paper deals with short-circuit electromagnetic force of power transformer depending on tap condition. In order to reduce the analysis time, we used a 2-D axi-symmetric model. Firstly, in order to prove the 2-D axi-symmetric model, we calculated percent impedance and maximum value of leakage magnetic flux density by using analytical method and finite element method. Secondly, short-circuit currents are calculated by using a short-circuit equation. Finally, short-circuit electromagnetic forces produced by short-circuit currents are computed by finite element method. And the results has compared depending on tap condition. The results are expected to be useful in structure design of power transformer."
Modeling and Electromagnetic Transient (EMT) Simulation of a Dual Active Bridge DC-DC Converter,2019,"['Dual Active Bridge DC-DC Converter', 'EMT simulation', 'Constant admittance method', 'High efficient modeling', 'Impedance scanning analysis']",국문 초록 정보 없음,"The dual active bridge (DAB) DC-DC converter is the core link of a power electronic transformer (PET). With the development of PETs toward medium- and high-voltage applications, more DAB modules are adopted. However, conventional Electromagnetic Transient (EMT) simulation for a multi-switch circuit is quite time consuming. In this paper digest, a modified constant admittance method has been developed for modeling of an isolated DAB. By reducing the expense of admittance matrix reconstruction and related iterative operation at switching instant, the simulation efficiency has been improved significantly, and the new model becomes more suitable for a real-time simulation algorithm. Meanwhile, time domain simulations are given, which show that the proposed method can keep the same accuracy as the conventional model."
High-Efficiency Bidirectional Three-Phase LCC Resonant Converter With a Wide Load Range,2019,[],국문 초록 정보 없음,"<P>This paper details the design and implementation of an efficient 4-kW bidirectional converter with a wide load range, based on a three-phase LCC resonant converter operated in a continuous conduction model, which has a number of advantages pertaining to a bidirectional power supply. The voltage boost-up function yields a high voltage gain without increasing the transformer turn ratio. The high switching frequency, which is achievable by using the soft-switching condition and multiphase operation, decreases the output ripple and helps minimize the size of the output filter, as the requirement for a filter changes after the power flow. Moreover, this reduction in the size of the filters yields economic advantages. In addition, because of the synchronous rectifier operation employed during switching, the conduction loss in the rectifier diode of the proposed converter is low. The direction of the output power can be changed easily, using phase control. The implemented power converter is connected to a 320-V rated generator on one side and 28-V lead-acid batteries on the other side. The functionality of the proposed converter is verified in experiments. We confirmed the high performance of the developed converter in terms of efficiency (92.2%), operable load range (0–12.5 A in step-up, and 0–142 A in step-down), and voltage ripple (0.05%).</P>"
Current Sharing Behavior of Parallel Connected Silicon Carbide MOSFETs Influenced by Parasitic Inductance,2019,"['Parasitic inductor', 'current mismatch of SiC MOSFETs', 'coupled inductor', 'RCD snubber circuit']",국문 초록 정보 없음,"The parasitic inductance from the wirings and the terminals of SiC MOSFETs has a significant impact on the behavior of current sharing of parallel-connected SiC MOSFETs. To investigate the mechanism of current mismatch in response to the parasitic inductance, the circuit model of parallel-connected SiC MOSFETs is built to obtain the mathematic relationship between current difference and parasitic inductance in both dynamic and static states. Because the way of connecting the parallel-connected SiC MOSFETs with the coupled inductor in series can lead to the turn-off voltage ringing and overshoot, an improved structure is further proposed in this paper. A RCD snubber circuit is added into the proposed structure by referring to the coupled inductor with transformer in fly-back converter. Finally, the approach is verified through the LTspice software and experiments."
Investigation on Dielectric Failure of High Voltage Equipment in Substation Caused by Capacitor Bank Switching,2019,['ATP-EMTP · Capacitor bank switching · Electrical transient · Inrush current · Restriking voltage · Transient recovery voltage'],국문 초록 정보 없음,"This paper investigates transient phenomenon of electrical stresses caused by capacitor bank switching, damaging HV equipment in substation. The system of aged air-insulated 115 kV substation is modeled by using Alternative Transients Program- Electromagnetic Transients Program. The failed current transformer (CT) was comprehensively modeled and investigated.The comprehensive model for electrical transient simulation has been developed by using actual data and derived data from real physical dimension of equipment. The simulated results are challenged by comparison of the results from theoretical calculation according to international standard and the results from simulation including on-site measurement. The comparison results to verify the accuracy of the developed model are satisfactory. The results show that electrical stresses aff ecting CT by voltage stress exceeds CT’s 123 kV rating together with the frequent switching operations as hundreds of times per year. These lead to degradation of CT insulation, especially at the top insulation portion close to HV terminal due to nonlinear voltage distribution. Consequently, CT explosion fi nally occurred. This developed model is used as an eff ective tool for switching transient investigation to determine electrical stresses caused by various switching operations. With the known electrical stresses, the proper rating of equipment in HV substation can be selected."
