title,date,keywords,abstract,multilingual_abstract
Self-Attention을 활용한 Siamese CNN-Bidirectional LSTM 기반 문장 유사도 예측,2019,"['자연어 처리', '유사도 측정', '샴 네트워크', '합성곱 신경망', '순환 신경망', '어텐션', 'natural language processing', 'similarity measure', 'siamese network', 'convolution neural network', 'recurrent neural network', 'attention']",본 논문에서는 입력된 두 문장의 유사도를 측정하는 딥러닝 모델을 제안한다. 기존의 문장의유사도 측정 모델에는 단어 혹은 형태소 단위로 문장을 분해하여 임베딩 하는 방식을 활용한다. 하지만 이는 사전의 크기를 증가시켜 모델의 복잡도를 높이는 문제점이 있다. 본 논문에서는 문장을 음소 단위로 분해하여 모델 복잡도를 줄이고 해당 음소를 묶어주는 다양한 필터 사이즈의 1D Convolution Neural Network와 Long Short Term Memory(LSTM)을 결합한 Siamese CNN-Bidirectional LSTM 모델을 제안한다. 본 모델을 평가하기 위해 네이버 지식인 데이터를 활용하여 기존의 문서 유사 측정에서 좋은 성능을 보이는 모델 Manhattan LSTM(MaLSTM)과 비교하였다.,"A deep learning model for semantic similarity between sentences was presented. In general, most of the models for measuring similarity word use level or morpheme level embedding.However, the attempt to apply either word use or morpheme level embedding results in higher complexity of the model due to the large size of the dictionary. To solve this problem, a Siamese CNN-Bidirectional LSTM model that utilizes phonemes instead of words or morphemes and combines long short term memory (LSTM) with 1D convolution neural networks with various window lengths that bind phonemes is proposed. For evaluation, we compared our model with Manhattan LSTM (MaLSTM) which shows good performance in measuring similarity between similar questions in the Naver Q&A dataset (similar to Kaggle Quora Question Pair)."
스펙트럼 패턴 인식 기반 머신러닝 알고리즘을 사용한 플라스틱 섬광검출기용 핵종분별 알고리즘,2019,"['플라스틱 섬광검출기', '핵종분별 알고리즘', '기계학습', '합성곱 신경망']",국문 초록 정보 없음,다국어 초록 정보 없음
가로의 이미지가 절도범죄에 미치는 영향에 관한 기초연구,2019,"['범죄예방 환경설계', '가로 이미지', '범죄예측', '합성곱신경망', 'CPTED', 'Street image', 'Crime prediction', 'Convolutional neural network']",국문 초록 정보 없음,다국어 초록 정보 없음
CNN을 활용한 착륙 패드 부분 인식 상황에서의 패드 중심점 추정 기법 연구,2019,"['드론(Drone)', '정밀 착륙(Precision Landing)', '합성곱 신경망(Convolutional Neural Network', 'CNN)', '부분 인식(Partial Recognition)']",국문 초록 정보 없음,다국어 초록 정보 없음
딥러닝 및 영상처리 기술을 활용한 콘크리트 균열 검출 방법,2019,"['콘크리트 균열', '균열 검출', '딥러닝', '영상처리', '합성곱신경망', 'Concrete Crack', 'Crack Detection', 'Deep Learning', 'Image Processing', 'CNN']","현행 균열조사 업무는 육안조사로 이루어지고 있어 점검자의 주관이 개입되어 점검 결과에 차이가 발생하거나, 측정오차가 발생할 여지가 있다. 이에 본 연구는 콘크리트 균열 조사의 객관성과 효율성을 높이기 위하여 딥러닝 네트워크 중 실시간 분석이 가능한 YOLO v.2를 활용하여 균열을 인지하고, 영상처리 기술을 활용하여 균열의 특성정보를 추출하는 프로세스를 제시하였다. 실험 결과, 실시간 분석이 가능한 검출속도와 정확도를 확보할 수 있었다. 본 연구의 결과는 시설물 하자진단 자동화 시스템 개발의 기초자료로 활용될수 있을 것이다.","Most of the current crack investigation work consists of visual inspection using simple measuring equipment such as crack scale. Thesemethods involve the subjection of the inspector, which may lead to differences in the inspection results prepared by the inspector, and maylead to a large number of measurement errors. So, this study proposes an image-based crack detection method to enhance objectivity andefficiency of concrete crack investigation. In this study, YOLOv2 was used to determine the presence of cracks in the image information toensure the speed and accuracy of detection for real-time analysis. In addition, we extracted shapes of cracks and calculated quantitatively,such as width and length using various image processing techniques. The results of this study will be used as a basis for the development ofimage-based facility defect diagnosis automation system."
CNN 기반 열화상 카메라를 활용한 재실자의 열쾌적감 예측에 관한 연구,2019,"['열쾌적감', '열화상 카메라', '피부온도', '기계학습', '합성곱신경망', 'Thermal Comfort', 'Thermographic Camera', 'Skin Temperature', 'Machine learning', 'Convolutional Neural Network']",국문 초록 정보 없음,다국어 초록 정보 없음
건설 현장 이미지 관리를 위한 이미지 캡셔닝 기반 텍스트 정보 생성,2019,"['건설 현장 관리', '이미지 캡셔닝', '텍스트 처리', '합성곱 신경망', '순환 신경망']",국문 초록 정보 없음,다국어 초록 정보 없음
CNN을 이용한 익형의 공력 성능 예측,2019,"['Deep Leaning(심층학습)', 'Convolution Neural Network(합성곱 신경망)', 'Airfoil(익형)', 'Aerospace Application(항공우주적용)']",국문 초록 정보 없음,다국어 초록 정보 없음
적응형 채널 어텐션 모듈을 활용한 복합 열화 복원 네트워크,2019,"['Image restoration', 'Deep learning', 'Channel attention', 'CNN', '영상복원', '딥러닝', '채널 어텐션', '합성곱신경망']",자율 주행 자동차나 소방 로봇과 같은 시스템에서 영상을 얻을 때 다양한 요인들로 인해 잡음，블러와 같은 열화가 발생한 다. 이런 열화된 영상에 직접 영상 분류와 같은 기술을 적용하기 어려워 열화 제거가 불가피하나 이러한 시스템들은 영상의 열화를 인식할 수 없어서 열화된 영상을 복원하는데 어려움이 있다. 본 논문에서는 영상에 적용된 열화를 인지하지 못하는 상황에서 여러 방법들로 열화된 영상으로부터 자연스럽고 선명한 영상을 복원하는 방법을 제안한다. 우리가 제안한 방법은 딥러닝 모델에 채널 어텐션 모듈과스깁 커넥션을사용하여 영상에 적용된 열화에 따라복원에 필요한 채널에 높은 가중치를 적용해 복합 열화 영상의 복원을 진행한다. 이 방법은 다른복합 열화복원 방법 에 비해 학습이 간단하고 기존의 다른 방법들에 비 해 높은 복합 열화 복원 성능을 낸다.,"The image obtained from systems such as autonomous driving cars or fire-fighting robots often suffer from several degradation such as noise, motion blur, and compression artifact due to multiple factor. It is difficult to apply image recognition to these degraded images, then the image restoration is essential. However, these systems cannot recognize what kind of degradation and thus there are difficulty restoring the images. In this paper, we propose the deep neural network, which restore natural images from images degraded in several ways such as noise, blur and JPEG compression in situations where the distortion applied to images is not recognized. We adopt the channel attention modules and skip connections in the proposed method, which makes the network focus on valuable information to image restoration. The proposed method is simpler to train than other methods, and experimental results show that the proposed method outperforms existing state-of-the-art methods."
트위터 사용자들의 감성을 이용한 사회적 이슈 분석,2019,"['소셜 네트워크 서비스', '트위터', '감성 분류', '사회적 이슈 분석', '합성곱 신경망', 'Social network service', 'Twitter', 'Sentiment classification', 'Social issues analysis', 'Convolutional neural networks']","대중들의 소통의 창구로 자리매김 하고 있는 소셜 네트워크 서비스(SNS)에 작성된 글은 감성을 많이 포함하고 있다는 특징을 갖고 있다. 그 중 트위터는 공개 Application Programming Interface(API)를 통한 데이터의 수집이 편리하다는 장점을 지니고 있다. 본 논문에서는 트위터 상에 표현된 사용자들의 감성 정보를 통해 사회적 이슈를 분석하고 마케팅 분야 활용 가능성을 제시한다. 이는 국민 또는 소비자의 의견과 반응을 필요로 하는 정부, 기업 등에 도움이 될 수 있다. 본 논문에서는 최근 사회적 이슈에 대한 트위터 텍스트 데이터를 긍정 또는 부정으로 분류하여 질적 분석을 제공하였고, 각 트윗의 좋아요 수, 리트윗 수 등에 대한 상관관계 분석을 통해 양적분석을 제공하였다. 질적 분석의 결과로 국민의 지지를 얻기 위해 관세정책을 홍보하고, 버즈 사용자에게는 기술적 편의를 제공할 것을 제안하였다. 양적 분석의 결과, 트위터 사용자들의 관심을 끌기 위해서는 긍정적인 트윗을 짧고 간단하게 작성해야 함을 밝혔다. 데이터의 수집 기간이 짧고, 단 두 가지의 키워드만을 분석하여 일반화 가능성이 떨어지는 한계를 가져 향후, 보다 긴 기간의 다양한 사회적 이슈를 분석할 예정이다.","Recently, social network service (SNS) is actively used by public. Among them, Twitter has a lot of tweets including sentiment and it is convenient to collect data through open Aplication Programming Interface (API). In this paper, we analyze social issues and suggest the possibility of using them in marketing through sentimental information of users. In this paper, we collect twitter text about social issues and classify as positive or negative by sentiment classifier to provide qualitative analysis. We provide a quantitative analysis by analyzing the correlation between the number of like and retweet of each tweet. As a result of the qualitative analysis, we suggest solutions to attract the interest of the public or consumers. As a result of the quantitative analysis, we conclude that the positive tweet should be brief to attract the users' attention on the Twitter. As future work, we will continue to analyze various social issues."
중첩 분포 이미지를 활용한 회전체 고장 진단,2019,"['중첩분포이미지(Overlaid Distribution Image)', '상전류(Stator Current Signal)', '합성곱신경망(Convolution Neural Network)']",국문 초록 정보 없음,"In this study, the improved fault diagnosis method for bearings in the load part of the rotating system using stator current is proposed. In spite of many previous studies for detecting faults with stator current signals, the domain knowledge for feature extraction is still required. Moreover, the extraction of fault-related features is hindered by control related components or operating noise. By using overlaid distribution image (ODI), which can be implemented without any domain knowledge, stator current signals are converted to the image containing a large amount of information. The ODI images of stator current signal can contribute to the efficient fault-related feature extraction of the convolution neural networks which have shown outstanding performance in image recognition and classification. The experimental study using bearing fault dataset demonstrates high accuracy of the proposed method compared to other machine learning based fault diagnosis method."
A Study on Fault Classification of Machining Center using Acceleration Data Based on 1D CNN Algorithm,2019,"['Machining Center(머시닝센터)', 'Machine Learning(머신러닝)', 'Fault Signal Classification(고장신호 분류)', 'CNN(합성곱 신경망)']",국문 초록 정보 없음,"The structure of the machinery industry due to the 4th industrial revolution is changing from precision and durability to intelligent and smart machinery through sensing and interconnection(IoT). There is a growing need for research on prognostics and health management(PHM) that can prevent abnormalities in processing machines and accurately predict and diagnose conditions. PHM is a technology that monitors the condition of a mechanical system, diagnoses signs of failure, and predicts the remaining life of the object. In this study, the vibration generated during machining is measured and a classification algorithm for normal and fault signals is developed. Arbitrary fault signal is collected by changing the conditions of un stable supply cutting oil and fixing jig. The signal processing is performed to apply the measured signal to the learning model. The sampling rate is changed for high speed operation and performed machine learning using raw signal without FFT. The fault classification algorithm for 1D convolution neural network composed of 2 convolution layers is developed."
딥러닝 기반 병리학적 음성 진단 시스템,2019,"['Dysphagia(연하곤란', '삼킴장애)', 'Pathological voice(병적음성)', 'Convolutional neural network(합성곱 신경망)', 'Diagnosis(진단)', 'Short-time Fourier Transfer(단시간 푸리에 변환)', 'Mel Frequency Cepstral Coefficient(멜 주파수 셉스트랄 상수)']",국문 초록 정보 없음,다국어 초록 정보 없음
인공지능 기반 MNIST 손글씨 인식에 대한 연구,2019,"['Handwriting', 'SLR', 'ANN', 'CNN', 'Deep learning', '손글씨', '소프트맥스 회귀분석', '인공신경망', '합성곱신경망', '딥러닝']",국문 초록 정보 없음,"In the development of electronic devices such as PDAs, smartphones, and tablets, research on handwriting recognition has emerged. In the meantime, there have been efforts to recognize various handwriting such as numbers, Japanese, and English. However, there is a point that it is difficult to recognize when the font shape is relatively irregular, such as handwriting of children. As a result, the need for research to improve handwriting recognition rate by applying deep learning techniques has recently been raised. Therefore, this study attempted to improve handwriting recognition rate based on various deep learning techniques. In the case of handwriting, it is difficult to prepare a variety of data sets, which limits the recognition rate. In this study, we tried to improve the accuracy of handwriting recognition by using CNN technique in order to find a way to overcome these limitations. The techniques used were SLR, ANN, and CNN, each measuring the accuracy of each method. As a result, CNN showed the highest performance of 95%."
인공지능 기반의 행동인식을 통한 개인 운동 트레이너 구현의 방향성 제시,2019,"['Healthcare', 'Fitness', 'Artificial Intelligence', 'Deep Running', 'CNN', 'RNN', '헬스케어', '피트니스', '인공지능', '딥러닝', '합성곱 신경망', '순환 신경망']","최근 딥러닝을 비롯한 인공지능 기술의 활용이 다양한 분야에서 활발해지고 있으며, 특히 딥러닝 기술 기반의 객체 인식 및 검출에 뛰어난 성능을 보이는 여러 알고리즘들이 발표되고 있다. 이에 본 논문에서는 사용자의 편의성이 효과적으로 반영된 모바일 헬스케어 애플리케이션 구현에 대한 적절한 방향성을 제시하고자 한다. 기존의 피트니스 애플리케이션들에 대한 이용 만족도 연구 및 모바일 헬스케어 애플리케이션에 대한 현황을 파악하여, 이로부터 피트니스 애플리케이션 시장에서의 생존과 우위를 확보하는 동시에, 최근 주목 받고 있는 인공지능 기술의 효과적인 적용에 의한 성능 개선을 통해 기존 이용자 유지 및 확대를 도모하고자 한다.","Recently, the use of artificial intelligence technology including deep learning has become active in various fields. In particular, several algorithms showing superior performance in object recognition and detection based on deep learning technology have been presented. In this paper, we propose the proper direction for the implementation of mobile healthcare application that user's convenience is effectively reflected. By effectively analyzing the current state of use satisfaction research for the existing fitness applications and the current status of mobile healthcare applications, we attempt to secure survival and superiority in the fitness application market, and, at the same time, to maintain and expand the existing user base."
다중 넓이 커널 CNN을 이용한 구름 요소 베어링 고장 진단,2019,"['구름 요소 베어링(Rolling element bearing)', '전이 학습(Transfer learning)', '고장 진단(Fault diagnosis)', '합성곱신경망(Convolution neural networks)']",국문 초록 정보 없음,다국어 초록 정보 없음
망막혈관 검출을 위한 영상분할기법,2019,"['당뇨망막병증(DR: Diabetic Retinopathy)', '망막혈관(Retinal Blood Vessel)', '영상강화(Image Enhancement)', '형태학적 영상처리(Morphological Image Processing)', '합성곱 신경망(Convolutional Neural Network)']",국문 초록 정보 없음,다국어 초록 정보 없음
한국어 음성 명령어 인식을 위한 자동데이터 구축,2019,"['Korean Speech Command', 'Speech Recognition', 'Automatic Data Construction', 'ResNet', 'CNN', '한국어 명령어 인식', '음성인식', '자동 데이터 구축', '레스넷', '합성곱신경망']","최근 화두가 되고 있는 AI분야에서 가장 큰 문제점은 학습데이터의 부족 문제를 꼽을 수 있다. 수동 데이터 구축에는 많은 시간과 노력이 소요되기에 개인이 손쉽게 필요 데이터를 구축하기는 매우 어렵다. 반면, 수동 데이터 구축에 비해 자동으로 구축하는 것은 높은 품질을 유지하는 것이 관건이다. 본 논문에서는 한국어 음성 명령어 인식기 개발에 필요한 데이터를 웹에서 자동으로 추출하고, 학습데이터로 사용할 수 있는 데이터를 자동으로 선별하는 방법을 소개한다. 특히, 자동 구축된 한국어 음성 데이터를 대상으로 우수한 성능을 보이는 ResNet기반의 수정 모델을 기반으로, 건강 및 일상생활도메인의 명령어 셋을 대상으로 적용가능성을 보이기 위한 실험을 진행하였다. 자동으로 구축된 데이터만을 사용한 일련의 실험에서 건강도메인은 ResNet15에서 89.5%, 일상생활도메인에서는 ResNet8에서 82%의 정확도를 보임으로써, 자동 수집 데이터의 활용 가능성을 검증하였다.","The biggest problem in the AI field, which has become a hot topic in recent years, is how to deal with the lack of training data. Since manual data construction takes a lot of time and efforts, it is non-trivial for an individual to easily build the necessary data. On the other hand, automatic data construction needs to handle data quality issue. In this paper, we introduce a method to automatically extract the data required to develop Korean speech command recognizer from the web and to automatically select the data that can be used for training data. In particular, we propose a modified ResNet model that shows modest performance for the automatically constructed Korean speech command data. We conducted an experiment to show the applicability of the command set of the health and daily life domain. In a series of experiments using only automatically constructed data, the accuracy of the health domain was 89.5% in ResNet15 and 82% in ResNet8 in the daily lives domain, respectively."
PointNet을 이용한 위성 부분품 분류 모델 연구,2019,"['PointNet(포인트넷)', 'Point Cloud(포인트클라우드)', '3D Classification Model(3차원 분류 모델)', 'Convolution Neural Network(합성곱신경망)']",국문 초록 정보 없음,다국어 초록 정보 없음
이미지 기반 품질 관리 기법의 스마트 팩토리 현장 적용 이슈와 전략,2019,"['Quality Management', 'Machine Learning', 'Convolution Neural Network', 'Smart Factory', '품질 경영', '기계 학습', '합성곱 신경망', '스마트 팩토리']","콘볼루션 신경망 기술의 발전이 영상 기반 품질 경영에서의 전처리 부담을 많이 줄여주는 의미가 있지만, 콘볼루션 신경망의 발전이 전처리 노력을 완전히 제거해주지는 못한다. 그러나, 조금만 훈련받으면 컴퓨터 비전 전문가가 아니더라도 영상 기반의 품질 관리를 할 수 있으며, 이에 기반하여 가변적인 생산체계에 빠르게 적응할 수 있다. 스마트 팩토리에서 자동화된 품질관리를 현실에서 실제 적용하는 것은, 이 방법론들을 이해하고, 이를 일부 구현하여 적용하거나, 통합적으로 구현하여 완전 자동화하는 형태로 진행된다. 이 논문은 스마트 팩토리 환경에서 자동화된 품질 검사를 위한 이미지 기반 품질 관리 기법들을 개관하고 현실에 이러한 기법을 실제 적용하는 데에서 나타나는 이슈와 전략에 대해 토론한다.","Although the development of convolutional neural network technology reduces a lot of preprocessing burden in image-based quality management, it does not completely eliminate the preprocessing effort. However, with a little training, even non-computer vision specialists can perform image-based quality management, which allows them to quickly adapt to variable manufacturing systems. The actual application of automated quality control at the smart factory in the real world is based on understanding, implementing, and integrating these methodologies. This paper provides an overview of image-based quality management techniques for automated quality inspection in a smart factory environment and discusses the issues and strategies of applying these techniques in practice."
라이다 센서 데이터를 이용한 구형 특징 표현 기반의 도시 구조물 3차원 점 군 분류에 관한 연구,2019,"['a라이다 센서', '거리 데이터', '물체 인식', '도시 구조물', '키티 데이터', '구형 특징 표현', '합성곱 신경망', 'LiDAR Sensor', 'Depth Data', 'Object Recognition', 'Urban Structure', 'KITTI Data', 'Spherical Signature Descriptor', 'Convolutional Neural Network']","물체 인식은 영상 등의 이미지 정보와 깊이 정보 등의 센서 데이터를 이용하여 물체의 종류와 크기, 방향, 위치 등의 고차원적인 공간 정보를 실시간으로 알아내는 기술로 자율주행의 기본 기술이 된다. 본 논문에서는 거리 데이터 기반의 물체인식을 목표로 하고 있으며, 3차원 점을 구성하고 있는 모든 점에 의미를 부여 할 수 있는 구형 특징 표현을 이용한 학습 데이터 생성을 제안하였다. 구형 특징 표현을 이용하여 생성된 학습 데이터는 주변 점들의 분포와 밀집도를 이용하여 한 점의 특징을 정의 함으로서 모든 점들에 대하여 생성이 가능하기 때문에 인공지능을 위한 학습데이터 준비에 매우 용이하게 사용될 수 있다. 본 논문에서는 KITTI 데이터와 직접 수집한 라이다 센서 데이터를 구형 특징 표현에 적용하여 학습 데이터를 생성하고 생성된 학습 데이터를 인공지능 학습의 한 종류인 CNN(Convolutional Neural Network)에 입력하여 도시 구조물에 대한 3차원 점 군을 분류하고자 하였다.","Object recognition is a technology that detects real-time high-dimensional spatial information such as type, size, direction, and position of an object using sensor data such as image information and depth information of photographs. In this study, we aim at achieving object recognition based on distance data and propose the generation of learning data using the spherical signature descriptor capable of giving meaning to all points composing a 3D point group. The learning data generated by using the spherical signature descriptor can easily be used for generating learning data for artificial intelligence because it is possible to define the characteristics of a point using the distribution and density of the surrounding points and to generate from all the points. In this study, we generated learning data by applying collected KITTI and LiDAR sensor data directly to the spherical signature descriptor and classifying the urban structures through artificial intelligence learning using a CNN (convolutional neural network)."
