title,date,keywords,abstract,multilingual_abstract
음성 분류 인공신경망을 활용한 자폐아 치료용 로봇의 지능화 동작 연구,2019,"['Autism Spectrum Disorders', 'Autistic Children Training', 'MFCC', 'Convolutional Neural Network', 'Speech Data Classification']",현재 아이들의 자폐스펙트럼장애 유병률이 한층 더 높게 보고되고 있으며 다양한 형태의 장애 징후를 보이고 있다. 특히 이들은 사회적 의사소통 영역에서 의사소통장애로 인한 대화에 어려움을 겪고 있으며 이를 훈련을 통해 개선 시킬 필요가 대두된다. 이를 위해 본 연구에서는 사전 연구를 통해 설계된 로봇에 장착된 마이크를 통해 음성 정보를 취득하고 이러한 정보를 이용하여 지능적인 동작을 만드는 방식을 제안한다. 음성 정보를 로봇 동작으로 분류하기 위해 인공신경망을 이용하였으며 여러 신경망 기법중 합성곱 방식을 기본으로 한 순환신경망을 결합하여 정확도를 향상시키려고 하였다. 입력 음성 데이터의 전 처리는 MFCC를 이용하여 분석하였으며 여러 데이터 정규화 및 인공신경망 최적화 기법을 활용하여 로봇의 동작을 추정하였다. 아울러 설계된 인공신경망은 기존에 사용한 구조 및 사람이 개입하여 분석하는 방법과의 정확도 비교 실험을 진행하여 분석 결과가 높은 정확도를 나타냈다. 향후 보다 높은 정확도를 가질 수 있는 로봇 동작을 설계하여 실제의 자폐아 치료 및 교육환경에서 적용할 수 있기 위하여 다양한 형태의 데이터를 수집하고 효율적으로 전처리하는 방식에 대한 연구가 요구된다.,"Currently, the prevalence of autism spectrum disorders in children is reported to be higher and shows various types of disorders. In particular, they are having difficulty in communication due to communication impairment in the area of social communication and need to be improved through training. Thus, this study proposes a method of acquiring voice information through a microphone mounted on a robot designed through preliminary research and using this information to make intelligent motions. An ANN(Artificial Neural Network) was used to classify the speech data into robot motions, and we tried to improve the accuracy by combining the Recurrent Neural Network based on Convolutional Neural Network. The preprocessing of input speech data was analyzed using MFCC(Mel-Frequency Cepstral Coefficient), and the motion of the robot was estimated using various data normalization and neural network optimization techniques. In addition, the designed ANN showed a high accuracy by conducting an experiment comparing the accuracy with the existing architecture and the method of human intervention. In order to design robot motions with higher accuracy in the future and to apply them in the treatment and education environment of children with autism."
< 구두-B-09 > 근적외선 스펙트럼을 이용한 부분 최소 자승 판별분석법과 인공신경망에 의한 목재 수종 구분,2019,[],"목재의 수종을 식별하기 위해 목재의 해부학적 세포 조직 비교 분석 또는 DNA 분석 등의 방법이 실시되고 있다. 그러나 두 방법 모두 시험편의 절단이 필요하고, 분석에 오랜 시간이 필요하며, 충분히 숙련된 전문가가 필요하다. 본 연구에서는 목재의 수종을 간편하고 신속하게 구분하기 위하여 근적외선 분광분석법과 인공신경망을 이용한 수종 구분 방법을 개발하였다. 국내 제재목 생산업에서 침엽수 소비량 중 대다수를 차지하고 있는 낙엽송(Larix kaempferi), 소나무(Pinus densiflora), 잣나무(Pinus koraiensis) , 삼나무(Cryptomeria japonica) 및 편백(Chamaecyparis obtusa)의 수종을 구분하기 위해 기건된 제재목에서 근적외선 스펙트럼을 측정하여 부분 최소 자승 판별 분석(Partial least squares discriminant analysis, PLS-DA) 및 인공신경망(Artificial neural network)에 의한 수종 구분을 실시하였다. 근적외선 스펙트럼의 수학적 전처리에 따라 PLS-DA 모델의 수종 구분 성능은 차이가 나타났다. 이 중, 가장 높은 신뢰도를 나타낸 Savitzky-Golay 2<sup>nd</sup> derivatives 전처리가 실시된 근적외선 스펙트럼을 이용한 PLS-DA 모델의 정확도는 95.2%, 최소 정밀도는 99.2%, 최소 재현율은 91.5%로 평가되었다. 근적외선 분광 분석법에서 사용되는 수학적 전처리에 대한 의존도를 낮추기 위하여 인공신경망 분류 알고리즘 중 신경망이 직접 수종 구분에 필요한 최적의 전처리 방법을 찾아나가는 1차원 합성곱 신경망을 이용한 수종 구분을 실시한 결과, 근적외선 스펙트럼의 수학적 전처리 정도에 상관없이 정확도, 정밀도 및 재현율이 모두 99.9% 이상으로 평가되었다.",다국어 초록 정보 없음
신경망 구조 탐색 기반 회전체 시스템 진단 기술 개발,2019,"['신경망 구조 탐색(Neural Architecture Search)', '건전성 진단(Health Diagnosis)', '합성곱 신경망(Convolutional Neural Networks)', '저널베어링 회전체 시스템(Journal Bearing Rotor System)', '딥러닝(Deep Learning)']",국문 초록 정보 없음,다국어 초록 정보 없음
Seq2SPARQL: 신경망 기계 번역을 사용한 지식 베이스 질의 언어 자동 생성,2019,[],국문 초록 정보 없음,"SPARQL(SPARQL Protocol and RDF Query Language)은 지식 베이스를 위한 표준 시맨틱 질의 언어이다. 최근 인공지능 분야에서 지식 베이스는 질의 응답 시스템, 시맨틱 검색 등 그 활용성이 커지고 있다. 그러나 SPARQL 과 같은 질의 언어를 사용하기 위해서는 질의 언어의 문법을 이해하기 때문에, 일반 사용자의 경우에는 그 활용성이 제한될 수밖에 없다. 이에 본 논문은 신경망 기반 기계 번역 기술을 활용하여 자연어 질의로부터 SPARQL 을 생성하는 방법을 제안한다. 우리는 제안하는 방법을 대규모 공개 지식 베이스인 Wikidata 를 사용해 검증하였다. 우리는 실험에서 사용할 Wikidata 에 존재하는 영화 지식을 묻는 자연어 질의-SPARQL 질의 쌍 20,000 건을 생성하였고, 여러 sequence-to-sequence 모델을 비교한 실험에서 합성곱 신경망 기반의 모델이 BLEU 96.8%의 가장 좋은 결과를 얻음을 보였다."
트리 기반 컨볼루션 신경망을 이용한 BigCloneBench 개선,2019,"['코드 클론', '클론 검사', '기계 학습', '벤치마크', '합성곱 신경망', 'code clone', 'clone checking', 'machine learning', 'benchmark', 'Convolutional Neural Network']",국문 초록 정보 없음,"BigCloneBench has recently been used for performance evaluation of code clone detection tool using machine learning. However, since BigCloneBench is not a benchmark that is optimized for machine learning, incorrect learning data can be created. In this paper, we have shown through experiments using machine learning that the set of Type-4 clone methods provided by BigCloneBench can additionally be found. Experimental results using Tree-Based Convolutional Neural Network show that our proposed method is effective in improving BigCloneBench’s dataset."
열화상 영상 잡음 제거를 위한 효율적인 잡음 제거 블록 기반의 신경망,2019,"['image denoising', 'convolutional neural networks', 'thermal image', 'laplace noise', 'receptive field', 'residual leraning']","열화상 카메라는 제한된 열화상 해상도로 인해 잡음이 있는 영상을 야기한다. 본 논문에서는 잡음 문제를 해결하기 위해 반복 가능한 인셉션-레지듀얼 블록(IRB)으로 이루어진 새로운 딥러닝 기반의 신경망을 제안한다. 각각의 IRB는 원본 이미지에 대하여 서로 다른 수용 영역을 가진 합성곱 층 2개를 가지고 베니싱 그레디언트(vanishing gradient)를 방지하기 위한 하나의 쇼트 컷(shortcut connection)으로 구성된다. 제안된 방법은 12개의 열화상 이미지로 테스트가 이루어졌다. 실험 결과, 제안된 방법은 최신의 잡음 제거 방법인 DnCNN과 비교해 봤을 때 신호대잡음비(PSNR)를 39.57에서 40.26으로 처리속도는 1.5910초에서 0.7508초로 잡음 제거 성능 및 처리 속도 개선을 보여준다.","Thermal cameras show noisy images due to their limited thermal resolution, especially for the scenes of a low-temperature difference. In order to deal with a noise problem, this paper proposes a novel neural network architecture with repeatable denoising inception-residual blocks(DnIRB) for noise learning. Each DnIRB has two sub-blocks with difference receptive fields and one shortcut connection to prevent a vanishing gradient problem. The proposed approach is tested for 12 thermal images. The experimental results indicate that the proposed approach shows the PSNR performance is increased 39.57 to 40.26 and processing time also is reduced 1.5910 to 0.7508 compared with state-of-the-art denoising methods which is called DnCNN."
위상수학적 데이터 분석과 심층 학습을 이용한 VLBI 시계열 데이터 분석,2019,[],"지구회전운동 물리량에 대한 정밀한 분석은 지구환경 변화의 이해와 장 · 단기적 기후변화 예측에 필수적인 요소이다. 초장기선 간섭계에 의한 관측(VLBI)의 발전은 굉장히 정밀한 지구 극 운동의 관측을 가능하게 해주었다. 이 연구에서는 VLBI 데이터에서 발생하는 이상 움직임을 위상수학적 데이터 분석과 심층 학습을 이용하여 탐지하는 정확하고 효율적인 방법을 제안한다. 푸리에 분석법과 스펙트로그램 분석법 등과 같은 전통적인 신호 분석 방법은 선형적인 모형에 국한되는 한계가 있지만, 본 연구에서 제안하는 방법은 이를 보완하여 보다 더 일반적인 형태의 신호까지로도 확장될 수 있다. 위상수학적 데이터 분석과 합성곱신경망을 이용한 지구회전운동 잔차 분석 결과를 통해 본 연구에서 제안한 방법이 VLBI 데이터에 대해 잘 작동하고 유의미한 결과를 도출하는 것을 보여준다.",다국어 초록 정보 없음
Fast R-CNN을 이용한 객체 인식 기반의 도로 노면 파손 탐지 기법,2019,"['도로 노면 파손', '심층 신경망', '유지보수', '영역 기반 합성곱', '객체 인식', 'Road surface damage', 'Deep neural network', 'Road maintenance', 'Region based convolutional neural networks', 'Object recognition']",국문 초록 정보 없음,다국어 초록 정보 없음
CNN 을 이용한 단일영상 고해상도 복원 및 수용영역 확장을 통한 성능 향상,2019,[],"합성곱 신경망의 성능이 증가하면서 다양한 영상 처리 문제를 해결하기 위해 합성곱 신경망을 적용한 시도들이 증가하고 있다. 고해상도 복원 문제도 그 중 하나였으며, 보다 높은 성능을 얻기 위해 주로 신경망의 깊이를 깊게 하는 시도들이 있었다. 본 논문에서는 고해상도 복원 작업을 위한 합성곱 신경망의 성능 향상을 위해 깊이를 증가시키는 접근법이 아닌 수용영역을 확장시키는 접근법을 시도하였다. 논문에서 제시한 모델은 신경망 내부에 두 개의 브랜치를 두어, 하나의 브랜치는 Dilated Convolution 을 이용해 수용영역을 확장하는데 사용되며, 다른 하나는 이 브랜치를 통해 나온 feature 를 가공하는데 사용된다. 기본 모델은 EDSR 을 사용하였으며, 최종적으로 4.79M 의 파라미터로 평균 32.46dB 의 PSNR 을 보여주었다. 하지만 모델의 구조가 복잡하여 깊이를 늘이는 접근법을 적용하기 어렵다는 한계점이 있다.",다국어 초록 정보 없음
딥러닝에 의한 객체인식 향상을 위한 학습 데이터의 효과적 구성: Mask R-CNN을 중심으로,2019,"['딥러닝', '합성곱 신경망', 'Mask R-CNN', '학습 데이터']",인공지능을 실현하기 위한 딥러닝(DL)은 최근 컴퓨팅 파워가 향상됨에 따라서 여러 분야에서 활용되고 있다. 합성곱 신경망(CNN: Convolutional Neural Network)은 영상 학습을 위한 대표적인 DL모델이다. CNN에서 발전된 영역기반 합성곱 신경망(R-CNN: Region- based Convolutional Neural Network)은 객체가 존재하는 영역을 탐지하고 객체를 인식하는 DL 모델이다. 본 연구에서는 R-CNN 중 가장 최근에 개발된 Mask R-CNN의 학습 데이터를 효과적으로 구성하여 건물의 인식 정확도를 높일 수 있는 방안을 제시하였다.,다국어 초록 정보 없음
GPR 히트맵 이미지 데이터 기반 CNN을 이용한 철근 두께 예측에 관한 연구,2019,"['GPR', 'B-scan', '히트맵', '합성곱 신경망', '철근', '두께', 'Ground Penetrating Radar', 'B-scan', 'heatmap', 'Convolution Neural Network', 'Rebar Thickness']","본 논문에서는 시설물 내부 철근 두께를 예측하기 위해 GPR 데이터를 활용한 철근 두께 예측 기법에 관한 연구를 실시하였다. 국내의 규격 미달 철근의 사용 및 배근 시공과 같은 부실시공 사례에서 볼 수 있듯이, 구조물 정밀진단을 위해서 철근 두께에 대한 정보는 정밀 안전진단을 위해서 꼭 필요함을 알 수 있다. 이를 위해 본 연구에서는 시편을 제작하여 철근 직경을 단계적으로 증가시켜 GPR의 B-scan 데이터를 취득하였다. GPR 의 B-scan 데이터는 가시성이 떨어지기 때문에 이를 migration을 통해 히트맵 이미지 데이터로 변화시켜 데이터의 직관성을 높이고자 하였다. 본 연구는 보편적으로 이용되는 B-scan 데이터와 히트맵 데이터의 합성곱 신경망(CNN) 적용 시 결과를 비교하기 위해 B-scan 및 히트맵 데이터에서 각각 철근에 대한 영역을 추출하여 학습 및 검증 데이터를 구축하였으며, 구축된 데이터에 CNN을 적용하였다. 그 결과, 히트맵 데이터의 경우 B-scan 데이터와 비교하였을 때 더 좋은 결괏값을 얻을 수 있었다. 이를 통해 GPR 히트맵 데이터를 이용하였을 경우 B-scan 데이터를 이용하였을 때보다 더 높은 정확도로 철근 두께를 예측할 수 있음을 확인하였으며, 시설물 내부 철근 두께 예측의 가능성을 검증하였다.","In this paper, a study was conducted on the method of using GPR data to predict rebar thickness inside a facility. As shown in the cases of poor construction, such as the use of rebars below the domestic standard and the construction of reinforcement, information on rebar thickness can be found to be essential for precision safety diagnosis of structures. For this purpose, the B-scan data of GPR was obtained by gradually increasing the diameter of rebars by making specimen. Because the B-scan data of GPR is less visible, the data was converted into the heatmap image data through migration to increase the intuition of the data. In order to compare the results of application of commonly used B-scan data and heatmap data to CNN, this study extracted areas for rebars from B-scan and heatmap data respectively to build training and validation data, and applied CNN to the deployed data. As a result, better results were obtained for the heatmap data when compared with the B-scan data. This confirms that if GPR heatmap data are used, rebar thickness can be predicted with higher accuracy than when B-scan data is used, and the possibility of predicting rebar thickness inside a facility is verified."
수도 레이블을 활용한 준지도 학습 기반의 도로노면 파손 탐지,2019,"['Road surface damage', 'Semantic segmentation', 'Convolutional neural network', 'Semi-supervised learning', '도로노면 파손', '의미론적 분할', '합성곱 신경망', '준지도 학습']","의미론적 분할 형태로 합성곱 신경망을 구성하여 도로노면의 파손을 탐지하는 연구가 진행되고 있다. 이러한 합성곱 신경망 형태의 모델을 생성하기 위해서는 입력 이미지와 이에 상응한 레이블된 이미지 데이터셋으로 수집해야 하고, 이러한 과정에서는 굉장히 많은 시간과 비용이 발생하게 된다. 본 논문에서는 이러한 작업을 완화하기 위하여 수도 레이블링을 활용한준지도 학습 기반의 도로노면 파손 탐지 기술을 제안하고자 한다. 레이블된 데이터셋과 레이블되지 않은 데이터셋을 적절하게 혼합하여 도로노면 파손을 탐지하는 모델을 업데이트하고, 이를 레이블된 데이터셋만을 활용한 기존 모델과 성능을 비교한다. 주관적인 성능결과, 민감도부분에서는 조금 저하된 성능을 보였지만, 정밀도 부분에서는 대폭 성능 향상이 있었으며, 최종적으로 F1-score 또한 높은 수치로 평가되었다.","By using convolutional neural networks (CNNs) based on semantic segmentation, road surface damage detection has being studied. In order to generate the CNN model, it is essential to collect the input and the corresponding labeled images. Unfortunately, such collecting pairs of the dataset requires a great deal of time and costs. In this paper, we proposed a road surface damage detection technique based on semi-supervised learning using pseudo labels to mitigate such problem. The model is updated by properly mixing labeled and unlabeled datasets, and compares the performance against existing model using only labeled dataset. As a subjective result, it was confirmed that the recall was slightly degraded, but the precision was considerably improved. In addition, the F1-score was also evaluated as a high value."
Word2Vec과 2계층 양방향 장단기 기억 네트워크를 이용한 특허 문서의 자동 IPC 분류,2019,"['텍스트 마이닝', '문서 분류', '순환 신경망', 'text mining', 'document classification', 'recurrent neural network']","자연어 처리를 이용한 문서 분류 분야에서도 전통적인 방법에서 벗어나 단어 임베딩을 활용한 합성곱 신경망과 순환 신경망 등 심층 신경망을 이용한 다양한 연구가 진행되고 있다. 본 논문에서는 Word2Vec과 두 개의 계층으로 구성된 양방향 장단기 기억 네트워크를 이용한 특허 문서의 IPC(International Patents Classification) 자동 분류 모델을 제안한다. IPC는 세계지식재산권기구에서 제정한 국제적으로 통일된 특허 분류 기준이며, 각 국가의 공인된 기관에서 수작업으로 분류하고 있다. IPC 자동 분류를 위하여 입력 시퀀스에 Word2Vec을 이용한 단어 임베딩가중치를 사용한다. 그리고 가중치가 부여된 시퀀스를 두 개의 계층을 갖는 깊은 구조의 양방향 장단기 기억 네트워크 신경망에 입력하여 IPC를 분류한다. 실험 결과 특허 문서의 분류 정확도가 합성곱 신경망 보다는 약 7% 향상되었으며, 순환 신경망을 단일로 이용하는 것 보다는 약 5% 향상된 것을 확인할 수 있었다. 또한 전통적인 방법인 나이브 베이시안, 로지스틱 분류 및 서포트 벡터 머신보다는 5~12% 이상 우수한 성능을 나타내었다.","There are various studies using Deep Neural Network such as CNN(Convolutional Neural Network) and RNN(Recurrent Neural Network) that utilize word embedding in document classification using natural language processing out of traditional methods. In this paper, we propose the IPC(International Patents Classification) automatic classification model of patent documents using two layers BLSTM(Bidirectional Long Short Term memory) network. The IPC is an internationally uniform standard for patent classification established by the World Intellectual Property Organization and is categorized by hand in authorized agencies in each country. For the IPC automatic classification, we use word embedding weight with Word2Vec in the input sequences. And they are classified by entering a weighted sequences into a deep neural network with two layers BLSTM. The experimental results showed that the accuracy of classification is improved by about 7% than that of CNN, and about 5% than that of single layer LSTM that is a field of RNN. Also it showed more than 5~12% higher performance than traditional methods such as Naive Bayes, Logistic and Support Vector Machine classification."
지능형 관광 서비스를 위한 관광 사진 분류체계 개발,2019,"['플리커', 'SNS', '관광목적 사진 분류체계', '딥러닝', '합성곱신경망', '한국 관광', 'Flickr', 'Social Network Service', 'Photo Classification for Tourist purpose', 'Deep Learning', 'Convolutional Neural Network', 'Korea Tour']","최근 딥러닝 기술 가운데 이미지데이타 분석에 뛰어난 성능을 보이는 합성곱신경망 기술의 발전은 이미지 분석 영역에서다양한 가능성을 제시하고 있다. 관광객이 게시한 사진을 딥러닝 기술을 이용하여 분류하기 위해서는 관광사진에 대한 분류와목적에 맞는 딥러닝 모델의 훈련작업이 필수적으로 선행되어야 한다. 본 연구에서는 관광객이 플리커에 게시한 사진을 효율적으로분류하기 위해 관광목적으로 사진이 어떻게 분류되어야 하는지 관광목적 사진분류 체계를 개발하고자 하였다. 관광목적 사진분류 카테고리 개발을 위해 문헌분석, 웹사이트 분석, 관광객이 게시한 약 38,000장 사진의 검토과정을 거쳐 사진 분류 카테고리를개발하였으며, 약 8400장의 사진을 개발된 카테고리에 맞춰 분류해 봄으로써 개발된 카테고리의 검증과정을 거쳤다. 이 과정을거쳐 최종으로 제안된 카테고리는 13개 대분류, 64개 중분류, 164개의 세분류 체계를 갖으며, 본 연구 결과는 향후 관광목적사진을 딥러닝 모델을 이용하여 분류하고자 할 때 기초자료로 활용될 것으로 기대된다.","In recent years technology of Convolutional Neural Network (CNN) among the technologies of deep learning has evolved dramatically and has shown an outstanding performance in the analysis of image data. First of all, the training of deep learning model is prerequisite to classify the photos posted by the tourists on Web by applying CNN technology. In this study we aim to develop the photo classification system in view of travel purpose in order to classify the photos posted by tourists on Flickr. We developed the category for photo classification by reviewing around 38,000 photos posted by tourists as well as by analysing literatures and web sites, and then verified the category by classifying 8,400 photos one by one manually according to the category developed. The category we developed has 3 hierarchical levels such as 13 major classification, 64 medium classification and 164 minor classification. We expect that our study can applied in base material when one tries to classify the photos for travel purpose by using the CNN deep learning model."
