title,date,keywords,abstract,multilingual_abstract
LeafNet: 합성곱 신경망을 이용한 식물체 분할,2019,"['Deep learning', 'Segmentation', 'Plant phenomics', 'Phenomics system', 'CNN', '딥 러닝', '분할', '식물 표현체', '피노믹스 시스템', '합성곱 신경망']","식물 표현체(plant phenomics) 연구는 우수한 형질의 식물 품종과 유전적 특성을 선별하기 위해 여러 식물체의 형태적 특징을 관측하고, 획득한 영상 빅데이터를 분석하는 기술이다. 기존의 방법은 검출 대상에 따라 직접 색상 임계값을 변경해야 하기 때문에 빅데이터를 다루는 정밀검정시스템에 적용하기 어렵다. 본 논문에서는 정밀검정시스템을 위한 식물체와 배경의 자동 분할이 가능한 합성곱 신경망(Convolution neural network: CNN) 구조를 제안한다. LeafNet은 9개의 컨벌루션 계층과 식물의 유무를 판단하기 위한 시그모이드(Sigmoid) 활성화 함수로 구성된다. LeafNet을 이용한 학습 결과, 식물 모종 영상에 대하여 정밀도 98.0%, 재현율 90.3%의 결과가 도출되어 정밀검정시스템의 적용 가능성을 확인하였다.",다국어 초록 정보 없음
자모 단위 합성곱 신경망 기반 맞춤법 오류가 포함된 자주 묻는 질문 자동 분류,2019,"['sentence classification', 'data with spelling errors', 'frequently asked questions', 'class embedding', '문장 분류', '맞춤법 오류가 포함된 데이터', '자주 묻는 질문', '클래스 임베딩']","웹이나 모바일 사용자는 홈페이지에 구축된 자주 묻는 질문 시스템(Frequently Asked Question: FAQ, 이하 FAQ)을 이용하여 원하는 정보를 얻는다. 기존 FAQ 시스템은 검색 모델을 기반으로 입력과 가장 유사하다고 판단되는 질의응답 후보를 사용자에게 보여준다. 하지만 검색 모델은 문서 색인에 의존하기 때문에 입력 문장의 맞춤법 오류에 취약하다. 따라서 본 논문에서는 FAQ 시스템을 문장분류기에 적용하여 맞춤법 오류를 최소화하는 모델을 제안한다. 자모 단위 합성곱 신경망을 이용한 임베딩 계층을 통해 사용자 입력의 맞춤법 오류를 줄이고, 클래스 임베딩과 전방 전달 신경망을 적용하여 분류기의 성능을 높였다. 제안 모델은 457개와 769개의 FAQ 클래스 분류에 대한 실험 결과로 Micro F1 score 기준 각각 81.32%p, 61.11%p의 높은 성능을 보였으며, 모델 예측의 신뢰도를 평가하기 위해 sigmoid 함수를 이용하여 신뢰도를 수치화했다.","Web and mobile users obtain the desired information using the frequently asked questions (FAQ) listed on the homepage. The FAQ system displays a query response candidate that is most similar to the input based on an information retrieval model. However, the information retrieval model depends on the index, and therefore, it is vulnerable to spelling errors in the sentence. This paper proposes a model applying the FAQ system to the sentence classifier, which minimizes the spelling errors. Using the embedded layer with jamo-based convolutional neural network, the spelling errors of the user input were reduced. The performance of the classifier was improved using class embedding and feed-forward neural network. As a result of 457 and 769 FAQ classifications, the Micro F1 score showed 81.32% p and 61.11% p performance, respectively. We used the sigmoid function to quantify the reliability of the model prediction."
랜섬웨어 방어를 위한 합성곱 신경망 기반의 데이터 암호화 탐지 기법,2019,"['ransomware', 'deep learning', 'convolutional neural network', 'computer security', '랜섬웨어', '딥러닝', '합성곱 신경망', '컴퓨터 보안']","최근 랜섬웨어에 의한 피해가 심각해짐에 따라, 랜섬웨어 공격을 실시간으로 감지하고 방어하는 기술 개발의 중요성이 높아지고 있다. 기존 랜섬웨어 탐지 기법의 한계를 극복하기 위해, 저장장치 내부 수준의 데이터 보존 및 복구 기법이 제안되었으나, 무분별한 데이터 보존으로 인해 저장공간 부하를 크게 증가시킬 수 있다는 한계점이 존재한다. 본 논문에서는 보존할 데이터를 정확하게 선정하면서도 피해 데이터를 온전하게 보존하기 위한, 합성곱 신경망 기반의 데이터 암호화 여부 판단 기법을 제시한다. 실험 결과, 제안한 기법은 저장장치 내부 수준에서 상위 계층의 정보 없이 93.90%의 높은 정확도로 데이터의 암호화 여부를 판단하였다. 또한, 손실 함수와 결정 경곗값을 수정하여 0에 가까운 부정 오류율을 달성하였다.","With the rapid increase in the number of ransomwares recently, the development of real-time strategies for ransomware defense is imperative. To overcome the limitations of traditional ransomware defense techniques, a storage-level data recovery technique was suggested. However, as the technique inefficiently selects data to conserve, it has a negative impact on the lifetime and performance of storage. In this paper, we propose a CNN-based encrypted data detection technique to enhance the accuracy of selecting data to conserve while ensuring complete data recovery. Our experiments show that the proposed technique achieved 93.90% detection accuracy at the storage-level without any high-level information. Furthermore, by changing the loss function and controlling a detection threshold, we attained a false negative rate of nearly 0."
스마트 팜을 위한 분할 인식 심층 합성곱 신경망 기반의 사과나무 잎사귀 질병 인식,2019,"['Smart Farm', 'Plant Disease', 'Deep Convolutional Neural Networks', 'Deep Feature Extraction', 'Feature Pooling']","이 논문에서는 분할 인식 심층 합성곱 신경망 기반의 사과나무 잎사귀 질병을 인식하는 기법을 제안하고자 한다. 주된 아이디어는 잎사귀 질병이 존재하는 영역이 잎사귀 안에 포함되는 반면 배경 영역에서는 질병과 관련된 정보가 없다는 것이다. 이 아이디어를 실현하고자 본 논문에서는 두 종류의 서브네트워크를 제시하고자 한다. 하나는 입력 영상을 배경 영역, 잎사귀 영역, 질병 영역으로 분할하기 위한 영상분할 서브네트워크이고 다른 하나는 입력 영상으로부터 질병의 종류를 예측하는 영상인식 서브네트워크이다. 실험 결과를 통해서, 예측된 영상분할 맵을 사용함으로써 기존의 VGG 네트워크에 비해 약 9%의 정인식률을 개선할 수 있었다.","A new method of recognizing apple leaf diseases via segmentation-aware deep convolutional neural network is proposed in this paper. The main idea is that leaf diseases exist in the leaf area, whereas background region has no information related to leaf diseases. To realize this idea, two subnetworks are designed. One is for the division of input image into background, leaf area, and disease area, and the other is for the prediction of leaf disease types. The experimental results show that correct recognition accuracy can be increased by 9% by using the predicted image segmentation map, compared to the VGG network."
자율주행 자동차의 기능 안전을 위한 합성곱 신경망 기반 상대 거리 예측 알고리즘 개발,2019,"['Autonomous vehicle(자율주행 자동차)', 'Convolutional neural network(합성곱 신경망)', 'Feature extraction(특징 추출)', 'Relative distance prediction(상대 거리 예측)', 'Functional safety(기능 안전)']",국문 초록 정보 없음,다국어 초록 정보 없음
자연어를 활용한 SQL문 생성을 위한 합성곱 신경망 기반 칼럼 예측 모델,2019,"['SQL', 'RDBMS', 'natural language processing', 'convolutional neural networks', 'SQL', '관계형 데이터베이스', '자연어 처리', '합성곱 신경망']","관계형 데이터베이스 시스템을 이용하여 대규모의 데이터를 검색하기 위해서는 테이블 스키마 및 SQL문을 이해해야 하는 필요성이 있다. 이를 해결하기 위해 자연어가 입력으로 주어질 때, 이에 대응하는 SQL문을 생성하는 연구가 최근 진행되고 있다. 기존 연구에서 가장 어려운 부분은 SQL문의 조건에 해당되는 칼럼을 효과적으로 예측하는 부분이며, 예측해야 하는 칼럼의 개수가 여러 개일 때 정확도가 크게 떨어지는 문제점이 있다. 본 논문에서는 칼럼 어텐션 메카니즘을 이용하여, 자연어 데이터의 숨겨진 표현을 효과적으로 추출하는 합성곱 신경망 모델을 제안한다. 본 연구의 제안 방법은 기존 방법 대비 약 6% 이상 정확도가 향상되는 것을 확인할 수 있었다.","To retrieve massive data using relational database management system (RDBMS), it is important to understanding of table schemas and SQL grammar. To address this issue, many studies have recently been carried out to generate an SQL query from a natural language question. However, the existing works suffer mostly from predicting columns at where clause and the accuracy is greatly reduced when there are multiple columns to be predicted. In this paper, we propose a convolutional neural network model with column attention mechanism that effectively extracts the latent representation of input question which helps column prediction of the model. The experiment shows that our model outperforms the accuracy of the existing model (SQLNet) by 6%."
빗줄기 방향과 강도를 고려한 심층 합성곱 신경망 기반의 빗줄기 제거 기법,2019,"['rain removal', 'residual networks', 'deep convolutional neural networks', 'sparse coding']","최근 인공지능 기술의 발달로 무인자동차, 무인드론 및 자율운항선박시스템 등이 개발되고 있다. 그러나 컴퓨터 비전 기반의 보행자 검출, 영상분할 같은 기법은 기상 환경에 상당한 영향을 받는다. 특히 비가 내리는 상황에서 영상을 획득할 때 캡처된 영상에서 빗줄기 패턴이 형성되고 이러한 빗줄기 패턴은 컴퓨터 비전 알고리즘에서 사용되는 특징 추출에 부정적인 영향을 줄 수 있다. 따라서 본 논문에서는 빗줄기의 강도와 방향을 고려한 심층 합성곱 신경망 기법을 제안하고자 한다. 특히 빗줄기 강도와 방향을 구별 짓기 위한 심층 합성곱 신경망과 빗줄기 타입 별 빗줄기 제거를 위한 잔차 네크워크 즉, 두 종류의 서브 네트워크를 학습해서 빗줄기를 제거하고자 한다. 제안한 기법을 적용할 때, 기존의 방법보다 빗줄기 제거와 디테일 보존 성능 측면에서 더 나은 결과를 얻을 수 있었으며 정량적 화질 평가에서도 우위를 달성할 수 있었다.","Recently, autonomous cars, autonomous drones, and self-driving ship systems are being developed, thanks to the development of artificial intelligence technologies However, computer vision algorithms such as pedestrian detections and image segmentations, are significantly affected by weather conditions. When capturing images in a rainy day, rain streaks are formed in the captured images, thereby having negative effects on feature extractors used in computer vision algorithms. Therefore, this paper proposes the deep convolution neural networks that consider the strength and orientation of rain streaks. More specifically, in this paper, two types of sub-networks are learned for rain streaks removal. One is to detect the strength and orientation of rain streaks and the other is to remove rain streaks via residual networks, which are trained optimally to each type of rain streaks. Experimental results show that the proposed method is more effective in removing rain streaks and preserving details than the conventional methods. Moreover, quantitative image quality assessments also show that the performance of the proposed method is superior to the conventional methods."
작물 분류를 위한 다중 규모 공간특징의 가중 결합 기반 합성곱 신경망 모델,2019,"['Crop classification', 'Convolutional neural network', 'Spatial feature', 'Image patch']","이 논문에서는 작물 분류를 목적으로 합성곱 신경망 구조에 다중 규모의 입력 영상으로부터 추출가능한 다양한 공간특징을 가중 결합하는 모델을 제안하였다. 제안 모델은 합성곱 계층에서 서로 다른 크기의 입력패치를 이용하여 공간특징을 추출한 후, squeeze-and-excitation block을 통해 추출한 공간특징의 중요도에 따라가중치를 부여한다. 제안 모델의 장점은 분류에 유용한 특징들을 추출하고 특징의 상대적 중요도를 분류에 이용하는데 있다. 제안 모델의 분류 성능을 평가하기 위해 미국 일리노이 주에서 수집한 다중시기 Landsat-8 OLI 영상을 이용한 작물 분류 사례연구를 수행하였다. 유용한 패치 크기 결정을 위해 먼저 단일 패치 모델에서 패치 크기가 작물 분류에 미치는 영향을 분석하였다. 그 후에 단일 패치 모델과 특징의 중요도를 고려하지 않는다중 패치 모델과 분류 성능을 비교하였다. 비교 실험 결과, 제안 모델은 연구지역에서 재배하는 작물의 공간특징을 고려함으로써 오분류 양상을 완화시켜 비교 모델들에 비해 가장 우수한 분류 정확도를 나타냈다. 분류에 유용한 공간특징의 상대적 중요도를 고려하는 제안 모델은 작물뿐만 아니라 서로 다른 공간특성을 보이는객체 분류에도 유용하게 적용될 수 있을 것으로 기대된다.","This paper proposes an advanced crop classification model that combines a procedure for weighted combination of spatial features extracted from multi-scale input images with a conventional convolutional neural network (CNN) structure. The proposed model first extracts spatial features from patches with different sizes in convolution layers, and then assigns different weights to the extracted spatial features by considering feature-specific importance using squeeze-and-excitation block sets. The novelty of the model lies in its ability to extract spatial features useful for classification and account for their relative importance. A case study of crop classification with multi-temporal Landsat-8 OLI images in Illinois, USA was carried out to evaluate the classification performance of the proposed model. The impact of patch sizes on crop classification was first assessed in a single-patch model to find useful patch sizes. The classification performance of the proposed model was then compared with those of conventional two CNN models including the single-patch model and a multi-patch model without considering feature-specific weights. From the results of comparison experiments, the proposed model could alleviate misclassification patterns by considering the spatial characteristics of different crops in the study area, achieving the best classification accuracy compared to the other models. Based on the case study results, the proposed model, which can account for the relative importance of spatial features, would be effectively applied to classification of objects with different spatial characteristics, as well as crops."
합성 곱 신경망을 이용한 서비스 거부 공격 탐지 기법 연구,2019,[],국문 초록 정보 없음,다국어 초록 정보 없음
합성곱 신경망을 이용한 언어장애인용 문장 인식,2019,[],국문 초록 정보 없음,다국어 초록 정보 없음
합성곱 신경망을 통한 드론의 장애물 회피 및 길 추적,2019,"['Trail following(길 추적)', 'Obstacle avoidance(장애물 회피)', 'Machine learning(기계학습)', 'Vision based control(영상 기반 제어)']",국문 초록 정보 없음,다국어 초록 정보 없음
합성곱 신경망 기반 밝기-색상 정보를 이용한 얼굴 위변조 검출 방법,2019,"['face anti-spoofing', 'luminance and chrominance', 'convolutional neural networks', 'attention module', 'contrast loss']",국문 초록 정보 없음,"In this paper, we propose the face anti-spoofing method based on combination of luminance and chrominance with convolutional neural networks. The proposed method extracts luminance and chrominance features independently from live and fake faces by using stacked convolutional neural networks and auxiliary networks. Unlike previous methods, an attention module has been adopted to adaptively combine extracted features instead of simply concatenating them. In addition, we propose a new loss function, called the contrast loss, to learn the classifier more efficiently. Specifically, the contrast loss improves the discriminative power of the features by maximizing the distance of the inter-class features while minimizing that of the intra-class features. Experimental results demonstrate that our method achieves the significant improvement for face anti-spoofing compared to existing methods."
합성곱 신경망을 이용한 Bender Gestalt Test 영상인식,2019,"['Bender Gestalt Test', 'Eye-writing', 'Pattern Recognition', 'Character Recognition', 'Dynamic Time Warping']",국문 초록 정보 없음,"This paper proposes a method of utilizing convolutional neural network to classify the images of Bender Gestalt Test (BGT), which is a tool to understand and analyze a person’s characteristic. The proposed network is composed of 29 layers including 18 convolutional layers and 2 fully connected layers, where the network is to be trained with augmented images. To verify the proposed method, 10 fold validation was adopted. In results, the proposed method classified the images into 9 classes with the mean f1 score of 97.05%, which is 13.71%p higher than a previous method. The analysis of the results shows the classification accuracy of the proposed method is stable over all the patterns as the worst f1 score among all the patterns was 92.11%."
합성곱 신경망을 이용한 보행자 머리상해치 예측기법 개발,2019,"['HIC(머리상해치)', 'NCAP(신차평가제도)', 'VRU Safety(보행자 안전)', 'Deep learning(심층 학습)', 'Pre-trained model(사전 학습 모델)']","보행자 관련 안전사고를 예방하고자 세계 각국에서는 NCAP제도를 활용하여 신차의 안전도를 평가하고있다. HIC는 교통약자(VRU)가 차량과 충돌하였을 때 받는 머리상해치를 의미한다. 기존 HIC예측을 위해선 후드상의 타격포인트에 대한 반복실험, 혹은 담당자의 경험적 판단 하에 성능인자를 추출하여 해석기법을 통해 예측하였다. 그러나 위와 같은 방법은 구조 변경마다 실험에 반복되는 공수소요가 발생하며, 경험적 판단에 의존함으로 객관성이 결여된다. 이에 본 연구에서는 인공지능 기법 중 딥 러닝의 CNN과 차량 설계도면, 그리고 충격 량 실험 값을 학습하여 딥 러닝을 이용한 HIC와 HIC 등급을 예측하며, Error rate, Top1-Acc등의 평가지표를 활용하여 성능을 검증한다.",다국어 초록 정보 없음
합성곱 신경망을 이용한 이동 물체 인식 및 6 축 로봇 매니퓰레이터 응용,2019,"['Manipulator', 'Object detection', 'ROS(Robot Operating Sytem)', 'Deep learning', 'Real-time control']",국문 초록 정보 없음,다국어 초록 정보 없음
합성곱 신경망을 활용한 전두엽 fNIRS 신호의 왼손-오른손 동작 구분,2019,[],국문 초록 정보 없음,다국어 초록 정보 없음
합성곱 신경망 기반 GPS L1 C/A 신호 검파기법,2019,[],국문 초록 정보 없음,다국어 초록 정보 없음
합성곱 신경망 기반의 블록화 노이즈 감소 기법,2019,[],국문 초록 정보 없음,다국어 초록 정보 없음
합성곱 신경망을 이용한 음절 피처맵 생성 및 감성 분석,2019,"['Sentiment Analysis', 'Text mining', 'Text classification']",국문 초록 정보 없음,"Sentiment analysis is a technique for analyzing subjective attitudes, opinions, and emotions of people in a text. When conducting sentiment analysis understanding the structure of the language used in the text is very important. In this paper, we noted the characteristics of the Korean language that a syllable consists of three elements: Initial sound, Intermediate sound, Final sound. Thus, we compare sentiment classification models that can reflect the characteristics. These models, which expresses syllables by combination of initial sound, intermediate sound, final sound. One of them is improved in classification accuracy over the existing character-level model. But not only that, This model is robust to the misspelled word compared to Syllable-level model and Morph-level model because it uses a character-level representation of a sentence as input."
합성곱 신경망 기반의 화면 내 예측 모드 결정,2019,[],국문 초록 정보 없음,다국어 초록 정보 없음
합성곱 신경망을 이용한 철강 표면영상의 결함 검출,2019,[],국문 초록 정보 없음,다국어 초록 정보 없음
합성곱 신경망을 통한 깊이 예측과 심층 강화학습을 활용한 소형 무인기의 충돌 회피,2019,"['Collision avoidance(충돌회피)', 'Reinforcement learning(강화학습)', 'Depth-estimation(깊이예측)', 'vision-based control(영상 기반 제어)', 'Machine learning(기계 학습)']",국문 초록 정보 없음,다국어 초록 정보 없음
합성곱 신경망 모형을 이용한 대전광역시 대덕대로 소통상황 예측,2019,[],국문 초록 정보 없음,다국어 초록 정보 없음
합성곱 신경망을 사용한 수술 후 통증 평가,2019,[],국문 초록 정보 없음,다국어 초록 정보 없음
합성곱 신경망을 이용한 프레임 동기 기법,2019,[],국문 초록 정보 없음,다국어 초록 정보 없음
합성곱 신경망 모델 기반의 폐기물 분류 시스템 연구,2019,[],국문 초록 정보 없음,다국어 초록 정보 없음
합성곱 신경망을 이용한 디지털 통신기 분류 알고리즘,2019,[],국문 초록 정보 없음,다국어 초록 정보 없음
합성곱 신경망 기반의 저조도 영상 개선,2019,[],국문 초록 정보 없음,다국어 초록 정보 없음
합성곱 신경망을 이용한 CPU 기반의 실시간 나이 및 성별 인식,2019,[],국문 초록 정보 없음,다국어 초록 정보 없음
합성곱 신경망을 이용한 생체신호기반 개인인증 모델링 연구,2019,[],국문 초록 정보 없음,다국어 초록 정보 없음
합성곱 신경망 구조를 이용한 문서 범주 관련 키워드 추출,2019,[],국문 초록 정보 없음,다국어 초록 정보 없음
그래프 합성곱 신경망을 이용한 부분 도메인 적응 기법,2019,[],국문 초록 정보 없음,"Domain adaptation is a technique that alleviates networks’ performance degradation on the target samples, which has a different distribution from the source samples. Since most existing domain adaptation methods assume that source and target domain contain the same labels, performance degradation occurs when the label set of the source and target are not the same. It is difficult to use existing domain adaptation techniques in real situations because generating the source domain with exactly the same label set as the target domain is ineffective. To solve this problem, partial domain adaptation methods have been attended, which exploit big data to construct the source domain and adapt it to the target domain included in the source label set. Although the existing partial domain adaptation methods show a great performance, these methods do not directly consider the data structure. Therefore, we propose graph partial domain adaptation networks, which apply a graph structure to the partial domain adaptation task. Specifically, we first construct a graph between feature maps extracted from the source and the target samples, and then adopt graph convolutional neural networks to consider relationships between different domains. After that, we train domain classifier to align the distribution of each category by using these feature maps. Our method, named as GPDA, achieves state-of-the-art performance on the Digit dataset and the Office-31 dataset."
3차원 합성곱 신경망을 활용한 실시간 전략 게임 승패 예측,2019,[],국문 초록 정보 없음,다국어 초록 정보 없음
다양한 합성곱 신경망 방식을 이용한 폐음 분류 방식의 성능 비교,2019,[],국문 초록 정보 없음,"In the diagnosis of pulmonary diseases, auscultation technique is simpler than the other methods, and lung sounds can be used for predicting the types of pulmonary diseases as well as identifying patients with pulmonary diseases. Therefore, in this paper, we identify patients with pulmonary diseases and classify lung sounds according to their sound characteristics using various convolutional neural networks, and compare the classification performance of each neural network method. First, lung sounds over affected areas of the chest with pulmonary diseases are collected by using a single-channel lung sound recording device, and spectral features are extracted from the collected sounds in time domain and applied to each neural network. As classification methods, we use general, parallel, and residual convolutional neural network, and compare lung sound classification performance of each neural network through experiments."
계층구조 합성곱 신경망 기반 고해상도 동영상 프레임 고속 보간 방법,2019,[],국문 초록 정보 없음,다국어 초록 정보 없음
