title,date,keywords,abstract,multilingual_abstract
딥러닝을 활용한 해양오염 예측도구 개발 및 적용 연구 (Ⅰ),2020,"['딥러닝', '해양', '환경영향평가', 'CNN', '콘볼루션 신경망', '클로로필-a', 'Deep Learning', 'Marine', 'EIA', 'Chlorophyll-a']","Ⅰ. 연구의 배경 및 목적ㅇ 해양에서 다양한 개발사업이 이루어지고 있으며 개발로 인한 환경적 영향을 예측·평가하여 저감방안을 마련하고 있음ㅇ 복잡한 해양환경적 특성으로 인해 개발사업이 해양환경에 미치는 영향을 파악하는 데는 한계가 있음ㅇ 해양환경 정보화플랫폼의 자료, 위성자료, 기존의 수치모형에서 계산된 방대한 물리적 자료를 딥러닝 기술에 적용하여 해양오염 예측 도구를 개발하고자 함Ⅱ. 국내외 현황 및 사례 분석ㅇ 해양 분야에서 딥러닝을 활용한 연구를 예측(결측치 보정 포함) 및 분류 연구로 구분하여 정리함ㅇ 해양 분야가 아닌 타 분야에서 딥러닝을 활용한 연구도 정리함Ⅲ. 연구 방법론1. 해양환경자료ㅇ 해양환경, 해양생태, 해양보호구역, 해양환경정보지도, 폐기물해양배출, 해양쓰레기, 해역이용영향평가 등과 관련된 다양한 자료를 제공하는 해양환경정보포털(MEIS)의 자료를 검토함ㅇ 2010년부터 천리안 위성(COMS: Communication, Ocean and Meteorological Satellite)을 통하여 해양관측을 수행하고 있으며, 위성으로부터 제공되는 자료를 조사함2. 수치모형ㅇ 해양의 유동, 지형, 파랑, 수질까지 다양한 영역의 해양환경 변화를 파악할 수 있는 수치모형 중에 연안역에서 널리 사용되는 Delft3D를 소개함3. 딥러닝 모델ㅇ 딥러닝 알고리즘은 입력 데이터의 형태에 따라 활용할 수 있는 모형이 다르기 때문에 주요 모형에 대해서만 설명함ㅇ 딥러닝 모형이 사용된 연구 사례를 소개함Ⅳ. 적용 및 검증1. 파랑 예측ㅇ 딥러닝의 적용 사례연구로서 외해에서 장기간 관측된 파랑 및 기상자료와 딥러닝 기법을 활용하여 해안역 인근의 일 년간의 파랑을 예측함ㅇ 60km 이상 이격된 해역의 기상정보와 파랑정보를 활용하여 해안가 인접지역의 파랑 자료를 간접적으로 추정할 수 있음2. 농도 확산ㅇ 파랑 예측 사례는 단일지점의 자료를 이용하여 추정값을 산출하였다면 금번 사례연구는 공간적 자료를 활용하여 딥러닝 기법의 효율성을 검증함3. 실해역 적용ㅇ 연구해역에서 시공간적인 물리 인자를 생성하기 위하여 수치모형을 구동하고 위성관측자료를 활용하여 용존 유기물질, 클로로필-a, 총부유물질, 수중 가시거리에 대한 공간 자료를 생성함ㅇ CNN 모형을 활용하여 딥러닝 모형을 구축하고 클로로필-a를 추정함Ⅴ. 결론 및 제언ㅇ 다양한 분야에 적용되고 있는 딥러닝 기술을 활용하여 연안역에서 플랑크톤 시·공간적 변화를 예측하는 도구를 개발함ㅇ 개발된 예측모형에 대한 정확도 및 신뢰성을 높이기 위하여 추가적인 연구 및 분석이 필요함ㅇ 딥러닝 예측 기술의 추가적인 개발은 기존 기술과 함께 시너지 효과를 발생시켜 환경정책계획 수립에 기여할 수 있음","Ⅰ. Aims and Purposes of the Researchㅇ Various development projects in the coastal areas have been carried out, and mitigation methods to reduce their impact on the environment have been under development based on the prediction and evaluation.ㅇ There are many limitations in understanding the impacts of development projects on the marine environment.ㅇ We intend to develop a marine pollution prediction tool by applying data from the Marine Environment Information System (MEIS), satellite data, and physical data calculated from the numerical model to deep learning technology.Ⅱ. Domestic and Foreign Status and Case Analysisㅇ Deep learning studies applied in the marine field were classified and organized into prediction (including missing value correction) and classification studies.ㅇ Deep learning research conducted in fields other than the marine field is also briefly summarized.Ⅲ. Methods1. Marine environment dataㅇ Data from the MEIS which provides various data related to the marine environment, marine ecology, marine protected areas, marine environment information map, and marine waste discharge were investigated.ㅇ Satellite data produced through the Communication, Ocean and Meteorological Satellite (COMS) operated since 2010 were reviewed.2. Numerical modelㅇ Delft3D, widely used in coastal areas, is described as a numerical model that simulates changes in the marine environment such as hydrodynamics, sediment transport, waves, and water quality.3. Deep learning modelㅇ In regard to deep learning models, only the main models are explained because the models that can be used are different depending on the type of input data.ㅇ We introduced research cases to which deep learning models are applied.Ⅳ. Application and Verification1. Wave predictionㅇ As a case study of the application of the deep learning model, the waves for a year near the coastal area were predicted using the deep learning model.ㅇ It is possible to indirectly estimate the wave data adjacent to the coast using the meteorological and wave information from the open sea 60 km away.2. Diffusion experimentㅇ In the case of wave prediction, the model predicted waves using data from a single point, but this case study showed that the deep learning model is also effective for spatial data prediction.3. Application to actual sea areasㅇ Using a numerical model for the study area, spatial and temporal physical data were generated. In addition, data on dissolved organic matter, chlorophyll-a, total suspended sediment, and visibility were generated from satellite ocean color observations.ㅇ A deep learning model was constructed using the CNN technique and chlorophyll-a was estimated.Ⅴ. Conclusion and Suggestionㅇ A tool for predicting plankton changes in coastal areas was developed using deep learning technologyㅇ Further research and analysis are required to increase the accuracy and reliability of the developed prediction tool in this studyㅇ Additional development of deep learning prediction tool can contribute to establishing effective environmental policy plans by generating synergies with existing tools"
딥러닝 관련 발명의 특허법상 보호 방안에 대한 연구,2020,"['딥러닝', '발명의 성립성', '특허 적격성', '소프트웨어 관련 발명컴퓨터 관련 발명', 'Alice 판결', 'Deep learning', 'eligible subject matter as an invention', 'patent eligibility', 'software-related inventions', 'computer-related inventions', 'Alice Case']","딥러닝 기술은 컴퓨터가 사물 등을 구분하기 위한 개념을 가지기 위해 ‘학습’을 수행하며, ‘학습’을 수행하기 위한 학습 모델이 가지는 구조가 깊은 것을 특징으로 한다. 딥러닝 기술은 인간이 개념을 받아들이기 위한 신경적 구조와 활동을 컴퓨터 기술에 접목한 신경망 기술을 기반으로 한다. 최근 그래픽 카드 등 하드웨어의 연산처리 능력이 높아지고 신경망 기술의 이론적 뒷받침이 이루어지면서 딥러닝 기술의 성과가 두드러지게 나타나게 되었다.  본 논문에서는 딥러닝 기술이 가지는 특성을 파악하기 위해 딥러닝 기술에 관한 변천과 주요 딥러닝 기술에 대한 내용 및 이와 관련된 특허권들의 청구범위를 살펴보았다. 또한, 본 논문에서는 딥러닝 기술이 가지는 특성을 감안하여 딥러닝 모델 구조가 변경된 경우와 기존 딥러닝 모델이 특유 목적에 맞게 접목된 경우로 구분하여 딥러닝 관련 발명의 특허 등록 가능성 확보 방안을 검토하였으며, 특허 등록 후 침해 주장 시 입증 용이성을 확보하기 위한 실무적 방안에 대해 검토하였다.  딥러닝 기술과 관련한 발명의 경우 발명의 성립성과 진보성 요건 등 특허성 요건을 판단함에 있어서 컴퓨터 관련 발명의 일종으로 취급될 수 있다. 최근 컴퓨터 관련 발명의 특허 적격성 판단과 관련하여 미국에서의 Alice 판결 등 주요 판례가 주목받고 있고 이에 따라 미국과 우리나라에서의 심사기준에도 변동이 있어 본 논문에서는 컴퓨터 관련 발명의 특허 적격성 판단에 대한 미국 판례의 변천을 살펴본 후 우리나라의 특허법 규정 및 2019년 3월 개정된 특허청의 특허․실용신안 심사기준을 검토하였다.","Deep learning is a technology to perform “learning” so that computers can adopt concepts to distinguish objects and the like. Deep-learning technology is characterized in that the structures of learning models for performing “learning” are “deep”. Deep-learning technology is based on neural-network technology in which neural structures and activities that enable human beings to accommodate concepts are grafted onto the computer technology. Recently, neural network technology has been underpinned by theory owning to the increased operational processing capacity of hardware units such as graphics cards, and remarkable performance of deep-learning technology has been exhibited.  In order to understand the properties of deep-learning technology, changes in deep-learning technology, major aspects of deep-learning technology, and the claims of patented inventions relating to deep-learning technology are reviewed in this paper. Also, considering the properties of deep-learning technology, cases are divided into cases where deep-learning model structures are changed and cases where conventional deep-learning models are grafted onto deep-learning technology so as to comply with specific objectives. On this basis, how to secure the patentability of deep-learning-related inventions is reviewed in this paper, and how to easily demonstrate patent infringement after the deep-learning-related inventions are patented is also reviewed in practical terms.In the case of deep-learning-related inventions, they may be handled as a kind of computer-related inventions when the patentability requirements thereof are determined in terms of whether the subject matters thereof establishes inventions and they meet inventiveness requirements, etc.. Recently, with respect to the patent eligibility determination of computer-related inventions, important precedents including the Alice Corp. judgment in the United States have drawn attention, and examination guidelines in the United States and Korea have changed accordingly. In this regard, in this paper I review changes in US precedents on patent eligibility determination of computer-related inventions, and then review the Korean Patent Act and patent and utility model examination guidelines, which were revised in March 2019 by the Korean Intellectual Property Office."
