title,date,keywords,abstract,multilingual_abstract
가로주택 정비사업에서 인공지능의 활용에 대한 연구: 의정부시의 현황을 사례로,2020,"['Block-unit Renewal project', 'artificial intelligence', 'machine learning', 'deep learning', 'autonomous construction.', '가로주택정비사업', '인공지능', '머신러닝', '딥러닝', '자율건축']","가로주택정비사업은 기존정비사업과 비해 소규모로 정비구역의 지정없이 많은 절차가 간소화되어 진행되는 사업이라 규모의 경제가 달성하기 어려워 검토비용의 제약과 시간상의 제약이 존재한다. 인공지능을 활용해서 그러한 제약을 극복하는 상황이 현재 진행되고 있다.LH공사, SH공사, 경기주택도시공사, 기타 관련 공기업에서 이미 인공지능을 사용하여 사업요건의 적합성검토, 건축법규에 적합한 건축설계, 종전 자산의 가치 추정과 신규 건물의 가치 추정 등이 이미 현장에서 활용되고 있다. 그리고 이에 대한 이론적, 기술적 고찰을 진행하였다.의정부시의 사례를 분석한 결과 경기주택도시공사에서 업체에 의뢰해 인공지능으로 사업성검토를 한다는 것이 별로 알려져 있지 않아 18곳의 가로주택정비사업의 사업 중에서 4곳만 사업성검토를 받아 이에 대한 홍보가 필요할 것으로 보인다. 또 경기주택도시공사를 통해서 업체에 의뢰를 해서 일방적으로 결과나 보고서를 통보받는 것 보다는 사업조건의 변화에 대한 민감도분석 등에 대한 피드백과 상호작용이 있으면 더 활용이 극대화될 것이다. 또한 더 적극적으로는 시나 공사와 같은 공공부문에서 가로주택정비사업의 요건을 갖춘 곳을 인공지능을 통해 발굴하여 추진하는 것도 고려할 필요가 있다.더 나아가 향후 자동화가 더 진행되어 웹상에서 바로 사업요건분석, 사업성분석 등이 가능해 지면 시의 차원에서 인접해서 추진하고 있는 가로주택정비구역을 묶어서 추진하여 기반시설개선효과가 더 높아지는 등의 개선책도 실행할 필요가 있다.","The Block-unit Renewal Project is small compared to the existing maintenance project, and it is a project in which many procedures are simplified without designation of a maintenance zone. Therefore, it is difficult to achieve economies of scale, so cost and time constraints exist. There are already situations in which artificial intelligence is used to overcome such limitations.LH Corporation, SH Corporation, Gyeonggi Housing and Urban Corporation, and other related public enterprises have already used artificial intelligence to review the suitability of business requirements, architectural design conforming to building regulations, and estimate the value of previous assets and estimate the value of new buildings. It is being utilized.As a result of analyzing the case of Uijeongbu City, it is not known that the Gyeonggi Housing and Urban Corporation commissioned a company to review the business feasibility with artificial intelligence, so only four of the 18 Block-unit Renewal projects received a feasibility review and thus need to be promoted. Seems to be. In addition, rather than requesting a company through Gyeonggi Housing and Urban Corporation to receive results or reports unilaterally, the use will be maximized if there is an interaction such as sensitivity analysis for changes such as changes in conditions. In addition, it is also necessary to consider proactively discovering and promoting places that meet the requirements of Block-unit Renewal projects in public sectors such as city and public sector through artificial intelligence.In the future, when more automation is carried out and it becomes possible to analyze business requirements and feasibility directly on the web, it is necessary to prepare for situations such as increasing the effect of improving infrastructure by grouping and promoting adjacent areas."
인공 소통과 귀속의 문제,2020,"['인공 소통', '인공 지능', '인공 감정', '소통과 행위', '귀속', '인격', '이중의 우연성', '가상 우연성', '딥러닝 알고리즘', '엘레나 에스포지토', 'artificial communication', 'artificial intelligence', 'artificial emotions', 'communication and action', 'attribution', 'person', 'double contingency', 'virtual contingency', 'deep learning algorithm', 'Elena Esposito']",국문 초록 정보 없음,다국어 초록 정보 없음
하이브리드 버스 에너지 관리 전략을 위한 속도 예측,2020,"['Speed Prediction(속도 예측)', 'Hybrid Electric Vehicle(하이브리드 전기 자동차)', 'Energy Management Strategy(에너지 관리 전략)', 'Deep Learning(딥러닝)', 'Long-Short Term Memory(장-단기 기억 메모리)', 'Recurrent Neural Network(순환 신경망)', 'Python(파이썬)']",국문 초록 정보 없음,다국어 초록 정보 없음
Attention Model 을 이용한 단안 영상 기반 깊이 추정 네트워크,2020,[],단안 영상에서의 깊이 추정은 주어진 시점에서 촬영된 2차원 영상으로부터 객체까지의 3차원 거리 정보를 추정하는 것이다. 최근 딥러닝 기반으로 단안 RGB 영상에서 깊이 정보 추정에 유용한 특징 맵을 추출하고 이를 이용해서 깊이를 추정하는 모델들이 기존 방법들의 성능을 넘어서면서 관련된 연구가 활발히 진행되고 있다. 또한 Attention Model 과 같이 특정 특징 맵의 채널 혹은 공간을 강조하여 전체적인 네트워크의 성능을 개선하는 연구가 소개되었다. 본 논문에서는 깊이 정보 추정을 위해 사용되는 특징 맵을 강조하기 위해서 Attention Model 을 추가한 AutoEncoder 기반의 깊이 추정 네트워크를 제안하고 적용 부분에 따른 네트워크의 깊이 정보 추정 성능을 평가 및 분석한다.,다국어 초록 정보 없음
"CCTV 영상으로부터 미세먼지 추정에서 학습영상조합, 기상변수 적용이 결과에 미치는 영향",2020,"['Deep Learning', 'PM Index', 'Support Vector Regression', 'SVR (Support Vector Regression)', 'CCTV', 'Convolutional Neural Network', '딥러닝', '미세먼지 지수', '합성곱 신경망']",국문 초록 정보 없음,다국어 초록 정보 없음
Analysis of indoor thermal comfort and developing an indoor environment prediction model for a Zero Energy Building in Korea,2020,"['Zero Energy Building(제로에너지빌딩)', 'Thermal comfort(열쾌적)', 'Overheating(과열)', 'Indoor temperature prediction model(실내온도 예측모델)', 'Deep learning(딥러닝)']",국문 초록 정보 없음,다국어 초록 정보 없음
"순환신경망, GRU를 이용한 자세 추정 기반 낙상 감지 기법",2020,"['Human Pose Estimation', 'Skeleton', 'Fall Detection', 'Deep Learning', 'GRU', '사람 자세 추정', '스켈레톤', '낙상 감지', '딥러닝', 'GRU']","낙상은 65세 이상의 노년층의 부상 또는 사망의 주요 원인으로 사회적 비용의 발생요인이다. 또한 산업현장에서 종종 발생하는 낙상 및 추락도 정확한 낙상 여부를 판단과 신속한 조치가 요구 된다. 다양한 낙상 감지 기법이 소개 되었으나 기존 센서기반 낙상 감지 장치는 사용자의 불편과 응답 시간이나 제한된 하드웨어 리소스로 인해 여전히 효과가 낮았다. 그러나 RNN (Recurrent Neural Network)은 순차적 입력을 분석하는 문제에서 뛰어난 정확성을 제공하므로 논 논문은 2D RGB 저가 카메라에서 얻은 스켈레톤 데이터를 기반으로 하는 낙상 감지 기법을 제안한다. 특히 GRU를 이용한 낙상 감지 정확도 향상을 위한 특징 추출 및 분류 방법을 제안하였다. 특징 추출을 위한 학습을 위해 공개 데이터 셋을 사용하였고, 높은 분류 정확도를 달성하기 위한 특징 추출 방법을 찾기 위한 시험 결과, 제안된 방법은 원시 골격 데이터 사용보다 낙상탐지에 효과적이다.",다국어 초록 정보 없음
DPESS: 임베딩 공간 통계를 이용한 주간 위성 이미지 기반의 인구 통계학적 속성 예측,2020,"['atellite imagery', 'deep learning', 'embedding', 'demographics', 'principle component analysis', 'urbanization', '위성 이미지', '위성영상', '딥러닝', '임베딩', '인구통계', '주성분분석', '도시화']","위성 이미지를 이용하여 사회 경제적 지표로 활용되는 인구 통계를 예측하거나 분석하는 연구가 활발히 진행되고 있다. 본 연구에서는 심층 신경망 모델을 기반으로 주간 위성 이미지를 이용하여 특정 지역의 인구 통계학적 속성 값을 예측하기 위한 새로운 접근법을 제시한다. 총 4단계로 이루어진 DPESS 모델은 정보의 손실 없이 많은 수의 입력 위성 이미지를 고정 길이의 벡터로 요약한다. 이는 전이 학습 및 임베딩 공간 통계와 같은 고유한 기술로 인해 가능하다. 연구 결과, 인구 밀도(R²=0.94), 15-29세 그룹 인구수(0.80), 고등학교 졸업 인구수(0.79), 가구당 총 구매력(0.80)과 같은 다양한 인구 통계학적 요소 값을 위성 이미지만으로도 효과적으로 예측할 수 있다. 한편, 본 연구를 다른 국가에 적용하기 위해서는 추가적인 연구가 필요할 것으로 사료된다.","Studies are being actively conducted to predict or analyze demographics used as socioeconomic factors using satellite images. We present a new approach, called DPESS, for estimating demographic attributes from daytime satellite imagery based on a deep neural network model. The four steps of the DPESS summarize any number of input images into a fixed-length embedded vector without a considerable loss of information, which is possible because of its unique structure and technique like transfer learning and embedded spatial statistics. Our extensive validation demonstrates that the DPESS model can predict various advanced demographics such as population density (R²=0.94), population count by age group (0.80), population count by education degree (0.79), and total purchase amount per household (0.80). We discuss future applications of this method in terms of applying our algorithm to other countries."
Convolutional Neural Network를 이용한 주차 차량 자세 추정,2020,"['Autonomous parking(자동 주차)', 'Convolutional Neural Network(합성곱 신경망)', 'Vehicle pose estimation(자세 추정)', 'Deep learning(딥러닝)', 'Image processing(영상 처리)']",국문 초록 정보 없음,"This paper proposes a technique based on Convolutional Neural Network(CNN) using rear view camera images to estimate the vehicle pose for the target point when parking. Identifying the vehicle’s pose for the target point in autonomous vehicles is a key technology in the automatic parking system. Generally, existing algorithm is used to recognize parking spaces with rear view camera images or rear view camera images and ultrasonic sensors to identify the vehicle’s poses for the target point. In this paper, we present feasibility of the network learned by CNN as AVM images to find out the pose of the vehicle simply. We show the performance that was observed when confirming the root mean squared error of the actual values and the predicted values."
인공지능과 빅데이터 분석 기반 통합보안관제시스템 구축방안에 관한 연구,2020,"['보안관제', '융합보안', '인공지능', '보안빅데이터', '통합보안관제시스템', 'Convergence Security', 'Artificial Intelligence', 'Big Data Analysis', 'Machine Learning', 'Enterprise Security Management System']","국내외 보안시장은 4차 산업혁명(The Fourth Industrial Revolution)의 핵심원천기술인 인공지능(artificial intelligence), 사물인터넷(internet of things), 딥러닝(deep learning), 빅데이터(big data), 자율주행(automatic driving) 등이 물리보안 및 사이버보안과 결합되어 새로운 융합보안시장을 창출하고 있다. 4차 산업혁명 시대에는 물리 · 정보 · 융합보안을 포괄하는 통합보안관제의 중요성이 날로 강조되고 있다. 글로벌 보안기업들은 인공지능 역량과 사이버위협 인텔리전스(cyber threat intelligence)가 집약된 융복합 관제 인프라를 구축해 나가고 있다. 본 연구에서는 인공지능과 빅데이터 기술을 적용한 통합보안관제시스템 구축에 필요한 기술적, 제도적인 요소를 제시하였다. 연구결과, (1) 글로벌 사이버 위협정보를 실시간 수집 · 공유하여 보안빅데이터 구축과 통합 플랫폼으로 위협 탐지 · 대응해야 함 (2) 머신러닝 기반의 인공지능 기술 적용과 빅데이터 분석고도화가 필요함 (3) 클라우드와 블록체인 기술을 융합한 통합보안관제센터 구축 필요함 (4) 지능형 영상 관제기술 및 지능형 선별관제 고도화 필요함 (5) SOAR 플랫폼 구축 및 보안운영 자동화 대비 (6) 보안관제체계의 통합과 융합보안 핵심인재양성 필요성 등의 제도적 · 기술적인 요소들을 통합보안관제시스템 구축에 필요한 실천과제로 제시하였다.","The security market is the core source technologies of the Fourth Industrial Revolution, artificial intelligence (AI), Internet of Things (IoT), deep learning, Big Data, automatic driving, etc. Combined with this physical security and cyber security, it creates a new convergence security market. In the era of the fourth industrial revolution, the importance of integrated security covering physical, information and convergence security is emphasized. Global security companies are building a converged control infrastructure that incorporates AI capabilities and cyber threat intelligence. In this study, we presented the technical and institutional elements necessary for the construction of an enterprise security management system (ESMS) using AI and Big Data technology. The results of this study, we suggested six institutional and technical factors required to establish ESMS including: (1) global cyber threat information must be collected and shared in real time, and security Big Data must be built and integrated to detect and respond to threats, (2) the need to upgrade and apply AI technology based on machine learning and Big Data analysis, (3) the need to build a cloud security command center (CSCC) that combines cloud and block-chain technology, (4) improvement of technologies for intelligent video control and intelligent screening control, (5) development of security orchestration, automation and response (SOAR) operation automation, (6) the need to integrate security control systems and foster core talents for convergence security."
크로스뷰 카메라-라이다 센서 융합 특징맵 생성을 통한 3D 물체 검출 기법,2020,"['Autonomous Driving (자율주행)', '3D Object Detection (3D 물체 검출)', 'Sensor Fusion (센서 융합)', 'Computer Vision (영상 처리)', 'Deep Learning (딥러닝)']",국문 초록 정보 없음,다국어 초록 정보 없음
자율주행 인공지능 기술 개발을 위한 데이터 수집 및 학습 플랫폼,2020,"['data collection platform(데이터 수집 플랫폼)', 'annotation (주석)', 'perception(인지)', 'planning (판단)', 'deep learning(딥러닝)']",국문 초록 정보 없음,다국어 초록 정보 없음
무선 네트워크 환경에서의 생성적 적대 신경망 기반 이 동성 예측 모델,2020,[],"초저지연성을 요구하는 5G 네트워크 환경에서 기기의 핸드오버를 능동적으로 조절하는 시스템의 중요성이 대두되고 있으며, 특히 핸드오버 시 기기의 이동성을 예측하는 것은 필수적이다. 딥러닝 모델의 일종인 생성적 적대 신경망은 두 신경망 사이의 경쟁 구도를 이용하여 두 신경망의 성능을 모두 높이는 목적으로 사용된다. 본 논문에서는 주로 데이터 생성 모델로 사용되는 생성적 적대 신경망을 이용하여 무선 네트워크 환경에서 기기의 이동성을 예측하는 시스템을 개발하였다. 이를 통해 실제 모바일 네트워크 환경에 적용되었을 경우 핸드오버 속도를 높이도록 한다.",다국어 초록 정보 없음
하드디스크의 잔존 수명 예측에 1D CNN-LSTM 을 이용한 모델 적용 연구,2020,[],"제품이나 부품의 잔존 수명을 정확하게 예측할 수 있다면 고장이나 중단으로 인한 손실을 방지하는 것이 가능해질 것이다. 제품의 잔존 수명은 시계열 데이터 분석을 통해 예측될 수 있으며, 최근에는 딥러닝을 이용한 잔존 수명 예측 연구가 활발하게 진행되고 있다. 본 연구에서 우리는 컴퓨터 기반 시스템의 주요 고장 요소가 되고 있는 하드디스크의 잔존 수명을 예측하는 문제에 1D CNN-LSTM 을 이용한 모델을 적용하고, RMSE 와 R-Square 값을 이용해 적용한 모델의 성능을 평가하였다.",다국어 초록 정보 없음
심층신경망 모형을 이용한 서울시 도시공원 및 녹지공간의 열섬저감효과 분석,2020,"['Urban Heat Island Effect', 'Urban Park and Green Space', 'Landsat', 'Land Surface Temperature', 'Deep Learning', '도시열섬현상', '도시공원 및 녹지', '위성영상', '지표면온도', '딥러닝']","도시화로 인한 도시열섬현상(Urban Heat Island)이 심화되면서 도시차원의 열 관리가 중요한 이슈로 다뤄지고, 도시열섬현완화 방안으로 녹지사업과 환경정책이 시행되고 있고, 도시공원 및 녹지와 열의 관계를 분석하는 다수의 연구가 수행되었다. 하지만 열이라는 특성은 다수의 요인이 복합적으로 얽혀있어 선형적 상관관계를 통한 해석에 한계가 있다. 본 연구는 변수요인들이 다양하고 데이터의 양이 방대하여 기존의 통계분석방식으로는 분석하기 어려운 분야에서 강점을 갖는 심층신경망 모형 방법론을 사용하여 여름철 서울지역의 공원 및 녹지의 열섬저감효과를 평가하는 것을 목표로 연구를 진행하였다. 이를 위해서 Landsat 8 인공위성영상을 활용하여 동시간의 광역적인 데이터를 취득하였고, ArcGis 10.7을 이용하여 서울시를 30m×30m 그리드로 격자화하여, 각 격자에 열섬저감을 측정할 수 있는 환경변수를 구축하였다. Python 3.7과 Keras를 이용하여 심층신경망 모형을 생성하여 지표면 온도와 변수 간의 관계를 분석하였다. 분석 결과, 인공신경망 모형은 높은 설명력을 가지는 것을 확인하였다. 또한 일반적인 연구 결과와 마찬가지로 인접 녹지와의 거리가 가까울수록, 공원면적이 커질수록, 공원의 식생활력도가 높을수록 지표면 온도가 낮아짐을 확인하였다. 식생활력도에 의한 냉각효과가 많이 있는 것을 확인하였고, 일부 선행연구에서 녹지에 인접할수록 0.3℃ ~ 2.3℃ 저감될 수 있는 특성이 나타나고, 공원의 크기가 크면 2℃~3℃ 저감효과가 나타난다는 결과를 보이고 있는데, 본 연구결과와 비교해 보면 도출된 효과가 과대평가되었을 가능성을 확인하였다. 본 연구의 결과는 향후 도시열섬현상 완화를 위해 새로운 도시녹지를 조성시 효과적인 녹지 구성을 위한 정보로 활용될 수 있다.","The Urban Heat Island (UHI) Effect has intensified due to urbanization and heat management at the urban level is treated as an important issue. Green space improvement projects and environmental policies are being implemented as a way to alleviate Urban Heat Islands. Several studies have been conducted to analyze the correlation between urban green areas and heat with linear regression models. However, linear regression models have limitations explaining the correlation between heat and the multitude of variables as heat is a result of a combination of non-linear factors. This study evaluated the Heat Island alleviating effects in Seoul during the summer by using a deep neural network model methodology, which has strengths in areas where it is difficult to analyze data with existing statistical analysis methods due to variable factors and a large amount of data. Wide-area data was acquired using Landsat 8. Seoul was divided into a grid (30m x 30m) and the heat island reduction variables were enter in each grid space to create a data structure that is needed for the construction of a deep neural network using ArcGIS 10.7 and Python3.7 with Keras. This deep neural network was used to analyze the correlation between land surface temperature and the variables. We confirmed that the deep neural network model has high explanatory accuracy. It was found that the cooling effect by NDVI was the greatest, and cooling effects due to the park size and green space proximity were also shown. Previous studies showed that the cooling effects related to park size was 2℃-3℃, and the proximity effect was found to lower the temperature 0.3℃-2.3℃. There is a possibility of overestimation of the results of previous studies. The results of this study can provide objective information for the justification and more effective formation of new urban green areas to alleviate the Urban Heat Island phenomenon in the future."
사회복지사와 독거노인을 위한 IoT,2020,[],"본 논문은 빈번한 가정방문 등으로 독거노인을 관리해야 하는 사회복지사들에게 관련 솔루션 및 대체 방안을 제공하고 독거노인에게는 외부 감염을 최대한으로 줄일 수 있는 IoT 장치와 App을 제안하였다. 딥러닝으로 학습된 사람 인식 알고리즘을 탑재하고 있는 Pi 카메라를 사용하여 독거노인이 집에 있을 때의 움직임을 지속적으로 확인하고 낙상과 같은 위급상황이 생겼을 시, Push 알림을 보내어 바로 대처하게 하였으며, 촬영본 확인이 가능하다. 또한 노인의 외출 시, 위급한 상황이 생기면 휴대용 단말기의 SOS 버튼을 눌러 Wifi 모듈을 통해 현재 위치와 알림을 즉각적으로 사회복지사의 App으로 보내어 확인할 수 있다.",다국어 초록 정보 없음
TFT를 활용한 수요 예측 기반 온라인 쇼핑몰 가격 최적화,2020,[],"최근 온라인 쇼핑몰 시장의 가격 경쟁이 심화되고 있어, 외부 가격 변화를 반영한 상품 수요 및 공급 예측 모델링의 중요성이 커지고 있다. 본 논문에서는 온라인 쇼핑몰에서의 할인 행사 간 상품 판매량을 딥러닝 기법을 통해 미리 예측하고, 이를 기반으로 행사 기간 내 매출 및 이윤을 최대화할 수 있는 가격 최적화 기법을 제시한다. 해당 기법을 실제 온라인 쇼핑몰 할인 행사에 적용한 결과, 매출과 순이익의 개선 효과를 확인할 수 있었다.",다국어 초록 정보 없음
학습자의 서술어 판단에 영향을 미치는 요인 연구,2020,"['Sentence component education', 'Sentence structure education', 'Grammar textbook', 'Predicate education Misconception', 'Regression analysis', 'Deep Learning', '문장 성분 교육', '문장 구조 교육', '문법 교과서', '서술어 교육', '오개념', '회귀분석', '딥러닝']",국문 초록 정보 없음,"Purpose：This research was to analyze the student’s predicate judgment, and based on the factors of composition of sentences that affect learners’ judgment of the predicate and their individual influence. Methods：In order to accomplish this purpose, we have selected 10 factors assumed to affect the learner’s judgment of the predicate, and created a test for determining predicates in sentences based on the system of school grammar and prior research. A survey was conducted on 302 high school sophomores. Analysis of survey results was conducted through open coding, regression analysis, and deep learning using deep neural networks(DNNs). Results：It showed that 1) learners who had misconceptions about the predicate, paying attention to the form, the product line, and the location in the sentence. 2) The influence of the 10 factors was found to be large in the order of ‘the way the predicate is formed’, ‘Whether or not a auxiliary word’ and so on 3) We found the questions that show a difference between learners’ difficulty recognition rate and the actual correct answer rate. Conclusion：It is necessary to improve predicate education in consideration of the difficulties learners face in judging predicates and the sentence composition factors that affect them."
한국어 오디오 캡션 시스템 개발,2020,[],"오디오 캡셔닝(Audio Captioning)은 시스템이 입력으로 오디오 신호를 받아들이고 해당 신호의 텍스트 설명을 출력하는 중간 번역 작업이다. 이 논문에서는 컨볼루셔널 뉴럴 네트워크(CNN), 트랜스포머의 딥러닝 알고리즘을 사용하여 주변 환경 소리에 대한 오디오 캡셔닝을 자동으로 수행하고 한글화된 출력 결과를 제공하는 모델을 제시한다. 본 연구 결과, 모델의 성능 평가 척도인 SPIDEr 점수는 0.1977이 나왔다.",다국어 초록 정보 없음
