title,date,keywords,abstract,multilingual_abstract
무인항공기 영상 및 딥러닝 기반 객체인식 알고리즘을 활용한 해안표착 폐기물 탐지 기법 연구,2020,"['해안 표착 폐기물', '원격 탐사', '객체 탐지', '기계 학습', '무인 항공기', 'Coastal Debris', 'Remote Sensing', 'Object Detection', 'Machine Learning', 'UAV']","본 연구에서는 무인항공기 원격탐사 기법과 딥러닝 기반 객체인식 알고리즘을 활용한 해안표착폐기물 탐지 기법을 제안한다. 항공영상 내에 존재하는 해안표착폐기물을 탐지하기 위해 심층신경망 기반 객체 인식 알고리즘을 제안하였다. PET, 스티로폼, 기타 플라스틱의 3가지 클래스의 이미지 데이터셋으로 심층신경망 모델을 훈련시켰으며, 각 클래스별 탐지 정확도를 Darknet-53과 비교하였다. 이를 통해 해안표착 폐기물을 무인항공기를 통해 성상별 모니터링할 수 있었으며, 향후 본 연구에서 제안하는 방법이 적용될 경우 해변 전체에 대한 성상별 전수조사가 가능하며, 이를 통해 해양환경 감시 분야의 효율성 증대에 기여할 수 있을 것으로 판단된다.","In this study, we propose a method for detecting coastal surface wastes using an UAV(Unmanned Aerial Vehicle) remote sensing method and an object detection algorithm based on deep learning. An object detection algorithm based on deep neural networks was proposed to detect coastal debris in aerial images. A deep neural network model was trained with image datasets of three classes: PET, Styrofoam, and plastics. And the detection accuracy of each class was compared with Darknet-53. Through this, it was possible to monitor the wastes landing on the shore by type through unmanned aerial vehicles. In the future, if the method proposed in this study is applied, a complete enumeration of the whole beach will be possible. Through this, it is believed that it can contribute to increase the efficiency of the marine environment monitoring field."
전염병 확산 방지를 위한 딥러닝 기반 얼굴 만지기 행동 인식 연구,2020,[],"무의식적인 손-얼굴의 접촉으로 인한 감염의 문제점을 해결하기 위해, 얼굴 만지기 행동을 인식할 필요가 있다. 본 연구는 최근 각광을 받는 딥러닝 기술을 이용하여 비디오 영상에서 얼굴 만지기 행동 인식에 대한 연구이다. 우선, 비디오 영상에서 얼굴 만지기와 관련된 11가지 행동에 대한 시, 공간적 특징을 컨볼루션 신경망을 통해 추출한다. 추출된 정보는 각 행동 레이블로 인코딩되어 비디오 영상에서 얼굴 만지기 행동을 분류한다. 또한, 3D, 2D 컨볼루션 신경망의 대표 네트워크인 I3D, MobileNet v3에 대해 비교 실험을 진행한다. 제안하는 시스템을 적용하영 인간의 행동을 분류하는 실험을 진행했을 때, 얼굴을 만지는 행동을 99%의 확률로 구분했다. 이 시스템을 이용하여 일반인이 무의식적인 얼굴 만지기 행동에 대해서 정량적으로 또는 적시적으로 인식을 하여, 안전한 위생 습관을 확립하여 감염의 확산방지에 도움을 줄수 있기를 바란다.",다국어 초록 정보 없음
효과음 자막 생성을 위한 딥러닝 기반의 다중 사운드 분류,2020,[],"본 논문은 영화에 나오는 효과음을 자막으로 생성해주는 자동자막생성을 제안하며, 그의 첫 단계로써 다중 사운드 분류 모델을 제안하였다. 고양이, 강아지, 사람의 음성을 분류하기 위해 사운드 데이터의 특징벡터를 추출한 뒤, 4가지의 기계학습에 적용한 결과 최적모델로 딥러닝이 선정되었다. 전처리 과정 중 주성분 분석의 유무에 따라 정확도는 81.3%와 33.3%로 확연한 차이가 있었으며, 이는 복잡한 특징을 가지는 사운드를 분류하는데 있어 주성분 분석과 넓고 깊은 형태의 신경망이 보다 개선된 분류성과를 가져온 것으로 생각된다.",다국어 초록 정보 없음
Imaginary Soundscape 기반의 딥러닝을 활용한 회화와 음악의 매칭 및 다중 감각을 이용한 융합적 평가 방법,2020,"['Matching of Painting and Music', 'Deep Learning', 'Multimodal Evaluation', 'Auditory Interaction', 'Multisensory Experience', 'Soundscape', '회회와 음악의 매칭', '딥러닝', '멀티모달 평가', '청각 인터랙션', '다중감각 경험', '사운드스케이프']","본 연구에서는 회화 감상에 도움이 되는 사운드스케이프를 구성하기 위해 딥러닝 기술을 활용하여 클래식 음악을 매칭하는 기술을 소개하고 회화와 음악 매칭이 얼마나 잘 되었는지에 대해 평가할 수 있는 평가 지표를 제안한다. 평가 지표는 리커드 5점 척도를 통한 적합도 평가와 멀티모달 측면의 평가로 진행하였다. 회화와 음악 매칭에 대해 13명의 실험 참가자의 적합도 평가의 점수는 3.74/5.0 이었고, 또한 13명의 실험 참가자의 멀티모달 평가에서 회화와 음악 매칭의 코사인 유사도의 평균은 0.79였다. 멀티모달적 평가는 새로운 사용자 경험을 측정할 수 있는 평가 지표가 될 것으로 기대된다. 또한 본 연구를 통해 시각과 청각의 인터랙션을 제안함으로써 다중감각 예술작품 경험을 향상시키고자 하였다. 본 연구에서 제안된 회화와 음악 매칭이 다중감각 예술작품 전시에서 활용되며 더 나아가 이는 시각 장애인들의 예술작품 감상에 대한 접근성을 높일 수 있을 것이라 기대한다.","In this study, we introduced the technique of matching classical music using deep learning to design soundscape that can help the viewer appreciate painting and proposed an evaluation index to evaluate how well matching painting and music. The evaluation index was conducted with suitability evaluation through the Likeard 5-point scale and evaluation in a multimodal aspect. The suitability evaluation score of the 13 test participants for the deep learning based best match between painting and music was 3.74/5.0 and band the average cosine similarity of the multimodal evaluation of 13 participants was 0.79. We expect multimodal evaluation to be an evaluation index that can measure a new user experience. In addition, this study aims to improve the experience of multisensory artworks by proposing the interaction between visual and auditory. The proposed matching of painting and music method can be used in multisensory artwork exhibition and furthermore it will increase the accessibility of visually impaired people to appreciate artworks."
실내 핑거프린트 측위를 위한 딥러닝 기반의 초고해상도 RF 맵 재구성 기법,2020,"['실내 위치 추정', '핑거프린트 측위', 'RF 맵 재구성', '딥러닝']",본 논문은 실내 핑거프린트 측위의 정확도를 향상시키기 위한 딥러닝 기반의 RF 맵 재구성 기법을 제안한다. 제안 기법은 합성곱 신경망 구조를 사용하여 희소 데이터와 정답 데이터와의 관계를 직접 학습함으로써 오프라인 단계에서 조사하지 않은 지역의 RF 맵을 고해상도로 복원한다. 실험 결과를 통해 제안 기법이 기존의 핑거프린트 측위보다 7.53m 향상된 측위 정확도를 가지며 다항식 보간법으로 RF 맵을 재구성하는 기법보다 0.92m의 추가적인 측위 정확도를 획득하였다.,"In this paper, we propose a deep learning-based radio frequency (RF) map reconstruction method to improve the accuracy of the indoor fingerprint positioning. The proposed scheme reconstructs the RF map in super-resolution using a convolutional neural network (CNN) by directly learning with sparse data and ground truth data in the offline phase. The simulation results show that the proposed method has 7.53m improved positioning accuracy than the conventional fingerprint positioning and 0.92m additional positioning accuracy than the bicubic interpolation method."
배 과수원을 위한 딥러닝 기반 지능형 변량 방제 시스템: 현장 평가,2020,"['변량제어', '지능형 변량 방제', 'PWM', '딥러닝', 'depth']","방제는 작물의 생산성을 크게 향상시켜주는 작업으로, 병해충이 많은 과수원에서는 생산량 증대를 위해 방제작업이 필수적으로 이뤄져야 한다. 과수원에서 주로 사용하는 방제 방법은 주변 환경에 대한 고려 없이 모든 방향으로 농약을 살포한다. 이와 같은 방식은 작업자가 농약에 직접적으로 노출되고, 무분별하게 방제를 수행하기 때문에 농약 오남용과 농약 중독을 초래한다. 그러므로 본 논문에서는 주변 환경을 인식하여 적정량의 농약만을 살포하는 지능형 변량 방제 시스템을 제안한다(그림 1). 주변 과수 환경을 딥러닝 기반의 과수 인식 및 depth 정보를 활용하여 보다 강건한 인식을 수행한다. 과수 인식　은 단순하게 존재 여부를 판단하는 방법이 아닌 픽셀 기반으로 과수 검출을 수행하며, 해당 구역에서 과수가 차지하는 비율을 파악한다. 또한, 인식된 과수의 depth 정보를 활용하여 노즐로부터 과수의 거리를 계산하여 살포될 유량 값을 도출 할 수 있다. 유량을 제어하기 위해 PWM 기반의 변량 제어를 수행하였으며, 각 스프레이 노즐 팁 가까이에 장착된 솔레노이드 밸브를 제어할 때 노즐 팁 근처의 스프레이 압력이 변동이 발생한다. 압력 변동은 토출 유량과, 액적 크기에 의도하지 않은 변화를 줄 수 있다. 즉, 이론적인 유량 모델링은 실제와 크게 다를 수 있기 때문에 본 논문에서는 변량제어 시스템의 유량을 예비실험을 바탕으로 모델링하고 최적화하였다. 제안된 지능형 방제 시스템의 성능을 검증하기 위하여 배 과수원을 대상으로 필드테스트를 수행하였다.",다국어 초록 정보 없음
지터에 내성을 갖는 딥러닝 기반 부채널 분석 방안,2020,[],"물리적 정보를 이용해 암호 알고리즘의 비밀정보를 분석하는 부채널분석 분야에서도 딥러닝을 접목한 분석방법들이 활발히 제안되고 있다. 본 논문에서는 소비전력이 시간축상으로 흐트러지는 현상인 지터가 있는 파형을 신경망의 특성을 기반으로 효과적으로 분석하는 방법을 제안한다. 제안한 방법을 실험적으로 검증하기 위해 지터가 있는 AES-128 파형을 Convolutional Neural Network와 Multi-Layer Perceptron을 기반으로 분석한 결과 제안한 방법을 적용한 신경망은 모든 바이트 키 분석에 성공했으나, 이외의 신경망은 일부 혹은 모든 바이트 키 분석에 실패했다.",다국어 초록 정보 없음
가변운행조건 하 영구자석 동기전동기의 딥러닝 기반 고장진단을 위한 전류 신호 전처리 기법,2020,"['영구자석 동기전동기 (Permanent Magnet Synchronous Motor)', '딥러닝 (Deep learning)', '전처리 (Preprocessing)', '리샘플링 (Resampling)']",국문 초록 정보 없음,"This paper proposes a preprocessing method for faults diagnosis method of a permanent magnet synchronous motor (PMSM) under various operating conditions. Mechanical & electrical faults of PMSM leads to amplitude and phase modulation of the current signal. However, variations from operating conditions also change the amplitude and phase of the current signal, which make it hard to find fault modulated component of the signal. To solve this problem, current signal is resampled to its angular domain based on its estimated angle, and spectral components of the resampled signal are used as an input of deep learning algorithm to test the relationships between spectral components. To validate the performance of the proposed method, normal and two different fault motors with different operating conditions were tested, and performance between preprocessed data and without preprocessed data were compared. The result shows the generalization capability of the proposed method."
노인코호트 DB를 이용한 딥러닝 기반의 뇌졸중 질환 예측 모델,2020,"['뇌졸중', '질환 예측', '딥러닝', 'CNN', '뇌졸중 심층 분석', 'Stroke', 'Disease Prediction', 'Deep Learning', 'Convolution Neural Network', 'Stroke In-depth Analysis']",국문 초록 정보 없음,"Stroke is the leading cause of death worldwide after cancer and heart disease. According to a statistical analysis of deaths by Statistics Korea, about 70 deaths occur every day. By 2030, the incidence of stroke disease is expected to surge more than three times due to an aging population. Therefore, research is required to reduce the burden of death and medical expenses and minimize social loss due to stroke disease. In this paper, we designed and implemented a new model that enables CNN-based stroke disease prediction. The model for predicting stroke disease was verified by using data from 558,147 elderly over the age of 60 published by the NHIS(national health insurance service). Through this experiment, we confirmed the accuracy of the model and the prediction of stroke disease for the Korean elderly."
국민청원 주제 분석 및 딥러닝 기반 답변 가능 청원 예측,2020,"['National Petition', 'Topic Analysis', 'Topic Modeling', 'K-means Clustering', 'LSTM', 'Deep Learning', '국민청원', '주제 분석', '토픽 모델링', 'K-means 클러스터링', 'LSTM', '딥러닝']","청와대 국민 청원 사이트가 개설된 이래로 많은 관심을 받고 있다. 본 논문에서는 국민 청원의 주제를 분석하고 딥러닝을 활용하여 답변 가능한 청원을 예측하는 모델을 제안하였다. 먼저, 추천순으로 1,500개의 청원글을 수집하였고, K-means 클러스터링을 적용하여 청원글을 군집하여 대주제를 정의하고, 보다 구체적인 세부 주제를 정의하기 위히여 토픽 모델링을 실시하였다. 다음으로는 LSTM을 활용한 답변 가능한 청원 예측 모델을 생성하여, 20만의 청원동의를 얻는 청원을 예측하기 위한 모델을 개발하였다. 이를 위해 글의 주제와 본문뿐만 아니라 글의 길이, 카테고리, 특정 품사의 비율이 영향을 미칠 수 있는지를 살펴보았다. 그 결과, 본문과 함께 글의 길이, 카테고리, 체언, 용언, 독립언, 수식언의 품사의 비율을 변수로 추가한 모델의 f1-score가 0.9 이상으로 글의 제목과 본문을 변수로 하는 모델보다 예측력이 높음을 알 수 있었다.","Since the opening of the national petition site, it has attracted much attention. In this paper, we perform topic analysis of the national petition site and propose a prediction model for answerable petitions based on deep learning. First, 1,500 petitions are collected, topics are extracted based on the petitions’ contents. Main subjects are defined using K-means clustering algorithm, and detailed subjects are defined using topic modeling of petitions belonging to the main subjects. Also, long short-term memory (LSTM) is used for prediction of answerable petitions. Not only title and contents but also categories, length of text, and ratio of part of speech such as noun, adjective, adverb, verb are also used for the proposed model. Our experimental results show that the type 2 model using other features such as ratio of part of speech, length of text, and categories outperforms the type 1 model without other features."
K-평균 군집화 알고리즘 및 딥러닝 기반 군중 집계를 이용한 전염병 확진자 접촉 가능성 여부 판단 모니터링 시스템 제안,2020,"['전염병', 'K-평균 군집화', '군중 계수', '모니터링 시스템', '전염병 예방', 'Infectious Diseases', 'K-means Clustering', 'Crowd Counting', 'Monitoring System', 'Pandemic Prevention']","전 세계적으로 무증상의 코로나바이러스 감염증-19 감염자가 자신이 감염된 것을 모르고 주변인들에게 전파할 수 있다는 가능성은 국민이 전염병 확산에 대한 불안과 두려움에서 벗어나지 못하고 있다는 점에서 여전히 매우 중요한 이슈이다. 본 논문에서는 K-평균 군집화 알고리즘 및 딥러닝 기반 군중 집계를 이용한 전염병 확진자 접촉 가능성 여부 판단 모니터링 시스템을 제안하였다. 모든 입력 학습 영상에 대해 300회 반복 학습한 결과, PSNR값은 21.51, 전체 데이터 셋에 대한 최종 MAE값은 67.984였다. 이는 확진자와 주변인과의 거리와 감염률 산출, 잠재적 환자 동선 주변 인원의 위험도 순 그룹 및 감염률 예측에 대한 영상 속 화질 정보, 관측치 간의 평균 절대 오차를 의미하며 각 CCTV 장면에서 군중의 수가 4,000명 이하일 때에는 평균 절대 오차 값이 0에 가까움을 증명하였다.","The possibility that an asymptotic coronavirus-19 infected person around the world is not aware of his infection and can spread it to people around him is still a very important issue in that the public is not free from anxiety and fear over the spread of the epidemic. In this paper, the K-means clustering algorithm and deep learning-based crowd aggregation were proposed to determine the possibility of contact with confirmed cases of infectious diseases. As a result of 300 iterations of all input learning images, the PSNR value was 21.51, and the final MAE value for the entire data set was 67.984. This means the average absolute error between observations and the average absolute error of fewer than 4,000 people in each CCTV scene, including the calculation of the distance and infection rate from the confirmed patient and the surrounding persons, the net group of potential patient movements, and the prediction of the infection rate."
행동 복제 강화학습 및 딥러닝 사물 부분 검출 기술에 기반한 사람형 로봇손의 사물 조작,2020,[],"최근 사람형(Anthropomorphic)로봇손의 사물조작 지능을 개발하기 위하여 행동복제(Behavior Cloning) Deep Reinforcement Learning(DRL) 연구가 진행중이다. 자유도(Degree of Freedom, DOF)가 높은 사람형 로봇손의 학습 문제점을 개선하기 위하여, 행동 복제를 통한 Human Demonstration Augmented(DA)강화 학습을 통하여 사람처럼 사물을 조작하는 지능을 학습시킬 수 있다. 그러나 사물 조작에 있어, 의미 있는 파지를 위해서는 사물의 특정 부위를 인식하고 파지하는 방법이 필수적이다. 본 연구에서는 딥러닝 YOLO 기술을 적용하여 사물의 특정 부위를 인식하고, DA-DRL 을 적용하여, 사물의 특정 부분을 파지하는 딥러닝 학습 기술을 제안하고, 2 종 사물(망치 및 칼)의 손잡이 부분을 인식하고 파지하여 검증한다. 본 연구에서 제안하는 학습방법은 사람과 상호작용하거나 도구를 용도에 맞게 사용해야하는 분야에서 유용할 것이다.",다국어 초록 정보 없음
IoT 보안 위협에 대한 딥러닝 기반의 탐지 동향,2020,[],"최근 5G, 인공지능(AI) 등과 함께 사물인터넷 (IoT) 기술이 주목받고 있으며, 보안 위협 또한 증가하고 있다. IoT 기기에 대한 다양한 공격 기법들이 존재하는 만큼 IoT 보안에 관한 연구 또한 활발하게 진행되고 있다. 본 논문에서는 IoT 환경에서의 보안 위협에 대응하기 위한 딥러닝 기반의 탐지 기법들의 최신 연구 동향과 앞으로의 방향을 살펴본다",다국어 초록 정보 없음
구글맵 API를 이용한 딥러닝 기반의 드론 자동 착륙 기법 설계,2020,"['지상관제 소프트웨어', 'GPS', '딥러닝', '구글맵 API', '자동 착륙', '이미지매칭', 'Ground control software', 'GPS', 'Deep learning', 'Google Maps API', 'Automatic landing', 'Image matching']","최근 원격조종과 자율조종이 가능한 무인항공기(RPAS:Remotely Piloted Aircraft System)가 택배 드론, 소방드론, 구급 드론, 농업용 드론, 예술 드론, 드론 택시 등 각 산업 분야와 공공기관에서의 관심과 활용이 높아지고 있다. 자율조종이 가능한 무인드론의 안정성 문제는 앞으로 드론 산업의 발달과 함께 진화하면서 해결해야 할 가장 큰 과제이기도 하다. 드론은 자율비행제어 시스템이 지정한 경로로 비행하고 목적지에 정확하게 자동 착륙을 수행할 수 있어야 한다. 본 연구는 드론의 센서와 GPS의 위치 정보의 오류를 보완하는 방법으로서 착륙지점 영상을 통해 드론의 도착 여부를 확인하고 정확한 위치에서의 착륙을 제어하는 기법을 제안한다. 서버에서 도착지 영상을 구글맵 API로부터 수신받아 딥러닝으로 학습하고, 드론에 NAVIO2와 라즈베리파이, 카메라를 장착하여 착륙지점의 이미지를 촬영한 다음 이미지를 서버에 전송한다. Deep Learning으로 학습된 결과와 비교하여 임계치에 맞게 드론의 위치를 조정한 후 착륙지점에 자동으로 착륙할 수 있다.","Recently, the RPAS(Remote Piloted Aircraft System), by remote control and autonomous navigation, has been increasing in interest and utilization in various industries and public organizations along with delivery drones, fire drones, ambulances, agricultural drones, and others. The problems of the stability of unmanned drones, which can be self-controlled, are also the biggest challenge to be solved along the development of the drone industry. drones should be able to fly in the specified path the autonomous flight control system sets, and perform automatically an accurate landing at the destination. This study proposes a technique to check arrival by landing point images and control landing at the correct point, compensating for errors in location data of the drone sensors and GPS. Receiving from the Google Map API and learning from the destination video, taking images of the landing point with a drone equipped with a NAVIO2 and Raspberry Pi, camera, sending them to the server, adjusting the location of the drone in line with threshold, Drones can automatically land at the landing point."
파워쉘 공격 탐지방법에 대한 딥러닝 연구,2020,[],"PowerShell은 닷넷 프레임 워크에 기반을 둔, 커맨드 라인 인터페이스 및 스크립트 언어의 특징을 가진 Microsoft의 명령어 인터프리터로, 이를 내장한 Windows 운영체제 점유율의 증가와 강력한 기능으로 PowerShell을 이용한 공격은 계속 증가하고 있다. 이연구에서는 딥러닝을 사용하여 악성코드를 효과적으로 탐지하는 방법과, 이에 필요한 시퀀스 데이터 추출의 방법을 찾아내는 것에 목적이 있다.",다국어 초록 정보 없음
