title,date,keywords,abstract,multilingual_abstract
Residual Multi-Dilated Recurrent Convolutional U-Net을 이용한 전자동 심장 분할 모델 분석,2020,"['딥러닝', '인공지능', '심장분할', '알고리즘', '인공신경망', '합성곱신경망', 'Deep Learning', 'Artificial Intelligence', 'Heart Segmentation', 'Algorithm', 'ANN', 'CNN']","본 논문에서는 딥 러닝 기반의 전-자동 심장 분할 알고리즘을 제안한다. 본 논문에서 제안하는 딥 러닝 모델은 기존 U-Net에 residual recurrent convolutional block과 residual multi-dilated convolutional block을 삽입하여 성능을 개선한 모델이다. 모델의 성능은 테스트 데이터 세트를 전-자동 분할한 결과와 영상의학 전문가의 수동 분할 결과를 비교하여 분석하였다. CT 영상에서 평균 96.88%의 DSC, 95.60%의 precision과 97.00%의 recall 결과를 얻었다. 분할된 영상은 3차원 볼륨 렌더링 기법을 적용하여 시각화한 후 관찰하여 분석할 수 있었다. 실험 결과를 통해 제안된 알고리즘이 다양한 심장 하부 구조를 분할하기에 효과적인 것을 알 수 있었다. 본 논문에서 제안하는 알고리즘이 전문의 또는 방사선사의 임상적 보조역할을 수행할 수 있을 것으로 기대한다.","In this paper, we proposed that a fully automatic multi-class whole heart segmentation algorithm using deep learning. The proposed method is based on U-Net architecture which consist of recurrent convolutional block, residual multi-dilated convolutional block. The evaluation was accomplished by comparing automated analysis results of the test dataset to the manual assessment. We obtained the average DSC of 96.88%, precision of 95.60%, and recall of 97.00% with CT images. We were able to observe and analyze after visualizing segmented images using three-dimensional volume rendering method. Our experiment results show that proposed method effectively performed to segment in various heart structures. We expected that our method can help doctors and radiologist to make image reading and clinical decision."
가중치 오차함수를 통한 콘크리트 균열 감지 모델 학습 개선,2020,"['딥러닝', '콘크리트 균열', '균열 검출', '오차 함수', 'U-Net', 'Deep Learning', 'Concrete Crack', 'Crack Detection', 'Loss Function', 'U-Net']","본 연구에서는 가중치 오차 함수를 적용하여, 미세한 콘크리트 균열을 감지하는 U-Net 모델을만들 수 있도록 개선 방안을 제안한다. 콘크리트 균열은 안전을 위협하는 요소이기 때문에 그 상태를 주기적으로 파악하고 신속하게 초기 대응을 하는 것이 중요하다. 하지만 현재는 점검자가직접 육안으로 검사하고 평가하는 외관 검사법이 주로 사용되고 있다. 이는 정확성뿐만 아니라비용과 시간, 안전성 측면에서도 한계점을 가진다. 이에 콘크리트 구조물에 생성되는 미세한 균열을 신속하고 정밀하게 탐지할 수 있도록 딥러닝을 활용한 기술들이 연구되고 있다. 본 연구에서U-Net을 활용한 균열 탐지를 시도한 결과, 미세한 균열을 탐지하지 못하는 것을 확인하였다. 이에제시한 가중치 오차 함수를 적용하여 학습한 모델에 대해 성능을 검증한 결과, 정확도(Accuracy) 99% 이상, 조화평균(F1_Score) 89%에서 92%의 신뢰성 높은 수치를 도출해내었고, 미세한 균열을정확하고 선명하게 탐지한 결과를 통해 학습 개선 방안의 성능을 검증하였다.","In this study, we propose an improvement method that can create U-Net model which detect fine concrete cracks by applying a weighted loss function. Because cracks in concrete are a factor that threatens safety, it is important to periodically check the condition and take prompt initial measures. However, currently, the visual inspection is mainly used in which the inspector directly inspects and evaluates with naked eyes. This has limitations not only in terms of accuracy, but also in terms of cost, time and safety. Accordingly, technologies using deep learning is being researched so that minute cracks generated in concrete structures can be detected quickly and accurately. As a result of attempting crack detection using U-Net in this study, it was confirmed that it could not detect minute cracks. Accordingly, as a result of verifying the performance of the model trained by applying the suggested weighted loss function, a highly reliable value (Accuracy) of 99% or higher and a harmonic average (F1_Score) of 89% to 92% was derived. The performance of the learning improvement plan was verified through the results of accurately and clearly detecting cracks."
다중 스케일 주의기반 네트워크을 통한 의료영상 분할,2020,"['의료 영상 분할', '딥러닝', '주의 네트워크', 'Medical Image Segmentation', 'Deep Learning', 'Attention Network']","딥러닝 기반 방법이 의료 이미지 분할에서 우수한 성능을 달성했지만 이러한 방법은 여전히 몇 가지 단점이 있다. 첫째, U-Net과 같은 인코더 디코더 구조에서 건너뛰는 연결을 사용할 경우 중복되는 특징과 불필요한 저수준 특징 정보를 다층의 스케일로 전달될 수 있다. 둘째, 이전 방법은 장거리 종속성을 수집 할 수 없으므로 특징 맵을 적절하 게 재구성하지 못한다. 이러한 문제를 완화하기 위해 본 논문에서는 서로 다른 수준에서 전체 상관 관계를 적응적으 로 탐지하고 주의 메커니즘을 활용하는 구조를 제안한다. 이 접근 방법은 지역 특징을 다른 수준으로 통합하고 노이 즈 및 원치 않는 정보를 억제하여 필수적인 특징을 강조한다. 제안하는 구조의 평가를 위해 Kvasir-SEG와 세포핵 분할 등의 두 가지 데이터셋을 이용하여 평가를 한다. 실험 결과에서 제안하는 모델의 정확도가 향상되고 기존의 방 법보다 우수한 성능을 보인다.","Even though deep learning(DL) based methods have been achieving superior performance in medical image segmentation, such methods still have some downsides. First, the use of skipconnections in encoder-decoder architecture like U-Net allows transferring redundant and superfluous low-level features information at multiple scales. Second, prior methods cannot capture long-range dependencies and hence fail to reconstruct the feature maps adeptly. To subdue these problems, we propose an architecture that adaptively captures global correlations from different scales and utilizes the attention mechanism. This approach integrates the local-features at different scales and underlines the essential features by suppressing noises and unwanted information. We evaluate the proposed architecture in the context of medical image segmentation on two different datasets: Kvasir-SEG and nuclei segmentation. Experimental results show that the proposed model yields better accuracy and outperforms previous methods."
SE-ResNeXt 기반 위험 소리 분류에 관한 연구,2020,"['딥러닝', '위험 소리 분류', '청각장애인', 'SE-ResNeXt', 'Deep Learning', 'Hazardous Sound Classification', 'Deaf People']","청각장애인은 일상생활에서 위험 소리를 듣지 못하여 위험에 많이 노출되고 있으며, 이를 해결하기 위해서 위험 소리를 인지하여 청각장애인에게 알려주는 기술이 필요하다. 최근 딥러닝을 적용하여 음향 이벤트를 분류하는 기술에 대한 연구는 진행되고 있지만, 위험 소리에 특화된 데이터 셋이 존재하지 않아 위험 소리를 분류하는 기술은 연구가 많이 진행되고 있지 않다. 따라서 본 논문에서는 10개의 범주에 대하여 26시간 규모의 위험 소리 데이터 셋을 구축하였다. 그리고 최신 합성곱 신경망 모델인 SE-ResNeXt을 사용하는 위험 소리 분류 방법을 제안하였다. 마지막으로 본 연구에서 구축한 위험 소리 데이터 셋을 사용하여 기존의 방법과 제안 방법의 분류 성능을 분석하였으며, 본 논문에서 제안한 SE-ResNeXt 기반의 위험 소리 분류 방법이 기존의 방법보다 뛰어난 분류 성능을 가지는 것을 실험 결과로 확인하였다.","Deaf people are exposed to a lot of dangerous situations since they are unable to hear hazardous sounds in their daily lives. In order to solve this problem, it is required a method that classifies hazardous sounds accurately and notifies dangerous situations to deaf people. Although there are many researches on classifying acoustic events based on deep learning technology, only a little has been going on for classifying dangerous sounds because there are no datasets especially configured for dangerous environments. Therefore, in this paper, we built a 26-hour long dataset for 10 hazardous sound categories to assess the classification performance. In addition, we proposed the SE-ResNeXt, which is the state-of-the-art convolutional neural networks model, as a method for classification. Finally, we compared the performances of the proposed method with existing methods, using our hazardous sound dataset. From the result of our experiment, we found out that the classification accuracy of SE-ResNeXt model is superior to that of pre-existing methods."
이미지를 사용한 가상의상착용을 위한 개선된 알고리즘,2020,"['가상착용', '딥러닝', '인간 표현', '성능 개선', '비용 함수', 'Virtual-try-on', 'Deep-learning', 'Human representation', 'Quality improvement', 'Loss function']","최근 이미지를 사용한 가상착용기술 (Virtual try-on: VTON)에 대한 일련의 연구들이 발표되었다. 이에 의상과 사용자 이미지를 사용한 대표적 방식 (SCMM 기반의 비-딥러닝 방식, 딥러닝 기반 VITON 과 CP-VITON)에 대해 인물의 자세 및 체형, 의상의 가려짐 정도, 의상의 특성 등에 따라 분석한 연구가 보고되었다. 본 논문에서는 이중 가장 좋은 성능을 보이는 CP-VTON의 문제점을 살펴보고 이에 따른 해결책을 제시한다. 구체적으로 대상인물의 분할 표현 문제, 교체 대상이 아닌 영역이 유지되지 못하는 문제, 합성 마스크 생성네트워크의 학습에 사용되는 비용함수 문제, 합성 네트워크의 마스크 문제를 지적하고 이를 개선하는 알고리즘을 제안하였다. 그 결과 SSIM 등에서 5%내외의 주관적으로는 상당한 개선을 보였다.","Recently, a series of studies on virtual try-on (VTON) using images have been published. A comparison study analyzed representative methods, SCMM-based non-deep learning method, deep learning based VITON and CP-VITON, using costumes and user images according to the posture and body type of the person, the degree of occlusion of the clothes, and the characteristics of the clothes. In this paper, we tackle the problems observed in the best performing CP-VTON. The issues tackled are the problem of segmentation of the subject, pixel generation of un-intended area, missing warped cloth mask and the cost function used in the learning, and limited the algorithm to improve it. The results show some improvement in SSIM, and significantly in subjective evaluation."
영상인식 및 분류용 인공지능 가속기의 최신 성능평가: MLPerf를 중심으로,2020,[],"인공지능의 고속화를 위한 인공지능용 혹은 딥러닝용 하드웨어 및 소프트웨어 시스템에 대한 수요가 폭발적으로 증가하고 있다. 또한 딥러닝 모델에 따라 다양한 추론 시스템이 끊임없이 연구되고 소개되고 있다. 최근에는 전세계에서 100개가 넘는 회사들에서 인공지능용 추론 칩을 개발하고 있고, 임베디드 시스템에서 데이터센터 솔루션에 이르기까지 다양한 분야를 위한 것들이 존재한다. 이러한 하드웨어의 개발을 위해서 12개 이상의 소프트웨어 프레임 워크 및 라이브러리가 활용되고 있다. 하드웨어와 소프트웨어가 다양한 만큼 이들을 중립적으로 평가하기가 매우 어려운 실정이다. 따라서 업계 표준의 인공지능을 위한 벤치마킹 및 평가기준이 필요한데, 이러한 요구로 인해 MLPerf 추론이 만들어졌다. MLPerf는 30개 이상의 기업과 200개 이상의 머신러닝 연구자 및 실무자들에 의해 운영되고, 전혀 다른 구조를 갖는 시스템을 비교할 수 있는 일관성 있는 규칙과 방법을 제시한다. MLPerf에 의해 제시된 규칙에 의해 2019년도에 처음으로 다양한 인공지능용 추론 하드웨어가 벤치마킹을 수행했다. 여기에는 14개의 회사에서 600개 이상의 추론 결과를 측정하였으며, 30개가 넘는 시스템이 이러한 추론에 사용되었다. 본 원고에서는 MLPerf의 학습과 추론을 중심으로 하여 최근에 개발된 다양한 회사들의 인공지능용 하드웨어, 즉 가속기들의 성능을 살펴보고자 한다.",다국어 초록 정보 없음
TensorRT와 SSD를 이용한 실시간 얼굴 검출방법,2020,"['텐서플로우', '텐서알티', '딥러닝', '에스에스디', '객체 검출', 'Tensorflow', 'TensorRT', 'Deep Learning', 'SSD', 'Object Detection']","최근에는 딥러닝 기술을 이용하여 물체 검출 및 인식에서 성능이 크게 향상되는 새로운 접근방법들이 빠르게 제안되고 있다. 객체, 특히 얼굴객체 검출에 관한 여러 기법(Faster R-CNN, R-CNN, YOLO, SSD 등) 중 SSD는 다른 기법들보다 정확도와 속도에서 우수하다. 동시에 여러 객체 검출 네트워크들(object detection network)도 쉽게 이용할 수 있다. 본 논문에서는 객체 검출 네트워크 중 Mobilenet v2 network를 이용하고 SSD와 결합한 모델을 훈련하고, TensorRT engine을 이용하여 기존의 성능보다 4배 이상의 속도로 객체를 검출하는 방법에 대해 제안하고 실험을 통해 성능을 검증한다. 제안한 방법의 성능 검증을 위한 응용으로 얼굴객체 검출기(facial object detector)를 만들어 다양한 상황에서 동작과 성능을 실험하였다.","Recently, new approaches that significantly improve performance in object detection and recognition using deep learning technology have been proposed quickly. Of the various techniques for object detection, especially facial object detection (Faster R-CNN, R-CNN, YOLO, SSD, etc), SSD is superior in accuracy and speed to other techniques. At the same time, multiple object detection networks are also readily available. In this paper, among object detection networks, Mobilenet v2 network is used, models combined with SSDs are trained, and methods for detecting objects at a rate of four times or more than conventional performance are proposed using TensorRT engine, and the performance is verified through experiments. Facial object detector was created as an application to verify the performance of the proposed method, and its behavior and performance were tested in various situations."
깊은 인공 신경망 이미지 기술자를 활용하는 멤버 분류,2020,[],"최근 딥 러닝을 이용한 방법들이 이미지 분류에서 뛰어난 성능을 보임에 따라, 복잡한 특징을 담고 있는 얼굴 이미지에 대해 이를 적용하려는 시도가 늘어나고 있다. 특히, 이미지로부터 주요한 특징들을 추출하여 간결하게 이미지를 대표할 수 있는 이미지 기술자 (Image descriptor)를 딥러닝을 통해 생성하는 연구가 인기를 끌고 있다. 이는 딥 러닝 끝 단에 있는 Fully-connected layer 의 출력으로 얻을 수 있으며 이미지의 의미론적 상관관계를 이용하여 학습된다. 구체적으로, 이미지 기술자는 실수형 벡터 데이터로서, 한 장의 이미지를 수치화 하여 비슷한 이미지 사이에는 벡터 거리가 가깝게, 서로 다른 이미지 사이에는 벡터 거리가 멀게 구성된다. 본 연구에서는 미리 학습된 인공 신경망을 통과시켜 얻은 얼굴 이미지 기술자를 활용하여 멤버 분류를 위한 두 개의 인공 신경망을 학습하는 것을 목표로 한다. 제안된 방법을 검증하기 위해 얼굴 인식에 널리 사용되는 벤치 마크 데이터셋을 활용하였고, 그 결과 제안된 방법이 높은 정확도로 멤버를 분류할 수 있다는 것을 확인하였다.",다국어 초록 정보 없음
인체 자세 추정을 위한 다중 해상도 디컨볼루션 출력망,2020,[],"최근 딥러닝을 이용한 인체 자세 추정(human pose estimation) 연구가 활발히 진행되고 있다. 그 중 구조가 간단하면서도 성능이 강력하여 널리 사용되고 있는 딥러닝 네트워크 모델은 이미지 분류(image classification)에 사용되는 백본 네트워크(backbone network)와 디컨볼루션 출력망(deconvolution head network)을 이어 붙인 구조를 갖는다. 기존의 디컨볼루션 출력망은 디컨볼루션 층을 쌓아 낮은 해상도의 특징맵을 모두 높은 해상도로 변환한 후 최종 인체 자세 추정을 하는데 이는 다양한 해상도에서 얻어낸 특징들을 골고루 활용하기 힘들다는 단점이 있다. 따라서 본 논문에서는 매 디컨볼루션 층 이후에 인체 자세 추정을 하여 다양한 해상도에서 연산을 하고 이를 종합하여 최종 인체 자세 추정을 하는 방법을 제안한다. 실험 결과 Res50 과 기존의 디컨볼루션 출력망의 경우 0.717 AP 를 얻었는데 Res101 과 기존의 디컨볼루션 출력망을 사용한 결과 50% 이상의 파라미터 수 증가와 함께 0.727 AP, 즉 0.010AP 의 성능 향상이 이루어졌다. 이에 반해 Res50 에 다중 해상도 디컨볼루션 출력망을 사용한 결과 약 1%의 파라미터 수 증가 만으로 0.720 AP, 즉 0.003 AP 의 성능 향상이 이루어졌다. 이를 통해 디컨볼루션 출력망 구조를 개선하면 매우 적은 파라미터 수 증가 만으로도 인체 자세 추정의 성능을 효과적으로 향상시킬 수 있음을 확인하였다.",다국어 초록 정보 없음
다중 스케일 영상을 이용한 GAN 기반 영상 간 변환 기법,2020,"['GAN', '딥러닝', 'GcGAN', '영상 간 변환', '다중 스케일', 'GAN', 'deep learning', 'GcGAN', 'image-to-image translation', 'multi-scale']","GcGAN은 기하학적 일관성을 유지하며 영상 간 스타일을 변환하는 딥러닝 모델이다. 그러나 GcGAN은 회전이나 반전(flip) 등의 한정적인 기하 변환으로 영상의 형태를 보존하기 때문에 영상의 세밀한 형태 정보를 제대로 유지하지 못하는 단점을 가지고 있다. 그래서 본 연구에서는 이런 단점을 개선한 새로운 영상 간 변환 기법인MSGcGAN(Multi-Scale GcGAN)을 제안한다. MSGcGAN은 GcGAN을 확장한 모델로서, 다중 스케일의 영상을 동시에 학습하여 스케일 불변 특징을 추출함으로써, 영상의 의미적 왜곡을 줄이고 세밀한 정보를 유지하는 방향으로 영상 간 스타일 변환을 수행한다. 실험 결과에 의하면 MSGcGAN은 GcGAN보다 정량적 정성적 측면에서 모두 우수하였고, 영상의 전체적인 형태 정보를 잘 유지하면서 스타일을 자연스럽게 변환함을 확인할 수 있었다.","GcGAN is a deep learning model to translate styles between images under geometric consistency constraint. However, GcGAN has a disadvantage that it does not properly maintain detailed content of an image, since it preserves the content of the image through limited geometric transformation such as rotation or flip.Therefore, in this study, we propose a new image-to-image translation method, MSGcGAN(Multi-Scale GcGAN), which improves this disadvantage. MSGcGAN, an extended model of GcGAN, performs style translation between images in a direction to reduce semantic distortion of images and maintain detailed content by learning multi-scale images simultaneously and extracting scale-invariant features. The experimental results showed that MSGcGAN was better than GcGAN in both quantitative and qualitative aspects, and it translated the style more naturally while maintaining the overall content of the image."
인공지능에 대한 사용자 관점의 이해와 이를 응용한 이미지 효과 및 영상 편집 프로그램에 대한 고찰,2020,"['인공지능', '머신러닝', '딥러닝', '이미지 합성', '영상 편집', '애니메이션', 'AI', 'machine learning', 'deep learning', 'image compositing', 'video editing', 'animation']",2016년 알파고의 바둑 대국은 일반인도 인공지능이라는 단어를 인식하는 계기가 되었다. 인공지능은 애니메이션의 소재이기도 하지만 이미 생활 속에서 다양하게 사용 중이다. 어도비 포토샵은 2014년부터 머신러닝을 적용한 기능을 추가하였으며 현재는 이미지 합성과 영상 편집을 비롯한 다양한 분야에서 머신러닝을 적용한 소프트웨어들이 출시되고 있다. 오늘날 애니메이션 제작 공정은 거의 모든 과정에서 컴퓨터를 사용하므로 개발자 측면이 아닌 사용자 측면에서 인공지능의 개념을 이해하고 이를 활용한 소프트웨어의 기능이 어떤 것들이 있는지 살피고 정리해야할 필요성을 느꼈다. 이에 연구자는 인공지능에 대하여 직접 만든 이미지와 개념도를 활용하여 일반인 수준에서 이해할 수 있도록 기초적인 내용을 정리하고 어떻게 소프트웨어에 적용되는지 고찰하였다.연구 결과 이미지 합성 분야에서 어도비 포토샵은 AI기능을 사용한 여러 소프트웨어의 기능을 대부분 포함하고 있었으나 영상 편집 분야에서 프리미어는 아직 다른 AI기반 영상편집 프로그램들과는 전혀 다른 기능을 볼 수 있다. 이는 여러 AI기반 영상편집 프로그램들이 텍스트나 음악에 맞추어 영상을 선별하여 일반인들이 쉽게 만드는 것을 목적으로 하는 것과 달리 프리미어는 범용 툴로서 전문적인 영상 편집과 이미지 보정이 목적이기 때문이다.애니메이션은 청소년들과 젊은이들이 좋아하는 매력적인 영상물이자 빠른 시대를 그려 내는 창의적인 텍스트로서 애니메이션 종사자들은 열린 마음으로 새로움을 줄 수 모든 것을 기획에서부터 제작 전반에 적용하고자 노력하는 자세를 가져야 한다. 앞으로 AI를 기반으로 쉽고 재미있게 창작을 할 수 있는 어플리케이션이나 플랫폼이 더 많이 등장할 것으로 예상한다. 그러므로 지금까지 애니메이션 제작에서 스토리텔링 영상 콘텐츠를 목표로 하였다면 앞으로는 기획능력과 제작기술을 바탕으로 머신러닝 개발자들과 함께 퍼즐형 스토리 창작이나 템플릿을 이용한 캐릭터 애니메이션과 같이 누구나 쉽게 즐길 수 있는 창작도구 형태의 콘텐츠를 개발하는 것과 같이 더 넓은 시야를 가질 필요가 있다. 이러한 새로운 작업을 할 수 있는 기본 지식을 가르치고 배우는데 본 연구내용이 도움이 되기를 기대한다.,"In 2016, AlphaGo had a historical Go match with one of the best Go masters, and it created a chance for the general public to recognize the expression artificial intelligence(AI). AI is one of the materials in animation, but it already serves various uses in human life. Adobe Photoshop added machine learning-applied functions in 2014. Today there are many software programs applying machine learning in various fields including image synthesis and video editing. The computer is used in almost every stage of the animation production process these days, which raised a need to understand the concept of AI and examine and arrange AI-based software functions in the viewpoint of users instead of developers. The investigator thus arranged the basics and examined the ways that they were applied to software by making use of the images and concept diagrams made by himself so that any people could understand them.The findings show that Adobe Photoshop encompassed most of the various software functions based on AI in the field of image synthesis. In the field of video editing, Premiere featured completely different functions not found in other AI-based video editing programs. Unlike other AI-based video editing programs designed to select videos according to given texts or music and make it easy for common people to use them for creative purposes, Premiere has a goal of professional video editing and image correction as a universal tool.Animation is an attractive work of video that adolescents and youths like, providing creative texts to depict the fast-evolving times. Those who are involved in the field of animation need to have an open mind and attitude to make efforts to apply something new to the entire process from planning to production. It is expected that more applications and platforms will be created capable of easy and fun creation based on AI. The production of animation has pursued the goal of creating storytelling video content. In the future, it will be important to employ a broader viewpoint to develop content in the forms of creative tools that anyone can enjoy including machine learning developers based on the planning abilities and production skills. The findings of the present study will hopefully contribute to the efforts to teach and learn the basic knowledge for these new works."
