title,date,keywords,abstract,multilingual_abstract
한국인 영어 학습자의 쓰기능력별 어휘 및 연어 사용 양상 분석,2020,"['corpus analysis', 'vocabulary', 'productive vocabulary', 'collocation', 'writing proficiency', 'part of speech tagging']",,"This study examined both lexical and collocational knowledge of Korean college students in relation to their writing proficiency measured by a diagnostic writing test. The study analyzed essays written in response to two topics by college students at three different proficiency levels (high, mid, low). In a comparison of vocabulary used in the essays, the study noted differences between the proficiency levels in terms of token and type frequencies. However, the lexical distribution patterns in reference to graded word-lists were similar across the proficiency levels. Regardless of the topic, approximately 90% of words used in the essays were from the first 2K words, and about 95% of words from the first 3K words. As to learner use of collocation, collocational expressions were more frequently used by advanced learners, compared to intermediate- or low-level learners. Despite the difference, collocational distribution patterns according to the graded collocation-list were also similar across the three proficiency levels. Regarding part-of-speech-tagged collocation, students tended to overuse a limited set of patterns, such as AJ-NN, NN-NN, and VP-AVP. Findings are discussed in more detail, along with pedagogical implications."
도로 네트워크에서 랜드마크 다차원 척도법을 이용한 효율적인 M-트리 대량적재 알고리즘,2020,"['M-tree', 'bulk loading', 'road network', 'landmark multidimensional scaling', 'M-트리', '대량적재', '도로 네트워크', '랜드마크 다차원 척도법']","본 연구에서는 도로 네트워크를 위한 M-트리 대량적재(bulk loading) 알고리즘을 제안한다. 도로 네트워크는 매우 동적이며, 차량의 이동, 예측하지 못한 공사와 사고 등으로 인하여 교통 상황이 끊임없이 변화한다.도로 네트워크 응용에서는 이러한 변화를 반영하도록 인덱스를 주기적으로 재구성하는 것이 필수적이다. 각각의 변화에 대하여 기존의 인덱스를 수정하기보다는 전체 도로 네트워크 데이터셋에 대한 새로운 인덱스를빠르게 재구성하는 대량적재가 효율적이다. 기존의 M-트리 대량적재 알고리즘은 ‘비싼’ 최단경로 거리 계산과 디스크 페이지 엑세스를 과도하게 수행하여 충분한 성능을 거두지 못하였다. 본 연구에서 제안하는 M-트리 대량적재 알고리즘은 랜드마크 다차원 척도법(Landmark Multidimensional Scaling, LMDS)을 이용하여 최단경로 거리 계산을 대폭 줄인다. 또한, 각 노드를 한번씩만 디스크에 저장하고 더 이상 읽지 않음으로써 디스크 액세스 횟수를 크게 줄였다. 실험 결과, 제안된 알고리즘은 기존의 알고리즘에 비하여 단일 쓰레드버전은 최대 21.3배, 다중 쓰레드 버전(동시 쓰레드 64개)은 최대 106배까지 M-트리 생성 성능이 향상되었고, 제안된 알고리즘으로 생성한 M-트리를 이용한 k-최근접 객체(k-nearest neighbor) 검색의 성능이 최대 1.22 배까지 향상되었다.","In this study, we propose an algorithm for M-tree bulk loading in road networks. Road networks are highly dynamic; traffic situation changes constantly owing to vehicle movements and unpredicted constructions and accidents. Thus, it is crucial for road network applications to periodically reorganize the index to fully reflect the changes. In such a circumstance, rather than modifying the existing index for each of the changes, it is more efficient to quickly bulk load a new index for the entire road network. The previous M-tree bulk loading algorithms heavily conduct ‘expensive’ shortest-path distance computations and disk page accesses, thereby degrading their performances. The algorithm proposed in this study reduces the number of shortest-path distance computations using landmark multidimensional scaling (LMDS). In addition, since our algorithm stores M-tree nodes in disk and does not access them again, the number of disk page accesses is also dramatically reduced. Experimental results demonstrated that our algorithm outperformed the previous algorithm by up to 21.3 times (single-thread version) and 106 times (multi-thread version with 64 concurrent threads) for M-tree construction and that the performance of the k-nearest neighbor (k-NN) search using the M-tree built by our algorithm was also improved by up to 1.22 times."
인공지능 기법을 활용한 공직기강 감찰활동 효과성 향상에 관한 연구,2020,"['인공지능', '기계학습', '감사', '공직기강', '감찰활동']","광범위하게 확산되고 있는 디지털화에 따라 레그테크(RegTech)의 활용 가능성과 사례도점점 증가하고 있으며, 그중에서도 감사활동에 기계학습의 응용 가능성이 높음을 증명하는 사례들이 주목을 받고 있다.본 연구에서는 사후 적발 위주의 공직기강 감찰 활동의 문제점을 개선하고, 상시적 예방 감찰 활동 수행을 위하여 인공지능 기술을 활용하고자 한다. 구체적으로 기계학습 기법을 활용하여 특히 PC ON 초과 시간 여부 예측 모형을 만들었으며, 공직기강 감찰활동의 근태점검에 상시적으로 인공지능 기법의 활용 가능성에 대해서 연구하였다.본 실험을 위해서 2020년 2월부터 2020년 7월까지의 모공공기관 직원의 사내 PC ON 시간 데이터 88,723개를 사용하였으며, 전체데이터는 훈련데이터 75%와 테스트데이터 25%로각각 분리하였고, k-겹 교차검증(K-fold Cross-validation) 방법을 사용하여 예측 정확도를 향상시키기 위해 노력하였다.다양한 예측모형 생성 실험을 위해서 k-NN, 의사결정트리, 랜덤 포레스트, 그래디언트 부스팅, 신경망 등 5개의 기계학습 기법들을 사용하였으며, 각 기법들에 대한 최적화를 수행하여 최적화 모델의 정확도를 비교 분석하였다.실험 결과 PC ON 초과 시간 여부 예측 모델 생성시‘근무유형’, ‘사번’, ‘부서명’, ‘월’ 변수가 중요한 특성 요소로 선택되었음을 확인하였고, 예측 결과가 가장 좋은 모델은 94.4%의 정확도를 가진 최적화된 랜덤 포레스트 모델이였다.","With the widespread digitalization, the availability and cases of RegTech are also increasing. Among them, cases proving that machine learning is highly likely to be applied to audit activities are drawing attention.In this study, we aim to improve the problems of post-detection-oriented public discipline inspection activities and utilize artificial intelligence technology to carry out preventive inspection activities on a regular basis. Specifically, the machine learning techniques were used to create a prediction model for PC ON overtime, and the possibility of using artificial intelligence techniques on a regular basis was studied for checking the absenteeism and tardiness of public office discipline.For this experiment, in-house PC ON time data of employees of a public institution were used from February 2020 to July 2020, and the entire data were separated into 75% of training data and 25% of test data, respectively, with using k-fold cross-validation method for improving prediction accuracy.For various predictive model generation experiments, five machine learning techniques were used: k-NN, decision tree, random forest, gradient boosting, and neural network. Optimization of each technique was performed to compare the accuracy of the optimization model.The results of the experiment confirmed that the ‘work type’, ‘employee number’, ‘department’, and ‘month’variables were selected as important characteristic elements when the PC ON overtime classification prediction model was created. The best model in the forecast was the optimized random forest model with 94.4% accuracy."
Fast Leaf Recognition and Retrieval Using Multi-Scale Angular Description Method,2020,"['Image Retrieval', 'k-NN', 'Leaf Recognition', 'Multi-Scale', 'SVM']",,"Recognizing plant species based on leaf images is challenging because of the large inter-class variation andinter-class similarities among different plant species. The effective extraction of leaf descriptors constitutes themost important problem in plant leaf recognition. In this paper, a multi-scale angular description method isproposed for fast and accurate leaf recognition and retrieval tasks. The proposed method uses a novel scalegenerationrule to develop an angular description of leaf contours. It is parameter-free and can capture leaffeatures from coarse to fine at multiple scales. A fast Fourier transform is used to make the descriptor compactand is effective in matching samples. Both support vector machine and k-nearest neighbors are used to classifyleaves. Leaf recognition and retrieval experiments were conducted on three challenging datasets, namelySwedish leaf, Flavia leaf, and ImageCLEF2012 leaf. The results are evaluated with the widely used standardmetrics and compared with several state-of-the-art methods. The results and comparisons show that theproposed method not only requires a low computational time, but also achieves good recognition and retrievalaccuracies on challenging datasets."
사용자의 온오프 라인 쇼핑에서 상품 추천을 위한 전이학습 모델 비교,2020,"['Recommendation', 'Deep Learning', 'Transfer Learning', 'FCN', 'k-NN', 'Linear SVM']",,"Recently, deep learning based services has been actively developed in various fields. Especially, in the online distribution environment some Applications with deep learning based on large amounts of data and user information began to be applied to real systems. In this paper, we develop an application system which recommends goods after learning and predicting using deep learning by presenting good image that user wants to purchase in online market sites. At this time, we apply three revised models based on the transfer learning model for automatic image recognition. After image recognition of goods, the system produces candidate goods and requires filter condition input for goods he wants to purchase. Finally, the system recommends goods by content-based recommendation method. In this paper, we experiment three revised models of image recognition which are used as core techniques in the system. These models are fully connected network, k-nearest neighbors search and linear SVM and they act as a classifier within the transfer learning model architecture. We experiment and compare performance evaluation for the revised models."
119 신고 데이터를 이용한 자연어처리 기반 재난안전 상황 분류 알고리즘 분석,2020,"['인공지능', '재난 대응', '자연어처리', '상황 분류', '기계학습', 'Artificial Intelligence', 'Emergency Response', 'Natural Language Processing', 'Situation Classification', 'Machine Learning']",,"Due to the development of artificial intelligence, it is used as a disaster response support system in the field of disaster. Disasters can occur anywhere, anytime. In the event of a disaster, there are four types of reports: fire, rescue, emergency, and other call. Disaster response according to the 119 call also responds differently depending on the type and situation. In this paper, 1280 data set of 119 calls were tested with 3 classes of SVM, NB, k-NN, DT, SGD, and RF situation classification algorithms using a training data set. Classification performance showed the highest performance of 92% and minimum of 77%. In the future, it is necessary to secure an effective data set by disaster in various fields to study disaster response."
Activity and Safety Recognition using Smart Work Shoes for Construction Worksite,2020,"['Construction site', 'Worker', 'Safety', 'Conductive textile', 'Stairs']",,"Workers at construction sites are easily exposed to many dangers and accidents involving falls, tripping, and missteps on stairs. However, researches on construction site monitoring system to prevent work-related injuries are still insufficient. The purpose of this study was to develop a wearable textile pressure insole sensor and examine its effectiveness in managing the real-time safety of construction workers. The sensor was designed based on the principles of parallel capacitance measurement using conductive textile and the monitoring system was developed by C# language. Three separate experiments were carried out for performance evaluation of the proposed sensor: (1) varying the distance between two capacitance plates to examine changes in capacitance charges, (2) repeatedly applying 1 N of pressure for 5,000 times to evaluate consistency, and (3) gradually increasing force by 1 N (from 1 N to 46 N) to test the linearity of the sensor value. Five subjects participated in our pilot test, which examined whether ascending and descending the stairs can be distinguished by our sensor and by weka assessment tool using k-NN algorithm. The 10-fold cross-validation method was used for analysis and the results of accuracy in identifying stair ascending and descending were 87.2% and 90.9%, respectively. By applying our sensor, the type of activity, weight-shifting patterns for balance control, and plantar pressure distribution for postural changes of the construction workers can be detected. The results of this study can be the basis for future sensor-based monitoring device development studies and fall prediction researches for construction workers."
Genetic diversity and population structure of indigenous chicken of Bangladesh using microsatellite markers,2020,"['Indigenous Chicken', 'Genetic Diversity', 'Microsatellite Marker', 'Bangladesh']",,"Objective: The objectives of this study were to investigate the genetic diversity, population structure and relatedness among the five chicken populations of Bangladesh using microsatellite markers.Methods: A total of 161 individuals representing 5 chicken populations (non-descript Deshi [ND], naked neck [NN], hilly [HI], Aseel [AS], and red jungle fowl [JF]) were included in this study to investigate genetic diversity measures, population structure, genetic distance and phylogenetic relationships. Genotyping was performed using 16 selected polymorphic microsatellite markers distributed across 10 chromosomes.Results: The average observed and expected heterozygosity, mean number of alleles and polymorphic information content were found to be 0.67±0.01, 0.70±0.01, 10.7 and 0.748, respectively in the studied populations. The estimated overall fixation index across the loci (F), heterozygote deficiency within (FIS) and among (FIT) chicken populations were 0.04±0.02, 0.05 and 0.16, respectively. Analysis of molecular variance analysis revealed 88.07% of the total genetic diversity was accounted for within population variation and the rest 11.93% was incurred with population differentiation (FST). The highest pairwise genetic distance (0.154) was found between ND and AS while the lowest distance was between JF and AS (0.084). Structure analysis depicted that the studied samples can be categorized into four distinct types or varieties (ΔK = 3.74) such as ND, NN, and HI where AS and JF clustered together as an admixed population. The Neighbor-Joining phylogenetic tree and discriminant analysis of principal component also showed close relatedness among three chicken varieties namely AS, HI, and JF.Conclusion: The results reflected that indigenous chicken of Bangladesh still possess rich genetic diversity but weak differentiation among the studied populations. This finding provides some important insight on genetic diversity measures that could support the designing and implementing of future breeding plans for indigenous chickens of Bangladesh."
