title,date,keywords,abstract,multilingual_abstract
토양에 살포된 축산 분뇨로부터 암모니아 방출량 예측을 위한 인공신경망의 초매개변수 최적화와 데이터 증식,2023,"['Livestock manure', 'Ammonia emission amount', 'Artificial neural network (ANN)', 'Hyperparameter optimization', 'Data augmentation']","인공신경망을 이용한 모델 개발에서 데이터의 품질은 모델 성능에 큰 영향을 주고, 양질의 충분한 데이터가 인공신경망 훈련을 위해 필요하다. 하지만, 공학 분야에서는 적은 양의 데이터로 모델을 개발해야 하는 경우가 자주 발생한다. 본 논문은 토양에 살포된 축산 분뇨로부터 암모니아 방출량에 대한 적은 수의 데이터(83개)를 사용하여 인공신경망 모델의 예측 성능을 향상할 수 있는 방안을 제시하였다. Michaelis-Menten 식으로 표현되는 암모니아 방출량 문제는11개 입력변수에 대하여 2개 출력변수로 구성되었다. 출력변수는 최대 질소 발생량(Nmax, kg/ha)과 Nmax의 절반에 도달하는 시간(Km, h)이다. 범주형 입력변수에 대해 다차원 등간격 기법인 one-hot encoding을 이용하여 데이터 전처리를수행하였고, 훈련데이터 66개에 대하여 generative adversarial network (GAN)을 이용하여 13개 데이터를 추가로 보강하였다. 또한, 인공신경망의 초매개변수인 은닉층 수, 각 은닉층 내 뉴런 수, 활성화 함수의 최적 조합을 찾기 위하여Gaussian process (GP)를 사용하였다. 기존의 인공신경망 구조(Lim et al., 2007) 는 17개 평가데이터에 대하여 mean absolute error (MAE)는 Km에서 0.0668, Nmax에서 0.1860이었다. 본 연구에서 제시된 인공신경망 모델은 Km에서 0.0414, Nmax에서 0.0818로 MAE 가 기존 모델 대비 각각 38%, 56% 감소하였다. 본 연구에서 제시된 방법은 적은 양의 데이터를 갖는 문제에서 인공신경망 성능을 향상하기 위하여 활용할 수 있을 것이다.",
신화론으로 본 AI예술의 생성이데올로기,2023,"['AI', 'AI생성예술', 'GAN', '기호학', '신화론', '의미작용', '창의', '생성', 'AI', 'AI generative art', 'GAN', 'mythology', 'signification', 'creation', 'generative']","본 연구는 AI영상플랫폼을 이용하여 나타나는 생성이미지의 신화론적 의미분석을 통한 AI생성예술에 대한 연구로써, 본 연구자가 제작한 드로잉과 콜라쥬 작품을 AI프로그램에 적용하여 생성된 이미지를 활용하여 기호학적으로 분석하였다. 연구방법은 AI생성플랫폼에 텍스트로 입력된 프롬프트의 형식과 내용이 가지는 의미를 재해석하고, 이를 신화론적 의미작용 모형에 적용시켜 실험하였다. 이를 통해 AI생성예술의 이미지에 대한 의미작용 분석과정은 AI생성이미지가 프롬프트 텍스트에 의해 2차적 의미작용이 변화하여 나타남을 알 수 있었다. 그 결과 AI생성예술의 의미작용모형은 바르트의 의미작용모형 구조와는 다소 차이가 있으며, 드로잉 이미지의 1차적 의미작용의 범위와 AI생성이미지의 2차적 의미작용의 범위가 변화되었다. 본 연구는 작가의 작품에 담긴 <창의>와 AI생성예술에 나타나는 <생성>이라는 두 신화의 의미작용 차이를 통해 AI생성예술이 가지는 창작도구로서의 가능성을 보여주고자 하였으며, AI생성예술의 예술적 가치에 대한 기대와 우려에 대한 함의를 도출하고자 하였다.","The study was conducted on AI generative art through analysis of the mythological meaning of generative images using an AI moving image platform. The drawings and collage works I created were semiotically analyzed using the images generated by applying them to an AI generation program. The research method was to reinterpret the meaning of the format and content of the prompt entered as text into the AI generative art platform and apply it to the mythological signification model for an experiment. Through this, the signification analysis process for images of AI generative art showed that AI generative images appear as secondary signification changes due to the prompt text. As a result, the semantic model of AI generative art is somewhat different from Barth's semantic model structure, and the scope of the primary semantics of drawing images and the secondary semantics of AI generative images have changed. This study attempted to show the potential of AI generative art as a creative tool through the difference in meaning between the both myths, <creation> in the artist's work and <generative> in AI generative art, and to determine the artistic value of AI generative art. The aim was to derive implications for expectations and concerns about."
Online New Media Oriented Privacy Data Recognition Mechanism Based on Deep Learning,2023,"['Face Recognition', 'GAN', 'New Media', 'Privacy Data Recognition.']",,"Although the current face de-recognition algorithm can effectively protect the user's identity, it will change the original attributes of the im-age, destroy the visual effect, or change the characteristics of the image to varying degrees. Traditional methods such as pixelation and occlu-sion can effectively realize face de-recognition, but the processed image cannot be used for basic processing such as face statistics and expres-sion recognition, which greatly destroys the usability of the image in the field of online new media. In order to preserve more attributes of the original image and reduce the changes of facial skin color and texture features caused by the above de-recognition algorithm's operation on the whole facial area, this paper proposes a privacy protection model of face image based on generative adversarial network and facial feature analysis. Our model realizes face recognition based on changing the original image as little as possible. Specifically, we identify and extract features from fixed parts in face images, including eyes, nose, mouth, eyebrows, and cheeks. Then, we designed a face privacy recognition and protection model based on conditional generative adversarial networks. We verify our proposed method on two most commonly used face datasets in face research, namely CelebFaces Attributes and Labeled Faces in the Wild, and the results show that our proposed method achieve better performance compared with other face privacy protection methods."
이미지 생성 AI의 효율성과 창의성이 지속사용의도에 미치는 영향 - OpenAI 달리(DALL-E)2를 중심으로,2023,"['AI', 'Image generating AI', 'GAN', 'AI', 'Image generating AI', 'GAN', 'Creativity', 'Efficiency', 'Design', 'Efficiency', 'Design', 'AI', 'Image generating AI', 'GAN', 'Creativity', 'Efficiency', 'Design']","최근 AI(Artificial Intelligence)는 우리 삶의 다양한 영역에 영향을 미치며 최대의 관심사로 떠오르고 있으며, 이러한 추세는 디자인 학문 분야에서도 예외가 아니다. 특히 이미지 생성 AI의 등장은 디자인 분야에 혁명적인 영 향을미치고있다.기존에없던새로운이미지를단몇초만에생성하는 것이 가능할 뿐 아니라 대중화되면서 AI 이슈의 중심이 되는 효율성과 창 의성에대한인과성을증명하고자한다.이를위해본연구는이미지생성 AI의 효율성과 창의성이 지속사용의도에 어떤 영향을 미치는지 연구하기 위해 문헌고찰, 디자인 분야에서 달리(DALL-E)2 활용 사례분석, 선행연구 를 바탕으로 연구 모형과 가설을 설정하여 실증 분석을 진행하고, 심층 인 터뷰를 통해 실질적으로 기여하는 지를 규명하고자 하였다. 연구 결과, 이 미지 생성 AI의 효율성과 창의성의 독립 변수와 지속사용의도인 종속변수 와의 인과 관계를 확인하였고, 이미지 생성 AI 효율성과 창의성이 지속사용 의도를 높이는 핵심 요소임을 확인하였으며, 이는 AI 기술의 개발과 활용에 있어 중요한 지침을 제공한다. 따라서, 앞으로의 AI를 활용한 교육, 이미지 생성 AI 개발, 기업 광고 및 비즈니스 등에 활용될 뿐만 아니라 디자이너 또는 예술가들의 역할을 제시한다. 또한, AI를 받아들이는 입장에서 이론적, 실무적 시사점을 제공하며, 후속 연구의 기초자료로 활용되어 이미지 생성 AI 연구에 기여 할 수 있을 것이라 사료된다.","Artificial Intelligence(AI) has become a hot topic of interest in recent years, affecting many areas of our lives, and the field of design is no exception to this trend. In particular, the emergence of image-generation AI has revolutionized the field of design. As the ability to generate new, unprecedented images in a matter of seconds becomes not only possible but popular, we want to prove the causality between efficiency and creativity that is at the center of the AI debate. To study how the efficiency and creativity of image-generating AI affect the intention to continue using it, this study conducted a literature review, analyzed the use of DALL-E2 in the design field, set up a research model and hypotheses based on previous studies, conducted an empirical analysis, and conducted in-depth interviews to find out whether it makes a practical contribution. As a result of the study, we confirmed the causal relationship between the independent variables of image generation AI efficiency and creativity and the dependent variable of continuous usage intention, and confirmed that image generation AI efficiency and creativity are key factors that increase continuous usage intention, which provides important guidance for the development and utilization of AI technology. Therefore, it suggests the role of designers or artists in future AI-enabled education, image generation AI development, corporate advertising and business, etc. It also provides theoretical and practical implications from the perspective of accepting AI, and is expected to serve as a basis for further research and contribute to the study of image-generation AI."
Distributed Secondary Voltage Optimal Control of Active Distribution Network and the System Stability Investigation,2023,"['Active distribution network', 'Distributed generation', 'Distributed optimal control', 'Voltage regulation', 'Smallsignal stability']",,"This paper presents a distributed secondary voltage optimal control strategy for active distribution network (ADN), and synthetizes the state-space model to investigate the system stability of the ADN under this control framework. A leader–follower type distributed voltage control strategy is formulated utilizing consensus protocol that can effectively decompose the node voltage control task while preserving a satisfactory voltage regulation performance. The small-signal models of distributed generation units adopting the distributed control law and the power network are established. The state-space model of the whole ADN is further established by integrating the linearized versions of these models together, and the system small-signal stability is studied utilizing eigenvalue analysis method. Finally, the IEEE-33 node distribution network under several operation scenarios is simulated to demonstrate the effectiveness of the proposed methods, and the stability of the system is also analysed."
Prediction of KOSPI 200 Index Movement Using Generative Adversarial Network Based on LSTM,2023,"['Stock movement prediction', 'GAN', 'LSTM', 'DNN', 'Kospi200']",,"Stock price prediction research has been actively underway since the past. Predicting the direction of the stock price movement is an attractive study that can be applied to actual investment. Even a little improvement in stock price performance can lead to large profits from actual investment. Nonetheless, predicting a random, volatile stock market poses many challenges.With the development of deep learning methodologies, there have been various attempts to apply them to predicting stock prices. This study aims to improve stock price direction prediction performance by using the Generative Adversarial Network (GAN) model, which is widely used in the image field, and the LSTM model, which is widely used for time series data prediction. The proposed LSTM-GAN model compared performance with that of benchmark models using the KOSPI 200 index, Korea’s representative stock index."
"생성형 AI 기반 이미지 변환 툴의 활용성과 한계성, 그리고 디자인 교육에의 함의",2023,"['생성형 AI', '그래픽 디자인', 'AI 디자인 툴', '이미지 변환', '디자인 교육', 'Generative AI', 'Graphic design', 'AI design tool', 'Image conversion', 'Design education']","본 연구는 최근 등장한 AI 기반 이미지 생성 도구가 컴퓨터 디자인 과업수행에 미치게 될 영향과 디자인 교육에 대한 시사점을 논의하고자 한다. 이를 위해 본고는 첫째, AI 기반 이미지 생성 기술 네 가지인 생성적 적대 신경망(GANs), 디퓨전(Diffusion), 이미지 분할 기술(SAM), 그리고 대규모 언어모델(LLM)을 기반으로 구현된 여덟 가지 AI 디자인 툴(PhotoRestore, DragGAN, StyleDrop, Dreamfusion, Lasco.ai, Cesium JS, Pictory.ai, VisionPro)의 기능성을 분석하였다. 둘째, 이러한 AI 기반 디자인 툴이 디자인 유형별(2D 그래픽 디자인, 사용자 경험 디자인, 웹 디자인, 그리고 3D 모델링 및 애니메이션)로 어떤 활용성과 한계성을 가지는지 분석하였다. 분석결과 디자인 과업 수행 및 교육에 생성형 AI 기술이 도입되면 학습 자료의 시각적 표현을 통한 학습 효과 증진, 텍스트를 이미지로 쉽게 변환하여 복잡한 개념의 시각화, 3D 모델로의 이미지 변환을 통한 복잡한 개념의 깊은 이해, 그리고 동영상 이미지나 객체 생성 기술을 통한 가상현실의 활용 등에 매우 유용하게 활용될 수 있음을 알 수 있었다. 마지막으로, 이러한 생성형 AI 기술의 등장이 디자인 과업수행과 교육에 미치게 될 영향력과 유의사항에 대해 논의하였다.","The primary objective of this study is to explore the potential applications of emerging AI-based image generation tools in various design domains and examine their implications for design education. To accomplish this, the paper begins by analyzing the functionalities of eight AI design tools (PhotoRestore, DragGAN, StyleDrop, Dreamfusion, Lasco.ai, Cesium JS, Pictory.ai, VisionPro) based on four types of AI-based image generation technologies: Generative Adversarial Networks (GANs), Diffusion, Segment Anything Model (SAM), and Large Language Models (LLM). Subsequently, the study investigates the practicality and limitations of these AI-based design tools in different design areas, such as 2D graphic design, user experience design, web design, and 3D modeling and animation. The analysis indicates that incorporating generative AI technologies into design tasks and education could significantly improve learning effectiveness through a visual representation of educational materials, facilitate the conversion of text into images for visualizing complex concepts, promote in-depth understanding of intricate ideas by transforming images into 3D models, and streamline the utilization of virtual reality through video image or object generation technology. Lastly, the paper discusses the potential impact and considerations that the advent of such generative AI technology may have on design tasks and education."
효율적인 이상 탐지를 위한 적대적 도메인 적응 기법,2023,"['Information Security', 'Deep Learning', 'Adversarial Domain Adaptation', 'Anomaly Detection', 'Time Series Data', '정보 보안', '딥러닝', '적대적 도메인 적응', '이상 탐지', '시계열 데이터']","본 논문에서는 효율적인 이상 탐지를 위한 적대적 도메인 적응 기법을 제안한다. 제안된 방법은 생성적 적대 네트워크(GAN)에 사용되는 적대적 학습을 통해 두 도메인 사이의 확률적 데이터 분포 차이를 최소화한다. 제안된 모델은 분류 성능 평가 지표를 사용하여, 제안된 도메인 적응 모델의 이상 탐지 성능을 도메인 적응을 적용하지 않은 모델과 비교하여 평가한다. 실험결과 제안된 모델이 비교 모델보다 학습시간을 67% 단축하고 유사한 성능을 보이는 효율적인 이상 탐지 성능을 보였으며, 기존 전이 학습(Transfer Learning)의 학습 과정과 달리 도메인 적응 방법을 통해 타겟 데이터가 소스 데이터 보다 상대적으로 큰 경우에도 효과적임을 확인하였다.","In this paper, we propose adversarial domain adaptation techniques for efficient anomaly detection. The proposed method minimizes the difference in stochastic data distribution between the two domains through adversarial learning used in generative adversarial networks (GANs). We evaluate the anomaly detection performance of the proposed domain adaptation model by using classification performance evaluation indicators compared to models without domain adaptation. Experiments show that the proposed model reduces learning time by 67% compared to comparative models, shows similar performance, and shows efficient anomaly detection performance, and unlike the learning process of transfer learning, it is effective even when target data is relatively larger than source data."
Applying Pix2pix to Translate Hyperemia in Blood Pool Image into Corresponding Increased Bone Uptake in Delayed Image in Three-Phase Bone Scintigraphy,2023,['Bone scintigraphy · Arthritis · Complex regional pain syndrome · Artificial intelligence · Image-to-image translation'],,"Purpose Delayed images may not be acquired due to severe pain, drowsiness, or worsening vital signs while waiting afterblood pool imaging in three-phase bone scintigraphy. If the hyperemia in the blood pool image contains information fromwhich increased uptake on the delayed images can be inferred, the generative adversarial network (GAN) can generate theincreased uptake from the hyperemia. We attempted to apply pix2pix, a type of conditional GAN, to transform hyperemiainto increased bone uptake.Methods We enrolled 1464 patients who underwent three-phase bone scintigraphy for inflammatory arthritis, osteomyelitis,complex regional pain syndrome (CRPS), cellulitis, and recent bone injury. Blood pool images were acquired 10 minafter intravenous injection of Tc-99 m hydroxymethylene diphosphonate, and delayed bone images were obtained after 3 h.The model was based on the open-source code of the pix2pix model with perceptual loss. Increased uptake in the delayedimages generated by the model was evaluated using lesion-based analysis by a nuclear radiologist in areas consistent withhyperemia in the blood pool images.Results The model showed sensitivities of 77.8% and 87.5% for inflammatory arthritis and CRPS, respectively. In osteomyelitisand cellulitis, their sensitivities of about 44% were observed. However, in cases of recent bone injury, the sensitivitywas only 6.3% in areas consistent with focal hyperemia.Conclusion The model based on pix2pix generated increased uptake in delayed images matching the hyperemia in the bloodpool image in inflammatory arthritis and CRPS."
적대적 생성 신경망 기반 비공기압 타이어 디자인 시스템,2023,"['Generative Adversarial Networks', 'Non-Pneumatic Tire', 'Design', 'OpenCV', 'AI']",,"The design of non-pneumatic tires, which are created by filling the space between the wheel and the tread with elastomeric compounds or polygonal spokes, has become an important research topic in the automotive and aerospace industries. In this study, a system was designed for the design of non-pneumatic tires through the implementation of a generative adversarial network. We specifically examined factors that could impact the design, including the type of non-pneumatic tire, its intended usage environment, manufacturing techniques, distinctions from pneumatic tires, and how spoke design affects load distribution. Using OpenCV, various shapes and spoke configurations were generated as images, and a GAN model was trained on the projected GANs to generate shapes and spokes for non-pneumatic tire designs. The designed non-pneumatic tires were labeled as available or not, and a Vision Transformer image classification AI model was trained on these labels for classification purposes. Evaluation of the classification model show convergence to a near-zero loss and a 99% accuracy rate confirming the generation of non-pneumatic tire designs."
이미지 생성을 위한 변동 자동 인코더 분산 제약,2023,"['Auto-encoder', 'Variational Auto-encoder', 'Latent space', 'Tensorflow']","GAN(Generative Adversarial Networks)이 합성 이미지 생성 및 기타 다양한 응용 프로그램에 현재 사용되고있지만, 생성 모델을 제어하기가 어렵다. 문제는 생성 모델의 잠재 공간에 있는데, 이미지 생성과 관련하여 입력된 잠재코드를 받아 특정 텍스트 및 신호에 따라 지정된 대상 속성이 향상되도록 하고 다른 속성은 크게 영향을 받지 않도록하기 위해서는 상당한 제약이 요구된다. 본 연구에서는 이미지 생성 및 조작과 관련하여 변동 자동 인코더의 잠재 벡터에 관해 특정 제약을 수반한 모델을 제안한다. 제안된 모델에 관해 TensorFlow의 변동 자동 인코더를 통해 실험한 결과이미지의 생성 및 조작과 관련하여 비교적 우수한 성능을 갖는 것으로 확인된다.",
감각치환을 위한 소리 기반 감정 표현 얼굴 생성 연구,2023,"['Visual to Auditory', 'Generative Model', 'Multi-Modal', 'GANs']",,"Research on Visual-to-Auditory (V2A) which uses neural facilitation to transfer visual information to auditory information is actively ongoing. However, existing V2A methods have provided users with limited information by simply converting visual information to auditory information. To provide more information to the users, it is necessary to generate and transmit augmented visual information by integrating it with other sensory information. Recently, methods for generating augmented visual information by integrating auditory and visual information are being studied, but there is a drawback in that they cannot generate images optimized for sound intensity by not considering the rich intensity of sound. To solve this problem, in this paper, a method of classifying sound and converting the classified result into sound intensity to generate images optimized for sound intensity is proposed. The results of applying the proposed method to a face image generation model in experiments showed that the proposed method can generate face images utilizing sound information when sound intensity is considered."
