title,date,keywords,abstract,multilingual_abstract
12/4 SynRel machine design with concentrated windings and novel polynomial fitting model‑based continuous MTPA control method,2023,"['Synchronous reluctance', 'Concentrated winding', 'Polynomial fitting model', 'MTPA control']",,"This paper proposes a 12-stator slot/4-rotor pole (12/4) synchronous reluctance (SynRel) machine with integral slot concentrated windings (ISCW), a segmented stator, and a skewed rotor, namely the 12/4 ISCW machine. The proposed 12/4 ISCW machine exhibits comparable torque performance when compared to the case of adopting an integral slot distributed winding (ISDW) with the same total stack length. A comparison study is conducted on the 12/4 ISCW machine, a 24/4 ISDW machine, and 6/4 fractional slot concentrated winding (FSCW) machines. Then a torque prediction method and a continuous maximum torque per ampere (MTPA) control based on the polynomial fitting model (PFM) are proposed for SynRel machines, to provide fast and accurate calculation of the real-time inductances and torque. Magnetic saturations are also considered in the PFM, which is why the PFM has great potential in the maximum-current-per-torque control of SynRel machines. Finally, a prototype of the proposed 12/4 ISCW SynRel machine is manufactured and experimental validations are carried out."
Airfoil GAN: encoding and synthesizing airfoils for aerodynamic shape optimization,2023,"['deep learning', 'generative adversarial network', 'airfoil design', 'design optimization']",,"The current design of aerodynamic shapes, like airfoils, involves computationally intensive simulations to explore the possible design space. Usually, such design relies on the prior definition of design parameters and places restrictions on synthesizing novel shapes. In this work, we propose a data-driven shape encoding and generating method, which automatically learns representations from existing airfoils and uses the learned representations to generate new airfoils. The representations are then used in the optimization of synthesized airfoil shapes based on their aerodynamic performance. Our model is built upon VAEGAN, a neural network that combines Variational Autoencoder with Generative Adversarial Network and is trained by the gradient-based technique. Our model can (1) encode the existing airfoil into a latent vector and reconstruct the airfoil from that, (2) generate novel airfoils by randomly sampling the latent vectors and mapping the vectors to the airfoil coordinate domain, and (3) synthesize airfoils with desired aerodynamic properties by optimizing learned features via a genetic algorithm. Our experiments show that the learned features encode shape information thoroughly and comprehensively without predefined design parameters. By interpolating/extrapolating feature vectors or sampling from Gaussian noises, the model can automatically synthesize novel airfoil shapes, some of which possess competitive or even better aerodynamic properties as compared to airfoils used for model training purposes. By optimizing shapes on the learned latent domain via a genetic algorithm, synthesized airfoils can evolve to target aerodynamic properties. This demonstrates an efficient learning-based airfoil design framework that encodes and optimizes the airfoil on the latent domain and synthesizes promising airfoil candidates for required aerodynamic performance."
Exploring the Effectiveness of GAN-based Approach and Reinforcement Learning in Character Boxing Task,2023,"['Character Animation', 'Physics-based Simulation', 'Reinforcement Learning', 'GAN', '캐릭터 애니메이션', '물리기반 시뮬레이션', '강화학습', 'GAN']",,"For decades, creating a desired locomotive motion in a goal-oriented manner has been a challenge in character animation. Datadriven methods using generative models have demonstrated efficient ways of predicting long sequences of motions without the need for explicit conditioning. While these methods produce high-quality long-term motions, they can be limited when it comes to synthesizing motion for challenging novel scenarios, such as punching a random target. A state-of-the-art solution to overcome this limitation is by using a GAN Discriminator to imitate motion data clips and incorporating reinforcement learning to compose goaloriented motions. In this paper, our research aims to create characters performing combat sports such as boxing, using a novel reward design in conjunction with existing GAN-based approaches. We experimentally demonstrate that both the Adversarial Motion Prior [3] and Adversarial Skill Embeddings [4] methods are capable of generating viable motions for a character punching a random target, even in the absence of mocap data that specifically captures the transition between punching and locomotion. Also, with a single learned policy, multiple task controllers can be constructed through the TimeChamber framework."
Constant on‑time variable frequency control for critical conduction mode GaN‑based totem‑pole PFC converters,2023,"['Constant on-time', 'Feed-forward', 'Critical conduction mode', 'Voltage-second principle']",,"A constant on-time variable frequency control (COTVFC) with feed-forward for a critical conduction mode (CRM) totempole power factor correction (PFC) converter is proposed in this paper. This control method only requires a single voltage loop, where the output is taken as the on-time of the main switches of the converter. The off-time of the main switches in different switching cycles is calculated by the voltage-second balance principle, which ensures that the converter always operates in the CRM. Feed-forward is introduced to improve the dynamic response of the converter. The control model is established and the transfer function from the on-time to the output is derived. On this basis, the control parameters of the voltage loop are designed. Then a simulation model is built in PSIM for simulation verification. Finally, a two-phase interleaved parallel GaN-based totem-pole PFC converter prototype is made for experimental verification. Simulation and experimental results verify the feasibility and effectiveness of the control method proposed in this paper."
Training and Synthesis Based Vehicle Color  Conversion Technique Using GAN,2023,"['Comprehensive Cars (CompCars)', 'Convolutional Neural Network (CNN)', 'Generative Adversarial Network (GAN)']",,"While recent Convolutional Neural Networks (CNNs) for object detection have been substantially improved, they require a large amount of annotated data to further improve their accuracy to the level of human. Such annotated data is scarce. Manual annotation of object labels is a time consuming and expensive process. Recently, generative models are being employed to automate the manual annotation and produce diverse training data. This leads to an increase in the accuracy of the target model. This paper presents a method to train a Generative Adversarial Network (GAN) network to translate the vehicle colors in the given dataset. It generates augmented image data by translating the selected vehicle objects to 7 color domains with the least compromise in the quality of generated images. We demonstrate the result of training the proposed GAN model and performance of vehicle color translation using Comprehensive Cars (CompCars) dataset."
GAN을 이용한 슬로싱 충격압력 데이터 생성 방법 연구,2023,"['Sloshing', 'Impact Pressure', 'Generative Adversarial Networks']",,"A model test is performed to measure the sloshing impact pressure in the liquid tank. A preprocessing is performed to learn the model test results applied with various environmental conditions. In this study, we propose a method for generating data similar to the total pressure data using Generative Adversarial Networks. In addition, after approximating the generated result to the three parameter Weibull distribution, the difference of the three parameters was compared through the RMSE and SMAPE calculation results. As a result, the distribution of the generated data showed similar results to the total pressure data distribution."
Inpainting GAN-Based Image Blending with Adaptive Binary Line Mask,2023,"['Image Blending', 'Image Inpainting', 'Composite Image', 'Generative Adversarial Network.']",,"Image blending is a scheme for image composition to make the composite image looks as natural and realistic as possible. Image blending should ensure that the edges of the object look seamless and do not distort colors. Recently, numerous studies investigated image blending methods adopting deep learning-based image processing algorithms and contributed to generating natural blended images. Although the previ-ous studies show remarkable performance in many cases, they suffer from quality drop when blending incompletely cropped object. This is because partial loss and unnecessary extra information on the cropped object image interferes with image blending. This paper proposes a new scheme that significantly reduce the unnatural edges and the color distortion. First, to detect and handle the incompletely cropped region, an adaptive binary line mask generation utilizing color difference checking algorithm (CDC) is proposed. The generated mask is exploited to im-prove image blending performance by isolating incompletely cropped image edges from image blending. Second, in order to perform inpaint-ing the missing or masked area of the object image and image blending together, the inpainting generative adversarial model is adopted. Exper-imental results show that the blended images are not only more natural than those of the previous works but the color information is also well preserved."
Enhancing GaN/AlGaN MQW Micro LED Optical and Electrical Performance with a Non-uniform LQB,2023,"['Numerical simulation', 'GaN', 'AlGaN MQW UV Μled', 'Graded Al LQB', 'Optical and electrical characteristics']",,"In this work, physical device modeling of ultraviolet micro light-emitting diodes (UV-μLEDs) based on GaN/AlGaN multiple quantum wells (MQWs) is presented. We numerically investigated the optical and electrical properties of UV-LEDs with a graded last quantum barrier (LQB). The constant content Aluminium (Al) of the LQB is replaced by a graded Al profile to improve the internal quantum efficiency (IQE) in the active MQWs region. The results show that the internal quantum efficiency (IQE) and radiative recombination rate of UV μLEDs with the last linearly increased Al composition LQB are higher than other samples under 90 A/cm 2 current. This composition also contributes to enhanced hole injection efficiency, effective electron confinement, and uniform distribution of carriers in the MQWs caused by the low electrostatic field. As a result, the optical output power is increased 1.94 times, and the spontaneous emission intensity 2.37 times. The simulated results indicate that the LQB AlGaN layer with different compositions of Al modification can mitigate the effect of the effective electron confinement, Auger recombination rate and hole injection, increasing the overlap between electron ditribution profiles."
GaN nanorods gas sensor for highly sensitive n-butanol  detection at room temperature,2023,['GaN nanorods · n-butanol sensor · Low operation temperature'],,"Safe and effi cient detection of hazardous n-butanol gas is very great signifi cance to the health of workers and researchers inchemical environments. In this work, we successfully developed a GaN gas sensor by a simple solvothermal method and alow-temperature nitridation process. Material characterization results show that one-dimensional nanorods structures wereobtained and the products presented a superior growth orientation along with (101) plane. The gas sensing test results showthat the sensor exhibits excellent responsivity, repeatability, and selectivity to n-butanol at room temperature. The responseand recovery time of the sensor to 200 ppm n-butanol gas was 45 s/34 s. Gas adsorption model and electron depletion layertheory were established to understand the n-butanol sensing mechanism. This work provides the possibility for its realapplication in n-butanol detection with safe and effi cient at room temperature."
Feasibility of mixed herbal medicine for improving gastric function in an alcohol-induced gastritis model,2023,"['gastritis', 'alcohol-induced gastritis', 'Curcumae longae Rhizoma', 'Schisandrae chinensis Fructus', 'Artemisiae scopariae herba', 'Gardeniae Fructus']",,"[Purpose] Excessive exercise causes various gastric dysfunction. Gastritis is common among athletes who perform high-intensity training. Gastritis is a digestive disease involving mucosal damage caused by inflammatory reactions and oxidative stress. In this study, the effects of a complex natural extract on gastric mucosal damage and the expression of inflammatory factors were evaluated in an animal model of alcohol-induced gastritis.[Methods] A mixed herbal medicine (Ma-al-gan; MAG) was prepared with four natural products (Curcumae longae Rhizoma, Schisandrae chinensis Fructus, Artemisiae scopariae herba, and Gardeniae Fructus) identified by a systemic analysis using the Traditional Chinese Medicine Systems Pharmacology platform. The effects of MAG on alcohol-induced gastric damage were evaluated.[Results] MAG (10–100 μg/mL) significantly reduced the mRNA and protein levels of inducible nitric oxide synthase and cyclooxygenase-2 in lipopolysaccharide-stimulated RAW264.7 cells. MAG (500 mg/kg/d) effectively prevented alcohol-induced gastric mucosal injury in vivo.[Conclusion] MAG regulates inflammatory signals and oxidative stress and is a potential herbal medicine for gastric disorders."
CT 영상에서 U-Net 기반 변형가능 컨볼루션 GAN을 이용한 잡음제거,2023,"['변형 가능한 컨볼루션', '잡음제거', 'CT영상', 'U-Net 구조', 'CT image', 'deformable convolution', 'denoising', 'GAN', 'U-Net architecture']",,
Color 적응형 Pix2Pix GAN 학습을 위한 데이터 전처리 방안,2023,"['color data preprocessing', 'Pix2Pix', 'color edge', 'GAN', 'neural network']",,
인공지능(AI)을 활용한 건축디자인 정보처리 모델에 관한 연구,2023,"['인공지능', '인지심리학', '정보처리이론', '수렴적사고', '발산적사고', '유추적사고', 'Artificial intelligence', 'Cognitive Psychology', 'Information Processing Theory', 'Convergent thinking', 'Divergent thinking', 'Analogical thinking']","최근 건축계에서는 인공지능 이미지 생성 모델이 건축디자인에 미칠 영향에 대한 논의가 한창이다. 인공지능은 정보처리이론을 사용하여 인간의 인지 능력을 분석하고 모형화 한다. 정보처리이론에 의하면 건축디자인은 공간의 문제를 해결하기 위한 합리적인 개념을 정립하고 그에 부합하는 시각적, 개념적 정보를 처리하는 정보처리 활동이다. 본 연구에서는 Akin(1986)의 정보처리모델인 DIPS(design information processing system)의 다섯 가지 정보처리 과정 ‘정보획득’, ‘정보표현’, ‘정보투영’, ‘정보확인’, ‘정보통제’를 건축디자인 사고유형의 특성인 ‘수렴적 사고’, ‘발산적 사고’, ‘유추적 사고’을 고찰하였다. 이를 통해 대표적인 디자인 관련 인공지능 NLP, GAN, DNN을 특성을 파악하고 인공지능을 활용한 건축디자인 정보처리모델을 제안하였다. 본 논문의 목적은 건축디자인 정보처리모델과 그 과정에서 발생하는 사고방식의 특성을 인공지능과 비교하여 인공지능의 건축디자인 활용 가능성을 분석하고 인공지능을 활용한 건축디자인 정보처리 모델을 제안하는 데 있다.","Recently, there is a lot of discussion in the architectural world about the impact that artificial intelligence image generation models will have on architectural design. Artificial intelligence uses information processing theory to analyze and model human cognitive abilities. According to information processing theory, architectural design is an information processing activity that establishes reasonable concepts to solve spatial problems and processes visual and conceptual information that corresponds to them.In this study, the five information processing processes of Akin's (1986) information processing model, DIPS (design information processing system), 'Information acquisition', 'Information representation', 'Information projection', 'Information confirmation', and 'Regulation of control'. The characteristics of architectural design thinking types, ‘convergent thinking’, ‘divergent thinking’, and ‘analogical thinking’ were examined. Through this, I identified the characteristics of representative design-related artificial intelligence NLP, GAN, and DNN and proposed an architectural design information processing model using artificial intelligence.The purpose of this paper is to examine the architectural design information processing model and compare the characteristics of the thinking style that occurs in the process with the characteristics of the artificial intelligence model to analyze the possibility of using artificial intelligence in architectural design and to provide architectural design information using artificial intelligence. The goal is to propose a processing model."
인버터블 트랜스포머를 이용한 플로우 기반 생성 모델,2023,"['Generative model', 'Transformer', 'Normalizing flow', 'Conditional probability']","플로우 기반 생성모델은 Variational AutoEncoder (VAE), Generative Adversarial Network(GAN)와 달리 잠재 벡터 z의 확률 분포에서 일련의 역변환을 통해 데이터 x의 분포를 명시적으로 학습한다. 이 논문에서는 시계열 데이터를 처리하는 인버터블 트랜스포머를 이용한 플로우 기반 생성모델을 제시한다. 이 모델을 통해 표준 정규 분포로부터 실제 데이터의 복잡한 조건부 확률분포를 추정할 수 있다. 학습된 모델에 조건을 넣어주면 실제 데이터 분포를 따르는 새로운 시계열 데이터를 만들 수 있다.","Unlike Variational AutoEncoder(VAE), Generative Adversarial Network(GAN), a flow-based generative model explicitly learns the distribution of data x by a sequence of invertible transformation. This paper proposes a flow-based generative model using invertible transformer, which processes time-series data. We can estimate the distribution of real data from standard normal distribution using the proposed model. A learned model with condition generates new time-series data which follows the distribution of real data."
Mask R-CNN을 이용한 이미지 합성 기반 데이터증강의 자주포 객체탐지 모델 성능향상 연구,2023,"['Data-Augmentation', 'Object Detection', 'Mask R-CNN', 'Image Synthesis', 'Self-Propelled Artillery']",,"The applications of AI technology have limitations in defense, such as the difficulty in obtaining sufficient high-quality big data and the lack of diversity in the acquired data. This study evaluated image data augmentation methods suitable for military operational environments to overcome these issues.First, the object selected is the ""self-propelled artillery."" By separating the object and synthesizing it into a specific background, an image synthesis-based data augmentation method is proposed to address the lack of data for military operational environments. Self-propelled artillery images identified in winter were used as test data to verify the performance. Three methods are used to augment the data: the baseline data augmentation method using self-propelled artillery training data identified in non-winter environments, data augmentation using Cycle-GAN, one of the image generation techniques, and the proposed image synthesis-based data augmentation method. The object detection performance was compared using the YOLOv5 model.The results show that using the image synthesis-based data augmentation method with the augmented training dataset achieved the highest performance, with an mAP (0.5) of 97%. This study shows that image synthesis-based data augmentation can address the lack of diversity in defense sector data. In addition, it provides a method to improve object detection model performance in weapon system detection."
여성 시니어를 위한 스마트폰 사진 러닝에 관한 연구 -‘스마트폰으로 도전하는 나도 시니어 모델’프로젝트를 중심으로-,2023,"['Women Senior', 'Smartphone Photography', 'Smart Learning', 'Walter Benjamin', 'GAN']",,"Despite an aging society with a growing proportion of elderly individuals, there is a lack of research on the usability of smartphones for different age groups. This study aims to examine the learning effect of using smartphones to form social network (SNS) through self-photographs, with active seniors and ageless women serving as models. In the class, smartphones and apps are utilized to teach the principles of photography and mass communication, increase production efficiency, and explore digital aesthetics through the  perspective of Walter Benjamin's media aesthetics. Therefore, continuous efforts to improve smartphone usability and contents for smart learning are necessary."
인페인팅 모델 기반의 사실적인 얼굴 주름 및 결점 처리 기법,2023,"['facial wrinkles', 'skin imperfections', 'wrinkles and imperfections detection', 'image inpainting', 'generative adversarial network', '얼굴 주름', '피부 결점', '주름 및 결점 검출', '이미지 인페인팅', '생성적 적대 신경망']","최근, 얼굴 피부에 대한 다양한 미용 시술이 보편화되면서, 얼굴에 존재하는 주름이나 결점을 효과적으로 검출하고 그 정도를 평가하는 연구가 활발히 진행되고 있다. 하지만, 시술로 예상되는 결과에 대한 시각적이고 객관적인 자료의 부족으로 인해 많은 소비자들이 시술을 주저하게 되고, 이를 해소하기 위해 병원에서는 많은 시간과 비용을 지불하고 있다. 이에 본 논문에서는 GAN 기반의 인페인팅 모델을 사용하여, 얼굴의 주름이나 결점 영역을 검출하고, 그 영역을 주변 피부와 유사하게 복원하는 사실적 얼굴 주름 및 결점 제거 기법을 제안한다. 주름 및 결점 영역 검출을 위해서는 프랑기 필터(Frangi filter)와 헤시안 필터(Hessian filter)를 함께 활용한 하이브리드 필터를 사용하였으며, 주름/결점 인페인팅을 위해서는 사전 훈련된 인페인팅 네트워크에 피부과에서 수집한 얼굴 데이터로 전이 학습을 수행한 모델을 사용하였다. 특히, 모델의 성능을 보다 객관적으로 평가하기 위해 새로운 평가지표를 제안하였으며, 이를 바탕으로 다양한 비교 실험을 통해 제안하는 기법의 성능이 우수함을 검증하였다.",
DCGAN 학습 모델을 이용한 게임 맵 데이터 자동 생성 프레임워크 설계 및 구현,2023,"['PGAN(Generative Adversarial Networks)', 'DCGAN(Deep Convolutional GAN)', 'MAP', 'FID(Frechet Inception Distance)', 'TSNE(T-distributed Stochastic Neighbor Embedding)']",,"The proportion of casual games and puzzle games among the genres of mobile games that are growing due to the increase in indoor activities and the increase in female gamers under the influence of COVID-19 is increasing. Accordingly, the development demand for the genre is increasing, but it takes a lot of time to generate various game map data essential in the development process. In this paper, a framework for automatically generating game map data using DCGAN model was designed and implemented. Due to the technology applied to the proposed framework implementation, a satisfactory result was obtained that the entire development period could be reduced by a third. In addition, it was possible to verify the authenticity of the map data generated based on the original data by applying the map class classification accuracy verification function of the automatically generated map data. If the technology for the developed framework is advanced, it is expected that it can be applied to the development of other genres of mobile games."
