title,date,keywords,abstract,multilingual_abstract
잔차연결 기반의 AWGN 제거를 위한 CNN 학습 알고리즘,2023,"['Image signal processing', 'AWGN', 'Convolutional neural network', 'Residual connection', '영상신호처리', 'AWGN', '합성곱 신경망', '잔차연결']","현대사회는 IoT 기술 및 인공지능 기술의 발전에 따라 다양한 분야에서 자동화가 이루어지고 있다. 영상을 사용하는 자동화 시스템은 카메라 또는 센서로 획득한 영상에서 특징을 검출하거나 객체를 분류한다. 하지만 영상을 획득하는 과정에서 다양한 원인으로 영상에 잡음이 발생하여 잡음에 훼손된 영역을 객체로 오검출하거나 검출률 저하를 야기할 수 있다. 본 논문에서는 잔차연결에 기반한 AWGN에 의해 훼손된 영상을 복원하는 학습 알고리즘을 제안한다. 제안한 알고리즘은 합성곱 신경망의 은닉층을 네트워크 깊이에 따라 세 개의 블록으로 구분하였으며, 각각의 블록의 학습 데이터를 잔차연결을 사용하여 연결 계층에 전달한다. 최종 결과는 연결 계층의 출력을 사용하여 구하며, 학습된 신경망으로 잡음 추정 값을 구하여 영상의 잡음을 제거한다.","With the development of IoT and AI technology in modern society, diverse fields are being automatized. The automation system using images detects characteristics of the ones gained with a camera or sensors or categorizes objects. Yet, noise can be made for different reasons in the process of getting images, and the part damaged by noise can be detected in error or cause the detection rate to become reduced. In this paper, the learning algorithm to restore images damaged by AWGN based on the residual connection was suggested. Regarding the proposed algorithm, the hidden layer of the convolution neural network was divided into three blocks depending on the depth of the network, and the learning data of each blcok was delivered to the link layer using the residual link. The final result was obtained using the output of the link layer, and the noise of images was removed by obtaining the estimated noise with the studied neural network."
그래프 트랜스포머 기반 농가 사과 품질 이미지의 그래프 표현 학습 연구,2023,"['딥 러닝', '그래프 표현 학습', '사과 품질 분류', '랜덤워크 위치 인코딩', 'Deep learning', 'Graph representation learning', 'Apple Quality Classification', 'Randomwalk positional encoding']","최근 농가의 사과 품질 선별 작업에서 인적자원의 한계를 극복하기 위해 합성곱 신경망(CNN) 기반 시스템이 개발되고 있다. 그러나 합성곱 신경망은 동일한 크기의 이미지만을 입력받기 때문에 샘플링 등의 전처리 과정이 요구될 수 있으며, 과도 샘플링의 경우 화질 저하, 블러링 등 원본 이미지의 정보손실 문제가 발생한다. 본 논문에서는 위 문제를 최소화하기 위하여, 원본 이미지의 패치 기반 그래프를 생성하고 그래프 트랜스포머 모델의 랜덤워크 기반 위치 인코딩 방법을 제안한다. 위 방법은 랜덤워크 알고리즘 기반 위치정보가 없는 패치들의 위치 임베딩 정보를 지속적으로 학습하고, 기존 그래프 트랜스포머의 자가 주의집중 기법을 통해 유익한 노드정보들을 집계함으로써 최적의 그래프 구조를 찾는다. 따라서 무작위 노드 순서의 새로운 그래프 구조와 이미지의 객체 위치에 따른 임의의 그래프 구조에서도 강건한 성질을 가지며, 좋은 성능을 보여준다. 5가지 사과 품질 데이터셋으로 실험하였을 때, 다른 GNN 모델보다 최소 1.3%에서 최대 4.7%의 학습 정확도가 높았으며, ResNet18 모델의 23.52M보다 약 15% 적은 3.59M의 파라미터 수를 보유하여 연산량 절감에 따른 빠른 추론 속도를 보이며 그 효과를 증명한다.","Recently, a convolutional neural network (CNN) based system is being developed to overcome the limitations of human resources in the apple quality classification of farmhouse. However, since convolutional neural networks receive only images of the same size, preprocessing such as sampling may be required, and in the case of oversampling, information loss of the original image such as image quality degradation and blurring occurs. In this paper, in order to minimize the above problem, to generate a image patch based graph of an original image and propose a random walk-based positional encoding method to apply the graph transformer model. The above method continuously learns the position embedding information of patches which don`t have a positional information based on the random walk algorithm, and finds the optimal graph structure by aggregating useful node information through the self-attention technique of graph transformer model. Therefore, it is robust and shows good performance even in a new graph structure of random node order and an arbitrary graph structure according to the location of an object in an image. As a result, when experimented with 5 apple quality datasets, the learning accuracy was higher than other GNN models by a minimum of 1.3% to a maximum of 4.7%, and the number of parameters was 3.59M, which was about 15% less than the 23.52M of the ResNet18 model. Therefore, it shows fast reasoning speed according to the reduction of the amount of computation and proves the effect."
콘크리트 균열 이미지의 데이터셋을 효율적으로 수집하기 위한 벡터기반의 학습 증강 기법,2023,"['Concrete crack', 'Data augmentation', 'Convolutional Neural Networks', 'Elastic distortion', 'Crack detection', '콘크리트 균열', '데이터 증강', '학습 증강', '합성곱 신경망', '탄성왜곡', '균열 검출']","본 논문에서는 콘크리트 균열 이미지 데이터셋을 효율적으로 얻기 위한 합성곱 신경망 네트워크 학습 기반의 데이터 증강기법을 제안한다. 실제 콘크리트 균열 이미지는 정형화된 형태가 없고 복잡한 패턴을 지니고 있어 얻기 어려울 뿐만 아니라, 데이터를 확보할 때 위험한 상황에 노출될 우려가 있다. 이러한 상황에 노출된 데이터셋 수집 문제를 본 논문에서는 벡터와 두께 기반의 데이터 증강 기법을 통해 비용과 시간적 측면에서 효율적으로 해결한다. 또한 제안한 방법을 효율성을 입증하고자 U-Net기반의 균열 검출을 통해 다양한 장면에서 실험을 진행했고, IoU 정확도로 측정했을 때 모든 장면에서 성능이 향상되었다. 콘크리트 균열 데이터를 증강하지 않았을 경우 잘못 예측된 경우의 비율이 약 25%였으나, 우리의 방법을 통해 데이터 증강을 했을 경우 잘못 예측된 비율이 3%까지 감소하였다.","In this paper, we propose a data augmentation method based on CNN(Convolutional Neural Network) learning for efficiently obtaining concrete crack image datasets. Real concrete crack images are not only difficult to obtain due to their unstructured shape and complex patterns, but also may be exposed to dangerous situations when acquiring data. In this paper, we solve the problem of collecting datasets exposed to such situations efficiently in terms of cost and time by using vector and thickness-based data augmentation techniques. To demonstrate the effectiveness of the proposed method, experiments were conducted in various scenes using U-Net-based crack detection, and the performance was improved in all scenes when measured by IoU accuracy. When the concrete crack data was not augmented, the percentage of incorrect predictions was about 25%, but when the data was augmented by our method, the percentage of incorrect predictions was reduced to 3%."
레스토랑 카테고리와 온라인 소비자 리뷰를 이용한 딥러닝 기반 레스토랑 추천 시스템 개발,2023,"['Restaurant Recommender System', 'Convolutional Neural Network', 'Online Reviews', 'Restaurant Attribute', '레스토랑 추천 시스템', '합성곱 신경망', '온라인 리뷰', '레스토랑 속성']","최근에는 외식 산업의 발달과 레스토랑 수요의 증가로 인해 레스토랑 추천 시스템 연구가 활발하게제안되고 있다. 기존 레스토랑 추천 시스템 연구는 정량적인 평점 정보 또는 온라인 리뷰의 감성분석을통해 소비자의 선호도 정보를 추출하였는데 이는 소비자의 의미론적 선호도 정보는 반영하지 못한다는한계가 존재한다. 또한, 레스토랑이 포함하는 세부적인 속성을 반영한 추천 시스템 연구는 부족한실정이다. 이를 해결하기 위해 본 연구에서는 소비자의 선호도와 레스토랑 속성 간의 상호작용을효과적으로 학습할 수 있는 딥러닝 기반 모델을 제안하였다. 먼저, 합성곱 신경망을 온라인 리뷰에적용하여 소비자의 의미론적 선호도 정보를 추출했고, 레스토랑 정보에 임베딩 기법을 적용하여레스토랑의 세부적인 속성을 추출했다. 최종적으로 요소별 연산을 통해 소비자 선호도와 레스토랑속성 간의 상호작용을 학습하여 소비자의 선호도 평점을 예측했다. 본 연구에서 제안한 모델의 추천성능을 평가하기 위해 Yelp.com의 온라인 리뷰를 사용한 실험 결과, 기존 연구의 다양한 모델과 비교했을때 본 연구의 제안 모델이 우수한 추천 성능을 보이는 것을 확인하였다. 본 연구는 레스토랑 산업의빅데이터를 활용한 맞춤형 레스토랑 추천 시스템을 제안함으로써 레스토랑 연구 분야와 온라인 서비스제공자에게 학술적 및 실무적 측면에서 다양한 시사점을 제공할 수 있을 것으로 기대한다.","Research on restaurant recommender systems has been proposed due to the development of the food service industry and the increasing demand for restaurants. Existing restaurant recommendation studies extracted consumer preference information through quantitative information or online review sensitivity analysis, but there is a limitation that it cannot reflect consumer semantic preference information. In addition, there is a lack of recommendation research that reflects the detailed attributes of restaurants.To solve this problem, this study proposed a model that can learn the interaction between consumer preferences and restaurant attributes by applying deep learning techniques. First, the convolutional neural network was applied to online reviews to extract semantic preference information from consumers, and embedded techniques were applied to restaurant information to extract detailed attributes of restaurants.Finally, the interaction between consumer preference and restaurant attributes was learned through the element-wise products to predict the consumer preference rating. Experiments using an online review of Yelp.com to evaluate the performance of the proposed model in this study confirmed that the proposed model in this study showed excellent recommendation performance. By proposing a customized restaurant recommendation system using big data from the restaurant industry, this study expects to provide various academic and practical implications."
인공지능 학습용 차량번호 생성 프로그램 개발,2023,"['Artificial Intelligence', 'Learning Data', 'Convolution Neural Network', 'Vehicle Number Recognition', '인공지능', '학습 데이터', '합성곱 신경망', '차량번호 인식']","인공지능 기반의 차량번호 인식을 위해서는 필수적으로 학습용 데이터가 필요하다. 그러나 국내에서는 ‘개인정보보호법’으로 인해 학습용 차량 번호판 데이터 확보가 어려운 실정이다. 본 연구에서는 이러한 문제를 해결하기 위해 인공지능 학습용 차량번호판 생성 프로그램을 개발하였다. 개발된 프로그램은 객체 생성부, 가상번호판 생성부, 학습용 번호판 생성부로 포함하고 있으며, 이를 통해 실제 현장에서 취득된 번호판과 매우 유사한 형태의 학습용 번호판을 대량으로 생성할 수 있었다. 또한 합성곱 신경망 알고리즘 기반의 차량번호 인식 시스템을 개발하였으며, 학습용 차량번호판 생성 프로그램을 통해 생성한 학습 데이터를 기반으로 실제 현장에서 수집한 차량 번호판에 대한 정확도를 검증하였다. 평가 결과, 총 500대 차량 중 약 99.2%에 해당되는 496대 차량의 번호가 일치함을 확인할 수 있었다. 따라서 본 연구에서 개발한 번호판 생성 프로그램은 인공지능 기반의 차량번호 인식에 필요한 학습용 데이터를 매우 효과적으로 생성해 줄 수 있음을 알 수 있었다.","UFor artificial intelligence-based license plate recognition, learning data is essential. However, in Korea, it is difficult to collect license plate data for learning due to the ‘Personal Information Protection Act’. In this study, a license plate generation program for AI learning was developed to solve this problem. The developed program includes an object generation unit, a virtual license plate generation unit, and a license plate generation unit for learning. And through this, it was possible to generate a large number of license plates for learning in a form very similar to license plates acquired in the actual field. In addition, a CNN algorithm-based license plate recognition system was developed, and the accuracy of vehicle license plates collected in the field was verified based on the learning data generated through the license plate generation program for learning. As a result of the accuracy evaluation, it was confirmed that the numbers of 496 vehicles, which correspond to about 99.2% of a total of 500 vehicles, matched. Therefore, it was found that the license plate generation program developed in this study can generate the learning data necessary for AI-based license plate recognition very effectively."
A Taekwondo Poomsae Movement Classification Model Learned Under Various Conditions,2023,"['Pose Estimation', 'Machine Learning', 'Deep Learning', 'Convolutional Neural Network', 'Deep Convolutional Neural Network', '자세 분류', '머신러닝', '딥러닝', '합성곱 신경망', '심층 합성곱 신경망']","태권도 겨루기의 전자호구, 축구의 VAR 등 스포츠에서 기술 발전이 고도화되고 있다. 하지만태권도 품새는 사람이 직접 자세를 눈으로 보고 판단하며 지도하기 때문에 때로는 대회의 현장에서 판정시비가 일어난다. 본 연구는 인공지능을 이용하여 태권도 동작을 더 정확하게 판단하고평가할 수 있는 인공지능 모델을 제안한다. 본 연구에서는 촬영 및 수집한 데이터를 전처리한 후학습, 테스트, 검증 세트로 분리한다. 분리한 데이터를 각 모델과 조건을 적용하여 학습한 후 비교하여 가장 좋은 성능의 모델을 제시한다. 각 조건의 모델은 정확도, Precision, Recall, F1-Score, 학습 소요 시간, Top-n error의 값을 비교하였고 그 결과 ResNet50과 Adam을 사용한 조건에서 학습한 모델의 성능이 가장 우수한 것으로 나타났다. 본 연구에서 제시한 모델을 활용하여 교육 현장이나 대회 등 다양한 방면에서 활용할 수 있을 것으로 기대한다.",
원심펌프 다중고장유형 분류 및 해석을 위한 딥러닝 모델링,2023,"['Prognostics and Health Management', 'Centrifugal Pump', 'Continuous Wavelet Transform', 'Convolutional Neural Network', 'Explainable AI', '건전성 예측 및 관리', '원심펌프', '연속 웨이블릿 변환', '합성곱 신경망', '설명가능한 인공지능']","산업인공지능의 발달로 기계장치의 결함 진단을 위해 센서 데이터 기반 기계학습 및 심층학습 기법을 활용하여 결함 유형을 분류하는 연구가 활발하게 진행되고 있다. 하지만, 심층학습을 비롯한 대부분의 기계학습 기법들은 블랙박스 구조로 결과 해석이 불가능하기 때문에 산업적으로 진단 모델에 대한 사용성 및 신뢰도 확보를 위해 모델의 의사결정에 대한 해석이 가능한 설명가능한 인공지능 기법이 제안되고 있다. 본 연구에서는 원심펌프의 결함 분류 및 해석을 위한 특징 추출을 위해 높은 분류 정확도를 보이며 설명력 있는 심층학습 모델을 제안한다. 시간-주파수 분석 기법인 연속 웨이블릿 변환을 통해 진동 신호를 이미지로 변환하였으며, 합성곱 신경망 학습 이후 테스트 결과에 gradient weighted class activation map을 적용하여 결함 유형 해석을 위한 주파수 대역을 추출 및 검증하였다.","With the development of industrial artificial intelligence, research to classify defect types using sensor data-based machine learning and deep learning techniques is being actively conducted. However, since most machine learning, including deep learning, cannot interpret the results due to the black box structure, an explainable artificial intelligence that can interpret the model’s decision-making is proposed to secure diagnostic model’s usability and reliability. In this study, we propose a deep learning model for fault classification and interpretation of centrifugal pumps. The vibration signal was converted into an image through continuous wavelet transformation, a time-frequency analysis technique, and after learning with a convolution neural network, gradient weighted class activation map was applied to the test results to extract and verify the characteristic frequency band."
CNN 기반 HTTPS 트래픽의 서비스 및 응용 단위 다중 레이블 분류,2023,"['Traffic Classification', 'HTTPS Traffic Classification', 'Application', 'Traffic Classification', 'Convolutional Neural Network', 'Multi-label Classification', '트래픽 분류', 'HTTPS 트래픽 분류', '응용 트래픽 분류', '합성 곱 신경망', '다중 레이블 분류']","웹 응용 프로그램은 HTTP 프로토콜의 보안 문제로 HTTPS 프로토콜을 사용한다. HTTPS 응용 트래픽 분류를위해 다양한 연구가 진행되고 있으나, 암호화로 인해 분류하기 어렵다. 이를 해결하기 위한 방법들은 multi-class 분류이며 서비스 단위로 응용 트래픽을 분류한다. 웹 서비스는 여러 응용 프로그램의 조합으로 구성되며, 트래픽또한 여러 응용 프로그램의 조합으로 하나의 서비스를 이룬다. 기존 연구와 같이 서비스 단위로만 분류할 경우, 서비스 내 여러 응용 프로그램의 트래픽이 섞여 미탐 혹은 오탐할 수 있다. 따라서 우리는 multi-label 분류를 사용하여 플로우 별로 서비스 단위인 주라벨과 응용 프로그램 단위인 부라벨을 정의하고, 합성 곱 신경망을 설계하여 6개의 서비스와 서비스 내 14개의 응용 프로그램을 분류한다. 6개의 서비스 분류 정확도는 100%, 14개의 응용 프로그램 분류 정확도는 85% 성능으로 서비스 단위와 응용 프로그램 단위로 트래픽을 분류하였다.",
딥러닝 기반의 알려진 평문 공격을 통한 S-PRESENT 분석,2023,"['Cryptanalysis', 'Know-plaintext Attack', 'S-PRESENT', 'Deep Learning', 'Convolutional Neural Network']","암호 분석은 알려진 평문 공격, 차분 분석, 부채널 분석 등과 같이 다양한 기법으로 수행될 수 있다. 최근에는 딥러닝을 암호 분석에 적용하는 연구들이 제안되고 있다. 알려진 평문 공격(Known-plaintext Attack)은 알려진 평문과 암호문 쌍을 사용하여 키를 알아내는 암호 분석 기법이다. 본 논문에서는 딥러닝 기술을 사용하여 경량 블록암호 PRESENT의 축소 버전인 S-PRESENT에 대해 알려진 평문 공격을 수행한다. 축소된 경량 블록 암호에 대해 수행된 최초의 딥러닝 기반의 알려진 평문 공격이라는 점에서 본 논문은 의의가 있다. 성능 향상 및 학습속도 개선을 위해 Skip connection, 1x1 Convolution과 같은 딥러닝 기법을 적용하였다. 암호 분석에는 MLP(Multi-Layer Perceptron)와 1D, 2D 합성곱 신경망 모델을 사용하여 최적화하였으며, 세 모델의 성능을 비교한다. 2D 합성곱 신경망에서 가장 높은 성능을 보였지만 일부 키공간까지만 공격이 가능했다. 이를 통해 MLP모델과 합성곱 신경망을 통한 알려진 평문 공격은 공격 가능한 키 비트에 제한이 있음을 알 수 있다.","Cryptanalysis can be performed by various techniques such as known plaintext attack, differential attack, side-channel analysis, and the like. Recently, many studies have been conducted on cryptanalysis using deep learning. A known-plaintext attack is a technique that uses a known plaintext and ciphertext pair to find a key. In this paper, we use deep learning technology to perform a known-plaintext attack against S-PRESENT, a reduced version of the lightweight block cipher PRESENT. This paper is significant in that it is the first known-plaintext attack based on deep learning performed on a reduced lightweight block cipher. For cryptanalysis, MLP (Multi-Layer Perceptron) and 1D and 2D CNN(Convolutional Neural Network) models are used and optimized, and the performance of the three models is compared. It showed the highest performance in 2D convolutional neural networks, but it was possible to attack only up to some key spaces. From this, it can be seen that the known-plaintext attack through the MLP model and the convolutional neural network is limited in attackable key bits."
C-LSTM 모델을 이용한 단기 전력 예측,2023,"['Deep Learning', 'C-LSTM', 'Electricity Forecasting', '딥러닝', 'C-LSTM', '전력 예측']","효율적인 발전 설비 운용과 에너지 공급을 위해서는 정확한 전력 예측이 필수적이다. 전력 예측은 수일 내의 전력 사용량의 변화를 예측하는 단기 예측과 수개월 간의 전력 사용량의 흐름을 예측을 하는 장기 예측으로 나누어진다. 본 논문은 신경망을 활용한 단기 전력 예측에 대해 분석하고 성능을 개선하는 방안을 제안한다. 시계열 데이터를 효과적으로 처리하기 위해 합성곱 신경망(CNN: Convolutional Neural Network)과 순환 신경망(RNN: Recurrent Neural Network)의 일종인 LSTM(Long short-Term Memory)을 결합한 C-LSTM 딥러닝 모델을 제안한다. 본 연구에서는 신경망을 활용하여 전력량 같은 값의 변화 범위가 넓고 예측이 어려운 시계열 데이터 예측에 있어 정확도에 미치는 요인을 분석하였다. 그 결과 1) 신경망 입력의 범위를 결정하는 데이터의 정규화, 2) 신경망 출력에 영향을 주는 활성화 함수가 정확도에 영향을 미치는 것을 확인하였다. UK-DALE 데이터를 사용한 단기 전력 예측 실험에서 기존의 정규화 방법 중에서 MinMax 정규화 방법과 신경망의 활성화 함수 Leaky-ReLU를 결합하였을 때 MAE 기준 98%의 가장 높은 정확도를 보이는 것을 확인하였다. 또한, 전력량의 정확도를 높이기 위해 외부 요인으로 날씨와 날짜를 추가적인 입력으로 사용한 실험을 수행하였으나 정확도 향상에는 크게 영향이 없었다. 이는 전력량 단기 예측에는 외부 요인의 영향력이 적으며, 계절의 변화에 따른 장기 예측 결과에 좀 더 영향이 큰 것으로 예측된다.","Electricity forecasting is essential for efficient operation of power generation facilities and energy supply. Electricity forecasts are divided into short-term forecasts that predict changes in electricity usage within days and long-term forecasts that predict the flow of electricity usage over several months. This paper proposes a short-term electricity forecasting method using neural networks. To handle time series data effectively, we propose a C-LSTM deep learning model that combines convolutional neural networks (CNN) and long short-term memory (LSTM), a type of recurrent neural network (RNN). In this study, a neural network was used to analyze the factors affecting accuracy in predicting time series data with no fixed range of values such as electricity. As a result, we verified 1) normalization of data that determines the range of neural network input, and 2) activation functions that affect neural network output affect prediction accuracy. Short-term electricity forecasting experiments using UK-DALE data showed the highest accuracy of 98% based on MAE when combining the MinMax normalization method with the neural network activation function Leaky-ReLU. In addition, an experiment using weather and date as additional inputs was conducted to increase the accuracy of electricity, but there was no significant effect on the prediction accuracy improvement. We assumed that the weather and date information does not affect short-term electricity prediction, but is a useful factor for long-term forecasting that reflects the season."
