title,date,keywords,abstract,multilingual_abstract
단시간 수중음향 신호를 활용한 합성곱 신경망 기반의 선박 소음 탐지,2023,"['Underwater acoustics', 'Shipping noise', 'Deep learning', 'Convolutional neural network (CNN)']","해양에서 인간에 의해 발생하는 대부분의 소음은 어업 및 상업 운송과 관련된 선박 방사소음이 주요한 원인이다. 최근 선박소음을 자동으로 탐지하기 위한 방법으로 딥러닝 기술이 활용되고 있다. 본 연구에서는 1분 단위로 분할한 선박소음 신호 기반의 스펙트로그램 이미지를 합성곱 신경망 기반 학습을 수행하여 근거리 선박소음 및 배경소음을 자동으로 탐지하는 연구를 수행하였다. 현재까지 많이 사용되고 있는 합성곱 신경망 모델인 Inception-V3, ResNet-50, VGG-16와 본 연구에서 제안한 모델을 이용하여 1분 단위의 선박소음을 학습 및 평가를 수행하였다. 분석 결과 F1 점수는 모델별로 각각 Inception-V3 97.42%, ResNet-50 98.42%, VGG-16 98.16%, 제안된 모델은 97.88%로 나타나 선박소음을 탐지함에 있어 준수한 성능이 나타났다. 이 때, 제안된 모델은 F1 점수가 가장 높게 나타난 ResNet-50 모델에 비해 약 1/8의 적은 파라미터로 동등한 탐지 성능을 보이는 것을 확인할 수 있었다. 추후에는 다양한 선박소음 및 선박자동식별장치(AIS, Automatic Identification System) 자료를 동시에 활용하여 원거리 선박소음 또한 자동으로 탐지가 가능할 것으로 판단된다.","Most of the noise generated by humans in the ocean is ship radiated noise caused to fishing and commercial shipping. Recently, deep learning technology has been used to detect shipping noise. In this study, the convolutional neural network is trained by a shipping noise spectrogram divided into 1-minute units to detect a near distance ship. Inception-V3, ResNet-50, VGG-16 and the proposed model were used to learn and evaluate 1-minute shipping noise. As a result, the F1 scores were 97.42%, 98.42%, 98.16% and 97.88% for Inception-V3, ResNet-50, VGG-16 and the proposed model, respectively. These models showed satisfactory performance in detecting shipping noise. It was confirmed that the proposed model showed equivalent detection performance with about 1/8 parameters compared to ResNet-50. For future works, it is expected that it will be possible to detect long-distance shipping noise by using additional noise data and AIS(Automatic Identification System)."
초음파 영상에서의 초고분해능 합성곱 신경망 알고리즘의 시뮬레이션 및 실험 연구,2023,"['Ultrasound imaging', 'Super resolution convolutional neural network', 'FieldⅡ simulation program', 'Quantitative evaluation of image quality', '초음파 영상', '초고분해능 합성곱 신경망 알고리즘', 'FieldⅡ 시뮬레이션 프로그램', '영상 화질의 정량적 평가']",,"Ultrasound is widely used in the medical field for non-destructive and non-invasive disease diagnosis. In order to improve the disease diagnosis accuracy of diagnostic medical images, improving spatial resolution is a very important factor. In this study, we aim to model the super resolution convolutional neural network (SRCNN) algorithm in ultrasound images and analyze its applicability in the medical diagnostic field. The study was conducted as an experimental study using FieldⅡsimulation and open source clinical liver hemangioma ultrasound imaging. The proposed SRCNN algorithm was modeled so that end-to-end learning can be applied from low resolution (LR) to high resolution. As a result of the simulation, we confirmed that the full width at half maximum in the phantom image using a FieldⅡ program was improved by 41.01% compared to LR when SRCNN was used. In addition, the peak to signal to noise ratio (PSNR) and structural similarity index (SSIM) evaluation results showed that SRCNN had the excellent value in both simulated and real liver hemangioma ultrasound images. In conclusion, the applicability of SRCNN to ultrasound images has been proven, and we expected that proposed algorithm can be used in various diagnostic medical fields."
인코더와 디코더에 기반한 합성곱 신경망과 순환 신경망의 새로운 하이브리드 접근법,2023,"['Deep Learning', 'CNN', 'RNN', 'LSTM', 'BiLSTM', 'CRNN', '딥러닝', 'RNN', 'LSTM', 'BiLSTM', 'CRNN']","빅데이터 시대를 맞이하여 인공지능 분야는 괄목할만한 성장을 보이고 있으며 특히 딥러닝에 의한이미지 분류 학습방법이 중요한 영역으로 자리하고 있다. 이미지 분류에서 많이 사용되어 온 CNN의성능을 더욱 개선하기 위해 다양한 연구가 활발하게 진행되었는데, 이 중에서 대표적인 방법이CRNN(Convolutional Recurrent Neural Network) 알고리즘이다. CRNN 알고리즘은 이미지 분류를 위한CNN과 시계열적 요소를 인식하기 위한 RNN의 조합으로 구성되는데, CRNN의 RNN영역에서 사용하는입력값은 학습 대상의 이미지를 합성곱과 풀링 기법을 적용하여 추출된 결과물을 flatten한 값이고, 이 입력값들은 이미지 내 동일 위상에 있는 픽셀값들이 서로 다른 순서로 나타나기 때문에, RNN에서의도한 이미지 내 배열 순서를 제대로 학습하기 어렵다는 한계점을 지닌다. 따라서 본 연구는 인코더와디코더의 개념을 응용한 CNN과 RNN의 새로운 하이브리드 방법을 제안하여, 이미지 분류 성능을향상시키는 것을 목적으로 하였다. 본 연구에서는 다양한 알고리즘 비교 실험을 통해, 새로운 하이브리드방법의 효과성을 검증하였다. 본 연구는 인코더와 디코더 개념의 적용 가능성을 넓히고, 제안한 방법이기존 하이브리드 방법에 비해, 복잡도가 크게 증가하지 않아 모델 학습 시간과 인프라 구축 비용측면에서 이점을 있다는 점에서 학문적 시사점을 가진다. 또한, 정확한 이미지 분류가 필요한 다양한분야에서 제공되는 서비스의 품질을 높일 수 있는 가능성을 제시하였다는 점에서 실무적 시사점을가진다.","In the era of big data, the field of artificial intelligence is showing remarkable growth, and in particular, the image classification learning methods by deep learning are becoming an important area. Various studies have been actively conducted to further improve the performance of CNNs, which have been widely used in image classification, among which a representative method is the Convolutional Recurrent Neural Network (CRNN) algorithm. The CRNN algorithm consists of a combination of CNN for image classification and RNNs for recognizing time series elements. However, since the inputs used in the RNN area of CRNN are the flatten values extracted by applying the convolution and pooling technique to the image, pixel values in the same phase in the image appear in different order. And this makes it difficult to properly learn the sequence of arrangements in the image intended by the RNN. Therefore, this study aims to improve image classification performance by proposing a novel hybrid method of CNN and RNN applying the concepts of encoder and decoder. In this study, the effectiveness of the new hybrid method was verified through various experiments. This study has academic implications in that it broadens the applicability of encoder and decoder concepts, and the proposed method has advantages in terms of model learning time and infrastructure construction costs as it does not significantly increase complexity compared to conventional hybrid methods. In addition, this study has practical implications in that it presents the possibility of improving the quality of services provided in various fields that require accurate image classification."
Canny Edge검출 기법과 합성곱 신경망을 이용한 심층학습 기반 터보차저 진동 분석,2023,"['터보차저', '진동', '고속 푸리에 변환', '합성곱 신경망', 'Canny 엣지 검출', '데이터 증강', 'Turbo Charger', 'Vibration', 'Fast Fourier Transformation(FFT)', 'Convolutional Neural Network', 'Canny Edge Detection', 'Data Augmentation']",,"This study proposes a novel method for analyzing turbocharger vibration utilizing a combination of the convolutional neural networks (CNN) technique and the Canny edge detection technique. The conventional 1D machine-learning techniques exhibit poor accuracies due to the irregularly changing rotating speeds of the turbine and compressor, which are inherent to turbochargers. To address the issue, the adoption of a 2D CNN accompanied by the Canny edge detection technique has been proposed here. First, the experimental vibration data of the turbocharger have been created and labeled. To augment the limited number of experimental data, the data augmentation technique is applied, resulting in a sufficient amount of data. Subsequently, various preprocessing and machine- learning techniques have been applied for the analysis. By comparing the accuracy and loss data of these analyses, the 2D CNN accompanied by the Canny edge detection technique has been confirmed as the most effective approach for analyzing turbocharger vibration."
풀링이 없는 분기 합성곱 신경망을 사용한 딸기 과육 분할,2023,"['풀링이 없는', '분기 합성곱 신경망', '딸기', '과육', '분할', 'Without Pooling', 'Branch Convolutional Neural Network', 'Strawberry', 'Flesh', 'Segmentation']","딸기는 연약하기에 수확과 수확 후 처리 과정에서 다양한 손상이 발생하고 부패하기 쉽다. 품질 유지를 위해 과하게 숙성되었거나 손상된 딸기를 분류해야 하지만 사람에 의해 수동으로 이루어지고 있기에 주관적이며 일관성이 떨어진다. 숙성도를 판단하기 위해 딸기 과육 부분을 분할한 후 색상정보를 활용한다면 객관적인 측정 기준으로 사용할 수 있으므로 일관성 있는 선별에 도움을 줄 수 있다. 하지만 단순히 임계치 기반의 방법으로는 분할하는 것을 자동화하기에 한계가 있다. 따라서 본 논문에서는 이러한 선별 과정의 객관성과 자동화를 위해 합성곱 신경망을 사용해 딸기 과육 분할 학습을 진행하였다. 정보 손실을 줄이기 위해 풀링을 사용하지 않았고, 다양한 크기의 필터를 가진 합성곱 층을 연결한 분기 구조를 사용하였다. 이를 통해 다양한 상태의 딸기를 더욱 정교하게 분할할 수 있었으며 정보 손실을 줄일 수 있음을 확인하였다.","Strawberries are fragile, making them prone to various damages during the harvest and post-harvest process, leading to easy spoilage. To maintain quality, overripe or damaged strawberries must be sorted, but this is done manually by humans, making it subjective and inconsistent. By analyzing the color information from segmented strawberry flesh to determine its ripeness, it can be used as an objective measurement standard and can help with consistent selection. However, there are limitations in automating segmentation using a simple threshold-based method. Therefore, in this paper, strawberry flesh segmentation learning was conducted using a convolutional neural network to improve objectivity and automation of the selection process. To reduce information loss, pooling was not used, and instead employed a branch structure with convolutional layers of various filter sizes. Through this, it was confirmed that strawberries in various ripening states could be segmented more precisely and information loss could be reduced."
서울시 대기 중 미세먼지 농도 예측을 위한 3D 심층 합성곱 신경망 앙상블 예측,2023,"['PM2.5', 'Air quality', '3D Convolutional Neural Network(3D-CNN)', 'Ensemble model', 'Artificial intelligence (AI)', 'Deep Learning', 'Prediction', 'PM2.5', '대기질', '3D 합성곱 신경망(3D-CNN)', '앙상블 모델', '인공지능', '딥러닝', '예측']","대기 중 미세먼지 (Particular Matter)의 높은 농도에 노출되는 것은 인간 건강에 심각한 영향을 미친다.많은 연구가 미세먼지가 특히 높은 농도에서 인간에게 매우 유독하다는 것을 보여주었다. 이러한 이유로 여러 국가가 미세먼지 농도를 규제하기 위해 상당한 노력을 기울이고 있다. 미세먼지 피해를 줄이기 위해 PM 농도 기반의 조기 경보 시스템이 필요다. 본 논문에서 대한민국 서울의 PM2.5 농도를 예측하기 위해 3D CNN을 활용한새로운 앙상블 예측 접근법을 제안한다. 이 방법은 매 6시간 최대 2일 동안 관측된 데이터에 대한 시공간 데이터의 특징을 추출하고 결합하기 위해 공간 정보뿐만 아니라 시간 정보도 활용할 수 있는 3D CNN의 앙상블 예측을사용한다. 결합한 특징은 공유 계층을 통해 의미 있는 특징 정보를 추출하고 개별 계층을 통해 시간별로 예측된 농도를 반환한다. 제안된 방법은 서울 메트로폴리탄 지역의 PM2.5 및 기상 데이터를 사용하여 2015년 1월 1일부터2021년 2월 28일까지 예측을 수행하였다. 제안된 방법은 PM 2.5 관측 (실제 값), CMAQ 예측 및 ConvLSTM에대해 종합적으로 모델을 평가하였다. 예측 성능 측면에서, 제안된 방법은 널리 사용되는 예측 모델과 비교하여7.06%의 향상된 예측 정확도, 4.28%의 향상된 고농도 탐지율, 오경보율을 11.77%만큼 개선하였다.","Exposure to high concentrations of airborne particulate matter (Particular Matter) has serious effects on human health. Much research work showed that particulate matter is very toxic to humans, especially in high concentrations. For this reason, many countries make considerable efforts to regulate PM concentrations. In order to implement PM measures to reduce damage, an early warning system based on PM concentration level is essentially required. In this paper, we propose a novel 3D CNN ensemble prediction approach for forecasting PM2.5 concentrations in Seoul, Republic of Korea, which is observed every 6 hours for up to two days. The proposed method uses an ensemble of 3D deep CNNs that can utilize not only spatial information but also temporal information to extract and combine features for spatiotemporal data corresponding to each input. The combined features aim at extracting meaningful feature information through the shared layer and return the time-series predicted concentration for each period through the individual layer. The proposed method performs prediciton using PM2.5 and meteorological data of Seoul metropolitan area, ranging from 2015-01-01 to 2021-02-28. The proposed method was comprehensively evaluated for PM2.5 observation (Ground-truth), CMAQ forecast, and ConvLSTM. In terms of prediction performance, the proposed method showed improvement in performances with an increase of 7.06% in accuracy, an increase of 4.28% in probability of detection, and a decrease of 11.77% in false alram rate, compared to the widely used forecast model."
합성곱 신경망을 이용한 단락이행의 용접 스패터 발생량 예측,2023,"['Gas metal arc(GMA)', 'Short circuit transfer', 'Spatter', 'Machine learning', 'Convolutional neural net']",,"In this study, a machine learning method is proposed to predict the weld spatter generation rate, regardless of the type of short-circuit waveform. Short-circuit waveform data are collected at a high sampling rate of 10–20 kHz, and then, compressed using a new preprocessing method to effectively process the data at a high sampling rate. To predict the spatter generation rate, the welding waveform is converted into an image using the proposed data pre- processing method, and the converted data are fed into the convolutional neural network (CNN). A parametric study on data augmentation and data resolution is conducted concurrently to enhance the prediction accuracy with limited amount of data."
합성곱 신경망 기반 선체 표면 유동 속도의 픽셀 수준 예측,2023,"['Artificial intelligence', 'Flow around a ship hull', 'Velocity prediction', 'Unet', 'Pixel level prediction']",,"In these days, high dimensional data prediction technology based on neural network shows compelling results in many different kind of field including engineering. Especially, a lot of variants of convolution neural network are widely utilized to develop pixel level prediction model for high dimensional data such as picture, or physical field value from the sensors. In this study, velocity vector field of ideal flow on ship surface is estimated on pixel level by Unet. First, potential flow analysis was conducted for the set of hull form data which are generated by hull form transformation method. Thereafter, four different neural network with a U-shape structure were conFig.d to train velocity vectors at the node position of pre-processed hull form data. As a result, for the test hull forms, it was confirmed that the network with short skip-connection gives the most accurate prediction results of streamlines and velocity magnitude. And the results also have a good agreement with potential flow analysis results. However, in some cases which don’t have nothing in common with training data in terms of speed or shape, the network has relatively high error at the region of large curvature."
합성곱 신경망(CNN)을 적용한 도로명 주소 레이어 구축 자동화 연구-실폭도로와 건물 레이어를 중심으로-,2023,"['주소', '공간정보', '드론 영상', '인공지능', 'Address', 'Spatial Information', 'Drone Image', 'AI']","오늘날의 주소의 개념은 일반적인 단순한 과거 주소의 개념에서 벗어나 주소 정보로서 정보 산업 및 물류 산업 등의 경쟁력을 좌우할 중요한 인프라로 인식의 변화를 가져왔다. 이에 본 연구에서는 최근 국제표준화기구로부터 우수사례로 선정된 K-주소의 원활한 해외 진출을 위해 인공지능 기술을 이용한 도로명 주소 레이어 구축 자동화 연구를 수행하였다. 드론 영상으로부터 취득한 정사영상을 이용하여 학습 데이터를 구축하고 CNN계열의 모델을 적용하여 정확도를 분석하였다. 정확도 분석 결과 일반적인 공간정보 구축에 필요로 하는 정확도에는 못 미치지만, 국내의 경우 도로가 53.62%, 건물이 69.88%이며, 탄자니아의 경우 도로가 19.39%, 건물이 31.88%로 추가적인 편집을 거칠 경우 도로명 주소 구축 목적의 데이터로서는 충분한 활용성이 있는 것으로 분석되었다.","Today's concept of address has moved away from the concept of a simple old address and has brought about a change in perception of address information as an important infrastructure that will determine the competitiveness of the information industry and logistics industry. Accordingly, in this study, we conducted an automation study to build a road name address layer using artificial intelligence technology, which is necessary for the smooth overseas expansion of K-Address, which was recently selected as an excellent example by the International Organization for Standardization. Learning data was constructed using orthoimages acquired from drone images, and accuracy was analyzed by applying a CNN-based model. As a result of the accuracy analysis, although it falls short of the accuracy required for general spatial information construction, in Korea, roads account for 53.62% and buildings account for 69.88%, and in Tanzania, roads account for 19.39% and buildings account for 31.88%, so after additional editing, the road names It was judged to have sufficient usability as data for address construction purposes."
3차원 합성곱 신경망과 웨이블렛 변환을 이용한 비접촉 광용적맥파 기반 심박수 예측,2023,"['3D Convolutional neural network', 'CWT algorithm', 'photolethysmography', 'heart rate', 'deep learning']",,"In recent years, research has been conducted into technologies that acquire biological signals in various situations such as healthcare and smart cars, and analyze the acquired signals to perform user recognition, emotion classification, and health status monitoring.Among them, heartbeat is a direct element that represents a person's physical and mental state. Conventional photoplethysmography (PPG) and electrocardiogram (ECG) methods require separate hardware for acquisition, making it difficult to acquire heartbeats in everyday situations. In this paper, we pre-processing videos to emphasize parts related to blood flow and reduce computing resource and times. and we design a model that utilizes 3D-CNN (3Dimension-Convolutional Neural Networks) to predict blood flow signals in a non-contact method through one second facial videos, while reducing the number of input channels. The blood flow signal predicted from the learned model extracted frequency regions related to heartbeat in various frequency regions through CWT (Continuous Wavelet Transform) analysis, and predicts heart rate through the frequency with the highest energy signal among them.Finally, we compared the predicted heart rate from one second facial videos with heart rates obtained though sensors, verified the proposed pre-processing methods and model’s performance"
심층 합성곱 신경망을 이용한 레이더 신호 탐지 성능 분석,2023,"['Binary code', 'artificial neural network', 'convolutional neural network', 'deep learning', '.']",,"Recently, studies to utilize artificial neural networks in radar detection have been actively conducted. In this paper, we compare the performances of SOTA (State Of The Art) neural networks when applying to radar detection. The detection networks consist of two paths to detect the range and Doppler frequency. Among the networks used, HRNet shows the best performance for the range detection, and EfficientNet shows the best performance for Doppler frequency prediction. Although the detection probability is slightly lower than the conventional radar signal processing result, it is somewhat insensitive to the detection threshold, and the false alarm rate is quite low. Therefore, it is expected that the SOTA networks can be well utilized in radar detection."
캔들스틱 차트와 합성곱 신경망을 이용한 주가 갭 예측 연구,2023,"['Trading System', 'CNN', 'Deep Learning', 'Price Gap', 'Candlestick Chart']","기술적 분석에서 가장 활용도가 높은 캔들스틱 차트는 주가의 추세를 직관적으로 파악할 수 있는 도표이다. 캔들스틱 차트 분석으로 수익을 얻을 수 있다면 딥러닝 알고리즘은 학습을 통해 주가 움직임 패턴을 찾아낼 수 있을 것이다. 본 연구의 목적은 주가의 일중, 일별 캔들스틱 차트의 이미지를 CNN에 학습시킨 후, 전일 종가와 당일 시가 차이로 측정하는 주가 갭을 예측하는 것이다. KOSPI200을 구성하는 개별종목을 대상으로 실증 분석한 결과는 다음과 같다. 첫째, 제안 CNN 모형은 갭 상승과 하락을 예측하는 이진 분류에서 55%의 정확도를 보였다. 둘째, 갭 상승과 하락을 나누어 분석한 결과 갭 상승에서 58%, 갭 하락에서 54%의 정밀도를 보였다. 셋째, 표본 외 자료로 시뮬레이션한 결과 제안 모형은 벤치마크 모형보다 우수한 예측 성과를 보였다. 본 연구는 이미지에 다양한 캔들스틱 차트 정보를 담아 CNN 모형에 학습시킨 점과 단기거래에서 중요한 역할을 하는 주가 갭을 예측했다는 점에서 기존 연구와 차별점이 있다. 향후 연구에서는 투자 주체별 거래 정보를 이미지에 추가하여 예측 성과를 개선할 필요가 있다.",
복부 CT 영상에서 심층 합성곱 신경망 기반의 국소 간 병변 분류를 위한 데이터 증강 기법의 효과 분석,2023,"['복부 CT 영상', '국소 간 병변', '데이터 증강', '어파인 변환', '생성적 적대 신경망', '믹스업', '어그믹스', 'Abdominal CT image', 'Focal liver lesion', 'Data augmentation', 'Affine transformation', 'Generative Adversarial Network', 'Mixup', 'Augmix']",,
