title,date,keywords,abstract,multilingual_abstract
딥러닝 기반 COVID-19 흉부 X-ray 영상 분류모델에 관한 연구,2023,"['Artificial intelligence', 'Covid-19', 'Transfer learning', 'CNN', 'Deep learning', '인공지능', '코로나19', '전이학습', '합성곱신경망', '딥러닝']","코로나19는 전 세계적으로 사회 전반에 걸쳐 다양한 영향을 미치고 있으며, 이러한 팬데믹의 확산으로 인한 피해를 최소화하기 위해 많은 연구들이 진행되고 있다. 특히, 인공지능기반 전이학습은 방사선 흉부영상의 신속한 진단및 최적의 치료법 개발을 위해 다양하게 활용되고 있다. 하지만, 모델들이 가지는 연산량과 학습시간에 대한 최적화를 근거로 하여 적절한 모델을 선택하고 임상에서 적극적으로 활용하기에는 한계가 있다. 따라서, 본 연구에서는 이미지 분류에서 우수한 성능을 보이는 5가지 모델의 연산량과 이에 따른 정확도, 그리고 학습 시간과 이에 따른 정확도를 비교하여, 인공지능의 활용 시 적합한 환경에 따른 최적의 모델 선택을 가능하게 하는 것을 목적으로 한다.","The global impact of COVID-19 is manifesting in various ways across society, prompting numerous studies to mitigatethe pandemic's effects. Notably, artificial intelligence-driven transfer learning is being harnessed to expedite the diagnosisof radiological chest images and to explore diverse treatment strategies. However, there are challenges in choosing theright model that balances computational resources and learning time, and in actively applying them in clinical settings.Thus, this study aims to compare the computational load, associated accuracy, and learning time of five high-performingmodels in classification. This comparison seeks to guide the choice of the optimal model in different contexts whenemploying artificial intelligence."
Convolutional Neural Network를 활용한 SEM 영상품질 향상 및 영상품질 평가를 위한 MTF 측정기법,2023,"['Semiconductor', 'Deep learning', 'Image quality', 'Scanning electron microscopy', 'Modulation transfer function', 'Convolutional neural network', '반도체', '딥러닝', '영상품질', '전자주사현미경', '변조전달함수', '합성곱 신경망']",,"As the size of semiconductor devices gradually decreases, it is important to measure and analyze semiconductor devices, to improve the image quality of semiconductors. We use VDSR, one of the Super-Resolution methods to improve the quality of semiconductor devices’ SEM images. VDSR is also a convolutional neural network that can be optimized with various parameters. In this study, a VDSR model for semiconductor devices’ SEM images was optimized using parameters such as depth of layers and amount of training data. Meanwhile, the quantitative evaluation and the qualitative evaluation did not match at the low scale factor. To solve this problem, we proposed an MTF measurement method using the slanted edge for better quantitative evaluation. This method was verified by comparing the results with the PSNR and SSIM index results, which are known as quality indicators. Based on the results, it was confirmed that using the MTF value could be a better approach for the evaluation of SEM images of the semiconductor device than using PSNR and SSIM."
CNN-LSTM 기반의 자율주행 기술,2023,"['Autonomous driving', 'CNN(Convolutional Neural Network)', 'LSTM(Long Short-Term Memory)', 'Data Preprocessing', 'Steering Control', '자율 주행', '합성곱 신경망', '장단기 기억 순환 신경망', '데이터 전처리', '조향 제어']",,"This study proposes a throttle and steering control technology using visual sensors based on deep learning's convolutional and recurrent neural networks. It collects camera image and control value data while driving a training track in clockwise and counterclockwise directions, and generates a model to predict throttle and steering through data sampling and preprocessing for efficient learning. Afterward, the model was validated on a test track in a different environment that was not used for training to find the optimal model and compare it with a CNN (Convolutional Neural Network). As a result, we found that the proposed deep learning model has excellent performance."
Convolutional Neural Network Model Using Data Augmentation for Emotion AI-based Recommendation Systems,2023,"['Emotion AI', 'Emotion classification model', 'Data augmentation', 'Recommendation systems', 'Convolutional neural network', '정서적 AI', '감정분류모형', '데이터 증강', '추천시스템', '합성곱신경망']","본 연구에서는 딥러닝 기법과 정서적 AI를 적용하여 사용자의 감정 상태를 추정하고 이를 추천과정에 반영할 수 있는 추천 시스템에 대한 새로운 연구 프레임워크를 제안한다. 이를 위해 분노, 혐오, 공포, 행복, 슬픔, 놀람, 중립의 7가지 감정을 각각 분류하는 감정분류모델을 구축하고, 이 결과를 추천 과정에 반영할 수 있는 모형을 제안한다. 그러나 일반적인 감정 분류 데이터에서는 각 레이블 간 분포 비율의 차이가 크기 때문에 일반화된 분류 결과를 기대하기 어려울 수 있다. 본 연구에서는 감정 이미지 데이터에서 혐오감 등의 감정 개수가 부족한 경우가 많으므로 데이터 증강을 이용한다. 마지막으로, 이미지 증강을 통해 데이터 기반의 감정 예측 모델을 추천시스템에 반영하는 방법을 제안한다.","In this study, we propose a novel research framework for the recommendation system that can estimate the users emotional state and reflect it in the recommendation process by applying deep learning techniques and emotion AI (artificial intelligence). To this end, we build an emotion classification model that classifies each of the seven emotions of angry, disgust, fear, happy, sad, surprise, and neutral, respectively, and propose a model that can reflect this result in the recommendation process. However, in the general emotion classification data, the difference in distribution ratio between each label is large, so it may be difficult to expect generalized classification results. In this study, since the number of emotion data such as disgust in emotion image data is often insufficient, correction is made through augmentation. Lastly, we propose a method to reflect the emotion prediction model based on data through image augmentation in the recommendation systems."
웹 검색엔진 및 딥러닝 기반 한글 단어 인식 OCR 시스템,2023,"['OCR', 'Deep Learning', 'CNN', 'Korean Word Recognition', 'Word Segmentation', '광학 문자 인식', '딥러닝', '합성곱 신경망', '한글 단어 인식', '단어 분리']",,"Optical character recognition (OCR) is the technology that recognizes text in an image and converts it into text data. In foreign countries, OCR enables automated document processing. Since the recognition rate of Hangul is lower than that of English and Numbers, the OCR is not widely used in Korea. If the OCR accuracy of Hangul is improved, we expect an increase in work efficiency through OCR in Korea as well. In this paper, the OCR system was based on the convolutional neural network (CNN) to train Hangul, English, and Numbers. Subsequently, the process was implemented that distinguishes the complex words to complete Hangul characters, recognizes the complete Hangul characters, and converts them into text data. Additionally, to further improve the accuracy of the OCR system, search the text data in a web search engine, and verify the existence of modified words. If a modified word is found in the web search results, it is considered the correct recognition result and included in the final text data. We conducted a recognition rate measurement and found that the OCR system was able to accurately recognize up to 90.1% of characters in documents containing Hangul, English, and Numbers."
딥러닝 기반 공간 프로그램 및 디자인 요소 분석,2023,"['Deep Learning', 'Computer Vision', 'CNN', 'Image Classification', 'Social Big Data', 'Spatial Design', 'Hotel Design', '딥러닝', '컴퓨터 비전', '합성곱 신경망', '이미지 분류', '소셜 빅데이터', '공간 디자인', '호텔 디자인']","본 연구의 목적은 소셜 빅데이터를 활용한 딥러닝 접근방식을 기반으로 라이프스타일 호텔의 주요 공간 프로그램 및 디자인 요소를 도출하고, 이를 통해 건축 공간 계획 및 디자인 분야에서 소셜 빅데이터와 딥러닝 기반 컴퓨터 비전의 활용 가능성을 모색하고자 하는 것이다. 디지털 시대에는 딥러닝 기반 기술을 통해 소셜 빅데이터를 통해 진정한 고객 의견을 접할 수 있게 되었다. 이러한 맥락에서 본 연구는 사용자가 선호하는 공간 프로그램 및 디자인 요소를 탐색하기 위해 대표적이 이미지 공유 소셜 미디어인 인스타그램의 이미지를 활용한다. 국내 라이프스타일 호텔의 사례를 대상으로, 프로그래밍한 파이썬 웹 크롤러를 활용하여 인스타그램 이미지를 수집 및 전처리하여 데이터셋을 준비하였다. 먼저, 사전 구축된 컴퓨터 비전 모델을 활용하여 이미지에 나타난 주요 공간 디자인 요소를 탐색하였다. 이후이전 단계에서 공간 이미지로 분류된 이미지에서 주요 공간 프로그램을 분석하였으며, 이에 딥 러닝 기반 CNN모델을 활용하였다. 본 연구의 결과는 가구와 재료, 섬유, 실내 식물과 같은 장식적인 요소들이 라이프스타일 호텔 환경을 설계할 때 우선순위를 두어야 하는 주요 디자인 요소라는 것을 보여준다. 또한 숙박 외에도 F&B와 연회, 리테일과 같은 다양한 프로그램이 주요한 프로그램인 것으로 나타났다. 마지막으로, 본 연구는 새로운 활용방법을 제시함으로써 건축 및 공간 계획 영역에서 빅데이터의 분석 및 딥러닝 모델의 활용을 확장하고자 하였다.","This study aims to uncover the essential spatial programs and design elements that resonate with lifestyle hotel users. It utilizes deep learningmethods with social big data to access authentic customer opinions in today’s digital world. In this context, this research focuses onevaluating Instagram images of South Korean lifestyle hotels systematically collected using a Python web crawler developed by the researcher.The image dataset was initially analyzed using a pre-built computer vision model to explore spatial design elements. Subsequently,Convolutional Neural Networks (CNN) was applied to scrutinize images categorized as spatial in the previous stage, identifying crucial spatialprograms. These findings emphasize the significance of decorative elements like furnishings, materials, textiles, and indoor greenery in shapinglifestyle hotel environments. Additionally, this research revealed that these hotels offer a range of services beyond accommodation, with astrong emphasis on Food and Beverage (F&B), banqueting facilities, and retail offerings. Ultimately, this study aims to expand and enrich thetoolbox of big data analysis techniques and deep learning models in the field of architecture and spatial design, introducing a new paradigmfor their application."
강판의 선상가열에 있어서 Faster R-CNN을 이용한 가열 위치 예측에 관한 연구,2023,"['Line Heating(선상 가열)', 'Deformation Analysis(변형 해석)', 'Deformation Images(변형 이미지)', 'Faster R-CNN(더빠른 영역 합성곱신경망)', 'Heating-Position Prediction(가열 위치 예측)']",,
이미지 타입의 ECG 데이터를 사용한 CNN 모델 기반 부정맥 분류,2023,"['Image-typed ECG', 'Arrhythmia Classification', 'CNN', 'RNN', 'MIT-BIH Arrhythmia Database', '심전도', '부정맥', '합성곱 신경망', '순환 신경망', 'MIT-BIH 부정맥 데이터셋']",,"Among cardiac diseases, arrhythmias can lead to serious complications such as stroke, heart attack, and heart failure if left untreated, so continuous and accurate ECG monitoring is crucial for clinical care. However, the accurate interpretation of electrocardiogram (ECG) data is entirely dependent on medical doctors, which requires additional time and cost. Therefore, this paper proposes an arrhythmia recognition module for the purpose of developing a medical platform through the analysis of abnormal pulse waveforms based on Lifelogs. The proposed method is to convert ECG data into image format instead of time series data, apply visual pattern recognition technology, and then detect arrhythmia using CNN model. In order to validate the arrhythmia classification of the CNN model by image type conversion of ECG data proposed in this paper, the MIT-BIH arrhythmia dataset was used, and the result showed an accuracy of 97%."
시멘트풀의 공극분포특성에 기반한 인장강도 예측 CNN 모델,2023,"['microstructure', 'cement paste', 'convolutional neural network', 'material property', 'micro-CT', '미세구조 특성', '시멘트 페이스트', '합성곱 신경망', '재료 응답', '마이크로 CT']",,"The uncertainties of microstructural features affect the properties of materials. Numerous pores that are randomly distributed in materials make it difficult to predict the properties of the materials. The distribution of pores in cementitious materials has a great influence on their mechanical properties. Existing studies focus on analyzing the statistical relationship between pore distribution and material responses, and the correlation between them is not yet fully determined. In this study, the mechanical response of cementitious materials is predicted through an image-based data approach using a convolutional neural network (CNN), and the correlation between pore distribution and material response is analyzed. The dataset for machine learning consists of high-resolution micro-CT images and the properties (tensile strength) of cementitious materials. The microstructures are characterized, and the mechanical properties are evaluated through 2D direct tension simulations using the phase-field fracture model. The attributes of input images are analyzed to identify the spot with the greatest influence on the prediction of material response through CNN. The correlation between pore distribution characteristics and material response is analyzed by comparing the active regions during the CNN process and the pore distribution."
문화재복원을 위한 콜맵 3D 재구성 어플리케이션에 관한 연구,2023,"['3D Reconstruction', 'SfM', 'Point Cloud', 'Pose Estimation', 'CNN', '3D 재구성', 'SfM', '포인트 클라우드', '위치 추정', '합성곱 신경망']",,"Colmap is one of the innovative artificial intelligence technologies, highly effective as a tool in 3D reconstruction tasks. Moreover, it excels at constructing intricate 3D models by utilizing images and corresponding metadata. Colmap generates 3D models by merging 2D images, camera position data, depth information, and so on. Through this, it achieves detailed and precise 3D reconstructions, inclusive of objects from the real world. Additionally, Colmap provides rapid processing by leveraging GPUs, allowing for efficient operation even within large data sets. In this paper, we have presented a method of collecting 2D images of traditional Korean towers and reconstructing them into 3D models using Colmap. This study applied this technology in the restoration process of traditional stone towers in South Korea. As a result, we confirmed the potential applicability of Colmap in the field of cultural heritage restoration."
CNN 기반 한국 숫자지화 인식 응용에서 표면근전도 샘플링 주파수가 학습 성능에 미치는 영향에 관한 연구,2023,"['Data sampling frequency', 'Convolutional neural network', 'Finger number gesture recognition', 'sEMG signals', '데이터 샘플링 주파수', '합성곱 신경망', '한국 숫자지화 인식', '표면근전도 신호']","본 연구는 CNN에 기반한 한국 숫자지화 인식 시스템의 입력데이터인 표면 근전도 신호에 대한 샘플링 주파수가 CNN의 학습 성능에 미치는 영향을 검토하였다. 표면 근전도의 샘플링 주파수가 크면 수집한 많은 양의 입력데이터에 대한 학습 시간이 길어지므로 실시간 시스템의 구현이 어려움이 발생하고 고가의 표면 근전도 측정장비를 필요로 하므로 표면근전도 신호의 샘플링 주파수 선정에서 적정선이 요구된다. 이를 위해 본 연구에서는 1,024Hz, 512Hz, 256Hz, 128Hz 그리고 64Hz의 샘플링 주파수를 선정하고 선정된 샘플링 주파수로 측정한 표면근전도 신호를 입력으로 CNN 학습 성능을 비교하였다. 비교 연구 결과는 선정된 모든 샘플링 주파수로 획득한 표면근전도 신호를 입력데이터를 활용한 CNN 학습 모두가 한국 숫자지화 일부터 다섯을 100% 인식하였으며, 그중에서도 256Hz의 샘플링 주파수로 획득한 표면근전도 신호를 입력데이터로 활용한 CNN 학습이 가장 짧은 시간 안에 이루어졌다.",
Reducing latency of neural automatic piano transcription  models,2023,"['Automatic music transcription', 'Piano transcription', 'Low-latency', 'Convolutional neural network', '자동 채보', '피아노 채보', '저지연', '합성곱 신경망']",,"Automatic Music Transcription (AMT) is a task that detects and recognizes musical note events from a given audio recording. In this paper, we focus on reducing the latency of real-time AMT systems on piano music. Although neural AMT models have been adapted for real-time piano transcription, they suffer from high latency, which hinders their usefulness in interactive scenarios. To tackle this issue, we explore several techniques for reducing the intrinsic latency of a neural network for piano transcription, including reducing window and hop sizes of Fast Fourier Transformation (FFT), modifying convolutional layer’s kernel size, and shifting the label in the time-axis to train the model to predict onset earlier. Our experiments demonstrate that combining these approaches can lower latency while maintaining high transcription accuracy. Specifically, our modified model achieved note F1 scores of 92.67 % and 90.51 % with latencies of 96 ms and 64 ms, respectively, compared to the baseline model’s note F1 score of 93.43 % with a latency of 160 ms. This methodology has potential for training AMT models for various interactive scenarios, including providing real-time feedback for piano education."
딥러닝 알고리즘을 이용한 매설 배관 피복 결함의 간접 검사 신호 진단에 관한 연구,2023,"['Buried Pipe', 'Close Interval Potential Survey', 'Direct Current Voltage Gradient', 'Deep learning algorithm', 'Convolutional Neural Network', 'Grad-CAM', '매설 배관', '근간격전위측정법', '직류전압기울기측정법', '딥러닝 알고리즘', '합성곱 신경망']",,"In this study, a deep learning algorithm was used to diagnose electric potential signals obtained through CIPS and DCVG, used indirect inspection methods to confirm the soundness of buried pipes. The deep learning algorithm consisted of CNN(Convolutional Neural Network) model for diagnosing the electric potential signal and Grad CAM(Gradient-weighted Class Activation Mapping) for showing the flaw prediction point. The CNN model for diagnosing electric potential signals classifies input data as normal/abnormal according to the presence or absence of flaw in the buried pipe, and for abnormal data, Grad CAM generates a heat map that visualizes the flaw prediction part of the buried pipe. The CIPS/DCVG signal and piping layout obtained from the 3D finite element model were used as input data for learning the CNN. The trained CNN classified the normal/abnormal data with 93% accuracy, and the Grad-CAM predicted flaws point with an average error of 2m. As a result, it confirmed that the electric potential signal of buried pipe can be diagnosed using a CNN-based deep learning algorithm."
딥러닝 기반의 회전기계 속도 추정 시스템,2023,"['Rotational Machinery', 'Rotational Speed Estimation', 'Short-time Fourier Transform', 'Convolutional Neural Network', 'Auto Correlation Function', '회전기계설비', '회전속도 추정', '단시간 푸리에 변환', '합성곱 신경망', '자기상관함수']",설비의 회전속도를 추정하는 방법은 회전계를 사용하는 방법과 진동 신호를 이용하는 방법 및 전류 신호를 이용한 방법이 존재한다. 회전계는 설치 위치와 환경에 영향을 받으며 전류 신호를 이용하는 방법은 센서 설치 및 유지보수에 어려움이 존재한다. 기존의 진동 신호를 이용하는 방법은 회전속도의 범위를 전문가가 정의해야 하며 연산량이 많아 산업현장에 적용하기 어렵다. 본 논문에서는 STFT 이미지를 사용하여 회전속도의 범위를 분류하는 CNN 모델을 학습시킨다. 그 후 자기상관함수를 이용하여 주기적 신호를 검출하고 엣지 디바이스에서 동작이 가능한 회전속도 추정 시스템을 제안한다. 연구에 사용된 데이터는 공기조화설비에서 수집하였으며 시스템의 성능 평가를 위해 모델의 성능평가 및 디지털 타코미터와 시스템의 추정 회전속도를 비교 분석하였다. 본 연구를 통해 제안한 시스템이 회전속도를 높은 정확도로 추정하며 산업현장에 적용 가능하다는 것을 확인하였다. 향후 연구로 특정한 속도 범위가 없어도 회전속도를 추정할 수 있도록 시스템 기능을 개선이 필요하다.,"Methods for estimating the rotational speed of equipment include a method using a rotation meter, a method using a vibration signal, and a method using a current signal. The rotation system is affected by the installation location and environment, and the method using the current signal presents difficulties in sensor installation and maintenance. The method using the existing vibration signal requires an expert to define the range of rotation speed, and it is difficult to apply it to industrial sites due to the large amount of computation. In this paper, we train a CNN model that classifies the rotational speed range using STFT images. After that, a rotational speed estimation system capable of detecting periodic signals using an autocorrelation function and operating in an edge device is proposed. The data used in the study was collected from air conditioning facilities, and the performance evaluation of the model and the estimated rotation speed of the digital tachometer and the system were compared and analyzed to evaluate the system performance. Through this study, it was confirmed that the proposed system estimates the rotational speed with high accuracy and can be applied to industrial sites. As a future study, it is necessary to improve the system function so that the rotational speed can be estimated without a specific speed range."
초분광 광학가시화 기술을 활용한 인공지능 산소온도 측정기술 개발,2023,"['Tunable Laser Absorption Spectroscopy', 'Hyperspectral Imaging', 'High-Temperature furnace experiment', 'Deep learning', 'CNN', '가변 다이오드 레이저 흡수 분광법', '초분광 기술', '고온로 실험', '심층학습', '합성곱 신경망']",,"This research developed a measurement technique that can measure the oxygen temperature inside a high temperature furnace. Instead of measuring only changes in frequency components within a small range used in the existing variable laser absorption spectroscopy, laser spectroscopy technology was used to spread out wavelength of the light source passing through the gas Based on a total of 20,000 image data, research was conducted to predict the temperature of a high-temperature furnace using CNN with black and white images in the form of spectral bands by temperature of 25 to 800 degrees. The optimal model was found through Hyper parameter optimization, R2 score is 0.89, and the accuracy of the test data is 88.73%. Based on this research, it is expected that concentration measurement and air-fuel ratio control technology can be applied."
