title,date,keywords,abstract,multilingual_abstract
온라인 민간경비 교육훈련의 현황 및 개선방안:,2017,"['직무교육', '온라인 교육', '위원회', '민간경비', '편리성\r\nJob Education', 'On-line Education', 'Committee', 'Private Security', 'Convenience']","2015년부터 도입된 온라인 민간경비 직무교육은 온라인 교육이 가지고 있는 특징인 교육의 편리성, 관리의 용이성 등의 장점으로 인하여 온라인 직무교육에 참가하는 경비원은 급격하게 증가하고 있다. 그러나 2016년 경찰청장의 감독명령에 의해 검정되지 않은 다수의 온라인교육기관이 참여함에 따라 직무교육의 문제점이 발생하고 있다. 따라서 본 연구에서는 현재의 온라인 민간경비 직무교육 현황을 살펴보고 개선방안을 제시하고자 하였다.현재의 온라인 직무교육의 문제점으로는 첫째, 질적인 수준이 담보되지 않은 온라인 교육기관이 직무교육을 수행하여 직무교육의 효과성을 떨어뜨리고 있다. 둘째, 교육학습에 있어서 기술적 지원체계의 미흡으로 원활한 교육진행의 어렵다는 점이다. 이러한 교육현황은 기존의 집체교육의 문제점을 개선하고자 도입한 온라인 교육방법의 장점을 제대로 살리지 못하고 있다. 따라서 직무교육의 품질을 개선하고 직무교육의 효과성을 향상시키기 위하여 교육기관에 대한 일정한 규제가 필요하다. 이에 대한 개선방안으로 첫째, 현재의 신임교육기관 선정과 유사하게 일정한 수준(교육과정, 전문가 보유, 모바일 교육지원 체제 등)을 유지하고 있는 교육기관을 평가하여 감독기관인 경찰청이 지정하여 관리함으로써 일정한 교육의 품질을 유지시키도록 하는 방안, 둘째, 온라인 민간경비 직무교육을 감독하는 경찰청의 관련 부서에서 검증위원회를 설치하여 위원회에서 일정한 수준의 교육기관을 검증하여 허용하는 방안 등을 제시하고자 한다.","The on-line security training system has been introduced since 2015, and the number of security guards participating in on-line job training is rapidly due to the convenience of education and the ease of management.However, due to the fact that many non-certified on-line education institutions participated in the supervision order of the police chief in 2016, there is a problem in terms of quality of job education. Therefore, in this study, the current status of on-line private security professional education is suggested and suggested improvement plan.The present problems of on-line job education are as follows: First, online education institutions that are not guaranteed qualitative level are dropping the effectiveness of job education by carrying out job education. Second, it isdifficult to proceed with smooth education due to lack of technical support system in educational learning. The current status of education does not fully utilize the advantages of the on-line education method introduced toimprove the problems of the conventional education. Therefore, some regulations on educational institutions are needed to improve the quality of job education and to improve the effectiveness of job education. First, itevaluates educational institutions that maintain a certain level (curriculum, specialist holding, mobile education support system, etc.) similar to the current selection of the new educational institution, Second, the relevantdepartment of the NPA, which oversees online private security job training, will set up a verification committee to propose ways for the committee to verify and allow a certain level of educational institutions."
자기조직화지도를 이용한 분류문제에서의 결측자료 대체방법 연구,2017,"['self-organizing maps', 'learning vector quantization', 'discriminant analysis', 'missing data', 'imputation.', '자기조직화지도', '학습벡터 양자화', '판별분석', '결측자료', '대체.']","Kohonen(1990)에 소개된 자기조직화지도(self-organizing maps, SOM)는 비지도학습(unsupervised learning) 신경망(neural network) 모형의 한 종류로서 고차원 다변량 자료에 대한 군집분석과 저차원 시각화에 사용된다. 학습벡터 양자화(learning vector quantization, LVQ)는 벡터 양자화(vector quantization) 방법을 활용한 지도학습(supervised learning) 모형의 한 종류로서 사전에 정해진 개수의 노드로 구성된 판별경계를 베이즈 판별경계로 미세하게 조정하는 알고리즘이며 비선형 판별경계를 가지는 자료에 대한 판별분석에 유용하게 사용된다. 본 논문에서는 비선형의 판별경계를 구축해야 하는 경우 SOM 방법의 결과노드를 활용하는 것이 K-평균 군집분석의 결과노드를 활용하는 것보다 최적의 판별경계 구성에 유리할 수 있음을 모의실험을 통해 보였다. 또한 결측값이 존재하면서 비선형 판별경계를 가지고 있는 자료에 대해 일반적인 결측값 대체방법인 평균대체, 핫덱대체, 그리고 모형에 근거한 대체 방법으로 대체를 실시하였을 때 SOM을 활용한 LVQ방법의 성능을 모의실험을 통해 알아보고 유리 판별 자료에 각 결측대체방법을 적용하여 판별 결과를 비교하였다.","Self-organizing maps (SOM) (Kohonen, 1990), one of the unsupervised learning neural network models, are used to conduct cluster analysis or visualize high dimensional data in a low dimensional space. Learning vector quantization (LVQ), one of the supervised learning models utilizing the vector quantization method, is an algorithm to adjust decision borders based on a chosen number of nodes for producing bayesian decision borders and usefully applied to discriminant analysis for data with nonlinear decision borders. Here, we conduct a simulation to show that initial nodes of LVQ based on the SOL algorithm performs better in finding optimal nonlinear decision borders than the ones based on the K-mean clustering method. When data with nonlinear decision borders include missing values, imputation can be implemented to fill in missing values. A simulation is conducted to compare the performance of the LVQ method utilizing SOM when missing values are imputed by mean imputation, hotdeck imputation, and a model based imputation. These imputation methods are also applied to impute missing values of glass identification data and misclassification rates of them are compared."
포인트 주석 기반의 비디오 위치 추정의 한계점 분석과 포인트 분포 모델링을 통한 개선방법 연구,2023,"['deep learning', 'computer vision', 'video localization', 'point-based learning', '딥러닝', '컴퓨터 비전', '비디오 위치 추정', '포인트 기반 학습']","비디오에서 행동의 위치를 추정하기 위해 행동의 시작과 끝에 모두 주석을 다는 것은 많은 비용을 요구한다. 따라서 주석 생성 비용을 줄이기 위해 비디오 단위의 행동 카테고리만 존재하는 약지도 학습이 활발히 진행되고 있지만 약지도 학습은 행동단위 주석의 부재에 따른 많은 한계가 존재한다. 최근에는 주석의 생성 비용은 줄이면서 약지도 학습에 비해 훨씬 개선된 성능을 낼 수 있는 포인트 주석 기반 약지도 학습에 대한 연구가 진행되고 있다. 하지만 이는 행동구간 내의 포인트가 존재하는 위치에 많이 의존한다는 한계가 있다. 본 연구진은 이런 점을 보완하고자, 행동구간을 나타낼 수 있는 확률분포를 설계하고 포인트 주석을 샘플링하여 학습이 진행됨에 따라 점차 포인트 주석을 행동구간의 가운데 방향으로 움직일 수 있게끔 하는 포인트 업데이트 방식을 제안한다. 실험은 제안하는 방법이 기존의 포인트 주석 기반 학습에서 치우친 포인트가 주어진 경우 성능의 한계를 개선함을 보여준다.","Labeling the starting and ending points of interesting actions in a video is labor-intensive and expensive. To reduce the labeling costs, many studies have been conducted on weakly supervised learning, where only video-level action labels exist, but it has limitations due to the absence of frame-level annotations. Recently, research has been conducted on point annotation-based learning, which can achieve much improved performance while reducing labeling costs. However, this has a limitation in that the performance depends the location of annotated points in the action interval. To compensate for this, we design a probability distribution that can represent action intervals, which allows us to sample point annotations and update them to gradually move point annotations toward the center of action intervals as learning progresses. Experiments show that the proposed method improves the performance limitation given biased points in a point annotation-based learning scheme."
Stress Identification and Analysis using Observed Heart Beat Data from Smart HRM Sensor Device,2017,"['Stress', 'HRV', 'Machine Learning']",,"In this paper, we analyses heart beat data to identify subjects stress state (binary) using heart rate variability (HRV) features extracted from heart beat data of the subjects and implement supervised machine learning techniques to create the mental stress classifier. There are four steps need to be done: data acquisition, data processing (HRV analysis), features selection, and machine learning, before doing performance measurement. There are 56 features generated from the HRV Analysis module with several of them are selected (using own algorithm) after computing the Pearson Correlation Matrix (p-values). The results of the list of selected features compared with all features data are compared by its model error after training using several machine learning techniques: support vector machine, decision tree, and discriminant analysis. SVM model and decision tree model with using selected features shows close results compared to using all recording by only 1% difference. Meanwhile, the discriminant analysis differs about 5%. All the machine learning method used in this works have 90% maximum average accuracy."
Recognizing Actions from Different Views by Topic Transfer,2017,"['action recognition', 'topic model', 'transfer learning', 'cross-view']",,"In this paper, we describe a novel method for recognizing human actions from different views via view knowledge transfer. Our approach is characterized by two aspects: 1) We propose a unsupervised topic transfer model (TTM) to model two view-dependent vocabularies, where the original bag of visual words (BoVW) representation can be transferred into a bag of topics (BoT) representation. The higher-level BoT features, which can be shared across views, can connect action models for different views. 2) Our features make it possible to obtain a discriminative model of action under one view and categorize actions in another view. We tested our approach on the IXMAS data set, and the results are promising, given such a simple approach. In addition, we also demonstrate a supervised topic transfer model (STTM), which can combine transfer feature learning and discriminative classifier learning into one framework."
CDBN 속성을 사용한 음악 장르 분류,2017,"['속성 학습', 'CDBN', 'ZCA 백색화', '다수결 투표', '장르 분류', 'Feature Learning', 'ZCA Whitening', 'Voting', 'Genre Classification']","본 논문에서는 속성 학습(Feature Learning) 모델 중 CDBN(Convolutional Deep Belief) 모델을 사용하여 음악 장르를 분류하는 방법을 제안한다. 제안하는 방법은 크게 전처리와 CDBN 훈련, 분류기 훈련 및 다수결 투표로 구성된다. 전처리 과정에서는 가공되지 않은 음악 데이터에서 멜 스펙트로그램(mel-spectrogram)을 추출한 뒤, ZCA 백색화(whitening)을 적용하여 멜스펙트로그램의 주파수 상호간 연관성을 제거한 저 수준 음악 속성을 얻는다. 다음으로 해당 저 수준 음악 속성을 입력으로 사용하여 계층적으로 고 수준의 음악 속성을 추출할 수 있도록 CDBN 커널을 훈련시킨다. 마지막으로 일정 시간 단위로 샘플링 한 저 수준의 음악 속성을 훈련된 CDBN에 입력으로 주어 얻을 수 있는 고 수준의 음악 속성을 사용하여 인공신경망 분류기를 학습시키고, 분류 결과의 다수결 투표를 통해 해당 데이터의 장르를 최종 결정한다. 제안된 방법은 GTZAN 데이터 셋을 사용하여 장르 분류를 시도한 결과 평균적으로 78.88%의 분류율을 보였다.","This paper proposes a genre classification method using CDBN(Convolutional Deep Belief), which is one of feature learning model. The proposed method consists of preprocessing, training of CDBN, supervised training of a classifier, and majority voting operations. In the preprocessing low-level music features are obtained from decorrelated mel-spectrogram by ZCA whitening. Then the kernels of CDBN is trained to extract hierarchical high-level features from inputs of the low-level music features. Finally the high-level features are obtained for labeled music from the CDBN, and a multilayer perceptron classifier is trained. In the training a set of cropped samples with a constant duration are taken from the low-level music features, each cropped sample is classified into a separate genre, and the set of classification results for the samples are combined to provide the final decision of a genre by majority voting. The proposed method showed 78.9% of average genre classification accuracy for GTZAN data set."
Iterative Naive Bayes classifier Design method for Effective Emotion Classification,2017,"['Emotion', 'Emotion recognition', 'DECAF', 'EEG']",,
초심 수퍼바이저의 수퍼비전 경험에 대한 내러티브 탐구,2017,"['초심 수퍼바이저', '수퍼비전', 'Novice supervisor', 'supervision']","본 연구는 초심 수퍼바이저의 수퍼비전 경험과 그 의미에 대해 알아보고자 상담심리전문가 자격을 취득한지 5년 이하, 현재 상담과 수퍼비전을 모두 하고 있는 수퍼바이저를 대상으로 내러티브 탐구방법을 통해 알아보았다. 수퍼바이저들은 주변의 요구로 수퍼비전을 시작하게 되었고, 역할변화로 인해 당황스러움이 있는 것으로 밝혀졌다. 또한 수퍼비전을 위해 치밀하게 준비를 하고, 수퍼바이지의 피드백에 신경 쓰고 있었으며, 수퍼바이지에 대한 여러 감정들이 교차하였다. 그럼에도 수퍼비전을 지속하는 이유는 수퍼바이지의 열정적인 모습이 보였기 때문이다.이러한 경험들을 통해 수퍼바이지의 성장을 믿고 기다려주게 되었고, 지적 호기심의 증가로 전문성이 발달하고 있었다. 그리고 수퍼바이저들은 자기성찰을 하고 있었으며, 자신만의 수퍼비전 방법을 형성해가고 있었다.초심 수퍼바이저들에게 수퍼비전은 전문가로서 그리고 인간으로서의 성숙해져 가는 과정이며, 이는 성장과 변화를 의미한다. 초심 수퍼바이저들의 시행착오와 부담감을 줄이기 위해 수퍼비전의 수행 경험이 수행될 수 있는 과정이 수립되기를 기대한다.","In this study, novice supervisors' experience ""supervising"" and the meaning they place on their supervisory experience were examined via narrative research design. Six certified counselling psychologists with fewer than five years of both counselling and supervisory experience were selected as participants of the study. The results found that novice supervisors have difficulty adjusting to their supervisory role since they transitioned only recently from supervisee to supervisor, and they accepted the supervisor role merely because their supervisees requested supervision from them. Although novice supervisors feel ambivalent toward their supervisees, they meticulously prepare supervisory session and feedback and are willing to continue supervision as their supervisees exhibit a high level of motivation and passion for learning from them.Data analysis reveal that supervisory experience increased novice supervisors' level of intellectual curiosity, which in turn improved their expertise in counselling. Over time, novice supervisors developed individualized, personalized supervision training methods through self-reflection as well as confidence in their supervisees' professional growth.To novice supervisors, supervisory experience is an important step towards growth on a professional level and positive change on a personal level. Findings from this study imply that more comprehensive supervision training and practice for novice supervisors should be implemented to reduce tension and unease that arise from abrupt role transition."
스마트홈 서비스를 위한 사용자 피드백 기반 상황인지 모델 학습,2017,"['Smart home', 'Situation awareness', 'Semi-supervised Learning', 'Genetic Algorithm']",,"IRecently, researches on the recognition of indoor user situations through various sensors in a smart home environment are under way. In this paper, the case study was conducted to determine the operation of the robot vacuum cleaner by inferring the user ’s indoor situation through the operation of home appliances, because the indoor situation greatly affects the operation of home appliances. In order to collect learning data for indoor situation awareness model learning, we received feedbacks from user when there was a mistake about the cleaning situation. In this paper, we propose a semi-supervised learning method using user feedback data. When we receive a user feedback, we search for the labels of unlabeled data that most fit the feedbacks collected through genetic algorithm, and use this data to learn the model. In order to verify the performance of the proposed algorithm, we performed a comparison experiments with other learning algorithms in the same environment and confirmed that the performance of the proposed algorithm is better than the other algorithms."
진로진학상담 슈퍼비전 교육내용에 대한 델파이 연구,2017,"['진로교육', '진로진학상담', '슈퍼비전', '델파이 연구', 'Career education', 'Career &amp', 'guidance counseling', 'Supervision', 'Delphi analysis']","본 연구의 목적은 진로진학상담 역량을 향상하기 위한 진로진학상담 슈퍼비전에서 중요하게 다루어야 할 교육내용을 제시하는 것이다. 이를 위해 진로상담 및 심리 정서상담 등의 슈퍼비전과 관련된 선행 연구를 탐색하고, 4차에 걸친 내용 분석을 통해 13개 요인, 57개 교육내용으로 진로진학상담 수퍼비전에서 다룰 필요가 있는 교육내용을 분류하였다. 또한, 이 초안의 교육내용을 진로진학상담교사, 진로상담전문가, 진학상담전문가, 심리정서상담전문가등 네 분야 32명의 전문가 패널에 의한 델파이 연구를 3차에 걸쳐 실시하여 진로진학상담 슈퍼비전 교육내용을 10개의 상위요인과 42개의 하위요인으로 제시하였다. 10개의 상위요인은 ‘진로교육 및 진로진학상담의 주요 이론 이해’, ‘진로심리검사 역량’, ‘개인차 및 다양성에 대한 이해’, ‘진로진학정보 탐색 역량’, ‘연계 및 자문역량’, ‘진로상담 역량’, ‘학습 진학상담 역량’, ‘성찰 및 자기 계발’, ‘상담기술의 적절한 활용 역량’, ‘전문가 윤리 및 사회적 책임감’이었다. 도출된 진로진학상담 수퍼비전 교육내용은 진로진학상담을 실시하는 교사의 역량을 향상하기 위한 슈퍼비전에서 반드시 다뤄져야 할 중요한 교육내용으로 추후연구에서는 진로진학상담 수퍼비전 모형 개발과 학교 현장에서의 활용도를 높일 수 있는 방안이 모색되어야 한다. 이러한 연구 결과를 토대로 본 연구의 시사점과 제한점에 대해 제시하였다.","This study aims to compile a list of educational contents in the supervision to enhance teacher’s career & guidance counseling competency. To achieve this, Delphi list of educational contents on the career & guidance counseling supervision was developed with 32 professional panels. This study compiled a list and presented relative importance of educational contents in supervision for enhancing career & guidance counseling practice skill. The Delphi survey was conducted in three rounds on the panel of 32 professionals. Hierarchical structure consisted of 10 main determinants with 42 sub-components from educational contents on supervision for career & guidance counseling. 10 main determinants included ‘understanding of major theory in career education and career guidance counseling’, ‘career psychological test competency’, ‘understanding individual difference and diversity’, ‘competency to search career & guidance information’, ‘referral and consultation competency’, ‘career counseling competency’,  learning guidance counseling competency’, ‘reflection and self-development’, ‘competency to apply JIKSper helping skills’, and ‘professional ethics and social responsibility’. This study has the following implications. The list of educational contents on the career & guidance counseling supervision is compiled. Conclusion of this study was hierarchical structure consisted of 10 main determinants with 42 sub-components from educational contents on supervision for career & guidance counseling. Based on the above findings, it is expected that national system of the supervision on career & guidance counseling is developed and subsequent studies could be activated. In addition, the limitations of the study and possible follow-up projects are proposed in the conclusion section."
기계 학습 방법을 이용한 활동 프로파일 기반의 스마트 시니어 분류 모델 개발,2017,"['활동 프로파일', '스마트 시니어', '기계 학습', '지도 학습', '비지도 학습', '분류 모델', 'Activity Profile', 'Smart Senior', 'Machine Learning', 'Supervised Learning', 'Unsupervised Learning', 'Classification Model']","최근 스마트폰의 보급 및 웹 서비스의 도입으로 온라인 사용자들은 대규모의 콘텐츠를 시간과 장소에 관계없이 접할 수 있게 되었다. 그러나 사용자들은 대규모의 콘텐츠 사이에서 원하는 콘텐츠를 찾는 데 어려움을 겪게 되었다. 이러한 문제를 해결하기 위해 다양한 분야에서 사용자 모델링 및 추천 시스템에 대한 연구가 활발하게 수행되었다. 그러나 정보 환경의 변화에 따른 시니어 계층의 적극적인 변화에도 불구하고 시니어 계층에 초점을 맞춘 사용자 모델링 및 추천 시스템에 대한 연구는 매우 부족한 실정이다. 이에 본 논문에서는 기계 학습 방법을 기반으로 스마트 시니어 계층의 선호도를 파악할 수 있는 모델링 방법을 제안하고, 스마트 시니어 분류 모델을 개발 한다. 이 결과, 스마트 시니어 계층의 선호도를 파악할 수 있을 뿐만 아니라 스마트 시니어 분류 모델 개발을 통해 시니어 사용자에게 가장 적합한 활동 및 콘텐츠를 제공하는 콘텐츠 추천 연구에 대한 발판을 마련하였다.","With the recent spread of smartphones and the introduction of web services, online users can access large-scale content regardless of time or place. However, users have had trouble finding the content they wanted among large-scale content. To solve this problem, user modeling and content recommendation system have been actively studied in various fields. However, in spite of active changes in senior groups according to the changes in information environment, research on user modeling and content recommendation system focused on senior groups are insufficient. In this paper, we propose a method of modeling smart senior based on their preference, and further develop a smart senior classification model using machine learning methods. As a result, we can not only grasp the preferences of smart seniors, but also develop a smart senior classification model, which is the foundation for the research of a recommendation system which will provide the activities and contents most suitable for senior groups."
