title,date,keywords,abstract,multilingual_abstract
Designing a Consumer Dispute Settlement System by Applying Machine Learning,2017,"['소비자피해', '분쟁조정시스템', '머신러닝', '중재', 'Consumer Damage', 'Dispute System', 'Machine Learning', 'Mediation']",,"Through the advancement of machine le arning technology, difficult problems in various fields have been resolved in an efficient and powerful manner. In the pa st, programs were only able to carry out commands that were strictly given by the code. Today, supervised machine learni ng enables programs to learn from any given set of data. Machine learning prog rams are capable of processing large a mounts of data and can make accurate predictions by finding new patterns with out continuous human supervision.This powerful ability can be applied in many different areas. This study in parti cular investigates how machine learning can be applied to resolve the problems in referencing the successful mediation cases in consumer disputes that are pro vided by the Korean Consumer Agency on their Consumer Dispute Mediation w ebsite. More specifically, this research utilizes library methods provided by sciki t-learn, an effective data analysis tool, in order to explain the process and appli cation of machine learning. By presenting the advantages of applying machine lea rning to successful mediation in consum er disputes, this research aims to explai n why a machine learning system would be appropriate for the Consumer Dispute Mediation system.The application of machine learning will allow the system to assume the burden of consumers in finding and analyzing the data provided by the Korean Consu mer Agency through a completely differ ent paradigm. The new system will effici ently learn, analyze, and solve the diffic ult problems of consumers, creating an overall improved user experience. As the system can easily obtain the information required by the consumer, it is expected that the utility of the system will continue to increase over time."
Multi-view based unlabeled data selection using feature transformation methods for semiboost learning,2017,"['SemiBoost learning', 'Useful unlabeled data selection', 'Multiple views of feature set', 'Feature decomposition methods']",,"<P>SemiBoost Mallapragada et al. (2009) is a boosting framework for semi-supervised learning, in which unlabeled data as well as labeled data both contribute to learning. Various strategies have been proposed in the literature to perform the task of selecting useful unlabeled data in SemiBoost. Recently, a multi-view based strategy was proposed in Le and Kim (2016), in which the feature set of the data is decomposed into subsets (i.e., multiple views) using a feature-decomposition method. In the decomposition process, the strategy inevitably results in some loss of information. To avoid this drawback, this paper considered feature-transformation methods, rather than using the decomposition method, to obtain the multiple views. More specifically, in the feature-transformation method, a number of views were obtained from the entire feature set using the same number of different mapping functions. After deriving the number of views of the data, each of the views was used for measuring corresponding confidences, for first evaluating examples to be selected. Then, all the confidence levels measured from the multiple views were combined as a weighted average for deriving a target confidence. The experimental results, which were obtained using support vector machines for well-known benchmark data, demonstrate that the proposed mechanism can compensate for the shortcomings of the traditional strategies. In addition, the results demonstrate that when the data is transformed appropriately into multiple views, the strategy can achieve further improvement in results in terms of classification accuracy. (C) 2017 Elsevier B.V. All rights reserved.</P>"
An Efficient Vision-based Object Detection and Tracking using Online Learning,2017,"['Object detection', 'object tracking', 'semi-supervised learning', 'real-time processing']",,"In this paper, we propose a vision-based object detection and tracking system using online learning. The proposed system adopts a feature point-based method for tracking a series of inter-frame movement of a newly detected object, to estimate rapidly and toughness. At the same time, it trains the detector for the object being tracked online. Temporarily using the result of the failure detector to the object, it initializes the tracker back tracks to enable the robust tracking. In particular, it reduced the processing time by improving the method of updating the appearance models of the objects to increase the tracking performance of the system. Using a data set obtained in a variety of settings, we evaluate the performance of the proposed system in terms of processing time."
"To Be Conservative as a Disposition of Education: Familiarity, Freedom and Learning from the Perspective of Michael Oakeshott",2017,"['익숙함', '보수적 성향', '행위 전통', '자유', '실용교육', '자유교육', 'familiarity', 'the conservative disposition', 'tradition of behaviour', 'freedom', '‘vocational education’', 'liberal learning']",,"Purpose: The purpose of this study is chiefly to interpret and clarify a traditionally notion of the conservative disposition concealed in liberal education by reviewing three basic concepts—familiarity, freedom and learning—from the perspective of Michael Oakeshott. Method: Firstly, we discover that there are two intractable crises in education on account of the observation of history and current situations. The first relates to the sustainability of the conservative disposition and the second to the invitation of liberal learning. They are organically interconnected in that the realisation of the latter, in a way, relies on a response to the acquisition of the former. Secondly, we define familiarity as a characteristic of the conservative disposition that derives from the enjoyment of “the present” through an examination of complex social conditions. Familiarity is the basis of a conservative disposition that runs through the whole tradition of behaviour, or rather the tradition of morality derives its inheritance as a way of understanding education. Thirdly, we systematically expound that the conservative disposition as an essential component of education activities is supposed not only to provide the basis for educational enterprise but to play a role that involves a relationship between teachers and students. Fourthly, we emphasize the pivotal role of the conservative disposition not only in restraining the hegemony of the pragmatic modes of education but in providing a strong guarantee for realizating the invitation of liberal education by criticizing ‘vocational education’. Results: Finally, we put forward the conservative disposition of freedom as a reflective consciousness that plays an irreplaceable role in supervising and advancing the development of liberal learning by virtue of Oakeshott’s perception of freedom. Conclusion: The discussion of Oakeshott’s concept of the conservative disposition, which deepens the importance and necessity of liberal education, can furtherly make a contribution to the re-establishment for the orientation of educational activities, as well as for the trusting relationship between learners and teachers in modern education."
Simultaneous Kernel Learning and Label Imputation for Pattern Classification with Partially Labeled Data,2017,"['Kernel learning', 'Semi-supervised learning', 'Pattern classification', 'Optimization']",,"The kernel function plays a central role in modern pattern classification for its ability to capture the inherent affinity structure of the underlying data manifold. While the kernel function can be chosen by human experts with domain knowledge, it is often more principled and promising to learn it directly from data. This idea of kernel learning has been studied considerably in machine learning and pattern recognition. However, most kernel learning algorithms assume fully supervised setups requiring expensive class label annotation for the training data. In this paper we consider kernel learning in the semi-supervised setup where only a fraction of data points need to be labeled. We propose two approaches: the first extends the idea of label propagation along the data similarity graph, in which we simultaneously learn the kernel and impute the labels of the unlabeled data. The second aims to minimize the dual loss in the support vector machines (SVM) classifier learning with respect to the kernel parameters and the missing labels. We provide reasonable and effective approximate solution methods for these optimization problems. These approaches exploit both labeled and unlabeled data in kernel leaning, where we empirically demonstrate the effectiveness on several benchmark datasets with partially labeled learning setups."
Simultaneous Kernel Learning and Label Imputation for Pattern Classification with Partially Labeled Data,2017,"['Kernel learning', 'Semi-supervised learning', 'Pattern classification', 'Optimization']",,"The kernel function plays a central role in modern pattern classification for its ability to capture the inherent affinity structure of the underlying data manifold. While the kernel function can be chosen by human experts with domain knowledge, it is often more principled and promising to learn it directly from data. This idea of kernel learning has been studied considerably in machine learning and pattern recognition. However, most kernel learning algorithms assume fully supervised setups requiring expensive class label annotation for the training data. In this paper we consider kernel learning in the semi-supervised setup where only a fraction of data points need to be labeled. We propose two approaches: the first extends the idea of label propagation along the data similarity graph, in which we simultaneously learn the kernel and impute the labels of the unlabeled data. The second aims to minimize the dual loss in the support vector machines (SVM) classifier learning with respect to the kernel parameters and the missing labels. We provide reasonable and effective approximate solution methods for these optimization problems. These approaches exploit both labeled and unlabeled data in kernel leaning, where we empirically demonstrate the effectiveness on several benchmark datasets with partially labeled learning setups."
Deep Neural Network Self-training Based on Unsupervised Learning and Dropout,2017,"['Neural network', 'Pre-training', 'Semi-supervised learning', 'Self-training', 'Dropout']",,"In supervised learning methods, a large amount of labeled data is necessary to find reliable classification boundaries to train a classifier. However, it is hard to obtain a large amount of labeled data in practice and it is time-consuming with a lot of cost to obtain labels of data.Although unlabeled data is comparatively plentiful than labeled data, most of supervised learning methods are not designed to exploit unlabeled data. Self-training is one of the semisupervised learning methods that alternatively repeat training a base classifier and labeling unlabeled data in training set. Most self-training methods have adopted confidence measures to select confidently labeled examples because high-confidence usually implies low error.A major difficulty of self-training is the error amplification. If a classifier misclassifies some examples and the misclassified examples are included in the labeled training set, the next classifier may learn improper classification boundaries and generate more misclassified examples. Since base classifiers are built with small labeled dataset and are hard to earn good generalization performance due to the small labeled dataset. Although improving training procedure and the performance of classifiers, error occurrence is inevitable, so corrections of self-labeled data are necessary to avoid error amplification in the following classifiers. In this paper, we propose a deep neural network based approach for alleviating the problems of self-training by combining schemes: pre-training, dropout and error forgetting. By applying combinations of these schemes to various dataset, a trained classifier using our approach shows improved performance than trained classifier using common self-training"
Deep Neural Network Self-training Based on Unsupervised Learning and Dropout,2017,"['Neural network', 'Pre-training', 'Semi-supervised learning', 'Self-training', 'Dropout']",,"In supervised learning methods, a large amount of labeled data is necessary to find reliable classification boundaries to train a classifier. However, it is hard to obtain a large amount of labeled data in practice and it is time-consuming with a lot of cost to obtain labels of data. Although unlabeled data is comparatively plentiful than labeled data, most of supervised learning methods are not designed to exploit unlabeled data. Self-training is one of the semisupervised learning methods that alternatively repeat training a base classifier and labeling unlabeled data in training set. Most self-training methods have adopted confidence measures to select confidently labeled examples because high-confidence usually implies low error. A major difficulty of self-training is the error amplification. If a classifier misclassifies some examples and the misclassified examples are included in the labeled training set, the next classifier may learn improper classification boundaries and generate more misclassified examples. Since base classifiers are built with small labeled dataset and are hard to earn good generalization performance due to the small labeled dataset. Although improving training procedure and the performance of classifiers, error occurrence is inevitable, so corrections of self-labeled data are necessary to avoid error amplification in the following classifiers. In this paper, we propose a deep neural network based approach for alleviating the problems of self-training by combining schemes: pre-training, dropout and error forgetting. By applying combinations of these schemes to various dataset, a trained classifier using our approach shows improved performance than trained classifier using common self-training."
Nonlinear machine fault detection by semi-supervised Laplacian Eigenmaps,2017,"['Semi-supervised Laplacian Eigenmaps', 'Fault detection', 'Feature extraction', 'Manifold learning']",,"A semi-supervised Laplacian Eigenmaps algorithm for machine fault detection is proposed. The purpose of the algorithm is to efficiently extract the manifold geometric characteristics of nonlinear vibration signal samples, and to determine fault classification of operating equipment so that the accuracy of fault detection can be improved. The data acquisition and pre-processing of the vibration signal is firstly implemented from monitoring equipment, then hybrid domain feature is obtained, and the initial sample set can be built. This is followed by implementing the semi-supervised Laplacian Eigenmaps algorithm so that the sensitive nature characteristics of manifold can be obtained from the device initial sample set. In order to establish the intelligent diagnostic model, the Least square Support vector machine (LS-SVM) is then adopted, which fault diagnosis and decisions can be achieved in the feature space of the low-dimensional manifold. The experiment results of using the IRIS data, gearbox and compressor fault data show the proposed method has more advantage when compared with the PCA and Laplacian Eigenmaps on improving the accuracy of fault detection."
Wine Quality Evaluation Using Machine Learning Algorithms,2017,"['wine quality', 'machine learning', 'supervised learning', 'linear regression', 'gradient descent.']",,"There are many prediction systems available for problems like stock exchange, medical diagnosis, insurance calculation, etc. Wine Quality is one area where there is a big opportunity to recommend a good quality of wine to users based on their preferences as well as in historical data. This paper describes the work to learn and assess whether a given wine sample is of good quality or not. The use of machine learning techniques specifically the linear regression with stochastic gradient descent were explored, and the features that perform well on this classification were engineered. The main aim is to develop a cost-effective system to acquire knowledge using data analysis through machine learning algorithms to predict the quality of wine in a better way."
준감독 학습과 공간 유사성을 이용한 비접근 지역의 작물 분류 - 북한 대홍단 지역 사례 연구 -,2017,"['Classification', 'Crop', 'North Korea', 'Semi-supervised learning']",,"In this paper, a new classification method based on the combination of semi-supervised learning with spatial similarity of adjacent pixels is presented for crop classification in inaccessible areas. Iterative classification based on semi-supervised learning is applied to extract reliable training data from both the initial classification result with a small number of training data, and classification results of adjacent pixels are also considered to extract new training pixels with less uncertainty. To evaluate the applicability of the proposed method, a case study of the classification of field crops was carried out using multi-temporal Landsat-8 OLI acquired in the Daehongdan region, North Korea. From a case study, the misclassification of crops and forests, and isolated pixels in the initial classification result were greatly reduced by applying the proposed semi-supervised learning method. In addition, the combination of classification results of adjacent pixels for the extraction of new training data led to the great reduction of both misclassification results and isolated pixels, compared to the initial classification and traditional semi-supervised learning results. Therefore, it is expected that the proposed method would be effectively applied to classify areas in which it is difficult to collect sufficient training data."
한국 간호학생의 간호실무에 대한 교내학습과 현장학습의 차이 경험,2017,"['간호교육', '간호학생', '임상실습', '질적 연구', '학습', 'learning', 'nursing education', 'nursing students', 'practical nursing', 'qualitative research']","본 연구는 간호학생의 견지에서 본 간호실무에 대한 교내학습과 현장학습의 차이 경험을 파악하고자 실시하였다. 연구 참여자는 일개 광역시와 일개 도에 소재한 4개 대학교의 간호학과에 재학 중이며, 임상실습을 1학기 이상 이수한 간호학생 총 14명으로, 자료는 더 이상 새로운 자료가 도출되지 않고 포화상태에 도달했을 때까지 일대일 심층 면담으로 수집하였다. 자료수집기간은 2014년 12월 1일부터 2015년 5월 27일까지였고, 자료 분석은 질적 내용분석 방법을 이용하였다. 본 연구 결과 4개 주 제와 13개 범주가 도출되었고, 주제는 ‘이상적 간호사상과는 먼 부정적 간호사상의 생성’, ‘지식부족과 자기 확신 부족으로 정확한 간호지식을 재확인함’, ‘혼돈과 회의감을 넘어 간호현실 수용하기’, ‘전문인으로의 점진적 발전을 희망함’이었다. 따라서 간호학생은 교내학습과 현장학습의 차이를 경험했을 때 간호전문직 가치와 윤리,  전문직 정체성의 혼란과 같은 심리적 스트레스와 간호사상의 변화로 인해 학습전이의 장애를 경험하였다. 따라서 교내학습과 현장학습의 차이를 줄이기 위해 대학의 교수와 임상현장 간호사는 최신의 실무지식을 습득하고, 체계적인 현장학습이 되도록 임상 학습 환경을 조성하고, 협력하는 것이 필요하다.","This study was to investigate Korean nursing students’ experience of the gap between classroom based and clinical based learning for nursing practice. Data were collected from 14 participants who were junior and senior nursing students experienced clinical practice from the four school of nursing located in one metropolitan city and one province of Korea. In-depth inter views were undertaken. Qualitative data were analyzed using content analysis. Four themes and thirteen categories emerged from the qualitative data. From the students  eyes, ‘generation of negative images of nurse that are far cry from ideal nursing’, ‘reconfirmation of nursing know ledge due to lack of know ledge and lack of confidence’, ‘Accepting nursing realities beyond confusion and skepticism’, ‘hopes for gradual development as a professional’ were considered as experience of the gap between classroom based and clinical based learning for nursing. They experienced barriers of learning transfer as a result of changing images of nurse and a variety of psychological stress in the clinical setting. A university faculty and a clinical nurse have to be updated with current know ledge and practice in the field, supervise their students’ clinical based learning with development of education system, and collaborate on clinical learning environment to close the gap between classroom based and clinical based learning."
기계학습을 이용한 기록 텍스트 자동분류 사례 연구,2017,"['자동분류', '인공지능', '지도학습', '분류체계', '한국전자통신연구원 엑소브레인', '기계학습', 'automatic classification', 'artificial intelligence', 'supervised learning', 'classification scheme', 'ETRI Exobrain', 'machine learning']",기록이나 문헌의 자동분류에 관한 연구는 오래 전부터 시작되었다. 최근에는 인공지능 기술이 발전하면서 기계학습이나 딥러닝을 접목한 연구로 발전되고 있다. 이 연구에서는 우선 문헌의 자동분류와 인공지능의 학습방식이 발전해 온 과정을 살펴보았다. 또 기계학습 중 특히 지도학습 방식의 특징과 다양한 사례를 통해 기록관리 분야에 인공지능 기술을 적용해야 할 필요성에 대해 알아보았다. 그리고 실제로 지도학습 방식으로 서울시의 결재문서를 ETRI의 엑소브레인을 통해 정부기능분류체계로 자동분류해 보았다. 이를 통해 기록을 다양한 방식의 분류체계로 자동분류하기 위한 각 과정의 고려사항을 도출하였다.,"Research on automatic classification of records and documents has been conducted for a long time. Recently, artificial intelligence technology has been developed to combine machine learning and deep learning. In this study, we first looked at the process of automatic classification of documents and learning method of artificial intelligence. We also discussed the necessity of applying artificial intelligence technology to records management using various cases of machine learning, especially supervised methods. And we conducted a test to automatically classify the public records of the Seoul metropolitan government into BRM using ETRI’s Exobrain, based on supervised machine learning method. Through this, we have drawn up issues to be considered in each step in records management agencies to automatically classify the records into various classification schemes."
