title,date,keywords,abstract,multilingual_abstract
동아시아에서 헌법재판의 현황 및 문제점과 그 시사점,2017,"['헌법재판제도', '분산형', '집중형', '사법심사제', '헌법감독제도', '규범통제절차의 일원화', '재판소원제도', 'Constitutional adjudication system', 'Decentralized model', 'Centralized model', 'Consitutional supervision', 'Constitutional control over the judgments of the ordinary courts']","오늘날 개별국가의 헌법재판제도는 크게 미국식의 분산형(decentralized model)과 유럽식의 집중형 (centralized model)으로 나눌 수 있는데, 이는 이론적 제도적인 타당성의 문제가 아니라 개별국가의 특수성을 고려한 헌법정책적인 선택의 문제이다.  동아시아 국가의 경우 유사한 법 전통, 사법체계, 법관구조를 가지고 있음에도 불구하고 서로 다른 유형의 헌법재판제도를 선택하여 운용하고 있다. 그 과정에서 제도의 문제점도 각기 다르게 나타나고 있지만, 이들 국가 모두 국민의 기본권 의식이 강화됨에 따라 헌법재판기능의 정상화 및 활성화로 방향을 설정하고 다양한 제도개선의 방안을 검토하고 있다. 일본의 경우 직업법관제의 토대에서 분산형제도가 갖는 사법심사의 소극성 및 기본권 구제의 장기화라는 문제를 해결하기 위해 최고재판소 내에 헌법재판전담부를 설치하는 방안과 헌법재판을 담당하는 독립된 사법기관을 설치하는 방안을 두고 그 장단점을 검토하는 등 개선방향을 모색하고 있다. 중국은 국민의 기본권 의식의 확대와 법치주의의 정착에 대한 국내외의 요구에 직면하여 기존의 정치적 헌법감독제도(constitutional supervision)에서 벗어나 독립성과 전문성을 갖춘 헌법감독제도 또는 사법절차를 통한 헌법재판제도의 도입에 대해 고민하고 있다. 몽골과 대만 역시 기존의 집중형과 분산형의 제도근간을 유지하면서, 몽골의 경우에는 사회주의헌법 전통의 정치적 헌법재판기관의 잔재를 일소하고 사법절차를 통한 명실상부한 사법형의 헌법재판소로 심판의 유형과 절차를 재정비하는 것으로, 대만의 경우에는 헌법제정자의 원래 의지에 따라 분산형제도의 본질에 부합하도록 사법원(Judicial Yuan)의 상고심기능과 헌법해석기능을 정상화하는 것으로 제도개선 방안을 마련하고 있다.  한국의 경우에도 헌법재판기능의 정상화 및 활성화라는 제도개선의 방향에 대해서는 이론이 있을 수 없을 것이다. 현행 헌법재판제도를 거의 30년간 운용하면서 드러난 문제점과 그 개선방안도 바로 헌법재판기능의 정상화 및 활성화의 방향으로 귀결되기 때문이다. 다만 우리의 경우에는 약 70여년에 이르는 동안의 다양한 헌법재판제도의 운용과 잘못된 제도선택으로 인한 시행착오를 엄청난 대가를 치르고 경험한 것에서 이들 국가들과는 상당한 차이가 있다. 이와 같은 이유에서 현행의 집중형제도를 버리고 분산형제도로 되돌아가자는 개선방안은 전혀 설득력이 없다. 오히려 헌법재판기능의 정상화 및 활성화의 차원에서 집중형제도의 본질에 충실하게 규범통제권한을 일원화하고, 법원의 재판에 대한 헌법소원을 허용하는 개선방안에 대해서는 전향적인 검토가 필요한 시점이다. 이로써 국가의 총체적인 규범상태에 대한 헌법적 통제와 국민 생활의 모든 영역으로 헌법의 가치와 규범력을 미치게 하여야 할 것이다.","The constitutional adjudication systems of individual countries in today""s world can be broadly classified into two systems, namely the decentralized model of America and the centralized model of Europe. It, however, is not a matter of theoretical and institutional validity, but a matter of constitutional choice reflecting the different circumstances of each country.  In the East Asian countries, the different types of constitutional adjudication system have been chosen and developed even though they have similar legal traditions and judicial systems. In the process, they have faced various challenges, but they have consistently moved towards the direction of normalization and revitalization of their constitutional adjudication systems as they have more realized the importance of the fundamental rights in their constitutions. They have examined and tried various ways of improving their constitutional adjudication systems.  In the case of Japan, in order to overcome the problems of long and passive nature of decentralized constitutional review, it is discussed that the separate chamber within the Supreme Court or the independent Constitutional Court should be set up in oder to deal with the consitutional matters. In the face of domestic and international demands for the protection of human rights and the rule of law, China is also moving away from the existing political consitutional supervision and considering to introduce the constitutional review by the judiciary or establish an independent and specialized institution for constitutional supervision. Mongolia and Taiwan also maintain the existing centralized and decentralized institutional system respectively, while in Mongolia, the political constitutional tradition of the socialist constitutional tradition has been cleared away and the independent Constitutional Court was set up and in Taiwan, there has been a plan to improve the system by normalizing the functions of the Judicial Yuan in interpreting the Constitution.  In the case of Korea, there is no doubt for the general direction of improving the constitutional adjudication system by normalizing and revitalizing the system since the problem that has been revealed while running the present constitutional adjudication system for almost 30 years and its improvement plan are said so. In our case, however, there is a big difference from the experiences of other countries as we have learned from a great deal of trials and errors from choosing the wrong systems in the past over about 70 years before the current system was finally adopted in 1987. For this reason, it is absolutely incomprehensible to discard the current centralized model and return to the old system of the decentralized model. On the contrary, it is necessary to more develop the current system by allowing the constitutional control over the judgments of the ordinary courts which is not possible in our current system. This should lead to improve the fundamental rights of people which are enshrined in our Constitution by allowing the constitutional control over all spheres of government power."
2015 개정 교육과정의 역량 구현 양상과 실천 요인에 관한 교육과정 선도교원의 의견 분석 및 논의,2017,"['2015 개정 교육과정', '핵심역량', '교과역량', '교육과정 개발', '수업 개선', '선도교원', '2015 revised national curriculum', 'key competency', 'subject competency', 'curriculum development', 'improvement of teaching and learning', 'leading teacher']",,"The purpose of this study is to analyze leading teachers` opinions on key competencies and subject competencies presented in the 2015 revised national curriculum and to draw implications for competency-based curriculum development and implementation. The research findings show that leading teachers are generally positive about the introduction of key competencies, subject competencies setting and its feasibility and recognize that the key competencies are highly related to the subject competencies of each subject. However, it is judged that the key competencies and subject competencies are not embodied well in every aspect of the curriculum documents. They also recognize that in the practice of competency education, supporting the development of teachers` ability to conduct student-centered classes in a culture that enables voluntary research efforts of the teacher community can be the biggest issue rather than external support such as development of competency-centered textbooks or consulting and supervision. Finally, we propose the need for support and policy that enable voluntary efforts for interdisciplinary cooperation and strengthening teacher capacity rather than developing competency-centered textbooks; specification of competency education in educational content, pedagogical methods and assessment; reconsideration of subject competencies setting; maintaining the relationship between key competency and items that guide educational goals."
조선 후기 지식인의 李光地 수용과 비판,2017,"['이광지', '주역절중', '주자학', '정조', '강희제', '이단설', 'Lee Guang-Ji', 'Zhōuyìzhézhōng', 'Orthodox Neo-Confucianism', 'King Jung-Jo', 'Emperor Kangxi', 'Heresy']","조선 후기 학풍을 이해하기 위해서는 그에 일정한 영향력을 행사한 명말청초 학술 수용에 대한 연구가 필요하다. 李光地(1642～1718)는 강희 연간 학계의 핵심인물로서 당대 쟁쟁한 학자들과 교유하고 각종 사업을 주관한 인물이기 때문에 청나라 연구동향에 주목하던 조선 지식인이 큰 관심을 가진 바 있다. 그러므로 이광지에 대한 조선 학계의 인식은 명말청초 학설이 조선 후기 학계에 미친 영향을 해명하는 유용한 단서가 될 것이다.이광지의 학설이 유입되었을 때 조선 지식인은 주자학 연구서 편찬을 주관한 이력에 주목하고 그 성과를 긍정적으로 받아들였다. 이광지가 추구한 연구목표, 주자서 정본화 작업은 매우 설득력 있는 것이었다. 주자학 연구가 심화된 조선 학계에서 그러한 성과를 호평하고 수용한 것은 자연스러운 일이었다.하지만 곧 이광지에 대한 비판이 제기된다. 이광지의 행적이 이민족 통치 합리화 작업과 밀접한 관련이 있기에 중화중심의 위계질서를 추구하는 주자학의 취지와는 거리가 멀다고 느꼈던 것이다. 그에 대한 반감은 곧 이광지 학설 비판으로 이어진다. 이광지의 이설이 주자학의 취지에 반하는 이단성을 갖고 있었기 때문이다. 그와 관련하여 정약용은 서양의 기하학 이론을 수용하고 주자가 수용한 卦變說을 폐지한 이광지의 易學을 비판하였고, 김매순은 왕수인의 『古本大學』 체제를 따른 이광지의 大學說을 힐난하였다. 이것이 반유가적 행적과 결부되면서 이광지에 대한 부정적인 여론이 형성되는 데 일정한 작용을 하였다.","To understand the academic traditions in the late Joseon Dynasty, it is necessary for students to understand about the scholars who pulled the strings during the late Ming and the early Qing dynasties. Lee guang ji was a point man to Emperor Kangxi as he was not only supervising many projects but also carried out academic exchanges with famous scholars in that time. Joseon scholars which focused on trend of Qing dynasty's researchs took a profound interest in him. Therefore, to appreciate the importance of Lee guang ji in late Joseon Dynasty is useful to explain his influence over the academic circles during the late Ming and early Qing dynasties. When Lee's theory came in, Joseon scholars took note of his work, the leading compilation of research paper of Orthodox neo-confucianism, and looked on the positive side of his work.Lee's theory was very compelling work both his target of study and to make Neo-Confucian authentic. It is little wonder that joseon scholars accepted his work with favorable comment because it deepened scholar´s knowledge of Orthodox neo-confucian in Joseon's academia. However, there has also been criticism of Lee's theory in present times. His version of the past was far from the purpose of original Neo-Confucian as he used the ideology to rationalize ruling by the barbarians. It has created hostility and criticism of his theory because his theory was regarded as a hearsay. Lee's opinion of 'Classic of Changes' and 'Great Learning' would be criticized for these reason by Jeong Yak-Yong and Kim Mae-Soon. As a result of those things, negative publicity of his work was because of his version of the past."
Multi-Level and Multi-Scale Feature Aggregation Using Pretrained Convolutional Neural Networks for Music Auto-Tagging,2017,,,"<P>Music auto-tagging is often handled in a similar manner to image classification by regarding the two-dimensional audio spectrogram as image data. However, music auto-tagging is distinguished from image classification in that the tags are highly diverse and have different levels of abstraction. Considering this issue, we propose a convolutional neural networks (CNN)-based architecture that embraces multi-level and multi-scaled features. The architecture is trained in three steps. First, we conduct supervised feature learning to capture local audio features using a set of CNNs with different input sizes. Second, we extract audio features from each layer of the pretrained convolutional networks separately and aggregate them altogether giving a long audio clip. Finally, we put them into fully connected networks and make final predictions of the tags. Our experiments show that using the combination of multi-level and multi-scale features is highly effective in music auto-tagging and the proposed method outperforms the previous state-of-the-art methods on the MagnaTagATune dataset and the Million Song Dataset. We further show that the proposed architecture is useful in transfer learning.</P>"
거리기반 후보군 선정과 인공신경망을 결합한 가스생산량 히스토리매칭,2017,"['Artificial neural network', 'Distance-based clustering', 'History matching', 'Gas production', '인공신경망', '거리기반 군집화', '히스토리매칭', '가스생산량']","이 연구에서는 거리기반 후보군 선정법을 인공신경망과 결합하여 생산 히스토리매칭을 수행하고, 생산추이 를 신뢰도 높게 예측하는 기법을 개발하였다. 생산추이를 입력층으로 한 역산모델 인공신경망을 구성하고, 거리기반 군집화를 통해 실제 생산자료와 유사한 추이를 보이는 후보모델을 인공신경망의 학습집단으로 활용하여 지도학습효 과를 개선하였다. 4개의 수압파쇄대를 갖는 셰일가스전에서 2년간 생산이력을 히스토리매칭하여 향후 3년간의 생산 이력을 예측하였다. 인공신경망 학습을 통해 매칭한 학습집단의 일가스생산량 오차는 초기 29.2%에서 마지막 세대 에는 4.3%로 개선되었다. 최적해는 참값과 비교하여 일가스생산량은 1.2%, 총생산량은 0.7%의 오차를 보였다. 최적 해를 이용한 민감도 분석결과, 모암의 공극률과 유체투과도가 생산추이예측에 민감하였다. 이 연구의 유사생산추이 후보군을 이용한 인공신경망 학습능력 개선기술은 효율적인 저류층 특성화와 신뢰도 높은 생산량 예측기법으로 활 용할 수 있다.","This paper presents a reliable history matching method that improves supervised-learning performances of an artificial neural network using the candidate models selected by distance-based clustering. The artificial neural network is used as an inverse method instead of a proxy model. The reservoir models within the cluster containing the true dataset update the training module. The developed method matches 2-year production histories and then estimates 3-year performances followed at shale gas reservoirs. The training performance improves the mean absolute error of daily gas rates from 29.2% to 4.3% while the optimum solutions, obtained by k-medoids clustering, show about 1.2% error of daily gas rates and 0.7% error of total production. The sensitivity analysis made by the optimal solutions reveals that the matrix porosity and its permeability influence the shale-gas production. The developed approach is able to estimate unknown production rates with reliable predictability."
A neural-based predictive model of the compressive strength of waste LCD glass concrete,2017,"['waste LCD concrete', 'compressive strength', 'back propagation neural networks', 'multivariable regression analysis', 'input variable strategy']",,"The Taiwanese liquid crystal display (LCD) industry has traditionally produced a huge amount of waste glass that is placed in landfills. Waste glass recycling can reduce the material costs of concrete and promote sustainable environmental protection activities. Concrete is always utilized as structural material; thus, the concrete compressive strength with a variety of mixtures must be studied using predictive models to achieve more precise results. To create an efficient waste LCD glass concrete (WLGC) design proportion, the related studies utilized a multivariable regression analysis to develop a compressive strength waste LCD glass concrete equation. The mix design proportion for waste LCD glass and the compressive strength relationship is complex and nonlinear. This results in a prediction weakness for the multivariable regression model during the initial growing phase of the compressive strength of waste LCD glass concrete. Thus, the R ratio for the predictive multivariable regression model is 0.96. Neural networks (NN) have a superior ability to handle nonlinear relationships between multiple variables by incorporating supervised learning. This study developed a multivariable prediction model for the determination of waste LCD glass concrete compressive strength by analyzing a series of laboratory test results and utilizing a neural network algorithm that was obtained in a related prior study. The current study also trained the prediction model for the compressive strength of waste LCD glass by calculating the effects of several types of factor combinations, such as the different number of input variables and the relevant filter for input variables. These types of factor combinations have been adjusted to enhance the predictive ability based on the training mechanism of the NN and the characteristics of waste LCD glass concrete. The selection priority of the input variable strategy is that evaluating relevance is better than adding dimensions for the NN prediction of the compressive strength of WLGC. The prediction ability of the model is examined using test results from the same data pool. The R ratio was determined to be approximately 0.996. Using the appropriate input variables from neural networks, the model validation results indicated that the model prediction attains greater accuracy than the multivariable regression model during the initial growing phase of compressive strength. Therefore, the neural-based predictive model for compressive strength promotes the application of waste LCD glass concrete."
집단상담 수업 경험에 대한 학습자의 인식,2017,"['집단상담', '집단상담 수업', '학습자', '내용', '방법', '성과', 'group counseling', 'group counseling class', 'learner', 'contents', 'method', 'educational outcomes']","이 연구는 대학원 학위 과정에 개설된 집단상담 수업에 참여한 대학원생들을 대상으로 학습자들이 인식하는 긍정적인 수업의 내용 요소와 방법 요소, 그리고 성과에 대한 내용을 살펴보는 것을 목적으로 한다. 이를 위해 전국 10여개 대학의 대학원에 재학 중인 상담 및 상담 관련 전공 대학원생을 대상으로 2016년 6월∼9월의 기간 동안 온라인 설문조사를 실시하였다. 자료 분석은 CQR-M의 방법으로 실시하였으며 2016년 10월∼2017년 1월에 걸쳐 최종적으로 106명의 자료가 분석되었다. 주요 연구 결과는 다음과 같다. 첫째, 집단상담 수업의 내용 요소 중 학습자들이 긍정적으로 인식하는 내용은 집단상담 관련 지식, 집단 운영 기술, 집단상담자 자질 및 윤리의 3가지 범주로 나타났다. 둘째, 집단상담 수업의 형식 요소 중 학습자들이 긍정적으로 인식하는 수업 방법은 집단상담 이론 학습방법, 간접실습방법, 직접실습방법, 그리고 수퍼비전의 4가지 범주로 나타났다. 셋째, 학습자들이 인식하는 수업의 성과는 개인내적변화, 집단에 대한 신뢰 형성 및 심화, 전문성 함양이라는 3가지 범주로 나타났다. 이와 같은 연구결과는 교육의 수요자가 되는 학습자들의 인식을 통해 상담자 교육과정에 반영할 수 있는 구체적인 시사점을 제공하였다는 의의를 지닌다.","The purpose of this study is to examine the content elements, method elements, and outcomes of positive instruction that learners perceive of graduate students who participated in group counseling class. To accomplish this purpose, an online questionnaire was conducted for graduate students attending graduate schools in 10 universities nationwide from June to September 2016, and the data of 106 students were analyzed by the CQR-M method from Octorber 2016 to January 2017. The main results are as follows. First, among contents elements of group counseling class, positively perceived contents were classified into three categories of group counseling knowledge, group operation skill, group counselor qualification and ethics. Second, among the form factors of group counseling class, the lessons that the learners perceive positively appeared as the four categories of group counseling theory learning method, indirect practice method, direct practice method, and supervision. Third, the outcomes of the lessons recognized by learners were classified into three categories: individual internal change, trust formation and deepening of group, and professionalism. The results of this study are meaningful that they provided specific implications that can be reflected in the curriculum of counselors through the perception of learners who are the consumers of education."
