title,date,keywords,abstract,multilingual_abstract
드론과 이미지 분석기법을 활용한 구조물 외관점검 기술 연구,2017,"['구조물 외관 검사', '드론', '자동비행항법', '딥러닝 이미지 분석', '모폴로지 기법', 'visual inspection', 'drone', 'automatic flight navigation', 'deep learning image analysis', 'morphology method']","이 연구는 사회 기반 구조물의 노후화에 대한 안전점검 기술분야에서 구조물 외관점검 기술의 효율적 대안에 관한 연구이다. 기존 육안점검 및 조사를 대신하여 산업용 드론과 딥 러닝기반의 이미지 분석 기법을 접목함으로써 막대한 인력과 시간소요 및 비용을 절감하고 높은 구역 및 돔 구조물의 접근 한계를 극복하고자 하였다. 구조물의 0.3mm 이상의 균열 손상을검지할 수 있는 고 해상도 카메라와 라이다 센서, 임베디드이미지 프로세서 모듈로 구성된 탑재체를 제작하여 산업용 드론에 탑재하였다. 이를 현장 시험에 적용하여 자동비행항법을통해 시편의 손상 이미지를 촬영하였다. 또한 균열경을 이용하여 기존 육안 점검 방법으로 백태, 박리박락과 같은 면적형손상과 선형 손상인 균열의 폭과 길이를 측정하여 최종 이미지분석 검출 결과와 비교하고자 하였다. 촬영된 이미지 중 80장의 샘플을 골라 이미지 분석 기법을 적용하여 사전처리작업(pre-processing)-분리작업(segmentation)-특징점 추출작업(feature extraction)-분류 작업(Classification)-지도학습작업(supervised learning) 등의 과정을 거쳐 손상을 분리하고, 이를 딥러닝 기반 플랫폼으로 지도학습하여 분석 파라미터를 추출하였다. 지도학습을 수행하지 않은 임의의 이미지샘플 60장을 신규로 추가하여 추출된 파라미터를 기반으로 이미지 분석을 수행한 결과, 손상 검출율의 90.5%로 나타났다.","The study is about the efficient alternative to concrete surface in the field of visual inspection technology fordeteriorated infrastructure. By combining industrial drones and deep learning based image analysis techniques withtraditional visual inspection and research, we tried to reduce manpowers, time requirements and costs, and to overcome theheight and dome structures. On board device mounted on drones is consisting of a high resolution camera for detectingcracks of more than 0.3 mm, a lidar sensor and a embeded image processor module. It was mounted on an industrialdrones, took sample images of damage from the site specimen through automatic flight navigation. In addition, the damegeparts of the site specimen was used to measure not only the width and length of cracks but white rust also, and tried upcompare them with the final image analysis detected results. Using the image analysis techniques, the damages of 54easample images were analyzed by the segmentation - feature extraction - decision making process, and extracted theanalysis parameters using supervised mode of the deep learning platform. The image analysis of newly addednon-supervised 60ea image samples was performed based on the extracted parameters. The result presented in 90.5 % ofthe damage detection rate."
영화 투자자를 위한 흥행성과 예측지표 발굴,2017,,"본 연구의 목적은 영화제작 초기 단계에 크라우드 펀딩(crowd funding) 등의 방식으로 영화에 투자하는 일반 투자자의 입장에서 의미 있는 투자지표를 발굴하는 것이다. 대표적인 지도학습(supervised learning) 데이터마이닝 기법인 의사결정나무, 회귀분석, 인공신경망을 활용하여 분석한 결과 의사결정나무모형에서는 장르, 등급, 실화 및 원작의 존재 여부, 배우파워가 흥행을 결정하는 주요 요인으로 도출되었고, 회귀분석모형에서는 배우파워, 등급(12세 이상/15세 이상 관람가), 장르(SF), 실화가 존재하는 영화의 흥행성과가 높은 것으로 나타났다. 또한 영화장르와 계절(개봉시기) 간의 상호작용효과 측면에서는 봄에 개봉된 사극, 공포, 로맨스 영화와 여름에 개봉된 액션, 범죄, 사극 영화, 가을에 개봉된 액션, 범죄, 사극, 로맨스 장르 영화의 흥행성과가 좋은 것으로 나타났다. 마지막으로 인공신경망 기법에서는 12개의 입력변수를 활용하여 예측력 87.7%의 모형이 도출되었다. 본 연구의 3가지 방법론으로부터 도출된 결과를 바탕으로 투자자가 영화산업에 투자할 경우 근거에 기반한 보다 합리적인 의사결정이 가능할 것으로 기대된다. 또한 본 연구는 투자 초기에 수집 가능한 정보만을 사용하여 영화의 흥행성과를 예측할 수 있는 지표를 발굴하였다는 측면에서 기존 연구와의 차별점을 갖는다.","The purpose of this study is to find meaningful investment indicators from the point of view of general investors who invest in movies in the early stage of making by way of crowd-funding. It is analyzed by using supervised learning techniques such as decision trees, regression, and ANN. As a result of the analysis, the decision tree model was derived as genre, grade, real story, presence of original work, and actor (star) power as the main variables that determine the box office. In the regression model, the actor power, grade (over 12 & 15 years old), genre (SF) and real story showed a significant positive value. In addition, the interaction between movie genres and seasons shows that the performances of drama, horror, romance released in the spring and action, crime, historical drama released in the summer and action, crime, historical drama, action released in the fall are good respectively. Finally, in the ANN, 12 input variables were used to derive a highly accurate model with a predictive power of 87.7%. Based on the results derived from the 3 methods of this study, it is expected that investors will make more reasonable decisions based on evidence when investing in the movie industry."
전력데이터 분석에서 이상점 추출을 위한 데이터 클러스터링 아키텍처에 관한 연구,2017,"['데이터 분석', '전력데이터', '비지도학습', '이상점', '주성분분석']","과거에는 전력데이터를 분석하는 기법으로 주로 기계학습의 지도학습 기법을 많이 활용하였고 데이터 마이닝 기법을 통한 패턴 검출을 주로 연구하였다. 그러나 전력데이터의 규모 커지고 실시간 데이터 공급이 가능해진 현재에는 과거의 데이터 분류 및 분석 기법을 통한 데이터 분석 연구는 한계가 존재한다. 이에 본 논문에서는 큰 규모의 전력데이터를 분석할 수 있는 클러스터링 아키텍처를 제안한다. 제안하는 클러스터링 프로세스는 비지도학습기법인 K-means 알고리즘의 문제점을 보완하고 전력데이터 수집과 분석까지의 모든 과정을 자동화할 수 있는 프로세스이다. 총 3 Level로 구분하여 Row Data Level, Clustering Level, User Interface Level로 구분하여 전력데이터를 분류 및 분석한다. 또한 클러스터링의 효율성 향상을 위하여 주성분분석 및 정규분포기반의 최적의 클러스터 수 K값 추출과 이상점으로 분류되는 데이터 감소를 위한 변형된 K-means 알고리즘을 제시한다.","In the past, researchers mainly used the supervised learning technique of machine learning to analyze power data and investigated the identification of patterns through the data mining technique. Data analysis research, however, faces its limitations with the old data classification and analysis techniques today when the size of electric power data has increased with the possible real-time provision of data. This study thus set out to propose a clustering architecture to analyze large-sized electric power data. The clustering process proposed in the study supplements the K-means algorithm, an unsupervised learning technique, for its problems and is capable of automating the entire process from the collection of electric power data to their analysis. In the present study, power data were categorized and analyzed in total three levels, which include the row data level, clustering level, and user interface level. In addition, the investigator identified K, the ideal number of clusters, based on principal component analysis and normal distribution and proposed an altered K-means algorithm to reduce data that would be categorized as ideal points in order to increase the efficiency of clustering."
중학교 내 자생적 교사학습공동체의 참여 요인 탐색,2017,"['사례 연구', '전문가학습공동체', '학교 내 교사학습공동체']","본 연구는 학교조직 내 교사학습공동체의 참여 요인을 탐색하는 데 목적이 있다. 이는 학교 문화와 학교풍토를 개선하기 위해 교사학습공동체의 중요성이 강조되고 있는 상황에서 교사학 습공동체를 적극적으로 형성하기 위한 구체적인 방안을 마련하기 위함이다. 자료 수집은 학교 내 자생적 교사학습공동체 구성원 8명을 대상으로 한 반구조화된 면담, 학교 내 메신저, 문서 를 통해 이루어졌다. 면담 자료는 이끄미교사의 경우 직접적 해석 방법을, 따르미교사의 경우 범주적 합산의 방법을 사용하여 분석한 후 연구참여자 점검을 통해 수정 및 보완되었다. 연구 결과, 교사학습공동체 형성과 관련하여 이끄미교사의 참여 요인은 수업 고충과 좋은 연수를 공유하고 싶은 마음, 수업철학의 중요성을 가르쳐주고 싶은 마음, 교사로서의 소명의 식, 수업 문화를 바꾸고 싶은 마음과 같은 개인적 요인과 관리자와 동료교사의 지원과 협조 라는 사회적 요인에서 비롯되었다. 따르미교사의 참여 요인은 자신의 수업에 대한 문제 인식, 수업에 대한 배움과 성장 욕구라는 개인적 요인, 동료교사와의 관계 발전, 유사한 교육관을 지닌 동료교사와의 소통, 이끄미교사의 영향력이라는 사회적 요인, 폐쇄적인 수업 문화, 형식 적인 장학 문화라는 조직적 요인에서 비롯되었다. 이를 통해 볼 때 첫째, 교사들의 자아실현 욕구를 격려하고 지원해 주는 방향으로 교사학습공동체가 운영되어야 한다. 둘째, 조직 차원 에서 이끄미교사의 출현을 위한 노력과 지원이 필요하다. 셋째, 교사학습공동체의 형성과 활 성화를 위한 학교장의 역량 제고가 필요하다. 넷째, 기존 학교문화의 개선 및 변화의 단초로 서 교사학습공동체에 주목할 필요가 있다.","The purpose of this study is to explore the factors that make forming spontaneous Teacher’s Learning Community in schools. This is due to the importance of Teacher’s Learning Community in improving school culture and school climate. Data collecting had been conducting by semi-structured interview on eight members of the spontaneous teacher’s learning community from a school, in-of-school messenger and various papers. The interview data was processed through ‘direct interpretation’ of the leading teacher, ‘categorical aggregation’ of seven following teachers, and ‘member checking’. As results of this study, the factors that lead to the formation of the leader's community are as follows. To share class pain and good training, to teach peers the importance of educational philosophy, to change class culture, the role of vocation as a teacher, and the principal's recommendation and encouragement. The factors that lead to the formation of the follower's community are as follows. Awareness of the problem of ones’ class, the need for growth in class, the need to develop relations with colleagues, the need for communication with peers who have similar educational values, the leader’s influence, closed class culture and formal supervision culture. Based on the findings, there are four focuses on the teacher’s learning community. First, operating the community in the direction of encouraging and supporting teachers’ self-realization. Secondly, Striving to grow a leading teacher at a school site. Thirdly, Striving to improve the principal’s competence for it. Fourthly, Striving for the revitalization of it as a beginning of school culture and climate enhancement."
머신 러닝을 이용한 영상 특징 기반 전기차 검출 및 분류 시스템,2017,"['Machine Learning', 'Supervised Learning', 'Vehicle Classification']",,"This paper proposes a novel way of vehicle detection and classification based on image features. There are two main processes in the proposed system, which are database construction and vehicle classification processes. In the database construction, there is a tight censorship for choosing appropriate images of the training set under the rigorous standard. These images are trained using Haar features for vehicle detection and histogram of oriented gradients extraction for vehicle classification based on the support vector machine. Additionally, in the vehicle detection and classification processes, the region of interest is reset using a number plate to reduce complexity. In the experimental results, the proposed system had the accuracy of 0.9776 and the F₁ score of 0.9327 for vehicle classification."
점진적 능동준지도 학습 기반 고효율 적응적 얼굴 표정 인식,2017,"['Active Semi-Supervised Learning', 'Facial Expression', 'Recognition', 'Deep Learning']",,
A CTR Prediction Approach for Text Advertising Based on the SAE-LR Deep Neural Network,2017,"['Deep Neural Network', 'Machine Learning', 'Text Advertising', 'SAE-LR']",,"For the autoencoder (AE) implemented as a construction component, this paper uses the method of greedy layer-by-layer pre-training without supervision to construct the stacked autoencoder (SAE) to extract the abstract features of the original input data, which is regarded as the input of the logistic regression (LR) model, after which the click-through rate (CTR) of the user to the advertisement under the contextual environment can be obtained. These experiments show that, compared with the usual logistic regression model and support vector regression model used in the field of predicting the advertising CTR in the industry, the SAE-LR model has a relatively large promotion in the AUC value. Based on the improvement of accuracy of advertising CTR prediction, the enterprises can accurately understand and have cognition for the needs of their customers, which promotes the multi-path development with high efficiency and low cost under the condition of internet finance."
A CTR Prediction Approach for Text Advertising Based on the SAE-LR Deep Neural Network,2017,"['Deep Neural Network', 'Machine Learning', 'Text Advertising', 'SAE-LR']",,"For the autoencoder (AE) implemented as a construction component, this paper uses the method of greedylayer-by-layer pre-training without supervision to construct the stacked autoencoder (SAE) to extract theabstract features of the original input data, which is regarded as the input of the logistic regression (LR)model, after which the click-through rate (CTR) of the user to the advertisement under the contextualenvironment can be obtained. These experiments show that, compared with the usual logistic regressionmodel and support vector regression model used in the field of predicting the advertising CTR in theindustry, the SAE-LR model has a relatively large promotion in the AUC value. Based on the improvement ofaccuracy of advertising CTR prediction, the enterprises can accurately understand and have cognition for theneeds of their customers, which promotes the multi-path development with high efficiency and low costunder the condition of internet finance."
"Text Classification for Patents: Experiments with Unigrams, Bigrams and Different Weighting Methods",2017,"['Data Mining', 'Patent Classification', 'Information Retrieval', 'Machine Learning', 'Support Vector Machine (SVM)', 'Supervised Weighting Scheme', 'Noun Phrase Extraction', 'Bag of Words']",,"Patent classification is becoming more critical as patent filings have been increasing over the years. Despite comprehensive studies in the area, there remain several issues in classifying patents on IPC hierarchical levels. Not only structural complexity but also shortage of patents in the lower level of the hierarchy causes the decline in classification performance. Therefore, we propose a new method of classification based on different criteria that are categories defined by the domain's experts mentioned in trend analysis reports, i.e. Patent Landscape Report (PLR). Several experiments were conducted with the purpose of identifying type of features and weighting methods that lead to the best classification performance using Support Vector Machine (SVM). Two types of features (noun and noun phrases) and five different weighting schemes (TF-idf, TF-rf, TF-icf, TF-icf-based, and TF-idcef-based) were experimented on."
"Text Classification for Patents : Experiments with Unigrams, Bigrams and Different Weighting Methods",2017,"['Data Mining', 'Patent Classification', 'Information Retrieval', 'Machine Learning', 'Support Vector Machine (SVM)', 'Supervised Weighting Scheme', 'Noun Phrase Extraction', 'Bag of Words']",,"Patent classification is becoming more critical as patent filings have been increasing over the years. Despite comprehensive studies in the area, there remain several issues in classifying patents on IPC hierarchical levels. Not only structural complexity but also shortage of patents in the lower level of the hierarchy causes the decline in classification performance. Therefore, we propose a new method of classification based on different criteria that are categories defined by the domain’s experts mentioned in trend analysis reports, i.e. Patent Landscape Report (PLR). Several experiments were conducted with the purpose of identifying type of features and weighting methods that lead to the best classification performance using Support Vector Machine (SVM). Two types of features (noun and noun phrases) and five different weighting schemes (TF-idf, TF-rf, TF-icf, TF-icf-based, and TF-idcef-based) were experimented on."
초등교사들이 수업을 하는 과정에서 주목하는 수업측면,2017,"['수업주목하기', '수업담화', '수업장학', '문화기술적 수업관찰법', 'teachers’ noticing', 'classroom discourse', 'instructional supervision', 'teacher culture', 'qualitative approach of classroom lesson', 'ethnography of classroom lesson']",,"The purpose of this study was to find out the features of lesson which elementary school teachers notice while teaching. The data were collected by 2 elementary school teachers’ lessons and classroom discourse which consists of initiation-response-evaluation/feedback interactional sequence were analysed with ethnographic method. The article concluded as follows: The categories which the teachers noticed were 1) students’ knowledge, understanding and thinking 2) sharing lesson contents and activities with students 3) students  encouragement andparticipation 4) classroom progress and management and 5) relationships between subject content and learning activities. Specifically, the teachers noticed the surface features of students’ knowledge, understanding and thinking: correct answers, the accuracy of students’ ideas, and errors and misconceptions. In contrast, they less noticed the substantial features of students  knowledge, understanding, and thinking: students’ conceptual understanding and reasoning. Therefore, in order for instructional improvement, it was suggested that elementary school teachers need to notice and respond to the substantial features of students  knowledge, understanding, and thinking: students’ conceptual understanding and reasoning."
학생체육일기를 통한 반성적 교수의 실천적 의미 탐색,2017,"['Physical Education Diary', 'Management of Learner', 'Function of Teaching and Learning Method', 'Interaction', '체육일기', '학습자 관리', '교수학습 방법의 기능', '상호작용']","본 연구는 학생들이 수업 후 체육일기를 작성함으로써 어떤 결과를 얻을 수 있으며, 또한 결과가 가지고 있는 교육적 의미와 역할이 무엇인지 탐색하는 데 목적이 있다. 이를 위해 학생들이 작성한 체육일기를 수집하여 영역분석과 분류분석을 통해 다음과 같은 결과를 도출하였다. 첫째, 체육일기를 통해 교사들이 직접 관찰할 수 없는 상황을 파악하여 학습자 관리를 할 수 있었다. 교사의 적극적인 감독과 체육수업이 어떻게 수행되어 학생들이 어떠한 방식으로 수업에 참여하는지에 대한 활동 상황을 파악할 수 있었다. 둘째, 교수학습방법의 기능으로서 역할이 가능하였다. 체육수업의 변화에 대한 시점과 과제의 종류, 적절성에 대한 판단자료의 가치와 단순히 일기장의 기능뿐만 아니라 학습장의 역할로서 학생들이 활용하고 있었다. 셋째, 체육일기는 교사와 학습자 간의 상호작용이 가능하도록 하였다. 교사가 학생들의 일기장에 남긴 댓글의 효과와 체육일기를 통해 학생들의 의견과 감정 상태를 표현함에 따라 교사와 학생간의 상호작용이 이루어지고 있었다. 따라서 체육일기가 단순한 글쓰기가 아니라 교사와 학생 모두에 있어 좋은 체육수업이 될 수 있는 수업활동의 한 가지 방법으로써 가치가 있음을 밝히고 싶다.","Purpose: The purpose of this study is to investigate what results the students could get by writing physical education diary after school, and what the educational meaning and role such results had. Methods: This study was to execute the domain analysis and analysis of classification system by collecting the physical education diary written by the students. Result: From the result of this research above, it may be summed up as follows. First, the learners could be managed by understanding the situation that the teachers could not observe it directly through the physical education diary. This researcher could understand the activity condition how the teacher""s active supervision and physical education performed, and how the students would participate in their classes. Second, the role was available as function of teaching and learning method. And the students used it as role of workbook as well as point about the change of physical education, sort of subject, value of decision data about the relevance, and function of simple diary. Third, the physical education diary could make it possible to interact between the teachers and learners. The interaction between the teachers and students was realized as the teachers expressed the students"" opinion and emotional state through the effect of comments in the students"" diaries and physical education diary. Conclusion: This researcher considers it as making it clear that the physical education diary, not simple writing, has its value as one of methods for class activity which can become good physical education for both teachers and students."
A Fusion Method of Co-training and Label Propagation for Prediction of Bank Telemarketing,2017,"['텔레마케팅', '준지도 학습법', '레이블 전파', '협동 학습', '신뢰도', 'telemarketing', 'semi-supervised learning', 'label propagation', 'co-training', 'reliability']",,
Attribute weighting for averaged one-dependence estimators,2017,,,"<P>Averaged one-dependence estimators (AODE) is a type of supervised learning algorithm that relaxes the conditional independence assumption that governs standard naive Bayes learning algorithms. AODE has demonstrated reasonable improvement in terms of classification performance when compared with a naive Bayes learner. However, AODE does not consider the relationships between the super-parent attribute and other normal attributes. In this paper, we propose a novel method based on AODE that weighs the relationship between the attributes called weighted AODE (WAODE), which is an attribute weighting method that uses the conditional mutual information metric to rank the relations among the attributes. We have conducted experiments on University of California, Irvine (UCI) benchmark datasets and compared accuracies between AODE and our proposed learner. The experimental results in our paper show that WAODE exhibits higher accuracy performance than the original AODE.</P>"
