title,date,keywords,abstract,multilingual_abstract
CNN Auto-Encoder Network Using Dilated Inception for Image Steganography,2021,"['Information security', 'Image steganography', 'Dilated convolution', 'CNN', 'Auto-encoder']",,"Numerous studies have used convolutional neural networks (CNNs) in the field of information concealment as well as steganalysis, achieving promising results in terms of capacity and invisibility. In this study, we propose a CNN-based steganographic model to hide a color image within another color image. The proposed model consists of two sub-networks: the hiding network is used by the sender to conceal the secret image; and the reveal network is used by the recipient to extract the secret image from the stego image. The architecture of the concealment sub-network is inspired by the U-Net auto-encoder and benefits from the advantages of the dilated convolution. The reveal sub-network is inspired by the auto-encoder architecture. To ensure the integrity of the hidden secret image, the model is trained end to end: rather than training separately, the two sub-networks are trained simultaneously a pair of networks. The loss function is elaborated in such a way that it favors the quality of the stego image over the secret image as the stego image is the one that comes under steganalysis attacks. To validate the proposed model, we carried out several tests on a range of challenging publicly available image datasets such as ImageNet, Labeled Faces in the Wild (LFW), and PASCAL-VOC12. Our results show that the proposed method can dissimulate an image into another one with the same size, reaching an embedding capacity of 24 bit per pixel without generating visual or structural artefacts on the host image. In addition, the proposed model is generic, that is, it does not depend on the image’s size or the database source."
"Enhanced and applicable algorithm for Big-Data by Combining Sparse Auto-Encoder and Load-Balancing, ProGReGA-KF",2021,"['Big-Data representation', 'Machine-Learning', 'massively multiplayer online architecture', 'Load-Balancing', 'Sparse Auto-Encoder']",,"Pervasive enhancement and required enforcement of the Internet of Things (IoTs) in a distributed massively multiplayer online architecture have effected in massive growth of Big-Data in terms of server over-load. There have been some previous works to overcome the overloading of server works. However, there are lack of considered methods, which is commonly applicable. Therefore, we propose a combing Sparse Auto-Encoder and Load-Balancing, which is ProGReGA for Big-Data of server loads. In the process of Sparse Auto-Encoder, when it comes to selection of the feature-pattern, the less relevant feature-pattern could be eliminated from Big-Data. In relation to Load-Balancing, the alleviated degradation of ProGReGA can take advantage of the less redundant feature-pattern. That means the most relevant of Big-Data representation can work. In the performance evaluation, we can find that the proposed method have become more approachable and stable."
Auto-encoder 기반의 촬영 각도 무관 동작 임베딩 생성 모델을 활용한 영상 속 동작 유사도 측정,2021,"['motion similarity', 'human analysis', 'auto-encoder', 'metric learning', 'deep learning', 'computer vision']",,"Analyzing a persons motion to measure similarity is used in the various problem. However, since the motion is captured through a camera, the motion expressed as a time series of two-dimensional joint coordinates in a video also changes if the camera angle is varied. If this factor is not taken into account when measuring motion similarity, the machine will not be able to determine motions with different camera angles as the same motion. In this study, in order to improve the similarity measurement performance in this situation, an auto-encoder based model that generates motion embedding independent of the camera angle factor was utilized. Furthermore, through the proposed algorithm that can measure the similarity from the generated motion embedding, it is possible to measure the motion similarity regardless of the camera angle. The experiment was conducted with two-dimensional joint coordinates of motions projecting from various angles and showed more accurate results than the similarity measured by motion embedding generated from a model that did not consider the camera angle."
Stacked Auto-Encoder Network to Predict Tensile Deformation Behavior of a Typical Nickel-Based Superalloy Considering Portevin–Le Chatelier Effects,2021,['Alloy · Deformation behavior · Portevin–Le Chatelier effect · Stacked auto-encoders network'],,"The intermediate-temperature (473–973 K) deformation behavior of a nickel-based superalloy is researched by uniaxialtensile experiments. It is observed that the flow characteristics and the Portevin–Le Chatelier (PLC) effects are significantlyaffected by the thermo-mechanical parameters. The serrated flow features are obvious under the testing conditions. A stackedauto-encoders (SAEs) network model is proposed for predicting the flow behaviors of the researched superalloy. The architectureof the established SAEs model is optimized layer by layer. The best number of hidden layer is 3, and the nodes perhidden layer are 15, 20 and 50, respectively. The excellent prediction ability suggests that the developed SAEs model canwell reconstruct the intermediate-temperature flow behavior involving the PLC effects of the researched superalloy."
CNN Auto-Encoder Network Using Dilated Inception for Image Steganography,2021,"['Information security', 'Image steganography', 'Dilated convolution', 'CNN', 'Autoencoder']",,"Numerous studies have used convolutional neural networks (CNNs) in the field of information concealment as well as steganalysis, achieving promising results in terms of capacity and invisibility. In this study, we propose a CNN-based steganographic model to hide a color image within another color image. The proposed model consists of two sub-networks: the hiding network is used by the sender to conceal the secret image; and the reveal network is used by the recipient to extract the secret image from the stego image. The architecture of the concealment sub-network is inspired by the U-Net auto-encoder and benefits from the advantages of the dilated convolution. The reveal sub-network is inspired by the auto-encoder architecture. To ensure the integrity of the hidden secret image, the model is trained end to end: rather than training separately, the two sub-networks are trained simultaneously a pair of networks. The loss function is elaborated in such a way that it favors the quality of the stego image over the secret image as the stego image is the one that comes under steganalysis attacks. To validate the proposed model, we carried out several tests on a range of challenging publicly available image datasets such as ImageNet, Labeled Faces in the Wild (LFW), and PASCAL-VOC12. Our results show that the proposed method can dissimulate an image into another one with the same size, reaching an embedding capacity of 24 bit per pixel without generating visual or structural artefacts on the host image. In addition, the proposed model is generic, that is, it does not depend on the image’s size or the database source."
Denoising Auto Encoder 기법을 활용한 진동 데이터 전처리 및 성능비교,2021,"['디노이징 오토인코더', '건전성 예측 및 관리기술', '웨이블릿 변환', '단일 클래스 서포트 벡터 머신', '노이즈 제거', 'Denoising Auto Encoder', 'Prognostics Health Management (PHM)', 'Wavelet Transform', 'One-Class Support Vector Machine', 'Noise Reduction']",기계 장비의 진동 데이터는 필연적으로 노이즈를 포함하고 있다. 이러한 노이즈는 기계 장비의 유지보수를 진행하는데 악영향 을 끼친다. 그에 따라 데이터의 노이즈를 얼마나 효과적으로 제거해주냐에 따라 학습 모델의 성능을 좌우한다. 본 논문에서는 시계열 데 이터를 전처리 함에 있어 특성추출 과정을 포함하지 않는 Denoising Auto Encoder 기법을 활용하여 데이터의 노이즈를 제거했다. 또한 기계 신호 처리에 널리 사용되는 Wavelet Transform과 성능 비교를 진행했다. 성능비교는 고장 탐지율을 계산하여 진행했으며 보다 정확한 비교 를 위해 분류 성능 평가기준 중 하나인 F-1 Score를 계산하여 성능 비교를 진행했다. 고장을 탐지하는 과정에서는 One-Class SVM 기법을 활용하여 고장 데이터를 탐지했다. 성능 비교 결과 고장 진단율과 오차율 측면에서 Denoising Auto Encoder 기법이 Wavelet Transform 기법 에 비해 보다 좋은 성능을 나타냈다.,"Vibration data of mechanical equipment inevitably have noise. This noise adversely affects the maintenance of mechanical equipment. Accordingly, the performance of a learning model depends on how effectively the noise of the data is removed. In this study, the noise of the data was removed using the Denoising Auto Encoder (DAE) technique which does not include the characteristic extraction process in preprocessing time series data. In addition, the performance was compared with that of the Wavelet Transform, which is widely used for machine signal processing. The performance comparison was conducted by calculating the failure detection rate. For a more accurate comparison, a classification performance evaluation criterion, the F-1 Score, was calculated. Failure data were detected using the One-Class SVM technique. The performance comparison, revealed that the DAE technique performed better than the Wavelet Transform technique in terms of failure diagnosis and error rate."
오토 인코더 기반의 단일 클래스 이상 탐지 모델을 통한 네트워크 침입 탐지,2021,"['이상 탐지', '네트워크 침입 탐지', '오토인코더', 'NSL-KDD', 'Anomaly Detection', 'Network Intrusion Detection', 'AutoEncoder']","최근 네트워크 환경에 대한 공격이 급속도로 고도화 및 지능화 되고 있기에, 기존의 시그니처 기반 침입탐지 시스템은 한계점이 명확해지고 있다. 지능형 지속 위협(Adavanced Persistent Threat; APT)과 같은 새로운 공격에 대해서 시그니처 패턴은 일반화 성능이 떨어지는 문제가 존재한다. 이러한 문제를 해결하기 위해 기계학습 기반의 침입 탐지 시스템에 대한 연구가 활발히 진행되고 있다. 하지만 실제 네트워크 환경에서 공격 샘플은 정상 샘플에 비해서 매우 적게 수집되어 클래스 불균형(Class Imbalance) 문제를 겪게 된다. 이러한 데이터로 지도 학습 기반의 이상 탐지 모델을 학습시킬 경우 정상 샘플에 편향된 결과를 가지게 된다. 본 논문에서는 이러한 불균형 문제를 해결하기 위해서 오토 인코더(Auto Encoder; AE)를 활용해 One-Class Anomaly Detection 을 수행하여 이를 극복한다. 실험은 NSL-KDD 데이터 셋을 통해 진행되었으며, 제안한 방법의 성능 평가를 위해 지도 학습된 모델들과 성능을 비교한다.","Recently network based attack technologies are rapidly advanced and intelligent, the limitations of existing signature-based intrusion detection systems are becoming clear. The reason is that signature-based detection methods lack generalization capabilities for new attacks such as APT attacks. To solve these problems, research on machine learning-based intrusion detection systems is being actively conducted. However, in the actual network environment, attack samples are collected very little compared to normal samples, resulting in class imbalance problems. When a supervised learning-based anomaly detection model is trained with such data, the result is biased to the normal sample. In this paper, we propose to overcome this imbalance problem through One-Class Anomaly Detection using an auto encoder. The experiment was conducted through the NSL-KDD data set and compares the performance with the supervised learning models for the performance evaluation of the proposed method."
합성곱 오토인코더를 이용한 체인 전동 장치의 고장 결함 감지 및 진단,2021,"['Fault Detection(고장 검출)', 'Fault Diagnosis(고장 진단)', 'Deep Learning(딥러닝)', 'Convolutional Auto-encoder(합성곱 오토인코더)', 'Unsupervised Learning(비지도학습)', 'Convolutional Neural Network(합성곱 신경망)']",,"This paper presents a method to detect the mechanical faults of a chain drive power transmission system (CDPTS) using a convolutional auto-encoder (CAE). In previous research, it was known that the methods to detect faults of the CDPTS based on an artificial neural network (ANN) and convolutional neural network (CNN) were useful. In this paper, an advanced application of CNN, the CAE function of CNN is employed to detect faults. This method uses the characteristics of reconstruction of CAE. Difference of input images of the CNN and reconstructed images extracted by CAE were used as the guideline of fault detection. In the fault condition of the system, the difference was larger than the predetermined threshold of error. The encoder of CAE can be fine-tuned to classify the fault types of CDPTS. Finally, this method was well applied to diagnose the fault types of the test CDPTS installed in the laboratory."
천해 음향 통신에서 이미지 향상을 위한 디노이징 오토인코더의 성능 평가,2021,"['Underwater acoustic communication', 'Shallow water', 'Multipath channel', 'Denoising autoencoder']",,"Underwater acoustic communication channel is influenced by environmental parameters such as multipath, background noise and scattering. Therefore, a transmitted signal is influenced by the sea surface and the sea bottom boundaries, and a received signal shows a delay spread. These factors create a noise in the image and degrade the quality of underwater acoustic communication. To solve these problems, in this paper, we evaluate the performance of an underwater acoustic communication model using a denoising auto-encoder used for unsupervised learning. Noise images generated by the underwater multipath channel were collected and used as training data. Experimental results were analyzed as a PSNR parameter that expressed the noise ratio of the two images."
"자율주행 자동차에서 제어권 전환 시 운전자, 차량, 환경 데이터에 기반한 복합 주행 안정 판단 알고리즘 제안 및 검증",2021,"['Autonomous vehicle', 'Driver assistance system', 'Driving stability', 'Take over request', 'Convolutional auto encoder']",,"A lot of research and development for the autonomous vehicle have been progressed recently, and it is about to be commercialized. In specific situations, however, the vehicle needs to be controlled by human and the driving mode must be switched from autonomous to manual. At the moment, it is difficult to have driving stability immediately because drivers were doing other tasks in the autonomous mode. For safety issue, driving stability after the take-over should be recovered quickly, and it is necessary to monitor driving stability in real time. In this study, we propose an algorithm for judging driving stability quantitatively using the data of drivers, vehicles, and the environment. We suggest one class classification approach based on convolutional auto encoder. And also, the numerical experiments are conducted to compare the results between the proposed algorithm and a rule-based algorithm, so we verify the effectiveness and rationality of the algorithm."
인공지능 모델을 이용한 공작기계의 스핀들 고장 진단,2021,"['Fault Diagnosis(고장 진단)', 'Artificial Intelligence(인공지능)', 'Spindle(스핀들)']","정보통신기술(ICT)의 발전은 전통적인 제조 분야의 혁신을 가속화시키고 있고, 스마트팩토리로 불리우는 최첨단 공장에서는 각종 센서를 통해 실시간으로 데이터를 수집하고 있다. 이러한 수집된 데이터에 인공지능 기술을 적용하여 기계 고장 상황에 빠르게 대처하는 연구가 최근 들어 많은 관심을 받고 있다. 본 연구에서는 공작기계 스핀들의 고장 진단을 목적으로 인공지능 기술의 적용 가능성을 확인하기 위해 테스트벤치를 구축한 후 볼트를 이용하여 인위적으로 스핀들의 편심을 변화시킨 고장 데이터를 수집하였고, 분류(classification) 문제에 주로 사용되는 인공지능 모델 3종(CNN, LSTM, auto-encoder)을 학습하여 스핀들의 7가지 상태를 분류하는 정확도를 비교 분석하였다. 또한, 공작기계 도메인에 인공지능 기술을 효과적으로 적용하기 위해 필요한 데이터 수집 및 처리방법과 모델 개발 방법을 제안한다.","The development of information and communication technology (ICT) is accelerating innovation in the traditional manufacturing sector. The smart factory which is a state-of-the-art factory collects data in real time through various sensors. Recently, researches on applying the artificial intelligence technology to these collected data to detect machine failures has gained a lot of attention. In this study, we built a test bench to check the possibility of applying the artificial intelligence technology for the fault diagnosis of the spindle of machine tools. We collected failure data by changing the off-center of the spindle using bolts. Further, we used artificial intelligence models (CNN, LSTM, and auto-encoder) to analyze the accuracy of seven types of fault classifications. In addition, the method of data collection, data process, and model development is proposed to effectively apply the artificial intelligence technology to machine tool domains."
시계열 예측을 위한 스타일 기반 트랜스포머,2021,"['Time Series Forecasting', 'Transformer', 'Generative Decoder', 'Style Transfer', '시계열 예측', '트랜스포머', '생성 디코더', '스타일 변환']",,"Time series forecasting refers to predicting future time information based on past time information. Accurately predicting future information is crucial because it is used for establishing strategies or making policy decisions in various fields. Recently, a transformer model has been mainly studied for a time series prediction model. However, the existing transformer model has a limitation in that it has an auto-regressive structure in which the output result is input again when the prediction sequence is output. This limitation causes a problem in that accuracy is lowered when predicting a distant time point. This paper proposes a sequential decoding model focusing on the style transformation technique to handle these problems and make more precise time series forecasting. The proposed model has a structure in which the contents of past data are extracted from the transformer-encoder and reflected in the style-based decoder to generate the predictive sequence. Unlike the decoder structure of the conventional auto-regressive transformer, this structure has the advantage of being able to more accurately predict information from a distant view because the prediction sequence is output all at once. As a result of conducting a prediction experiment with various time series datasets with different data characteristics, it was shown that the model presented in this paper has better prediction accuracy than other existing time series prediction models."
Development of a Hybrid Deep-Learning Model for the Human Activity Recognition based on the Wristband Accelerometer Signals,2021,"['Activities of Daily Living', 'Human Activity Recognition', 'Smartwatch', 'Accelerometer', 'Machine Learning', 'Activity Classification', 'Feature Extraction', 'Feature Reduction']",,"This study aims to develop a human activity recognition (HAR) system as a Deep-Learning (DL) classification model, distinguishing various human activities. We solely rely on the signals from a wristband accelerometer worn by a person for the user's convenience. 3-axis sequential acceleration signal data are gathered within a predefined time-window-slice, and they are used as input to the classification system. We are particularly interested in developing a Deep-Learning model that can outperform conventional machine learning classification performance. A total of 13 activities based on the laboratory experiments' data are used for the initial performance comparison. We have improved classification performance using the Convolutional Neural Network (CNN) combined with an auto-encoder feature reduction and parameter tuning. With various publically available HAR datasets, we could also achieve significant improvement in HAR classification. Our CNN model is also compared against Recurrent-Neural-Network(RNN) with Long Short-Term Memory(LSTM) to demonstrate its superiority. Noticeably, our model could distinguish both general activities and near-identical activities such as sitting down on the chair and floor, with almost perfect classification accuracy."
Automatic Classification of the Korean Triage Acuity Scale in Simulated Emergency Rooms Using Speech Recognition and Natural Language Processing: a Proof of Concept Study,2021,"['Triage', 'Classification', 'Machine Learning', 'Natural Language Processing', 'Deep Learning']",,"Background: Rapid triage reduces the patients' stay time at an emergency department (ED). The Korean Triage Acuity Scale (KTAS) is mandatorily applied at EDs in South Korea.For rapid triage, we studied machine learning-based triage systems composed of a speech recognition model and natural language processing-based classification.Methods: We simulated 762 triage cases that consisted of 18 classes with six types of the main symptom (chest pain, dyspnea, fever, stroke, abdominal pain, and headache) and three levels of KTAS. In addition, we recorded conversations between emergency patients and clinicians during the simulation. We used speech recognition models to transcribe the conversation.Bidirectional Encoder Representation from Transformers (BERT), support vector machine (SVM), random forest (RF), and k-nearest neighbors (KNN) were used for KTAS and symptom classification. Additionally, we evaluated the Shapley Additive exPlanations (SHAP) values of features to interpret the classifiers.Results: The character error rate of the speech recognition model was reduced to 25.21% through transfer learning. With auto-transcribed scripts, support vector machine (area under the receiver operating characteristic curve [AUROC], 0.86; 95% confidence interval [CI], 0.81–0.9), KNN (AUROC, 0.89; 95% CI, 0.85–0.93), RF (AUROC, 0.86; 95% CI, 0.82–0.9) and BERT (AUROC, 0.82; 95% CI, 0.75–0.87) achieved excellent classification performance.Based on SHAP, we found “stress”, “pain score point”, “fever”, “breath”, “head” and “chest” were the important vocabularies for determining KTAS and symptoms.Conclusion: We demonstrated the potential of an automatic KTAS classification system using speech recognition models, machine learning and BERT-based classifiers."
해외지수와 투자자별 매매 동향에 따른 딥러닝 기반 주가 등락 예측,2021,"['Stock Price Fluctuation Prediction', 'Deep Learning', 'Overseas Indices', 'Trading Trends by Investor', '주가 등락 예측', '딥러닝', '해외 지수', '투자자별 매매 동향']",,"Stock price prediction is a subject of research in various fields such as economy, statistics, computer engineering, etc. In recent years, researches on predicting the movement of stock prices by learning artificial intelligence models from various indicators such as basic indicators and technical indicators have become active. This study proposes a deep learning model that predicts the ups and downs of KOSPI from overseas indices such as S&P500, past KOSPI indices, and trading trends by KOSPI investors. The proposed model extracts a latent variable using a stacked auto-encoder to predict stock price fluctuations, and predicts the fluctuation of the closing price compared to the market price of the day by learning an LSTM suitable for learning time series data from the extracted latent variable to decide to buy or sell based on the value. As a result of comparing the returns and prediction accuracy of the proposed model and the comparative models, the proposed model showed better performance than the comparative models."
