title,date,keywords,abstract,multilingual_abstract
기계학습 기반의 클라우드를 위한 센서 데이터 수집 및 정제 시스템,2021,"['Cloud system', 'Fog system', 'Machine learning', 'Support vector marchine', 'Recurrent neural network', '클라우드 시스템', '포그 시스템', '기계학습', 'SVM', 'RNN']","기계학습은 최근 대부분의 분야에서 적용하여 연구를 하고 있다. 이것은 기계학습의 결과가 결정된 것이 아니라 입력데이터의 학습으로 목적함수를 생성하고, 이를 통해 통하여 새로운 데이터에 대한 판단이 가능하기 때문이다. 또한, 축적된 데이터의 증가는 기계학습 결과의 정확도에 영향을 미친다. 이에 수집된 데이터는 기계학습에 중요한 요인이다. 제안하는 본 시스템은 서비스 제공을 위한 클라우드 시스템과 지역의 포그 시스템의 융합 시스템이다. 이에 클라우드 시스템은 서비스를 위한 머신러닝과 기반 구조를 제공하고, 포그 시스템은 클라우드와 사용자의 중간에 위치하여 데이터 수집 및 정제를 수행한다. 이를 적용하기 위한 데이터는 스마트기기에서 발생하는 센세 데이터로 한다. 이에 적용된 기계학습 기법은 분류를 위한 SVM알고리즘, 상태 인지를 위한 RNN 알고리즘을 이용한다.","Machine learning has recently been applied to research in most areas. This is because the results of machine learning are not determined, but the learning of input data creates the objective function, which enables the determination of new data. In addition, the increase in accumulated data affects the accuracy of machine learning results. The data collected here is an important factor in machine learning. The proposed system is a convergence system of cloud systems and local fog systems for service delivery. Thus, the cloud system provides machine learning and infrastructure for services, while the fog system is located in the middle of the cloud and the user to collect and refine data. The data for this application shall be based on the Sensitive data generated by smart devices. The machine learning technique applied to this system uses SVM algorithm for classification and RNN algorithm for status recognition."
ConvLSTM을 이용한 도로 구간 속도 예측 기법,2021,"['speed prediction', 'deep neural network', 'CNN', 'LSTM']",,"Predicting the speed of a road link, which means a specific segment of a road, is an important technology for location-based services like best route on the road. Recently, machine learning-based speed prediction methods including deep neural networks have been proposed. In particular, a speed prediction method using a convolution neural network (CNN) and a recurrent neural network (RNN) has been proposed. CNN can predict the speed by considering the spatial characteristics of the road, and RNN can predict the speed by considering the temporal characteristics of the speed change according to time of the road. In this paper, we propose a speed prediction method based on Convolutional LSTM (ConvLSTM) combining RNN and CNN that considers the properties of the neighboring links of the road link and the properties of the temporal road link together. In addition, the previously proposed LSTM-based speed prediction method is partially modified and implemented, and the performance of both is compared through experiments. Finally we shows the superiority of the proposed method compared to the existing proposed method."
심층신경망을 이용한 PCB 부품의 인쇄문자 인식,2021,"['Deep Neural Networks', 'OCR', 'LPRNet', 'CRNN', 'Text Recognition']",,"Recognition of characters printed or marked on the PCB components from images captured using cameras is an important task in PCB components inspection systems. Previous optical character recognition (OCR) of PCB components typically consists of two stages: character segmentation and classification of each segmented character. However, character segmentation often fails due to corrupted characters, low image contrast, etc. Thus, OCR without character segmentation is desirable and increasingly used via deep neural networks. Typical implementation based on deep neural nets without character segmentation includes convolutional neural network followed by recurrent neural network (RNN). However, one disadvantage of this approach is slow execution due to RNN layers. LPRNet is a segmentation-free character recognition network with excellent accuracy proved in license plate recognition. LPRNet uses a wide convolution instead of RNN, thus enabling fast inference. In this paper, LPRNet was adapted for recognizing characters printed on PCB components with fast execution and high accuracy. Initial training with synthetic images followed by fine-tuning on real text images yielded accurate recognition. This net can be further optimized on Intel CPU using OpenVINO tool kit. The optimized version of the network can be run in real-time faster than even GPU."
스트립된 바이너리에서 LSTM을 이용한 함수정보 추출 기법,2021,"['Bidrectional RNN', 'Function information', 'Machine Learning', 'N-byte', 'RNN', 'Reverse Engineering', 'Stripped Binary', '양방향 순환신경망', '함수정보', '머신러닝', '순환신경망', '역어셈블 엔지니어링', '스트립 바이너리']",,"To analyze and defend malware codes, reverse engineering is used as identify function location information. However, the stripped binary is not easy to find information such as function location because function symbol information is removed. To solve this problem, there are various binary analysis tools such as BAP and BitBlaze IDA Pro, but they are based on heuristics method, so they do not perform well in general. In this paper, we propose a technique to extract function information using LSTM-based models by applying algorithms of N-byte method that is extracted binaries corresponding to reverse assembling instruments in a recursive descent method. Through experiments, the proposed techniques were superior to the existing techniques in terms of time and accuracy."
Robustness of Differentiable Neural Computer Using Limited Retention Vector-based Memory Deallocation in Language Model,2021,"['Differentiable Neural Computer', 'DNC', 'Language Model', 'LM', 'Memory Deallocation', 'Retention Vector', 'Robustness']",,"Recurrent neural network (RNN) architectures have been used for language modeling (LM) tasks that require learning long-range word or character sequences. However, the RNN architecture is still suffered from unstable gradients on long-range sequences. To address the issue of long-range sequences, an attention mechanism has been used, showing state-of-the-art (SOTA) performance in all LM tasks. A differentiable neural computer (DNC) is a deep learning architecture using an attention mechanism. The DNC architecture is a neural network augmented with a content-addressable external memory. However, in the write operation, some information unrelated to the input word remains in memory. Moreover, DNCs have been found to perform poorly with low numbers of weight parameters. Therefore, we propose a robust memory deallocation method using a limited retention vector. The limited retention vector determines whether the network increases or decreases its usage of information in external memory according to a threshold. We experimentally evaluate the robustness of a DNC implementing the proposed approach according to the size of the controller and external memory on the enwik8 LM task. When we decreased the number of weight parameters by 32.47%, the proposed DNC showed a low bits-per-character (BPC) degradation of 4.30%, demonstrating the effectiveness of our approach in language modeling tasks."
Korean Sentiment Analysis Using Natural Network: Based on IKEA Review Data,2021,"['NLP', 'Word2Vec', 'CNN', 'RNN', 'LSTM', 'GRU', 'BiLSTM', 'BiGRU']",,"In this paper, we find a suitable methodology for Korean Sentiment Analysis through a comparative experiment in which methods of embedding and natural network models are learned at the highest accuracy and fastest speed. The embedding method compares word embeddeding and Word2Vec. The model compares and experiments representative neural network models CNN, RNN, LSTM, GRU, Bi-LSTM and Bi-GRU with IKEA review data. Experiments show that Word2Vec and BiGRU had the highest accuracy and second fastest speed with 94.23% accuracy and 42.30 seconds speed. Word2Vec and GRU were found to have the third highest accuracy and fastest speed with 92.53% accuracy and 26.75 seconds speed."
An Autonomous Driving Approach Based on Trajectory Learning Using Deep Neural Networks,2021,"['Autonomous driving', 'Trajectory learning', 'CNN_Raw-RNN', 'Pilot and copilot']",,"Autonomous driving approaches today are mainly based on perception-planning-action modular pipelines and the End2End paradigm respectively. The End2End paradigm is a strategy that directly maps raw sensor data to vehicle control actions. This strategy is very promising and appealing because complex module design and cumbersome data labeling are avoided. Since this approach lacks a degree of interpretability, safety and practicability. we propose an autonomous driving approach based on trajectory learning using deep neural networks in this paper. In comparison to End2End algorithm, it is found that the trajectory learning algorithm performs better in autonomous driving. As for trajectory learning algorithm, the CNN_Raw-RNN network structure is established, which is verified to be more effective than the original CNN_LSTM network structure. Besides, we propose an autonomous driving architecture of a pilot and copilot combination. The pilot is responsible for trajectory prediction via imitation learning with labeled driving trajectories, while the copilot is a safety module that is employed to verify the effectiveness of the vehicle trajectory by the results of the semantic segmentation auxiliary task. The proposed autonomous driving architecture is verified with a real car on urban roads without manual intervention within 40 km."
PoseNet과 GRU를 이용한 Skeleton Keypoints 기반 낙상 감지,2021,"['Pose Estimation', 'Skeleton Keypoints', 'Fall Detection', 'Deep Learning', 'LSTM', 'PoseNet']","낙상 판단을 위한 최근 발표되는 연구는 RNN(Recurrent Neural Network)을 이용한 낙상 동작 특징 분석과 동작 분류에 집중되어 있다. 웨어러블 센서를 기반으로 한 접근 방식은 높은 탐지율을 제공하나 사용자의 착용 불편으로 보편화 되지 못했고 최근 영상이나 이미지 기반에 딥러닝 접근방식을 이용한 낙상 감지방법이 소개 되었다. 본 논문은 2D RGB 저가 카메라에서 얻은 영상을 PoseNet을 이용해 추출한 인체 골격 키포인트(Keypoints) 정보로 머리와 어깨의 키포인트들의 위치와 위치 변화 가속도를 추정함으로써 낙상 판단의 정확도를 높이기 위한 감지 방법을 연구하였다. 특히 낙상 후 자세 특징 추출을 기반으로 Convolutional Neural Networks 중 Gated Recurrent Unit 기법을 사용하는 비전 기반 낙상 감지 솔루션을 제안한다. 인체 골격 특징 추출을 위해 공개 데이터 세트를 사용하였고, 동작분류 정확도를 높이는 기법으로 코, 좌우 눈 그리고 양쪽 귀를 포함하는 머리와 어깨를 하나의 세그먼트로 하는 특징 추출 방법을 적용해, 세그먼트의 하강 속도와 17개의 인체 골격 키포인트가 구성하는 바운딩 박스(Bounding Box)의 높이 대 폭의 비율을 융합하여 실험을 하였다. 제안한 방법은 기존 원시골격 데이터 사용 기법보다 낙상 탐지에 보다 효과적이며 실험환경에서 약 99.8%의 성공률을 보였다.","A recent study of people physically falling focused on analyzing the motions of the falls using a recurrent neural network (RNN) and a deep learning approach to get good results from detecting 2D human poses from a single color image. In this paper, we investigate a detection method for estimating the position of the head and shoulder keypoints and the acceleration of positional change using the skeletal keypoints information extracted using PoseNet from an image obtained with a low-cost 2D RGB camera, increasing the accuracy of judgments about the falls. In particular, we propose a fall detection method based on the characteristics of post-fall posture in the fall motion-analysis method. A public data set was used to extract human skeletal features, and as a result of an experiment to find a feature extraction method that can achieve high classification accuracy, the proposed method showed a 99.8% success rate in detecting falls more effectively than a conventional, primitive skeletal data-use method."
"『길 위 1번지』, AI 제임스의 소설 : 「소설의 기술」과 인공신경망 알고리즘의 글쓰기",2021,"['Henry James', '“The Art of Fiction', '” 1 the Road', 'CNN', 'RNN', 'Creativity']",,"This article explores the implications of 1 the Road (2018), a fiction produced by an artificial neural network, for the debate on machine creativity. Unlike most of the recent deeplearning writing programs, its creator Ross Goodwin traveled with this neural network machine from New York to New Orleans in a Cadillac equipped with a surveillance camera, a voice recognizer, and GPS. The AI thus had continuous feeds of fresh images and sounds, not unlike a novelist who hits the road searching for an experience. I argue that we can better understand this attempt of 1 the Road when discussed alongside Henry James’s realist notion of fiction in his essay “The Art of Fiction” (1884). Even though James is often considered an arch-humanist in his belief that fiction is an expression of the unique personality of a novelist, his idea of experience offers a way of understanding Goodwin’s machine as a creative writer. Its algorithmic operation―processing the new sense data via the CNN algorithm and producing the result as writing via the RNN algorithm―is strikingly similar to the workings of the novelist’s mind in James’s view. I do not argue that those sense data are unmediated, and this fact is reflected in the CNN’s algorithm that imitates the human mind. In fact, James asserts that sensory data are the result of mediated selection, which can only be seen through the final result, the writing itself. What I propose is that regardless of whether the machine has a so-called “consciousness,” its writing can affect the reader in similar ways as does a text written by a human being. As long as it works as a linguistic medium to relate the “experience,” which is the algorithmic process of selection and transcription, it is a creative writer."
AdaBoost-GRU 앙상블 모형을 이용한 금융 시계열 예측,2021,"['AdaBoost-GRU 앙상블', '금융시계열', '딥러닝', 'AdaBoost-GRU ensemble', 'deep learning', 'financial time series']","일반적으로 금융 시계열 (financial time series) 예측은 비선형성 (non-linearity)과 불규칙성(irregularity)으로 인해 매우 어려운 일이다. 본 논문에서는 금융 시계열 예측을 위해 AdaBoost 알고리즘과 GRU 모형을 결합한 하이브리드 앙상블 학습 방법 (hybrid ensemble learning approach)을 제안하고자 한다. 여기서 GRU 모형은 LSTM (long short term memory) 모형과 함께 시계열 예측에 널리 사용되는 RNN (recurrent neural network)의 변형 모형이다. 우리는 KOSPI 데이터와 원/달러 환율과 같은 금융 시계열 데이터를 가지고 제안된 모델을 평가하고자 한다. 성능실험 결과 제안된 AdaBoost-GRU 앙상블은 3가지 척도 즉, MAE, MSE 및 RMSE 척도에서 기존의 ARIMA 모형, LSTM 모형, GRU 모형, 그리고 Adaboost-LSTM 앙상블보다 좋은 성능을 보였다. 그리고 Adaboost-LSTM 모형과의 처리속도 면에서 제안된 AdaBoost-GRU 모형이 빠름을 알 수 있었다.","In general, forecasting an financial time series is very difficult due to non-linearity and irregularity. In this paper, we propose a hybrid ensemble learning approach that combines the AdaBoost algorithm and GRU model for financial time series forecasting. Here, the GRU model is a modified structure of a recurrent neural network (RNN) widely used for time series forecasting along with a long short term memory (LSTM) model. We evaluated the proposed model with two financial time series data: KOSPI data, and won/dollar exchange rate data. As a result of performance tests, the proposed AdaBoost-GRU ensemble showed better performance than ARIMA model, single LSTM model, single GRU model, and Adaboost-LSTM ensemble in three scales: MAE, MSE and RMSE. In addition, the proposed AdaBoost-GRU ensemble was found to be fast in terms of processing speed with the Adaboost-LSTM model."
순환신경망 기반의 폭염 발생확률 예측 모델 개발 : 서울특별시를 중심으로,2021,"['폭염 발생확률', '순환신경망', 'LSTM', 'GRU', 'Heatwave Occurrence Probability', 'Recurrent Neural Network', 'LSTM', 'GRU']","최근 기후변화의 영향으로 폭염 발생이 증가하여 우리나라에서도 인명피해와 사회⋅경제적 피해가 증가하고 있다. 이러한 이유로 국내에서는 폭염과 관련된 연구 개발의 중요성이 대두되고 있다. 폭염 발생확률을 사전에 예측하는 것은 재해 위험 관리의 측면에서 매우 중요하나, 현재까지의 선행 연구들 중 폭염 발생확률을 예측한 연구들은 미비한 실정이다. 따라서 본 연구에서는 서울특별시를 대상으로 일 단위 과거 기상 데이터를 활용해 미래의 폭염 발생확률을 예측하였다. 이를 위해 시계열 데이터의 분석에 유용한 순환신경망 기반의 모델(RNN, LSTM, GRU)을 활용하였다. 본 연구에서 최적 모델로 선정된 GRU 모델의 성능을 평가한 결과 과적합 문제가 발생하지 않았으며, 검증 및 테스트 과정에서 실제 폭염 발생일을 각각 78%, 86% 재현하여 예측 정확도가 높은 것을 확인하였다. 따라서 향후 지자체별로 본 연구 방법을 적용한다면 효율적인 폭염 대비가 가능할 것으로 판단된다.","Recently, the incidence of heat waves has increased due to climate change, and the resultant mortalities and socio-economic damage are also increasing in Korea. Hence, emphasis has been placed on research examining heatwaves and their effects. Predicting the probability of heatwave in advance is very important from the perspective of disaster risk management; however, related studies have been insufficient so far. Therefore, in this study, the probability of future heatwave onset was predicted using daily scaled past weather data for Seoul Metropolitan Government. For the analysis, models based on recurrent neural networks (RNN, LSTM, GRU) were used, which are suitable for analyzing time-series data. Upon evaluating the performance of the GRU model, which was selected as the optimized model, no overfitting problem was observed. The prediction accuracy of the model was high as it demonstrated a reproduction of 78% and 86% of actual heatwave days during the validation and test process, respectively. Therefore, this model can be used by each local government to coordinate an efficient response to heat waves."
회선신경망 기반 SARS-CoV-2 (COVID-19) 치료제 약물재창출 및 세포 실험 결과로서의 Peroxisome Proliferator- Activated Receptors-Gamma Agonist의 효과,2021,"['코로나바이러스감염증-19', '인공지능', 'Peroxisome Proliferator- Activated Receptors', '시험관내 실험', 'COVID-19', 'Artificial Intelligence', 'Peroxisome Proliferator-Activated Receptors', 'in vitro']","연구배경: Coronavirus disease 2019 (COVID-19) 감염 시 발병하는 급성 호흡곤란 증후군은 사이토카인 폭풍에 의해 촉발되며 이를 억제하는 면역 조절자를 활성화하는 방법이 COVID-19의 새로운 치료제로 떠오 르 고 있다. 본 연구에서는 인공지능 을 이용하여COVID-19 치료 가능성이 있는 약물 50가지를 선정하였고 이중 염증반응을 억제하는 역할을 하는 PPAR-γ agonist 2종의 항바이러스효과를 평가하는 세포 실험을 설계하였다.방법: Drugbank와 CORD-19 database에 RNN 스크리닝을 적용하여화합물과 SARS-CoV-2 감염 세포에서 발현되는 main protease 구조물 사이의 결합 에너지 값이 높은 상위 50개의 치료제 후보군을 선정하였다. 세포 실험은 chloroquine, lopinavir, remdesivir를 처리한 대조군과 PPAR-γ agonist 2종을 처리한 실험군으로 나누어 진행하였으며 각 약물을 농도별로 처리하여 SARS-CoV-2 감염 세포 저해율을면역 형광법을 이용하여 구했다.결과: 기준 화합물로 사용된 chloroquine (SI=9.28), remdesivir(SI=4.56), lopinavir (SI=3.5) 모두 SI 값이 1 이상으로 항바이러스 효과가 확인되었다. Chloroquine, lopinavir는 SARS-CoV-2 감염 저해 효과를 보이는 농도에서 세포독성이 크게 증가하였고 remdesivir는 세포독성이 증가하지 않았다. 반면 실험군으로 쓰인 PPAR-γ agonist 2종모두 SI=1로 SARS-CoV-2 감염 저해 효과가 미미하고 세포 독성도 증가하지 않는 것이 확인되었다.결론: PPAR-γ agonist는 유의미한 SARS-CoV-2 감염 세포수의 저해를보이지 않아 COVID-19 치료제로는 한계가 있으나 인공지능을 신약개발에 활용하였다는 점에 본 연구의 의의가 있다.","Background: Acute respiratory distress syndrome resulting from coronavirus (COVID-19) infection is triggered by cytokine storms, so activation ofinhibitory modulators of inflammatory pathways has become a new candidate modality for COVID-19 treatment. This study utilized artificialintelligence (A.I.) to search databases, and compiled a list of 50 drugs deemed plausible candidates for COVID-19 treatment. We then designed a cellbasedin vitro assay to evaluate the efficacy of PPAR-γ agonists against viral induced inflammation.Methods: We applied RNN screening to Drugbank and CORD-19 databases, and selected as the top 50 drug candidates those compounds that havethe highest docking energy with the main protease produced by SARS-CoV-2 infected cells. We then designed an in vitro study includingchloroquine, lopinavir, and remdesivir treated cells as controls, and cells treated with two PPAR-γ agonists as experimental groups. SARS-CoV-2infected cells were administered a range of concentrations of each drug, and inhibition-normalized infection ratios were derived using animmunofluorescence method.Results: The positive control groups’ SI’s were >1 (chloroquine SI=9.28, remdesivir SI=4.56, lopinavir SI=3.5), confirming their inhibitory effects againstSARS-CoV-2 infection. However, chloroquine and lopinavir displayed high cytotoxicity, and Remdesivir displayed low cytotoxicity. The two PPAR-γagonist SIs indicated that they possess no inhibitory effect against SARS-CoV-2 infection, but are clinically safe.Conclusion: The PPAR-γ agonists did not reduce numbers of SARS-CoV-2 infected cells. Nevertheless, this study has significance in that we introducedthe use of A.I. for rapid new drug development during the COVID pandemic."
A Text Content Classification Using LSTM For Objective Category Classification,2021,"['인공지능', '콘텐츠', '카테고리', 'LSTM', '자연어', 'AI', 'contents', 'categorization', 'LSTM', 'natural language']","인공지능은 현재 인공지능 번역기, 페이스 아이디와 같이 우리의 삶 다양한 곳에 적용되고 있으며 여러 가지 장점으로 많은 산업분야에서도 적용되고 있다. 본 연구는 매년 방대한 양의 콘텐츠들이 넘쳐나는 상황에서 인공지능을 적용한 카테고리 분류로 원하는 데이터를 추출함으로써 편의성을 제공한다. 본 연구에서는 텍스트 분류에서 두각을 나타내고 있는 LSTM(Long-Short Term Memory network)을 사용한 모델을 제안하며 자연어 처리에 적합한 구조를 가진 RNN(Recurrent Neural Network)과 BiLSTM(Bidirectional LSTM)을 사용한 모델과의 성능을 비교한다. 세 가지 모델의 성능비교는 뉴스 텍스트 데이터에 적용해 accuracy, precision, recall의 측정값을 사용해 비교하였고 그 결과 LSTM모델의 성능이 가장 우수한 것으로 나타났다. 따라서 본 연구에서는 LSTM을사용한 텍스트 분류를 권장한다.","AI is deeply applied to various algorithms that assists us, not only daily technologies like translator and Face ID, but also contributing to innumerable fields in industry, due to its dominance. In this research, we provide convenience through AI categorization, extracting the only data that users need, with objective classification, rather than verifying all data to find from the internet, where exists an immense number of contents. In this research, we propose a model using LSTM(Long-Short Term Memory Network), which stands out from text classification, and compare its performance with models of RNN(Recurrent Neural Network) and BiLSTM(Bidirectional LSTM), which is suitable structure for natural language processing. The performance of the three models is compared using measurements of accuracy, precision, and recall. As a result, the LSTM model appears to have the best performance.Therefore, in this research, text classification using LSTM is recommended."
