title,date,keywords,abstract,multilingual_abstract
적대적 생성 신경망을 활용한 과다 노출 영상 복원 방법,2021,[],"본 논문에서는 과다 노출된 영상을 영상 간 변환(Image-to-Image Translation)을 위해 설계된 적대적 생성 신경망(Generative Adversarial Network)을 활용하여 복원하는 연구를 수행한다. 과다 노출 복원을 위한 기존의 연구에서 과다 노출 영역 판별, 밝기 회복, 색상 보정 과정을 거치는데, 영상 내 과다 노출 영역을 판별하는 과정에서 임의로 결정하는 파라미터에 의해 복원된 영상 결과가 달라지는 한계점을 극복하기 위해 종단간(End-to-End) 신경망을 학습시켜 과다 노출 영역을 별도의 파라미터 선택과 분할된 과정 없이 한 번에 복원하는 방법을 제안한다. 영상 간 변환 신경망 학습에 필요한 과다 노출 여부로 도메인이 분할된 데이터셋은 게임 소프트웨어를 활용하여 만들어 사용하였다. 본 연구에서는 신경망이 생성한 영상이 실제로 과다 노출 영역을 탐지하여 복원하는 것을 확인하였다. 그리고 과다 노출 영역을 탐지하여 복원하는 과정을 학습 단계별로 확인함으로써 신경망이 실제로 과다 노출 복원 과정을 학습함을 보였다.",다국어 초록 정보 없음
자동 채색화 과업의 성능 향상을 위한 적대적 생성 신경망의 손실함수 연구,2021,[],"자동 채색화 과업(Automatic Colorization)은 흑백 영상을 입력으로 하여 자연스러운 색상을 사용자의 개입없이 자동으로 예측하는 과업이다. 전통적인 컴퓨터 비전으로는 해결하지 못했던 자동 채색화에 대한 연구가 깊은 신경망이 발달함에 따라 활발히 이루어지고 있다. 본 논문에서는 자동 채색화의 성능 향상을 위해 적대적 생성 신경망인 pix2pix의 손실함수를 개선하는 방법을 제시한다. 제시한 방법의 성능 평가를 위해 PSNR, IQM이라는 평가 지표를 이용하여 정량적으로 평가한 결과 PSNR은 0.01%, IQM은 12% 향상된 결과를 보였다. 또한 기존 방법과 제시된 방법의 시각적 비교를 통해 정성적 평가를 수행하여 결과의 신뢰도를 높였다. 자동 채색화에 특화된 적대적 생성 신경망의 손실함수를 개선한 우리의 방법은 향후 다양한 채색화 과업 응용으로 확장될 수 있을 것으로 판단된다.",다국어 초록 정보 없음
공간 적응적 조건부 적대적 생성신경망을 활용한 단일 영상 내 반사 영역 제거기법,2021,"['조건부 적대적 생성신경망', '영상데이터 간 전환', '반사 영역 제거', '공간 적응적 비 정규화', 'Conditional generative adversarial network', 'Image-to-image translation', 'Reflection removal', 'Spatially adaptive de-normalization']",국문 초록 정보 없음,다국어 초록 정보 없음
멀티 스케일 적대적 생성 신경망을 이용한 라이다 채널 해상도 개선,2021,"['Super-Resolution(고해상화)', 'Multi-Scale(멀티 스케일)', 'GAN(적대적 생성 신경망)', 'LiDAR(라이다)', 'Panoramic Image (파노라마 이미지)']",국문 초록 정보 없음,"To perform stable autonomous driving, it is essential to understand the dynamic environment through sensors. Sensors for object detection include cameras, lidars, and radar sensors. Especially, lidars can obtain relatively accurate three-dimensional point cloud data by measuring the time reflected on objects after shooting laser pulses. In addition, as the interval between pulses increases, the detection performance of distant objects decreases, high-channel lidar is necessary to determine the shape of the distant object. However there is a problem that the more channels Lidar has, the more it costs. Therefore, research is actively underway to convert low-channel lidars into images and super-resolution them into high-channel lidars. In this paper, we present a method for converting low-channel lidar point clouds to high-channel lidar point clouds using multiscale adversarial generative neural networks (GANs). We project a 16-channel point cloud into a panoramic image, and then train the network to generate 64-channel point cloud by putting it as an input value into a neural network. The proposed algorithm has been verified using Carla simulation set."
적대적 생성 신경망을 사용한 유기 행동 검출,2021,"['Abandonment Behavior Detection', 'Ganerative Advesarial Networks', 'Anomaly Detection']",국문 초록 정보 없음,"Abandoned luggage items in public areas will be a potential threat caused by bombs or biological warfare. We present a method for real-time automatic detection of abandoned luggage in video captured by surveillance cameras. Most works for abandoned objects detection use a preliminary step to detect foreground regions or objects, and use various techniques including deep learning to distinguish between abandoned luggage items and other objects. These object detection-based methods require direct learning of characteristics of different types of objects. However, it is difficult to detect a new type of unlearned object, and there is insufficient detection of the instantaneous situation in which an object is abandoned. In order to solve these problems, we propose reconstruction-based anomaly detection to identify unusual patterns that do not conform to expected behavior such as abandoning objects. The approach is comprised of two stages - first, static object detection based on YOLOv4 and second, abandoned luggage recognition based on anomaly detection using Ganerative Advesarial Networks (GAN). We demonstrate the proposed GAN-based anomaly detection for abandonment behavior by performing experiments on Abnormal Event CCTV Video Dataset."
적대적 생성 신경망과 딥러닝을 이용한 교량 상판의 균열 감지,2021,"['딥러닝', '이미지 생성 모델', '균열 감지', '교량 점검', '콘크리트 교량', 'Deep learning', 'Image generative model', 'Crack detection', 'Bridge deck monitoring', 'Concrete bridge']",국문 초록 정보 없음,다국어 초록 정보 없음
적대적 생성 신경망기반 데이터 증강을 통한 해상객체 식별 성능향상에 대한 연구,2021,[],국문 초록 정보 없음,"With the advancement of generative adversarial networks(GAN), it has become possible to successfully create images of various classes[1]. In this situation, through various studies, methods of using the image generated by GAN as a meaningful result have been proposed. In some fields, there are cases in which the classification performance has been successfully improved by using augmented data through GAN, but research on maritime images is relatively insufficient. In this paper, we intend to show through an experiment that the performance of marine object identification can be improved by enhancing data through GAN."
다중 스케일 그라디언트 조건부 적대적 생성 신경망을 활용한 문장 기반 영상 생성 기법,2021,[],국문 초록 정보 없음,"While Generative Adversarial Networks (GANs) have seen huge success in image synthesis tasks, synthesizing high-quality images from text descriptions is a challenging problem in computer vision. This paper proposes a method named Text-to-Face Generation Using Multi-Scale Gradients for Conditional Generative Adversarial Networks (T2F-MSGGANs) that combines GANs and a natural language processing model to create human faces has features found in the input text. The proposed method addresses two problems of GANs: model collapse and training instability by investigating how gradients at multiple scales can be used to generate high-resolution images. We show that T2F-MSGGANs converge stably and generate good-quality images."
위성 이미지와 순환 적대적 생성 신경망을 활용한 소나 이미지 내 수중 물체 지역화 방법,2021,[],국문 초록 정보 없음,다국어 초록 정보 없음
시계열 데이터를 위한 적대적 생성 신경망(GAN) 이상탐지 기법에 관한 연구,2021,"['이상 탐지', '시계열 자료', 'GAN', 'CUSUM']","최근 사물인터넷(IoT)과 같은 기술의 발달로 인해 시계열 데이터 속에 존재하는 이상(Anomaly)을 자동으로 탐지하는 이상탐지(Anomaly detection)에 대한 수요가 증가하고 있다. 이에 다양한 분야에 기반을 둔 이상탐지 기법들이 제안됐다. 통계적공정관리(Statistical process control) 기법인 누적합관리도(Cumulative sum chart)가 그 대표적인 예이다. 최근에는 적대적 생성 신경망(Generative adversarial networks, GAN) 방법의 성공으로 인해 GAN을 활용한 이상탐지 기법들이 많은 주목을 받고 있다. Li et al. (2018)은 GAN 기반 이상탐지 방법이 누적합관리도보다 우수한 이상탐지 성능을 나타낸다고 주장하였다. 그러나 그들의 연구는 제안된 GAN 기반 이상탐지 방법과 누적합관리도의 공정한 비교를 위한 프레임워크가 존재하지 않는다. 이에 본 연구는 다음과 같은 연구를 수행하였다.첫째, 이상탐지 성능의 비교 프레임워크를 제시하여 GAN 기반 이상탐지 방법들과 누적합관리도의 이상탐지 성능을 비교하였다. 그 결과 누적합관리도가 GAN 기반 이상탐지 방법들의 성능보다 우수하게 나타났다. 이는 선행연구(Li et al., 2018)와는 상반된 결과로 비교 절차에 따라 이상탐지 성능이 달라질 수 있기에 더 많은 후속 연구가 더 필요함을 의미한다. 둘째, 기존 GAN 기반 이상탐지 기법들의 성능 향상을 위한 연구를 수행하였다. 그 결과 역전파(Backpropagation) 단계의 수가 이상탐지 성능에 영향을 미치는 요인임을 밝혀내었다. 역전파 단계의 수는 이상점수를 얻는 과정인 역-사상(Inverse mapping) 절차의 반복회수를 의미한다. 마지막으로 시계열 효과를 제거한 잔차(Residual)를 모니터링하면 이상탐지 성능이 향상됨을 확인하였다.",다국어 초록 정보 없음
적대적 생성 신경망(GAN)을 이용한 시계열 데이터 이상탐지 기법 연구,2021,[],국문 초록 정보 없음,다국어 초록 정보 없음
적대적 생성 신경망(GAN)을 이용한 시계열 데이터 이상탐지 기법 연구,2021,[],국문 초록 정보 없음,다국어 초록 정보 없음
균형 잡힌 적대적 생성 신경망 학습을 위한 Z-score 기반 샘플링,2021,[],국문 초록 정보 없음,다국어 초록 정보 없음
데이터 센터의 전력량 예측을 위한 적대적 생성 신경망(GAN) 기반 데이터 확장 성능 비교,2021,[],국문 초록 정보 없음,다국어 초록 정보 없음
생성적 적대 신경망을 활용한 영상 생성 기술의 초현실주의적 기제 - 도시 풍경을 생성하는 작업 뷰포터(Viewporter)의 창작 배경을 기반으로,2021,"['초현실주의', '영상 생성 기술', '인공지능', '매체 미학', '미디어 아트', 'Surrealism', 'image generation', 'artificial intelligence', 'media aesthetics', 'media arts']","사진과 영상 매체는 인간 내면의 환영을 생생하게 묘사할 수 있다는 점에서 초현실주의적인 작업의 표현에 적극적으로 활용 되었다. 사진과 영상 기술들에 덧붙여서 최근 획기적인 횡보를 보여준 인공지능 기술, 특별히 생성적 적대 신경망(GAN) 또 한 초현실주의적 작업의 도구로써 무한한 가능성을 제공한다는 관점에서 본 연구를 진행하게 되었다. 초현실주의적 영상의 특성에 관한 문헌 연구, GAN의 기술의 분석, 나아가 이를 적용한 작업 창작을 통한 복합적인 방식으로 본 연구를 진행한다. 특별히 프리드리히 키틀러(Fredrich Kittler)의 매체 분석 방식과 유사하게 인공지능 기술의 작동 방식을 조명한다. 영상 생성 기술의 작동 방식인 데이터 학습, 알고리즘을 활용한 통계, 그리고 모델을 적용하는 세 단계에서 가지는 특성을 파편성, 가변 성, 결합성으로 정리하며 이를 초현실주의적인 표현 요소로써 발견하였다. 이러한 특성을 적용하여 도시 개발에 관한 환상과 허상이라는 주제로 본인의 인터렉티브 미디어아트 <뷰포터(Viewporter)>를 제작하였다. <뷰포터>는 GAN을 활용하여 가상 의 도시 풍경을 생성해내고 이 영상을 전망대의 망원경과 유사한 장치를 통해 관객에게 보여준다. 이 작업을 통해 사회 집단 이 가진 무의식적 욕망을 묘사하는 한편, 이를 관객이 내면화하고 향유할 수 있도록 하였다. <뷰포터> 작업을 통해 인공지능 기술이 생성한 영상이 보는 이의 무의식적인 욕망을 촉발하는 촉매제로써 작용할 수 있다는 점에서 인공지능 기술을 활용한 초현실주의적 예술이 향후 나아가야 할 방향성을 발견할 수 있었다.","Photography and film have been actively used in relation to surrealistic artworks to depict human internal desires. The author of this study uncovered the creative potential of image generation techniques, specifically a generative adversarial network (GAN), for creating surrealistic artworks in addition to the traditional imaging techniques used in photography and film, such as cameras, projection, and film editing. This study utilizes a mixed research method involving a literature review of surrealistic film and media art, an analysis on GAN techniques, and media art project development. Based on Freidrich Kittler’s analysis method for media studies, this research examines the operational methods of GAN for image generation. The study summarizes the three steps of GAN techniques (data learning, algorithmic statistics, and model application processes) as showing fragmentary, fluidity and combinatory aspects, which relates well with surrealistic expressions. Based on the findings here, the author created an interactive media art project, termed <Viewporter>, and compared a surrealistic AI technique with social phenomena pertaining to city development. <Viewporter> depicts a landscape of a non-existent city and shows this view through a device that resembles a telescope. Developing this project, the author aimed to visualize the subconscious desires of a group, which the viewer can internalize through the artwork. This study shows the future direction of surrealistic artworks using AI for image generation, which is to evoke and drive the viewer’s subconscious desires."
섬유 드레이프 이미지를 활용한 드레이프 생성 모델 구현에 관한 연구,2021,"['드레이프', '조건부 적대적 생성 신경망', '3D 시뮬레이션', 'Drape', 'Conditional Generative Adversarial Network', '3D Simulation']","드레이프는 의상의 외형을 결정하는 요인 중 하나로 섬유·패션 산업에서 매우 중요한 요소 중 하나이다. 코로나 바이러스의 영향으로 비대면 거래가 활성화되고 있는 시점에서, 드레이프값을 요구하는 업체들이 많아지고 있다. 하지만 중소기업이나 영세기업의 경우, 드레이프를 측정하는 것에 대한 시간과 비용적 부담을 느껴, 드레이프를 측정하는 데에 어려움을 겪고 있다. 따라서 본 연구는 디지털 물성을 측정하여 생성된 3D 시뮬레이션 이미지를 통해 조건부 적대적 생성 신경망을 이용하여 입력된 소재의 물성값에 대한 드레이프 이미지 생성을 목표로 하였다. 기존 보유한 736개의 디지털 물성값을 통해, 드레이프 이미지를 생성하였으며, 이를 모델 학습에 이용하였다. 이후 생성 모델을 통해 나온 이미지 샘플에 대하여 드레이프 값을 계산하였다. 실제 드레이프 실험 값과 생성 드레이프 값 비교결과, 첨두수의 오차는 0.75개였으며, 드레이프값의 평균 오차는 7.875의 오차를 보임을 확인할 수 있었다.","Drape is one of the factors that determine the shape of clothes and is one of the very important factors in the textile and fashion industry. At a time when non-face-to-face transactions are being activated due to the impact of the coronavirus, more and more companies are asking for drape value. However, in the case of small and medium-sized enterprises (SMEs), it is difficult to measure the drape, because they feel the burden of time and money for measuring the drape. Therefore, this study aimed to generate a drape image for the material property value input using a conditional adversarial neural network through 3D simulation images generated by measuring digital properties. A drape image was created through the existing 736 digital property values, and this was used for model training. Then, the drape value was calculated for the image samples obtained through the generative model. As a result of comparing the actual drape experimental value and the generated drape value, it was confirmed that the error of the peak number was 0.75, and the average error of the drape value was 7.875"
Self-Attention을 적용한 문장 임베딩으로부터 이미지 생성 연구,2021,"['자연어 처리', '이미지 생성', '적대적 신경망', 'Natural Language Processing', 'Image generation', 'Generative Adversarial Network']","사람이 어떤 문장을 보고 그 문장에 대해 이해하는 것은 문장 안에서 주요한 단어를 이미지로 연상시켜 그 문장에 대해 이해한다. 이러한 연상과정을 컴퓨터가 할 수 있도록 하는 것을 text-to-image라고 한다. 기존 딥 러닝 기반 text-to-image 모델은 Convolutional Neural Network(CNN)-Long Short Term Memory(LSTM), bi-directional LSTM을 사용하여 텍스트의 특징을 추출하고, GAN에 입력으로 하여 이미지를 생성한다. 기존 text-to-image 모델은 텍스트 특징 추출에서 기본적인 임베딩을 사용하였으며, 여러 모듈을 사용하여 이미지를 생성하므로 학습 시간이 오래 걸린다. 따라서 본 연구에서는 자연어 처리 분야에서 성능 향상을 보인 어텐션 메커니즘(Attention Mechanism)을 문장 임베딩에 사용하여 특징을 추출하고, 추출된 특징을 GAN에 입력하여 이미지를 생성하는 방법을 제안한다. 실험 결과 기존 연구에서 사용되는 모델보다 inception score가 높았으며 육안으로 판단하였을 때 입력된 문장에서 특징을 잘 표현하는 이미지를 생성하였다. 또한, 긴 문장이 입력되었을 때에도 문장을 잘 표현하는 이미지를 생성하였다.","When a person sees a sentence and understands the sentence, the person understands the sentence by reminiscent of the main word in the sentence as an image. Text-to-image is what allows computers to do this associative process. The previous deep learning-based text-to-image model extracts text features using Convolutional Neural Network (CNN)-Long Short Term Memory (LSTM) and bi-directional LSTM, and generates an image by inputting it to the GAN. The previous text-to-image model uses basic embedding in text feature extraction, and it takes a long time to train because images are generated using several modules. Therefore, in this research, we propose a method of extracting features by using the attention mechanism, which has improved performance in the natural language processing field, for sentence embedding, and generating an image by inputting the extracted features into the GAN. As a result of the experiment, the inception score was higher than that of the model used in the previous study, and when judged with the naked eye, an image that expresses the features well in the input sentence was created. In addition, even when a long sentence is input, an image that expresses the sentence well was created."
티타늄 적층 제조 표면 조도 향상을 위한 DC GAN 심층신경망 연구,2021,"['Convolutional Neural Network(합성곱 신경망)', 'Directed Energy Deposition(직접에너지 적층방식)', 'Ti-6Al-4V Powder(티타늄 합금 분말)', 'Process Condition Optimization(공정 조건 최적화)', 'Generative Adversarial Networks(적대적 생성 신경망)']","Direct Energy Deposition (DED) 공정은 금속 분말을 직접 분사하여 레이저로 소결하는 성형 기술이며, 큰 금속 부품을 제조하는 데에 유용한 공정이다. 하지만, 다른 적층 성형 방식에 비해 표면 조도가 낮다는 단점이 있다. 본 연구에서는 티타늄 합금 분말로 DED 공정 시 표면 조도에 영향을 주는 세 가지 공정 변수를 조절하고 그에 따라 제조된 조형체 표면을 2D Scan한 이미지로 합성곱 신경망 기반 기계학습을 진행하였다. 테스트 셋 기준 MAPE 80 %이상의 정확도로 이미지의 공정 조건을 예측해냈다. 또한 DC-GAN으로 생성한 이미지로 조형물 조도 상태 예측을 진행하였다. 이로써 티타늄 합금 분말에 대한 DED 공정시의 표면 조도 개선에 인공 지능이 적극 활용될 것으로 기대한다.","The Direct Energy Deposition (DED) process is one of the additive manufacturing (AM) that sprays metal powder directly into a high-power laser and is useful for manufacturing large metal parts. However, there is a bottleneck that surface roughness is relatively low compared to other AM methods. In this work, we controlled three process variables that affect surface illumination during the DED process with titanium powder material and conducted convolutional neural network-based machine learning based on 2D scanned images of the sculptural surface manufactured accordingly. We predicted the process conditions of images with accuracy of more than 80% of MAPE based on test sets. In addition, we visually observed surface roughness with images generated by DC-GAN. It is expected that artificial intelligence will be actively used to improve surface roughness during the DED process for titanium alloy powder materials."
Adversarial Sparsity Mapping Network to Defense Against Adversarial Attacks,2021,"['generative adversarial network', 'image generation', 'adversarial attacks']",적대적 네트워크는 서로 다른 이미지 처리 작업에서 우수한 정확도를 달성했다. 생성적 적대 네트워크의 핵심은 출력을 참조 이미지로써 개선하기 위해 비지도 학습 프로세스를 채택한다는 것이다. 그러나 이 네트워크는 여전히 대상을 식별하기엔 느린 학습 과정과 학습 과적합과 같은 문제에 직면해 있다. 적대적 공격은 모델이 원하는 이미지 처리 작업을 달성하기 어렵게 만든다. 본 논문은 적대적 공격으로부터 무력화하기 위해 심층 신경망인 적대적 모델을 제시한다. 제안된 모듈은 적대적 공격을 무력화하기 위해 적대적 희소성 매핑 네트워크를 채택한다. 적대적 이미지 생성 작업은 제안한 방법으로 적대적 공격에 대해 높은 견고성을 제공한다는 것을 보여준다.,"Adversarial networks achieved superior accuracy in different image processing tasks. The core advantage of a generative adversarial network is that it adopts an unsupervised learning process to improve the output as the reference image. However, the network still faces problems like training overfitting and the slow learning process to identify the target. These problems are conducting by adversarial attacks. Adversarial attacks create the optical illusion that makes the model mistake to achieve the desired image processing task. This paper presents an adversarial model for fusing deep neural networks from adversarial attacks. The proposed module adopts the adversarial sparsity mapping network to fusing the adversarial attacks. The adversarial image generation task has shown that the proposed defense provides high robustness against adversarial attacks."
Facial Emotion Recognition Data Augmentation using Generative Adversarial Network,2021,"['적대적 생성 신경망', '데이터 증강', '얼굴 감정 인식', '이미지 간 변환', 'generative adversarial network', 'data augmentation', 'facial emotion recognition', 'image-to-image translation']",국문 초록 정보 없음,다국어 초록 정보 없음
Research on WGAN models with Renyi Differential Privacy,2021,"['적대적 생성 신경망', '데이터 프라이버시', '차분 프라이버시', 'Renyi 차분 프라이버시', 'Generative Adversarial Network', 'Data privacy', 'Differential privacy', 'Renyi Differential privacy']",국문 초록 정보 없음,다국어 초록 정보 없음
