title,date,keywords,abstract,multilingual_abstract
시계열 예측을 위한 스타일 기반 트랜스포머,2021,"['Time Series Forecasting', 'Transformer', 'Generative Decoder', 'Style Transfer', '시계열 예측', '트랜스포머', '생성 디코더', '스타일 변환']",,"Time series forecasting refers to predicting future time information based on past time information. Accurately predicting future information is crucial because it is used for establishing strategies or making policy decisions in various fields. Recently, a transformer model has been mainly studied for a time series prediction model. However, the existing transformer model has a limitation in that it has an auto-regressive structure in which the output result is input again when the prediction sequence is output. This limitation causes a problem in that accuracy is lowered when predicting a distant time point. This paper proposes a sequential decoding model focusing on the style transformation technique to handle these problems and make more precise time series forecasting. The proposed model has a structure in which the contents of past data are extracted from the transformer-encoder and reflected in the style-based decoder to generate the predictive sequence. Unlike the decoder structure of the conventional auto-regressive transformer, this structure has the advantage of being able to more accurately predict information from a distant view because the prediction sequence is output all at once. As a result of conducting a prediction experiment with various time series datasets with different data characteristics, it was shown that the model presented in this paper has better prediction accuracy than other existing time series prediction models."
언어 학습자로서의 신경망 언어모델: 영어 주어-동사 일치를 중심으로,2021,"['language model', 'GPT-2', 'linguistic generalization', 'subject-verb agreement', 'interference effect', 'plural-singular asymmetry', '언어모델', '언어(학) 일반화', '주어-동사 일치', '간섭효과', '복수-단수 비대칭']",,"This paper assesses the language-processing ability of the neural language model (L2-GPT-2) trained on data sets of English textbooks published in Korea using the Generative Pre-trained Transformer (GPT)-2. Assuming that the language model (LM) is also an (artificial) language learner, we test it focusing on subject-verb agreement in English. It is a well-established fact that L1 speakers exhibit facilitatory interference effects in ungrammatical sentences with a plural subject and a singular form of verb. Unlike human native speakers, L2-GPT-2 as well as L1-GPT-2 display such effects in ungrammatical sentences either with a plural subject and a singular form of verb, or with a singular subject and a plural form of verb. Though there is a significant difference between human speakers and neural LMs in processing subject-verb agreement, the two LMs’ sensitivity to interference by a distractor NP points to the fact that they can attain a remarkably human-like linguistic generalization on subject-verb agreement."
FEM Simulation and Test Verification of PD Ultrasonic Signal Propagation in a Power Transformer Model,2021,"['Power transformers', 'Partial discharge', 'FEM', 'Propagation property']",,"Ultrasonic signals will be generated when partial discharge occurs in internal insulation faults in large oil immersed power transformers: because the ultrasonic signal has strong anti-interference ability and has no direct electromagnetic contact with the equipment, it is widely used in transformer fault detection and positioning. In this paper, the fi nite element method (FEM) is used to simulate the ultrasonic signal in a 35 kV power transformer. The infl uence of transformer case on ultrasonic signal propagation is considered, and the propagation law of the ultrasonic signal inside the transformer is obtained. Fabry–Pérot (F–P) fi bre acoustic sensors with a centre frequency of 28 kHz were fabricated. A partial discharge detection test was carried out in a 35 kV transformer winding model using the F–P sensors. The test results show that the ultrasonic waveform detected by the F–P sensors are in good agreement with the simulation results, and the propagation of the ultrasonic wave inside the transformer is verifi ed. It lays a foundation for detecting and locating PDs in power transformer by F–P acoustic sensors."
Analytical loss model of series-resonant indirect-matrix-type power electronics transformers using MOSFETs,2021,"['Analytical loss model', 'MOSFET', 'Series-resonant dc-dc converter', 'Indirect-matrix converter', 'Power electronics transformer', 'High efficiency']",,"A MOSFET-based series-resonant indirect-matrix-type power electronic transformer (PET) consists of line-frequency-switching folding-unfolding bridges and series-resonant dc-dc converters (SRCs), which is an attractive choice to achieve ac-ac conversion due to its high efficiency and high power density. However, the conduction losses, switching losses, and core losses in each of the high-frequency switching cycles T<sub>s</sub> are different due to the pulsating dc voltage |ac|, which introduces difficulties in the calculation of losses. In addition, the small dc capacitors also participate in the resonance, and the resonant current shape deviates from a pure sine. Therefore, the conventional loss model is not suitable for PETs. In this paper, the time-domain analysis of SRC resonant current considering the dc capacitor is developed. Then, the analytical expression of the resonant current RMS value in grid cycle T<sub>g</sub> is derived, which is more accurate in calculating conduction loss than the conventional model. In addition, it avoids the calculating losses in each T<sub>s</sub>. Next, an analytical switching loss model is developed based on the curve fitting of the capacitance-voltage relationship. A simplified analytical core loss model is provided. Each part of the loss of the PET is verified by thermal simulations, and the total losses are verified by efficiency tests on an experiment prototype."
양방향 인재매칭을 위한 BERT 기반의 전이학습 모델,2021,"['HR Matching', 'Job Recommendation', 'BERT', 'Transfer Learning', 'Pre-trained Language Model', 'Fine-tuning Deep Learning Model']",,"While youth unemployment has recorded the lowest level since the global COVID-19 pandemic, SMEs(small and medium sized enterprises) are still struggling to fill vacancies. It is difficult for SMEs to find good candidates as well as for job seekers to find appropriate job offers due to information mismatch. To overcome information mismatch, this study proposes the fine-turning model for bidirectional HR matching based on a pre-learning language model called BERT(Bidirectional Encoder Representations from Transformers). The proposed model is capable to recommend job openings suitable for the applicant, or applicants appropriate for the job through sufficient pre-learning of terms including technical jargons. The results of the experiment demonstrate the superior performance of our model in terms of precision, recall, and f1-score compared to the existing content-based metric learning model. This study provides insights for developing practical models for job recommendations and offers suggestions for future research."
Analyzing the Impact of Sequential Context Learning on the Transformer Based Korean Text Summarization Model,2021,"['한국어 텍스트 요약', '제목 생성', '어텐션 메커니즘', '트랜스포머 모델', 'Korean text summarization', 'headline generation', 'attention mechanism', 'transformer model']",,
음성감정인식 성능 향상을 위한 트랜스포머 기반 전이학습 및 다중작업학습,2021,,,"It is hard to prepare sufficient training data for speech emotion recognition due to the difficulty of emotion labeling. In this paper, we apply transfer learning with large-scale training data for speech recognition on a transformer-based model to improve the performance of speech emotion recognition. In addition, we propose a method to utilize context information without decoding by multi-task learning with speech recognition. According to the speech emotion recognition experiments using the IEMOCAP dataset, our model achieves a weighted accuracy of 70.6 % and an unweighted accuracy of 71.6 %, which shows that the proposed method is effective in improving the performance of speech emotion recognition."
DeepKLM - 통사 실험을 위한 전산 언어모델 라이브러리 -,2021,"['BERT', 'language model', 'surprisal', 'experimental syntax', 'corpus', '언어모델', '서프라이절', '실험통사론', '말뭉치']",,"This paper introduces DeepKLM, a deep learning library for syntactic experiments. The library enables researchers to use the state-of-the-art deep computational language model, based on BERT (Bidirectional Encoder Representations from Transformers). The library, written in Python, works to fill the masked part of a sentence with a specific token, similar to the Cloze task in the traditional language experiments. The output value of surprisal is related to human language processing in terms of speed and complexity. The library additionally provides two visualization tools of the heatmap and the attention head visualization. This article also provides two case studies of NPIs and reflexives employing the library. The library has room for improvement in that the BERT-based components are not entirely on par with those in human language sentences. Despite such limits, the case studies imply that the library enables us to assess human and deep learning machines’ language ability."
분산전원용 PCS의 누설전류 등가회로 모델 및 분석,2021,"['Leakage current', 'Common-mode Voltage', 'Equivalent circuit', 'Parasitic capacitance']",,"Due to continuous environmental problems around the world and an increase in energy consumption, interest in solar power, wind power, and hydropower is increasing. Among them, photovoltaics is the most used in industries and homes because it is easy to repair and can be used for a long time. In photovoltaic PCS, parasitic capacitance is generated between the photovoltaic module and the ground due to the installation structure of the photovoltaic module. This parasitic capacitance, VCM, which is a common mode voltage generated by switching of PCS, is applied to CP, and leakage current occurs. In this paper, the common mode voltage characteristics at three-phase three-level, and three-phase two-level were compared. Proposed an equivalent circuit that was equalized from unaffected by grid impedance the point of view of the common-mode by dividing it into a transformerless type PCS connected to the grid ground and a transformer type PCS applying a transformer. The validity of the proposed equivalent circuit was verified by constructing a three-phase three-level PCS and comparing the equivalent circuit using the experiment measurements and PSIM. In the transformerless PCS, the leakage current is equivalent to 1.13A in the equivalent circuit and 1.14A in the experiment. In the transformer type PCS, the equivalent circuit is 68mA and the experiment 70mA. In addition, for the validity of the proposed equivalent circuit, FFT analysis of leakage current, which is the switching frequency, was performed."
Number Normalization in Korean Using the Transformer Model,2021,"['텍스트 정규화', '숫자 정규화', '시퀀스 투 시퀀스', '트랜스포머', '웹 텍스트 데이터', 'text normalization', 'number normalization', 'sequence to sequence', 'transformer', 'web text data']",,
Improving BERT-based Sentiment Analysis Model using Graph-based Ranking Mechanism,2021,"['인공지능', '자연어 처리', '감정분석', '그래프 기반 메커니즘', '인공신경망', 'BERT', 'artificial intelligence', 'natural language processing', 'sentiment analysis', 'graph-based mechanism', 'neural network']","문서 처리의 자동화에 대한 필요성이 대두됨에 따라 인공지능을 통한 자연어 처리(Natural Language Processing) 분야에서 연구가 활발하게 진행되고 있다. 본 연구에서는 자연어 처리 분야 중 특히 감정분석(Sentiment Analysis) 분야에서 그래프 기반의 순위화 메커니즘을 통해 추출한 형태소, 또는 요약 기반의 벡터인 GRAB vector(GRAph-Based vector)를 제안하고 이를 통해 기존의 BERT(Bidirectional Embedding Representations from Transformers)모델에 적용한다. 이를 통하여 더욱 강인하고 성능이 향상된 GRAB-BERT 모델을 제안한다. 또한, GRAB vector가 모델에 미치는 영향을 분석하기 위하여 재귀적 인공신경망(Recurrent Neural Network) 기반 모델들과 BERT 기반 모델에 시퀀스 입력 길이를 각각 다르게 학습한 경우 GRAB vector의 적용 여부에 따른 성능을 한국어와 영어에 대하여 분석한다. 결과적으로 형태소 단위로 추출된 벡터가 BERT와 같은 병렬적으로 문자를 처리하는 모델의 경우, 더욱 강인한 학습이 가능하며 성능이 향상됨을 보인다. 추가로, BERT 기반의 모델과 반대로 재귀적 인공신경망 기반모델들의 경우 형태소 기반이 아닌 그래프 기반 요약문 추출을 통한 벡터를 적용한 경우가 더 효과적임을 보인다.","Due to the need for automated document processing, artificial intelligence research has been actively conducted in the field of natural language processing(NLP). In this paper, we propose the GRAB vector(GRAph-Based vector), which consists of vectorized keyword-based morphemes or summaries extracted from the graph-based ranking mechanism. Next, we applied the GRAB vector to the sentiment analysis task, which is an NLP task, and we proposed a more accurate and robust model, GRAB-BERT(GRAB vector-BERT model). Then, to analyze the effect of the GRAB vector on this model, we compared the performances of recurrent neural network models(RNNs) and BERT models with or without the application of the GRAB vector on both English and Korean text samples with different sequence sizes. Our results demonstrate that applying the GRAB vector to models such as BERT to process inputs in parallel improves the robustness of the model and its performance. Furthermore, unlike BERT-based models, RNN models are more effective when applying graph-based extracted summaries than when applying morpheme-based summaries."
Transformer 기반 비윤리적 문장 탐지,2021,"['인공지능', '문장분류', '자연어처리', '비윤리적 문장', '딥러닝', 'artificial intelligence', 'sentence classification', 'natural language processing', 'unethical sentence', 'deep learning']",,"Social network services (SNS) have spread due to the development of information and communication technology, but at the same time, they have caused serious social problems such as malicious comments. The number of arrests and incidents of cyber defamation and insults increased sharply from 8,880 in 2014 to 16,633 in 2019, and measures are required to solve the problem. However, existing regulations such as IP blacklist and slang filters make it difficult to detect malicious comments. Therefore, we need an artificial intelligence model optimized for unethical sentence detection. This paper proposes a Transformer-based unethical sentence detection model that has shown high performance in natural language processing. The model showed accuracy of 95.03% and will be utilized as an unethical sentence detection model. Also, it will be applied in various fields such as streaming services as well as comments on SNS."
Self-revising Transformer with Multi-view for Image Captioning,2021,"['자연어 처리', '이미지 캡션 생성', '멀티-헤드 주의 기제 기법', '다중 관점 인코더', 'natural language processing', 'image captioning', 'multi-head attention', 'multi-view encoder']",,
무인 감시 Transformer,2021,"['Deep learning', 'Transformer', 'Segmentation', 'Visual surveillance']",,"In a visual surveillance system, even the same object should exhibit different detection results depending on the surrounding environment configuration. To this end, the model for visual surveillance needs to detect an object by understanding the state of the object according to the environment on the image. In this study, for such visual surveillance, an object segmentation model applied with a transformer structure suitable for image processing was used to divide objects inside the image into foreground and background. A modified attention structure was presented for the corresponding transformer structure, and the results of object segmentation models according to the type of input data were compared."
Design and Modeling of Octagonal Planar Inductor and Transformer in Monolithic Technology for RF Systems,2021,['Forward converter  · Inductor  · Integration  · Octagonal  · Planar  · RF  · Transformer'],,"This paper presents the design and modeling of planar inductor and transformer for their integration in a Forward converter.The windings are of octagonal spiral planar topology. Basing on Wheeler method, we evaluate the inductance values of planar coils. All parasitic eff ects generated by stacking of diff erent material layers are summarized perfectly in the π-electrical model of both on chip inductor and transformer. The electromagnetic simulation, by using COMSOL Multiphysics 5.3 software, illustrates the distribution of magnetic fi eld lines, the current density and the temperature distribution in our integrated micro coils. To validate the diff erent geometric and electrical parameters values, we have simulated the circuit of the Forward converter containing the π-electrical circuit of on chip integrated inductor and transformer, using the software TINA 9.0."
Zero-anaphora resolution in Korean based on deep language representation model: BERT,2021,"['attention', 'bidirectional encoder representations from transformers (BERT)', 'deep learning', 'language representation model', 'zero-anaphora resolution (ZAR)']",,"It is necessary to achieve high performance in the task of zero anaphora resolution (ZAR) for completely understanding the texts in Korean, Japanese, Chinese, and various other languages. Deep-learning-based models are being employed for building ZAR systems, owing to the success of deep learning in the recent years. However, the objective of building a high-quality ZAR system is far from being achieved even using these models. To enhance the current ZAR techniques, we fine-tuned a pretrained bidirectional encoder representations from transformers (BERT). Notably, BERT is a general language representation model that enables systems to utilize deep bidirectional contextual information in a natural language text. It extensively exploits the attention mechanism based upon the sequence-transduction model Transformer. In our model, classification is simultaneously performed for all the words in the input word sequence to decide whether each word can be an antecedent. We seek end-to-end learning by disallowing any use of hand-crafted or dependency-parsing features. Experimental results show that compared with other models, our approach can significantly improve the performance of ZAR."
Korean automatic spacing using pretrained transformer encoder and analysis,2021,"['attention', 'BERT', 'Korean automatic spacing', 'natural language processing', 'pretrained transformer encoder']",,"Automatic spacing in Korean is used to correct spacing units in a given input sentence. The demand for automatic spacing has been increasing owing to frequent incorrect spacing in recent media, such as the Internet and mobile networks. Therefore, herein, we propose a transformer encoder that reads a sentence bidirectionally and can be pretrained using an out‐of‐task corpus. Notably, our model exhibited the highest character accuracy (98.42%) among the existing automatic spacing models for Korean. We experimentally validated the effectiveness of bidirectional encoding and pretraining for automatic spacing in Korean. Moreover, we conclude that pretraining is more important than fine‐tuning and data size."
Transmission Distance Improvement of a Two-Coil Magnetic Resonance Wireless Power Transmission System Using Transformers,2021,"['Magnetic Resonance Modeling', 'Q-Factor', 'Wireless Power Transfer']",,"In this paper, a two-coil magnetic resonance wireless transmission system is studied to improve the transmission distance using transformers. A conventional two-coil and four-coil wireless power transmission (WPT) system as well as a two-coil WPT system with transformers are analyzed comparatively via circuit simulations and experiments. Circuit analysis was used to predict the transmission distance with the highest efficiency. To verify the improvement in the transmission distance of the proposed system, transformers with inductance values of 80, 100, and 140 μH were fabricated and analyzed through experiments and simulations. A maximum S21 parameter of 0.76 was noted when the inductance was 80 μH and the transmitting distance was 4 cm. The experimental results almost matched the simulation results. From the experiments, it was shown that the transmitting distance of a WPT system can be adjusted by using transformers. Additionally, it was found that the transmitting distance is inversely proportional to the transformer inductance, and the efficiency of the WPT system decreases with the transmitting distance."
Personality Prediction Based on Text Analytics Using Bidirectional Encoder Representations from Transformers from English Twitter Dataset,2021,"['Personality prediction', 'Twitter', 'Big Five personality traits', 'BERT']",,"Personality traits can be inferred from a person’s behavioral patterns. One example is when writing posts on social media. Extracting information about individual personalities can yield enormous benefits for various applications such as recommendation systems, marketing, or hiring employees. The objective of this research is to build a personality prediction system that uses English texts from Twitter as a dataset to predict personality traits. This research uses the Big Five personality traits theory to analyze personality traits, which consist of openness, conscientiousness, extraversion, agreeableness, and neuroticism. Several classifiers were used in this research, such as support vector machine, convolutional neural network, and variants of bidirectional encoder representations from transformers (BERT). To improve the performance, we implemented several feature extraction techniques, such as N-gram, linguistic inquiry and word count (LIWC), word embedding, and data augmentation. The best results were obtained by fine-tuning the BERT model and using it as the main classifier of the personality prediction system. We conclude that the BERT performance could be improved by using individual tweets instead of concatenated ones."
음질 및 속도 향상을 위한 선형 스펙트로그램 활용 Text-to-speech,2021,"['speech synthesis', 'machine learning', 'artificial intelligence', 'text-to-speech (TTS)', '음성 합성', '기계 학습', '인공지능']","인공신경망에 기반한 대부분의 음성 합성 모델은 고음질의 자연스러운 발화를 생성하기 위해 보코더 모델을 사용한다. 보코더 모델은 멜 스펙트로그램 예측 모델과 결합하여 멜 스펙트로그램을 음성으로 변환한다. 그러나 보코더 모델을 사용할 경우에는 많은 양의 컴퓨터 메모리와 훈련 시간이 필요하며, GPU가 제공되지 않는 실제 서비스환경에서 음성 합성이 오래 걸린다는 단점이 있다. 기존의 선형 스펙트로그램 예측 모델에서는 보코더 모델을 사용하지 않으므로 이 문제가 발생하지 않지만, 대신에 고품질의 음성을 생성하지 못한다. 본 논문은 뉴럴넷 기반 보코더를 사용하지 않으면서도 양질의 음성을 생성하는 Tacotron 2 & Transformer 기반의 선형 스펙트로그램 예측 모델을 제시한다. 본 모델의 성능과 속도 측정 실험을 진행한 결과, 보코더 기반 모델에 비해 성능과 속도 면에서 조금 더 우세한 점을 보였으며, 따라서 고품질의 음성을 빠른 속도로 생성하는 음성 합성 모델 연구의 발판 역할을 할 것으로 기대한다.","Most neural-network-based speech synthesis models utilize neural vocoders to convert mel-scaled spectrograms into high-quality, human-like voices. However, neural vocoders combined with mel-scaled spectrogram prediction models demand considerable computer memory and time during the training phase and are subject to slow inference speeds in an environment where GPU is not used. This problem does not arise in linear spectrogram prediction models, as they do not use neural vocoders, but these models suffer from low voice quality. As a solution, this paper proposes a Tacotron 2 and Transformer-based linear spectrogram prediction model that produces high-quality speech and does not use neural vocoders. Experiments suggest that this model can serve as the foundation of a high-quality text-to-speech model with fast inference speed."
