title,date,keywords,abstract,multilingual_abstract
Sentiment analysis of Korean movie reviews using XLM-R,2021,"['Sentiment analysis', 'Transformer', 'BERT', 'XLM-R', 'Transfer learning', 'Fine tuning']",국문 초록 정보 없음,"Sentiment refers to a person's thoughts, opinions, and feelings toward an object. Sentiment analysis is a process of collecting opinions on a specific target and classifying them according to their emotions, and applies to opinion mining that analyzes product reviews and reviews on the web. Companies and users can grasp the opinions of public opinion and come up with a way to do so. Recently, natural language processing models using the Transformer structure have appeared, and Google's BERT is a representative example. Afterwards, various models came out by remodeling the BERT. Among them, the Facebook AI team unveiled the XLM-R (XLM-RoBERTa), an upgraded XLM model. XLM-R solved the data limitation and the curse of multilinguality by training XLM with 2TB or more refined CC (CommonCrawl), not Wikipedia data. This model showed that the multilingual model has similar performance to the single language model when it is trained by adjusting the size of the model and the data required for training. Therefore, in this paper, we study the improvement of Korean sentiment analysis performed using a pre-trained XLM-R model that solved curse of multilinguality and improved performance."
워드 임베딩 클러스터링을 활용한 리뷰 다중문서 요약기법,2021,"['Muti-document', 'Text Summarization', 'Transformer', 'Word Embedding', '다중문서', '텍스트 요약', '트랜스포머', '워드 임베딩']",국문 초록 정보 없음,"Multi-document refers to a document consisting of various topics, not a single topic, and a typical example is online reviews. There have been several attempts to summarize online reviews because of their vast amounts of information. However, collective summarization of reviews through existing summary models creates a problem of losing the various topics that make up the reviews. Therefore, in this paper, we present method to summarize the review with minimal loss of the topic. The proposed method classify reviews through processes such as preprocessing, importance evaluation, embedding substitution using BERT, and embedding clustering. Furthermore, the classified sentences generate the final summary using the trained Transformer summary model. The performance evaluation of the proposed model was compared by evaluating the existing summary model, seq2seq model, and the cosine similarity with the ROUGE score, and performed a high performance summary compared to the existing summary model."
Hyperparameter experiments on end-to-end automatic speech recognition,2021,"['automatic speech recognition', 'transformer', 'neural network', 'hyperparameters', 'optimization']",국문 초록 정보 없음,"End-to-end (E2E) automatic speech recognition (ASR) has achieved promising performance gains with the introduced self-attention network, Transformer. However, due to training time and the number of hyperparameters, finding the optimal hyperparameter set is computationally expensive. This paper investigates the impact of hyperparameters in the Transformer network to answer two questions: which hyperparameter plays a critical role in the task performance and training speed. The Transformer network for training has two encoder and decoder networks combined with Connectionist Temporal Classification (CTC). We have trained the model with Wall Street Journal (WSJ) SI-284 and tested on devl93 and eval92. Seventeen hyperparameters were selected from the ESPnet training configuration, and varying ranges of values were used for experiments. The result shows that “num blocks” and “linear units” hyperparameters in the encoder and decoder networks reduce Word Error Rate (WER) significantly. However, performance gain is more prominent when they are altered in the encoder network. Training duration also linearly increased as “num blocks” and “linear units” hyperparameters’ values grow. Based on the experimental results, we collected the optimal values from each hyperparameter and reduced the WER up to 2.9/1.9 from dev93 and eval93 respectively."
흐름이 있는 문서에 적합한 비지도학습 추상 요약 방법,2021,"['NLP', 'Summarization', 'GAN', 'BERT', 'Transformer']",국문 초록 정보 없음,"Recently, a breakthrough has been made in the NLP area by Transformer techniques based on encoder-decoder. However, this only can be used in mainstream languages where millions of dataset are well-equipped, such as English and Chinese, and there is a limitation that it cannot be used in non-mainstream languages where dataset are not established. In addition, there is a deflection problem that focuses on the beginning of the document in mechanical summarization. Therefore, these methods are not suitable for documents with flows such as fairy tales and novels. In this paper, we propose a hybrid summarization method that does not require a dataset and improves the deflection problem using GAN with two adaptive discriminators. We evaluate our model on the CNN/Daily Mail dataset to verify an objective validity. Also, we proved that the model has valid performance in Korean, one of the non-mainstream languages."
Finite Element Analysis of the Effects of Process and Material Parameters on the LVDT Output Characteristics,2021,"['LVDT(선형가변차동변압기)', 'Output Characteristic(출력 특성)', 'Supply Power(공급 전원)', 'Core Material(코어 재질)', 'Finite Element Analysis(유한요소해석)']",국문 초록 정보 없음,"Linear variable differential transformer (LVDT) is a displacement sensor and is commonly used owing to its wide measurement range, excellent linearity, high sensitivity, and precision. To improve the output characteristics of LVDT, a few studies have been conducted to analyze the output using a theoretical method or a finite element method. However, the material properties of the core and the electromagnetic force acting on the core were not considered in the previous studies. In this study, a finite element analysis model was proposed considering the characteristics of the LVDT composed of coils, core, magnetic shell and electric circuit, and the core displacement. Using the proposed model, changes in sensitivity and linear region of LVDT according to changes in process and material parameters were analyzed. The outputs of the LVDT model were compared with those of the theoretical analysis, and then, the proposed analysis model was validated. When the electrical conductivity of the core was high and the relative magnetic permeability was low, the decrease in sensitivity was large. Additionally, an increase in the frequency of the power led to further decrease in sensitivity. The electromagnetic force applied on the core increased as the voltage increased, the frequency decreased, and the core displacement increased."
SMERT: Single-stream Multimodal BERT for Sentiment Analysis and Emotion Detection,2021,"['자연어 처리', '멀티 모달', '감성 분석', '감정 탐지', '단일 입출력 트랜스포머', 'natural language processing', 'multimodal', 'sentiment analysis', 'emotion detection', 'single-stream transformer', 'BERT']",국문 초록 정보 없음,다국어 초록 정보 없음
Automatic Categorization of Islamic Jurisprudential Legal Questions using Hierarchical Deep Learning Text Classifier,2021,"['Islamic Fatwa', 'Natural Language Processing', 'Text Classification', 'Question Answering', 'Recurrent Neural Networks', 'Transformers']",국문 초록 정보 없음,"The Islamic jurisprudential legal system represents an essential component of the Islamic religion, that governs many aspects of Muslims' daily lives. This creates many questions that require interpretations by qualified specialists, or Muftis according to the main sources of legislation in Islam. The Islamic jurisprudence is usually classified into branches, according to which the questions can be categorized and classified. Such categorization has many applications in automated question-answering systems, and in manual systems in routing the questions to a specialized Mufti to answer specific topics. In this work we tackle the problem of automatic categorisation of Islamic jurisprudential legal questions using deep learning techniques. In this paper, we build a hierarchical deep learning model that first extracts the question text features at two levels: word and sentence representation, followed by a text classifier that acts upon the question representation. To evaluate our model, we build and release the largest publicly available dataset of Islamic questions and answers, along with their topics, for 52 topic categories. We evaluate different state-of-the art deep learning models, both for word and sentence embeddings, comparing recurrent and transformer-based techniques, and performing extensive ablation studies to show the effect of each model choice. Our hierarchical model is based on pre-trained models, taking advantage of the recent advancement of transfer learning techniques, focused on Arabic language."
Simple and effective neural coreference resolution for Korean language,2021,"['coreference resolution', 'head‐final language', 'Korean', 'pretrained language model', 'recurrent neural network']",국문 초록 정보 없음,"We propose an end‐to‐end neural coreference resolution for the Korean language that uses an attention mechanism to point to the same entity. Because Korean is a head‐final language, we focused on a method that uses a pointer network based on the head. The key idea is to consider all nouns in the document as candidates based on the head‐final characteristics of the Korean language and learn distributions over the referenced entity positions for each noun. Given the recent success of applications using bidirectional encoder representation from transformer (BERT) in natural language‐processing tasks, we employed BERT in the proposed model to create word representations based on contextual information. The experimental results indicated that the proposed model achieved state‐of‐the‐art performance in Korean language coreference resolution."
콘포머 기반 한국어 음성인식,2021,[],국문 초록 정보 없음,"We propose a speech recognition system based on conformer. Conformer is known to be convolution-augmented transformer, which combines transfer model for capturing global information with Convolution Neural Network (CNN) for exploiting local feature effectively. The baseline system is developed to be a transfer-based speech recognition using Long Short-Term Memory (LSTM)-based language model. The proposed system is a system which uses conformer instead of transformer with transformer-based language model. When Electronics and Telecommunications Research Institute (ETRI) speech corpus in AI-Hub is used for our evaluation, the proposed system yields 5.7 % of Character Error Rate (CER) while the baseline system results in 11.8 % of CER. Even though speech corpus is extended into other domain of AI-hub such as NHNdiguest speech corpus, the proposed system makes a robust performance for two domains. Throughout those experiments, we can prove a validation of the proposed system."
Explaining the translation error factors of Korean-Chinese machine translation services using self-attention visualization,2021,"['Self-attention', 'Machine translation', 'XAI', 'exBERT']",국문 초록 정보 없음,"This study analyzed the Korean-Chinese translation error factors of machine translation services such as Papago and Google translate through self-attention path visualization. Self-Attention is a key method of the Transformer and Bert NLP model and recently widely used in machine translation. The study analyzes the difference in the Attention path between ST (source text) and ST' which meaning does not change and the translation output appears more accurately. Understanding these attention path pattern differences and each translation result TT (target text), and TT', the study summarized three types of errors: symbols missing error, grammar error, and multiple meaning words error. The study analyzed using the xlm-ReBerta multilingual NLP model provided by exBERT, for self-attention visualization, and suggesting some suggestions for error resolution. Through the study, it was found that the cause of translation error can be well identified using the Self-Attention visualization method, and through the explanation, machine translation algorithm developers can use it to improve service quality, and researchers can more understand machine translation algorithms."
유사도 기반 이미지 캡션을 이용한 시각질의응답 연구,2021,[],국문 초록 정보 없음,"Visual Question Answering (VQA) and image captioning are tasks that require understanding of the features of images and linguistic features of text. Therefore, co-attention may be the key to both tasks, which can connect image and text. In this paper, we propose a model to achieve high performance for VQA by image caption generated using a pretrained standard transformer model based on MSCOCO dataset. Captions unrelated to the question can rather interfere with answering, so some captions similar to the question were selected to use based on a similarity to the question. In addition, stopwords in the caption could not affect or interfere with answering, so the experiment was conducted after removing stopwords. Experiments were conducted on VQA-v2 data to compare the proposed model with the deep modular co-attention network (MCAN) model, which showed good performance by using co-attention between images and text. As a result, the proposed model outperformed the MCAN model."
Automatic Classification of the Korean Triage Acuity Scale in Simulated Emergency Rooms Using Speech Recognition and Natural Language Processing: a Proof of Concept Study,2021,"['Triage', 'Classification', 'Machine Learning', 'Natural Language Processing', 'Deep Learning']",국문 초록 정보 없음,"Background: Rapid triage reduces the patients' stay time at an emergency department (ED). The Korean Triage Acuity Scale (KTAS) is mandatorily applied at EDs in South Korea.For rapid triage, we studied machine learning-based triage systems composed of a speech recognition model and natural language processing-based classification.Methods: We simulated 762 triage cases that consisted of 18 classes with six types of the main symptom (chest pain, dyspnea, fever, stroke, abdominal pain, and headache) and three levels of KTAS. In addition, we recorded conversations between emergency patients and clinicians during the simulation. We used speech recognition models to transcribe the conversation.Bidirectional Encoder Representation from Transformers (BERT), support vector machine (SVM), random forest (RF), and k-nearest neighbors (KNN) were used for KTAS and symptom classification. Additionally, we evaluated the Shapley Additive exPlanations (SHAP) values of features to interpret the classifiers.Results: The character error rate of the speech recognition model was reduced to 25.21% through transfer learning. With auto-transcribed scripts, support vector machine (area under the receiver operating characteristic curve [AUROC], 0.86; 95% confidence interval [CI], 0.81–0.9), KNN (AUROC, 0.89; 95% CI, 0.85–0.93), RF (AUROC, 0.86; 95% CI, 0.82–0.9) and BERT (AUROC, 0.82; 95% CI, 0.75–0.87) achieved excellent classification performance.Based on SHAP, we found “stress”, “pain score point”, “fever”, “breath”, “head” and “chest” were the important vocabularies for determining KTAS and symptoms.Conclusion: We demonstrated the potential of an automatic KTAS classification system using speech recognition models, machine learning and BERT-based classifiers."
Scene Text Recognition with Multi-decoders,2021,"['Scene text recognition', 'End to end frame', 'CTC decoder module', 'Attention decoder module']",국문 초록 정보 없음,"In this article, we focus on the scene text recognition problem, which is one of the challenging sub-files of computer vision because of the random existence of scene text. Recently, scene text recognition has achieved state-of-art performance because of the improvement of deep learning. At present, encoder-decoder architecture was widely used for scene recognition tasks, which consist of feature extractor, sequence module. Specifically, at the decoder part, connectionist temporal classification(CTC), attention mechanism, and transformer(self-attention) are three main approaches used in recent research. CTC decoder is flexible and can handle sequences with large changes in length for its align sequences features with labels in a frame-wise manner. Attention decoder can learn better and deeper feature expression and get the better position information of each character. Attention decoder can get more robust and accurate performance for both regular and irregular scene text. Moreover, a novel decoder mechanism is introduced in our study. The proposed architecture has several advantages: the model can be trained using the end-to-end manner under the condition of multi decoders, and can deal with the sequences of arbitrary length and the images of arbitrary shape. Extensive experiments on standard benchmarks demonstrate that our model’s performance is improved for regular and irregular text recognition."
Argument Facet Detection in Online Debates Based on Attention Weights and Clustering with Combined Similarity Matrices,2021,"['argument mining', 'argument facets', 'argument clustering', 'semantic similarities', 'debate texts', 'attention weights']",국문 초록 정보 없음,"The purpose of argument mining research is to analyze and understand the stances, content, and structures of large argumentative texts, such as online debates. For our research, we collected a list of identified arguments from online debates and attempted to use unsupervised methods to create a list of common justifications for each argument stance in each domain. We propose a model that clusters arguments by subtopics, or justifications, and then extracts the list of representative words for argument facets from each cluster. We were able to improve clustering performance by using a combination of three different similarity matrices (cosine similarity between BERT sentence embeddings, semantic textual similarity, and similarity between topic probability distributions) for the clustering algorithm. Our clustering produced 5%p and 7.5%p of ARI and V-measure values on average, which outperforms previous work in two of four domains. Additionally, we used a Transformer model to utilize the attention weights to discover argument facets, and we observed better performances compared to the method without attention weights."
Adaptive Distance Protection Scheme for Mutually Coupled Line,2021,['Adaptive relaying  · Distance protection  · Mutual coupling  · Mho characteristic  · Artifi cial neural networks'],국문 초록 정보 없음,"The availability of zero-sequence current, under normal circumstances, determines the accuracy of the operation of a distance relay which is connected to a mutually coupled parallel line. When this is not available, the system adopts a diff erent compensation factor which if, not properly calculated introduces errors in the relay operation. The proposed adaptive protection scheme, described in this paper, consists of three modular artifi cial neural networks model (ANN). This is developed using the feed-forward nonlinear backpropagation Levenberg–Marquardt algorithm that determines the actual status of the mutually coupled lines. The remote terminal units connected to the current and voltage transformers are used to acquire the appropriate data. The proposed scheme also carefully determines the ground distance element reach settings by calculating the apparent impedance while considering mutual coupling for all practical system confi gurations from the ANN; this eliminates the need for a compensation factor. The results of the apparent impedance (R + jX) calculated by the proposed adaptive and the conventional schemes, showed an average percentage error of (0.06% and 0.02%) and (15% and 41.5%) respectively. Having obtained this result, the performance of the proposed adaptive scheme showed the exact fault location with a higher accuracy when compared with a compensated conventional scheme"
Quasi resonant converter for autonomous power supply,2021,"['DC-DC power converters', 'Pulse width modulation', 'Quasiresonant converters', 'Shunt transistor']",국문 초록 정보 없음,"Quasiresonant converters (QRCs) are increasingly being used in autonomous power supply systems. These converters are efficient, have small dimensions, and operate stably when the load changes. This study is devoted to the development of a zero-current switching QRC with improved characteristics. The main advantages of this QRC are a wide range of regulation and a low level of output voltage ripple. These advantages are achieved by the recuperation of excess energy due to a transistor shunting the primary winding of a transformer. In this work, a mathematical model of advanced QRC (AQRC) is developed, and the quantitative relationship between the parameters of the AQRC power circuit elements is established. In addition, the electromagnetic processes occurring in the AQRC are studied on the Simulink model. Moreover, the AQRC characteristics for various operating modes are studied, and the rational parameters of its components are determined. Then, an AQRC prototype is created. The tests of the prototype are in good agreement with the models. Results show that the AQRC allows for the adjustment of the output voltage ranging from 0 to 100% of the rated value and has a standard level of electromagnetic compatibility."
열화상 이미지 분석을 통한 배전 설비 공정능력지수 감지 시스템 개발,2021,"['Object Detection', 'Process Capability Index', 'Thermal Imaging Technology']",국문 초록 정보 없음,"Purpose: The purpose of this study is to propose a system predicting whether an electricity distribution system is abnormal by analyzing the temperature of the deteriorated system. Traditional electricity distribution system abnormality diagnosis was mainly limited to post-inspection. This research presents a remote monitoring system for detecting thermal images of the deteriorated electricity distribution system efficiently hereby providing safe and efficient abnormal diagnosis to electricians.Methods: In this study, an object detection algorithm (YOLOv5) is performed using 16,866 thermal images of electricity distribution systems provided by KEPCO(Korea Electric Power Corporation). Abnormality/ Normality of the extracted system images from the algorithm are classified via the limit temperature. Each classification model, Random Forest, Support Vector Machine, XGBOOST is performed to explore 463,053 temperature datasets. The process capability index is employed to indicate the quality of the electricity distribution system.Results: This research performs case study with transformers representing the electricity distribution systems. The case study shows the following states: accuracy 100%, precision 100%, recall 100%, F1-score 100%. Also the case study shows the process capability index of the transformers with the following states: steady state 99.47%, caution state 0.16%, and risk state 0.37%.Conclusion: The sum of caution and risk state is 0.53%, which is higher than the actual failure rate. Also most transformer abnormalities can be detected through this monitoring system."
Characteristic analysis of new hybrid compensation topology for wireless charging circuits,2021,"['Wireless power transfer', 'Constant-current output', 'Constant-voltage output', 'Electric vehicle charging']",국문 초록 정보 없음,"Wireless power transfer (WPT) has the advantages of flexibility, safety, and high reliability. Thus, it is widely used in portable electronic equipment, electric vehicles (EV), medical equipment, and other fields. The resonance compensation method of wireless charging directly affects the gain characteristics of the output current and voltage. As a result, this is one of the main research focuses of wireless power transmission technology. A new hybrid compensation topology circuit is proposed in this paper, which is based on the EV constant-current (CC) and constant-voltage (CV) charging mode. In this hybrid topology circuit, an equivalent loosely coupled transformer T model is established for the primary and secondary coils. Through an analysis of the circuit principle, it is concluded that the wireless power transmission circuit can realize CC and CV outputs under a dynamic load change. The output power efficiency characteristics of the serial/parallel (S/P) compensation and serial/serial (S/S) compensation circuits are analyzed. In addition, the mutual inductance parameters are optimized by an efficiency power product method to achieve the overall optimal parameter design in terms of the circuit output power and efficiency. A simulation model and an experimental prototype of the wireless power transmission circuit are established. The design process of the circuit parameters under a given target current and voltage is also presented. The simulation verifies the correctness of the constant current and constant voltage output of the S/P-S/S hybrid compensation circuit. The experimental platform verifies the CC output under the S/P compensation topology, and the CV output under the serial/serial (S/S) compensation topology."
