title,date,keywords,abstract,multilingual_abstract
사전학습 언어 모델을 활용한 트랜스포머 기반 텍스트 요약,2021,"['딥러닝', '자동 문서 요약', '트랜스포머', '사전학습 언어 모델', 'Deep Learning', 'Automatic Text Summarization', 'Transformer', 'Pre-trained Language Model']","소셜 미디어의 등장으로 많은 양의 텍스트 데이터가 온라인상에서 생산 및 유통되면서, 정보 이용자가 방대한 정 보로부터 필요한 정보만을 추려내는 작업은 더욱 어려워지게 되었다. 이로 인해 많은 양의 텍스트를 자동으로 요약 하기 위한 다양한 시도가 이루어지고 있으며, 특히 최근에는 풍부한 표현의 요약문을 새롭게 생성할 수 있는 추상 요약 접근법에 대한 연구가 활발히 수행되고 있다. 추상 요약 분야에서는 신경망 기반의 트랜스포머 모델이 우수한 성능을 보이며 널리 활용되고 있지만, 충분한 양의 학습 데이터가 확보되지 않으면 트랜스포머를 구성하고 있는 매 개변수의 학습이 충분히 이루어지지 않아서 양질의 요약문을 생성하기 어렵다는 한계를 갖는다. 따라서 본 연구는 소량의 학습 데이터가 주어진 상황에서도 양질의 요약문을 생성하기 위해, 한국어 사전학습 언어 모델인 KoBERT의 일부 요소를 추출하여 트랜스포머 기반의 추상 요약 모델에 적용하는 문서 요약 방안을 제시한다. 제안 방법론의 우 수성을 검증하기 위해 Dacon의 한국어 문서 생성 요약 데이터 42,803건에 대한 요약 실험을 수행한 결과, 제안 방법 론이 비교 방법론에 비해 요약 품질을 평가하는 지표인 ROUGE 기준으로 우수한 성능을 보임을 확인하였다.","As a large amount of text data is produced and distributed online with the advent of social media, it has become more difficult for users to extract only necessary information from a vast amount of information. As a result, various attempts have been made to automatically summarize a large amount of text. In particular, the abstractive summarization approach is being actively studied because it can create a new summary with rich contextual expressions. In the abstractive summarization task, neural network-based transformer models show high-performance and are used widely. However, if a sufficient amount of training data is not provided, it is difficult to generate a high-quality summary because the parameters constituting the transformer are not sufficiently learned. In this work, we proposes a text summarization method that generates a high-quality summary given a small amount of training data. Specifically, we extract some elements of KoBERT and apply them to a transformer-based abstractive summarization model. We conducted an experiment on 42,803 cases of Dacon's summary data to evaluate the performance of the proposed methodology. As a result of the experiment, it was confirmed that the proposed methodology showed superior performance based on the ROUGE index compared to the comparative method."
단어 손실함수와 반복 페널티를 추가한 트랜스포머 인코더-디코더 제목 생성 모델,2021,"['트랜스포머 인코더-디코더 모델', '자동 제목 생성', '단어 손실함수', '반복 페널티', 'transformer encoder-decoder', 'automatic title generation', 'word loss', 'repeat penalty']","제목은 문서를 대표하는 어구 혹은 문장이라 정의할 수 있다. 우리는 문서의 제목을 생성하기 위해 트랜스포머 기반 인코더-디코더 구조를 제안한다. 대용량 문서를 이용하여 트랜스포머 인코더-디코더 구조의 사전학습(pre-training)을 진행하고 본문과 제목 쌍으로 이루어진 문서를 이용하여 미세조정(fine-tuning)을 진행하였다. 또한 제목 생성 태스크로 범위가 제한되는 미세조정 과정에서 입력 문서에 나타나는 어절의 생성 비율을 증가시키기 위해 단어 손실함수를 추가하고 토큰이 반복적으로 생성되는 문제를 개선하기 위한 반복 패널티를 모델 추가하는 방법을 제안한다. 25,564개의 논문 데이터를 사용한 실험에서 단어 손실함수와 반복 패널티를 개별적으로 적용시킨 모델의 성능이 기존 모델에 비해 개선되고, 두 제안 방법을 모두 적용한 모델에서는 Rouge-L의 성능이 2.7% 향상되는 것을 확인하였다.","The title can be defined as a phrase or sentence the represents the document. We propose a transformer encoder-decoder model to generate the title of the document. The transformer model is pre-trained based on a the usage of a large document, and fine-tuning is performed using the data comprising of the body and title. Also, in the fine-tuning process, the scope of which is limited to the title generation task, a Word Loss is added to increase the generation ratio of words appearing in the input document and ground truth title. We propose a method of adding a Repeat Penalty to the model to reduce the problem that tokens are repeatedly generated. In an experiment conducted using data from 25,564 papers, the performance of the model that individually applied the Word Loss and the Repeat Penalty was improved compared to the baseline. It was confirmed that Rouge-L""s performance improved by 2.7% in the model to which both the proposed methods were applied."
텍스트 트랜스포머 모델에서 어텐션 맵을 이용한 경사도 기반 화이트 박스 적대적 예제 생성 방안,2021,"['트랜스포머', '적대적 예제', '딥러닝', '텍스트 데이터', '화이트박스', 'Transformer', 'Adversarial example', 'Deep learning', 'Text data', 'Whitebox']",,"Abstract should be placed here. These instructions give you guidelines for preparing papers for JDCS. The method of generating Adversarial examples for text data of the transformer model was mostly a black box attack method because of the discrete characteristics of text data. Recently, a gradient-based white box attack method targeting text data of a transformer model has been announced, which has the disadvantage that it takes a long time and is not efficient because it learns one distribution for each generation of an example. This paper improves the efficiency of the existing white box attack method by proposing an attention constraint using the attention structure of the transformer model. Through experiments, it has been proven that the generation time can be shortened by about 6.5% and the diversity of generated adversarial examples can be increased by 2.4% compared to the previous research results."
효율적인 트랜스포머를 이용한 팩트체크 자동화 모델,2021,"['Automated fact checking', 'Locality sensitive hashing', 'Natural language processing', 'Transformer']",,"Nowadays, fake news from newspapers and social media is a serious issue in news credibility. Some of machine learning methods (such as LSTM, logistic regression, and Transformer) has been applied for fact checking. In this paper, we present Transformer-based fact checking model which improves computational efficiency. Locality Sensitive Hashing (LSH) is employed to efficiently compute attention value so that it can reduce the computation time. With LSH, model can group semantically similar words, and compute attention value within the group. The performance of proposed model is 75% for accuracy, 42.9% and 75% for Fl micro score and F1 macro score, respectively."
주제 어트리뷰트 모델을 이용한 주제 키워드 기반 한국어 문서 요약,2021,"['topic centric summarization', 'machine learning', 'pre-training', 'MASS', 'PPLM', '주제 키워드 기반 문서 요약', '머신 러닝', '사전 학습', 'MASS', 'PPLM']","문서 추상 요약은 요약 모델이 원문의 핵심 정보를 파악하여 새로운 요약문을 생성하는 작업이다. 이때 추상 요약 모델로 일반적인 Sequence-to-Sequence 모델을 많이 사용하였지만 여기에 핵심 정보를 잘 표현하고 요약문에 반영하기 위해 주제(topic)을 넣어 요약문을 생성하는 주제 중심 요약(Topic centric summarization)을 하는 연구가 최근에 진행되고 있다. 그러나 기존의 방법은 주제 분포(Topic distribution)를 반영하여 문장을 생성하기 위해 모델을 처음부터 학습해야 하기 때문에 사전 학습 언어 모델의 장점을 살리기 어렵다. 본 논문에서는 사전 학습 언어 모델의 장점을 살리면서 주제 키워드를 요약문에 반영하여 주제 중심 요약을 할 수 있는 방법을 제시한다. 제안하는 주제 중심 요약 방법은 기존 조건부 언어 모델(Conditional Language Model)에서 연구되었던 PPLM(Plug and Play Language Model)의 어트리뷰트 모델을 문서 요약에서 사용되는 사전 학습 Sequence-to-Sequence 모델인 MASS에 적용하여 ‘주제 키워드 기반 요약문’을 생성하는 방법이다. 제안하는 방법은 별도의 추가 학습을 요구하지 않기 때문에 MASS의 언어 능력과 파인 튜닝으로 학습한 요약 능력을 그대로 사용함과 동시에 특정 키워드를 등장시켜 주제에서 벗어나지 않는 요약문을 생성할 수 있게 한다. 제안하는 방법의 우수성을 보이기 위해 BERT+Transformer 디코더를 사용한 모델, PPLM을 적용하지 않은 MASS 모델과 한국어 요약성능을 비교하였으며 평균적으로 ROUGE와 BERTScore 모두 성능이 향상되는 것을 확인할 수 있었다.","Abstractive summarization takes original text as an input and generates a summary containing the core-information about the original text. The abstractive summarization model is mainly designed by the Sequence-to-Sequence model. To improve quality as well as coherence of summary, the topic-centric methods which contain the core information of the original text are recently proposed.However, the previous methods perform additional training steps which make it difficult to take advantage of the pre-trained language model. This paper proposes a topic-centric summarizer that can reflect topic words to a summary as well as retain the characteristics of language model by using PPLM. The proposed method does not require any additional training. To prove the effectiveness of the proposed summarizer, this paper performed summarization experiments with Korean newspaper data."
LIME 알고리즘을 이용한 한국어 감성 분류 모델 해석,2021,,"한국어 감성 분류 작업은 챗봇, 사용자의 물건 구매 평 분석 등 실 서비스에서 사용되고 있으며, 현재 딥러닝 기술의 발달로 높은 성능을 가진 신경망 모델을 활발히 사용하여 감성 분류 작업을 수행하고 있다. 하지만 신경망 모델은 입력 문장이 어떤 단어들로 인해 결과가 예측되었는지 해석하는 것이 쉽지 않으며, 최근 신경망 모델의 해석을 위한 모델 해석 방법들이 활발히 제안되어지고 있다. 본 논문에서는 모델 해석 방법 중 LIME 알고리즘을 이용하여 한국어 감성 분류 데이터 셋으로 학습된 모델들의 입력 문장 내 단어들 중 어떤 단어가 결과에 영향을 미쳤는지 해석하고자 한다. 그 결과, 85.23%의 성능을 보인 양방향 순환 신경망 모델의 해석 결과, 총 25,283개의 긍정, 부정 단어를 포함했지만, 상대적으로 낮은 성능을 보인 84.20%의 Transformer 모델의 해석 결과, 총 26,447개의 긍정, 부정 단어가 포함되어 있어 양방향 순환 신경망 모델보다 Transformer 모델이 신뢰할 수 있는 모델임을 확인할 수 있었다.",
CTR 예측을 위한 비전 트랜스포머 활용에 관한 연구,2021,"['클릭률', '심층신경망', '추천시스템', 'e-비즈니스', 'Click-Through Rate', 'Deep Neural Network', 'Recommender systems', 'e-business']","Click-Through Rate(CTR) 예측은 추천시스템에서 후보 항목의 순위를 결정하고 높은 순위의 항목들을 추천하여 고객의 정보 과부하를 줄임과 동시에 판매 촉진을 통한 수익 극대화를 달성할 수 있는 핵심 기능이다. 자연어 처리와 이미지 분류 분야는 심층신경망(deep neural network)의 활용을 통한 괄목한 성장을 하고 있다. 최근 이 분야의 주류를 이루던 모델과 차별화된 어텐션(attention) 메커니즘 기반의 트랜스포머(transformer) 모델이 제안되어 state-of-the-art를 달성하였다. 본 연구에서는 CTR 예측을 위한 트랜스포머 기반 모델의 성능 향상 방안을 제시한다. 자연어와 이미지 데이터와는 다른 이산적(discrete)이며 범주적(categorical)인 CTR 데이터 특성이 모델 성능에 미치는 영향력을 분석하기 위해 임베딩의 일반화(regularization)와 트랜스포머의 정규화(normalization)에 관한 실험을 수행한다. 실험 결과에 따르면, CTR 데이터 입력 처리를 위한 임베딩 과정에서 L2 일반화의 적용과 트랜스포머 모델의 기본 정규화 방법인 레이어 정규화 대신 배치 정규화를 적용할 때 예측 성능이 크게 향상됨을 확인하였다.","Click-Through Rate (CTR) prediction is a key function that determines the ranking of candidate items in the recommendation system and recommends high-ranking items to reduce customer information overload and achieve profit maximization through sales promotion. The fields of natural language processing and image classification are achieving remarkable growth through the use of deep neural networks. Recently, a transformer model based on an attention mechanism, differentiated from the mainstream models in the fields of natural language processing and image classification, has been proposed to achieve state-of-the-art in this field. In this study, we present a method for improving the performance of a transformer model for CTR prediction. In order to analyze the effect of discrete and categorical CTR data characteristics different from natural language and image data on performance, experiments on embedding regularization and transformer normalization are performed. According to the experimental results, it was confirmed that the prediction performance of the transformer was significantly improved when the L2 generalization was applied in the embedding process for CTR data input processing and when batch normalization was applied instead of layer normalization, which is the default regularization method, to the transformer model."
특허문서 자동분류를 위한 딥러닝 개별 모델 분류기와 앙상블 분류기의 성능비교,2021,"['Patent classification', 'Ensemble', 'Deep learning']",,
추가 사전학습 기반 지식 전이를 통한 국가 R&D 전문 언어모델 구축,2021,"['국가 R&D', '지식 전이', '사전학습 모델', 'BERT', '추가 사전학습', 'National R&D', 'Knowledge Transfer', 'Pre-trained Language Model', 'Further Pre-training']","최근 딥러닝 기술이 빠르게 발전함에 따라 국가 R&D 분야의 방대한 텍스트 문서를 다양한 관점에서 분석하기 위한 수요가 급증하고 있다. 특히 대용량의 말뭉치에 대해 사전학습을 수행한 BERT(Bidirectional Encoder Representations from Transformers) 언어모델의 활용에 대한 관심이 높아지고 있다. 하지만 국가 R&D와 같이 고도로 전문화된 분야에서 높은 빈도로 사용되는 전문어는 기본 BERT에서 충분히 학습이 이루어지지 않은 경우가 많으며, 이는 BERT를 통한 전문 분야 문서 이해의 한계로 지적되고 있다. 따라서 본 연구에서는 최근 활발하게 연구되고 있는 추가 사전학습을 활용하여, 기본 BERT에 국가 R&D 분야 지식을 전이한 R&D KoBERT 언어모델을 구축하는 방안을 제시한다. 또한 제안 모델의 성능 평가를 위해 보건의료, 정보통신 분야의 과제 약 116,000건을 대상으로 분류 분석을 수행한 결과, 제안 모델이 순수한 KoBERT 모델에 비해 정확도 측면에서 더 높은 성능을 나타내는 것을 확인하였다.","With the recent rapid development of deep learning technology, the demand for analyzing huge text documents in the national R&D field from various perspectives is rapidly increasing. In particular, interest in the application of a BERT(Bidirectional Encoder Representations from Transformers) language model that has pre-trained a large corpus is growing. However, the terminology used frequently in highly specialized fields such as national R&D are often not sufficiently learned in basic BERT. This is pointed out as a limitation of understanding documents in specialized fields through BERT. Therefore, this study proposes a method to build an R&D KoBERT language model that transfers national R&D field knowledge to basic BERT using further pre-training. In addition, in order to evaluate the performance of the proposed model, we performed classification analysis on about 116,000 R&D reports in the health care and information and communication fields. Experimental results showed that our proposed model showed higher performance in terms of accuracy compared to the pure KoBERT model."
BERT를 활용한 상표 의견제출통지서 거절이유 분류모델 개발,2021,"['BERT', '자연어처리', '딥러닝', '워드 임베딩', '토크나이저', 'BERT', 'Natural Language Process', 'Deep Learning', 'Word Embedding', 'Tokenizer']","멀티미디어 콘텐츠의 증가와 스마트 기기의 보급으로 다양한 종류의 데이터가 폭발적으로 생산되고 있다. 특히, 텍스트 데이터는 오랜 시간 인류의 의사 표현수단이었으며, 텍스트 분석에 대한 수요 및 필요성은 다 양한 분야에서 지속적으로 증가하고 있다. 최근에는 다양한 분야에서 뛰어난 성능을 보이는 딥러닝과 텍스트 를 의미적으로 벡터화하는 워드 임베딩 (word embedding) 방식이 결합된 ELMo (embeddings from language model), GPT (generative pre-training of a language model), BERT (bidirectional encoder representations from transformers)와 같은 모델들이 개발되어왔다. 특히 구글이 개발한 BERT는 현재 자연 어처리 분야에서 가장 뛰어난 성능을 보이는 언어모델로 손꼽히고 있다. 하지만 ‘영어’나 소셜미디어 데이터 와 같은 ‘일반 텍스트’에 특화된 BERT는 ‘한국어’나 ‘R&D 문서, 지식재산권 문서 등’ 전문 분야에 특화된 텍 스트에서 최적의 성능이 구현되지 않기 때문에 전문 분야에 맞는 말뭉치(corpus)를 학습하는 등의 최적화 과 정을 통해 최적의 성능을 도출할 수 있다. 따라서 본 연구에서는 한글 상표 분야에 특화된 BERT를 개발하 기 위해 상표 의견제출통지서 내 거절이유 텍스트 말뭉치를 활용하여 상표 관련 전문 문서에 특화된 토크나 이저 (tokenizer) 모델을 학습하고 이를 BERT에 활용하였다. 제안 모델의 분류 정확도는 기존의 다국어 BERT 모델의 분류 정확도 성능보다 약 4.97%p 높은 96.89%를 기록하였다. 해당 결과를 통해 자연어 분야 에서 높은 성능을 보였던 BERT가 전문 용어로 구성된 말뭉치 데이터에서도 높은 분류 정확도를 보일 수 있 다는 것을 확인하였다.","The increase of multimedia contents and the spread of smart devices have resulted in explosive production of various kinds of data. In particular, text data has been a means of expressing human opinion for a long time, and the demand and necessity for text analysis are continuously increasing in various fields. Recently, models such as the ELMo (embeddings from language model), GPT (generating pre-training of a language model), BERT (bidirectional encoder representations from transformation) have been developed that combine deep learning, which is showing excellent performance in various fields, and the word embedding method that semantically vectorizes text. In particular, BERT developed by Google is considered to be one of the most outstanding language models in the field of natural language processing. However, BERT specialized in 'English' and plain text, such as social media data, does not implement optimal performance in specialized texts such as 'Korean' or 'R&D documents, intellectual property documents', so it can achieve optimal performance through optimization such as learning specialized corpus. Therefore, In this study, in order to develop a BERT specialized in the field of Korean trademarks, a tokenizer model specialized in trademark-related professional documents was learned using a text corpus for rejection in the trademark opinion submission notice and used for BERT. The classification accuracy of the proposed model was 96.89%, which is 4.97% higher than the classification accuracy performance of the existing multilingual BERT model. The results showed that BERT, which showed high performance in the field of natural language, could show high classification accuracy even in corpus data composed of specialized terms."
효과적인 비전 트랜스포머를 통한 화재 감지,2021,"['컨볼루션 뉴럴 네트워크', '화재 감지', '포그기아의 데이터 세트', '산불', '스마트시티', '비전 변압기', 'Convolution Neural Network', 'Fire Detection', 'Foggia’s Dataset', 'Forest Fire', 'Smart Cities', 'Vision Transformers']","오늘날 현대사회에서 스마트하고 안전한 도시는 연구 커뮤니티의 주요 관심사 중 하나이다. 도시들은 개방된 지역, 농경지, 숲으로 둘러싸여 있으며, 화재 발생은 인간의 삶을 위협하고 그들의 재산도 손상시킬 수 있다. 최근 비전 센서 기반 화재 감지 기술은 컴퓨터 비전 분야의 전문가들을 통해, 최신 문헌에서 다양한 컨볼루션 신경 네트워크 (CNN)을 대한 최고의 성능을 달성하고 있다. 그러나 이러한 기술은 변환 불변이고, 지역성에 민감하며, 이미지에 대한 전체적인 이해가 부족하다. 또한 CNN 기반 모델은 계산 비용을 줄이기 위해 차원 축소를 위한 풀링 레이어 전략을 사용했지만, 가장 활동적인 특징 검출기의 정확한 위치와 같은 많은 의미 있는 정보를 손실한다. 이러한 문 제를 극복하기 위해 본 연구에서는 비전 트랜스포머(ViT)기반 화재 감지 모델을 개발하였다. ViT는 입력 이미지를 이미지 패치로 분할한 다음 워드 임베딩과 유사한 시퀀스 구조로 트랜스포머에 제공한다. 우리는 벤치마크 화재 데 이터 세트에서 제안된 작업의 성능을 평가하고 최신(SOTA) CNN 방법과 비교할 때 좋은 결과를 달성한다.","In today's modern age, smart and safe cities are one of the major concerns of the research community. The cities are surrounded by open areas, agricultural land, and forests, where fire incidence can make human lives threatening, damaging their properties as well. Recently, vision sensors-based fire detection has attracted computer vision domain experts, where the leading performance is achieved by a variety of convolution neural networks(CNN) in the recent literature. However, these techniques are translation invariant, locality-sensitive, and lacking a global understanding of images. Furthermore, CNN-based models use the pooling layers strategy for dimensionality reduction to reduce the computational cost but it also loses a lot of meaningful information such as the precise location of the most active feature detector. To overcome these problems, in this work, we developed Vision Transformers(ViT) based model for fire detection. The ViT split the input image into image patches and then feed these patches to the transformer in a sequence structure similar to word embeddings. We evaluate the performance of the proposed work on the benchmark fire dataset and achieve good results when compared to state-of-the-art(SOTA) fire detection CNN models."
오토인코더 기반의 생성 모델을 이용한 유입변압기 수명 예측 시스템,2021,"['Oil transformer', 'Neural network', 'Autoencoder', 'Data augmentation', 'Life estimation', '유입변압기', '신경회로망', '오토인코더', '데이터 증강', '수명예측']",,
태그 라벨과 트랜스포머를 이용한 시맨틱 분할,2021,"['Deep learning', 'Transformer', 'Semantic Segmentation']",,"Currently, research on artificial intelligence that autonomously interacts with surroundings without human management has attracted research attention in vehicle and robot-related fields. The recognition of the surrounding environment is the basis for artificial intelligence that requires interaction with the surroundings, which means that research on object detection is necessary. In general, object detection proceeds in the same way as detection and segmentation. Among them, in the case of segmentation, the size of the model is smaller, and more information can be obtained than detection using anchors. However, the inferior detection performance and generalization ability of this method for small objects has limited its further application. In this paper, a modified transformer structure with different configuration of training data from the existing label data is presented to improve the performance of segmentation."
