title,date,keywords,abstract,multilingual_abstract
트랜스포머를 이용한 GVQA 모델의 성능 개선에 관한 연구,2021,[],"오늘날 인공지능(Artificial Intelligence, AI) 분야에서 가장 구현하기 어려운 분야 중 하나는 추론이다. 근래 추론 분야에서 영상과 언어가 결합한 다중 모드(Multi-modal) 환경에서 영상 기반의 질의 응답(Visual Question Answering, VQA) 과업에 대한 AI 모델이 발표됐다. 얼마 지나지 않아 VQA 모델의 성능을 개선한 GVQA(Grounded Visual Question Answering) 모델도 발표됐다. 하지만 아직 GVQA 모델도 완벽한 성능을 내진 못한다. 본 논문에서는 GVQA 모델의 성능 개선을 위해 VCC(Visual Concept Classifier) 모델을 ViT-G(Vision Transformer-Giant)/14로 변경하고, ACP(Answer Cluster Predictor) 모델을 GPT(Generative Pretrained Transformer)-3으로 변경한다. 이와 같은 방법들은 성능을 개선하는 데 큰 도움이 될 수 있다고 사료된다.",다국어 초록 정보 없음
사전학습 언어 모델을 활용한 트랜스포머 기반 텍스트 요약,2021,"['딥러닝', '자동 문서 요약', '트랜스포머', '사전학습 언어 모델', 'Deep Learning', 'Automatic Text Summarization', 'Transformer', 'Pre-trained Language Model']","소셜 미디어의 등장으로 많은 양의 텍스트 데이터가 온라인상에서 생산 및 유통되면서, 정보 이용자가 방대한 정 보로부터 필요한 정보만을 추려내는 작업은 더욱 어려워지게 되었다. 이로 인해 많은 양의 텍스트를 자동으로 요약 하기 위한 다양한 시도가 이루어지고 있으며, 특히 최근에는 풍부한 표현의 요약문을 새롭게 생성할 수 있는 추상 요약 접근법에 대한 연구가 활발히 수행되고 있다. 추상 요약 분야에서는 신경망 기반의 트랜스포머 모델이 우수한 성능을 보이며 널리 활용되고 있지만, 충분한 양의 학습 데이터가 확보되지 않으면 트랜스포머를 구성하고 있는 매 개변수의 학습이 충분히 이루어지지 않아서 양질의 요약문을 생성하기 어렵다는 한계를 갖는다. 따라서 본 연구는 소량의 학습 데이터가 주어진 상황에서도 양질의 요약문을 생성하기 위해, 한국어 사전학습 언어 모델인 KoBERT의 일부 요소를 추출하여 트랜스포머 기반의 추상 요약 모델에 적용하는 문서 요약 방안을 제시한다. 제안 방법론의 우 수성을 검증하기 위해 Dacon의 한국어 문서 생성 요약 데이터 42,803건에 대한 요약 실험을 수행한 결과, 제안 방법 론이 비교 방법론에 비해 요약 품질을 평가하는 지표인 ROUGE 기준으로 우수한 성능을 보임을 확인하였다.","As a large amount of text data is produced and distributed online with the advent of social media, it has become more difficult for users to extract only necessary information from a vast amount of information. As a result, various attempts have been made to automatically summarize a large amount of text. In particular, the abstractive summarization approach is being actively studied because it can create a new summary with rich contextual expressions. In the abstractive summarization task, neural network-based transformer models show high-performance and are used widely. However, if a sufficient amount of training data is not provided, it is difficult to generate a high-quality summary because the parameters constituting the transformer are not sufficiently learned. In this work, we proposes a text summarization method that generates a high-quality summary given a small amount of training data. Specifically, we extract some elements of KoBERT and apply them to a transformer-based abstractive summarization model. We conducted an experiment on 42,803 cases of Dacon's summary data to evaluate the performance of the proposed methodology. As a result of the experiment, it was confirmed that the proposed methodology showed superior performance based on the ROUGE index compared to the comparative method."
단어 손실함수와 반복 페널티를 추가한 트랜스포머 인코더-디코더 제목 생성 모델,2021,"['트랜스포머 인코더-디코더 모델', '자동 제목 생성', '단어 손실함수', '반복 페널티', 'transformer encoder-decoder', 'automatic title generation', 'word loss', 'repeat penalty']","제목은 문서를 대표하는 어구 혹은 문장이라 정의할 수 있다. 우리는 문서의 제목을 생성하기 위해 트랜스포머 기반 인코더-디코더 구조를 제안한다. 대용량 문서를 이용하여 트랜스포머 인코더-디코더 구조의 사전학습(pre-training)을 진행하고 본문과 제목 쌍으로 이루어진 문서를 이용하여 미세조정(fine-tuning)을 진행하였다. 또한 제목 생성 태스크로 범위가 제한되는 미세조정 과정에서 입력 문서에 나타나는 어절의 생성 비율을 증가시키기 위해 단어 손실함수를 추가하고 토큰이 반복적으로 생성되는 문제를 개선하기 위한 반복 패널티를 모델 추가하는 방법을 제안한다. 25,564개의 논문 데이터를 사용한 실험에서 단어 손실함수와 반복 패널티를 개별적으로 적용시킨 모델의 성능이 기존 모델에 비해 개선되고, 두 제안 방법을 모두 적용한 모델에서는 Rouge-L의 성능이 2.7% 향상되는 것을 확인하였다.","The title can be defined as a phrase or sentence the represents the document. We propose a transformer encoder-decoder model to generate the title of the document. The transformer model is pre-trained based on a the usage of a large document, and fine-tuning is performed using the data comprising of the body and title. Also, in the fine-tuning process, the scope of which is limited to the title generation task, a Word Loss is added to increase the generation ratio of words appearing in the input document and ground truth title. We propose a method of adding a Repeat Penalty to the model to reduce the problem that tokens are repeatedly generated. In an experiment conducted using data from 25,564 papers, the performance of the model that individually applied the Word Loss and the Repeat Penalty was improved compared to the baseline. It was confirmed that Rouge-L""s performance improved by 2.7% in the model to which both the proposed methods were applied."
투사적 그림검사 분야로의 트랜스포머 기반의 이미지 분류 모델 적용에 관한 연구,2021,"['미술치료', '인간과 컴퓨터 상호작용', '딥러닝', '이미지 분류', '트랜스포머']","본 논문에서는 심리진단을 위한 그림검사(Drawing Test) 과정에서 미술치료사의 객관적인 의사결정을 지원하기 위한 이미지 분류 모델인 VQ-ViT(Vector Quantization-Vision Transformer)을 제안한다. 사전학습을 위해 대규모의 레이블링 데이터셋이 필요한 기존의 이미지 분류 모델(e.g., Resnet, Vision Transformer)에 비해 VQ-ViT는 레이블링되지 않은 데이터에 대하여 비지도학습으로 임베딩을 진행한다. 우리는 CIFAR-10, TU-Berlin 그리고 직접 수집한 빗 속의 사람 그림 검사(PITR, Person-In-The-Rain) 데이터셋에 대하여 VQ-ViT와 기존의 이미지 분류 모델들과의 성능 비교실험을 진행하였다. 그 결과 VQ-ViT는 비지도 학습의 이미지 임베딩 기법과 적은 파라미터 수로 그림검사 분야에서의 발전 가능성을 보였다. 이를 기반으로 우리는 딥러닝 기반의 이미지 분류 모델의 한계점 파악 및 발전 방향을 논의한다.",다국어 초록 정보 없음
텍스트 트랜스포머 모델에서 어텐션 맵을 이용한 경사도 기반 화이트 박스 적대적 예제 생성 방안,2021,"['트랜스포머', '적대적 예제', '딥러닝', '텍스트 데이터', '화이트박스', 'Transformer', 'Adversarial example', 'Deep learning', 'Text data', 'Whitebox']",국문 초록 정보 없음,"Abstract should be placed here. These instructions give you guidelines for preparing papers for JDCS. The method of generating Adversarial examples for text data of the transformer model was mostly a black box attack method because of the discrete characteristics of text data. Recently, a gradient-based white box attack method targeting text data of a transformer model has been announced, which has the disadvantage that it takes a long time and is not efficient because it learns one distribution for each generation of an example. This paper improves the efficiency of the existing white box attack method by proposing an attention constraint using the attention structure of the transformer model. Through experiments, it has been proven that the generation time can be shortened by about 6.5% and the diversity of generated adversarial examples can be increased by 2.4% compared to the previous research results."
효율적인 트랜스포머를 이용한 팩트체크 자동화 모델,2021,"['Automated fact checking', 'Locality sensitive hashing', 'Natural language processing', 'Transformer']",국문 초록 정보 없음,"Nowadays, fake news from newspapers and social media is a serious issue in news credibility. Some of machine learning methods (such as LSTM, logistic regression, and Transformer) has been applied for fact checking. In this paper, we present Transformer-based fact checking model which improves computational efficiency. Locality Sensitive Hashing (LSH) is employed to efficiently compute attention value so that it can reduce the computation time. With LSH, model can group semantically similar words, and compute attention value within the group. The performance of proposed model is 75% for accuracy, 42.9% and 75% for Fl micro score and F1 macro score, respectively."
효율적인 트랜스포머에 기반한 설명 가능한 팩트체크 모델,2021,"['Attention Mechanism', 'Transformer', 'Explainable Fact Checking', 'Hashing Function']","본 논문에서는 어텐션 메커니즘에 기반하여 정보 판단에 대한 근거를 제공하는, 이른바 설명 가능한 팩트체크 모델을 제안할 것이다. 최근 미디어의 발달에 따라 각종 뉴스가 쏟아지고 있는 바, 이와 더불어 뉴스에 대한 진위 여부 판단, 즉 팩트체크가 주목받고 있는 상황이다. 하지만 현재 팩트체크는 언론인이나 시민 단체 일원들의 검색 능력에 의존하고 있어서, 이를 자동적으로 하는 모델에 대한 연구가 진행되고 있다. 이에 본 논문에서 설명 가능한 자동 팩트체크 모델을 제안하고자 한다.","In this paper, we introduce the model so-called Explainable Fact-Checking model based on attention mechanism which shows both the result of fact check of the news and the evidence of verdict. Recently, several news surge on media, so fact check attracts much attentions. However, in present fact check relies on the search made by journalists and members of fact check organization, so there is some researches about automated fact checking. Therefore in this paper we propose explainable automated fact checking model."
트랜스포머 모델을 활용한 드노보 펩타이드 서열 분석,2021,[],국문 초록 정보 없음,다국어 초록 정보 없음
트랜스포머 모델에 제로카피를 적용한 서빙 기법,2021,[],국문 초록 정보 없음,다국어 초록 정보 없음
PatentQA: 트랜스포머 모델을 이용한 특허 질의응답 신경망 검색시스템,2021,[],국문 초록 정보 없음,다국어 초록 정보 없음
돌연변이 탐지를 위한 트랜스포머 모델과 RNN 모델의 성능비교,2021,[],국문 초록 정보 없음,다국어 초록 정보 없음
트랜스포머 기반 다중 센서를 활용한 EPS 실차 소음 수준 예측 모델,2021,[],국문 초록 정보 없음,다국어 초록 정보 없음
트랜스포머 기반 딥러닝 맵매칭 모델 개발,2021,[],국문 초록 정보 없음,다국어 초록 정보 없음
트랜스포머 기반 압타머-단백질 상호작용 예측 분류 모델 설계,2021,[],국문 초록 정보 없음,다국어 초록 정보 없음
감성 사전을 활용한 트랜스포머 모델 기반의 감정분석,2021,[],국문 초록 정보 없음,다국어 초록 정보 없음
5G Dual Connectivity 환경을 위한 트랜스포머 모델 기반 상향 링크 자원 예측 연구,2021,[],국문 초록 정보 없음,다국어 초록 정보 없음
Temporal Fusion Transformer 모델을 활용한 다층 수평 시계열 데이터 분석,2021,[],"시계열 형태의 데이터는 다양한 분야에서 수집되고 응용되기 때문에 정확한 시계열 예측은 많은 분야에서 운영 효율성을 높일 수 있는 중요한 분석 방법으로 고려된다. 그중 다층 수평 예측은 사용자에게 전반적인 시계열 데이터 경향성을 제공할 수 있다. 하지만 다양한 정보를 포함하는 시계열 데이터는 데이터에 내재한 이질성(heterogeneity)까지 포괄적으로 고려한 방법을 통해서만 정확한 예측을 할 수 있다. 하지만 지금까지 많은 시계열 분석 모델들이 데이터의 이질성을 반영하지 못했다. 이러한 한계를 보완하고자 우리는 Temporal Fusion Transformer 모델을 사용하여 실생활과 밀접한 관련이 있는 데이터에 적용하여 이질성을 고려한 향상된 예측을 수행하였다. 실제, 주식 데이터와 미세 먼지 데이터와 같은 실생활 시계열 데이터에 적용하였고 실험 결과 기존 모델보다 Mean Squared Error(MSE)가 0.3487 낮은 것을 확인하였다.",다국어 초록 정보 없음
KoEPT: Transformer 기반 생성 모델을 사용한 한국어 수학 문장제 문제 자동 풀이,2021,[],"이 논문에서는 자연어로 구성된 수학 문장제 문제를 자동으로 풀이하기 위한 Transformer 기반의 생성모델인 KoEPT를 제안한다. 수학 문장제 문제는 일상 상황을 수학적 형식으로 표현한 자연어 문제로, 문장제 문제 풀이 기술은 실생활에 응용 가능성이 많아 국내외에서 다양하게 연구된 바 있다. 한국어의 경우 지금까지의 연구는 문제를 유형으로 분류하여 풀이하는 기법들이 주로 시도되었으나, 이러한 기법은 다양한 수식을 포괄하여 분류 난도가 높은 데이터셋에 적용하기 어렵다는 한계가 있다. 본 논문은 이를 해결하기 위해 우선 현존하는 한국어 수학 문장제 문제 데이터셋인 CC, IL, ALG514의 분류 난도를 측정한 후 5겹교차 검증 기법을 사용하여 KoEPT의 성능을 평가하였다. 평가에 사용된 한국어 데이터셋들에 대하여, KoEPT는 CC에서는 기존 최고 성능과 대등한 99.1%, IL과 ALG514에서 각각 89.3%, 80.5%로 새로운 최고 성능을 얻었다. 뿐만 아니라 평가 결과 KoEPT는 분류 난도가 높은 데이터셋에 대해 상대적으로 개선된 성능을 보였다.",다국어 초록 정보 없음
Transformer 모델을 이용한 감정 분석,2021,"['Sentiment analysis', 'Transformer']",국문 초록 정보 없음,다국어 초록 정보 없음
Shared Attention Network와 Multi-Query Attention을 이용한 Transformer 모델의 디코더 속도 개선,2021,"['기계번역', 'NMT', 'Transformer', 'Shared Attention Networks', 'Multi- Query Attention']",국문 초록 정보 없음,다국어 초록 정보 없음
위협 탐지 및 교통량 예측을 위한 장기 시계열 데이터에서의 Transformer 와 LSTM 모델 성능 비교,2021,"['Transformer', 'LSTM', 'Time-series data', 'Security Threat detection']",국문 초록 정보 없음,"Deep learning research to analyze industrial time-series data has been an active research topic. Recent studies have attempted to borrow the models for natural language processing(NLP) to handle time dependency issues. However, industrial data have different properties compared with NLP data: strongly dependent on a time axis. Moreover, because industrial information is continuously accumulating while the machine is running, it has a much longer sequence than other sequential data. In this study, we compare the performance of widely used natural language models, LSTM and Transformer, on such long-time series industrial data. For comparison, we performed experiments to detect an attack on a water treatment management system and to predict traffic flow on a highway. We confirmed that the Transformer using the attention mechanism showed better performance than the LSTM."
신약개발을 위한 Transformer기반의 딥러닝 모델,2021,[],국문 초록 정보 없음,다국어 초록 정보 없음
비전 트랜스포머를 활용한 이미지 분류 시스템 설계,2021,"['Image Classification', 'Vision Transformer', 'CIFAR-10', 'Convolutional Neural Network']","트랜스포머(Transformer)는 자연어 처리 분야에서 괄목할 만한 성과를 내어 왔다. 이러한 트랜스포머의 기능을 트랜스포머를 이미지 분류와 같은 다른 분야에 적용하는 연구가 최근 진행되고 있다. 본 연구에서는 이미지 데이터를 학습하여 해당 이미지를 분류하는 비전 트랜스포머 모델을 설계하고 구현하였다. 비전 트랜스포머(Vision Transformer ; ViT) 모델은 합성곱 신경망(Convolutional Neural Network ; CNN)을 사용하는 대신 어텐션 메커니즘 (Attention Mechanism)을 이미지 분류에 적용하여 계산비용을 크게 줄였다. 비전 트랜스포머의 설계를 검증하기 위해, CIFAR-10 데이터와 CIFAR-100 데이터를 벤치마크 데이터로 사용하였다. 실험 결과, 설계된 비전 트랜스포머를 향후 이미지 분류에 활용할 만한 가능성을 발견할 수 있었다.","We have seen remarkable achievements of Transformer in natural language processing fields. Recently, there have been research conducted for applying Transformer for other fields like image classification. In this paper, we design and implement vision transformer model that trains image data for classification. Vision Transformer (ViT) model significantly reduces the computational cost of training image classifiers by applying attention mechanism instead of using a convolutional neural network (CNN). To evaluate our design of Vision Transformer, we use CIFAR-10 and CIFAR-100 as benchmark datasets. From the experiment results, we discover the possibility of utilizing our Vision Transformer design for image classification tasks in the future."
주제 어트리뷰트 모델을 이용한 주제 키워드 기반 한국어 문서 요약,2021,"['topic centric summarization', 'machine learning', 'pre-training', 'MASS', 'PPLM', '주제 키워드 기반 문서 요약', '머신 러닝', '사전 학습', 'MASS', 'PPLM']","문서 추상 요약은 요약 모델이 원문의 핵심 정보를 파악하여 새로운 요약문을 생성하는 작업이다. 이때 추상 요약 모델로 일반적인 Sequence-to-Sequence 모델을 많이 사용하였지만 여기에 핵심 정보를 잘 표현하고 요약문에 반영하기 위해 주제(topic)을 넣어 요약문을 생성하는 주제 중심 요약(Topic centric summarization)을 하는 연구가 최근에 진행되고 있다. 그러나 기존의 방법은 주제 분포(Topic distribution)를 반영하여 문장을 생성하기 위해 모델을 처음부터 학습해야 하기 때문에 사전 학습 언어 모델의 장점을 살리기 어렵다. 본 논문에서는 사전 학습 언어 모델의 장점을 살리면서 주제 키워드를 요약문에 반영하여 주제 중심 요약을 할 수 있는 방법을 제시한다. 제안하는 주제 중심 요약 방법은 기존 조건부 언어 모델(Conditional Language Model)에서 연구되었던 PPLM(Plug and Play Language Model)의 어트리뷰트 모델을 문서 요약에서 사용되는 사전 학습 Sequence-to-Sequence 모델인 MASS에 적용하여 ‘주제 키워드 기반 요약문’을 생성하는 방법이다. 제안하는 방법은 별도의 추가 학습을 요구하지 않기 때문에 MASS의 언어 능력과 파인 튜닝으로 학습한 요약 능력을 그대로 사용함과 동시에 특정 키워드를 등장시켜 주제에서 벗어나지 않는 요약문을 생성할 수 있게 한다. 제안하는 방법의 우수성을 보이기 위해 BERT+Transformer 디코더를 사용한 모델, PPLM을 적용하지 않은 MASS 모델과 한국어 요약성능을 비교하였으며 평균적으로 ROUGE와 BERTScore 모두 성능이 향상되는 것을 확인할 수 있었다.","Abstractive summarization takes original text as an input and generates a summary containing the core-information about the original text. The abstractive summarization model is mainly designed by the Sequence-to-Sequence model. To improve quality as well as coherence of summary, the topic-centric methods which contain the core information of the original text are recently proposed.However, the previous methods perform additional training steps which make it difficult to take advantage of the pre-trained language model. This paper proposes a topic-centric summarizer that can reflect topic words to a summary as well as retain the characteristics of language model by using PPLM. The proposed method does not require any additional training. To prove the effectiveness of the proposed summarizer, this paper performed summarization experiments with Korean newspaper data."
LIME 알고리즘을 이용한 한국어 감성 분류 모델 해석,2021,[],"한국어 감성 분류 작업은 챗봇, 사용자의 물건 구매 평 분석 등 실 서비스에서 사용되고 있으며, 현재 딥러닝 기술의 발달로 높은 성능을 가진 신경망 모델을 활발히 사용하여 감성 분류 작업을 수행하고 있다. 하지만 신경망 모델은 입력 문장이 어떤 단어들로 인해 결과가 예측되었는지 해석하는 것이 쉽지 않으며, 최근 신경망 모델의 해석을 위한 모델 해석 방법들이 활발히 제안되어지고 있다. 본 논문에서는 모델 해석 방법 중 LIME 알고리즘을 이용하여 한국어 감성 분류 데이터 셋으로 학습된 모델들의 입력 문장 내 단어들 중 어떤 단어가 결과에 영향을 미쳤는지 해석하고자 한다. 그 결과, 85.23%의 성능을 보인 양방향 순환 신경망 모델의 해석 결과, 총 25,283개의 긍정, 부정 단어를 포함했지만, 상대적으로 낮은 성능을 보인 84.20%의 Transformer 모델의 해석 결과, 총 26,447개의 긍정, 부정 단어가 포함되어 있어 양방향 순환 신경망 모델보다 Transformer 모델이 신뢰할 수 있는 모델임을 확인할 수 있었다.",다국어 초록 정보 없음
CTR 예측을 위한 비전 트랜스포머 활용에 관한 연구,2021,"['클릭률', '심층신경망', '추천시스템', 'e-비즈니스', 'Click-Through Rate', 'Deep Neural Network', 'Recommender systems', 'e-business']","Click-Through Rate(CTR) 예측은 추천시스템에서 후보 항목의 순위를 결정하고 높은 순위의 항목들을 추천하여 고객의 정보 과부하를 줄임과 동시에 판매 촉진을 통한 수익 극대화를 달성할 수 있는 핵심 기능이다. 자연어 처리와 이미지 분류 분야는 심층신경망(deep neural network)의 활용을 통한 괄목한 성장을 하고 있다. 최근 이 분야의 주류를 이루던 모델과 차별화된 어텐션(attention) 메커니즘 기반의 트랜스포머(transformer) 모델이 제안되어 state-of-the-art를 달성하였다. 본 연구에서는 CTR 예측을 위한 트랜스포머 기반 모델의 성능 향상 방안을 제시한다. 자연어와 이미지 데이터와는 다른 이산적(discrete)이며 범주적(categorical)인 CTR 데이터 특성이 모델 성능에 미치는 영향력을 분석하기 위해 임베딩의 일반화(regularization)와 트랜스포머의 정규화(normalization)에 관한 실험을 수행한다. 실험 결과에 따르면, CTR 데이터 입력 처리를 위한 임베딩 과정에서 L2 일반화의 적용과 트랜스포머 모델의 기본 정규화 방법인 레이어 정규화 대신 배치 정규화를 적용할 때 예측 성능이 크게 향상됨을 확인하였다.","Click-Through Rate (CTR) prediction is a key function that determines the ranking of candidate items in the recommendation system and recommends high-ranking items to reduce customer information overload and achieve profit maximization through sales promotion. The fields of natural language processing and image classification are achieving remarkable growth through the use of deep neural networks. Recently, a transformer model based on an attention mechanism, differentiated from the mainstream models in the fields of natural language processing and image classification, has been proposed to achieve state-of-the-art in this field. In this study, we present a method for improving the performance of a transformer model for CTR prediction. In order to analyze the effect of discrete and categorical CTR data characteristics different from natural language and image data on performance, experiments on embedding regularization and transformer normalization are performed. According to the experimental results, it was confirmed that the prediction performance of the transformer was significantly improved when the L2 generalization was applied in the embedding process for CTR data input processing and when batch normalization was applied instead of layer normalization, which is the default regularization method, to the transformer model."
