title,date,keywords,abstract,multilingual_abstract
특허문서 자동분류를 위한 딥러닝 개별 모델 분류기와 앙상블 분류기의 성능비교,2021,"['Patent classification', 'Ensemble', 'Deep learning']",국문 초록 정보 없음,다국어 초록 정보 없음
추가 사전학습 기반 지식 전이를 통한 국가 R&D 전문 언어모델 구축,2021,"['국가 R&D', '지식 전이', '사전학습 모델', 'BERT', '추가 사전학습', 'National R&D', 'Knowledge Transfer', 'Pre-trained Language Model', 'Further Pre-training']","최근 딥러닝 기술이 빠르게 발전함에 따라 국가 R&D 분야의 방대한 텍스트 문서를 다양한 관점에서 분석하기 위한 수요가 급증하고 있다. 특히 대용량의 말뭉치에 대해 사전학습을 수행한 BERT(Bidirectional Encoder Representations from Transformers) 언어모델의 활용에 대한 관심이 높아지고 있다. 하지만 국가 R&D와 같이 고도로 전문화된 분야에서 높은 빈도로 사용되는 전문어는 기본 BERT에서 충분히 학습이 이루어지지 않은 경우가 많으며, 이는 BERT를 통한 전문 분야 문서 이해의 한계로 지적되고 있다. 따라서 본 연구에서는 최근 활발하게 연구되고 있는 추가 사전학습을 활용하여, 기본 BERT에 국가 R&D 분야 지식을 전이한 R&D KoBERT 언어모델을 구축하는 방안을 제시한다. 또한 제안 모델의 성능 평가를 위해 보건의료, 정보통신 분야의 과제 약 116,000건을 대상으로 분류 분석을 수행한 결과, 제안 모델이 순수한 KoBERT 모델에 비해 정확도 측면에서 더 높은 성능을 나타내는 것을 확인하였다.","With the recent rapid development of deep learning technology, the demand for analyzing huge text documents in the national R&D field from various perspectives is rapidly increasing. In particular, interest in the application of a BERT(Bidirectional Encoder Representations from Transformers) language model that has pre-trained a large corpus is growing. However, the terminology used frequently in highly specialized fields such as national R&D are often not sufficiently learned in basic BERT. This is pointed out as a limitation of understanding documents in specialized fields through BERT. Therefore, this study proposes a method to build an R&D KoBERT language model that transfers national R&D field knowledge to basic BERT using further pre-training. In addition, in order to evaluate the performance of the proposed model, we performed classification analysis on about 116,000 R&D reports in the health care and information and communication fields. Experimental results showed that our proposed model showed higher performance in terms of accuracy compared to the pure KoBERT model."
BERT를 활용한 상표 의견제출통지서 거절이유 분류모델 개발,2021,"['BERT', '자연어처리', '딥러닝', '워드 임베딩', '토크나이저', 'BERT', 'Natural Language Process', 'Deep Learning', 'Word Embedding', 'Tokenizer']","멀티미디어 콘텐츠의 증가와 스마트 기기의 보급으로 다양한 종류의 데이터가 폭발적으로 생산되고 있다. 특히, 텍스트 데이터는 오랜 시간 인류의 의사 표현수단이었으며, 텍스트 분석에 대한 수요 및 필요성은 다 양한 분야에서 지속적으로 증가하고 있다. 최근에는 다양한 분야에서 뛰어난 성능을 보이는 딥러닝과 텍스트 를 의미적으로 벡터화하는 워드 임베딩 (word embedding) 방식이 결합된 ELMo (embeddings from language model), GPT (generative pre-training of a language model), BERT (bidirectional encoder representations from transformers)와 같은 모델들이 개발되어왔다. 특히 구글이 개발한 BERT는 현재 자연 어처리 분야에서 가장 뛰어난 성능을 보이는 언어모델로 손꼽히고 있다. 하지만 ‘영어’나 소셜미디어 데이터 와 같은 ‘일반 텍스트’에 특화된 BERT는 ‘한국어’나 ‘R&D 문서, 지식재산권 문서 등’ 전문 분야에 특화된 텍 스트에서 최적의 성능이 구현되지 않기 때문에 전문 분야에 맞는 말뭉치(corpus)를 학습하는 등의 최적화 과 정을 통해 최적의 성능을 도출할 수 있다. 따라서 본 연구에서는 한글 상표 분야에 특화된 BERT를 개발하 기 위해 상표 의견제출통지서 내 거절이유 텍스트 말뭉치를 활용하여 상표 관련 전문 문서에 특화된 토크나 이저 (tokenizer) 모델을 학습하고 이를 BERT에 활용하였다. 제안 모델의 분류 정확도는 기존의 다국어 BERT 모델의 분류 정확도 성능보다 약 4.97%p 높은 96.89%를 기록하였다. 해당 결과를 통해 자연어 분야 에서 높은 성능을 보였던 BERT가 전문 용어로 구성된 말뭉치 데이터에서도 높은 분류 정확도를 보일 수 있 다는 것을 확인하였다.","The increase of multimedia contents and the spread of smart devices have resulted in explosive production of various kinds of data. In particular, text data has been a means of expressing human opinion for a long time, and the demand and necessity for text analysis are continuously increasing in various fields. Recently, models such as the ELMo (embeddings from language model), GPT (generating pre-training of a language model), BERT (bidirectional encoder representations from transformation) have been developed that combine deep learning, which is showing excellent performance in various fields, and the word embedding method that semantically vectorizes text. In particular, BERT developed by Google is considered to be one of the most outstanding language models in the field of natural language processing. However, BERT specialized in 'English' and plain text, such as social media data, does not implement optimal performance in specialized texts such as 'Korean' or 'R&D documents, intellectual property documents', so it can achieve optimal performance through optimization such as learning specialized corpus. Therefore, In this study, in order to develop a BERT specialized in the field of Korean trademarks, a tokenizer model specialized in trademark-related professional documents was learned using a text corpus for rejection in the trademark opinion submission notice and used for BERT. The classification accuracy of the proposed model was 96.89%, which is 4.97% higher than the classification accuracy performance of the existing multilingual BERT model. The results showed that BERT, which showed high performance in the field of natural language, could show high classification accuracy even in corpus data composed of specialized terms."
경량화 기법을 적용한 트랜스포머 기반의 한국어 음성인식 연구,2021,[],"최근 Transformer 모델이 여러 도메인에 적용되어 기존의 성능을 뛰어넘는 결과를 보이고 있다. 음성인식 분야에도 Transformer 음향모델이 다른 모델 성능 대비 우수한 결과치를 보이고 있다. 하지만, Transformer의 고질적인 연산량 문제의 원인인 Feed Forward 연산을 사용하는 Self-attention 방식을 음성 인식 도메인에 적합하도록 개선하였다. 해당, Light-weight 기법을 적용한 Transformer 음향모델을 한국어 기반의 데이터 셋에 적용하여 연구를 진행하였고 최종적으로 17% 의 연산량 감소를 확인할 수 있었다.",다국어 초록 정보 없음
비전 트랜스포머를 이용한 휴대 수하물 보안검색 위험화물 검출 연구,2021,[],"본 연구에서는 최근 각광받고 있는 비전 트랜스포머 백본 기반 객체 검출 알고리즘을 항공 및 지하철 등 휴대 수하물 보안검색에 적용하기 위해 x-선 투과 영상 내 위험화물 검출 모델을 구성하여 학습 및 검증한 결과를 보고하고자 한다. 최근 MS COCO 객체 검출 벤치마크 결과 가장 뛰어난 검출 성능이 발표된 바 있는 Swin 트랜스포머(Transformer) 백본과 Cascade R-CNN 검출기를 휴대 수하물 보안검색 x-선 촬영 영상 내 위험화물 검출에 적용하였으며, 휴대 수하물 보안검색 x-선 촬영 영상으로 구성된 공개 데이터셋인 SIXray-10에 대해 지도학습을 진행한 결과, 기존 합성곱 신경망 백본을 이용한 검출결과와 비교하여 개선된 63.8 ㎃P의 정확도를 얻을 수 있었다.",다국어 초록 정보 없음
비전 트랜스포머를 이용한 품질검사 관련 연구,2021,[],"본 논문은 개선된 트랜스포머 기반 이미지 이상 탐지 및 위치 파악 네트워크를 제안한다. 우리가 제안하는 모델은 재구성 기반 접근 방식과 패치 임베딩의 조합이다. 트랜스포머 네트워크를 사용하면 임베디드 패치의 공간 정보를 보존하는 데 도움이 되며, 이는 나중에 가우스 혼합 밀도 네트워크에 의해 처리되어 변칙 영역을 지역화한다. 또한 트랜스포머에 증류토큰을 활용한 전이학습을 적용한다. 제안된 네트워크는 기존의 VT-ADL 보다 정확도와 이미지 처리 속도 모두에서 향상된 결과를 보여주었다.",다국어 초록 정보 없음
인공지능 언어모델에 통사구조와 한국어 특징에 대한 지식을 주입하는 방법,2021,[],국문 초록 정보 없음,다국어 초록 정보 없음
효과적인 비전 트랜스포머를 통한 화재 감지,2021,"['컨볼루션 뉴럴 네트워크', '화재 감지', '포그기아의 데이터 세트', '산불', '스마트시티', '비전 변압기', 'Convolution Neural Network', 'Fire Detection', 'Foggia’s Dataset', 'Forest Fire', 'Smart Cities', 'Vision Transformers']","오늘날 현대사회에서 스마트하고 안전한 도시는 연구 커뮤니티의 주요 관심사 중 하나이다. 도시들은 개방된 지역, 농경지, 숲으로 둘러싸여 있으며, 화재 발생은 인간의 삶을 위협하고 그들의 재산도 손상시킬 수 있다. 최근 비전 센서 기반 화재 감지 기술은 컴퓨터 비전 분야의 전문가들을 통해, 최신 문헌에서 다양한 컨볼루션 신경 네트워크 (CNN)을 대한 최고의 성능을 달성하고 있다. 그러나 이러한 기술은 변환 불변이고, 지역성에 민감하며, 이미지에 대한 전체적인 이해가 부족하다. 또한 CNN 기반 모델은 계산 비용을 줄이기 위해 차원 축소를 위한 풀링 레이어 전략을 사용했지만, 가장 활동적인 특징 검출기의 정확한 위치와 같은 많은 의미 있는 정보를 손실한다. 이러한 문 제를 극복하기 위해 본 연구에서는 비전 트랜스포머(ViT)기반 화재 감지 모델을 개발하였다. ViT는 입력 이미지를 이미지 패치로 분할한 다음 워드 임베딩과 유사한 시퀀스 구조로 트랜스포머에 제공한다. 우리는 벤치마크 화재 데 이터 세트에서 제안된 작업의 성능을 평가하고 최신(SOTA) CNN 방법과 비교할 때 좋은 결과를 달성한다.","In today's modern age, smart and safe cities are one of the major concerns of the research community. The cities are surrounded by open areas, agricultural land, and forests, where fire incidence can make human lives threatening, damaging their properties as well. Recently, vision sensors-based fire detection has attracted computer vision domain experts, where the leading performance is achieved by a variety of convolution neural networks(CNN) in the recent literature. However, these techniques are translation invariant, locality-sensitive, and lacking a global understanding of images. Furthermore, CNN-based models use the pooling layers strategy for dimensionality reduction to reduce the computational cost but it also loses a lot of meaningful information such as the precise location of the most active feature detector. To overcome these problems, in this work, we developed Vision Transformers(ViT) based model for fire detection. The ViT split the input image into image patches and then feed these patches to the transformer in a sequence structure similar to word embeddings. We evaluate the performance of the proposed work on the benchmark fire dataset and achieve good results when compared to state-of-the-art(SOTA) fire detection CNN models."
객체 검출을 위한 트랜스포머와 공간 피라미드 풀링 기반의 YOLO 네트워크,2021,[],"일반적으로 딥러닝 기반의 객체 검출(Object Detection)기법은 합성곱 신경망(Convolutional Neural Network, CNN)을 통해 입력된 영상의 특징(Feature)을 추출하여 이를 통해 객체 검출을 수행한다. 최근 자연어 처리 분야에서 획기적인 성능을 보인 트랜스포머(Transformer)가 영상 분류, 객체 검출과 같은 컴퓨터 비전 작업을 수행하는데 있어 경쟁력이 있음이 드러나고 있다. 본 논문에서는 YOLOv4-CSP의 CSP 블록을 개선한 one-stage 방식의 객체 검출 네트워크를 제안한다. 개선된 CSP 블록은 트랜스포머(Transformer)의 멀티 헤드 어텐션(Multi-Head Attention)과 CSP 형태의 공간 피라미드 풀링(Spatial Pyramid Pooling, SPP) 연산을 기반으로 네트워크의 Backbone과 Neck에서의 feature 학습을 돕는다. 본 실험은 MSCOCO test-dev2017 데이터 셋으로 평가하였으며 제안하는 네트워크는 YOLOv4-CSP의 경량화 모델인 YOLOv4s-mish에 대하여 평균 정밀도(Average Precision, AP)기준 2.7% 향상된 검출 정확도를 보인다.",다국어 초록 정보 없음
다중스케일 기반 비전 트랜스포머를 이용한 깊이 추정,2021,"['vision transform', 'artificial neural network', 'depth estimation']","본 연구는 광범위한 컴퓨터 비전 문제를 성공적으로 해결한 새로운 아키텍쳐인 Visual Transformer(ViT)를 사용하여 단일 이미지로부터 깊이 정보를 추정하는 새로운 접근 방식을 제안한다. 인코더의 자기주의 메커니즘을 통해 모델은 넓은 이미지 영역에서 깊이 정보를 고려하는 여러 이미지 패치 간의 상관관계를 확인한다. 상대적으로 전역 인식에 집중하는 자기주의의 국소 영역 인식 성능 개선을 위해서 다중스케일 기반 특징맵을 학습하여 깊이 정보를 추정한다. 논문에서 제안한 프레임워크는 간단하면서도 효과적이며 단일 ViT를 사용한 모델보다 성능이 우수하다. 정량적, 정성적 결과는 디코더의 추가적인 특징을 학습한 네트워크가 다양한 평가지표, 시각화 측면에서 개선된 성능을 보여준다.","In this study, we proposes a new approach to estimating depth information from a single image using Visual Transformer (ViT), a new architecture that successfully solves a wide range of computer vision problems. Through the encoder""s self-attention mechanism, the model verifies the correlation between multiple image patches that take depth information into account over a large image area. In order to improve the local area recognition performance of global recognition through self-attention, depth information is estimated by learning multi-scaling based feature maps. The framework proposed in the paper is simple and effective, and has better performance than a model using only ViT. Quantitative and qualitative results show that the network learning additional features of the decoder has improved performance in terms of various evaluation indicators and visualization."
중공업 도메인 특화 언어 모델 : HeavyBERT,2021,[],"최근 자연어 처리 연구에서 대용량 말뭉치와 양방향 트랜스포머 기반 맥락을 고려한 BERT와 같은 언어 모델을 사전 학습하고, 응용 태스크에 미세 조정하여 높은 성능을 달성하였다. 그러나 이러한 언어 모델은 위키피디아나 뉴스 등, 일반적인 도메인에 대하여 사전 학습한 것이기 때문에 중공업 도메인과 같은 특수한 도메인의 태스크에 적합하지 않다는 문제점이 존재한다. 본 논문에서는 중공업 도메인의 말뭉치와 BERT를 기반으로 사전 학습한 중공업 도메인에 특화된 언어 모델인 HeavyBERT를제안한다.",다국어 초록 정보 없음
트랜스포머를 이용한 중국어 NER 관련 문자와 단어 통합 임배딩,2021,[],국문 초록 정보 없음,"Since the words and words in Chinese sentences are continuous and the length of vocabulary is huge, Chinese NER(Named Entity Recognition) always based on character representation. In recent years, many Chinese research has been reconsidered how to integrate the word information into the Chinese NER model. However, the traditional sequence model has complex structure, the slow inference speed, and an additional dictionary information is needed, which is difficult to implement in the industry. The approach in this paper has the state of the art and parallelizable, which is integrated the char-word embeddings, so that the model learns word information. The proposed model is easy to implement, and outperforms traditional model in terms of speed and efficiency, which is improved f1-score on two dataset."
오토인코더 기반의 생성 모델을 이용한 유입변압기 수명 예측 시스템,2021,"['Oil transformer', 'Neural network', 'Autoencoder', 'Data augmentation', 'Life estimation', '유입변압기', '신경회로망', '오토인코더', '데이터 증강', '수명예측']",국문 초록 정보 없음,다국어 초록 정보 없음
태그 라벨과 트랜스포머를 이용한 시맨틱 분할,2021,"['Deep learning', 'Transformer', 'Semantic Segmentation']",국문 초록 정보 없음,"Currently, research on artificial intelligence that autonomously interacts with surroundings without human management has attracted research attention in vehicle and robot-related fields. The recognition of the surrounding environment is the basis for artificial intelligence that requires interaction with the surroundings, which means that research on object detection is necessary. In general, object detection proceeds in the same way as detection and segmentation. Among them, in the case of segmentation, the size of the model is smaller, and more information can be obtained than detection using anchors. However, the inferior detection performance and generalization ability of this method for small objects has limited its further application. In this paper, a modified transformer structure with different configuration of training data from the existing label data is presented to improve the performance of segmentation."
시계열 예측을 위한 스타일 기반 트랜스포머,2021,"['Time Series Forecasting', 'Transformer', 'Generative Decoder', 'Style Transfer', '시계열 예측', '트랜스포머', '생성 디코더', '스타일 변환']",국문 초록 정보 없음,"Time series forecasting refers to predicting future time information based on past time information. Accurately predicting future information is crucial because it is used for establishing strategies or making policy decisions in various fields. Recently, a transformer model has been mainly studied for a time series prediction model. However, the existing transformer model has a limitation in that it has an auto-regressive structure in which the output result is input again when the prediction sequence is output. This limitation causes a problem in that accuracy is lowered when predicting a distant time point. This paper proposes a sequential decoding model focusing on the style transformation technique to handle these problems and make more precise time series forecasting. The proposed model has a structure in which the contents of past data are extracted from the transformer-encoder and reflected in the style-based decoder to generate the predictive sequence. Unlike the decoder structure of the conventional auto-regressive transformer, this structure has the advantage of being able to more accurately predict information from a distant view because the prediction sequence is output all at once. As a result of conducting a prediction experiment with various time series datasets with different data characteristics, it was shown that the model presented in this paper has better prediction accuracy than other existing time series prediction models."
트랜스포머 인코더와 시암넷 결합한 시맨틱 유사도 알고리즘,2021,[],국문 초록 정보 없음,"To solve the problem that existing computing methods cannot adequately represent the semantic features of sentences, Siamese TRAT, a semantic feature extraction model based on Transformer encoder is proposed. The transformer model is used to fully extract the semantic information within sentences and carry out deep semantic coding for sentences. In addition, the interactive attention mechanism is introduced to extract the similar features of the association between two sentences, which makes the model better at capturing the important semantic information inside the sentence. As a result, it improves the semantic understanding and generalization ability of the model. The experimental results show that the proposed model can improve the accuracy significantly for the semantic similarity calculation task of English and Chinese, and is more effective than the existing methods."
언어 학습자로서의 신경망 언어모델: 영어 주어-동사 일치를 중심으로,2021,"['language model', 'GPT-2', 'linguistic generalization', 'subject-verb agreement', 'interference effect', 'plural-singular asymmetry', '언어모델', '언어(학) 일반화', '주어-동사 일치', '간섭효과', '복수-단수 비대칭']",국문 초록 정보 없음,"This paper assesses the language-processing ability of the neural language model (L2-GPT-2) trained on data sets of English textbooks published in Korea using the Generative Pre-trained Transformer (GPT)-2. Assuming that the language model (LM) is also an (artificial) language learner, we test it focusing on subject-verb agreement in English. It is a well-established fact that L1 speakers exhibit facilitatory interference effects in ungrammatical sentences with a plural subject and a singular form of verb. Unlike human native speakers, L2-GPT-2 as well as L1-GPT-2 display such effects in ungrammatical sentences either with a plural subject and a singular form of verb, or with a singular subject and a plural form of verb. Though there is a significant difference between human speakers and neural LMs in processing subject-verb agreement, the two LMs’ sensitivity to interference by a distractor NP points to the fact that they can attain a remarkably human-like linguistic generalization on subject-verb agreement."
FEM Simulation and Test Verification of PD Ultrasonic Signal Propagation in a Power Transformer Model,2021,"['Power transformers', 'Partial discharge', 'FEM', 'Propagation property']",국문 초록 정보 없음,"Ultrasonic signals will be generated when partial discharge occurs in internal insulation faults in large oil immersed power transformers: because the ultrasonic signal has strong anti-interference ability and has no direct electromagnetic contact with the equipment, it is widely used in transformer fault detection and positioning. In this paper, the fi nite element method (FEM) is used to simulate the ultrasonic signal in a 35 kV power transformer. The infl uence of transformer case on ultrasonic signal propagation is considered, and the propagation law of the ultrasonic signal inside the transformer is obtained. Fabry–Pérot (F–P) fi bre acoustic sensors with a centre frequency of 28 kHz were fabricated. A partial discharge detection test was carried out in a 35 kV transformer winding model using the F–P sensors. The test results show that the ultrasonic waveform detected by the F–P sensors are in good agreement with the simulation results, and the propagation of the ultrasonic wave inside the transformer is verifi ed. It lays a foundation for detecting and locating PDs in power transformer by F–P acoustic sensors."
Analytical loss model of series-resonant indirect-matrix-type power electronics transformers using MOSFETs,2021,"['Analytical loss model', 'MOSFET', 'Series-resonant dc-dc converter', 'Indirect-matrix converter', 'Power electronics transformer', 'High efficiency']",국문 초록 정보 없음,"A MOSFET-based series-resonant indirect-matrix-type power electronic transformer (PET) consists of line-frequency-switching folding-unfolding bridges and series-resonant dc-dc converters (SRCs), which is an attractive choice to achieve ac-ac conversion due to its high efficiency and high power density. However, the conduction losses, switching losses, and core losses in each of the high-frequency switching cycles T<sub>s</sub> are different due to the pulsating dc voltage |ac|, which introduces difficulties in the calculation of losses. In addition, the small dc capacitors also participate in the resonance, and the resonant current shape deviates from a pure sine. Therefore, the conventional loss model is not suitable for PETs. In this paper, the time-domain analysis of SRC resonant current considering the dc capacitor is developed. Then, the analytical expression of the resonant current RMS value in grid cycle T<sub>g</sub> is derived, which is more accurate in calculating conduction loss than the conventional model. In addition, it avoids the calculating losses in each T<sub>s</sub>. Next, an analytical switching loss model is developed based on the curve fitting of the capacitance-voltage relationship. A simplified analytical core loss model is provided. Each part of the loss of the PET is verified by thermal simulations, and the total losses are verified by efficiency tests on an experiment prototype."
