title,date,keywords,abstract,multilingual_abstract
합성곱신경망을 이용한 타이타닉호의 재난 데이터 분석,2021,"['타이타닉 재난데이터', '합성곱신경망', 'LeNet-5', 'Keras', 'Titanic Disaster Data', 'Convolutional Neural Networks', 'LeNet-5', 'Keras']","본 연구에서는 합성곱신경망을 이용해서 타이타닉 재난데이터를 분석하였다. 그 동안 타이타닉 재난 데이터에 대한 k-최근접이웃 알고리즘, Naive Bayes 알고리즘, 의사결정트리 알고리즘 , SVM 알고리즘, 로지스틱 회귀 알고리즘 등 인공지능기법을 이용한 많은 분석이 이루어져왔다. 또한 인공신경망을 이용한 분석도 이루어져왔지만 합성곱신경망을 이용해서 이 타이타닉 재난데이터에 대한 분석은 없었다. 이 타이타닉 재난데이터 분석을 위하여 Keras를 이용하여 합성곱신경망중 LeNet-5를 사용해 모델링하여 훈련을 진행하였다. 이 성능결과를 Kaggle 웹사이트에 올려진 다중신경망을 이용한 분석결과와 비교하였다. LeNet-5를 이용한 경우 모델훈련에서 요구되는 훈련파라미터 개수의 비교에서 Kaggle 웹사이트에 올려진 다중신경망보다 월등히 적었다. 또한 훈련된 모델을 이용한 테스트 결과에서도 정확도는 0.856, 정밀도는 0.924를 나타냈다. 이 성능측정치는 Kaggle에 올려진 다중신경망의 정확도 0.842, 정밀도 0.873보다 우수한 것이다.","Titanic disaster data is analyzed using the convolutional neural networks in this paper. Although many researchers have analyzed this data using the aritificial intelligence techniques such as k-nearest neighbors algorithm, Naive Bayes algorithm, decision tree algorithm, SVM algorithm and logistic regression algorithm. Although the artificial neural networks are also used in another researches, the convolutional neural networks model has not been used in the analysis for this titanic disaster data. LeNet-5 among the various convolutional neural networks model is used with Keras for the train in this analysis. The performance result is compared with the result of analysis using the mutlilayer neural networks uploaded in Kaggle web site. In the comparison of the number of parameters to be trained, LeNet-5 shows efficient than multilayer neural networks. In the results of test after trained process, LeNet-5 shows 0.856 in accuracy and 0.923 in precision. These performance measures are better than those of multilayer neural networks whose accuracy was 0.841 and the precision was 0.872."
합성곱신경망을 이용한 KDD Cup 1999 데이터분석,2021,"['KDD Cup 1999 Data', 'Convolutional Neural Networks', 'LeNet-5', 'Keras', 'KDD Cup 1999 데이터', '합성곱신경망', 'LeNet-5', 'Keras']","KDD Cup 1999 데이터는 네트워크침입탐지 연구에 많이 이용된 데이터셋이다. 본 연구에서는 합성곱신경망을 이용해서 이 데이터를 분석하였다. 그 동안 이 데이터에 대한 TASVM, 의사결정트리 알고리즘, 랜덤포레스트알고리즘 등의 인공지능기법을 이용한 많은 분석이 이루어졌다. 그리고 다층신경망을 통한 분석도 이루어져왔지만 합성곱신경망을 이용한 접근은 거의 없었다. 합성곱신경망중 LeNet-5를 이용하여 Keras를 사용해서 분석을 하였다. 첫 번째 방법에서는 KDD Cup 1999의 10%훈련셋을 훈련셋과 테스트셋으로 나누어 분석하였다. 그리고 두 번째 방법에서는 10%훈련셋으로는 훈련하고 테스트는 테스트셋을 사용하여 분석하였다. 그리고 이 두 가지 방법의 결과를 캐글 웹사이트에 올려진 다층신경망과 비교하였다. KDD Cup 1999 데이터에는 침입유형을 크게 4가지로 분류하는데 각 유형별로 성능척도를 계산하였다. 그 결과 2가지 방법 모두에서 LeNet-5가 캐글에 올려진 다층신경망보다 우수한 성능을 나타냈다.","KDD Cup 1999 data has been used for the network intrusion detection studies. This data is analyzed using the convolutional neural networks in this paper. Many researchers have analyzed this data using the aritificial intelligence techniques such as TAVSM, decision tree algorithm and random forest algorithm etc. Although multilayer neural networks also have been used in these analysis, convolutional neural networks models have not been used. LeNet-5 among the various convolutional neural networks models is used with Keras for this analysis. At the first method, the 10% training set of the KDD Cup 1999 dividing into training set and testing set is used. At the second method, the 10% training set is used for train and testing set is used for test. The results are compared with the result of analysis using the mutlilayer neural networks uploaded in Kaggle web site. Because attacks are classified into 4 types in KDD Cup 1999 data, the performance measures are calculated by each attack types. LeNet-5 shows the better perfomance than the multilayer neural networks uploaded to Kaggle web site at both methods in all performance measures."
합성곱신경망을 이용한 초분광영상기반 토양수분 예측,2021,"['Soil moisture', 'Plant growth', 'Hyperspectral image', 'Spectral band', 'CNN', '토양수분', '식물생육', '초분광영상', '분광밴드', '합성곱신경망']","식물의 생육은 수분에 의해서 크게 좌우되기 때문에 토양이 재배하는 식물에 최적의 수분을 가지도록 조절하는 것은 중요하다. 최근 초분광영상을 통하여 식물의 생육정보를 자동으로 분석하는 연구가 진행되고 있으며 토양의 수분함량을 측정하는 것도 포함한다. 그러나 초분광의 경우 많은 분광밴드에서 나타나는 방대한데이터로 인하여 분석과정이 복잡하기 때문에 사용이 어렵다. 본 논문에서는 초분광영상의 복잡도를 합성곱신경망 (Convolution Neural Network, CNN)을 통하여 해결하는 방법을 제안한다. 제안한 방법은 대상 초분광의 전체 대역을 심층학습방법을 사용하여 자동 분석하기 때문에 각 영상에 대해 인식에 필요한 특정 대역을 찾는 노력을 할 필요가 없다. 제안 시스템의 유효성을 보이기 위해서 토양에서 얻은 초분광영상을 이용한수분함량분석 실험을 수행하고 결과를 보인다.",
합성곱신경망을 사용한 이미지 기반의 안드로이드 악성소프트웨어 패밀리 분류,2021,"['안드로이드 악성소프트웨어', '패밀리 분류', '회색조 이미지', '합성곱 신경망', '데이터 섹션', 'android malware', 'family classification', 'grayscale image', 'CNN', 'data section']","안드로이드 악성소프트웨어가 지속적으로 증가함에 따라, 기계학습을 사용한 안드로이드 악성소프트웨어 탐지 및 분류 기법이 많이 연구되고 있다. 악성소프트웨어 패밀리(malware family) 분류는, 악성소프트웨어 샘플들을 연관성 있는 그룹으로 분류하는 기법으로 컴퓨터 포렌식 분석, 위협 평가, 위협완화 계획에 중요한 역할을 한다. 본 논문에서는 실행파일 중의 일부를 회색조 이미지(grayscale image)로 변환한 후 변환된 영상들을 대상으로 딥러닝 기법을 적용하여 안드로이드 악성소프트웨어 패밀리를 분류하는 방법을 제안한다. 대표적인 안드로이드 악성소프트웨어 데이터 셋(dataset)인 Drebin에서 제공되는 악성소프트웨어 대표 패밀리들을 대상으로 합성곱신경망(Convolutional Neural Network, CNN) 모델을 적용하여 악성소프트웨어를 분류한다. 본 실험의 연구 결과를 기존 연구 결과와 비교하여, 데이터 경량화와 적절한 데이터 크기의 선정, 정확도에 있어 본 연구가 악성소프트웨어 분류에 더 효과적임을 보인다.","As Android malware continues to increase, Android malware detection and classification techniques using machine learning are being studied intensively. Malware family classification is a technique for classifying malware samples into related malware families and plays an important role in computer forensic analysis, threat assessment, and threat mitigation planning. In this paper, we propose a method to classify Android malware families by converting only part of an executable file into a gray scale image and applying deep learning to the converted images. The malware samples are classified from the representative families of the dataset from the Drebin project by applying the Convolutional Neural Network (CNN) model. The experimental results show that the proposed method is more effective in classifying malware families in terms of processing overhead and classification accuracy."
농작물 질병분류를 위한 전이학습에 사용되는 기초 합성곱신경망 모델간 성능 비교,2021,"['Crop Disease', 'Transfer Learning', 'Convolutional Neural Network', 'Performance Evaluation']",,"Recently, transfer learning techniques with a base convolutional neural network (CNN) model have widely gained acceptance in early detection and classification of crop diseases to increase agricultural productivity with reducing disease spread. The transfer learning techniques based classifiers generally achieve over 90% of classification accuracy for crop diseases using dataset of crop leaf images (e.g., PlantVillage dataset), but they have ability to classify only the pre-trained diseases. This paper provides with an evaluation scheme on selecting an effective base CNN model for crop disease transfer learning with regard to the accuracy of trained target crops as well as of untrained target crops. First, we present transfer learning models called CDC (crop disease classification) architecture including widely used base (pre-trained) CNN models. We evaluate each performance of seven base CNN models for four untrained crops. The results of performance evaluation show that the DenseNet201 is one of the best base CNN models."
립모션 센서 기반 증강현실 인지재활 훈련시스템을 위한 합성곱신경망 손동작 인식,2021,"['Euler angle spectrograph', 'Convolutional neural network (CNN)', 'Hand gesture recognition', 'Augmented reality (AR)', 'Cognitive rehabilitation system', 'Leap motion controller (LMC)']",,"In this paper, we evaluated prediction accuracy of Euler angle spectrograph classification method using a convolutional neural networks (CNN) for hand gesture recognition in augmented reality (AR) cognitive rehabilitation system based on Leap Motion Controller (LMC). Hand gesture recognition methods using a conventional support vector machine (SVM) show 91.3% accuracy in multiple motions. In this paper, five hand gestures (""Promise"", ""Bunny"", ""Close"", ""Victory"", and ""Thumb"") are selected and measured 100 times for testing the utility of spectral classification techniques. Validation results for the five hand gestures were able to be correctly predicted 100% of the time, indicating superior recognition accuracy than those of conventional SVM methods. The hand motion recognition using CNN meant to be applied more useful to AR cognitive rehabilitation training systems based on LMC than sign language recognition using SVM."
심방세동 진단을 위한 시계열성을 보전한 2차원 심전도 데이터 기반의 합성곱 신경망 모델,2021,"['2D 시계열', '심전도', '심방세동', '진단', '합성곱 신경망', '2D time series', 'electrocardiogram', 'atrial fibrillation', 'diagnosing', 'convolutional nueral network']","본 논문은 심장의 이상징후 중 심방세동 진단을 위하여 시계열성을 보전한 2D 심전도 데이터 기반의 합성곱 신경망 모델을 제안한다. 제안 모델은 시계열성을 보전한 2D 구조의 심전도 데이터를 사용하여 1D 합성곱 신경망 모델이나 기존의 2D 합성곱 신경망 모델에 비하여 심방세동 진단 성능을 높인다. 제안 방법의 유효성을 검증하기 위하여 Physionet 2017에 공개된 심전도 데이터를 활용하여 비교실험을 수행하였다. 1D 합성곱 신경망을 사용한 모델, 기존의 2D 합성곱 신경망 모델들과 제안 방법을 동일 환경에서 비교한 결과, 제안 방법이 다른 방법들에 비하여 더 적은 수의 학습 파라미터를 사용하면서도 더 높은 F1 점수와 정밀도(precision)를 보임을 확인하였다.","This paper proposes a convolutional neural network model based on 2D electrocardiogram data that preserves time series for diagnosing of atrial fibrillation among cardiac abnormalities. The proposed model uses ECG data of a 2D structure that preserves time series to improve atrial fibrillation diagnosing performance compared to the 1D convolutional neural network model and the existing 2D convolutional neural network model. To confirm the superiority of the proposed method, a comparative experiment was conducted using the ECG data published in Physionet 2017. A comparing of a 1D convolutional neural network model, two existing 2D convolutional neural network models and ours in the same experimental environments, the proposed method shows a higher F1 score and precision with fewer learning parameters."
흉부 X-선 영상에서 심장비대증 분류를 위한 합성곱 신경망 모델 제안,2021,"['합성곱 신경망', '딥러닝', '흉부 X-선', '분류', 'Convolutional Neural Network', 'Deep learning', 'Chest X-ray', 'Classification']","본 논문에서는 흉부 X선 영상에서 정상 심장과 비정상 심장(심장비대)을 분류할 수 있는 합성곱 신경망 모델을 제안하고자 한다. 학습 및 테스트 데이터로는 경북대학교병원에 내원하여 정상과 심장비대를 진단받은 환자들의 흉부 X-선 이미지를 획득하여 사용하였다. 제안된 합성곱 신경망 모델을 이용하였을 때의 정상 심장 및 비정상 심장(심장비대) 분류 정확도는 99.88%였다. 정상 심장 영상을 테스트 데이터로 사용하였을 때의 정확도, 정밀도, 재현율 및 F1 Score는 95%, 100%, 90%, 96%였다. 비정상 심장(심장비대) 영상을 테스트 데이터로 사용하였을 때의 정확도, 정밀도, 재현율 및 F1 Score는 95%, 92%, 100% 및 96%였다. 이러한 학습 및 테스트 분류 결과로 제안된 합성곱 신경망 모델은 흉부 X-선 영상의 특징 추출 및 분류에서 매우 우수한 성능을 보여주고 있다고 판단된다. 본 논문에서 제안하는 합성곱 신경망 모델은 흉부 X-선 영상의 질환 분류에 있어 유용한 결과를 보여줄 것으로 판단되며, 다른 의료 영상에서도 동일한 결과를 나타내는지 알아보기 위하여 추가적인 연구가 이루어져야 할 것이다.","The purpose of this study is to propose a convolutional neural network model that can classify normal and abnormal(cardiomegaly) in chest X-ray images. The training data and test data used in this paper were used by acquiring chest X-ray images of patients diagnosed with normal and abnormal(cardiomegaly). Using the proposed deep learning model, we classified normal and abnormal(cardiomegaly) images and verified the classification performance. When using the proposed model, the classification accuracy of normal and abnormal(cardiomegaly) was 99.88%. Validation of classification performance using normal images as test data showed 95%, 100%, 90%, and 96% in accuracy, precision, recall, and F1 score. Validation of classification performance using abnormal(cardiomegaly) images as test data showed 95%, 92%, 100%, and 96% in accuracy, precision, recall, and F1 score. Our classification results show that the proposed convolutional neural network model shows very good performance in feature extraction and classification of chest X-ray images. The convolutional neural network model proposed in this paper is expected to show useful results for disease classification of chest X-ray images, and further study of CNN models are needed focusing on the features of medical images."
Deep Metric Learning을 활용한 합성곱 신경망 기반의 피부질환 분류 기술,2021,"['합성곱 신경망', 'deep metric 손실', '클래스 불균형', '피부질환', 'convolutional neural network', 'deep metric loss', 'class imbalance', 'skin disease']","피부는 외부 오염으로부터 일차적으로 몸을 보호하는 역할을 한다. 피부병이 발생하게 되면 피부의 보호 기능이 저하되므로 신속한 진단과 처치가 필요하다. 최근 인공지능의 발달로 인해 여러 분야에 기술적용을 위한 연구가 이루어지고 있으며, 피부과에서도 인공지능을 활용해 오진율을 줄여 신속한 치료를 받을 수 있는 환경을 만들기 위한 연구가 진행되고 있다. 종래 연구들의 주된 흐름은 발생 빈도가 낮은 피부질환의 진단이었지만, 본 논문에서는 사람들에게 흔히 발생할 수 있고, 개인이 명확히 판별하기 힘든 티눈과 사마귀를 합성곱 신경망을 통해 분류하는 방법을 제안한다. 사용한 데이터셋은 3개의 클래스로 이루어져 있으며, 총 2,515장의 이미지를 가지고 있다, 학습 데이터 부족과 클래스 불균형 문제가 존재한다. 모델의 학습에는 deep metric 손실 함수와 교차 손실 함수를 이용해 각각 성능을 분석하였으며, 정밀도, 재현율, F1 점수, 정확도의 측면에서 비교한 결과 deep metric 손실 함수에서 더 우수한 성능을 보였다.","The skin is the body s first line of defense against external infection. When a skin disease strikes, the skin s protective role is compromised, necessitating quick diagnosis and treatment. Recently, as artificial intelligence has advanced, research for technical applications has been done in a variety of sectors, including dermatology, to reduce the rate of misdiagnosis and obtain quick treatment using artificial intelligence. Although previous studies have diagnosed skin diseases with low incidence, this paper proposes a method to classify common illnesses such as warts and corns using a convolutional neural network. The data set used consists of 3 classes and 2,515 images, but there is a problem of lack of training data and class imbalance. We analyzed the performance using a deep metric loss function and a cross-entropy loss function to train the model. When comparing that in terms of accuracy, recall, F1 score, and accuracy, the former performed better."
합성곱 신경망을 이용한 수중 선체면 영상의 청소 상태 검사,2021,"['Classification(분류)', 'Cleaning Condition(청소 상태)', 'Convolutional Neural Network(합성곱 신경망)', 'Hull Surface(선체면)', 'Inspection Image(검사 영상)', 'Underwater Hull(수중 선체)']","본 연구에서는 합성곱 신경망(CNN: convolutional neural network)을 이용해 수중에서 촬영한 선체면 영상에서 선체면의 청소 상태를 검사하기 위한 방법을 제안한다. 원격 조종 수중 로봇에서 수집한 동영상을 이용해 학습 데이터를 생성하였으며, 이 데이터들을 청소가 된 상태와 청소가 안된 상태의 영상으로 분류하였다. 청소 상태 검사를 위한 CNN 모델을 합성곱 레이어(convolution layer), 최대풀링 레이어(max-pooling layer), 드롭아웃 레이어(dropout layer)로 구성된 네 개의 합성곱 블록(convolution block)과 세개의 완전 연결 레이어(fully-connected layer)로 구성하였다. 그리고, 미니배치 경사하강법(mini-batch gradient descent)과 Adam 최적화를 이용해 CNN 모델을 학습하였다. 그 결과, 테스트 셋에 대해 97.95%의 정확도와 97.94%의 F1-점수를 보여주었다.","We propose a method for inspecting the cleaning condition of hull surfaces from underwater hull surface images using a convolutional neural network (CNN). A training data set was generated using videos collected from a remotely operated underwater robot, and the data set was classified into cleaned images and uncleaned images. The CNN model for inspecting the cleaning condition was composed of four convolutional blocks and three fully connected layers, where each convolutional block consisted of a convolution layer, a max-pooling layer, and a dropout layer. The CNN model was trained using the mini-batch gradient descent method and an Adam optimizer. As a result, on the testing set, the accuracy was 97.95%, and the F1-score was 97.94%."
합성곱 신경망 모델을 이용한 진동 응답의 모드 기여도 추정,2021,"['Deep Learning(딥러닝)', 'Mode Participation Factor(모드 기여도 계수)', 'Convolutional Neural Network(합성곱 신경망)', 'Natural Mode(고유 모드)', 'Mode Superposition Method(모드 중첩법)']","본 연구에서는 모드 중첩법으로 표현된 구조물의 강제 진동 응답에서 각 고유 모드의 기여도를 합성곱 신경망 모델을 이용하여 추정하는 방법론을 제시하고, 외팔보에 적용하여 제시한 방법론의 유효성을 입증한다. 과도 응답이 사라진 후에 조화 가진력에 의한 구조물의 강제 진동 거동은 해당 구조물이 갖는 고유 모드들의 선형 조합으로 표현할 수 있다. 각 고유 모드의 기여도는 가진력의 주파수, 가진 위치와 크기의 분포 등에 따라 달라지기 때문에 기여도가 큰 몇 개의 고유 모드만 사용하여 강제 진동거동을 근사적으로 표현할 수 있다. 이런 기여도를 추정할 수 있는 딥러닝 모델을 제안하고, 알맞은 입력과 출력 데이터를 사용하여 딥러닝 모델을 학습시킨다. 학습이 완료된 딥러닝 모델은 높은 정확도를 갖는 것을 알 수 있었고, 이런 결과가 응용될 수 있는 분야를 살펴본다.","In this study, a method based on a convolutional neural network was proposed to estimate the participation factor of each vibration mode in forced vibration response, expressed by the mode superposition method, and the effectiveness of the method was validated by applying it to a cantilever beam. After the transient response decays out, the forced vibration behaviour of a structure due to a harmonic excitation force can be expressed as a linear combination of its vibration modes. Since the participation factor of each vibration mode varies depending on the frequency of the excitation force, its location, and distribution, only a few vibration modes with large participation factors can be used to approximate the forced vibration behaviour. To estimate this participation factor, a convolutional neural network model was trained using appropriate input and output data. The proposed and trained deep learning model showed high accuracy against test data. Furthermore, its areas of application were discussed."
