title,date,keywords,abstract,multilingual_abstract
스태킹 앙상블을 이용한 병렬 네트워크 이상호흡음 분류 모델,2021,"['Respiratory Sound Classification', 'Wheezes', 'Crackles', 'Convolutional Neural Network(CNN)', 'Stacking Ensemble', '호흡음 분류', '천명음', '수포음', '병렬 합성곱 신경망', '스태킹 앙상블']","최근 코로나(Covid-19)의 영향으로 스마트 헬스케어 관련 산업과 비대면 방식의 원격 진단을 통한 질환 분류 예측 연구의 필요성이 증가하고 있다. 일반적으로 호흡기 질환의 진단은 비용이 많이 들고 숙련된 의료 전문가를 필요로 하여 현실적으로 조기 진단 및 모니터링에 한계가 있다. 따라서, 간단하고 편리한 청진기로부터 수집된 호흡음을 딥러닝 기반 모델을 활용하여 높은 정확도로 분류하고 조기 진단이 필요하다. 본 연구에서는 청진을 통해 수집된 폐음 데이터를 이용하여 이상 호흡음 분류모델을 제안한다. 데이터 전처리로는 대역통과필터(BandPassFilter)방법론을 적용하고 로그 멜 스펙트로그램(Log-Mel Spectrogram)과 Mel Frequency Cepstral Coefficient(MFCC)을 이용하여 폐음의 특징적인 정보를 추출하였다. 추출된 폐음의 특징에 대해서 효과적으로 분류할 수 있는 병렬 합성곱 신경망 네트워크(Parallel CNN network)모델을 제안하고 다양한 머신러닝 분류기(Classifiers)와 결합한 스태킹 앙상블(Stacking Ensemble) 방법론을 이용하여 이상 호흡음을 높은 정확도로 분류하였다. 본 논문에서 제안한 방법은 96.9%의 정확도로 이상 호흡음을 분류하였으며, 기본모델의 결과 대비 정확도가 약 6.1% 향상되었다.","As the COVID-19 pandemic rapidly changes healthcare around the globe, the need for smart healthcare that allows for remote diagnosis is increasing. The current classification of respiratory diseases cost high and requires a face-to-face visit with a skilled medical professional, thus the pandemic significantly hinders monitoring and early diagnosis. Therefore, the ability to accurately classify and diagnose respiratory sound using deep learning-based AI　models is essential to modern medicine as a remote alternative to the current stethoscope. In this study, we propose a deep learning-based respiratory sound classification model using data collected from medical experts. The sound data were preprocessed with BandPassFilter, and the relevant respiratory audio features were extracted with Log-Mel Spectrogram and Mel Frequency Cepstral Coefficient (MFCC). Subsequently, a Parallel CNN network model was trained on these two inputs using stacking ensemble techniques combined with various machine learning classifiers to efficiently classify and detect abnormal respiratory sounds with high accuracy. The model proposed in this paper classified abnormal respiratory sounds with an accuracy of 96.9%, which is approximately 6.1% higher than the classification accuracy of baseline model."
전이학습 기반 CNN을 통한 풀림 방지 코팅 볼트 이진 분류에 관한 연구,2021,"['Bolts With Anti-loosening Coating', 'Convolutional Neural Networks', 'Transfer Learning', 'Fine-tuning', 'Fully Connected Layer']","풀림 방지 코팅 볼트는 주로 자동차 안전 관련 부품을 결합하는 데 사용되므로 안전성 유지를 위해 코팅 결함을 사전에 감지해야 한다. 이를 위해 이전 연구 [CNN 및 모델 시각화 기법을 사용한 코팅 볼트 불량 판별]에서는 합성곱신경망을 사용했다. 이때 합성곱 신경망은 데이터 수가 많을수록 이미지 패턴 및 특성 분석 정확도가 증가하지만 그에 따라 학습시간이 증가한다. 또한 확보 가능한 코팅 볼트 샘플이 한정적이다. 본 연구에서는 이전 연구에 전이학습을 추가적으로 적용해 데이터 개수가 적은 경우에도 코팅 결함에 대해 정확한 분류를 하고자 한다. 전이학습을 적용할 때 학습데이터 수와 사전 학습 데이터 ImageNet 간의 유사성을 고려해 분류층만 학습했다. 데이터 학습에는 전역 평균 풀링, 선형 서포트 벡터 머신 및 완전 연결 계층과 같은 분류층을 적용했으며, 고려한 모델 중 완전 연결 계층 방법의 분류층이 가장 높은 95% 정확도를 가진다. 추가적으로 마지막 합성곱층과 분류층을 미세 조정하면 정확도는 97%까지 향상된다. 전이학습 및 미세 조정을 이용하면 선별 정확도를 향상시킴은 물론 이전보다 학습 소요시간을 절반으로 줄일 수 있음을 보였다.","Because bolts with anti-loosening coatings are used mainly for joining safety-related components in automobiles, accurate automatic screening of these coatings is essential to detect defects efficiently. The performance of the convolutional neural network (CNN) used in a previous study [Identification of bolt coating defects using CNN and Grad-CAM] increased with increasing number of data for the analysis of image patterns and characteristics. On the other hand, obtaining the necessary amount of data for coated bolts is difficult, making training time-consuming. In this paper, resorting to the same VGG16 model as in a previous study, transfer learning was applied to decrease the training time and achieve the same or better accuracy with fewer data. The classifier was trained, considering the number of training data for this study and its similarity with ImageNet data. In conjunction with the fully connected layer, the highest accuracy was achieved (95%). To enhance the performance further, the last convolution layer and the classifier were fine-tuned, which resulted in a 2% increase in accuracy (97%). This shows that the learning time can be reduced by transfer learning and fine-tuning while maintaining a high screening accuracy."
MI 센서기반의 금속탐지용 뉴럴네트워크 성능비교에 관한연구,2021,"['합성곱신경망', '딥러닝', '전자기유도', '자기임피던스센서', '순환신경망', 'CNN', 'Deep Learning', 'Electromagnetic Induction', 'MI sensor', 'RNN']",,"This paper is a study on the efficiency of the filtering method of signal processing and the metal detection method using deep learning for data obtained from multiple MI sensors. The MI sensor is a principle that detects changes in magnetic field and is a passive sensor that detects metal objects. However, when detecting a metal object, the amount of change in the magnetic field caused by the metal is small, so there is a limit to the detectable distance. In order to effectively detect and analyze this, a method using deep learning was applied. In addition, the performance of the deep learning model was compared and analyzed using the filtering method of signal processing. In this paper, the detection performance of CNN and RNN networks was compared and analyzed from the data extracted from the self-impedance sensor. The RNN model showed higher performance than the CNN model. However, in the shallow stage, the CNN model showed higher performance than the RNN model."
ResNet을 이용한 도로 네트워크 교통 데이터 예측,2021,"['합성곱 신경망', '잔차 학습', '전이 학습', '교통 속도 예측', 'Convolutional Neural Network', 'Residual Learning', 'ResNet', 'Transfer Learning', 'Traffic Speed Prediction']",,
An Evaluation Method for Generalization Errors of CNN using Training Data,2021,"['합성곱 신경망', '일반화 오류', '반응 셋', '상대적 일반화 오류', 'convolutional neural network', 'generalization error', 'response set', 'relative generalization error']",,
CNN을 활용한 새싹삼의 품질 예측 모델 개발,2021,"['합성곱신경망', '새싹삼', '품질예측', '이미지 인식', 'convolutional neural network (CNN)', 'Ginseng Sprouts', 'Quality Prediction', 'Image Recognition']",,
CNN기반의 온라인 수어통역 상담 시스템에 관한 연구,2021,"['OpenCV', '합성곱 신경망', '수어', '청각장애인', '영상처리', 'OpenCV(Open Source Computer Vision)', 'CNN(Convolutional Neural  Networks)', 'Sign Language', 'Hearing-Impaired Person', 'Image Processing']",,
딥러닝과 의미론적 영상분할을 이용한 자동차 번호판의 숫자 및 문자영역 검출,2021,"['딥러닝', '합성곱 신경망(CNN)', '의미론적 분할', '자동차 번호판', '영상분할 및 인식', 'Deep Learning', 'Convolution Neural Network(CNN)', 'Semantic Segmentation', 'License Plate', 'Image Segmentation and Recognition']","자동차 번호판 인식은 지능형 교통시스템에서 핵심적인 역할을 담당한다. 따라서 효율적으로 자동차 번호판의 숫자 및 문자영역을 검출하는 것은 매우 중요한 과정이다. 본 연구에서는 딥러닝과 의미론적 영상분할 알고리즘을 적용 하여 효과적으로 자동차 번호판의 번호영역을 검출하는 방법을 제안한다. 제안된 방법은 화소 투영과 같은 전처리과정 없이 번호판 영상에서 바로 숫자 및 문자영역을 검출하는 알고리즘이다. 번호판 영상은 도로 위에 설치된 고정 카메라로 부터 획득한 영상으로 날씨 및 조명변화 등을 모두 포함한 다양한 실제 상황에서 촬영된 것을 사용하였다. 입력 영상은 색상변화를 줄이기 위해 정규화하고 실험에 사용된 딥러닝 신경망 모델은 Vgg16, Vgg19, ResNet18 및 ResNet50이 다. 제안방법의 성능을 검토하기 위해 번호판 영상 500장으로 실험하였다. 학습을 위해 300장을 할당하였으며 테스트용 으로 200장을 사용하였다. 컴퓨터모의 실험결과 ResNet50을 사용할 때 가장 우수하였으며 95.77% 정확도를 얻었다.","License plate recognition plays a key role in intelligent transportation systems. Therefore, it is a very important process to efficiently detect the number and character areas. In this paper, we propose a method to effectively detect license plate number area by applying deep learning and semantic image segmentation algorithm. The proposed method is an algorithm that detects number and text areas directly from the license plate without preprocessing such as pixel projection. The license plate image was acquired from a fixed camera installed on the road, and was used in various real situations taking into account both weather and lighting changes. The input images was normalized to reduce the color change, and the deep learning neural networks used in the experiment were Vgg16, Vgg19, ResNet18, and ResNet50. To examine the performance of the proposed method, we experimented with 500 license plate images. 300 sheets were used for learning and 200 sheets were used for testing. As a result of computer simulation, it was the best when using ResNet50, and 95.77% accuracy was obtained."
변형 Residual Convolutional Neural Network 모델을 이용한 고효율 심전도 데이터 분석 기법,2021,"['MIT-BIH arrhythmia 데이터베이스', 'ResNet', 'ResNeXt', 'Adabound', '주입기법']",,
CNN 잡음감쇠기에서 필터 수의 최적화,2021,"['잡음 감쇠', '심층 학습', '합성곱 신경망', '오차 역전파', '평균 제곱 오차', '평균 절대값 오차', 'Noise Attenuation', 'Deep Learning', 'CNN', 'Error Back Propagation', 'MSE', 'MAE']","본 논문은 잡음감쇠기에서 CNN(Convolutional Neural Network) 계층의 필터 수가 성능에 미치는 영향을 연구하였다 이 시스템은 적응필터 대신 신경망 예측필터를 이용하며 심층학습방법으로 잡음을 감쇠한다. 64-뉴런, 16-커널 CNN 필터와 오차 역전파 알고리즘을 이용하여 잡음이 포함된 음성신호로부터 음성을 추정한다. 본 연구에서 필터 수에 대한 잡음감쇠기의 성능을 검증하기 위하여 Keras 라이브러리를 사용한 프로그램을 작성하고 시뮬레이션을 실시하였다. 시뮬레이션 결과, 본 시스템은 필터 수가 16일 때 MSE(Mean Squared Error) 및 MAE(Mean Absolute Error) 값이 가장 작은 것으로 나타났으며 필터가 4개 일 때 성능이 가장 낮은 것을 볼 수 있다. 그리고 필터가 8개 이상이 되면 필터 수에 따라 MSE 및 MAE 값이 크게 차이나지 않는 것을 보여주었다. 이러한 결과로부터 음성신호의 주요 특징을 표현하기 위해서는 약 8개 이상의 필터를 사용해야 한다는 것을 알 수 있다.","This paper studies the effect of the number of filters in the CNN (Convolutional Neural Network) layer on the performance of a noise attenuator. Speech is estimated from a noised speech signal using a 64-neuron, 16-kernel CNN filter and an error back-propagation algorithm. In this study, in order to verify the performance of the noise attenuator with respect to the number of filters, a program using Keras library was written and simulation was performed. As a result of simulation, it can be seen that this system has the smallest MSE (Mean Squared Error) and MAE (Mean Absolute Error) values when the number of filters is 16, and the performance is the lowest when there are 4 filters. And when there are more than 8 filters, it was shown that the MSE and MAE values do not differ significantly depending on the number of filters. From these results, it can be seen that about 8 or more filters must be used to express the characteristics of the speech signal."
CNN 기반 딥러닝을 이용한 패션 아이템 분류 및 결합,2021,"['인공지능', '딥러닝', '머신러닝', '합성곱 신경망', '생성적 적대 신경망', '패션', 'Artificial Intelligence', 'Deep Learning', 'Machine Learning', 'Convolutional Neural Network', 'Generative Adversarial Network', 'Fashion']",,"In this paper, in order to implement an artificial intelligence system that can appropriately match fashion items according to the situation, a deep learning model based on convolutional neural network was designed after labeling with 10 fashion items based on fashion-MNIST. Based on the designed deep learning model, 45,000 fashion images were used as a training dataset, and 15,000 fashion images were used as a verification dataset, and deep learning was performed with a total of 15 epochs. As a result of the deep learning execution, the training data learning accuracy 96% and the verification data learning accuracy 94% were output in the accuracy evaluation of fashion item classification. In this paper, we constructed a dataset that can provide 7 types of fashion matching based on the implemented artificial intelligence fashion item classification system. The established dataset is expected to become the basis of an artificial intelligence fashion matching service that can satisfy various fashion needs of individuals in the future."
Quality control of seismic data based on convolutional neural network,2021,"['파워스펙트럼밀도', '품질관리', '심층학습', '합성곱 신경망', 'power spectral density', 'quality control', 'deep learning', 'convolutional neural network']",,"Installing more seismic stations may result in improving the capability of earthquake monitoring and shortening the time to report the occurrence of earthquakes or deliver public earthquake warnings. However, accordingly, it becomes difficult to assess the condition of seismic instrument. The goal of this study is to develop an automated method for assessing the quality of seismic data, which is based on power spectral densities (PSD) of one-hour waveform data. We collected 10,309 PSDs of broadband seismometers and 4,452 PSDs of accelerometers recorded from 2016, 2017 and 2019, and used them as the input of the convolutional neural network (CNN), a class of deep learning. Two deep CNNs for broadband seismometer and accelerometer were trained to automatically determine the condition of seismic data: normal and abnormal conditions. We find that the condition of seismic data determined by the CNNs have an accuracy of 99.9% and they can successfully determine the condition from PSDs of 15-minute waveforms. The outstanding performance of the trained models indicates that this can be a very effective tool for assessing the condition of seismic instrument."
문화재 관리를 위한 지능형 플랫폼 방안 연구,2021,"['문화재', 'IoT', '빅데이터', '심층신경망(DNN)', '합성곱신경망(CNN)', 'Cultural Property', 'IoT', 'Big Data', 'Deep Neural Network', 'Convolution Neural Network']",,"Recently, with the rapid development of IoT technology, the issue of Intelligent Platforms for managing Cultural Properties is increasing. In order to develop an Intelligent Platform for Cultural Property management, Sensors can be installed to collect and analyze internal and external state data of Cultural Properties, and predict with Big Data analysis using Artificial Intelligence algorithms. This Study proposes an external and internal intelligent integrated platform research method based on IoT technology for maintenance and safety management of Cultural Properties. In the proposed Intelligent Platform, a Deep Neural Network (DNN) learning algorithm was proposed to analyze and predict the tilt Sensor data and the Meteorological Agency data considering changes in the external environment as external data of Cultural Properties. In addition, we propose a Convolutional Neural Network (CNN) learning algorithm to analyze and predict image data for detecting pests as internal data of Cultural Properties."
YOLO V3 기반의 시각장애인을 위한 유도 블록 인식 알고리즘,2021,"['YOLO', '영상인식', '머신러닝', '합성곱 신경망', '평균 정밀도', 'Object detection', 'Machine learning', 'Convolutional neurual network', 'Mean average precision']","현재 우리나라에 설치된 유도 블록 중에서 일부는 설치 후에 관리가 미흡한 편이며 파손된 경우 보수도 잘 이루어지지 않아 시각장애인들의 보행에 부정적인 영향을 미치는 경우가 많다. 시각장애인들에게 유도 블록의 위치와 의미를 전달하는 시스템에 관한 연구가 필요한 상황이며 이를 위해서 휴대하기 편하고 스마트폰에서도 계산이 가능한 알고리즘이 요구된다. 이에 본 논문은 실시간 물체 검출이 가능하고, 준수한 FPS(frame per second)를 유지할 수 있는 YOLO를 기반으로 한 시각장애인을 위한 유도 블록 인식 알고리즘을 제안한다. 그리고 영상인식 영역의 성능을 여러 가지 수치로 비교하여 최선의 알고리즘을 선택했고 해당 알고리즘은 mAP와 YOLO-Loss, AP, Precision 등의 수치를 이용하여 성능을 평가하였다. 제안한 알고리즘은 연산량을 줄여주고 그에 따른 정확도의 하락을 방지하는 방법도 제시했다.","Currently, some of the induction blocks in the case of in Korea are poorly managed when some of the induction blocks are installed, and there is a visual impairment because neither case nor maintenance is well done. There is a need for research on a system that delivers the location and meaning of guidance blocks to visually impaired people, and an algorithm that is easy to perform and that can be calculated on a smartphone is required. Therefore, this paper proposes an induction block recognition algorithm for the visually impaired based on YOLO, which enables real-time detection and uses compliant FPS (frame per second). Then, the best algorithm was selected by comparing the performance of the image recognition area with various numbers, and the performance was evaluated using mAP, YOLO-Loss, AP, and Precision. The proposed algorithm flows the computational load and also suggests a method to prevent its degradation."
자율주행 트랙터 경로 추종을 위한 영상 기반 경계검출기술 개발,2021,"['자율주행', '농업기계', '경계 검출', '합성곱 신경망', '조향제어', 'autonomous traveling', 'agricultural machinery', 'boundary detection', 'CNN', 'steering control']",,
인공지능 기반 영어 발음 인식에 관한 연구,2021,"['인공지능', '동적 시간 워핑', '합성곱 신경망', '영어 발음', '영어 교육', 'AI', 'DTW', 'CNN', 'English Pronunciation', 'English Language Training']","최근 4차 산업혁명은 주요 선진국을 중심으로 세계의 국가들의 관심을 갖는 분야가 되고 있다. 4차 산업혁명 기술의 핵심기술인 인공지능기술은 다양한 분야에 융합하는 형태로 발전하고 있으며, 에듀테크 분야에도 많은 영향을 미치고 있으며 교육을 혁신적으로 변화하기 위해 많은 관심과 노력을 하고 있다. 본 논문은 DTW 음성인식 알고리즘을 이용하여 실험환경을 구축하고 다양한 원어민 데이터와 비원어민 데이터를 딥러닝 학습하고, CNN 알고리즘과의 비교를 통해 영어 발음의 유사도를 측정하여 비원어민이 원어민과 유사한 발음으로 교정할 수 있도록 연구한다.","Recently, the fourth industrial revolution has become an area of interest to many countries, mainly in major advanced countries. Artificial intelligence technology, the core technology of the fourth industrial revolution, is developing in a form of convergence in various fields and has a lot of influence on the edutech field to change education innovatively. This paper builds an experimental environment using the DTW speech recognition algorithm and deep learning on various native and non-native data. Furthermore, through comparisons with CNN algorithms, we study non-native speakers to correct them with similar pronunciation to native speakers by measuring the similarity of English pronunciation."
소음 신호를 이용한 딥러닝 이용 파워 드라이빙 시스템의 건전성 감시,2021,"['Convolutional Neural Network(합성곱 신경망)', 'Continuous Wavelet Transform(연속 웨이블렛 변환)', 'Power Driving System(동력 구동 시스템)']",,"The power driving system (PDS) comprises parts such as the chain, sprocket, gear, bearing, and rotating shaft. The purpose of this study is to develop a condition-monitoring device that diagnoses component defects early by using a convolutional neural network to prevent complete damage due to component defects. For this study, eight types of defects are artificially manufactured in various parts and assembled to build a PDS. A convolutional neural network is developed to classify and diagnose the eight types of defects. A feature for faults is successfully extracted, and fault classification is achieved with 90 % accuracy."
CNN을 활용한 카오스 신호 분류 검증,2021,"['Convolutional Neural Network(합성곱 신경망)', 'Lyapunov Exponent(리아푸노브 지수)', 'Recurrence Plot(리커런스 플롯)', 'Chaos(카오스)']",,"The aim of the study was to classify the chaotic time-series data with the nonlinear problem using the convolutional neural network (CNN), and to determine and verify the chaotic characteristics from a deterministic system. The classical nonlinear differential equation established by the Rossler model was used, and the chaotic characteristics were determined by the Lyapunov exponent. The chaotic properties was visualized using an unthresholded recurrence plot through the proposed procedure. A simple CNN model was developed to learn the extracted image using the proposed feature-visualization technique. As a result, the chaotic characteristics were classified with an accuracy of 99 % or more."
뇌파를 활용한 IoT기반 스마트홈 시스템 구현,2021,"['스마트홈', '사물인터넷', '뇌-컴퓨터 인터페이스', '뇌파', '딥러닝', '합성곱신경망', 'Smart Home', 'Internet of Things (IoT)', 'Brain-Computer Interface (BCI)', 'Electroencephalography (EEG)', 'Deep learning', 'Convolutional Neural Network (CNN)']",,
