title,date,keywords,abstract,multilingual_abstract
경안천 용존 산소 예측을 위한 입력 인자 선정 및 기계 학습 모델 비교,2021,"['인공신경망', '합성곱 신경망', '게이트 순환 유닛', '경안천', '랜덤 포레스트', 'Artificial Neural Network', 'Convolutional Neural Network', 'Gated Recurrent Unit', 'Gyeongan Stream', 'Random Forest']","목적:본 연구에서는 경안천의 용존 산소(dissolved oxygen, DO) 예측을 위해 기계 학습(machine learning) 모델의 최적 입력 인자를 선정하고 성능 평가 지표 결과를 비교하여 최적 모델을 찾고자 한다.방법:경안천 특정 지점의 수질 자료를 연구대상으로 삼아 1998년 1월 15일부터 2019년 12월 30일까지 자료를 수집하고, 전처리한 데이터를 7:3의 비율에 따라 train과 test 자료로 나누어 실험을 진행하였다. 기계 학습 중 랜덤 포레스트(random forest, RF), 인공신경망(artificial neural network, ANN), 합성곱 신경망(convolutional neural network, CNN), 게이트 순환 유닛(gated recurrent unit, GRU) 등을 이용하였다. RF와 ANN은 무작위 추출(random split)과 시계열 자료(time series)로 구분하여 실험하였으며, CNN과 GRU는 시계열 자료만 이용하여 실험을 진행하였다. 모델별 최적의 결과를 비교하기 위해 성능 평가 지표(결정 계수(square of the correlation coefficient, R2), 평균 제곱근 오차(root mean square error, RMSE), 평균 절대 오차(mean absolute error, MAE))를 사용하였다.결과 및 토의:RF 기여도 분석 결과와 참고문헌을 통해 최적 입력 인자로 수온, pH, 전기 전도도, PO4-P, NH4-N, 총 인, 부유물질, NO3-N 등으로 선정하였다. RF와 ANN 모두 무작위 추출보다 시계열 자료의 성능이 더 우수하였다. 시계열 자료를 이용하여 모델 성능을 비교해 보면, RF > CNN > GRU > ANN 순으로 나타났다.결론:본 연구에서 경안천의 DO 예측을 위한 기계 학습 모델의 최적 입력 인자로 8개(수온, pH, 전기 전도도, PO4-P, NH4-N, 총 인, 부유물질, NO3-N)를 선택하였다. DO 예측에 가장 우수한 모델은 시계열 자료를 사용한 RF 모델이었다. 따라서 경안천과 같은 하천의 DO를 예측하는 경우 최적 입력 인자 선정 후 시계열 자료를 바탕으로 RF 모델을 이용할 것을 제안한다.","Objectives:In this study, we select input factors for machine learning models to predict dissolved oxygen (DO) in Gyeongan Stream and compare results of performance evaluation indicators to find the optimal model.Methods:The water quality data from the specific points of Gyeongan Stream were collected between January 15, 1998 and December 30, 2019. The pretreatment data were divided into train and test data with the ratio of 7:3. We used random forest (RF), artificial neural network (ANN), convolutional neural network (CNN), and gated recurrent unit (GRU) among machine learning. RF and ANN were tested by both random split and time series data, while CNN and GRU conducted the experiment using only time series data. Performance evaluation indicators such as square of the correlation coefficient (R2), root mean square error (RMSE), and mean absolute error (MAE) were used to compare the optimal results for the models.Results and Discussion:Based on the RF variable importance results and references, water temperature, pH, electrical conductivity, PO4-P, NH4-N, total phosphorus, suspended solids, and NO3-N were used as input factors. Both RF and ANN performed better with time series data than random split. The model performance was good in order of RF > CNN > GRU > ANN.Conclusions:The eight input factors (water temperature, pH, electrical conductivity, PO4-P, NH4-N, total phosphorus, suspended solids, and NO3-N) were selected for machine learning models to predict DO in Gyeongan Stream. The best model for DO prediction was the RF model with time series data. Therefore, we suggest that the RF with the eight input factors could be used to predict the DO in streams."
시간 연속성을 고려한 딥러닝 기반 레이더 강우예측,2021,"['레이더', '강우예측', '합성곱 신경망', '장단기메모리', '딥러닝', 'Radar', 'Rainfall prediction', 'Convolutional neural network', 'Long short-term memory', 'Deep learning']","본 연구에서는 시계열 순서의 의미가 희석될 수 있는 기존의 U-net 기반 딥러닝 강우예측 모델의 성능을 개선하고자 하였다. 이를 위해서 데이터의 연속성을 고려한 ConvLSTM2D U-Net 신경망 구조를 갖는 모델을 적용하고, RainNet 모델 및 외삽 기반의 이류모델을 이용하여 예측정확도 개선 정도를 평가하였다. 또한 신경망 기반 모델 학습과정에서의 불확실성을 개선하기 위해 단일 모델뿐만 아니라 10개의 앙상블 모델로 학습을 수행하였다. 학습된 신경망 강우예측모델은 현재를 기준으로 과거 30분 전까지의 연속된 4개의 자료를 이용하여 10분 선행 예측자료를 생성하는데 최적화되었다. 최적화된 딥러닝 강우예측모델을 이용하여 강우예측을 수행한 결과, ConvLSTM2D U-Net을 사용하였을 때 예측 오차의 크기가 가장 작고, 강우 이동 위치를 상대적으로 정확히 구현하였다. 특히, 앙상블 ConvLSTM2D U-Net이 타 예측모델에 비해 높은 CSI와 낮은 MAE를 보이며, 상대적으로 정확하게 강우를 예측하였으며, 좁은 오차범위로 안정적인 예측성능을 보여주었다. 다만, 특정 지점만을 대상으로 한 예측성능은 전체 강우 영역에 대한 예측성능에 비해 낮게 나타나, 상세한 영역의 강우예측에 대한 딥러닝 강우예측모델의 한계도 확인하였다. 본 연구를 통해 시간의 변화를 고려하기 위한 ConvLSTM2D U-Net 신경망 구조가 예측정확도를 높일 수 있었으나, 여전히 강한 강우영역이나 상세한 강우예측에는 공간평활로 인한 합성곱 신경망 모델의 한계가 있음을 확인하였다.","In this study, we tried to improve the performance of the existing U-net-based deep learning rainfall prediction model, which can weaken the meaning of time series order. For this, ConvLSTM2D U-Net structure model considering temporal consistency of data was applied, and we evaluated accuracy of the ConvLSTM2D U-Net model using a RainNet model and an extrapolation-based advection model. In addition, we tried to improve the uncertainty in the model training process by performing learning not only with a single model but also with 10 ensemble models. The trained neural network rainfall prediction model was optimized to generate 10-minute advance prediction data using four consecutive data of the past 30 minutes from the present. The results of deep learning rainfall prediction models are difficult to identify schematically distinct differences, but with ConvLSTM2D U-Net, the magnitude of the prediction error is the smallest and the location of rainfall is relatively accurate. In particular, the ensemble ConvLSTM2D U-Net showed high CSI, low MAE, and a narrow error range, and predicted rainfall more accurately and stable prediction performance than other models. However, the prediction performance for a specific point was very low compared to the prediction performance for the entire area, and the deep learning rainfall prediction model also had limitations. Through this study, it was confirmed that the ConvLSTM2D U-Net neural network structure to account for the change of time could increase the prediction accuracy, but there is still a limitation of the convolution deep neural network model due to spatial smoothing in the strong rainfall region or detailed rainfall prediction."
CNN 강우여부 분류기를 적용한 ANN 기반 X-Band 레이다 유의파고 보정,2021,"['X-band 레이다', '유의파고', '머신러닝', '인공신경망', '합성곱신경망', 'X-band marine radar', 'significant wave heights', 'machine learning', 'artificial neural network(ANN)', 'convolutional neural network(CNN)']",항해용 X-band 레이다를 이용한 파랑관측은 해수면에 후방산란 된 전자기파 이미지를 분석하여 이루어진다. 1분당 42개의 해수면 시계열 이미지로부터 3차원 FFT를 계산하고 변조전달함수(Modulation Transfer Function)를 구하여 파랑정보를 추출한다. 따라서 레이다 파고계로 계측한 유의파고의 정확도는 X-band 레이다 영상의 상태에 따라 결정된다. 2020년 여름 태풍 마이삭과 하이선 내습 시 강릉 안인 해안에 설치된 X-band 레이다 파고계로 관측한 유의파고의 오차가 크게 발생하였다. 이는 태풍 내습 시 급격히 유의파고가 증가하는 한편 강한 강우가 동반되어 X-band 레이다 영상의 품질이 저하되었기 때문이다. 최대 오차 발생 이전까지 많은 강우가 있었음이 확인된다. 본 연구에서는 convolution neural network(CNN)을 이용하여 레이다 이미지로부터 강우 여부를 분류하고 강우여부에 따라 강우시 인공신경망 모델을 적용하여 태풍 시 유의파고 관측 정확도를 향상시켰다. 폭우를 동반한 태풍 시 레이다 자료 특성에 기반하여 인공신경망 유의파고 산출 알고리즘을 개선하고 이를 통해 X-band 레이다 파고계의 정확도를 향상시키는 방법을 제시하였다.,"Wave observations using a marine X-band radar are conducted by analyzing the backscattered radar signal from sea surfaces. Wave parameters are extracted using Modulation Transfer Function obtained from 3D wave number and frequency spectra which are calculated by 3D FFT of time series of sea surface images (42 images per minute). The accuracy of estimation of the significant wave height is, therefore, critically dependent on the quality of radar images. Wave observations during Typhoon Maysak and Haishen in the summer of 2020 show large errors in the estimation of the significant wave heights. It is because of the deteriorated radar images due to raindrops falling on the sea surface. This paper presents the algorithm developed to increase the accuracy of wave heights estimation from radar images by adopting convolution neural network(CNN) which automatically classify radar images into rain and non-rain cases. Then, an algorithm for deriving the Hs is proposed by creating different ANN models and selectively applying them according to the rain or non-rain cases. The developed algorithm applied to heavy rain cases during typhoons and showed critically improved results."
인접성 벡터를 이용한 트리플 지식 그래프의 임베딩 모델 개선,2021,"['지식 그래프', '노드 임베딩', '트리플 그래프', '합성곱 신경망', '그래프 특징 추출', '머신러닝', 'Knowledge Graph', 'Node Embedding', 'Triple Graph', 'Convolutional Network', 'Graph Feature Extraction', 'Machine Learning']","그래프 표현 학습을 위한 노드 임베딩 기법은 그래프 마이닝에서 양질의 결과를 얻는 데 중요한 역할을 한다. 지금까지 대표적인 노드 임베딩 기법은 동종 그래프를 대상으로 연구 되었기에, 간선 별로 고유한 의미를 갖는 지식 그래프를 학습하는 데 어려움이 있었다. 이러한 문제를 해결하고자, 기존 Triple2Vec 기법은 지식 그래프의 노드 쌍과 간선을 하나의 노드로 갖는 트리플 그래프를 학습하여 임베딩 모델을 구축한다. 하지만 Triple2Vec 임베딩 모델은 트리플 노드 간 관련성을 단순한 척도로 산정하기 때문에 성능을 높이는데 한계를 가진다. 이에 본 논문은 Triple2Vec 임베딩 모델을 개선하기 위한 그래프 합성곱 신경망 기반의 특징 추출 기법을 제안한다. 제안 기법은 트리플 그래프의 인접성 벡터(Neighborliness Vector)를 추출하여 트리플 그래프에 대해 노드 별로 이웃한 노드 간 관계성을 학습한다. 본 논문은 DBLP, DBpedia, IMDB 데이터셋을 활용한 카테고리 분류 실험을 통해, 제안 기법을 적용한 임베딩 모델이 기존 Triple2Vec 모델보다 우수함을 입증한다.","The node embedding technique for learning graph representation plays an important role in obtaining good quality results in graph mining. Until now, representative node embedding techniques have been studied for homogeneous graphs, and thus it is difficult to learn knowledge graphs with unique meanings for each edge. To resolve this problem, the conventional Triple2Vec technique builds an embedding model by learning a triple graph having a node pair and an edge of the knowledge graph as one node. However, the Triple2 Vec embedding model has limitations in improving performance because it calculates the relationship between triple nodes as a simple measure. Therefore, this paper proposes a feature extraction technique based on a graph convolutional neural network to improve the Triple2Vec embedding model. The proposed method extracts the neighborliness vector of the triple graph and learns the relationship between neighboring nodes for each node in the triple graph. We proves that the embedding model applying the proposed method is superior to the existing Triple2Vec model through category classification experiments using DBLP, DBpedia, and IMDB datasets."
인공지능 기반 위 병변 검출 알고리즘 개발,2021,"['Gastric Endoscopy', 'CNN', 'R-CNN Model', '위 내시경', '합성곱 신경망', '영역기반 합성곱 신경망 모델']","위암은 1999년 이후 우리나라에서 가장 많이 발생하는 암으로 1위를 차지하고 있다. 위암은 내시경 검사를 통해 일차적으로 판단되고 조직검사를 통해 정확히 진단되기 전까지는 특징적인 증상이 없으며, 실제로 위 내시경 검사를 받은 환자는 받지 않은 환자에 비해 생존율이 2.24배 높다는 연구 결과가 발표된 바 있다. 이러한 문제를 해결하기 위하여 본 논문은 위암 환자의 위 내시경 시행 시 임상의에게 실시간으로 보조적인 정보를 제공해 주고자 제안되었다. 본 논문에서는 Faster R-CNN을 위 병변 검출에 적합한 모델로 개선하여 보다 빠르고 정확한 검출 결과를 임상의에게 제공하는 방법을 제안한다. 기존 알고리즘과의 비교 평가 결과 평균 91%의 정확도를 도출하여 제안 방법이 보다 효과적임을 증명하였으며, 영상 처리 속도 또한 0.1sec/frame을 도출하여 실시간 처리에 적합함을 증명하였다. 향후 연구로 다양한 환경에서의 내시경 영상 수집을 통한 학습 데이터의 개선을 통해 정확도를 개선하고자 한다.","Gastric cancer is the most common cancer and has been the number one incidence since 1999 in Korea. Gastric cancer is primarily judged through endoscopy and has no characteristic symptoms until accurately diagnosed through biopsy then In fact, a study found that patients who underwent gastroscopy had a 2.24 times higher survival rate than those who did not. to solve these problems, This paper was proposed to provide real-time ancillary information to clinicians when performing gastroscopy for gastric cancer patients. In this paper, we propose a method to provide faster and more accurate detection results to clinicians by improving Faster R-CNN as a model suitable for gastric lesion detection. As a result of comparative evaluation with existing algorithms, an average accuracy of 91% was derived, proving that the proposed method is more effective. and, The image processing speed was also proven to be suitable for real-time processing by deriving 0.1sec/frame. As a future study, we intend to improve the accuracy by improving the learning data through the collection of endoscopic images in various environments."
Deep learning based Person Re-identification with RGB-D sensors,2021,"['person re-identification', 'surveillance system', 'deep learning', 'human action recognition', 'multi class identification', '사람 재인식', '감시 시스템', '딥러닝', '합성곱신경망', '사람 행동 인식', '다중 분류 인식']","본 연구에서는 3차원 RGB-D Xtion2 카메라를 이용하여 보행자의 골격좌표를 추출한 결과를 바탕으로 동적인 특성(속도, 가속도)을 함께 고려하여 딥러닝 모델을 통해 사람을 인식하는 방법을 제안한다. 본 논문의 핵심목표는 RGB-D 카메라로 손쉽게 좌표를 추출하고 새롭게 생성한 동적인 특성을 기반으로 자체 고안한 1차원 합성곱 신경망 분류기 모델(1D-ConvNet)을 통해 자동으로 보행 패턴을 파악하는 것이다. 1D-ConvNet의 인식 정확도와 동적인 특성이 정확도에 미치는 영향을 알아보기 위한 실험을 수행하였다. 정확도는 F1 Score를 기준으로 측정하였고, 동적인 특성을 고려한 분류기 모델(JCSpeed)과 고려하지 않은 분류기 모델(JC)의 정확도 비교를 통해 영향력을 측정하였다. 그 결과 동적인 특성을 고려한 경우의 분류기 모델이 그렇지 않은 경우보다 F1 Score가 약 8% 높게 나타났다.","In this paper, we propose a deep learning-based person re-identification method using a three-dimensional RGB-Depth Xtion2 camera considering joint coordinates and dynamic features(velocity, acceleration). The main idea of the proposed identification methodology is to easily extract gait data such as joint coordinates, dynamic features with an RGB-D camera and automatically identify gait patterns through a self-designed one-dimensional convolutional neural network classifier(1D-ConvNet). The accuracy was measured based on the F1 Score, and the influence was measured by comparing the accuracy with the classifier model (JC) that did not consider dynamic characteristics. As a result, our proposed classifier model in the case of considering the dynamic characteristics(JCSpeed) showed about 8% higher F1-Score than JC."
Artificial Neural Network Method Based on Convolution to Efficiently Extract the DoF Embodied in Images,2021,"['Artificial neural network', 'Convolutional neural network', 'Depth of field', 'Image processing', 'Region of interest', 'Object detection', '인공 신경망', '합성곱 신경망', '피사계 심도', '이미지 프로세싱', '관심영역', '객체 검출']","본 논문에서는 카메라의 포커싱과 아웃포커싱에 의해 이미지에서 뿌옇게 표현되는 피사계 심도(Depth of field, DoF) 영역을 효율적인 합성곱 신경망을 통해 찾는 방법을 제안한다. 우리의 접근방식은 RGB채널기반의 상호-상관 필터를 이용하여 DoF영역을 이미지로부터 효율적으로 분류하고, 합성곱 신경망 네트워크에 학습하기 위한 데이터를 구축하며, 이렇게 얻어진 데이터를 이용하여 이미지-DoF가중치 맵 데이터 쌍을 설정한다. 학습할 때 사용되는 데이터는 이미지와 상호-상관필터 기반으로 추출된 DoF 가중치 맵을 이용하며, 네트워크 학습 단계에서 수렴률을 높이기 위해 스무딩을 과정을 한번 더 적용한 결과를 사용한다. 테스트 결과로 얻은 DoF 가중치 이미지는 입력 이미지에서 DoF영역을 안정적으로 찾아내며, 제안하는 방법은 DoF영역을 사용자의 ROI(Region of interest)로 활용하여 NPR렌더링, 객체 검출 등 다양한 곳에 활용이 가능하다.","In this paper, we propose a method to find the DoF(Depth of field) that is blurred in an image by focusing and out-focusing the camera through a efficient convolutional neural network. Our approach uses the RGB channel-based cross-correlation filter to efficiently classify the DoF region from the image and build data for learning in the convolutional neural network. A data pair of the training data is established between the image and the DoF weighted map. Data used for learning uses DoF weight maps extracted by cross-correlation filters, and uses the result of applying the smoothing process to increase the convergence rate in the network learning stage. The DoF weighted image obtained as the test result stably finds the DoF region in the input image. As a result, the proposed method can be used in various places such as NPR(Non-photorealistic rendering) rendering and object detection by using the DoF area as the user""s ROI(Region of interest)."
음향 장면 분류를 위한 경량화 모형 연구,2021,"['acoustic scene classification', 'light-weight model', 'deep learning', 'convolutional neural network', '음향 장면 분류', '경량화 모델', '딥러닝', '합성곱 신경망']","음향 장면 분류는 오디오 파일이 녹음된 환경이 어디인지 분류하는 문제이다. 이는 음향 장면 분류와 관련한 대회인 DCASE 대회에서 꾸준하게 연구되었던 분야이다. 실제 응용 분야에 음향 장면 분류 문제를 적용할 때, 모델의 복잡도를 고려하여야 한다. 특히 경량 기기에 적용하기 위해서는 경량 딥러닝 모델이 필요하다. 우리는 경량 기술이 적용된 여러 모델을 비교하였다. 먼저 log mel-spectrogram, deltas, delta-deltas 피쳐를 사용한 합성곱 신경망(CNN) 기반의 기본 모델을 제안하였다. 그리고 원래의 합성곱 층을 depthwise separable convolution block, linear bottleneck inverted residual block과 같은 효율적인 합성곱 블록으로 대체하고, 각 모델에 대하여 Quantization를 적용하여 경량 모델을 제안하였다. 경량화 기술을 고려한 모델은 기본 모델에 대비하여 성능이 비슷하거나 조금 낮은 성능을 보였지만, 모델 사이즈는 503KB에서 42.76KB로 작아진 것을 확인하였다.","Acoustic scene classification (ASC) categorizes an audio file based on the environment in which it has been recorded. This has long been studied in the detection and classification of acoustic scenes and events (DCASE). In this study, we considered the problem that ASC faces in real-world applications that the model used should have low-complexity. We compared several models that apply light-weight techniques. First, a base CNN model was proposed using log mel-spectrogram, deltas, and delta-deltas features. Second, depthwise separable convolution, linear bottleneck inverted residual block was applied to the convolutional layer, and Quantization was applied to the models to develop a low-complexity model. The model considering low-complexity was similar or slightly inferior to the performance of the base model, but the model size was significantly reduced from 503 KB to 42.76 KB."
전이 학습을 이용한 선박 기관실 기기의 분류에 관한 연구,2021,"['Patrol robot', 'Ship engine room equipment', 'Convolution neural network', 'Classification', 'Transfer learning', '순찰 로봇', '선박 기관실 기기', '합성곱 신경망', '분류', '전이 학습']","선박 기관실은 기술의 발전으로 인해 자동화 시스템이 향상되었지만, 해상에서는 바람, 파도, 진동, 기기 노후화 등의 다양한 변수가 많아 자동화 시스템에서 계측되지 않는 풀림, 절단, 누유, 누수 등이 발생하므로 기관사는 주기적으로 순찰을 한다. 순찰 시에는 1명의 기관사만 순찰하는 경우도 있으며, 이는 고온고압 및 회전기기가 운전 중인 기관실에서 많은 위험요소를 가지고 있다. 기관사가 순찰 시에는 오감을 활용하며, 특히 시각에 의존한다. 본 논문에서는 로봇이 기관실을 순찰하며 기기의 특이사항을 검출하고 알려주는 기관실 순찰 로봇을 구현하기 위한 선행연구로서 선박 기관실 기기의 이미지를 합성곱 신경망을 이용하여 분류하였다. 선박 기관실의 이미지 데이터 셋을 구성한 후 사전 훈련된 합성곱 신경망 모델로 학습하였다. 학습한 모델의 분류 성능은 높은 재현율을 보였으며, 클래스 활성화 맵으로 이미지를 시각화 하였다. 데이터의 양이 제한적이어서 일반화할 수는 없지만, 각 선박의 데이터를 전이학습으로 학습시키면 적은 시간과 비용으로 각 선박의 특성에 맞는 모델을 구축할 수 있을 것으로 사료된다.","Ship engine rooms have improved automation systems owing to the advancement of technology. However, there are many variables at sea, such as wind, waves, vibration, and equipment aging, which cause loosening, cutting, and leakage, which are not measured by automated systems. There are cases in which only one engineer is available for patrolling. This entails many risk factors in the engine room, where rotating equipment is operating at high temperature and high pressure. When the engineer patrols, he uses his five senses, with particular high dependence on vision. We hereby present a preliminary study to implement an engine-room patrol robot that detects and informs the machine room while a robot patrols the engine room. Images of ship engine-room equipment were classified using a convolutional neural network (CNN). After constructing the image dataset of the ship engine room, the network was trained with a pre-trained CNN model. Classification performance of the trained model showed high reproducibility. Images were visualized with a class activation map. Although it cannot be generalized because the amount of data was limited, it is thought that if the data of each ship were learned through transfer learning, a model suitable for the characteristics of each ship could be constructed with little time and cost expenditure."
